Sheet: Sheet1
A1: Item Code | B1: Item Description | C1: Net price | D1: Tax rate | E1: Tax inc price
A2: DW-4412 | B2: Sunscreen | C2: 3.64 | D2: 0.1 | E2: =RC[-2]*(1+RC[-1]) -> 4.0040000000000004
A3: ED-4570 | B3: Wine cooler | C3: 13.45 | D3: 0.1 | E3: =RC[-2]*(1+RC[-1]) -> 14.795
A4: EO-1427 | B4: Picnic hamper | C4: 25.68 | D4: 0.1 | E4: =RC[-2]*(1+RC[-1]) -> 28.248000000000001
A5: IS-5812 | B5: Insecticide | C5: 13.79 | D5: 0.1 | E5: =RC[-2]*(1+RC[-1]) -> 15.169
A6: PR-5234 | B6: Plastic plates | C6: 4.78 | D6: 0.1 | E6: =RC[-2]*(1+RC[-1]) -> 5.2580000000000009
A7: PR-5512 | B7: Plastic cutlery | C7: 10.75 | D7: 0.1 | E7: =RC[-2]*(1+RC[-1]) -> 11.825000000000001
A8: PR-8967 | B8: Plastic glasses | C8: 6.89 | D8: 0.1 | E8: =RC[-2]*(1+RC[-1]) -> 7.5790000000000006
A9: RP-0821 | B9: Ice packs | C9: 12.68 | D9: 0.1 | E9: =RC[-2]*(1+RC[-1]) -> 13.948
A10: WT-4850 | B10: Corkscrew | C10: 1.78 | D10: 0.1 | E10: =RC[-2]*(1+RC[-1]) -> 1.9580000000000002
A11: WW-1235 | B11: Umbrella | C11: 4.25 | D11: 0.1 | E11: =RC[-2]*(1+RC[-1]) -> 4.6750000000000007