Sheet: FILTER
A1: Room Number | B1: Week Number | C1: Day | D1: Day Sort | E1: Time | F1: Time Sort | G1: In Use Indicator | H1: Room Capacity | I1: Number Of Occupants | J1: Percentage Occupied
A2: 104 | B2: 1 | C2: Monday | D2: 1 | E2: 9am-10am | F2: 1 | G2: 2 | H2: 20 | I2: 0 | J2: =RC[-1]/RC[-2] -> 0
A3: 104 | B3: 1 | C3: Monday | D3: 1 | E3: 10am-11am | F3: 2 | G3: 3 | H3: 20 | I3: 1 | J3: =RC[-1]/RC[-2] -> 0.05
A4: 104 | B4: 1 | C4: Monday | D4: 1 | E4: 11am-12pm | F4: 3 | G4: 2 | H4: 20 | I4: 0 | J4: =RC[-1]/RC[-2] -> 0
A5: 104 | B5: 1 | C5: Monday | D5: 1 | E5: 12pm-1pm | F5: 4 | G5: 2 | H5: 20 | I5: 0 | J5: =RC[-1]/RC[-2] -> 0
A6: 104 | B6: 1 | C6: Monday | D6: 1 | E6: 1pm-2pm | F6: 5 | G6: 1 | H6: 20 | I6: 10 | J6: =RC[-1]/RC[-2] -> 0.5
A7: 104 | B7: 1 | C7: Monday | D7: 1 | E7: 2pm-3pm | F7: 6 | G7: 1 | H7: 20 | I7: 17 | J7: =RC[-1]/RC[-2] -> 0.85
A8: 104 | B8: 1 | C8: Monday | D8: 1 | E8: 3pm-4pm | F8: 7 | G8: 1 | H8: 20 | I8: 6 | J8: =RC[-1]/RC[-2] -> 0.3
A9: 104 | B9: 1 | C9: Monday | D9: 1 | E9: 4pm-5pm | F9: 8 | G9: 1 | H9: 20 | I9: 1 | J9: =RC[-1]/RC[-2] -> 0.05
A10: 104 | B10: 1 | C10: Tuesday | D10: 2 | E10: 9am-10am | F10: 1 | G10: 2 | H10: 20 | I10: 0 | J10: =RC[-1]/RC[-2] -> 0
A11: 104 | B11: 1 | C11: Tuesday | D11: 2 | E11: 10am-11am | F11: 2 | G11: 1 | H11: 20 | I11: 19 | J11: =RC[-1]/RC[-2] -> 0.95
A12: 104 | B12: 1 | C12: Tuesday | D12: 2 | E12: 11am-12pm | F12: 3 | G12: 1 | H12: 20 | I12: 16 | J12: =RC[-1]/RC[-2] -> 0.8
A13: 104 | B13: 1 | C13: Tuesday | D13: 2 | E13: 12pm-1pm | F13: 4 | G13: 3 | H13: 20 | I13: 1 | J13: =RC[-1]/RC[-2] -> 0.05
A14: 104 | B14: 1 | C14: Tuesday | D14: 2 | E14: 1pm-2pm | F14: 5 | G14: 2 | H14: 20 | I14: 0 | J14: =RC[-1]/RC[-2] -> 0
A15: 104 | B15: 1 | C15: Tuesday | D15: 2 | E15: 2pm-3pm | F15: 6 | G15: 1 | H15: 20 | I15: 19 | J15: =RC[-1]/RC[-2] -> 0.95
A16: 104 | B16: 1 | C16: Tuesday | D16: 2 | E16: 3pm-4pm | F16: 7 | G16: 1 | H16: 20 | I16: 19 | J16: =RC[-1]/RC[-2] -> 0.95
A17: 104 | B17: 1 | C17: Tuesday | D17: 2 | E17: 4pm-5pm | F17: 8 | G17: 2 | H17: 20 | I17: 0 | J17: =RC[-1]/RC[-2] -> 0
A18: 104 | B18: 1 | C18: Wednesday | D18: 3 | E18: 9am-10am | F18: 1 | G18: 2 | H18: 20 | I18: 0 | J18: =RC[-1]/RC[-2] -> 0
A19: 104 | B19: 1 | C19: Wednesday | D19: 3 | E19: 10am-11am | F19: 2 | G19: 2 | H19: 20 | I19: 0 | J19: =RC[-1]/RC[-2] -> 0
A20: 104 | B20: 1 | C20: Wednesday | D20: 3 | E20: 11am-12pm | F20: 3 | G20: 2 | H20: 20 | I20: 0 | J20: =RC[-1]/RC[-2] -> 0
A21: 104 | B21: 1 | C21: Wednesday | D21: 3 | E21: 12pm-1pm | F21: 4 | G21: 2 | H21: 20 | I21: 0 | J21: =RC[-1]/RC[-2] -> 0
A22: 104 | B22: 1 | C22: Wednesday | D22: 3 | E22: 1pm-2pm | F22: 5 | G22: 2 | H22: 20 | I22: 0 | J22: =RC[-1]/RC[-2] -> 0
A23: 104 | B23: 1 | C23: Wednesday | D23: 3 | E23: 2pm-3pm | F23: 6 | G23: 2 | H23: 20 | I23: 0 | J23: =RC[-1]/RC[-2] -> 0
A24: 104 | B24: 1 | C24: Wednesday | D24: 3 | E24: 3pm-4pm | F24: 7 | G24: 1 | H24: 20 | I24: 20 | J24: =RC[-1]/RC[-2] -> 1
A25: 104 | B25: 1 | C25: Wednesday | D25: 3 | E25: 4pm-5pm | F25: 8 | G25: 1 | H25: 20 | I25: 19 | J25: =RC[-1]/RC[-2] -> 0.95
A26: 104 | B26: 1 | C26: Thursday | D26: 4 | E26: 9am-10am | F26: 1 | G26: 2 | H26: 20 | I26: 0 | J26: =RC[-1]/RC[-2] -> 0
A27: 104 | B27: 1 | C27: Thursday | D27: 4 | E27: 10am-11am | F27: 2 | G27: 3 | H27: 20 | I27: 2 | J27: =RC[-1]/RC[-2] -> 0.1
A28: 104 | B28: 1 | C28: Thursday | D28: 4 | E28: 11am-12pm | F28: 3 | G28: 1 | H28: 20 | I28: 20 | J28: =RC[-1]/RC[-2] -> 1
A29: 104 | B29: 1 | C29: Thursday | D29: 4 | E29: 12pm-1pm | F29: 4 | G29: 1 | H29: 20 | I29: 3 | J29: =RC[-1]/RC[-2] -> 0.15
A30: 104 | B30: 1 | C30: Thursday | D30: 4 | E30: 1pm-2pm | F30: 5 | G30: 2 | H30: 20 | I30: 0 | J30: =RC[-1]/RC[-2] -> 0
A31: 104 | B31: 1 | C31: Thursday | D31: 4 | E31: 2pm-3pm | F31: 6 | G31: 1 | H31: 20 | I31: 20 | J31: =RC[-1]/RC[-2] -> 1
A32: 104 | B32: 1 | C32: Thursday | D32: 4 | E32: 3pm-4pm | F32: 7 | G32: 2 | H32: 20 | I32: 0 | J32: =RC[-1]/RC[-2] -> 0
A33: 104 | B33: 1 | C33: Thursday | D33: 4 | E33: 4pm-5pm | F33: 8 | G33: 2 | H33: 20 | I33: 0 | J33: =RC[-1]/RC[-2] -> 0
A34: 104 | B34: 1 | C34: Friday | D34: 5 | E34: 9am-10am | F34: 1 | G34: 2 | H34: 20 | I34: 0 | J34: =RC[-1]/RC[-2] -> 0
A35: 104 | B35: 1 | C35: Friday | D35: 5 | E35: 10am-11am | F35: 2 | G35: 2 | H35: 20 | I35: 0 | J35: =RC[-1]/RC[-2] -> 0
A36: 104 | B36: 1 | C36: Friday | D36: 5 | E36: 11am-12pm | F36: 3 | G36: 2 | H36: 20 | I36: 0 | J36: =RC[-1]/RC[-2] -> 0
A37: 104 | B37: 1 | C37: Friday | D37: 5 | E37: 12pm-1pm | F37: 4 | G37: 2 | H37: 20 | I37: 0 | J37: =RC[-1]/RC[-2] -> 0
A38: 104 | B38: 1 | C38: Friday | D38: 5 | E38: 1pm-2pm | F38: 5 | G38: 2 | H38: 20 | I38: 0 | J38: =RC[-1]/RC[-2] -> 0
A39: 104 | B39: 1 | C39: Friday | D39: 5 | E39: 2pm-3pm | F39: 6 | G39: 1 | H39: 20 | I39: 18 | J39: =RC[-1]/RC[-2] -> 0.9
A40: 104 | B40: 1 | C40: Friday | D40: 5 | E40: 3pm-4pm | F40: 7 | G40: 2 | H40: 20 | I40: 0 | J40: =RC[-1]/RC[-2] -> 0
A41: 104 | B41: 1 | C41: Friday | D41: 5 | E41: 4pm-5pm | F41: 8 | G41: 4 | H41: 20 | I41: 1 | J41: =RC[-1]/RC[-2] -> 0.05
A42: 111 | B42: 1 | C42: Monday | D42: 1 | E42: 9am-10am | F42: 1 | G42: 2 | H42: 20 | I42: 0 | J42: =RC[-1]/RC[-2] -> 0
A43: 111 | B43: 1 | C43: Monday | D43: 1 | E43: 10am-11am | F43: 2 | G43: 2 | H43: 20 | I43: 0 | J43: =RC[-1]/RC[-2] -> 0
A44: 111 | B44: 1 | C44: Monday | D44: 1 | E44: 11am-12pm | F44: 3 | G44: 2 | H44: 20 | I44: 0 | J44: =RC[-1]/RC[-2] -> 0
A45: 111 | B45: 1 | C45: Monday | D45: 1 | E45: 12pm-1pm | F45: 4 | G45: 2 | H45: 20 | I45: 0 | J45: =RC[-1]/RC[-2] -> 0
A46: 111 | B46: 1 | C46: Monday | D46: 1 | E46: 1pm-2pm | F46: 5 | G46: 2 | H46: 20 | I46: 0 | J46: =RC[-1]/RC[-2] -> 0
A47: 111 | B47: 1 | C47: Monday | D47: 1 | E47: 2pm-3pm | F47: 6 | G47: 2 | H47: 20 | I47: 0 | J47: =RC[-1]/RC[-2] -> 0
A48: 111 | B48: 1 | C48: Monday | D48: 1 | E48: 3pm-4pm | F48: 7 | G48: 2 | H48: 20 | I48: 0 | J48: =RC[-1]/RC[-2] -> 0
A49: 111 | B49: 1 | C49: Monday | D49: 1 | E49: 4pm-5pm | F49: 8 | G49: 2 | H49: 20 | I49: 0 | J49: =RC[-1]/RC[-2] -> 0
A50: 111 | B50: 1 | C50: Tuesday | D50: 2 | E50: 9am-10am | F50: 1 | G50: 2 | H50: 20 | I50: 0 | J50: =RC[-1]/RC[-2] -> 0
A51: 111 | B51: 1 | C51: Tuesday | D51: 2 | E51: 10am-11am | F51: 2 | G51: 1 | H51: 20 | I51: 17 | J51: =RC[-1]/RC[-2] -> 0.85
A52: 111 | B52: 1 | C52: Tuesday | D52: 2 | E52: 11am-12pm | F52: 3 | G52: 1 | H52: 20 | I52: 17 | J52: =RC[-1]/RC[-2] -> 0.85
A53: 111 | B53: 1 | C53: Tuesday | D53: 2 | E53: 12pm-1pm | F53: 4 | G53: 3 | H53: 20 | I53: 1 | J53: =RC[-1]/RC[-2] -> 0.05
A54: 111 | B54: 1 | C54: Tuesday | D54: 2 | E54: 1pm-2pm | F54: 5 | G54: 3 | H54: 20 | I54: 1 | J54: =RC[-1]/RC[-2] -> 0.05
A55: 111 | B55: 1 | C55: Tuesday | D55: 2 | E55: 2pm-3pm | F55: 6 | G55: 1 | H55: 20 | I55: 14 | J55: =RC[-1]/RC[-2] -> 0.7
A56: 111 | B56: 1 | C56: Tuesday | D56: 2 | E56: 3pm-4pm | F56: 7 | G56: 1 | H56: 20 | I56: 20 | J56: =RC[-1]/RC[-2] -> 1
A57: 111 | B57: 1 | C57: Tuesday | D57: 2 | E57: 4pm-5pm | F57: 8 | G57: 3 | H57: 20 | I57: 2 | J57: =RC[-1]/RC[-2] -> 0.1
A58: 111 | B58: 1 | C58: Wednesday | D58: 3 | E58: 9am-10am | F58: 1 | G58: 1 | H58: 20 | I58: 18 | J58: =RC[-1]/RC[-2] -> 0.9
A59: 111 | B59: 1 | C59: Wednesday | D59: 3 | E59: 10am-11am | F59: 2 | G59: 1 | H59: 20 | I59: 16 | J59: =RC[-1]/RC[-2] -> 0.8
A60: 111 | B60: 1 | C60: Wednesday | D60: 3 | E60: 11am-12pm | F60: 3 | G60: 3 | H60: 20 | I60: 1 | J60: =RC[-1]/RC[-2] -> 0.05
A61: 111 | B61: 1 | C61: Wednesday | D61: 3 | E61: 12pm-1pm | F61: 4 | G61: 2 | H61: 20 | I61: 0 | J61: =RC[-1]/RC[-2] -> 0
A62: 111 | B62: 1 | C62: Wednesday | D62: 3 | E62: 1pm-2pm | F62: 5 | G62: 2 | H62: 20 | I62: 0 | J62: =RC[-1]/RC[-2] -> 0
A63: 111 | B63: 1 | C63: Wednesday | D63: 3 | E63: 2pm-3pm | F63: 6 | G63: 2 | H63: 20 | I63: 0 | J63: =RC[-1]/RC[-2] -> 0
A64: 111 | B64: 1 | C64: Wednesday | D64: 3 | E64: 3pm-4pm | F64: 7 | G64: 2 | H64: 20 | I64: 0 | J64: =RC[-1]/RC[-2] -> 0
A65: 111 | B65: 1 | C65: Wednesday | D65: 3 | E65: 4pm-5pm | F65: 8 | G65: 2 | H65: 20 | I65: 0 | J65: =RC[-1]/RC[-2] -> 0
A66: 111 | B66: 1 | C66: Thursday | D66: 4 | E66: 9am-10am | F66: 1 | G66: 1 | H66: 20 | I66: 13 | J66: =RC[-1]/RC[-2] -> 0.65
A67: 111 | B67: 1 | C67: Thursday | D67: 4 | E67: 10am-11am | F67: 2 | G67: 1 | H67: 20 | I67: 15 | J67: =RC[-1]/RC[-2] -> 0.75
A68: 111 | B68: 1 | C68: Thursday | D68: 4 | E68: 11am-12pm | F68: 3 | G68: 2 | H68: 20 | I68: 0 | J68: =RC[-1]/RC[-2] -> 0
A69: 111 | B69: 1 | C69: Thursday | D69: 4 | E69: 12pm-1pm | F69: 4 | G69: 2 | H69: 20 | I69: 0 | J69: =RC[-1]/RC[-2] -> 0
A70: 111 | B70: 1 | C70: Thursday | D70: 4 | E70: 1pm-2pm | F70: 5 | G70: 2 | H70: 20 | I70: 0 | J70: =RC[-1]/RC[-2] -> 0
A71: 111 | B71: 1 | C71: Thursday | D71: 4 | E71: 2pm-3pm | F71: 6 | G71: 1 | H71: 20 | I71: 14 | J71: =RC[-1]/RC[-2] -> 0.7
A72: 111 | B72: 1 | C72: Thursday | D72: 4 | E72: 3pm-4pm | F72: 7 | G72: 1 | H72: 20 | I72: 15 | J72: =RC[-1]/RC[-2] -> 0.75
A73: 111 | B73: 1 | C73: Thursday | D73: 4 | E73: 4pm-5pm | F73: 8 | G73: 3 | H73: 20 | I73: 2 | J73: =RC[-1]/RC[-2] -> 0.1
A74: 111 | B74: 1 | C74: Friday | D74: 5 | E74: 9am-10am | F74: 1 | G74: 2 | H74: 20 | I74: 0 | J74: =RC[-1]/RC[-2] -> 0
A75: 111 | B75: 1 | C75: Friday | D75: 5 | E75: 10am-11am | F75: 2 | G75: 2 | H75: 20 | I75: 0 | J75: =RC[-1]/RC[-2] -> 0
A76: 111 | B76: 1 | C76: Friday | D76: 5 | E76: 11am-12pm | F76: 3 | G76: 2 | H76: 20 | I76: 0 | J76: =RC[-1]/RC[-2] -> 0
A77: 111 | B77: 1 | C77: Friday | D77: 5 | E77: 12pm-1pm | F77: 4 | G77: 2 | H77: 20 | I77: 0 | J77: =RC[-1]/RC[-2] -> 0
A78: 111 | B78: 1 | C78: Friday | D78: 5 | E78: 1pm-2pm | F78: 5 | G78: 2 | H78: 20 | I78: 0 | J78: =RC[-1]/RC[-2] -> 0
A79: 111 | B79: 1 | C79: Friday | D79: 5 | E79: 2pm-3pm | F79: 6 | G79: 2 | H79: 20 | I79: 0 | J79: =RC[-1]/RC[-2] -> 0
A80: 111 | B80: 1 | C80: Friday | D80: 5 | E80: 3pm-4pm | F80: 7 | G80: 2 | H80: 20 | I80: 0 | J80: =RC[-1]/RC[-2] -> 0
A81: 111 | B81: 1 | C81: Friday | D81: 5 | E81: 4pm-5pm | F81: 8 | G81: 2 | H81: 20 | I81: 0 | J81: =RC[-1]/RC[-2] -> 0
A82: 113 | B82: 1 | C82: Monday | D82: 1 | E82: 9am-10am | F82: 1 | G82: 2 | H82: 20 | I82: 0 | J82: =RC[-1]/RC[-2] -> 0
A83: 113 | B83: 1 | C83: Monday | D83: 1 | E83: 10am-11am | F83: 2 | G83: 3 | H83: 20 | I83: 1 | J83: =RC[-1]/RC[-2] -> 0.05
A84: 113 | B84: 1 | C84: Monday | D84: 1 | E84: 11am-12pm | F84: 3 | G84: 2 | H84: 20 | I84: 0 | J84: =RC[-1]/RC[-2] -> 0
A85: 113 | B85: 1 | C85: Monday | D85: 1 | E85: 12pm-1pm | F85: 4 | G85: 1 | H85: 20 | I85: 5 | J85: =RC[-1]/RC[-2] -> 0.25
A86: 113 | B86: 1 | C86: Monday | D86: 1 | E86: 1pm-2pm | F86: 5 | G86: 1 | H86: 20 | I86: 7 | J86: =RC[-1]/RC[-2] -> 0.35
A87: 113 | B87: 1 | C87: Monday | D87: 1 | E87: 2pm-3pm | F87: 6 | G87: 1 | H87: 20 | I87: 6 | J87: =RC[-1]/RC[-2] -> 0.3
A88: 113 | B88: 1 | C88: Monday | D88: 1 | E88: 3pm-4pm | F88: 7 | G88: 2 | H88: 20 | I88: 0 | J88: =RC[-1]/RC[-2] -> 0
A89: 113 | B89: 1 | C89: Monday | D89: 1 | E89: 4pm-5pm | F89: 8 | G89: 2 | H89: 20 | I89: 0 | J89: =RC[-1]/RC[-2] -> 0
A90: 113 | B90: 1 | C90: Tuesday | D90: 2 | E90: 9am-10am | F90: 1 | G90: 2 | H90: 20 | I90: 0 | J90: =RC[-1]/RC[-2] -> 0
A91: 113 | B91: 1 | C91: Tuesday | D91: 2 | E91: 10am-11am | F91: 2 | G91: 2 | H91: 20 | I91: 0 | J91: =RC[-1]/RC[-2] -> 0
A92: 113 | B92: 1 | C92: Tuesday | D92: 2 | E92: 11am-12pm | F92: 3 | G92: 2 | H92: 20 | I92: 0 | J92: =RC[-1]/RC[-2] -> 0
A93: 113 | B93: 1 | C93: Tuesday | D93: 2 | E93: 12pm-1pm | F93: 4 | G93: 2 | H93: 20 | I93: 0 | J93: =RC[-1]/RC[-2] -> 0
A94: 113 | B94: 1 | C94: Tuesday | D94: 2 | E94: 1pm-2pm | F94: 5 | G94: 2 | H94: 20 | I94: 0 | J94: =RC[-1]/RC[-2] -> 0
A95: 113 | B95: 1 | C95: Tuesday | D95: 2 | E95: 2pm-3pm | F95: 6 | G95: 1 | H95: 20 | I95: 21 | J95: =RC[-1]/RC[-2] -> 1.05
A96: 113 | B96: 1 | C96: Tuesday | D96: 2 | E96: 3pm-4pm | F96: 7 | G96: 1 | H96: 20 | I96: 20 | J96: =RC[-1]/RC[-2] -> 1
A97: 113 | B97: 1 | C97: Tuesday | D97: 2 | E97: 4pm-5pm | F97: 8 | G97: 2 | H97: 20 | I97: 0 | J97: =RC[-1]/RC[-2] -> 0
A98: 113 | B98: 1 | C98: Wednesday | D98: 3 | E98: 9am-10am | F98: 1 | G98: 1 | H98: 20 | I98: 7 | J98: =RC[-1]/RC[-2] -> 0.35
A99: 113 | B99: 1 | C99: Wednesday | D99: 3 | E99: 10am-11am | F99: 2 | G99: 1 | H99: 20 | I99: 7 | J99: =RC[-1]/RC[-2] -> 0.35
A100: 113 | B100: 1 | C100: Wednesday | D100: 3 | E100: 11am-12pm | F100: 3 | G100: 3 | H100: 20 | I100: 1 | J100: =RC[-1]/RC[-2] -> 0.05
A101: 113 | B101: 1 | C101: Wednesday | D101: 3 | E101: 12pm-1pm | F101: 4 | G101: 2 | H101: 20 | I101: 0 | J101: =RC[-1]/RC[-2] -> 0
A102: 113 | B102: 1 | C102: Wednesday | D102: 3 | E102: 1pm-2pm | F102: 5 | G102: 2 | H102: 20 | I102: 0 | J102: =RC[-1]/RC[-2] -> 0
A103: 113 | B103: 1 | C103: Wednesday | D103: 3 | E103: 2pm-3pm | F103: 6 | G103: 2 | H103: 20 | I103: 0 | J103: =RC[-1]/RC[-2] -> 0
A104: 113 | B104: 1 | C104: Wednesday | D104: 3 | E104: 3pm-4pm | F104: 7 | G104: 2 | H104: 20 | I104: 0 | J104: =RC[-1]/RC[-2] -> 0
A105: 113 | B105: 1 | C105: Wednesday | D105: 3 | E105: 4pm-5pm | F105: 8 | G105: 2 | H105: 20 | I105: 0 | J105: =RC[-1]/RC[-2] -> 0
A106: 113 | B106: 1 | C106: Thursday | D106: 4 | E106: 9am-10am | F106: 1 | G106: 1 | H106: 20 | I106: 14 | J106: =RC[-1]/RC[-2] -> 0.7
A107: 113 | B107: 1 | C107: Thursday | D107: 4 | E107: 10am-11am | F107: 2 | G107: 2 | H107: 20 | I107: 0 | J107: =RC[-1]/RC[-2] -> 0
A108: 113 | B108: 1 | C108: Thursday | D108: 4 | E108: 11am-12pm | F108: 3 | G108: 1 | H108: 20 | I108: 20 | J108: =RC[-1]/RC[-2] -> 1
A109: 113 | B109: 1 | C109: Thursday | D109: 4 | E109: 12pm-1pm | F109: 4 | G109: 1 | H109: 20 | I109: 20 | J109: =RC[-1]/RC[-2] -> 1
A110: 113 | B110: 1 | C110: Thursday | D110: 4 | E110: 1pm-2pm | F110: 5 | G110: 2 | H110: 20 | I110: 0 | J110: =RC[-1]/RC[-2] -> 0
A111: 113 | B111: 1 | C111: Thursday | D111: 4 | E111: 2pm-3pm | F111: 6 | G111: 1 | H111: 20 | I111: 9 | J111: =RC[-1]/RC[-2] -> 0.45
A112: 113 | B112: 1 | C112: Thursday | D112: 4 | E112: 3pm-4pm | F112: 7 | G112: 2 | H112: 20 | I112: 0 | J112: =RC[-1]/RC[-2] -> 0
A113: 113 | B113: 1 | C113: Thursday | D113: 4 | E113: 4pm-5pm | F113: 8 | G113: 2 | H113: 20 | I113: 0 | J113: =RC[-1]/RC[-2] -> 0
A114: 113 | B114: 1 | C114: Friday | D114: 5 | E114: 9am-10am | F114: 1 | G114: 2 | H114: 20 | I114: 0 | J114: =RC[-1]/RC[-2] -> 0
A115: 113 | B115: 1 | C115: Friday | D115: 5 | E115: 10am-11am | F115: 2 | G115: 1 | H115: 20 | I115: 19 | J115: =RC[-1]/RC[-2] -> 0.95
A116: 113 | B116: 1 | C116: Friday | D116: 5 | E116: 11am-12pm | F116: 3 | G116: 1 | H116: 20 | I116: 19 | J116: =RC[-1]/RC[-2] -> 0.95
A117: 113 | B117: 1 | C117: Friday | D117: 5 | E117: 12pm-1pm | F117: 4 | G117: 1 | H117: 20 | I117: 13 | J117: =RC[-1]/RC[-2] -> 0.65
A118: 113 | B118: 1 | C118: Friday | D118: 5 | E118: 1pm-2pm | F118: 5 | G118: 1 | H118: 20 | I118: 15 | J118: =RC[-1]/RC[-2] -> 0.75
A119: 113 | B119: 1 | C119: Friday | D119: 5 | E119: 2pm-3pm | F119: 6 | G119: 3 | H119: 20 | I119: 1 | J119: =RC[-1]/RC[-2] -> 0.05
A120: 113 | B120: 1 | C120: Friday | D120: 5 | E120: 3pm-4pm | F120: 7 | G120: 1 | H120: 20 | I120: 7 | J120: =RC[-1]/RC[-2] -> 0.35
A121: 113 | B121: 1 | C121: Friday | D121: 5 | E121: 4pm-5pm | F121: 8 | G121: 2 | H121: 20 | I121: 0 | J121: =RC[-1]/RC[-2] -> 0
A122: 117 | B122: 1 | C122: Monday | D122: 1 | E122: 9am-10am | F122: 1 | G122: 2 | H122: 20 | I122: 0 | J122: =RC[-1]/RC[-2] -> 0
A123: 117 | B123: 1 | C123: Monday | D123: 1 | E123: 10am-11am | F123: 2 | G123: 3 | H123: 20 | I123: 1 | J123: =RC[-1]/RC[-2] -> 0.05
A124: 117 | B124: 1 | C124: Monday | D124: 1 | E124: 11am-12pm | F124: 3 | G124: 2 | H124: 20 | I124: 0 | J124: =RC[-1]/RC[-2] -> 0
A125: 117 | B125: 1 | C125: Monday | D125: 1 | E125: 12pm-1pm | F125: 4 | G125: 2 | H125: 20 | I125: 0 | J125: =RC[-1]/RC[-2] -> 0
A126: 117 | B126: 1 | C126: Monday | D126: 1 | E126: 1pm-2pm | F126: 5 | G126: 1 | H126: 20 | I126: 18 | J126: =RC[-1]/RC[-2] -> 0.9
A127: 117 | B127: 1 | C127: Monday | D127: 1 | E127: 2pm-3pm | F127: 6 | G127: 1 | H127: 20 | I127: 17 | J127: =RC[-1]/RC[-2] -> 0.85
A128: 117 | B128: 1 | C128: Monday | D128: 1 | E128: 3pm-4pm | F128: 7 | G128: 1 | H128: 20 | I128: 15 | J128: =RC[-1]/RC[-2] -> 0.75
A129: 117 | B129: 1 | C129: Monday | D129: 1 | E129: 4pm-5pm | F129: 8 | G129: 1 | H129: 20 | I129: 8 | J129: =RC[-1]/RC[-2] -> 0.4
A130: 117 | B130: 1 | C130: Tuesday | D130: 2 | E130: 9am-10am | F130: 1 | G130: 3 | H130: 20 | I130: 2 | J130: =RC[-1]/RC[-2] -> 0.1
A131: 117 | B131: 1 | C131: Tuesday | D131: 2 | E131: 10am-11am | F131: 2 | G131: 1 | H131: 20 | I131: 18 | J131: =RC[-1]/RC[-2] -> 0.9
A132: 117 | B132: 1 | C132: Tuesday | D132: 2 | E132: 11am-12pm | F132: 3 | G132: 1 | H132: 20 | I132: 16 | J132: =RC[-1]/RC[-2] -> 0.8
A133: 117 | B133: 1 | C133: Tuesday | D133: 2 | E133: 12pm-1pm | F133: 4 | G133: 1 | H133: 20 | I133: 17 | J133: =RC[-1]/RC[-2] -> 0.85
A134: 117 | B134: 1 | C134: Tuesday | D134: 2 | E134: 1pm-2pm | F134: 5 | G134: 2 | H134: 20 | I134: 0 | J134: =RC[-1]/RC[-2] -> 0
A135: 117 | B135: 1 | C135: Tuesday | D135: 2 | E135: 2pm-3pm | F135: 6 | G135: 1 | H135: 20 | I135: 14 | J135: =RC[-1]/RC[-2] -> 0.7
A136: 117 | B136: 1 | C136: Tuesday | D136: 2 | E136: 3pm-4pm | F136: 7 | G136: 1 | H136: 20 | I136: 14 | J136: =RC[-1]/RC[-2] -> 0.7
A137: 117 | B137: 1 | C137: Tuesday | D137: 2 | E137: 4pm-5pm | F137: 8 | G137: 1 | H137: 20 | I137: 11 | J137: =RC[-1]/RC[-2] -> 0.55
A138: 117 | B138: 1 | C138: Wednesday | D138: 3 | E138: 9am-10am | F138: 1 | G138: 1 | H138: 20 | I138: 20 | J138: =RC[-1]/RC[-2] -> 1
A139: 117 | B139: 1 | C139: Wednesday | D139: 3 | E139: 10am-11am | F139: 2 | G139: 1 | H139: 20 | I139: 13 | J139: =RC[-1]/RC[-2] -> 0.65
A140: 117 | B140: 1 | C140: Wednesday | D140: 3 | E140: 11am-12pm | F140: 3 | G140: 1 | H140: 20 | I140: 12 | J140: =RC[-1]/RC[-2] -> 0.6
A141: 117 | B141: 1 | C141: Wednesday | D141: 3 | E141: 12pm-1pm | F141: 4 | G141: 2 | H141: 20 | I141: 0 | J141: =RC[-1]/RC[-2] -> 0
A142: 117 | B142: 1 | C142: Wednesday | D142: 3 | E142: 1pm-2pm | F142: 5 | G142: 1 | H142: 20 | I142: 3 | J142: =RC[-1]/RC[-2] -> 0.15
A143: 117 | B143: 1 | C143: Wednesday | D143: 3 | E143: 2pm-3pm | F143: 6 | G143: 1 | H143: 20 | I143: 18 | J143: =RC[-1]/RC[-2] -> 0.9
A144: 117 | B144: 1 | C144: Wednesday | D144: 3 | E144: 3pm-4pm | F144: 7 | G144: 1 | H144: 20 | I144: 13 | J144: =RC[-1]/RC[-2] -> 0.65
A145: 117 | B145: 1 | C145: Wednesday | D145: 3 | E145: 4pm-5pm | F145: 8 | G145: 1 | H145: 20 | I145: 9 | J145: =RC[-1]/RC[-2] -> 0.45
A146: 117 | B146: 1 | C146: Thursday | D146: 4 | E146: 9am-10am | F146: 1 | G146: 3 | H146: 20 | I146: 1 | J146: =RC[-1]/RC[-2] -> 0.05
A147: 117 | B147: 1 | C147: Thursday | D147: 4 | E147: 10am-11am | F147: 2 | G147: 1 | H147: 20 | I147: 15 | J147: =RC[-1]/RC[-2] -> 0.75
A148: 117 | B148: 1 | C148: Thursday | D148: 4 | E148: 11am-12pm | F148: 3 | G148: 1 | H148: 20 | I148: 16 | J148: =RC[-1]/RC[-2] -> 0.8
A149: 117 | B149: 1 | C149: Thursday | D149: 4 | E149: 12pm-1pm | F149: 4 | G149: 1 | H149: 20 | I149: 13 | J149: =RC[-1]/RC[-2] -> 0.65
A150: 117 | B150: 1 | C150: Thursday | D150: 4 | E150: 1pm-2pm | F150: 5 | G150: 2 | H150: 20 | I150: 0 | J150: =RC[-1]/RC[-2] -> 0
A151: 117 | B151: 1 | C151: Thursday | D151: 4 | E151: 2pm-3pm | F151: 6 | G151: 1 | H151: 20 | I151: 20 | J151: =RC[-1]/RC[-2] -> 1
A152: 117 | B152: 1 | C152: Thursday | D152: 4 | E152: 3pm-4pm | F152: 7 | G152: 1 | H152: 20 | I152: 17 | J152: =RC[-1]/RC[-2] -> 0.85
A153: 117 | B153: 1 | C153: Thursday | D153: 4 | E153: 4pm-5pm | F153: 8 | G153: 1 | H153: 20 | I153: 7 | J153: =RC[-1]/RC[-2] -> 0.35
A154: 117 | B154: 1 | C154: Friday | D154: 5 | E154: 9am-10am | F154: 1 | G154: 2 | H154: 20 | I154: 0 | J154: =RC[-1]/RC[-2] -> 0
A155: 117 | B155: 1 | C155: Friday | D155: 5 | E155: 10am-11am | F155: 2 | G155: 2 | H155: 20 | I155: 0 | J155: =RC[-1]/RC[-2] -> 0
A156: 117 | B156: 1 | C156: Friday | D156: 5 | E156: 11am-12pm | F156: 3 | G156: 2 | H156: 20 | I156: 0 | J156: =RC[-1]/RC[-2] -> 0
A157: 117 | B157: 1 | C157: Friday | D157: 5 | E157: 12pm-1pm | F157: 4 | G157: 2 | H157: 20 | I157: 0 | J157: =RC[-1]/RC[-2] -> 0
A158: 117 | B158: 1 | C158: Friday | D158: 5 | E158: 1pm-2pm | F158: 5 | G158: 2 | H158: 20 | I158: 0 | J158: =RC[-1]/RC[-2] -> 0
A159: 117 | B159: 1 | C159: Friday | D159: 5 | E159: 2pm-3pm | F159: 6 | G159: 1 | H159: 20 | I159: 18 | J159: =RC[-1]/RC[-2] -> 0.9
A160: 117 | B160: 1 | C160: Friday | D160: 5 | E160: 3pm-4pm | F160: 7 | G160: 1 | H160: 20 | I160: 18 | J160: =RC[-1]/RC[-2] -> 0.9
A161: 117 | B161: 1 | C161: Friday | D161: 5 | E161: 4pm-5pm | F161: 8 | G161: 1 | H161: 20 | I161: 18 | J161: =RC[-1]/RC[-2] -> 0.9
A162: 118 | B162: 1 | C162: Monday | D162: 1 | E162: 9am-10am | F162: 1 | G162: 3 | H162: 6 | I162: 2 | J162: =RC[-1]/RC[-2] -> 0.33333333333333331
A163: 118 | B163: 1 | C163: Monday | D163: 1 | E163: 10am-11am | F163: 2 | G163: 3 | H163: 6 | I163: 2 | J163: =RC[-1]/RC[-2] -> 0.33333333333333331
A164: 118 | B164: 1 | C164: Monday | D164: 1 | E164: 11am-12pm | F164: 3 | G164: 1 | H164: 6 | I164: 1 | J164: =RC[-1]/RC[-2] -> 0.16666666666666666
A165: 118 | B165: 1 | C165: Monday | D165: 1 | E165: 12pm-1pm | F165: 4 | G165: 1 | H165: 6 | I165: 5 | J165: =RC[-1]/RC[-2] -> 0.83333333333333337
A166: 118 | B166: 1 | C166: Monday | D166: 1 | E166: 1pm-2pm | F166: 5 | G166: 1 | H166: 6 | I166: 3 | J166: =RC[-1]/RC[-2] -> 0.5
A167: 118 | B167: 1 | C167: Monday | D167: 1 | E167: 2pm-3pm | F167: 6 | G167: 1 | H167: 6 | I167: 3 | J167: =RC[-1]/RC[-2] -> 0.5
A168: 118 | B168: 1 | C168: Monday | D168: 1 | E168: 3pm-4pm | F168: 7 | G168: 1 | H168: 6 | I168: 4 | J168: =RC[-1]/RC[-2] -> 0.66666666666666663
A169: 118 | B169: 1 | C169: Monday | D169: 1 | E169: 4pm-5pm | F169: 8 | G169: 1 | H169: 6 | I169: 1 | J169: =RC[-1]/RC[-2] -> 0.16666666666666666
A170: 118 | B170: 1 | C170: Tuesday | D170: 2 | E170: 9am-10am | F170: 1 | G170: 1 | H170: 6 | I170: 2 | J170: =RC[-1]/RC[-2] -> 0.33333333333333331
A171: 118 | B171: 1 | C171: Tuesday | D171: 2 | E171: 10am-11am | F171: 2 | G171: 3 | H171: 6 | I171: 2 | J171: =RC[-1]/RC[-2] -> 0.33333333333333331
A172: 118 | B172: 1 | C172: Tuesday | D172: 2 | E172: 11am-12pm | F172: 3 | G172: 1 | H172: 6 | I172: 1 | J172: =RC[-1]/RC[-2] -> 0.16666666666666666
A173: 118 | B173: 1 | C173: Tuesday | D173: 2 | E173: 12pm-1pm | F173: 4 | G173: 2 | H173: 6 | I173: 0 | J173: =RC[-1]/RC[-2] -> 0
A174: 118 | B174: 1 | C174: Tuesday | D174: 2 | E174: 1pm-2pm | F174: 5 | G174: 2 | H174: 6 | I174: 0 | J174: =RC[-1]/RC[-2] -> 0
A175: 118 | B175: 1 | C175: Tuesday | D175: 2 | E175: 2pm-3pm | F175: 6 | G175: 1 | H175: 6 | I175: 3 | J175: =RC[-1]/RC[-2] -> 0.5
A176: 118 | B176: 1 | C176: Tuesday | D176: 2 | E176: 3pm-4pm | F176: 7 | G176: 1 | H176: 6 | I176: 4 | J176: =RC[-1]/RC[-2] -> 0.66666666666666663
A177: 118 | B177: 1 | C177: Tuesday | D177: 2 | E177: 4pm-5pm | F177: 8 | G177: 1 | H177: 6 | I177: 1 | J177: =RC[-1]/RC[-2] -> 0.16666666666666666
A178: 118 | B178: 1 | C178: Wednesday | D178: 3 | E178: 9am-10am | F178: 1 | G178: 1 | H178: 6 | I178: 2 | J178: =RC[-1]/RC[-2] -> 0.33333333333333331
A179: 118 | B179: 1 | C179: Wednesday | D179: 3 | E179: 10am-11am | F179: 2 | G179: 1 | H179: 6 | I179: 4 | J179: =RC[-1]/RC[-2] -> 0.66666666666666663
A180: 118 | B180: 1 | C180: Wednesday | D180: 3 | E180: 11am-12pm | F180: 3 | G180: 1 | H180: 6 | I180: 3 | J180: =RC[-1]/RC[-2] -> 0.5
A181: 118 | B181: 1 | C181: Wednesday | D181: 3 | E181: 12pm-1pm | F181: 4 | G181: 2 | H181: 6 | I181: 0 | J181: =RC[-1]/RC[-2] -> 0
A182: 118 | B182: 1 | C182: Wednesday | D182: 3 | E182: 1pm-2pm | F182: 5 | G182: 1 | H182: 6 | I182: 1 | J182: =RC[-1]/RC[-2] -> 0.16666666666666666
A183: 118 | B183: 1 | C183: Wednesday | D183: 3 | E183: 2pm-3pm | F183: 6 | G183: 2 | H183: 6 | I183: 0 | J183: =RC[-1]/RC[-2] -> 0
A184: 118 | B184: 1 | C184: Wednesday | D184: 3 | E184: 3pm-4pm | F184: 7 | G184: 1 | H184: 6 | I184: 1 | J184: =RC[-1]/RC[-2] -> 0.16666666666666666
A185: 118 | B185: 1 | C185: Wednesday | D185: 3 | E185: 4pm-5pm | F185: 8 | G185: 1 | H185: 6 | I185: 4 | J185: =RC[-1]/RC[-2] -> 0.66666666666666663
A186: 118 | B186: 1 | C186: Thursday | D186: 4 | E186: 9am-10am | F186: 1 | G186: 2 | H186: 6 | I186: 0 | J186: =RC[-1]/RC[-2] -> 0
A187: 118 | B187: 1 | C187: Thursday | D187: 4 | E187: 10am-11am | F187: 2 | G187: 2 | H187: 6 | I187: 0 | J187: =RC[-1]/RC[-2] -> 0
A188: 118 | B188: 1 | C188: Thursday | D188: 4 | E188: 11am-12pm | F188: 3 | G188: 1 | H188: 6 | I188: 1 | J188: =RC[-1]/RC[-2] -> 0.16666666666666666
A189: 118 | B189: 1 | C189: Thursday | D189: 4 | E189: 12pm-1pm | F189: 4 | G189: 1 | H189: 6 | I189: 1 | J189: =RC[-1]/RC[-2] -> 0.16666666666666666
A190: 118 | B190: 1 | C190: Thursday | D190: 4 | E190: 1pm-2pm | F190: 5 | G190: 1 | H190: 6 | I190: 1 | J190: =RC[-1]/RC[-2] -> 0.16666666666666666
A191: 118 | B191: 1 | C191: Thursday | D191: 4 | E191: 2pm-3pm | F191: 6 | G191: 1 | H191: 6 | I191: 1 | J191: =RC[-1]/RC[-2] -> 0.16666666666666666
A192: 118 | B192: 1 | C192: Thursday | D192: 4 | E192: 3pm-4pm | F192: 7 | G192: 3 | H192: 6 | I192: 1 | J192: =RC[-1]/RC[-2] -> 0.16666666666666666
A193: 118 | B193: 1 | C193: Thursday | D193: 4 | E193: 4pm-5pm | F193: 8 | G193: 2 | H193: 6 | I193: 0 | J193: =RC[-1]/RC[-2] -> 0
A194: 118 | B194: 1 | C194: Friday | D194: 5 | E194: 9am-10am | F194: 1 | G194: 2 | H194: 6 | I194: 0 | J194: =RC[-1]/RC[-2] -> 0
A195: 118 | B195: 1 | C195: Friday | D195: 5 | E195: 10am-11am | F195: 2 | G195: 1 | H195: 6 | I195: 1 | J195: =RC[-1]/RC[-2] -> 0.16666666666666666
A196: 118 | B196: 1 | C196: Friday | D196: 5 | E196: 11am-12pm | F196: 3 | G196: 2 | H196: 6 | I196: 0 | J196: =RC[-1]/RC[-2] -> 0
A197: 118 | B197: 1 | C197: Friday | D197: 5 | E197: 12pm-1pm | F197: 4 | G197: 1 | H197: 6 | I197: 3 | J197: =RC[-1]/RC[-2] -> 0.5
A198: 118 | B198: 1 | C198: Friday | D198: 5 | E198: 1pm-2pm | F198: 5 | G198: 1 | H198: 6 | I198: 2 | J198: =RC[-1]/RC[-2] -> 0.33333333333333331
A199: 118 | B199: 1 | C199: Friday | D199: 5 | E199: 2pm-3pm | F199: 6 | G199: 2 | H199: 6 | I199: 0 | J199: =RC[-1]/RC[-2] -> 0
A200: 118 | B200: 1 | C200: Friday | D200: 5 | E200: 3pm-4pm | F200: 7 | G200: 2 | H200: 6 | I200: 0 | J200: =RC[-1]/RC[-2] -> 0
A201: 118 | B201: 1 | C201: Friday | D201: 5 | E201: 4pm-5pm | F201: 8 | G201: 1 | H201: 6 | I201: 1 | J201: =RC[-1]/RC[-2] -> 0.16666666666666666
A202: 119 | B202: 1 | C202: Monday | D202: 1 | E202: 9am-10am | F202: 1 | G202: 1 | H202: 20 | I202: 20 | J202: =RC[-1]/RC[-2] -> 1
A203: 119 | B203: 1 | C203: Monday | D203: 1 | E203: 10am-11am | F203: 2 | G203: 1 | H203: 20 | I203: 20 | J203: =RC[-1]/RC[-2] -> 1
A204: 119 | B204: 1 | C204: Monday | D204: 1 | E204: 11am-12pm | F204: 3 | G204: 1 | H204: 20 | I204: 7 | J204: =RC[-1]/RC[-2] -> 0.35
A205: 119 | B205: 1 | C205: Monday | D205: 1 | E205: 12pm-1pm | F205: 4 | G205: 2 | H205: 20 | I205: 0 | J205: =RC[-1]/RC[-2] -> 0
A206: 119 | B206: 1 | C206: Monday | D206: 1 | E206: 1pm-2pm | F206: 5 | G206: 2 | H206: 20 | I206: 0 | J206: =RC[-1]/RC[-2] -> 0
A207: 119 | B207: 1 | C207: Monday | D207: 1 | E207: 2pm-3pm | F207: 6 | G207: 2 | H207: 20 | I207: 0 | J207: =RC[-1]/RC[-2] -> 0
A208: 119 | B208: 1 | C208: Monday | D208: 1 | E208: 3pm-4pm | F208: 7 | G208: 2 | H208: 20 | I208: 0 | J208: =RC[-1]/RC[-2] -> 0
A209: 119 | B209: 1 | C209: Monday | D209: 1 | E209: 4pm-5pm | F209: 8 | G209: 1 | H209: 20 | I209: 1 | J209: =RC[-1]/RC[-2] -> 0.05
A210: 119 | B210: 1 | C210: Tuesday | D210: 2 | E210: 9am-10am | F210: 1 | G210: 2 | H210: 20 | I210: 0 | J210: =RC[-1]/RC[-2] -> 0
A211: 119 | B211: 1 | C211: Tuesday | D211: 2 | E211: 10am-11am | F211: 2 | G211: 1 | H211: 20 | I211: 1 | J211: =RC[-1]/RC[-2] -> 0.05
A212: 119 | B212: 1 | C212: Tuesday | D212: 2 | E212: 11am-12pm | F212: 3 | G212: 2 | H212: 20 | I212: 0 | J212: =RC[-1]/RC[-2] -> 0
A213: 119 | B213: 1 | C213: Tuesday | D213: 2 | E213: 12pm-1pm | F213: 4 | G213: 2 | H213: 20 | I213: 0 | J213: =RC[-1]/RC[-2] -> 0
A214: 119 | B214: 1 | C214: Tuesday | D214: 2 | E214: 1pm-2pm | F214: 5 | G214: 2 | H214: 20 | I214: 0 | J214: =RC[-1]/RC[-2] -> 0
A215: 119 | B215: 1 | C215: Tuesday | D215: 2 | E215: 2pm-3pm | F215: 6 | G215: 2 | H215: 20 | I215: 0 | J215: =RC[-1]/RC[-2] -> 0
A216: 119 | B216: 1 | C216: Tuesday | D216: 2 | E216: 3pm-4pm | F216: 7 | G216: 2 | H216: 20 | I216: 0 | J216: =RC[-1]/RC[-2] -> 0
A217: 119 | B217: 1 | C217: Tuesday | D217: 2 | E217: 4pm-5pm | F217: 8 | G217: 2 | H217: 20 | I217: 0 | J217: =RC[-1]/RC[-2] -> 0
A218: 119 | B218: 1 | C218: Wednesday | D218: 3 | E218: 9am-10am | F218: 1 | G218: 2 | H218: 20 | I218: 0 | J218: =RC[-1]/RC[-2] -> 0
A219: 119 | B219: 1 | C219: Wednesday | D219: 3 | E219: 10am-11am | F219: 2 | G219: 1 | H219: 20 | I219: 25 | J219: =RC[-1]/RC[-2] -> 1.25
A220: 119 | B220: 1 | C220: Wednesday | D220: 3 | E220: 11am-12pm | F220: 3 | G220: 2 | H220: 20 | I220: 0 | J220: =RC[-1]/RC[-2] -> 0
A221: 119 | B221: 1 | C221: Wednesday | D221: 3 | E221: 12pm-1pm | F221: 4 | G221: 2 | H221: 20 | I221: 0 | J221: =RC[-1]/RC[-2] -> 0
A222: 119 | B222: 1 | C222: Wednesday | D222: 3 | E222: 1pm-2pm | F222: 5 | G222: 2 | H222: 20 | I222: 0 | J222: =RC[-1]/RC[-2] -> 0
A223: 119 | B223: 1 | C223: Wednesday | D223: 3 | E223: 2pm-3pm | F223: 6 | G223: 2 | H223: 20 | I223: 0 | J223: =RC[-1]/RC[-2] -> 0
A224: 119 | B224: 1 | C224: Wednesday | D224: 3 | E224: 3pm-4pm | F224: 7 | G224: 2 | H224: 20 | I224: 0 | J224: =RC[-1]/RC[-2] -> 0
A225: 119 | B225: 1 | C225: Wednesday | D225: 3 | E225: 4pm-5pm | F225: 8 | G225: 2 | H225: 20 | I225: 0 | J225: =RC[-1]/RC[-2] -> 0
A226: 119 | B226: 1 | C226: Thursday | D226: 4 | E226: 9am-10am | F226: 1 | G226: 2 | H226: 20 | I226: 0 | J226: =RC[-1]/RC[-2] -> 0
A227: 119 | B227: 1 | C227: Thursday | D227: 4 | E227: 10am-11am | F227: 2 | G227: 2 | H227: 20 | I227: 0 | J227: =RC[-1]/RC[-2] -> 0
A228: 119 | B228: 1 | C228: Thursday | D228: 4 | E228: 11am-12pm | F228: 3 | G228: 2 | H228: 20 | I228: 0 | J228: =RC[-1]/RC[-2] -> 0
A229: 119 | B229: 1 | C229: Thursday | D229: 4 | E229: 12pm-1pm | F229: 4 | G229: 2 | H229: 20 | I229: 0 | J229: =RC[-1]/RC[-2] -> 0
A230: 119 | B230: 1 | C230: Thursday | D230: 4 | E230: 1pm-2pm | F230: 5 | G230: 2 | H230: 20 | I230: 0 | J230: =RC[-1]/RC[-2] -> 0
A231: 119 | B231: 1 | C231: Thursday | D231: 4 | E231: 2pm-3pm | F231: 6 | G231: 1 | H231: 20 | I231: 18 | J231: =RC[-1]/RC[-2] -> 0.9
A232: 119 | B232: 1 | C232: Thursday | D232: 4 | E232: 3pm-4pm | F232: 7 | G232: 1 | H232: 20 | I232: 8 | J232: =RC[-1]/RC[-2] -> 0.4
A233: 119 | B233: 1 | C233: Thursday | D233: 4 | E233: 4pm-5pm | F233: 8 | G233: 2 | H233: 20 | I233: 0 | J233: =RC[-1]/RC[-2] -> 0
A234: 119 | B234: 1 | C234: Friday | D234: 5 | E234: 9am-10am | F234: 1 | G234: 2 | H234: 20 | I234: 0 | J234: =RC[-1]/RC[-2] -> 0
A235: 119 | B235: 1 | C235: Friday | D235: 5 | E235: 10am-11am | F235: 2 | G235: 2 | H235: 20 | I235: 0 | J235: =RC[-1]/RC[-2] -> 0
A236: 119 | B236: 1 | C236: Friday | D236: 5 | E236: 11am-12pm | F236: 3 | G236: 2 | H236: 20 | I236: 0 | J236: =RC[-1]/RC[-2] -> 0
A237: 119 | B237: 1 | C237: Friday | D237: 5 | E237: 12pm-1pm | F237: 4 | G237: 2 | H237: 20 | I237: 0 | J237: =RC[-1]/RC[-2] -> 0
A238: 119 | B238: 1 | C238: Friday | D238: 5 | E238: 1pm-2pm | F238: 5 | G238: 2 | H238: 20 | I238: 0 | J238: =RC[-1]/RC[-2] -> 0
A239: 119 | B239: 1 | C239: Friday | D239: 5 | E239: 2pm-3pm | F239: 6 | G239: 2 | H239: 20 | I239: 0 | J239: =RC[-1]/RC[-2] -> 0
A240: 119 | B240: 1 | C240: Friday | D240: 5 | E240: 3pm-4pm | F240: 7 | G240: 2 | H240: 20 | I240: 0 | J240: =RC[-1]/RC[-2] -> 0
A241: 119 | B241: 1 | C241: Friday | D241: 5 | E241: 4pm-5pm | F241: 8 | G241: 2 | H241: 20 | I241: 0 | J241: =RC[-1]/RC[-2] -> 0
A242: 124 | B242: 1 | C242: Monday | D242: 1 | E242: 9am-10am | F242: 1 | G242: 2 | H242: 44 | I242: 0 | J242: =RC[-1]/RC[-2] -> 0
A243: 124 | B243: 1 | C243: Monday | D243: 1 | E243: 10am-11am | F243: 2 | G243: 3 | H243: 44 | I243: 1 | J243: =RC[-1]/RC[-2] -> 2.2727272727272728E-2
A244: 124 | B244: 1 | C244: Monday | D244: 1 | E244: 11am-12pm | F244: 3 | G244: 2 | H244: 44 | I244: 0 | J244: =RC[-1]/RC[-2] -> 0
A245: 124 | B245: 1 | C245: Monday | D245: 1 | E245: 12pm-1pm | F245: 4 | G245: 2 | H245: 44 | I245: 0 | J245: =RC[-1]/RC[-2] -> 0
A246: 124 | B246: 1 | C246: Monday | D246: 1 | E246: 1pm-2pm | F246: 5 | G246: 1 | H246: 44 | I246: 16 | J246: =RC[-1]/RC[-2] -> 0.36363636363636365
A247: 124 | B247: 1 | C247: Monday | D247: 1 | E247: 2pm-3pm | F247: 6 | G247: 1 | H247: 44 | I247: 16 | J247: =RC[-1]/RC[-2] -> 0.36363636363636365
A248: 124 | B248: 1 | C248: Monday | D248: 1 | E248: 3pm-4pm | F248: 7 | G248: 1 | H248: 44 | I248: 18 | J248: =RC[-1]/RC[-2] -> 0.40909090909090912
A249: 124 | B249: 1 | C249: Monday | D249: 1 | E249: 4pm-5pm | F249: 8 | G249: 1 | H249: 44 | I249: 17 | J249: =RC[-1]/RC[-2] -> 0.38636363636363635
A250: 124 | B250: 1 | C250: Tuesday | D250: 2 | E250: 9am-10am | F250: 1 | G250: 2 | H250: 44 | I250: 0 | J250: =RC[-1]/RC[-2] -> 0
A251: 124 | B251: 1 | C251: Tuesday | D251: 2 | E251: 10am-11am | F251: 2 | G251: 2 | H251: 44 | I251: 0 | J251: =RC[-1]/RC[-2] -> 0
A252: 124 | B252: 1 | C252: Tuesday | D252: 2 | E252: 11am-12pm | F252: 3 | G252: 2 | H252: 44 | I252: 0 | J252: =RC[-1]/RC[-2] -> 0
A253: 124 | B253: 1 | C253: Tuesday | D253: 2 | E253: 12pm-1pm | F253: 4 | G253: 2 | H253: 44 | I253: 0 | J253: =RC[-1]/RC[-2] -> 0
A254: 124 | B254: 1 | C254: Tuesday | D254: 2 | E254: 1pm-2pm | F254: 5 | G254: 2 | H254: 44 | I254: 0 | J254: =RC[-1]/RC[-2] -> 0
A255: 124 | B255: 1 | C255: Tuesday | D255: 2 | E255: 2pm-3pm | F255: 6 | G255: 1 | H255: 44 | I255: 18 | J255: =RC[-1]/RC[-2] -> 0.40909090909090912
A256: 124 | B256: 1 | C256: Tuesday | D256: 2 | E256: 3pm-4pm | F256: 7 | G256: 1 | H256: 44 | I256: 17 | J256: =RC[-1]/RC[-2] -> 0.38636363636363635
A257: 124 | B257: 1 | C257: Tuesday | D257: 2 | E257: 4pm-5pm | F257: 8 | G257: 1 | H257: 44 | I257: 16 | J257: =RC[-1]/RC[-2] -> 0.36363636363636365
A258: 124 | B258: 1 | C258: Wednesday | D258: 3 | E258: 9am-10am | F258: 1 | G258: 2 | H258: 44 | I258: 0 | J258: =RC[-1]/RC[-2] -> 0
A259: 124 | B259: 1 | C259: Wednesday | D259: 3 | E259: 10am-11am | F259: 2 | G259: 2 | H259: 44 | I259: 0 | J259: =RC[-1]/RC[-2] -> 0
A260: 124 | B260: 1 | C260: Wednesday | D260: 3 | E260: 11am-12pm | F260: 3 | G260: 2 | H260: 44 | I260: 0 | J260: =RC[-1]/RC[-2] -> 0
A261: 124 | B261: 1 | C261: Wednesday | D261: 3 | E261: 12pm-1pm | F261: 4 | G261: 1 | H261: 44 | I261: 2 | J261: =RC[-1]/RC[-2] -> 4.5454545454545456E-2
A262: 124 | B262: 1 | C262: Wednesday | D262: 3 | E262: 1pm-2pm | F262: 5 | G262: 1 | H262: 44 | I262: 3 | J262: =RC[-1]/RC[-2] -> 6.8181818181818177E-2
A263: 124 | B263: 1 | C263: Wednesday | D263: 3 | E263: 2pm-3pm | F263: 6 | G263: 2 | H263: 44 | I263: 0 | J263: =RC[-1]/RC[-2] -> 0
A264: 124 | B264: 1 | C264: Wednesday | D264: 3 | E264: 3pm-4pm | F264: 7 | G264: 2 | H264: 44 | I264: 0 | J264: =RC[-1]/RC[-2] -> 0
A265: 124 | B265: 1 | C265: Wednesday | D265: 3 | E265: 4pm-5pm | F265: 8 | G265: 2 | H265: 44 | I265: 0 | J265: =RC[-1]/RC[-2] -> 0
A266: 124 | B266: 1 | C266: Thursday | D266: 4 | E266: 9am-10am | F266: 1 | G266: 1 | H266: 44 | I266: 16 | J266: =RC[-1]/RC[-2] -> 0.36363636363636365
A267: 124 | B267: 1 | C267: Thursday | D267: 4 | E267: 10am-11am | F267: 2 | G267: 1 | H267: 44 | I267: 16 | J267: =RC[-1]/RC[-2] -> 0.36363636363636365
A268: 124 | B268: 1 | C268: Thursday | D268: 4 | E268: 11am-12pm | F268: 3 | G268: 1 | H268: 44 | I268: 18 | J268: =RC[-1]/RC[-2] -> 0.40909090909090912
A269: 124 | B269: 1 | C269: Thursday | D269: 4 | E269: 12pm-1pm | F269: 4 | G269: 2 | H269: 44 | I269: 0 | J269: =RC[-1]/RC[-2] -> 0
A270: 124 | B270: 1 | C270: Thursday | D270: 4 | E270: 1pm-2pm | F270: 5 | G270: 2 | H270: 44 | I270: 0 | J270: =RC[-1]/RC[-2] -> 0
A271: 124 | B271: 1 | C271: Thursday | D271: 4 | E271: 2pm-3pm | F271: 6 | G271: 1 | H271: 44 | I271: 14 | J271: =RC[-1]/RC[-2] -> 0.31818181818181818
A272: 124 | B272: 1 | C272: Thursday | D272: 4 | E272: 3pm-4pm | F272: 7 | G272: 1 | H272: 44 | I272: 15 | J272: =RC[-1]/RC[-2] -> 0.34090909090909088
A273: 124 | B273: 1 | C273: Thursday | D273: 4 | E273: 4pm-5pm | F273: 8 | G273: 1 | H273: 44 | I273: 15 | J273: =RC[-1]/RC[-2] -> 0.34090909090909088
A274: 124 | B274: 1 | C274: Friday | D274: 5 | E274: 9am-10am | F274: 1 | G274: 1 | H274: 44 | I274: 15 | J274: =RC[-1]/RC[-2] -> 0.34090909090909088
A275: 124 | B275: 1 | C275: Friday | D275: 5 | E275: 10am-11am | F275: 2 | G275: 2 | H275: 44 | I275: 0 | J275: =RC[-1]/RC[-2] -> 0
A276: 124 | B276: 1 | C276: Friday | D276: 5 | E276: 11am-12pm | F276: 3 | G276: 1 | H276: 44 | I276: 1 | J276: =RC[-1]/RC[-2] -> 2.2727272727272728E-2
A277: 124 | B277: 1 | C277: Friday | D277: 5 | E277: 12pm-1pm | F277: 4 | G277: 2 | H277: 44 | I277: 0 | J277: =RC[-1]/RC[-2] -> 0
A278: 124 | B278: 1 | C278: Friday | D278: 5 | E278: 1pm-2pm | F278: 5 | G278: 2 | H278: 44 | I278: 0 | J278: =RC[-1]/RC[-2] -> 0
A279: 124 | B279: 1 | C279: Friday | D279: 5 | E279: 2pm-3pm | F279: 6 | G279: 1 | H279: 44 | I279: 18 | J279: =RC[-1]/RC[-2] -> 0.40909090909090912
A280: 124 | B280: 1 | C280: Friday | D280: 5 | E280: 3pm-4pm | F280: 7 | G280: 1 | H280: 44 | I280: 18 | J280: =RC[-1]/RC[-2] -> 0.40909090909090912
A281: 124 | B281: 1 | C281: Friday | D281: 5 | E281: 4pm-5pm | F281: 8 | G281: 1 | H281: 44 | I281: 18 | J281: =RC[-1]/RC[-2] -> 0.40909090909090912
A282: 207 | B282: 1 | C282: Monday | D282: 1 | E282: 9am-10am | F282: 1 | G282: 1 | H282: 4 | I282: 2 | J282: =RC[-1]/RC[-2] -> 0.5
A283: 207 | B283: 1 | C283: Monday | D283: 1 | E283: 10am-11am | F283: 2 | G283: 2 | H283: 4 | I283: 0 | J283: =RC[-1]/RC[-2] -> 0
A284: 207 | B284: 1 | C284: Monday | D284: 1 | E284: 11am-12pm | F284: 3 | G284: 2 | H284: 4 | I284: 0 | J284: =RC[-1]/RC[-2] -> 0
A285: 207 | B285: 1 | C285: Monday | D285: 1 | E285: 12pm-1pm | F285: 4 | G285: 2 | H285: 4 | I285: 0 | J285: =RC[-1]/RC[-2] -> 0
A286: 207 | B286: 1 | C286: Monday | D286: 1 | E286: 1pm-2pm | F286: 5 | G286: 2 | H286: 4 | I286: 0 | J286: =RC[-1]/RC[-2] -> 0
A287: 207 | B287: 1 | C287: Monday | D287: 1 | E287: 2pm-3pm | F287: 6 | G287: 2 | H287: 4 | I287: 0 | J287: =RC[-1]/RC[-2] -> 0
A288: 207 | B288: 1 | C288: Monday | D288: 1 | E288: 3pm-4pm | F288: 7 | G288: 1 | H288: 4 | I288: 1 | J288: =RC[-1]/RC[-2] -> 0.25
A289: 207 | B289: 1 | C289: Monday | D289: 1 | E289: 4pm-5pm | F289: 8 | G289: 3 | H289: 4 | I289: 1 | J289: =RC[-1]/RC[-2] -> 0.25
A290: 207 | B290: 1 | C290: Tuesday | D290: 2 | E290: 9am-10am | F290: 1 | G290: 2 | H290: 4 | I290: 0 | J290: =RC[-1]/RC[-2] -> 0
A291: 207 | B291: 1 | C291: Tuesday | D291: 2 | E291: 10am-11am | F291: 2 | G291: 2 | H291: 4 | I291: 0 | J291: =RC[-1]/RC[-2] -> 0
A292: 207 | B292: 1 | C292: Tuesday | D292: 2 | E292: 11am-12pm | F292: 3 | G292: 2 | H292: 4 | I292: 0 | J292: =RC[-1]/RC[-2] -> 0
A293: 207 | B293: 1 | C293: Tuesday | D293: 2 | E293: 12pm-1pm | F293: 4 | G293: 2 | H293: 4 | I293: 0 | J293: =RC[-1]/RC[-2] -> 0
A294: 207 | B294: 1 | C294: Tuesday | D294: 2 | E294: 1pm-2pm | F294: 5 | G294: 2 | H294: 4 | I294: 0 | J294: =RC[-1]/RC[-2] -> 0
A295: 207 | B295: 1 | C295: Tuesday | D295: 2 | E295: 2pm-3pm | F295: 6 | G295: 2 | H295: 4 | I295: 0 | J295: =RC[-1]/RC[-2] -> 0
A296: 207 | B296: 1 | C296: Tuesday | D296: 2 | E296: 3pm-4pm | F296: 7 | G296: 2 | H296: 4 | I296: 0 | J296: =RC[-1]/RC[-2] -> 0
A297: 207 | B297: 1 | C297: Tuesday | D297: 2 | E297: 4pm-5pm | F297: 8 | G297: 2 | H297: 4 | I297: 0 | J297: =RC[-1]/RC[-2] -> 0
A298: 207 | B298: 1 | C298: Wednesday | D298: 3 | E298: 9am-10am | F298: 1 | G298: 2 | H298: 4 | I298: 0 | J298: =RC[-1]/RC[-2] -> 0
A299: 207 | B299: 1 | C299: Wednesday | D299: 3 | E299: 10am-11am | F299: 2 | G299: 2 | H299: 4 | I299: 0 | J299: =RC[-1]/RC[-2] -> 0
A300: 207 | B300: 1 | C300: Wednesday | D300: 3 | E300: 11am-12pm | F300: 3 | G300: 2 | H300: 4 | I300: 0 | J300: =RC[-1]/RC[-2] -> 0
A301: 207 | B301: 1 | C301: Wednesday | D301: 3 | E301: 12pm-1pm | F301: 4 | G301: 2 | H301: 4 | I301: 0 | J301: =RC[-1]/RC[-2] -> 0
A302: 207 | B302: 1 | C302: Wednesday | D302: 3 | E302: 1pm-2pm | F302: 5 | G302: 2 | H302: 4 | I302: 0 | J302: =RC[-1]/RC[-2] -> 0
A303: 207 | B303: 1 | C303: Wednesday | D303: 3 | E303: 2pm-3pm | F303: 6 | G303: 3 | H303: 4 | I303: 1 | J303: =RC[-1]/RC[-2] -> 0.25
A304: 207 | B304: 1 | C304: Wednesday | D304: 3 | E304: 3pm-4pm | F304: 7 | G304: 1 | H304: 4 | I304: 1 | J304: =RC[-1]/RC[-2] -> 0.25
A305: 207 | B305: 1 | C305: Wednesday | D305: 3 | E305: 4pm-5pm | F305: 8 | G305: 2 | H305: 4 | I305: 0 | J305: =RC[-1]/RC[-2] -> 0
A306: 207 | B306: 1 | C306: Thursday | D306: 4 | E306: 9am-10am | F306: 1 | G306: 2 | H306: 4 | I306: 0 | J306: =RC[-1]/RC[-2] -> 0
A307: 207 | B307: 1 | C307: Thursday | D307: 4 | E307: 10am-11am | F307: 2 | G307: 2 | H307: 4 | I307: 0 | J307: =RC[-1]/RC[-2] -> 0
A308: 207 | B308: 1 | C308: Thursday | D308: 4 | E308: 11am-12pm | F308: 3 | G308: 2 | H308: 4 | I308: 0 | J308: =RC[-1]/RC[-2] -> 0
A309: 207 | B309: 1 | C309: Thursday | D309: 4 | E309: 12pm-1pm | F309: 4 | G309: 2 | H309: 4 | I309: 0 | J309: =RC[-1]/RC[-2] -> 0
A310: 207 | B310: 1 | C310: Thursday | D310: 4 | E310: 1pm-2pm | F310: 5 | G310: 2 | H310: 4 | I310: 0 | J310: =RC[-1]/RC[-2] -> 0
A311: 207 | B311: 1 | C311: Thursday | D311: 4 | E311: 2pm-3pm | F311: 6 | G311: 2 | H311: 4 | I311: 0 | J311: =RC[-1]/RC[-2] -> 0
A312: 207 | B312: 1 | C312: Thursday | D312: 4 | E312: 3pm-4pm | F312: 7 | G312: 2 | H312: 4 | I312: 0 | J312: =RC[-1]/RC[-2] -> 0
A313: 207 | B313: 1 | C313: Thursday | D313: 4 | E313: 4pm-5pm | F313: 8 | G313: 2 | H313: 4 | I313: 0 | J313: =RC[-1]/RC[-2] -> 0
A314: 207 | B314: 1 | C314: Friday | D314: 5 | E314: 9am-10am | F314: 1 | G314: 2 | H314: 4 | I314: 0 | J314: =RC[-1]/RC[-2] -> 0
A315: 207 | B315: 1 | C315: Friday | D315: 5 | E315: 10am-11am | F315: 2 | G315: 2 | H315: 4 | I315: 0 | J315: =RC[-1]/RC[-2] -> 0
A316: 207 | B316: 1 | C316: Friday | D316: 5 | E316: 11am-12pm | F316: 3 | G316: 2 | H316: 4 | I316: 0 | J316: =RC[-1]/RC[-2] -> 0
A317: 207 | B317: 1 | C317: Friday | D317: 5 | E317: 12pm-1pm | F317: 4 | G317: 2 | H317: 4 | I317: 0 | J317: =RC[-1]/RC[-2] -> 0
A318: 207 | B318: 1 | C318: Friday | D318: 5 | E318: 1pm-2pm | F318: 5 | G318: 2 | H318: 4 | I318: 0 | J318: =RC[-1]/RC[-2] -> 0
A319: 207 | B319: 1 | C319: Friday | D319: 5 | E319: 2pm-3pm | F319: 6 | G319: 2 | H319: 4 | I319: 0 | J319: =RC[-1]/RC[-2] -> 0
A320: 207 | B320: 1 | C320: Friday | D320: 5 | E320: 3pm-4pm | F320: 7 | G320: 2 | H320: 4 | I320: 0 | J320: =RC[-1]/RC[-2] -> 0
A321: 207 | B321: 1 | C321: Friday | D321: 5 | E321: 4pm-5pm | F321: 8 | G321: 2 | H321: 4 | I321: 0 | J321: =RC[-1]/RC[-2] -> 0
A322: 208 | B322: 1 | C322: Monday | D322: 1 | E322: 9am-10am | F322: 1 | G322: 3 | H322: 4 | I322: 1 | J322: =RC[-1]/RC[-2] -> 0.25
A323: 208 | B323: 1 | C323: Monday | D323: 1 | E323: 10am-11am | F323: 2 | G323: 2 | H323: 4 | I323: 0 | J323: =RC[-1]/RC[-2] -> 0
A324: 208 | B324: 1 | C324: Monday | D324: 1 | E324: 11am-12pm | F324: 3 | G324: 2 | H324: 4 | I324: 0 | J324: =RC[-1]/RC[-2] -> 0
A325: 208 | B325: 1 | C325: Monday | D325: 1 | E325: 12pm-1pm | F325: 4 | G325: 2 | H325: 4 | I325: 0 | J325: =RC[-1]/RC[-2] -> 0
A326: 208 | B326: 1 | C326: Monday | D326: 1 | E326: 1pm-2pm | F326: 5 | G326: 2 | H326: 4 | I326: 0 | J326: =RC[-1]/RC[-2] -> 0
A327: 208 | B327: 1 | C327: Monday | D327: 1 | E327: 2pm-3pm | F327: 6 | G327: 2 | H327: 4 | I327: 0 | J327: =RC[-1]/RC[-2] -> 0
A328: 208 | B328: 1 | C328: Monday | D328: 1 | E328: 3pm-4pm | F328: 7 | G328: 2 | H328: 4 | I328: 0 | J328: =RC[-1]/RC[-2] -> 0
A329: 208 | B329: 1 | C329: Monday | D329: 1 | E329: 4pm-5pm | F329: 8 | G329: 2 | H329: 4 | I329: 0 | J329: =RC[-1]/RC[-2] -> 0
A330: 208 | B330: 1 | C330: Tuesday | D330: 2 | E330: 9am-10am | F330: 1 | G330: 2 | H330: 4 | I330: 0 | J330: =RC[-1]/RC[-2] -> 0
A331: 208 | B331: 1 | C331: Tuesday | D331: 2 | E331: 10am-11am | F331: 2 | G331: 3 | H331: 4 | I331: 1 | J331: =RC[-1]/RC[-2] -> 0.25
A332: 208 | B332: 1 | C332: Tuesday | D332: 2 | E332: 11am-12pm | F332: 3 | G332: 2 | H332: 4 | I332: 0 | J332: =RC[-1]/RC[-2] -> 0
A333: 208 | B333: 1 | C333: Tuesday | D333: 2 | E333: 12pm-1pm | F333: 4 | G333: 3 | H333: 4 | I333: 1 | J333: =RC[-1]/RC[-2] -> 0.25
A334: 208 | B334: 1 | C334: Tuesday | D334: 2 | E334: 1pm-2pm | F334: 5 | G334: 2 | H334: 4 | I334: 0 | J334: =RC[-1]/RC[-2] -> 0
A335: 208 | B335: 1 | C335: Tuesday | D335: 2 | E335: 2pm-3pm | F335: 6 | G335: 2 | H335: 4 | I335: 0 | J335: =RC[-1]/RC[-2] -> 0
A336: 208 | B336: 1 | C336: Tuesday | D336: 2 | E336: 3pm-4pm | F336: 7 | G336: 2 | H336: 4 | I336: 0 | J336: =RC[-1]/RC[-2] -> 0
A337: 208 | B337: 1 | C337: Tuesday | D337: 2 | E337: 4pm-5pm | F337: 8 | G337: 2 | H337: 4 | I337: 0 | J337: =RC[-1]/RC[-2] -> 0
A338: 208 | B338: 1 | C338: Wednesday | D338: 3 | E338: 9am-10am | F338: 1 | G338: 3 | H338: 4 | I338: 2 | J338: =RC[-1]/RC[-2] -> 0.5
A339: 208 | B339: 1 | C339: Wednesday | D339: 3 | E339: 10am-11am | F339: 2 | G339: 3 | H339: 4 | I339: 1 | J339: =RC[-1]/RC[-2] -> 0.25
A340: 208 | B340: 1 | C340: Wednesday | D340: 3 | E340: 11am-12pm | F340: 3 | G340: 3 | H340: 4 | I340: 2 | J340: =RC[-1]/RC[-2] -> 0.5
A341: 208 | B341: 1 | C341: Wednesday | D341: 3 | E341: 12pm-1pm | F341: 4 | G341: 2 | H341: 4 | I341: 0 | J341: =RC[-1]/RC[-2] -> 0
A342: 208 | B342: 1 | C342: Wednesday | D342: 3 | E342: 1pm-2pm | F342: 5 | G342: 2 | H342: 4 | I342: 0 | J342: =RC[-1]/RC[-2] -> 0
A343: 208 | B343: 1 | C343: Wednesday | D343: 3 | E343: 2pm-3pm | F343: 6 | G343: 2 | H343: 4 | I343: 0 | J343: =RC[-1]/RC[-2] -> 0
A344: 208 | B344: 1 | C344: Wednesday | D344: 3 | E344: 3pm-4pm | F344: 7 | G344: 2 | H344: 4 | I344: 0 | J344: =RC[-1]/RC[-2] -> 0
A345: 208 | B345: 1 | C345: Wednesday | D345: 3 | E345: 4pm-5pm | F345: 8 | G345: 2 | H345: 4 | I345: 0 | J345: =RC[-1]/RC[-2] -> 0
A346: 208 | B346: 1 | C346: Thursday | D346: 4 | E346: 9am-10am | F346: 1 | G346: 3 | H346: 4 | I346: 1 | J346: =RC[-1]/RC[-2] -> 0.25
A347: 208 | B347: 1 | C347: Thursday | D347: 4 | E347: 10am-11am | F347: 2 | G347: 2 | H347: 4 | I347: 0 | J347: =RC[-1]/RC[-2] -> 0
A348: 208 | B348: 1 | C348: Thursday | D348: 4 | E348: 11am-12pm | F348: 3 | G348: 2 | H348: 4 | I348: 0 | J348: =RC[-1]/RC[-2] -> 0
A349: 208 | B349: 1 | C349: Thursday | D349: 4 | E349: 12pm-1pm | F349: 4 | G349: 2 | H349: 4 | I349: 0 | J349: =RC[-1]/RC[-2] -> 0
A350: 208 | B350: 1 | C350: Thursday | D350: 4 | E350: 1pm-2pm | F350: 5 | G350: 2 | H350: 4 | I350: 0 | J350: =RC[-1]/RC[-2] -> 0
A351: 208 | B351: 1 | C351: Thursday | D351: 4 | E351: 2pm-3pm | F351: 6 | G351: 2 | H351: 4 | I351: 0 | J351: =RC[-1]/RC[-2] -> 0
A352: 208 | B352: 1 | C352: Thursday | D352: 4 | E352: 3pm-4pm | F352: 7 | G352: 2 | H352: 4 | I352: 0 | J352: =RC[-1]/RC[-2] -> 0
A353: 208 | B353: 1 | C353: Thursday | D353: 4 | E353: 4pm-5pm | F353: 8 | G353: 2 | H353: 4 | I353: 0 | J353: =RC[-1]/RC[-2] -> 0
A354: 208 | B354: 1 | C354: Friday | D354: 5 | E354: 9am-10am | F354: 1 | G354: 2 | H354: 4 | I354: 0 | J354: =RC[-1]/RC[-2] -> 0
A355: 208 | B355: 1 | C355: Friday | D355: 5 | E355: 10am-11am | F355: 2 | G355: 1 | H355: 4 | I355: 1 | J355: =RC[-1]/RC[-2] -> 0.25
A356: 208 | B356: 1 | C356: Friday | D356: 5 | E356: 11am-12pm | F356: 3 | G356: 2 | H356: 4 | I356: 0 | J356: =RC[-1]/RC[-2] -> 0
A357: 208 | B357: 1 | C357: Friday | D357: 5 | E357: 12pm-1pm | F357: 4 | G357: 2 | H357: 4 | I357: 0 | J357: =RC[-1]/RC[-2] -> 0
A358: 208 | B358: 1 | C358: Friday | D358: 5 | E358: 1pm-2pm | F358: 5 | G358: 2 | H358: 4 | I358: 0 | J358: =RC[-1]/RC[-2] -> 0
A359: 208 | B359: 1 | C359: Friday | D359: 5 | E359: 2pm-3pm | F359: 6 | G359: 2 | H359: 4 | I359: 0 | J359: =RC[-1]/RC[-2] -> 0
A360: 208 | B360: 1 | C360: Friday | D360: 5 | E360: 3pm-4pm | F360: 7 | G360: 2 | H360: 4 | I360: 0 | J360: =RC[-1]/RC[-2] -> 0
A361: 208 | B361: 1 | C361: Friday | D361: 5 | E361: 4pm-5pm | F361: 8 | G361: 1 | H361: 4 | I361: 1 | J361: =RC[-1]/RC[-2] -> 0.25
A362: 209 | B362: 1 | C362: Monday | D362: 1 | E362: 9am-10am | F362: 1 | G362: 2 | H362: 4 | I362: 0 | J362: =RC[-1]/RC[-2] -> 0
A363: 209 | B363: 1 | C363: Monday | D363: 1 | E363: 10am-11am | F363: 2 | G363: 2 | H363: 4 | I363: 0 | J363: =RC[-1]/RC[-2] -> 0
A364: 209 | B364: 1 | C364: Monday | D364: 1 | E364: 11am-12pm | F364: 3 | G364: 2 | H364: 4 | I364: 0 | J364: =RC[-1]/RC[-2] -> 0
A365: 209 | B365: 1 | C365: Monday | D365: 1 | E365: 12pm-1pm | F365: 4 | G365: 2 | H365: 4 | I365: 0 | J365: =RC[-1]/RC[-2] -> 0
A366: 209 | B366: 1 | C366: Monday | D366: 1 | E366: 1pm-2pm | F366: 5 | G366: 3 | H366: 4 | I366: 1 | J366: =RC[-1]/RC[-2] -> 0.25
A367: 209 | B367: 1 | C367: Monday | D367: 1 | E367: 2pm-3pm | F367: 6 | G367: 2 | H367: 4 | I367: 0 | J367: =RC[-1]/RC[-2] -> 0
A368: 209 | B368: 1 | C368: Monday | D368: 1 | E368: 3pm-4pm | F368: 7 | G368: 2 | H368: 4 | I368: 0 | J368: =RC[-1]/RC[-2] -> 0
A369: 209 | B369: 1 | C369: Monday | D369: 1 | E369: 4pm-5pm | F369: 8 | G369: 1 | H369: 4 | I369: 7 | J369: =RC[-1]/RC[-2] -> 1.75
A370: 209 | B370: 1 | C370: Tuesday | D370: 2 | E370: 9am-10am | F370: 1 | G370: 2 | H370: 4 | I370: 0 | J370: =RC[-1]/RC[-2] -> 0
A371: 209 | B371: 1 | C371: Tuesday | D371: 2 | E371: 10am-11am | F371: 2 | G371: 2 | H371: 4 | I371: 0 | J371: =RC[-1]/RC[-2] -> 0
A372: 209 | B372: 1 | C372: Tuesday | D372: 2 | E372: 11am-12pm | F372: 3 | G372: 3 | H372: 4 | I372: 1 | J372: =RC[-1]/RC[-2] -> 0.25
A373: 209 | B373: 1 | C373: Tuesday | D373: 2 | E373: 12pm-1pm | F373: 4 | G373: 2 | H373: 4 | I373: 0 | J373: =RC[-1]/RC[-2] -> 0
A374: 209 | B374: 1 | C374: Tuesday | D374: 2 | E374: 1pm-2pm | F374: 5 | G374: 2 | H374: 4 | I374: 0 | J374: =RC[-1]/RC[-2] -> 0
A375: 209 | B375: 1 | C375: Tuesday | D375: 2 | E375: 2pm-3pm | F375: 6 | G375: 2 | H375: 4 | I375: 0 | J375: =RC[-1]/RC[-2] -> 0
A376: 209 | B376: 1 | C376: Tuesday | D376: 2 | E376: 3pm-4pm | F376: 7 | G376: 2 | H376: 4 | I376: 0 | J376: =RC[-1]/RC[-2] -> 0
A377: 209 | B377: 1 | C377: Tuesday | D377: 2 | E377: 4pm-5pm | F377: 8 | G377: 3 | H377: 4 | I377: 1 | J377: =RC[-1]/RC[-2] -> 0.25
A378: 209 | B378: 1 | C378: Wednesday | D378: 3 | E378: 9am-10am | F378: 1 | G378: 1 | H378: 4 | I378: 1 | J378: =RC[-1]/RC[-2] -> 0.25
A379: 209 | B379: 1 | C379: Wednesday | D379: 3 | E379: 10am-11am | F379: 2 | G379: 2 | H379: 4 | I379: 0 | J379: =RC[-1]/RC[-2] -> 0
A380: 209 | B380: 1 | C380: Wednesday | D380: 3 | E380: 11am-12pm | F380: 3 | G380: 2 | H380: 4 | I380: 0 | J380: =RC[-1]/RC[-2] -> 0
A381: 209 | B381: 1 | C381: Wednesday | D381: 3 | E381: 12pm-1pm | F381: 4 | G381: 2 | H381: 4 | I381: 0 | J381: =RC[-1]/RC[-2] -> 0
A382: 209 | B382: 1 | C382: Wednesday | D382: 3 | E382: 1pm-2pm | F382: 5 | G382: 1 | H382: 4 | I382: 1 | J382: =RC[-1]/RC[-2] -> 0.25
A383: 209 | B383: 1 | C383: Wednesday | D383: 3 | E383: 2pm-3pm | F383: 6 | G383: 1 | H383: 4 | I383: 1 | J383: =RC[-1]/RC[-2] -> 0.25
A384: 209 | B384: 1 | C384: Wednesday | D384: 3 | E384: 3pm-4pm | F384: 7 | G384: 2 | H384: 4 | I384: 0 | J384: =RC[-1]/RC[-2] -> 0
A385: 209 | B385: 1 | C385: Wednesday | D385: 3 | E385: 4pm-5pm | F385: 8 | G385: 2 | H385: 4 | I385: 0 | J385: =RC[-1]/RC[-2] -> 0
A386: 209 | B386: 1 | C386: Thursday | D386: 4 | E386: 9am-10am | F386: 1 | G386: 3 | H386: 4 | I386: 1 | J386: =RC[-1]/RC[-2] -> 0.25
A387: 209 | B387: 1 | C387: Thursday | D387: 4 | E387: 10am-11am | F387: 2 | G387: 2 | H387: 4 | I387: 0 | J387: =RC[-1]/RC[-2] -> 0
A388: 209 | B388: 1 | C388: Thursday | D388: 4 | E388: 11am-12pm | F388: 3 | G388: 2 | H388: 4 | I388: 0 | J388: =RC[-1]/RC[-2] -> 0
A389: 209 | B389: 1 | C389: Thursday | D389: 4 | E389: 12pm-1pm | F389: 4 | G389: 3 | H389: 4 | I389: 1 | J389: =RC[-1]/RC[-2] -> 0.25
A390: 209 | B390: 1 | C390: Thursday | D390: 4 | E390: 1pm-2pm | F390: 5 | G390: 2 | H390: 4 | I390: 0 | J390: =RC[-1]/RC[-2] -> 0
A391: 209 | B391: 1 | C391: Thursday | D391: 4 | E391: 2pm-3pm | F391: 6 | G391: 1 | H391: 4 | I391: 1 | J391: =RC[-1]/RC[-2] -> 0.25
A392: 209 | B392: 1 | C392: Thursday | D392: 4 | E392: 3pm-4pm | F392: 7 | G392: 1 | H392: 4 | I392: 1 | J392: =RC[-1]/RC[-2] -> 0.25
A393: 209 | B393: 1 | C393: Thursday | D393: 4 | E393: 4pm-5pm | F393: 8 | G393: 1 | H393: 4 | I393: 1 | J393: =RC[-1]/RC[-2] -> 0.25
A394: 209 | B394: 1 | C394: Friday | D394: 5 | E394: 9am-10am | F394: 1 | G394: 2 | H394: 4 | I394: 0 | J394: =RC[-1]/RC[-2] -> 0
A395: 209 | B395: 1 | C395: Friday | D395: 5 | E395: 10am-11am | F395: 2 | G395: 1 | H395: 4 | I395: 1 | J395: =RC[-1]/RC[-2] -> 0.25
A396: 209 | B396: 1 | C396: Friday | D396: 5 | E396: 11am-12pm | F396: 3 | G396: 2 | H396: 4 | I396: 0 | J396: =RC[-1]/RC[-2] -> 0
A397: 209 | B397: 1 | C397: Friday | D397: 5 | E397: 12pm-1pm | F397: 4 | G397: 2 | H397: 4 | I397: 0 | J397: =RC[-1]/RC[-2] -> 0
A398: 209 | B398: 1 | C398: Friday | D398: 5 | E398: 1pm-2pm | F398: 5 | G398: 2 | H398: 4 | I398: 0 | J398: =RC[-1]/RC[-2] -> 0
A399: 209 | B399: 1 | C399: Friday | D399: 5 | E399: 2pm-3pm | F399: 6 | G399: 2 | H399: 4 | I399: 0 | J399: =RC[-1]/RC[-2] -> 0
A400: 209 | B400: 1 | C400: Friday | D400: 5 | E400: 3pm-4pm | F400: 7 | G400: 2 | H400: 4 | I400: 0 | J400: =RC[-1]/RC[-2] -> 0
A401: 209 | B401: 1 | C401: Friday | D401: 5 | E401: 4pm-5pm | F401: 8 | G401: 1 | H401: 4 | I401: 1 | J401: =RC[-1]/RC[-2] -> 0.25
A402: 210 | B402: 1 | C402: Monday | D402: 1 | E402: 9am-10am | F402: 1 | G402: 2 | H402: 3 | I402: 0 | J402: =RC[-1]/RC[-2] -> 0
A403: 210 | B403: 1 | C403: Monday | D403: 1 | E403: 10am-11am | F403: 2 | G403: 2 | H403: 3 | I403: 0 | J403: =RC[-1]/RC[-2] -> 0
A404: 210 | B404: 1 | C404: Monday | D404: 1 | E404: 11am-12pm | F404: 3 | G404: 2 | H404: 3 | I404: 0 | J404: =RC[-1]/RC[-2] -> 0
A405: 210 | B405: 1 | C405: Monday | D405: 1 | E405: 12pm-1pm | F405: 4 | G405: 2 | H405: 3 | I405: 0 | J405: =RC[-1]/RC[-2] -> 0
A406: 210 | B406: 1 | C406: Monday | D406: 1 | E406: 1pm-2pm | F406: 5 | G406: 3 | H406: 3 | I406: 1 | J406: =RC[-1]/RC[-2] -> 0.33333333333333331
A407: 210 | B407: 1 | C407: Monday | D407: 1 | E407: 2pm-3pm | F407: 6 | G407: 2 | H407: 3 | I407: 0 | J407: =RC[-1]/RC[-2] -> 0
A408: 210 | B408: 1 | C408: Monday | D408: 1 | E408: 3pm-4pm | F408: 7 | G408: 1 | H408: 3 | I408: 2 | J408: =RC[-1]/RC[-2] -> 0.66666666666666663
A409: 210 | B409: 1 | C409: Monday | D409: 1 | E409: 4pm-5pm | F409: 8 | G409: 1 | H409: 3 | I409: 2 | J409: =RC[-1]/RC[-2] -> 0.66666666666666663
A410: 210 | B410: 1 | C410: Tuesday | D410: 2 | E410: 9am-10am | F410: 1 | G410: 3 | H410: 3 | I410: 1 | J410: =RC[-1]/RC[-2] -> 0.33333333333333331
A411: 210 | B411: 1 | C411: Tuesday | D411: 2 | E411: 10am-11am | F411: 2 | G411: 1 | H411: 3 | I411: 4 | J411: =RC[-1]/RC[-2] -> 1.3333333333333333
A412: 210 | B412: 1 | C412: Tuesday | D412: 2 | E412: 11am-12pm | F412: 3 | G412: 1 | H412: 3 | I412: 4 | J412: =RC[-1]/RC[-2] -> 1.3333333333333333
A413: 210 | B413: 1 | C413: Tuesday | D413: 2 | E413: 12pm-1pm | F413: 4 | G413: 1 | H413: 3 | I413: 3 | J413: =RC[-1]/RC[-2] -> 1
A414: 210 | B414: 1 | C414: Tuesday | D414: 2 | E414: 1pm-2pm | F414: 5 | G414: 2 | H414: 3 | I414: 0 | J414: =RC[-1]/RC[-2] -> 0
A415: 210 | B415: 1 | C415: Tuesday | D415: 2 | E415: 2pm-3pm | F415: 6 | G415: 2 | H415: 3 | I415: 0 | J415: =RC[-1]/RC[-2] -> 0
A416: 210 | B416: 1 | C416: Tuesday | D416: 2 | E416: 3pm-4pm | F416: 7 | G416: 1 | H416: 3 | I416: 2 | J416: =RC[-1]/RC[-2] -> 0.66666666666666663
A417: 210 | B417: 1 | C417: Tuesday | D417: 2 | E417: 4pm-5pm | F417: 8 | G417: 1 | H417: 3 | I417: 2 | J417: =RC[-1]/RC[-2] -> 0.66666666666666663
A418: 210 | B418: 1 | C418: Wednesday | D418: 3 | E418: 9am-10am | F418: 1 | G418: 1 | H418: 3 | I418: 1 | J418: =RC[-1]/RC[-2] -> 0.33333333333333331
A419: 210 | B419: 1 | C419: Wednesday | D419: 3 | E419: 10am-11am | F419: 2 | G419: 1 | H419: 3 | I419: 5 | J419: =RC[-1]/RC[-2] -> 1.6666666666666667
A420: 210 | B420: 1 | C420: Wednesday | D420: 3 | E420: 11am-12pm | F420: 3 | G420: 2 | H420: 3 | I420: 0 | J420: =RC[-1]/RC[-2] -> 0
A421: 210 | B421: 1 | C421: Wednesday | D421: 3 | E421: 12pm-1pm | F421: 4 | G421: 2 | H421: 3 | I421: 0 | J421: =RC[-1]/RC[-2] -> 0
A422: 210 | B422: 1 | C422: Wednesday | D422: 3 | E422: 1pm-2pm | F422: 5 | G422: 2 | H422: 3 | I422: 0 | J422: =RC[-1]/RC[-2] -> 0
A423: 210 | B423: 1 | C423: Wednesday | D423: 3 | E423: 2pm-3pm | F423: 6 | G423: 2 | H423: 3 | I423: 0 | J423: =RC[-1]/RC[-2] -> 0
A424: 210 | B424: 1 | C424: Wednesday | D424: 3 | E424: 3pm-4pm | F424: 7 | G424: 2 | H424: 3 | I424: 0 | J424: =RC[-1]/RC[-2] -> 0
A425: 210 | B425: 1 | C425: Wednesday | D425: 3 | E425: 4pm-5pm | F425: 8 | G425: 2 | H425: 3 | I425: 0 | J425: =RC[-1]/RC[-2] -> 0
A426: 210 | B426: 1 | C426: Thursday | D426: 4 | E426: 9am-10am | F426: 1 | G426: 2 | H426: 3 | I426: 0 | J426: =RC[-1]/RC[-2] -> 0
A427: 210 | B427: 1 | C427: Thursday | D427: 4 | E427: 10am-11am | F427: 2 | G427: 2 | H427: 3 | I427: 0 | J427: =RC[-1]/RC[-2] -> 0
A428: 210 | B428: 1 | C428: Thursday | D428: 4 | E428: 11am-12pm | F428: 3 | G428: 2 | H428: 3 | I428: 0 | J428: =RC[-1]/RC[-2] -> 0
A429: 210 | B429: 1 | C429: Thursday | D429: 4 | E429: 12pm-1pm | F429: 4 | G429: 2 | H429: 3 | I429: 0 | J429: =RC[-1]/RC[-2] -> 0
A430: 210 | B430: 1 | C430: Thursday | D430: 4 | E430: 1pm-2pm | F430: 5 | G430: 2 | H430: 3 | I430: 0 | J430: =RC[-1]/RC[-2] -> 0
A431: 210 | B431: 1 | C431: Thursday | D431: 4 | E431: 2pm-3pm | F431: 6 | G431: 2 | H431: 3 | I431: 0 | J431: =RC[-1]/RC[-2] -> 0
A432: 210 | B432: 1 | C432: Thursday | D432: 4 | E432: 3pm-4pm | F432: 7 | G432: 2 | H432: 3 | I432: 0 | J432: =RC[-1]/RC[-2] -> 0
A433: 210 | B433: 1 | C433: Thursday | D433: 4 | E433: 4pm-5pm | F433: 8 | G433: 2 | H433: 3 | I433: 0 | J433: =RC[-1]/RC[-2] -> 0
A434: 210 | B434: 1 | C434: Friday | D434: 5 | E434: 9am-10am | F434: 1 | G434: 2 | H434: 3 | I434: 0 | J434: =RC[-1]/RC[-2] -> 0
A435: 210 | B435: 1 | C435: Friday | D435: 5 | E435: 10am-11am | F435: 2 | G435: 2 | H435: 3 | I435: 0 | J435: =RC[-1]/RC[-2] -> 0
A436: 210 | B436: 1 | C436: Friday | D436: 5 | E436: 11am-12pm | F436: 3 | G436: 2 | H436: 3 | I436: 0 | J436: =RC[-1]/RC[-2] -> 0
A437: 210 | B437: 1 | C437: Friday | D437: 5 | E437: 12pm-1pm | F437: 4 | G437: 2 | H437: 3 | I437: 0 | J437: =RC[-1]/RC[-2] -> 0
A438: 210 | B438: 1 | C438: Friday | D438: 5 | E438: 1pm-2pm | F438: 5 | G438: 2 | H438: 3 | I438: 0 | J438: =RC[-1]/RC[-2] -> 0
A439: 210 | B439: 1 | C439: Friday | D439: 5 | E439: 2pm-3pm | F439: 6 | G439: 2 | H439: 3 | I439: 0 | J439: =RC[-1]/RC[-2] -> 0
A440: 210 | B440: 1 | C440: Friday | D440: 5 | E440: 3pm-4pm | F440: 7 | G440: 1 | H440: 3 | I440: 4 | J440: =RC[-1]/RC[-2] -> 1.3333333333333333
A441: 210 | B441: 1 | C441: Friday | D441: 5 | E441: 4pm-5pm | F441: 8 | G441: 1 | H441: 3 | I441: 1 | J441: =RC[-1]/RC[-2] -> 0.33333333333333331
A442: 211 | B442: 1 | C442: Monday | D442: 1 | E442: 9am-10am | F442: 1 | G442: 1 | H442: 34 | I442: 14 | J442: =RC[-1]/RC[-2] -> 0.41176470588235292
A443: 211 | B443: 1 | C443: Monday | D443: 1 | E443: 10am-11am | F443: 2 | G443: 1 | H443: 34 | I443: 10 | J443: =RC[-1]/RC[-2] -> 0.29411764705882354
A444: 211 | B444: 1 | C444: Monday | D444: 1 | E444: 11am-12pm | F444: 3 | G444: 1 | H444: 34 | I444: 14 | J444: =RC[-1]/RC[-2] -> 0.41176470588235292
A445: 211 | B445: 1 | C445: Monday | D445: 1 | E445: 12pm-1pm | F445: 4 | G445: 2 | H445: 34 | I445: 0 | J445: =RC[-1]/RC[-2] -> 0
A446: 211 | B446: 1 | C446: Monday | D446: 1 | E446: 1pm-2pm | F446: 5 | G446: 2 | H446: 34 | I446: 0 | J446: =RC[-1]/RC[-2] -> 0
A447: 211 | B447: 1 | C447: Monday | D447: 1 | E447: 2pm-3pm | F447: 6 | G447: 3 | H447: 34 | I447: 1 | J447: =RC[-1]/RC[-2] -> 2.9411764705882353E-2
A448: 211 | B448: 1 | C448: Monday | D448: 1 | E448: 3pm-4pm | F448: 7 | G448: 3 | H448: 34 | I448: 2 | J448: =RC[-1]/RC[-2] -> 5.8823529411764705E-2
A449: 211 | B449: 1 | C449: Monday | D449: 1 | E449: 4pm-5pm | F449: 8 | G449: 2 | H449: 34 | I449: 0 | J449: =RC[-1]/RC[-2] -> 0
A450: 211 | B450: 1 | C450: Tuesday | D450: 2 | E450: 9am-10am | F450: 1 | G450: 1 | H450: 34 | I450: 26 | J450: =RC[-1]/RC[-2] -> 0.76470588235294112
A451: 211 | B451: 1 | C451: Tuesday | D451: 2 | E451: 10am-11am | F451: 2 | G451: 1 | H451: 34 | I451: 2 | J451: =RC[-1]/RC[-2] -> 5.8823529411764705E-2
A452: 211 | B452: 1 | C452: Tuesday | D452: 2 | E452: 11am-12pm | F452: 3 | G452: 1 | H452: 34 | I452: 20 | J452: =RC[-1]/RC[-2] -> 0.58823529411764708
A453: 211 | B453: 1 | C453: Tuesday | D453: 2 | E453: 12pm-1pm | F453: 4 | G453: 2 | H453: 34 | I453: 0 | J453: =RC[-1]/RC[-2] -> 0
A454: 211 | B454: 1 | C454: Tuesday | D454: 2 | E454: 1pm-2pm | F454: 5 | G454: 2 | H454: 34 | I454: 0 | J454: =RC[-1]/RC[-2] -> 0
A455: 211 | B455: 1 | C455: Tuesday | D455: 2 | E455: 2pm-3pm | F455: 6 | G455: 1 | H455: 34 | I455: 20 | J455: =RC[-1]/RC[-2] -> 0.58823529411764708
A456: 211 | B456: 1 | C456: Tuesday | D456: 2 | E456: 3pm-4pm | F456: 7 | G456: 1 | H456: 34 | I456: 30 | J456: =RC[-1]/RC[-2] -> 0.88235294117647056
A457: 211 | B457: 1 | C457: Tuesday | D457: 2 | E457: 4pm-5pm | F457: 8 | G457: 1 | H457: 34 | I457: 30 | J457: =RC[-1]/RC[-2] -> 0.88235294117647056
A458: 211 | B458: 1 | C458: Wednesday | D458: 3 | E458: 9am-10am | F458: 1 | G458: 1 | H458: 34 | I458: 35 | J458: =RC[-1]/RC[-2] -> 1.0294117647058822
A459: 211 | B459: 1 | C459: Wednesday | D459: 3 | E459: 10am-11am | F459: 2 | G459: 1 | H459: 34 | I459: 23 | J459: =RC[-1]/RC[-2] -> 0.67647058823529416
A460: 211 | B460: 1 | C460: Wednesday | D460: 3 | E460: 11am-12pm | F460: 3 | G460: 1 | H460: 34 | I460: 25 | J460: =RC[-1]/RC[-2] -> 0.73529411764705888
A461: 211 | B461: 1 | C461: Wednesday | D461: 3 | E461: 12pm-1pm | F461: 4 | G461: 1 | H461: 34 | I461: 4 | J461: =RC[-1]/RC[-2] -> 0.11764705882352941
A462: 211 | B462: 1 | C462: Wednesday | D462: 3 | E462: 1pm-2pm | F462: 5 | G462: 3 | H462: 34 | I462: 1 | J462: =RC[-1]/RC[-2] -> 2.9411764705882353E-2
A463: 211 | B463: 1 | C463: Wednesday | D463: 3 | E463: 2pm-3pm | F463: 6 | G463: 1 | H463: 34 | I463: 1 | J463: =RC[-1]/RC[-2] -> 2.9411764705882353E-2
A464: 211 | B464: 1 | C464: Wednesday | D464: 3 | E464: 3pm-4pm | F464: 7 | G464: 1 | H464: 34 | I464: 20 | J464: =RC[-1]/RC[-2] -> 0.58823529411764708
A465: 211 | B465: 1 | C465: Wednesday | D465: 3 | E465: 4pm-5pm | F465: 8 | G465: 1 | H465: 34 | I465: 20 | J465: =RC[-1]/RC[-2] -> 0.58823529411764708
A466: 211 | B466: 1 | C466: Thursday | D466: 4 | E466: 9am-10am | F466: 1 | G466: 1 | H466: 34 | I466: 1 | J466: =RC[-1]/RC[-2] -> 2.9411764705882353E-2
A467: 211 | B467: 1 | C467: Thursday | D467: 4 | E467: 10am-11am | F467: 2 | G467: 1 | H467: 34 | I467: 9 | J467: =RC[-1]/RC[-2] -> 0.26470588235294118
A468: 211 | B468: 1 | C468: Thursday | D468: 4 | E468: 11am-12pm | F468: 3 | G468: 1 | H468: 34 | I468: 12 | J468: =RC[-1]/RC[-2] -> 0.35294117647058826
A469: 211 | B469: 1 | C469: Thursday | D469: 4 | E469: 12pm-1pm | F469: 4 | G469: 1 | H469: 34 | I469: 8 | J469: =RC[-1]/RC[-2] -> 0.23529411764705882
A470: 211 | B470: 1 | C470: Thursday | D470: 4 | E470: 1pm-2pm | F470: 5 | G470: 1 | H470: 34 | I470: 2 | J470: =RC[-1]/RC[-2] -> 5.8823529411764705E-2
A471: 211 | B471: 1 | C471: Thursday | D471: 4 | E471: 2pm-3pm | F471: 6 | G471: 3 | H471: 34 | I471: 1 | J471: =RC[-1]/RC[-2] -> 2.9411764705882353E-2
A472: 211 | B472: 1 | C472: Thursday | D472: 4 | E472: 3pm-4pm | F472: 7 | G472: 3 | H472: 34 | I472: 1 | J472: =RC[-1]/RC[-2] -> 2.9411764705882353E-2
A473: 211 | B473: 1 | C473: Thursday | D473: 4 | E473: 4pm-5pm | F473: 8 | G473: 2 | H473: 34 | I473: 0 | J473: =RC[-1]/RC[-2] -> 0
A474: 211 | B474: 1 | C474: Friday | D474: 5 | E474: 9am-10am | F474: 1 | G474: 3 | H474: 34 | I474: 2 | J474: =RC[-1]/RC[-2] -> 5.8823529411764705E-2
A475: 211 | B475: 1 | C475: Friday | D475: 5 | E475: 10am-11am | F475: 2 | G475: 2 | H475: 34 | I475: 0 | J475: =RC[-1]/RC[-2] -> 0
A476: 211 | B476: 1 | C476: Friday | D476: 5 | E476: 11am-12pm | F476: 3 | G476: 2 | H476: 34 | I476: 0 | J476: =RC[-1]/RC[-2] -> 0
A477: 211 | B477: 1 | C477: Friday | D477: 5 | E477: 12pm-1pm | F477: 4 | G477: 2 | H477: 34 | I477: 0 | J477: =RC[-1]/RC[-2] -> 0
A478: 211 | B478: 1 | C478: Friday | D478: 5 | E478: 1pm-2pm | F478: 5 | G478: 2 | H478: 34 | I478: 0 | J478: =RC[-1]/RC[-2] -> 0
A479: 211 | B479: 1 | C479: Friday | D479: 5 | E479: 2pm-3pm | F479: 6 | G479: 2 | H479: 34 | I479: 0 | J479: =RC[-1]/RC[-2] -> 0
A480: 211 | B480: 1 | C480: Friday | D480: 5 | E480: 3pm-4pm | F480: 7 | G480: 2 | H480: 34 | I480: 0 | J480: =RC[-1]/RC[-2] -> 0
A481: 211 | B481: 1 | C481: Friday | D481: 5 | E481: 4pm-5pm | F481: 8 | G481: 2 | H481: 34 | I481: 0 | J481: =RC[-1]/RC[-2] -> 0
A482: 217 | B482: 1 | C482: Monday | D482: 1 | E482: 9am-10am | F482: 1 | G482: 2 | H482: 4 | I482: 0 | J482: =RC[-1]/RC[-2] -> 0
A483: 217 | B483: 1 | C483: Monday | D483: 1 | E483: 10am-11am | F483: 2 | G483: 2 | H483: 4 | I483: 0 | J483: =RC[-1]/RC[-2] -> 0
A484: 217 | B484: 1 | C484: Monday | D484: 1 | E484: 11am-12pm | F484: 3 | G484: 2 | H484: 4 | I484: 0 | J484: =RC[-1]/RC[-2] -> 0
A485: 217 | B485: 1 | C485: Monday | D485: 1 | E485: 12pm-1pm | F485: 4 | G485: 2 | H485: 4 | I485: 0 | J485: =RC[-1]/RC[-2] -> 0
A486: 217 | B486: 1 | C486: Monday | D486: 1 | E486: 1pm-2pm | F486: 5 | G486: 2 | H486: 4 | I486: 0 | J486: =RC[-1]/RC[-2] -> 0
A487: 217 | B487: 1 | C487: Monday | D487: 1 | E487: 2pm-3pm | F487: 6 | G487: 2 | H487: 4 | I487: 0 | J487: =RC[-1]/RC[-2] -> 0
A488: 217 | B488: 1 | C488: Monday | D488: 1 | E488: 3pm-4pm | F488: 7 | G488: 2 | H488: 4 | I488: 0 | J488: =RC[-1]/RC[-2] -> 0
A489: 217 | B489: 1 | C489: Monday | D489: 1 | E489: 4pm-5pm | F489: 8 | G489: 2 | H489: 4 | I489: 0 | J489: =RC[-1]/RC[-2] -> 0
A490: 217 | B490: 1 | C490: Tuesday | D490: 2 | E490: 9am-10am | F490: 1 | G490: 2 | H490: 4 | I490: 0 | J490: =RC[-1]/RC[-2] -> 0
A491: 217 | B491: 1 | C491: Tuesday | D491: 2 | E491: 10am-11am | F491: 2 | G491: 2 | H491: 4 | I491: 0 | J491: =RC[-1]/RC[-2] -> 0
A492: 217 | B492: 1 | C492: Tuesday | D492: 2 | E492: 11am-12pm | F492: 3 | G492: 2 | H492: 4 | I492: 0 | J492: =RC[-1]/RC[-2] -> 0
A493: 217 | B493: 1 | C493: Tuesday | D493: 2 | E493: 12pm-1pm | F493: 4 | G493: 2 | H493: 4 | I493: 0 | J493: =RC[-1]/RC[-2] -> 0
A494: 217 | B494: 1 | C494: Tuesday | D494: 2 | E494: 1pm-2pm | F494: 5 | G494: 2 | H494: 4 | I494: 0 | J494: =RC[-1]/RC[-2] -> 0
A495: 217 | B495: 1 | C495: Tuesday | D495: 2 | E495: 2pm-3pm | F495: 6 | G495: 2 | H495: 4 | I495: 0 | J495: =RC[-1]/RC[-2] -> 0
A496: 217 | B496: 1 | C496: Tuesday | D496: 2 | E496: 3pm-4pm | F496: 7 | G496: 2 | H496: 4 | I496: 0 | J496: =RC[-1]/RC[-2] -> 0
A497: 217 | B497: 1 | C497: Tuesday | D497: 2 | E497: 4pm-5pm | F497: 8 | G497: 2 | H497: 4 | I497: 0 | J497: =RC[-1]/RC[-2] -> 0
A498: 217 | B498: 1 | C498: Wednesday | D498: 3 | E498: 9am-10am | F498: 1 | G498: 2 | H498: 4 | I498: 0 | J498: =RC[-1]/RC[-2] -> 0
A499: 217 | B499: 1 | C499: Wednesday | D499: 3 | E499: 10am-11am | F499: 2 | G499: 2 | H499: 4 | I499: 0 | J499: =RC[-1]/RC[-2] -> 0
A500: 217 | B500: 1 | C500: Wednesday | D500: 3 | E500: 11am-12pm | F500: 3 | G500: 2 | H500: 4 | I500: 0 | J500: =RC[-1]/RC[-2] -> 0
A501: 217 | B501: 1 | C501: Wednesday | D501: 3 | E501: 12pm-1pm | F501: 4 | G501: 2 | H501: 4 | I501: 0 | J501: =RC[-1]/RC[-2] -> 0
A502: 217 | B502: 1 | C502: Wednesday | D502: 3 | E502: 1pm-2pm | F502: 5 | G502: 2 | H502: 4 | I502: 0 | J502: =RC[-1]/RC[-2] -> 0
A503: 217 | B503: 1 | C503: Wednesday | D503: 3 | E503: 2pm-3pm | F503: 6 | G503: 2 | H503: 4 | I503: 0 | J503: =RC[-1]/RC[-2] -> 0
A504: 217 | B504: 1 | C504: Wednesday | D504: 3 | E504: 3pm-4pm | F504: 7 | G504: 2 | H504: 4 | I504: 0 | J504: =RC[-1]/RC[-2] -> 0
A505: 217 | B505: 1 | C505: Wednesday | D505: 3 | E505: 4pm-5pm | F505: 8 | G505: 2 | H505: 4 | I505: 0 | J505: =RC[-1]/RC[-2] -> 0
A506: 217 | B506: 1 | C506: Thursday | D506: 4 | E506: 9am-10am | F506: 1 | G506: 2 | H506: 4 | I506: 0 | J506: =RC[-1]/RC[-2] -> 0
A507: 217 | B507: 1 | C507: Thursday | D507: 4 | E507: 10am-11am | F507: 2 | G507: 2 | H507: 4 | I507: 0 | J507: =RC[-1]/RC[-2] -> 0
A508: 217 | B508: 1 | C508: Thursday | D508: 4 | E508: 11am-12pm | F508: 3 | G508: 2 | H508: 4 | I508: 0 | J508: =RC[-1]/RC[-2] -> 0
A509: 217 | B509: 1 | C509: Thursday | D509: 4 | E509: 12pm-1pm | F509: 4 | G509: 2 | H509: 4 | I509: 0 | J509: =RC[-1]/RC[-2] -> 0
A510: 217 | B510: 1 | C510: Thursday | D510: 4 | E510: 1pm-2pm | F510: 5 | G510: 2 | H510: 4 | I510: 0 | J510: =RC[-1]/RC[-2] -> 0
A511: 217 | B511: 1 | C511: Thursday | D511: 4 | E511: 2pm-3pm | F511: 6 | G511: 2 | H511: 4 | I511: 0 | J511: =RC[-1]/RC[-2] -> 0
A512: 217 | B512: 1 | C512: Thursday | D512: 4 | E512: 3pm-4pm | F512: 7 | G512: 2 | H512: 4 | I512: 0 | J512: =RC[-1]/RC[-2] -> 0
A513: 217 | B513: 1 | C513: Thursday | D513: 4 | E513: 4pm-5pm | F513: 8 | G513: 2 | H513: 4 | I513: 0 | J513: =RC[-1]/RC[-2] -> 0
A514: 217 | B514: 1 | C514: Friday | D514: 5 | E514: 9am-10am | F514: 1 | G514: 2 | H514: 4 | I514: 0 | J514: =RC[-1]/RC[-2] -> 0
A515: 217 | B515: 1 | C515: Friday | D515: 5 | E515: 10am-11am | F515: 2 | G515: 2 | H515: 4 | I515: 0 | J515: =RC[-1]/RC[-2] -> 0
A516: 217 | B516: 1 | C516: Friday | D516: 5 | E516: 11am-12pm | F516: 3 | G516: 2 | H516: 4 | I516: 0 | J516: =RC[-1]/RC[-2] -> 0
A517: 217 | B517: 1 | C517: Friday | D517: 5 | E517: 12pm-1pm | F517: 4 | G517: 2 | H517: 4 | I517: 0 | J517: =RC[-1]/RC[-2] -> 0
A518: 217 | B518: 1 | C518: Friday | D518: 5 | E518: 1pm-2pm | F518: 5 | G518: 2 | H518: 4 | I518: 0 | J518: =RC[-1]/RC[-2] -> 0
A519: 217 | B519: 1 | C519: Friday | D519: 5 | E519: 2pm-3pm | F519: 6 | G519: 2 | H519: 4 | I519: 0 | J519: =RC[-1]/RC[-2] -> 0
A520: 217 | B520: 1 | C520: Friday | D520: 5 | E520: 3pm-4pm | F520: 7 | G520: 2 | H520: 4 | I520: 0 | J520: =RC[-1]/RC[-2] -> 0
A521: 217 | B521: 1 | C521: Friday | D521: 5 | E521: 4pm-5pm | F521: 8 | G521: 2 | H521: 4 | I521: 0 | J521: =RC[-1]/RC[-2] -> 0
A522: 217A | B522: 1 | C522: Monday | D522: 1 | E522: 9am-10am | F522: 1 | G522: 2 | H522: 4 | I522: 0 | J522: =RC[-1]/RC[-2] -> 0
A523: 217A | B523: 1 | C523: Monday | D523: 1 | E523: 10am-11am | F523: 2 | G523: 2 | H523: 4 | I523: 0 | J523: =RC[-1]/RC[-2] -> 0
A524: 217A | B524: 1 | C524: Monday | D524: 1 | E524: 11am-12pm | F524: 3 | G524: 2 | H524: 4 | I524: 0 | J524: =RC[-1]/RC[-2] -> 0
A525: 217A | B525: 1 | C525: Monday | D525: 1 | E525: 12pm-1pm | F525: 4 | G525: 2 | H525: 4 | I525: 0 | J525: =RC[-1]/RC[-2] -> 0
A526: 217A | B526: 1 | C526: Monday | D526: 1 | E526: 1pm-2pm | F526: 5 | G526: 2 | H526: 4 | I526: 0 | J526: =RC[-1]/RC[-2] -> 0
A527: 217A | B527: 1 | C527: Monday | D527: 1 | E527: 2pm-3pm | F527: 6 | G527: 2 | H527: 4 | I527: 0 | J527: =RC[-1]/RC[-2] -> 0
A528: 217A | B528: 1 | C528: Monday | D528: 1 | E528: 3pm-4pm | F528: 7 | G528: 2 | H528: 4 | I528: 0 | J528: =RC[-1]/RC[-2] -> 0
A529: 217A | B529: 1 | C529: Monday | D529: 1 | E529: 4pm-5pm | F529: 8 | G529: 2 | H529: 4 | I529: 0 | J529: =RC[-1]/RC[-2] -> 0
A530: 217A | B530: 1 | C530: Tuesday | D530: 2 | E530: 9am-10am | F530: 1 | G530: 2 | H530: 4 | I530: 0 | J530: =RC[-1]/RC[-2] -> 0
A531: 217A | B531: 1 | C531: Tuesday | D531: 2 | E531: 10am-11am | F531: 2 | G531: 2 | H531: 4 | I531: 0 | J531: =RC[-1]/RC[-2] -> 0
A532: 217A | B532: 1 | C532: Tuesday | D532: 2 | E532: 11am-12pm | F532: 3 | G532: 2 | H532: 4 | I532: 0 | J532: =RC[-1]/RC[-2] -> 0
A533: 217A | B533: 1 | C533: Tuesday | D533: 2 | E533: 12pm-1pm | F533: 4 | G533: 2 | H533: 4 | I533: 0 | J533: =RC[-1]/RC[-2] -> 0
A534: 217A | B534: 1 | C534: Tuesday | D534: 2 | E534: 1pm-2pm | F534: 5 | G534: 2 | H534: 4 | I534: 0 | J534: =RC[-1]/RC[-2] -> 0
A535: 217A | B535: 1 | C535: Tuesday | D535: 2 | E535: 2pm-3pm | F535: 6 | G535: 2 | H535: 4 | I535: 0 | J535: =RC[-1]/RC[-2] -> 0
A536: 217A | B536: 1 | C536: Tuesday | D536: 2 | E536: 3pm-4pm | F536: 7 | G536: 2 | H536: 4 | I536: 0 | J536: =RC[-1]/RC[-2] -> 0
A537: 217A | B537: 1 | C537: Tuesday | D537: 2 | E537: 4pm-5pm | F537: 8 | G537: 2 | H537: 4 | I537: 0 | J537: =RC[-1]/RC[-2] -> 0
A538: 217A | B538: 1 | C538: Wednesday | D538: 3 | E538: 9am-10am | F538: 1 | G538: 2 | H538: 4 | I538: 0 | J538: =RC[-1]/RC[-2] -> 0
A539: 217A | B539: 1 | C539: Wednesday | D539: 3 | E539: 10am-11am | F539: 2 | G539: 2 | H539: 4 | I539: 0 | J539: =RC[-1]/RC[-2] -> 0
A540: 217A | B540: 1 | C540: Wednesday | D540: 3 | E540: 11am-12pm | F540: 3 | G540: 2 | H540: 4 | I540: 0 | J540: =RC[-1]/RC[-2] -> 0
A541: 217A | B541: 1 | C541: Wednesday | D541: 3 | E541: 12pm-1pm | F541: 4 | G541: 2 | H541: 4 | I541: 0 | J541: =RC[-1]/RC[-2] -> 0
A542: 217A | B542: 1 | C542: Wednesday | D542: 3 | E542: 1pm-2pm | F542: 5 | G542: 2 | H542: 4 | I542: 0 | J542: =RC[-1]/RC[-2] -> 0
A543: 217A | B543: 1 | C543: Wednesday | D543: 3 | E543: 2pm-3pm | F543: 6 | G543: 2 | H543: 4 | I543: 0 | J543: =RC[-1]/RC[-2] -> 0
A544: 217A | B544: 1 | C544: Wednesday | D544: 3 | E544: 3pm-4pm | F544: 7 | G544: 2 | H544: 4 | I544: 0 | J544: =RC[-1]/RC[-2] -> 0
A545: 217A | B545: 1 | C545: Wednesday | D545: 3 | E545: 4pm-5pm | F545: 8 | G545: 2 | H545: 4 | I545: 0 | J545: =RC[-1]/RC[-2] -> 0
A546: 217A | B546: 1 | C546: Thursday | D546: 4 | E546: 9am-10am | F546: 1 | G546: 2 | H546: 4 | I546: 0 | J546: =RC[-1]/RC[-2] -> 0
A547: 217A | B547: 1 | C547: Thursday | D547: 4 | E547: 10am-11am | F547: 2 | G547: 2 | H547: 4 | I547: 0 | J547: =RC[-1]/RC[-2] -> 0
A548: 217A | B548: 1 | C548: Thursday | D548: 4 | E548: 11am-12pm | F548: 3 | G548: 2 | H548: 4 | I548: 0 | J548: =RC[-1]/RC[-2] -> 0
A549: 217A | B549: 1 | C549: Thursday | D549: 4 | E549: 12pm-1pm | F549: 4 | G549: 2 | H549: 4 | I549: 0 | J549: =RC[-1]/RC[-2] -> 0
A550: 217A | B550: 1 | C550: Thursday | D550: 4 | E550: 1pm-2pm | F550: 5 | G550: 2 | H550: 4 | I550: 0 | J550: =RC[-1]/RC[-2] -> 0
A551: 217A | B551: 1 | C551: Thursday | D551: 4 | E551: 2pm-3pm | F551: 6 | G551: 2 | H551: 4 | I551: 0 | J551: =RC[-1]/RC[-2] -> 0
A552: 217A | B552: 1 | C552: Thursday | D552: 4 | E552: 3pm-4pm | F552: 7 | G552: 2 | H552: 4 | I552: 0 | J552: =RC[-1]/RC[-2] -> 0
A553: 217A | B553: 1 | C553: Thursday | D553: 4 | E553: 4pm-5pm | F553: 8 | G553: 2 | H553: 4 | I553: 0 | J553: =RC[-1]/RC[-2] -> 0
A554: 217A | B554: 1 | C554: Friday | D554: 5 | E554: 9am-10am | F554: 1 | G554: 2 | H554: 4 | I554: 0 | J554: =RC[-1]/RC[-2] -> 0
A555: 217A | B555: 1 | C555: Friday | D555: 5 | E555: 10am-11am | F555: 2 | G555: 2 | H555: 4 | I555: 0 | J555: =RC[-1]/RC[-2] -> 0
A556: 217A | B556: 1 | C556: Friday | D556: 5 | E556: 11am-12pm | F556: 3 | G556: 2 | H556: 4 | I556: 0 | J556: =RC[-1]/RC[-2] -> 0
A557: 217A | B557: 1 | C557: Friday | D557: 5 | E557: 12pm-1pm | F557: 4 | G557: 2 | H557: 4 | I557: 0 | J557: =RC[-1]/RC[-2] -> 0
A558: 217A | B558: 1 | C558: Friday | D558: 5 | E558: 1pm-2pm | F558: 5 | G558: 2 | H558: 4 | I558: 0 | J558: =RC[-1]/RC[-2] -> 0
A559: 217A | B559: 1 | C559: Friday | D559: 5 | E559: 2pm-3pm | F559: 6 | G559: 2 | H559: 4 | I559: 0 | J559: =RC[-1]/RC[-2] -> 0
A560: 217A | B560: 1 | C560: Friday | D560: 5 | E560: 3pm-4pm | F560: 7 | G560: 2 | H560: 4 | I560: 0 | J560: =RC[-1]/RC[-2] -> 0
A561: 217A | B561: 1 | C561: Friday | D561: 5 | E561: 4pm-5pm | F561: 8 | G561: 2 | H561: 4 | I561: 0 | J561: =RC[-1]/RC[-2] -> 0
A562: 219 | B562: 1 | C562: Monday | D562: 1 | E562: 9am-10am | F562: 1 | G562: 1 | H562: 34 | I562: 15 | J562: =RC[-1]/RC[-2] -> 0.44117647058823528
A563: 219 | B563: 1 | C563: Monday | D563: 1 | E563: 10am-11am | F563: 2 | G563: 1 | H563: 34 | I563: 16 | J563: =RC[-1]/RC[-2] -> 0.47058823529411764
A564: 219 | B564: 1 | C564: Monday | D564: 1 | E564: 11am-12pm | F564: 3 | G564: 1 | H564: 34 | I564: 16 | J564: =RC[-1]/RC[-2] -> 0.47058823529411764
A565: 219 | B565: 1 | C565: Monday | D565: 1 | E565: 12pm-1pm | F565: 4 | G565: 2 | H565: 34 | I565: 0 | J565: =RC[-1]/RC[-2] -> 0
A566: 219 | B566: 1 | C566: Monday | D566: 1 | E566: 1pm-2pm | F566: 5 | G566: 2 | H566: 34 | I566: 0 | J566: =RC[-1]/RC[-2] -> 0
A567: 219 | B567: 1 | C567: Monday | D567: 1 | E567: 2pm-3pm | F567: 6 | G567: 1 | H567: 34 | I567: 10 | J567: =RC[-1]/RC[-2] -> 0.29411764705882354
A568: 219 | B568: 1 | C568: Monday | D568: 1 | E568: 3pm-4pm | F568: 7 | G568: 1 | H568: 34 | I568: 15 | J568: =RC[-1]/RC[-2] -> 0.44117647058823528
A569: 219 | B569: 1 | C569: Monday | D569: 1 | E569: 4pm-5pm | F569: 8 | G569: 1 | H569: 34 | I569: 9 | J569: =RC[-1]/RC[-2] -> 0.26470588235294118
A570: 219 | B570: 1 | C570: Tuesday | D570: 2 | E570: 9am-10am | F570: 1 | G570: 2 | H570: 34 | I570: 0 | J570: =RC[-1]/RC[-2] -> 0
A571: 219 | B571: 1 | C571: Tuesday | D571: 2 | E571: 10am-11am | F571: 2 | G571: 2 | H571: 34 | I571: 0 | J571: =RC[-1]/RC[-2] -> 0
A572: 219 | B572: 1 | C572: Tuesday | D572: 2 | E572: 11am-12pm | F572: 3 | G572: 2 | H572: 34 | I572: 0 | J572: =RC[-1]/RC[-2] -> 0
A573: 219 | B573: 1 | C573: Tuesday | D573: 2 | E573: 12pm-1pm | F573: 4 | G573: 2 | H573: 34 | I573: 0 | J573: =RC[-1]/RC[-2] -> 0
A574: 219 | B574: 1 | C574: Tuesday | D574: 2 | E574: 1pm-2pm | F574: 5 | G574: 2 | H574: 34 | I574: 0 | J574: =RC[-1]/RC[-2] -> 0
A575: 219 | B575: 1 | C575: Tuesday | D575: 2 | E575: 2pm-3pm | F575: 6 | G575: 1 | H575: 34 | I575: 30 | J575: =RC[-1]/RC[-2] -> 0.88235294117647056
A576: 219 | B576: 1 | C576: Tuesday | D576: 2 | E576: 3pm-4pm | F576: 7 | G576: 1 | H576: 34 | I576: 30 | J576: =RC[-1]/RC[-2] -> 0.88235294117647056
A577: 219 | B577: 1 | C577: Tuesday | D577: 2 | E577: 4pm-5pm | F577: 8 | G577: 1 | H577: 34 | I577: 30 | J577: =RC[-1]/RC[-2] -> 0.88235294117647056
A578: 219 | B578: 1 | C578: Wednesday | D578: 3 | E578: 9am-10am | F578: 1 | G578: 2 | H578: 34 | I578: 0 | J578: =RC[-1]/RC[-2] -> 0
A579: 219 | B579: 1 | C579: Wednesday | D579: 3 | E579: 10am-11am | F579: 2 | G579: 1 | H579: 34 | I579: 24 | J579: =RC[-1]/RC[-2] -> 0.70588235294117652
A580: 219 | B580: 1 | C580: Wednesday | D580: 3 | E580: 11am-12pm | F580: 3 | G580: 1 | H580: 34 | I580: 22 | J580: =RC[-1]/RC[-2] -> 0.6470588235294118
A581: 219 | B581: 1 | C581: Wednesday | D581: 3 | E581: 12pm-1pm | F581: 4 | G581: 2 | H581: 34 | I581: 0 | J581: =RC[-1]/RC[-2] -> 0
A582: 219 | B582: 1 | C582: Wednesday | D582: 3 | E582: 1pm-2pm | F582: 5 | G582: 3 | H582: 34 | I582: 1 | J582: =RC[-1]/RC[-2] -> 2.9411764705882353E-2
A583: 219 | B583: 1 | C583: Wednesday | D583: 3 | E583: 2pm-3pm | F583: 6 | G583: 3 | H583: 34 | I583: 1 | J583: =RC[-1]/RC[-2] -> 2.9411764705882353E-2
A584: 219 | B584: 1 | C584: Wednesday | D584: 3 | E584: 3pm-4pm | F584: 7 | G584: 1 | H584: 34 | I584: 23 | J584: =RC[-1]/RC[-2] -> 0.67647058823529416
A585: 219 | B585: 1 | C585: Wednesday | D585: 3 | E585: 4pm-5pm | F585: 8 | G585: 1 | H585: 34 | I585: 23 | J585: =RC[-1]/RC[-2] -> 0.67647058823529416
A586: 219 | B586: 1 | C586: Thursday | D586: 4 | E586: 9am-10am | F586: 1 | G586: 3 | H586: 34 | I586: 1 | J586: =RC[-1]/RC[-2] -> 2.9411764705882353E-2
A587: 219 | B587: 1 | C587: Thursday | D587: 4 | E587: 10am-11am | F587: 2 | G587: 1 | H587: 34 | I587: 15 | J587: =RC[-1]/RC[-2] -> 0.44117647058823528
A588: 219 | B588: 1 | C588: Thursday | D588: 4 | E588: 11am-12pm | F588: 3 | G588: 1 | H588: 34 | I588: 6 | J588: =RC[-1]/RC[-2] -> 0.17647058823529413
A589: 219 | B589: 1 | C589: Thursday | D589: 4 | E589: 12pm-1pm | F589: 4 | G589: 1 | H589: 34 | I589: 1 | J589: =RC[-1]/RC[-2] -> 2.9411764705882353E-2
A590: 219 | B590: 1 | C590: Thursday | D590: 4 | E590: 1pm-2pm | F590: 5 | G590: 1 | H590: 34 | I590: 2 | J590: =RC[-1]/RC[-2] -> 5.8823529411764705E-2
A591: 219 | B591: 1 | C591: Thursday | D591: 4 | E591: 2pm-3pm | F591: 6 | G591: 2 | H591: 34 | I591: 0 | J591: =RC[-1]/RC[-2] -> 0
A592: 219 | B592: 1 | C592: Thursday | D592: 4 | E592: 3pm-4pm | F592: 7 | G592: 1 | H592: 34 | I592: 20 | J592: =RC[-1]/RC[-2] -> 0.58823529411764708
A593: 219 | B593: 1 | C593: Thursday | D593: 4 | E593: 4pm-5pm | F593: 8 | G593: 1 | H593: 34 | I593: 10 | J593: =RC[-1]/RC[-2] -> 0.29411764705882354
A594: 219 | B594: 1 | C594: Friday | D594: 5 | E594: 9am-10am | F594: 1 | G594: 2 | H594: 34 | I594: 0 | J594: =RC[-1]/RC[-2] -> 0
A595: 219 | B595: 1 | C595: Friday | D595: 5 | E595: 10am-11am | F595: 2 | G595: 3 | H595: 34 | I595: 1 | J595: =RC[-1]/RC[-2] -> 2.9411764705882353E-2
A596: 219 | B596: 1 | C596: Friday | D596: 5 | E596: 11am-12pm | F596: 3 | G596: 3 | H596: 34 | I596: 1 | J596: =RC[-1]/RC[-2] -> 2.9411764705882353E-2
A597: 219 | B597: 1 | C597: Friday | D597: 5 | E597: 12pm-1pm | F597: 4 | G597: 2 | H597: 34 | I597: 0 | J597: =RC[-1]/RC[-2] -> 0
A598: 219 | B598: 1 | C598: Friday | D598: 5 | E598: 1pm-2pm | F598: 5 | G598: 1 | H598: 34 | I598: 3 | J598: =RC[-1]/RC[-2] -> 8.8235294117647065E-2
A599: 219 | B599: 1 | C599: Friday | D599: 5 | E599: 2pm-3pm | F599: 6 | G599: 1 | H599: 34 | I599: 2 | J599: =RC[-1]/RC[-2] -> 5.8823529411764705E-2
A600: 219 | B600: 1 | C600: Friday | D600: 5 | E600: 3pm-4pm | F600: 7 | G600: 2 | H600: 34 | I600: 0 | J600: =RC[-1]/RC[-2] -> 0
A601: 219 | B601: 1 | C601: Friday | D601: 5 | E601: 4pm-5pm | F601: 8 | G601: 1 | H601: 34 | I601: 2 | J601: =RC[-1]/RC[-2] -> 5.8823529411764705E-2
A602: 220 | B602: 1 | C602: Monday | D602: 1 | E602: 9am-10am | F602: 1 | G602: 2 | H602: 6 | I602: 0 | J602: =RC[-1]/RC[-2] -> 0
A603: 220 | B603: 1 | C603: Monday | D603: 1 | E603: 10am-11am | F603: 2 | G603: 2 | H603: 6 | I603: 0 | J603: =RC[-1]/RC[-2] -> 0
A604: 220 | B604: 1 | C604: Monday | D604: 1 | E604: 11am-12pm | F604: 3 | G604: 2 | H604: 6 | I604: 0 | J604: =RC[-1]/RC[-2] -> 0
A605: 220 | B605: 1 | C605: Monday | D605: 1 | E605: 12pm-1pm | F605: 4 | G605: 2 | H605: 6 | I605: 0 | J605: =RC[-1]/RC[-2] -> 0
A606: 220 | B606: 1 | C606: Monday | D606: 1 | E606: 1pm-2pm | F606: 5 | G606: 2 | H606: 6 | I606: 0 | J606: =RC[-1]/RC[-2] -> 0
A607: 220 | B607: 1 | C607: Monday | D607: 1 | E607: 2pm-3pm | F607: 6 | G607: 2 | H607: 6 | I607: 0 | J607: =RC[-1]/RC[-2] -> 0
A608: 220 | B608: 1 | C608: Monday | D608: 1 | E608: 3pm-4pm | F608: 7 | G608: 2 | H608: 6 | I608: 0 | J608: =RC[-1]/RC[-2] -> 0
A609: 220 | B609: 1 | C609: Monday | D609: 1 | E609: 4pm-5pm | F609: 8 | G609: 2 | H609: 6 | I609: 0 | J609: =RC[-1]/RC[-2] -> 0
A610: 220 | B610: 1 | C610: Tuesday | D610: 2 | E610: 9am-10am | F610: 1 | G610: 2 | H610: 6 | I610: 0 | J610: =RC[-1]/RC[-2] -> 0
A611: 220 | B611: 1 | C611: Tuesday | D611: 2 | E611: 10am-11am | F611: 2 | G611: 2 | H611: 6 | I611: 0 | J611: =RC[-1]/RC[-2] -> 0
A612: 220 | B612: 1 | C612: Tuesday | D612: 2 | E612: 11am-12pm | F612: 3 | G612: 2 | H612: 6 | I612: 0 | J612: =RC[-1]/RC[-2] -> 0
A613: 220 | B613: 1 | C613: Tuesday | D613: 2 | E613: 12pm-1pm | F613: 4 | G613: 2 | H613: 6 | I613: 0 | J613: =RC[-1]/RC[-2] -> 0
A614: 220 | B614: 1 | C614: Tuesday | D614: 2 | E614: 1pm-2pm | F614: 5 | G614: 2 | H614: 6 | I614: 0 | J614: =RC[-1]/RC[-2] -> 0
A615: 220 | B615: 1 | C615: Tuesday | D615: 2 | E615: 2pm-3pm | F615: 6 | G615: 2 | H615: 6 | I615: 0 | J615: =RC[-1]/RC[-2] -> 0
A616: 220 | B616: 1 | C616: Tuesday | D616: 2 | E616: 3pm-4pm | F616: 7 | G616: 2 | H616: 6 | I616: 0 | J616: =RC[-1]/RC[-2] -> 0
A617: 220 | B617: 1 | C617: Tuesday | D617: 2 | E617: 4pm-5pm | F617: 8 | G617: 2 | H617: 6 | I617: 0 | J617: =RC[-1]/RC[-2] -> 0
A618: 220 | B618: 1 | C618: Wednesday | D618: 3 | E618: 9am-10am | F618: 1 | G618: 2 | H618: 6 | I618: 0 | J618: =RC[-1]/RC[-2] -> 0
A619: 220 | B619: 1 | C619: Wednesday | D619: 3 | E619: 10am-11am | F619: 2 | G619: 2 | H619: 6 | I619: 0 | J619: =RC[-1]/RC[-2] -> 0
A620: 220 | B620: 1 | C620: Wednesday | D620: 3 | E620: 11am-12pm | F620: 3 | G620: 2 | H620: 6 | I620: 0 | J620: =RC[-1]/RC[-2] -> 0
A621: 220 | B621: 1 | C621: Wednesday | D621: 3 | E621: 12pm-1pm | F621: 4 | G621: 2 | H621: 6 | I621: 0 | J621: =RC[-1]/RC[-2] -> 0
A622: 220 | B622: 1 | C622: Wednesday | D622: 3 | E622: 1pm-2pm | F622: 5 | G622: 2 | H622: 6 | I622: 0 | J622: =RC[-1]/RC[-2] -> 0
A623: 220 | B623: 1 | C623: Wednesday | D623: 3 | E623: 2pm-3pm | F623: 6 | G623: 2 | H623: 6 | I623: 0 | J623: =RC[-1]/RC[-2] -> 0
A624: 220 | B624: 1 | C624: Wednesday | D624: 3 | E624: 3pm-4pm | F624: 7 | G624: 2 | H624: 6 | I624: 0 | J624: =RC[-1]/RC[-2] -> 0
A625: 220 | B625: 1 | C625: Wednesday | D625: 3 | E625: 4pm-5pm | F625: 8 | G625: 2 | H625: 6 | I625: 0 | J625: =RC[-1]/RC[-2] -> 0
A626: 220 | B626: 1 | C626: Thursday | D626: 4 | E626: 9am-10am | F626: 1 | G626: 2 | H626: 6 | I626: 0 | J626: =RC[-1]/RC[-2] -> 0
A627: 220 | B627: 1 | C627: Thursday | D627: 4 | E627: 10am-11am | F627: 2 | G627: 2 | H627: 6 | I627: 0 | J627: =RC[-1]/RC[-2] -> 0
A628: 220 | B628: 1 | C628: Thursday | D628: 4 | E628: 11am-12pm | F628: 3 | G628: 2 | H628: 6 | I628: 0 | J628: =RC[-1]/RC[-2] -> 0
A629: 220 | B629: 1 | C629: Thursday | D629: 4 | E629: 12pm-1pm | F629: 4 | G629: 2 | H629: 6 | I629: 0 | J629: =RC[-1]/RC[-2] -> 0
A630: 220 | B630: 1 | C630: Thursday | D630: 4 | E630: 1pm-2pm | F630: 5 | G630: 2 | H630: 6 | I630: 0 | J630: =RC[-1]/RC[-2] -> 0
A631: 220 | B631: 1 | C631: Thursday | D631: 4 | E631: 2pm-3pm | F631: 6 | G631: 2 | H631: 6 | I631: 0 | J631: =RC[-1]/RC[-2] -> 0
A632: 220 | B632: 1 | C632: Thursday | D632: 4 | E632: 3pm-4pm | F632: 7 | G632: 2 | H632: 6 | I632: 0 | J632: =RC[-1]/RC[-2] -> 0
A633: 220 | B633: 1 | C633: Thursday | D633: 4 | E633: 4pm-5pm | F633: 8 | G633: 2 | H633: 6 | I633: 0 | J633: =RC[-1]/RC[-2] -> 0
A634: 220 | B634: 1 | C634: Friday | D634: 5 | E634: 9am-10am | F634: 1 | G634: 2 | H634: 6 | I634: 0 | J634: =RC[-1]/RC[-2] -> 0
A635: 220 | B635: 1 | C635: Friday | D635: 5 | E635: 10am-11am | F635: 2 | G635: 2 | H635: 6 | I635: 0 | J635: =RC[-1]/RC[-2] -> 0
A636: 220 | B636: 1 | C636: Friday | D636: 5 | E636: 11am-12pm | F636: 3 | G636: 2 | H636: 6 | I636: 0 | J636: =RC[-1]/RC[-2] -> 0
A637: 220 | B637: 1 | C637: Friday | D637: 5 | E637: 12pm-1pm | F637: 4 | G637: 2 | H637: 6 | I637: 0 | J637: =RC[-1]/RC[-2] -> 0
A638: 220 | B638: 1 | C638: Friday | D638: 5 | E638: 1pm-2pm | F638: 5 | G638: 2 | H638: 6 | I638: 0 | J638: =RC[-1]/RC[-2] -> 0
A639: 220 | B639: 1 | C639: Friday | D639: 5 | E639: 2pm-3pm | F639: 6 | G639: 2 | H639: 6 | I639: 0 | J639: =RC[-1]/RC[-2] -> 0
A640: 220 | B640: 1 | C640: Friday | D640: 5 | E640: 3pm-4pm | F640: 7 | G640: 2 | H640: 6 | I640: 0 | J640: =RC[-1]/RC[-2] -> 0
A641: 220 | B641: 1 | C641: Friday | D641: 5 | E641: 4pm-5pm | F641: 8 | G641: 2 | H641: 6 | I641: 0 | J641: =RC[-1]/RC[-2] -> 0
A642: 232 | B642: 1 | C642: Monday | D642: 1 | E642: 9am-10am | F642: 1 | G642: 2 | H642: 4 | I642: 0 | J642: =RC[-1]/RC[-2] -> 0
A643: 232 | B643: 1 | C643: Monday | D643: 1 | E643: 10am-11am | F643: 2 | G643: 2 | H643: 4 | I643: 0 | J643: =RC[-1]/RC[-2] -> 0
A644: 232 | B644: 1 | C644: Monday | D644: 1 | E644: 11am-12pm | F644: 3 | G644: 2 | H644: 4 | I644: 0 | J644: =RC[-1]/RC[-2] -> 0
A645: 232 | B645: 1 | C645: Monday | D645: 1 | E645: 12pm-1pm | F645: 4 | G645: 2 | H645: 4 | I645: 0 | J645: =RC[-1]/RC[-2] -> 0
A646: 232 | B646: 1 | C646: Monday | D646: 1 | E646: 1pm-2pm | F646: 5 | G646: 2 | H646: 4 | I646: 0 | J646: =RC[-1]/RC[-2] -> 0
A647: 232 | B647: 1 | C647: Monday | D647: 1 | E647: 2pm-3pm | F647: 6 | G647: 1 | H647: 4 | I647: 1 | J647: =RC[-1]/RC[-2] -> 0.25
A648: 232 | B648: 1 | C648: Monday | D648: 1 | E648: 3pm-4pm | F648: 7 | G648: 2 | H648: 4 | I648: 0 | J648: =RC[-1]/RC[-2] -> 0
A649: 232 | B649: 1 | C649: Monday | D649: 1 | E649: 4pm-5pm | F649: 8 | G649: 2 | H649: 4 | I649: 0 | J649: =RC[-1]/RC[-2] -> 0
A650: 232 | B650: 1 | C650: Tuesday | D650: 2 | E650: 9am-10am | F650: 1 | G650: 2 | H650: 4 | I650: 0 | J650: =RC[-1]/RC[-2] -> 0
A651: 232 | B651: 1 | C651: Tuesday | D651: 2 | E651: 10am-11am | F651: 2 | G651: 1 | H651: 4 | I651: 13 | J651: =RC[-1]/RC[-2] -> 3.25
A652: 232 | B652: 1 | C652: Tuesday | D652: 2 | E652: 11am-12pm | F652: 3 | G652: 1 | H652: 4 | I652: 2 | J652: =RC[-1]/RC[-2] -> 0.5
A653: 232 | B653: 1 | C653: Tuesday | D653: 2 | E653: 12pm-1pm | F653: 4 | G653: 2 | H653: 4 | I653: 0 | J653: =RC[-1]/RC[-2] -> 0
A654: 232 | B654: 1 | C654: Tuesday | D654: 2 | E654: 1pm-2pm | F654: 5 | G654: 2 | H654: 4 | I654: 0 | J654: =RC[-1]/RC[-2] -> 0
A655: 232 | B655: 1 | C655: Tuesday | D655: 2 | E655: 2pm-3pm | F655: 6 | G655: 2 | H655: 4 | I655: 0 | J655: =RC[-1]/RC[-2] -> 0
A656: 232 | B656: 1 | C656: Tuesday | D656: 2 | E656: 3pm-4pm | F656: 7 | G656: 2 | H656: 4 | I656: 0 | J656: =RC[-1]/RC[-2] -> 0
A657: 232 | B657: 1 | C657: Tuesday | D657: 2 | E657: 4pm-5pm | F657: 8 | G657: 2 | H657: 4 | I657: 0 | J657: =RC[-1]/RC[-2] -> 0
A658: 232 | B658: 1 | C658: Wednesday | D658: 3 | E658: 9am-10am | F658: 1 | G658: 2 | H658: 4 | I658: 0 | J658: =RC[-1]/RC[-2] -> 0
A659: 232 | B659: 1 | C659: Wednesday | D659: 3 | E659: 10am-11am | F659: 2 | G659: 2 | H659: 4 | I659: 0 | J659: =RC[-1]/RC[-2] -> 0
A660: 232 | B660: 1 | C660: Wednesday | D660: 3 | E660: 11am-12pm | F660: 3 | G660: 2 | H660: 4 | I660: 0 | J660: =RC[-1]/RC[-2] -> 0
A661: 232 | B661: 1 | C661: Wednesday | D661: 3 | E661: 12pm-1pm | F661: 4 | G661: 2 | H661: 4 | I661: 0 | J661: =RC[-1]/RC[-2] -> 0
A662: 232 | B662: 1 | C662: Wednesday | D662: 3 | E662: 1pm-2pm | F662: 5 | G662: 2 | H662: 4 | I662: 0 | J662: =RC[-1]/RC[-2] -> 0
A663: 232 | B663: 1 | C663: Wednesday | D663: 3 | E663: 2pm-3pm | F663: 6 | G663: 2 | H663: 4 | I663: 0 | J663: =RC[-1]/RC[-2] -> 0
A664: 232 | B664: 1 | C664: Wednesday | D664: 3 | E664: 3pm-4pm | F664: 7 | G664: 2 | H664: 4 | I664: 0 | J664: =RC[-1]/RC[-2] -> 0
A665: 232 | B665: 1 | C665: Wednesday | D665: 3 | E665: 4pm-5pm | F665: 8 | G665: 2 | H665: 4 | I665: 0 | J665: =RC[-1]/RC[-2] -> 0
A666: 232 | B666: 1 | C666: Thursday | D666: 4 | E666: 9am-10am | F666: 1 | G666: 2 | H666: 4 | I666: 0 | J666: =RC[-1]/RC[-2] -> 0
A667: 232 | B667: 1 | C667: Thursday | D667: 4 | E667: 10am-11am | F667: 2 | G667: 1 | H667: 4 | I667: 12 | J667: =RC[-1]/RC[-2] -> 3
A668: 232 | B668: 1 | C668: Thursday | D668: 4 | E668: 11am-12pm | F668: 3 | G668: 2 | H668: 4 | I668: 0 | J668: =RC[-1]/RC[-2] -> 0
A669: 232 | B669: 1 | C669: Thursday | D669: 4 | E669: 12pm-1pm | F669: 4 | G669: 2 | H669: 4 | I669: 0 | J669: =RC[-1]/RC[-2] -> 0
A670: 232 | B670: 1 | C670: Thursday | D670: 4 | E670: 1pm-2pm | F670: 5 | G670: 2 | H670: 4 | I670: 0 | J670: =RC[-1]/RC[-2] -> 0
A671: 232 | B671: 1 | C671: Thursday | D671: 4 | E671: 2pm-3pm | F671: 6 | G671: 2 | H671: 4 | I671: 0 | J671: =RC[-1]/RC[-2] -> 0
A672: 232 | B672: 1 | C672: Thursday | D672: 4 | E672: 3pm-4pm | F672: 7 | G672: 2 | H672: 4 | I672: 0 | J672: =RC[-1]/RC[-2] -> 0
A673: 232 | B673: 1 | C673: Thursday | D673: 4 | E673: 4pm-5pm | F673: 8 | G673: 2 | H673: 4 | I673: 0 | J673: =RC[-1]/RC[-2] -> 0
A674: 232 | B674: 1 | C674: Friday | D674: 5 | E674: 9am-10am | F674: 1 | G674: 2 | H674: 4 | I674: 0 | J674: =RC[-1]/RC[-2] -> 0
A675: 232 | B675: 1 | C675: Friday | D675: 5 | E675: 10am-11am | F675: 2 | G675: 2 | H675: 4 | I675: 0 | J675: =RC[-1]/RC[-2] -> 0
A676: 232 | B676: 1 | C676: Friday | D676: 5 | E676: 11am-12pm | F676: 3 | G676: 2 | H676: 4 | I676: 0 | J676: =RC[-1]/RC[-2] -> 0
A677: 232 | B677: 1 | C677: Friday | D677: 5 | E677: 12pm-1pm | F677: 4 | G677: 2 | H677: 4 | I677: 0 | J677: =RC[-1]/RC[-2] -> 0
A678: 232 | B678: 1 | C678: Friday | D678: 5 | E678: 1pm-2pm | F678: 5 | G678: 2 | H678: 4 | I678: 0 | J678: =RC[-1]/RC[-2] -> 0
A679: 232 | B679: 1 | C679: Friday | D679: 5 | E679: 2pm-3pm | F679: 6 | G679: 2 | H679: 4 | I679: 0 | J679: =RC[-1]/RC[-2] -> 0
A680: 232 | B680: 1 | C680: Friday | D680: 5 | E680: 3pm-4pm | F680: 7 | G680: 1 | H680: 4 | I680: 4 | J680: =RC[-1]/RC[-2] -> 1
A681: 232 | B681: 1 | C681: Friday | D681: 5 | E681: 4pm-5pm | F681: 8 | G681: 1 | H681: 4 | I681: 6 | J681: =RC[-1]/RC[-2] -> 1.5
A682: 233 | B682: 1 | C682: Monday | D682: 1 | E682: 9am-10am | F682: 1 | G682: 2 | H682: 4 | I682: 0 | J682: =RC[-1]/RC[-2] -> 0
A683: 233 | B683: 1 | C683: Monday | D683: 1 | E683: 10am-11am | F683: 2 | G683: 2 | H683: 4 | I683: 0 | J683: =RC[-1]/RC[-2] -> 0
A684: 233 | B684: 1 | C684: Monday | D684: 1 | E684: 11am-12pm | F684: 3 | G684: 2 | H684: 4 | I684: 0 | J684: =RC[-1]/RC[-2] -> 0
A685: 233 | B685: 1 | C685: Monday | D685: 1 | E685: 12pm-1pm | F685: 4 | G685: 2 | H685: 4 | I685: 0 | J685: =RC[-1]/RC[-2] -> 0
A686: 233 | B686: 1 | C686: Monday | D686: 1 | E686: 1pm-2pm | F686: 5 | G686: 2 | H686: 4 | I686: 0 | J686: =RC[-1]/RC[-2] -> 0
A687: 233 | B687: 1 | C687: Monday | D687: 1 | E687: 2pm-3pm | F687: 6 | G687: 2 | H687: 4 | I687: 0 | J687: =RC[-1]/RC[-2] -> 0
A688: 233 | B688: 1 | C688: Monday | D688: 1 | E688: 3pm-4pm | F688: 7 | G688: 2 | H688: 4 | I688: 0 | J688: =RC[-1]/RC[-2] -> 0
A689: 233 | B689: 1 | C689: Monday | D689: 1 | E689: 4pm-5pm | F689: 8 | G689: 2 | H689: 4 | I689: 0 | J689: =RC[-1]/RC[-2] -> 0
A690: 233 | B690: 1 | C690: Tuesday | D690: 2 | E690: 9am-10am | F690: 1 | G690: 1 | H690: 4 | I690: 6 | J690: =RC[-1]/RC[-2] -> 1.5
A691: 233 | B691: 1 | C691: Tuesday | D691: 2 | E691: 10am-11am | F691: 2 | G691: 1 | H691: 4 | I691: 13 | J691: =RC[-1]/RC[-2] -> 3.25
A692: 233 | B692: 1 | C692: Tuesday | D692: 2 | E692: 11am-12pm | F692: 3 | G692: 1 | H692: 4 | I692: 5 | J692: =RC[-1]/RC[-2] -> 1.25
A693: 233 | B693: 1 | C693: Tuesday | D693: 2 | E693: 12pm-1pm | F693: 4 | G693: 2 | H693: 4 | I693: 0 | J693: =RC[-1]/RC[-2] -> 0
A694: 233 | B694: 1 | C694: Tuesday | D694: 2 | E694: 1pm-2pm | F694: 5 | G694: 2 | H694: 4 | I694: 0 | J694: =RC[-1]/RC[-2] -> 0
A695: 233 | B695: 1 | C695: Tuesday | D695: 2 | E695: 2pm-3pm | F695: 6 | G695: 1 | H695: 4 | I695: 1 | J695: =RC[-1]/RC[-2] -> 0.25
A696: 233 | B696: 1 | C696: Tuesday | D696: 2 | E696: 3pm-4pm | F696: 7 | G696: 2 | H696: 4 | I696: 0 | J696: =RC[-1]/RC[-2] -> 0
A697: 233 | B697: 1 | C697: Tuesday | D697: 2 | E697: 4pm-5pm | F697: 8 | G697: 2 | H697: 4 | I697: 0 | J697: =RC[-1]/RC[-2] -> 0
A698: 233 | B698: 1 | C698: Wednesday | D698: 3 | E698: 9am-10am | F698: 1 | G698: 2 | H698: 4 | I698: 0 | J698: =RC[-1]/RC[-2] -> 0
A699: 233 | B699: 1 | C699: Wednesday | D699: 3 | E699: 10am-11am | F699: 2 | G699: 2 | H699: 4 | I699: 0 | J699: =RC[-1]/RC[-2] -> 0
A700: 233 | B700: 1 | C700: Wednesday | D700: 3 | E700: 11am-12pm | F700: 3 | G700: 2 | H700: 4 | I700: 0 | J700: =RC[-1]/RC[-2] -> 0
A701: 233 | B701: 1 | C701: Wednesday | D701: 3 | E701: 12pm-1pm | F701: 4 | G701: 2 | H701: 4 | I701: 0 | J701: =RC[-1]/RC[-2] -> 0
A702: 233 | B702: 1 | C702: Wednesday | D702: 3 | E702: 1pm-2pm | F702: 5 | G702: 2 | H702: 4 | I702: 0 | J702: =RC[-1]/RC[-2] -> 0
A703: 233 | B703: 1 | C703: Wednesday | D703: 3 | E703: 2pm-3pm | F703: 6 | G703: 2 | H703: 4 | I703: 0 | J703: =RC[-1]/RC[-2] -> 0
A704: 233 | B704: 1 | C704: Wednesday | D704: 3 | E704: 3pm-4pm | F704: 7 | G704: 2 | H704: 4 | I704: 0 | J704: =RC[-1]/RC[-2] -> 0
A705: 233 | B705: 1 | C705: Wednesday | D705: 3 | E705: 4pm-5pm | F705: 8 | G705: 2 | H705: 4 | I705: 0 | J705: =RC[-1]/RC[-2] -> 0
A706: 233 | B706: 1 | C706: Thursday | D706: 4 | E706: 9am-10am | F706: 1 | G706: 2 | H706: 4 | I706: 0 | J706: =RC[-1]/RC[-2] -> 0
A707: 233 | B707: 1 | C707: Thursday | D707: 4 | E707: 10am-11am | F707: 2 | G707: 2 | H707: 4 | I707: 0 | J707: =RC[-1]/RC[-2] -> 0
A708: 233 | B708: 1 | C708: Thursday | D708: 4 | E708: 11am-12pm | F708: 3 | G708: 1 | H708: 4 | I708: 9 | J708: =RC[-1]/RC[-2] -> 2.25
A709: 233 | B709: 1 | C709: Thursday | D709: 4 | E709: 12pm-1pm | F709: 4 | G709: 1 | H709: 4 | I709: 3 | J709: =RC[-1]/RC[-2] -> 0.75
A710: 233 | B710: 1 | C710: Thursday | D710: 4 | E710: 1pm-2pm | F710: 5 | G710: 2 | H710: 4 | I710: 0 | J710: =RC[-1]/RC[-2] -> 0
A711: 233 | B711: 1 | C711: Thursday | D711: 4 | E711: 2pm-3pm | F711: 6 | G711: 2 | H711: 4 | I711: 0 | J711: =RC[-1]/RC[-2] -> 0
A712: 233 | B712: 1 | C712: Thursday | D712: 4 | E712: 3pm-4pm | F712: 7 | G712: 2 | H712: 4 | I712: 0 | J712: =RC[-1]/RC[-2] -> 0
A713: 233 | B713: 1 | C713: Thursday | D713: 4 | E713: 4pm-5pm | F713: 8 | G713: 2 | H713: 4 | I713: 0 | J713: =RC[-1]/RC[-2] -> 0
A714: 233 | B714: 1 | C714: Friday | D714: 5 | E714: 9am-10am | F714: 1 | G714: 2 | H714: 4 | I714: 0 | J714: =RC[-1]/RC[-2] -> 0
A715: 233 | B715: 1 | C715: Friday | D715: 5 | E715: 10am-11am | F715: 2 | G715: 2 | H715: 4 | I715: 0 | J715: =RC[-1]/RC[-2] -> 0
A716: 233 | B716: 1 | C716: Friday | D716: 5 | E716: 11am-12pm | F716: 3 | G716: 2 | H716: 4 | I716: 0 | J716: =RC[-1]/RC[-2] -> 0
A717: 233 | B717: 1 | C717: Friday | D717: 5 | E717: 12pm-1pm | F717: 4 | G717: 2 | H717: 4 | I717: 0 | J717: =RC[-1]/RC[-2] -> 0
A718: 233 | B718: 1 | C718: Friday | D718: 5 | E718: 1pm-2pm | F718: 5 | G718: 2 | H718: 4 | I718: 0 | J718: =RC[-1]/RC[-2] -> 0
A719: 233 | B719: 1 | C719: Friday | D719: 5 | E719: 2pm-3pm | F719: 6 | G719: 2 | H719: 4 | I719: 0 | J719: =RC[-1]/RC[-2] -> 0
A720: 233 | B720: 1 | C720: Friday | D720: 5 | E720: 3pm-4pm | F720: 7 | G720: 2 | H720: 4 | I720: 0 | J720: =RC[-1]/RC[-2] -> 0
A721: 233 | B721: 1 | C721: Friday | D721: 5 | E721: 4pm-5pm | F721: 8 | G721: 2 | H721: 4 | I721: 0 | J721: =RC[-1]/RC[-2] -> 0
A722: 234 | B722: 1 | C722: Monday | D722: 1 | E722: 9am-10am | F722: 1 | G722: 2 | H722: 4 | I722: 0 | J722: =RC[-1]/RC[-2] -> 0
A723: 234 | B723: 1 | C723: Monday | D723: 1 | E723: 10am-11am | F723: 2 | G723: 2 | H723: 4 | I723: 0 | J723: =RC[-1]/RC[-2] -> 0
A724: 234 | B724: 1 | C724: Monday | D724: 1 | E724: 11am-12pm | F724: 3 | G724: 2 | H724: 4 | I724: 0 | J724: =RC[-1]/RC[-2] -> 0
A725: 234 | B725: 1 | C725: Monday | D725: 1 | E725: 12pm-1pm | F725: 4 | G725: 1 | H725: 4 | I725: 1 | J725: =RC[-1]/RC[-2] -> 0.25
A726: 234 | B726: 1 | C726: Monday | D726: 1 | E726: 1pm-2pm | F726: 5 | G726: 2 | H726: 4 | I726: 0 | J726: =RC[-1]/RC[-2] -> 0
A727: 234 | B727: 1 | C727: Monday | D727: 1 | E727: 2pm-3pm | F727: 6 | G727: 3 | H727: 4 | I727: 1 | J727: =RC[-1]/RC[-2] -> 0.25
A728: 234 | B728: 1 | C728: Monday | D728: 1 | E728: 3pm-4pm | F728: 7 | G728: 2 | H728: 4 | I728: 0 | J728: =RC[-1]/RC[-2] -> 0
A729: 234 | B729: 1 | C729: Monday | D729: 1 | E729: 4pm-5pm | F729: 8 | G729: 2 | H729: 4 | I729: 0 | J729: =RC[-1]/RC[-2] -> 0
A730: 234 | B730: 1 | C730: Tuesday | D730: 2 | E730: 9am-10am | F730: 1 | G730: 1 | H730: 4 | I730: 2 | J730: =RC[-1]/RC[-2] -> 0.5
A731: 234 | B731: 1 | C731: Tuesday | D731: 2 | E731: 10am-11am | F731: 2 | G731: 1 | H731: 4 | I731: 6 | J731: =RC[-1]/RC[-2] -> 1.5
A732: 234 | B732: 1 | C732: Tuesday | D732: 2 | E732: 11am-12pm | F732: 3 | G732: 1 | H732: 4 | I732: 7 | J732: =RC[-1]/RC[-2] -> 1.75
A733: 234 | B733: 1 | C733: Tuesday | D733: 2 | E733: 12pm-1pm | F733: 4 | G733: 2 | H733: 4 | I733: 0 | J733: =RC[-1]/RC[-2] -> 0
A734: 234 | B734: 1 | C734: Tuesday | D734: 2 | E734: 1pm-2pm | F734: 5 | G734: 2 | H734: 4 | I734: 0 | J734: =RC[-1]/RC[-2] -> 0
A735: 234 | B735: 1 | C735: Tuesday | D735: 2 | E735: 2pm-3pm | F735: 6 | G735: 2 | H735: 4 | I735: 0 | J735: =RC[-1]/RC[-2] -> 0
A736: 234 | B736: 1 | C736: Tuesday | D736: 2 | E736: 3pm-4pm | F736: 7 | G736: 2 | H736: 4 | I736: 0 | J736: =RC[-1]/RC[-2] -> 0
A737: 234 | B737: 1 | C737: Tuesday | D737: 2 | E737: 4pm-5pm | F737: 8 | G737: 2 | H737: 4 | I737: 0 | J737: =RC[-1]/RC[-2] -> 0
A738: 234 | B738: 1 | C738: Wednesday | D738: 3 | E738: 9am-10am | F738: 1 | G738: 2 | H738: 4 | I738: 0 | J738: =RC[-1]/RC[-2] -> 0
A739: 234 | B739: 1 | C739: Wednesday | D739: 3 | E739: 10am-11am | F739: 2 | G739: 2 | H739: 4 | I739: 0 | J739: =RC[-1]/RC[-2] -> 0
A740: 234 | B740: 1 | C740: Wednesday | D740: 3 | E740: 11am-12pm | F740: 3 | G740: 2 | H740: 4 | I740: 0 | J740: =RC[-1]/RC[-2] -> 0
A741: 234 | B741: 1 | C741: Wednesday | D741: 3 | E741: 12pm-1pm | F741: 4 | G741: 2 | H741: 4 | I741: 0 | J741: =RC[-1]/RC[-2] -> 0
A742: 234 | B742: 1 | C742: Wednesday | D742: 3 | E742: 1pm-2pm | F742: 5 | G742: 2 | H742: 4 | I742: 0 | J742: =RC[-1]/RC[-2] -> 0
A743: 234 | B743: 1 | C743: Wednesday | D743: 3 | E743: 2pm-3pm | F743: 6 | G743: 2 | H743: 4 | I743: 0 | J743: =RC[-1]/RC[-2] -> 0
A744: 234 | B744: 1 | C744: Wednesday | D744: 3 | E744: 3pm-4pm | F744: 7 | G744: 2 | H744: 4 | I744: 0 | J744: =RC[-1]/RC[-2] -> 0
A745: 234 | B745: 1 | C745: Wednesday | D745: 3 | E745: 4pm-5pm | F745: 8 | G745: 3 | H745: 4 | I745: 2 | J745: =RC[-1]/RC[-2] -> 0.5
A746: 234 | B746: 1 | C746: Thursday | D746: 4 | E746: 9am-10am | F746: 1 | G746: 2 | H746: 4 | I746: 0 | J746: =RC[-1]/RC[-2] -> 0
A747: 234 | B747: 1 | C747: Thursday | D747: 4 | E747: 10am-11am | F747: 2 | G747: 1 | H747: 4 | I747: 11 | J747: =RC[-1]/RC[-2] -> 2.75
A748: 234 | B748: 1 | C748: Thursday | D748: 4 | E748: 11am-12pm | F748: 3 | G748: 1 | H748: 4 | I748: 4 | J748: =RC[-1]/RC[-2] -> 1
A749: 234 | B749: 1 | C749: Thursday | D749: 4 | E749: 12pm-1pm | F749: 4 | G749: 1 | H749: 4 | I749: 10 | J749: =RC[-1]/RC[-2] -> 2.5
A750: 234 | B750: 1 | C750: Thursday | D750: 4 | E750: 1pm-2pm | F750: 5 | G750: 1 | H750: 4 | I750: 2 | J750: =RC[-1]/RC[-2] -> 0.5
A751: 234 | B751: 1 | C751: Thursday | D751: 4 | E751: 2pm-3pm | F751: 6 | G751: 3 | H751: 4 | I751: 1 | J751: =RC[-1]/RC[-2] -> 0.25
A752: 234 | B752: 1 | C752: Thursday | D752: 4 | E752: 3pm-4pm | F752: 7 | G752: 2 | H752: 4 | I752: 0 | J752: =RC[-1]/RC[-2] -> 0
A753: 234 | B753: 1 | C753: Thursday | D753: 4 | E753: 4pm-5pm | F753: 8 | G753: 2 | H753: 4 | I753: 0 | J753: =RC[-1]/RC[-2] -> 0
A754: 234 | B754: 1 | C754: Friday | D754: 5 | E754: 9am-10am | F754: 1 | G754: 2 | H754: 4 | I754: 0 | J754: =RC[-1]/RC[-2] -> 0
A755: 234 | B755: 1 | C755: Friday | D755: 5 | E755: 10am-11am | F755: 2 | G755: 3 | H755: 4 | I755: 1 | J755: =RC[-1]/RC[-2] -> 0.25
A756: 234 | B756: 1 | C756: Friday | D756: 5 | E756: 11am-12pm | F756: 3 | G756: 2 | H756: 4 | I756: 0 | J756: =RC[-1]/RC[-2] -> 0
A757: 234 | B757: 1 | C757: Friday | D757: 5 | E757: 12pm-1pm | F757: 4 | G757: 2 | H757: 4 | I757: 0 | J757: =RC[-1]/RC[-2] -> 0
A758: 234 | B758: 1 | C758: Friday | D758: 5 | E758: 1pm-2pm | F758: 5 | G758: 2 | H758: 4 | I758: 0 | J758: =RC[-1]/RC[-2] -> 0
A759: 234 | B759: 1 | C759: Friday | D759: 5 | E759: 2pm-3pm | F759: 6 | G759: 1 | H759: 4 | I759: 13 | J759: =RC[-1]/RC[-2] -> 3.25
A760: 234 | B760: 1 | C760: Friday | D760: 5 | E760: 3pm-4pm | F760: 7 | G760: 1 | H760: 4 | I760: 5 | J760: =RC[-1]/RC[-2] -> 1.25
A761: 234 | B761: 1 | C761: Friday | D761: 5 | E761: 4pm-5pm | F761: 8 | G761: 1 | H761: 4 | I761: 6 | J761: =RC[-1]/RC[-2] -> 1.5
A762: 237 | B762: 1 | C762: Monday | D762: 1 | E762: 9am-10am | F762: 1 | G762: 2 | H762: 44 | I762: 0 | J762: =RC[-1]/RC[-2] -> 0
A763: 237 | B763: 1 | C763: Monday | D763: 1 | E763: 10am-11am | F763: 2 | G763: 2 | H763: 44 | I763: 0 | J763: =RC[-1]/RC[-2] -> 0
A764: 237 | B764: 1 | C764: Monday | D764: 1 | E764: 11am-12pm | F764: 3 | G764: 2 | H764: 44 | I764: 0 | J764: =RC[-1]/RC[-2] -> 0
A765: 237 | B765: 1 | C765: Monday | D765: 1 | E765: 12pm-1pm | F765: 4 | G765: 2 | H765: 44 | I765: 0 | J765: =RC[-1]/RC[-2] -> 0
A766: 237 | B766: 1 | C766: Monday | D766: 1 | E766: 1pm-2pm | F766: 5 | G766: 1 | H766: 44 | I766: 13 | J766: =RC[-1]/RC[-2] -> 0.29545454545454547
A767: 237 | B767: 1 | C767: Monday | D767: 1 | E767: 2pm-3pm | F767: 6 | G767: 1 | H767: 44 | I767: 12 | J767: =RC[-1]/RC[-2] -> 0.27272727272727271
A768: 237 | B768: 1 | C768: Monday | D768: 1 | E768: 3pm-4pm | F768: 7 | G768: 1 | H768: 44 | I768: 12 | J768: =RC[-1]/RC[-2] -> 0.27272727272727271
A769: 237 | B769: 1 | C769: Monday | D769: 1 | E769: 4pm-5pm | F769: 8 | G769: 1 | H769: 44 | I769: 12 | J769: =RC[-1]/RC[-2] -> 0.27272727272727271
A770: 237 | B770: 1 | C770: Tuesday | D770: 2 | E770: 9am-10am | F770: 1 | G770: 1 | H770: 44 | I770: 12 | J770: =RC[-1]/RC[-2] -> 0.27272727272727271
A771: 237 | B771: 1 | C771: Tuesday | D771: 2 | E771: 10am-11am | F771: 2 | G771: 1 | H771: 44 | I771: 10 | J771: =RC[-1]/RC[-2] -> 0.22727272727272727
A772: 237 | B772: 1 | C772: Tuesday | D772: 2 | E772: 11am-12pm | F772: 3 | G772: 1 | H772: 44 | I772: 16 | J772: =RC[-1]/RC[-2] -> 0.36363636363636365
A773: 237 | B773: 1 | C773: Tuesday | D773: 2 | E773: 12pm-1pm | F773: 4 | G773: 2 | H773: 44 | I773: 0 | J773: =RC[-1]/RC[-2] -> 0
A774: 237 | B774: 1 | C774: Tuesday | D774: 2 | E774: 1pm-2pm | F774: 5 | G774: 2 | H774: 44 | I774: 0 | J774: =RC[-1]/RC[-2] -> 0
A775: 237 | B775: 1 | C775: Tuesday | D775: 2 | E775: 2pm-3pm | F775: 6 | G775: 1 | H775: 44 | I775: 2 | J775: =RC[-1]/RC[-2] -> 4.5454545454545456E-2
A776: 237 | B776: 1 | C776: Tuesday | D776: 2 | E776: 3pm-4pm | F776: 7 | G776: 2 | H776: 44 | I776: 0 | J776: =RC[-1]/RC[-2] -> 0
A777: 237 | B777: 1 | C777: Tuesday | D777: 2 | E777: 4pm-5pm | F777: 8 | G777: 1 | H777: 44 | I777: 3 | J777: =RC[-1]/RC[-2] -> 6.8181818181818177E-2
A778: 237 | B778: 1 | C778: Wednesday | D778: 3 | E778: 9am-10am | F778: 1 | G778: 2 | H778: 44 | I778: 0 | J778: =RC[-1]/RC[-2] -> 0
A779: 237 | B779: 1 | C779: Wednesday | D779: 3 | E779: 10am-11am | F779: 2 | G779: 2 | H779: 44 | I779: 0 | J779: =RC[-1]/RC[-2] -> 0
A780: 237 | B780: 1 | C780: Wednesday | D780: 3 | E780: 11am-12pm | F780: 3 | G780: 2 | H780: 44 | I780: 0 | J780: =RC[-1]/RC[-2] -> 0
A781: 237 | B781: 1 | C781: Wednesday | D781: 3 | E781: 12pm-1pm | F781: 4 | G781: 2 | H781: 44 | I781: 0 | J781: =RC[-1]/RC[-2] -> 0
A782: 237 | B782: 1 | C782: Wednesday | D782: 3 | E782: 1pm-2pm | F782: 5 | G782: 1 | H782: 44 | I782: 3 | J782: =RC[-1]/RC[-2] -> 6.8181818181818177E-2
A783: 237 | B783: 1 | C783: Wednesday | D783: 3 | E783: 2pm-3pm | F783: 6 | G783: 1 | H783: 44 | I783: 12 | J783: =RC[-1]/RC[-2] -> 0.27272727272727271
A784: 237 | B784: 1 | C784: Wednesday | D784: 3 | E784: 3pm-4pm | F784: 7 | G784: 1 | H784: 44 | I784: 11 | J784: =RC[-1]/RC[-2] -> 0.25
A785: 237 | B785: 1 | C785: Wednesday | D785: 3 | E785: 4pm-5pm | F785: 8 | G785: 1 | H785: 44 | I785: 11 | J785: =RC[-1]/RC[-2] -> 0.25
A786: 237 | B786: 1 | C786: Thursday | D786: 4 | E786: 9am-10am | F786: 1 | G786: 2 | H786: 44 | I786: 0 | J786: =RC[-1]/RC[-2] -> 0
A787: 237 | B787: 1 | C787: Thursday | D787: 4 | E787: 10am-11am | F787: 2 | G787: 1 | H787: 44 | I787: 13 | J787: =RC[-1]/RC[-2] -> 0.29545454545454547
A788: 237 | B788: 1 | C788: Thursday | D788: 4 | E788: 11am-12pm | F788: 3 | G788: 1 | H788: 44 | I788: 12 | J788: =RC[-1]/RC[-2] -> 0.27272727272727271
A789: 237 | B789: 1 | C789: Thursday | D789: 4 | E789: 12pm-1pm | F789: 4 | G789: 1 | H789: 44 | I789: 10 | J789: =RC[-1]/RC[-2] -> 0.22727272727272727
A790: 237 | B790: 1 | C790: Thursday | D790: 4 | E790: 1pm-2pm | F790: 5 | G790: 1 | H790: 44 | I790: 5 | J790: =RC[-1]/RC[-2] -> 0.11363636363636363
A791: 237 | B791: 1 | C791: Thursday | D791: 4 | E791: 2pm-3pm | F791: 6 | G791: 2 | H791: 44 | I791: 0 | J791: =RC[-1]/RC[-2] -> 0
A792: 237 | B792: 1 | C792: Thursday | D792: 4 | E792: 3pm-4pm | F792: 7 | G792: 2 | H792: 44 | I792: 0 | J792: =RC[-1]/RC[-2] -> 0
A793: 237 | B793: 1 | C793: Thursday | D793: 4 | E793: 4pm-5pm | F793: 8 | G793: 2 | H793: 44 | I793: 0 | J793: =RC[-1]/RC[-2] -> 0
A794: 237 | B794: 1 | C794: Friday | D794: 5 | E794: 9am-10am | F794: 1 | G794: 2 | H794: 44 | I794: 0 | J794: =RC[-1]/RC[-2] -> 0
A795: 237 | B795: 1 | C795: Friday | D795: 5 | E795: 10am-11am | F795: 2 | G795: 2 | H795: 44 | I795: 0 | J795: =RC[-1]/RC[-2] -> 0
A796: 237 | B796: 1 | C796: Friday | D796: 5 | E796: 11am-12pm | F796: 3 | G796: 2 | H796: 44 | I796: 0 | J796: =RC[-1]/RC[-2] -> 0
A797: 237 | B797: 1 | C797: Friday | D797: 5 | E797: 12pm-1pm | F797: 4 | G797: 2 | H797: 44 | I797: 0 | J797: =RC[-1]/RC[-2] -> 0
A798: 237 | B798: 1 | C798: Friday | D798: 5 | E798: 1pm-2pm | F798: 5 | G798: 2 | H798: 44 | I798: 0 | J798: =RC[-1]/RC[-2] -> 0
A799: 237 | B799: 1 | C799: Friday | D799: 5 | E799: 2pm-3pm | F799: 6 | G799: 2 | H799: 44 | I799: 0 | J799: =RC[-1]/RC[-2] -> 0
A800: 237 | B800: 1 | C800: Friday | D800: 5 | E800: 3pm-4pm | F800: 7 | G800: 2 | H800: 44 | I800: 0 | J800: =RC[-1]/RC[-2] -> 0
A801: 237 | B801: 1 | C801: Friday | D801: 5 | E801: 4pm-5pm | F801: 8 | G801: 2 | H801: 44 | I801: 0 | J801: =RC[-1]/RC[-2] -> 0
A802: 104 | B802: 2 | C802: Monday | D802: 1 | E802: 9am-10am | F802: 1 | G802: 3 | H802: 20 | I802: 1 | J802: =RC[-1]/RC[-2] -> 0.05
A803: 104 | B803: 2 | C803: Monday | D803: 1 | E803: 10am-11am | F803: 2 | G803: 3 | H803: 20 | I803: 1 | J803: =RC[-1]/RC[-2] -> 0.05
A804: 104 | B804: 2 | C804: Monday | D804: 1 | E804: 11am-12pm | F804: 3 | G804: 3 | H804: 20 | I804: 1 | J804: =RC[-1]/RC[-2] -> 0.05
A805: 104 | B805: 2 | C805: Monday | D805: 1 | E805: 12pm-1pm | F805: 4 | G805: 2 | H805: 20 | I805: 0 | J805: =RC[-1]/RC[-2] -> 0
A806: 104 | B806: 2 | C806: Monday | D806: 1 | E806: 1pm-2pm | F806: 5 | G806: 2 | H806: 20 | I806: 0 | J806: =RC[-1]/RC[-2] -> 0
A807: 104 | B807: 2 | C807: Monday | D807: 1 | E807: 2pm-3pm | F807: 6 | G807: 1 | H807: 20 | I807: 19 | J807: =RC[-1]/RC[-2] -> 0.95
A808: 104 | B808: 2 | C808: Monday | D808: 1 | E808: 3pm-4pm | F808: 7 | G808: 1 | H808: 20 | I808: 18 | J808: =RC[-1]/RC[-2] -> 0.9
A809: 104 | B809: 2 | C809: Monday | D809: 1 | E809: 4pm-5pm | F809: 8 | G809: 2 | H809: 20 | I809: 0 | J809: =RC[-1]/RC[-2] -> 0
A810: 104 | B810: 2 | C810: Tuesday | D810: 2 | E810: 9am-10am | F810: 1 | G810: 2 | H810: 20 | I810: 0 | J810: =RC[-1]/RC[-2] -> 0
A811: 104 | B811: 2 | C811: Tuesday | D811: 2 | E811: 10am-11am | F811: 2 | G811: 1 | H811: 20 | I811: 16 | J811: =RC[-1]/RC[-2] -> 0.8
A812: 104 | B812: 2 | C812: Tuesday | D812: 2 | E812: 11am-12pm | F812: 3 | G812: 1 | H812: 20 | I812: 16 | J812: =RC[-1]/RC[-2] -> 0.8
A813: 104 | B813: 2 | C813: Tuesday | D813: 2 | E813: 12pm-1pm | F813: 4 | G813: 2 | H813: 20 | I813: 0 | J813: =RC[-1]/RC[-2] -> 0
A814: 104 | B814: 2 | C814: Tuesday | D814: 2 | E814: 1pm-2pm | F814: 5 | G814: 2 | H814: 20 | I814: 0 | J814: =RC[-1]/RC[-2] -> 0
A815: 104 | B815: 2 | C815: Tuesday | D815: 2 | E815: 2pm-3pm | F815: 6 | G815: 1 | H815: 20 | I815: 12 | J815: =RC[-1]/RC[-2] -> 0.6
A816: 104 | B816: 2 | C816: Tuesday | D816: 2 | E816: 3pm-4pm | F816: 7 | G816: 1 | H816: 20 | I816: 11 | J816: =RC[-1]/RC[-2] -> 0.55
A817: 104 | B817: 2 | C817: Tuesday | D817: 2 | E817: 4pm-5pm | F817: 8 | G817: 1 | H817: 20 | I817: 5 | J817: =RC[-1]/RC[-2] -> 0.25
A818: 104 | B818: 2 | C818: Wednesday | D818: 3 | E818: 9am-10am | F818: 1 | G818: 2 | H818: 20 | I818: 0 | J818: =RC[-1]/RC[-2] -> 0
A819: 104 | B819: 2 | C819: Wednesday | D819: 3 | E819: 10am-11am | F819: 2 | G819: 2 | H819: 20 | I819: 0 | J819: =RC[-1]/RC[-2] -> 0
A820: 104 | B820: 2 | C820: Wednesday | D820: 3 | E820: 11am-12pm | F820: 3 | G820: 2 | H820: 20 | I820: 0 | J820: =RC[-1]/RC[-2] -> 0
A821: 104 | B821: 2 | C821: Wednesday | D821: 3 | E821: 12pm-1pm | F821: 4 | G821: 2 | H821: 20 | I821: 0 | J821: =RC[-1]/RC[-2] -> 0
A822: 104 | B822: 2 | C822: Wednesday | D822: 3 | E822: 1pm-2pm | F822: 5 | G822: 2 | H822: 20 | I822: 0 | J822: =RC[-1]/RC[-2] -> 0
A823: 104 | B823: 2 | C823: Wednesday | D823: 3 | E823: 2pm-3pm | F823: 6 | G823: 2 | H823: 20 | I823: 0 | J823: =RC[-1]/RC[-2] -> 0
A824: 104 | B824: 2 | C824: Wednesday | D824: 3 | E824: 3pm-4pm | F824: 7 | G824: 1 | H824: 20 | I824: 17 | J824: =RC[-1]/RC[-2] -> 0.85
A825: 104 | B825: 2 | C825: Wednesday | D825: 3 | E825: 4pm-5pm | F825: 8 | G825: 1 | H825: 20 | I825: 14 | J825: =RC[-1]/RC[-2] -> 0.7
A826: 104 | B826: 2 | C826: Thursday | D826: 4 | E826: 9am-10am | F826: 1 | G826: 2 | H826: 20 | I826: 0 | J826: =RC[-1]/RC[-2] -> 0
A827: 104 | B827: 2 | C827: Thursday | D827: 4 | E827: 10am-11am | F827: 2 | G827: 3 | H827: 20 | I827: 2 | J827: =RC[-1]/RC[-2] -> 0.1
A828: 104 | B828: 2 | C828: Thursday | D828: 4 | E828: 11am-12pm | F828: 3 | G828: 1 | H828: 20 | I828: 20 | J828: =RC[-1]/RC[-2] -> 1
A829: 104 | B829: 2 | C829: Thursday | D829: 4 | E829: 12pm-1pm | F829: 4 | G829: 1 | H829: 20 | I829: 3 | J829: =RC[-1]/RC[-2] -> 0.15
A830: 104 | B830: 2 | C830: Thursday | D830: 4 | E830: 1pm-2pm | F830: 5 | G830: 2 | H830: 20 | I830: 0 | J830: =RC[-1]/RC[-2] -> 0
A831: 104 | B831: 2 | C831: Thursday | D831: 4 | E831: 2pm-3pm | F831: 6 | G831: 1 | H831: 20 | I831: 20 | J831: =RC[-1]/RC[-2] -> 1
A832: 104 | B832: 2 | C832: Thursday | D832: 4 | E832: 3pm-4pm | F832: 7 | G832: 2 | H832: 20 | I832: 0 | J832: =RC[-1]/RC[-2] -> 0
A833: 104 | B833: 2 | C833: Thursday | D833: 4 | E833: 4pm-5pm | F833: 8 | G833: 2 | H833: 20 | I833: 0 | J833: =RC[-1]/RC[-2] -> 0
A834: 104 | B834: 2 | C834: Friday | D834: 5 | E834: 9am-10am | F834: 1 | G834: 2 | H834: 20 | I834: 0 | J834: =RC[-1]/RC[-2] -> 0
A835: 104 | B835: 2 | C835: Friday | D835: 5 | E835: 10am-11am | F835: 2 | G835: 2 | H835: 20 | I835: 0 | J835: =RC[-1]/RC[-2] -> 0
A836: 104 | B836: 2 | C836: Friday | D836: 5 | E836: 11am-12pm | F836: 3 | G836: 2 | H836: 20 | I836: 0 | J836: =RC[-1]/RC[-2] -> 0
A837: 104 | B837: 2 | C837: Friday | D837: 5 | E837: 12pm-1pm | F837: 4 | G837: 2 | H837: 20 | I837: 0 | J837: =RC[-1]/RC[-2] -> 0
A838: 104 | B838: 2 | C838: Friday | D838: 5 | E838: 1pm-2pm | F838: 5 | G838: 2 | H838: 20 | I838: 0 | J838: =RC[-1]/RC[-2] -> 0
A839: 104 | B839: 2 | C839: Friday | D839: 5 | E839: 2pm-3pm | F839: 6 | G839: 1 | H839: 20 | I839: 11 | J839: =RC[-1]/RC[-2] -> 0.55
A840: 104 | B840: 2 | C840: Friday | D840: 5 | E840: 3pm-4pm | F840: 7 | G840: 2 | H840: 20 | I840: 0 | J840: =RC[-1]/RC[-2] -> 0
A841: 104 | B841: 2 | C841: Friday | D841: 5 | E841: 4pm-5pm | F841: 8 | G841: 2 | H841: 20 | I841: 0 | J841: =RC[-1]/RC[-2] -> 0
A842: 111 | B842: 2 | C842: Monday | D842: 1 | E842: 9am-10am | F842: 1 | G842: 2 | H842: 20 | I842: 0 | J842: =RC[-1]/RC[-2] -> 0
A843: 111 | B843: 2 | C843: Monday | D843: 1 | E843: 10am-11am | F843: 2 | G843: 2 | H843: 20 | I843: 0 | J843: =RC[-1]/RC[-2] -> 0
A844: 111 | B844: 2 | C844: Monday | D844: 1 | E844: 11am-12pm | F844: 3 | G844: 2 | H844: 20 | I844: 0 | J844: =RC[-1]/RC[-2] -> 0
A845: 111 | B845: 2 | C845: Monday | D845: 1 | E845: 12pm-1pm | F845: 4 | G845: 2 | H845: 20 | I845: 0 | J845: =RC[-1]/RC[-2] -> 0
A846: 111 | B846: 2 | C846: Monday | D846: 1 | E846: 1pm-2pm | F846: 5 | G846: 2 | H846: 20 | I846: 0 | J846: =RC[-1]/RC[-2] -> 0
A847: 111 | B847: 2 | C847: Monday | D847: 1 | E847: 2pm-3pm | F847: 6 | G847: 2 | H847: 20 | I847: 0 | J847: =RC[-1]/RC[-2] -> 0
A848: 111 | B848: 2 | C848: Monday | D848: 1 | E848: 3pm-4pm | F848: 7 | G848: 3 | H848: 20 | I848: 1 | J848: =RC[-1]/RC[-2] -> 0.05
A849: 111 | B849: 2 | C849: Monday | D849: 1 | E849: 4pm-5pm | F849: 8 | G849: 2 | H849: 20 | I849: 0 | J849: =RC[-1]/RC[-2] -> 0
A850: 111 | B850: 2 | C850: Tuesday | D850: 2 | E850: 9am-10am | F850: 1 | G850: 2 | H850: 20 | I850: 0 | J850: =RC[-1]/RC[-2] -> 0
A851: 111 | B851: 2 | C851: Tuesday | D851: 2 | E851: 10am-11am | F851: 2 | G851: 1 | H851: 20 | I851: 16 | J851: =RC[-1]/RC[-2] -> 0.8
A852: 111 | B852: 2 | C852: Tuesday | D852: 2 | E852: 11am-12pm | F852: 3 | G852: 1 | H852: 20 | I852: 20 | J852: =RC[-1]/RC[-2] -> 1
A853: 111 | B853: 2 | C853: Tuesday | D853: 2 | E853: 12pm-1pm | F853: 4 | G853: 1 | H853: 20 | I853: 2 | J853: =RC[-1]/RC[-2] -> 0.1
A854: 111 | B854: 2 | C854: Tuesday | D854: 2 | E854: 1pm-2pm | F854: 5 | G854: 2 | H854: 20 | I854: 0 | J854: =RC[-1]/RC[-2] -> 0
A855: 111 | B855: 2 | C855: Tuesday | D855: 2 | E855: 2pm-3pm | F855: 6 | G855: 1 | H855: 20 | I855: 25 | J855: =RC[-1]/RC[-2] -> 1.25
A856: 111 | B856: 2 | C856: Tuesday | D856: 2 | E856: 3pm-4pm | F856: 7 | G856: 1 | H856: 20 | I856: 14 | J856: =RC[-1]/RC[-2] -> 0.7
A857: 111 | B857: 2 | C857: Tuesday | D857: 2 | E857: 4pm-5pm | F857: 8 | G857: 1 | H857: 20 | I857: 17 | J857: =RC[-1]/RC[-2] -> 0.85
A858: 111 | B858: 2 | C858: Wednesday | D858: 3 | E858: 9am-10am | F858: 1 | G858: 1 | H858: 20 | I858: 18 | J858: =RC[-1]/RC[-2] -> 0.9
A859: 111 | B859: 2 | C859: Wednesday | D859: 3 | E859: 10am-11am | F859: 2 | G859: 1 | H859: 20 | I859: 15 | J859: =RC[-1]/RC[-2] -> 0.75
A860: 111 | B860: 2 | C860: Wednesday | D860: 3 | E860: 11am-12pm | F860: 3 | G860: 1 | H860: 20 | I860: 6 | J860: =RC[-1]/RC[-2] -> 0.3
A861: 111 | B861: 2 | C861: Wednesday | D861: 3 | E861: 12pm-1pm | F861: 4 | G861: 2 | H861: 20 | I861: 0 | J861: =RC[-1]/RC[-2] -> 0
A862: 111 | B862: 2 | C862: Wednesday | D862: 3 | E862: 1pm-2pm | F862: 5 | G862: 2 | H862: 20 | I862: 0 | J862: =RC[-1]/RC[-2] -> 0
A863: 111 | B863: 2 | C863: Wednesday | D863: 3 | E863: 2pm-3pm | F863: 6 | G863: 2 | H863: 20 | I863: 0 | J863: =RC[-1]/RC[-2] -> 0
A864: 111 | B864: 2 | C864: Wednesday | D864: 3 | E864: 3pm-4pm | F864: 7 | G864: 2 | H864: 20 | I864: 0 | J864: =RC[-1]/RC[-2] -> 0
A865: 111 | B865: 2 | C865: Wednesday | D865: 3 | E865: 4pm-5pm | F865: 8 | G865: 2 | H865: 20 | I865: 0 | J865: =RC[-1]/RC[-2] -> 0
A866: 111 | B866: 2 | C866: Thursday | D866: 4 | E866: 9am-10am | F866: 1 | G866: 1 | H866: 20 | I866: 13 | J866: =RC[-1]/RC[-2] -> 0.65
A867: 111 | B867: 2 | C867: Thursday | D867: 4 | E867: 10am-11am | F867: 2 | G867: 1 | H867: 20 | I867: 15 | J867: =RC[-1]/RC[-2] -> 0.75
A868: 111 | B868: 2 | C868: Thursday | D868: 4 | E868: 11am-12pm | F868: 3 | G868: 2 | H868: 20 | I868: 0 | J868: =RC[-1]/RC[-2] -> 0
A869: 111 | B869: 2 | C869: Thursday | D869: 4 | E869: 12pm-1pm | F869: 4 | G869: 2 | H869: 20 | I869: 0 | J869: =RC[-1]/RC[-2] -> 0
A870: 111 | B870: 2 | C870: Thursday | D870: 4 | E870: 1pm-2pm | F870: 5 | G870: 2 | H870: 20 | I870: 0 | J870: =RC[-1]/RC[-2] -> 0
A871: 111 | B871: 2 | C871: Thursday | D871: 4 | E871: 2pm-3pm | F871: 6 | G871: 1 | H871: 20 | I871: 14 | J871: =RC[-1]/RC[-2] -> 0.7
A872: 111 | B872: 2 | C872: Thursday | D872: 4 | E872: 3pm-4pm | F872: 7 | G872: 1 | H872: 20 | I872: 15 | J872: =RC[-1]/RC[-2] -> 0.75
A873: 111 | B873: 2 | C873: Thursday | D873: 4 | E873: 4pm-5pm | F873: 8 | G873: 3 | H873: 20 | I873: 2 | J873: =RC[-1]/RC[-2] -> 0.1
A874: 111 | B874: 2 | C874: Friday | D874: 5 | E874: 9am-10am | F874: 1 | G874: 2 | H874: 20 | I874: 0 | J874: =RC[-1]/RC[-2] -> 0
A875: 111 | B875: 2 | C875: Friday | D875: 5 | E875: 10am-11am | F875: 2 | G875: 3 | H875: 20 | I875: 1 | J875: =RC[-1]/RC[-2] -> 0.05
A876: 111 | B876: 2 | C876: Friday | D876: 5 | E876: 11am-12pm | F876: 3 | G876: 1 | H876: 20 | I876: 1 | J876: =RC[-1]/RC[-2] -> 0.05
A877: 111 | B877: 2 | C877: Friday | D877: 5 | E877: 12pm-1pm | F877: 4 | G877: 2 | H877: 20 | I877: 0 | J877: =RC[-1]/RC[-2] -> 0
A878: 111 | B878: 2 | C878: Friday | D878: 5 | E878: 1pm-2pm | F878: 5 | G878: 2 | H878: 20 | I878: 0 | J878: =RC[-1]/RC[-2] -> 0
A879: 111 | B879: 2 | C879: Friday | D879: 5 | E879: 2pm-3pm | F879: 6 | G879: 2 | H879: 20 | I879: 0 | J879: =RC[-1]/RC[-2] -> 0
A880: 111 | B880: 2 | C880: Friday | D880: 5 | E880: 3pm-4pm | F880: 7 | G880: 2 | H880: 20 | I880: 0 | J880: =RC[-1]/RC[-2] -> 0
A881: 111 | B881: 2 | C881: Friday | D881: 5 | E881: 4pm-5pm | F881: 8 | G881: 2 | H881: 20 | I881: 0 | J881: =RC[-1]/RC[-2] -> 0
A882: 113 | B882: 2 | C882: Monday | D882: 1 | E882: 9am-10am | F882: 1 | G882: 2 | H882: 20 | I882: 0 | J882: =RC[-1]/RC[-2] -> 0
A883: 113 | B883: 2 | C883: Monday | D883: 1 | E883: 10am-11am | F883: 2 | G883: 2 | H883: 20 | I883: 0 | J883: =RC[-1]/RC[-2] -> 0
A884: 113 | B884: 2 | C884: Monday | D884: 1 | E884: 11am-12pm | F884: 3 | G884: 2 | H884: 20 | I884: 0 | J884: =RC[-1]/RC[-2] -> 0
A885: 113 | B885: 2 | C885: Monday | D885: 1 | E885: 12pm-1pm | F885: 4 | G885: 1 | H885: 20 | I885: 6 | J885: =RC[-1]/RC[-2] -> 0.3
A886: 113 | B886: 2 | C886: Monday | D886: 1 | E886: 1pm-2pm | F886: 5 | G886: 1 | H886: 20 | I886: 8 | J886: =RC[-1]/RC[-2] -> 0.4
A887: 113 | B887: 2 | C887: Monday | D887: 1 | E887: 2pm-3pm | F887: 6 | G887: 2 | H887: 20 | I887: 0 | J887: =RC[-1]/RC[-2] -> 0
A888: 113 | B888: 2 | C888: Monday | D888: 1 | E888: 3pm-4pm | F888: 7 | G888: 2 | H888: 20 | I888: 0 | J888: =RC[-1]/RC[-2] -> 0
A889: 113 | B889: 2 | C889: Monday | D889: 1 | E889: 4pm-5pm | F889: 8 | G889: 2 | H889: 20 | I889: 0 | J889: =RC[-1]/RC[-2] -> 0
A890: 113 | B890: 2 | C890: Tuesday | D890: 2 | E890: 9am-10am | F890: 1 | G890: 2 | H890: 20 | I890: 0 | J890: =RC[-1]/RC[-2] -> 0
A891: 113 | B891: 2 | C891: Tuesday | D891: 2 | E891: 10am-11am | F891: 2 | G891: 2 | H891: 20 | I891: 0 | J891: =RC[-1]/RC[-2] -> 0
A892: 113 | B892: 2 | C892: Tuesday | D892: 2 | E892: 11am-12pm | F892: 3 | G892: 3 | H892: 20 | I892: 1 | J892: =RC[-1]/RC[-2] -> 0.05
A893: 113 | B893: 2 | C893: Tuesday | D893: 2 | E893: 12pm-1pm | F893: 4 | G893: 2 | H893: 20 | I893: 0 | J893: =RC[-1]/RC[-2] -> 0
A894: 113 | B894: 2 | C894: Tuesday | D894: 2 | E894: 1pm-2pm | F894: 5 | G894: 2 | H894: 20 | I894: 0 | J894: =RC[-1]/RC[-2] -> 0
A895: 113 | B895: 2 | C895: Tuesday | D895: 2 | E895: 2pm-3pm | F895: 6 | G895: 1 | H895: 20 | I895: 20 | J895: =RC[-1]/RC[-2] -> 1
A896: 113 | B896: 2 | C896: Tuesday | D896: 2 | E896: 3pm-4pm | F896: 7 | G896: 1 | H896: 20 | I896: 14 | J896: =RC[-1]/RC[-2] -> 0.7
A897: 113 | B897: 2 | C897: Tuesday | D897: 2 | E897: 4pm-5pm | F897: 8 | G897: 2 | H897: 20 | I897: 0 | J897: =RC[-1]/RC[-2] -> 0
A898: 113 | B898: 2 | C898: Wednesday | D898: 3 | E898: 9am-10am | F898: 1 | G898: 1 | H898: 20 | I898: 7 | J898: =RC[-1]/RC[-2] -> 0.35
A899: 113 | B899: 2 | C899: Wednesday | D899: 3 | E899: 10am-11am | F899: 2 | G899: 1 | H899: 20 | I899: 10 | J899: =RC[-1]/RC[-2] -> 0.5
A900: 113 | B900: 2 | C900: Wednesday | D900: 3 | E900: 11am-12pm | F900: 3 | G900: 2 | H900: 20 | I900: 0 | J900: =RC[-1]/RC[-2] -> 0
A901: 113 | B901: 2 | C901: Wednesday | D901: 3 | E901: 12pm-1pm | F901: 4 | G901: 2 | H901: 20 | I901: 0 | J901: =RC[-1]/RC[-2] -> 0
A902: 113 | B902: 2 | C902: Wednesday | D902: 3 | E902: 1pm-2pm | F902: 5 | G902: 2 | H902: 20 | I902: 0 | J902: =RC[-1]/RC[-2] -> 0
A903: 113 | B903: 2 | C903: Wednesday | D903: 3 | E903: 2pm-3pm | F903: 6 | G903: 2 | H903: 20 | I903: 0 | J903: =RC[-1]/RC[-2] -> 0
A904: 113 | B904: 2 | C904: Wednesday | D904: 3 | E904: 3pm-4pm | F904: 7 | G904: 2 | H904: 20 | I904: 0 | J904: =RC[-1]/RC[-2] -> 0
A905: 113 | B905: 2 | C905: Wednesday | D905: 3 | E905: 4pm-5pm | F905: 8 | G905: 2 | H905: 20 | I905: 0 | J905: =RC[-1]/RC[-2] -> 0
A906: 113 | B906: 2 | C906: Thursday | D906: 4 | E906: 9am-10am | F906: 1 | G906: 1 | H906: 20 | I906: 14 | J906: =RC[-1]/RC[-2] -> 0.7
A907: 113 | B907: 2 | C907: Thursday | D907: 4 | E907: 10am-11am | F907: 2 | G907: 2 | H907: 20 | I907: 0 | J907: =RC[-1]/RC[-2] -> 0
A908: 113 | B908: 2 | C908: Thursday | D908: 4 | E908: 11am-12pm | F908: 3 | G908: 1 | H908: 20 | I908: 20 | J908: =RC[-1]/RC[-2] -> 1
A909: 113 | B909: 2 | C909: Thursday | D909: 4 | E909: 12pm-1pm | F909: 4 | G909: 1 | H909: 20 | I909: 20 | J909: =RC[-1]/RC[-2] -> 1
A910: 113 | B910: 2 | C910: Thursday | D910: 4 | E910: 1pm-2pm | F910: 5 | G910: 2 | H910: 20 | I910: 0 | J910: =RC[-1]/RC[-2] -> 0
A911: 113 | B911: 2 | C911: Thursday | D911: 4 | E911: 2pm-3pm | F911: 6 | G911: 1 | H911: 20 | I911: 9 | J911: =RC[-1]/RC[-2] -> 0.45
A912: 113 | B912: 2 | C912: Thursday | D912: 4 | E912: 3pm-4pm | F912: 7 | G912: 2 | H912: 20 | I912: 0 | J912: =RC[-1]/RC[-2] -> 0
A913: 113 | B913: 2 | C913: Thursday | D913: 4 | E913: 4pm-5pm | F913: 8 | G913: 2 | H913: 20 | I913: 0 | J913: =RC[-1]/RC[-2] -> 0
A914: 113 | B914: 2 | C914: Friday | D914: 5 | E914: 9am-10am | F914: 1 | G914: 2 | H914: 20 | I914: 0 | J914: =RC[-1]/RC[-2] -> 0
A915: 113 | B915: 2 | C915: Friday | D915: 5 | E915: 10am-11am | F915: 2 | G915: 1 | H915: 20 | I915: 16 | J915: =RC[-1]/RC[-2] -> 0.8
A916: 113 | B916: 2 | C916: Friday | D916: 5 | E916: 11am-12pm | F916: 3 | G916: 2 | H916: 20 | I916: 0 | J916: =RC[-1]/RC[-2] -> 0
A917: 113 | B917: 2 | C917: Friday | D917: 5 | E917: 12pm-1pm | F917: 4 | G917: 1 | H917: 20 | I917: 13 | J917: =RC[-1]/RC[-2] -> 0.65
A918: 113 | B918: 2 | C918: Friday | D918: 5 | E918: 1pm-2pm | F918: 5 | G918: 1 | H918: 20 | I918: 11 | J918: =RC[-1]/RC[-2] -> 0.55
A919: 113 | B919: 2 | C919: Friday | D919: 5 | E919: 2pm-3pm | F919: 6 | G919: 2 | H919: 20 | I919: 0 | J919: =RC[-1]/RC[-2] -> 0
A920: 113 | B920: 2 | C920: Friday | D920: 5 | E920: 3pm-4pm | F920: 7 | G920: 2 | H920: 20 | I920: 0 | J920: =RC[-1]/RC[-2] -> 0
A921: 113 | B921: 2 | C921: Friday | D921: 5 | E921: 4pm-5pm | F921: 8 | G921: 2 | H921: 20 | I921: 0 | J921: =RC[-1]/RC[-2] -> 0
A922: 117 | B922: 2 | C922: Monday | D922: 1 | E922: 9am-10am | F922: 1 | G922: 2 | H922: 20 | I922: 0 | J922: =RC[-1]/RC[-2] -> 0
A923: 117 | B923: 2 | C923: Monday | D923: 1 | E923: 10am-11am | F923: 2 | G923: 3 | H923: 20 | I923: 2 | J923: =RC[-1]/RC[-2] -> 0.1
A924: 117 | B924: 2 | C924: Monday | D924: 1 | E924: 11am-12pm | F924: 3 | G924: 2 | H924: 20 | I924: 0 | J924: =RC[-1]/RC[-2] -> 0
A925: 117 | B925: 2 | C925: Monday | D925: 1 | E925: 12pm-1pm | F925: 4 | G925: 2 | H925: 20 | I925: 0 | J925: =RC[-1]/RC[-2] -> 0
A926: 117 | B926: 2 | C926: Monday | D926: 1 | E926: 1pm-2pm | F926: 5 | G926: 2 | H926: 20 | I926: 0 | J926: =RC[-1]/RC[-2] -> 0
A927: 117 | B927: 2 | C927: Monday | D927: 1 | E927: 2pm-3pm | F927: 6 | G927: 1 | H927: 20 | I927: 18 | J927: =RC[-1]/RC[-2] -> 0.9
A928: 117 | B928: 2 | C928: Monday | D928: 1 | E928: 3pm-4pm | F928: 7 | G928: 1 | H928: 20 | I928: 19 | J928: =RC[-1]/RC[-2] -> 0.95
A929: 117 | B929: 2 | C929: Monday | D929: 1 | E929: 4pm-5pm | F929: 8 | G929: 1 | H929: 20 | I929: 4 | J929: =RC[-1]/RC[-2] -> 0.2
A930: 117 | B930: 2 | C930: Tuesday | D930: 2 | E930: 9am-10am | F930: 1 | G930: 3 | H930: 20 | I930: 1 | J930: =RC[-1]/RC[-2] -> 0.05
A931: 117 | B931: 2 | C931: Tuesday | D931: 2 | E931: 10am-11am | F931: 2 | G931: 1 | H931: 20 | I931: 20 | J931: =RC[-1]/RC[-2] -> 1
A932: 117 | B932: 2 | C932: Tuesday | D932: 2 | E932: 11am-12pm | F932: 3 | G932: 1 | H932: 20 | I932: 25 | J932: =RC[-1]/RC[-2] -> 1.25
A933: 117 | B933: 2 | C933: Tuesday | D933: 2 | E933: 12pm-1pm | F933: 4 | G933: 1 | H933: 20 | I933: 4 | J933: =RC[-1]/RC[-2] -> 0.2
A934: 117 | B934: 2 | C934: Tuesday | D934: 2 | E934: 1pm-2pm | F934: 5 | G934: 2 | H934: 20 | I934: 0 | J934: =RC[-1]/RC[-2] -> 0
A935: 117 | B935: 2 | C935: Tuesday | D935: 2 | E935: 2pm-3pm | F935: 6 | G935: 1 | H935: 20 | I935: 20 | J935: =RC[-1]/RC[-2] -> 1
A936: 117 | B936: 2 | C936: Tuesday | D936: 2 | E936: 3pm-4pm | F936: 7 | G936: 1 | H936: 20 | I936: 22 | J936: =RC[-1]/RC[-2] -> 1.1
A937: 117 | B937: 2 | C937: Tuesday | D937: 2 | E937: 4pm-5pm | F937: 8 | G937: 1 | H937: 20 | I937: 25 | J937: =RC[-1]/RC[-2] -> 1.25
A938: 117 | B938: 2 | C938: Wednesday | D938: 3 | E938: 9am-10am | F938: 1 | G938: 1 | H938: 20 | I938: 18 | J938: =RC[-1]/RC[-2] -> 0.9
A939: 117 | B939: 2 | C939: Wednesday | D939: 3 | E939: 10am-11am | F939: 2 | G939: 1 | H939: 20 | I939: 20 | J939: =RC[-1]/RC[-2] -> 1
A940: 117 | B940: 2 | C940: Wednesday | D940: 3 | E940: 11am-12pm | F940: 3 | G940: 1 | H940: 20 | I940: 20 | J940: =RC[-1]/RC[-2] -> 1
A941: 117 | B941: 2 | C941: Wednesday | D941: 3 | E941: 12pm-1pm | F941: 4 | G941: 1 | H941: 20 | I941: 2 | J941: =RC[-1]/RC[-2] -> 0.1
A942: 117 | B942: 2 | C942: Wednesday | D942: 3 | E942: 1pm-2pm | F942: 5 | G942: 1 | H942: 20 | I942: 7 | J942: =RC[-1]/RC[-2] -> 0.35
A943: 117 | B943: 2 | C943: Wednesday | D943: 3 | E943: 2pm-3pm | F943: 6 | G943: 1 | H943: 20 | I943: 13 | J943: =RC[-1]/RC[-2] -> 0.65
A944: 117 | B944: 2 | C944: Wednesday | D944: 3 | E944: 3pm-4pm | F944: 7 | G944: 1 | H944: 20 | I944: 17 | J944: =RC[-1]/RC[-2] -> 0.85
A945: 117 | B945: 2 | C945: Wednesday | D945: 3 | E945: 4pm-5pm | F945: 8 | G945: 3 | H945: 20 | I945: 2 | J945: =RC[-1]/RC[-2] -> 0.1
A946: 117 | B946: 2 | C946: Thursday | D946: 4 | E946: 9am-10am | F946: 1 | G946: 3 | H946: 20 | I946: 1 | J946: =RC[-1]/RC[-2] -> 0.05
A947: 117 | B947: 2 | C947: Thursday | D947: 4 | E947: 10am-11am | F947: 2 | G947: 1 | H947: 20 | I947: 15 | J947: =RC[-1]/RC[-2] -> 0.75
A948: 117 | B948: 2 | C948: Thursday | D948: 4 | E948: 11am-12pm | F948: 3 | G948: 1 | H948: 20 | I948: 16 | J948: =RC[-1]/RC[-2] -> 0.8
A949: 117 | B949: 2 | C949: Thursday | D949: 4 | E949: 12pm-1pm | F949: 4 | G949: 1 | H949: 20 | I949: 13 | J949: =RC[-1]/RC[-2] -> 0.65
A950: 117 | B950: 2 | C950: Thursday | D950: 4 | E950: 1pm-2pm | F950: 5 | G950: 2 | H950: 20 | I950: 0 | J950: =RC[-1]/RC[-2] -> 0
A951: 117 | B951: 2 | C951: Thursday | D951: 4 | E951: 2pm-3pm | F951: 6 | G951: 1 | H951: 20 | I951: 20 | J951: =RC[-1]/RC[-2] -> 1
A952: 117 | B952: 2 | C952: Thursday | D952: 4 | E952: 3pm-4pm | F952: 7 | G952: 1 | H952: 20 | I952: 17 | J952: =RC[-1]/RC[-2] -> 0.85
A953: 117 | B953: 2 | C953: Thursday | D953: 4 | E953: 4pm-5pm | F953: 8 | G953: 1 | H953: 20 | I953: 7 | J953: =RC[-1]/RC[-2] -> 0.35
A954: 117 | B954: 2 | C954: Friday | D954: 5 | E954: 9am-10am | F954: 1 | G954: 2 | H954: 20 | I954: 0 | J954: =RC[-1]/RC[-2] -> 0
A955: 117 | B955: 2 | C955: Friday | D955: 5 | E955: 10am-11am | F955: 2 | G955: 2 | H955: 20 | I955: 0 | J955: =RC[-1]/RC[-2] -> 0
A956: 117 | B956: 2 | C956: Friday | D956: 5 | E956: 11am-12pm | F956: 3 | G956: 2 | H956: 20 | I956: 0 | J956: =RC[-1]/RC[-2] -> 0
A957: 117 | B957: 2 | C957: Friday | D957: 5 | E957: 12pm-1pm | F957: 4 | G957: 2 | H957: 20 | I957: 0 | J957: =RC[-1]/RC[-2] -> 0
A958: 117 | B958: 2 | C958: Friday | D958: 5 | E958: 1pm-2pm | F958: 5 | G958: 2 | H958: 20 | I958: 0 | J958: =RC[-1]/RC[-2] -> 0
A959: 117 | B959: 2 | C959: Friday | D959: 5 | E959: 2pm-3pm | F959: 6 | G959: 1 | H959: 20 | I959: 19 | J959: =RC[-1]/RC[-2] -> 0.95
A960: 117 | B960: 2 | C960: Friday | D960: 5 | E960: 3pm-4pm | F960: 7 | G960: 1 | H960: 20 | I960: 10 | J960: =RC[-1]/RC[-2] -> 0.5
A961: 117 | B961: 2 | C961: Friday | D961: 5 | E961: 4pm-5pm | F961: 8 | G961: 2 | H961: 20 | I961: 0 | J961: =RC[-1]/RC[-2] -> 0
A962: 118 | B962: 2 | C962: Monday | D962: 1 | E962: 9am-10am | F962: 1 | G962: 3 | H962: 6 | I962: 1 | J962: =RC[-1]/RC[-2] -> 0.16666666666666666
A963: 118 | B963: 2 | C963: Monday | D963: 1 | E963: 10am-11am | F963: 2 | G963: 2 | H963: 6 | I963: 0 | J963: =RC[-1]/RC[-2] -> 0
A964: 118 | B964: 2 | C964: Monday | D964: 1 | E964: 11am-12pm | F964: 3 | G964: 2 | H964: 6 | I964: 0 | J964: =RC[-1]/RC[-2] -> 0
A965: 118 | B965: 2 | C965: Monday | D965: 1 | E965: 12pm-1pm | F965: 4 | G965: 2 | H965: 6 | I965: 0 | J965: =RC[-1]/RC[-2] -> 0
A966: 118 | B966: 2 | C966: Monday | D966: 1 | E966: 1pm-2pm | F966: 5 | G966: 2 | H966: 6 | I966: 0 | J966: =RC[-1]/RC[-2] -> 0
A967: 118 | B967: 2 | C967: Monday | D967: 1 | E967: 2pm-3pm | F967: 6 | G967: 2 | H967: 6 | I967: 0 | J967: =RC[-1]/RC[-2] -> 0
A968: 118 | B968: 2 | C968: Monday | D968: 1 | E968: 3pm-4pm | F968: 7 | G968: 1 | H968: 6 | I968: 2 | J968: =RC[-1]/RC[-2] -> 0.33333333333333331
A969: 118 | B969: 2 | C969: Monday | D969: 1 | E969: 4pm-5pm | F969: 8 | G969: 2 | H969: 6 | I969: 0 | J969: =RC[-1]/RC[-2] -> 0
A970: 118 | B970: 2 | C970: Tuesday | D970: 2 | E970: 9am-10am | F970: 1 | G970: 2 | H970: 6 | I970: 0 | J970: =RC[-1]/RC[-2] -> 0
A971: 118 | B971: 2 | C971: Tuesday | D971: 2 | E971: 10am-11am | F971: 2 | G971: 2 | H971: 6 | I971: 0 | J971: =RC[-1]/RC[-2] -> 0
A972: 118 | B972: 2 | C972: Tuesday | D972: 2 | E972: 11am-12pm | F972: 3 | G972: 1 | H972: 6 | I972: 2 | J972: =RC[-1]/RC[-2] -> 0.33333333333333331
A973: 118 | B973: 2 | C973: Tuesday | D973: 2 | E973: 12pm-1pm | F973: 4 | G973: 2 | H973: 6 | I973: 0 | J973: =RC[-1]/RC[-2] -> 0
A974: 118 | B974: 2 | C974: Tuesday | D974: 2 | E974: 1pm-2pm | F974: 5 | G974: 1 | H974: 6 | I974: 7 | J974: =RC[-1]/RC[-2] -> 1.1666666666666667
A975: 118 | B975: 2 | C975: Tuesday | D975: 2 | E975: 2pm-3pm | F975: 6 | G975: 1 | H975: 6 | I975: 2 | J975: =RC[-1]/RC[-2] -> 0.33333333333333331
A976: 118 | B976: 2 | C976: Tuesday | D976: 2 | E976: 3pm-4pm | F976: 7 | G976: 1 | H976: 6 | I976: 1 | J976: =RC[-1]/RC[-2] -> 0.16666666666666666
A977: 118 | B977: 2 | C977: Tuesday | D977: 2 | E977: 4pm-5pm | F977: 8 | G977: 1 | H977: 6 | I977: 3 | J977: =RC[-1]/RC[-2] -> 0.5
A978: 118 | B978: 2 | C978: Wednesday | D978: 3 | E978: 9am-10am | F978: 1 | G978: 2 | H978: 6 | I978: 0 | J978: =RC[-1]/RC[-2] -> 0
A979: 118 | B979: 2 | C979: Wednesday | D979: 3 | E979: 10am-11am | F979: 2 | G979: 2 | H979: 6 | I979: 0 | J979: =RC[-1]/RC[-2] -> 0
A980: 118 | B980: 2 | C980: Wednesday | D980: 3 | E980: 11am-12pm | F980: 3 | G980: 1 | H980: 6 | I980: 1 | J980: =RC[-1]/RC[-2] -> 0.16666666666666666
A981: 118 | B981: 2 | C981: Wednesday | D981: 3 | E981: 12pm-1pm | F981: 4 | G981: 2 | H981: 6 | I981: 0 | J981: =RC[-1]/RC[-2] -> 0
A982: 118 | B982: 2 | C982: Wednesday | D982: 3 | E982: 1pm-2pm | F982: 5 | G982: 2 | H982: 6 | I982: 0 | J982: =RC[-1]/RC[-2] -> 0
A983: 118 | B983: 2 | C983: Wednesday | D983: 3 | E983: 2pm-3pm | F983: 6 | G983: 2 | H983: 6 | I983: 0 | J983: =RC[-1]/RC[-2] -> 0
A984: 118 | B984: 2 | C984: Wednesday | D984: 3 | E984: 3pm-4pm | F984: 7 | G984: 1 | H984: 6 | I984: 3 | J984: =RC[-1]/RC[-2] -> 0.5
A985: 118 | B985: 2 | C985: Wednesday | D985: 3 | E985: 4pm-5pm | F985: 8 | G985: 2 | H985: 6 | I985: 0 | J985: =RC[-1]/RC[-2] -> 0
A986: 118 | B986: 2 | C986: Thursday | D986: 4 | E986: 9am-10am | F986: 1 | G986: 2 | H986: 6 | I986: 0 | J986: =RC[-1]/RC[-2] -> 0
A987: 118 | B987: 2 | C987: Thursday | D987: 4 | E987: 10am-11am | F987: 2 | G987: 2 | H987: 6 | I987: 0 | J987: =RC[-1]/RC[-2] -> 0
A988: 118 | B988: 2 | C988: Thursday | D988: 4 | E988: 11am-12pm | F988: 3 | G988: 1 | H988: 6 | I988: 1 | J988: =RC[-1]/RC[-2] -> 0.16666666666666666
A989: 118 | B989: 2 | C989: Thursday | D989: 4 | E989: 12pm-1pm | F989: 4 | G989: 1 | H989: 6 | I989: 1 | J989: =RC[-1]/RC[-2] -> 0.16666666666666666
A990: 118 | B990: 2 | C990: Thursday | D990: 4 | E990: 1pm-2pm | F990: 5 | G990: 1 | H990: 6 | I990: 1 | J990: =RC[-1]/RC[-2] -> 0.16666666666666666
A991: 118 | B991: 2 | C991: Thursday | D991: 4 | E991: 2pm-3pm | F991: 6 | G991: 1 | H991: 6 | I991: 1 | J991: =RC[-1]/RC[-2] -> 0.16666666666666666
A992: 118 | B992: 2 | C992: Thursday | D992: 4 | E992: 3pm-4pm | F992: 7 | G992: 3 | H992: 6 | I992: 1 | J992: =RC[-1]/RC[-2] -> 0.16666666666666666
A993: 118 | B993: 2 | C993: Thursday | D993: 4 | E993: 4pm-5pm | F993: 8 | G993: 2 | H993: 6 | I993: 0 | J993: =RC[-1]/RC[-2] -> 0
A994: 118 | B994: 2 | C994: Friday | D994: 5 | E994: 9am-10am | F994: 1 | G994: 3 | H994: 6 | I994: 1 | J994: =RC[-1]/RC[-2] -> 0.16666666666666666
A995: 118 | B995: 2 | C995: Friday | D995: 5 | E995: 10am-11am | F995: 2 | G995: 2 | H995: 6 | I995: 0 | J995: =RC[-1]/RC[-2] -> 0
A996: 118 | B996: 2 | C996: Friday | D996: 5 | E996: 11am-12pm | F996: 3 | G996: 3 | H996: 6 | I996: 1 | J996: =RC[-1]/RC[-2] -> 0.16666666666666666
A997: 118 | B997: 2 | C997: Friday | D997: 5 | E997: 12pm-1pm | F997: 4 | G997: 1 | H997: 6 | I997: 2 | J997: =RC[-1]/RC[-2] -> 0.33333333333333331
A998: 118 | B998: 2 | C998: Friday | D998: 5 | E998: 1pm-2pm | F998: 5 | G998: 1 | H998: 6 | I998: 3 | J998: =RC[-1]/RC[-2] -> 0.5
A999: 118 | B999: 2 | C999: Friday | D999: 5 | E999: 2pm-3pm | F999: 6 | G999: 2 | H999: 6 | I999: 0 | J999: =RC[-1]/RC[-2] -> 0
A1000: 118 | B1000: 2 | C1000: Friday | D1000: 5 | E1000: 3pm-4pm | F1000: 7 | G1000: 3 | H1000: 6 | I1000: 1 | J1000: =RC[-1]/RC[-2] -> 0.16666666666666666
A1001: 118 | B1001: 2 | C1001: Friday | D1001: 5 | E1001: 4pm-5pm | F1001: 8 | G1001: 1 | H1001: 6 | I1001: 4 | J1001: =RC[-1]/RC[-2] -> 0.66666666666666663
A1002: 119 | B1002: 2 | C1002: Monday | D1002: 1 | E1002: 9am-10am | F1002: 1 | G1002: 2 | H1002: 20 | I1002: 0 | J1002: =RC[-1]/RC[-2] -> 0
A1003: 119 | B1003: 2 | C1003: Monday | D1003: 1 | E1003: 10am-11am | F1003: 2 | G1003: 1 | H1003: 20 | I1003: 22 | J1003: =RC[-1]/RC[-2] -> 1.1
A1004: 119 | B1004: 2 | C1004: Monday | D1004: 1 | E1004: 11am-12pm | F1004: 3 | G1004: 1 | H1004: 20 | I1004: 22 | J1004: =RC[-1]/RC[-2] -> 1.1
A1005: 119 | B1005: 2 | C1005: Monday | D1005: 1 | E1005: 12pm-1pm | F1005: 4 | G1005: 1 | H1005: 20 | I1005: 22 | J1005: =RC[-1]/RC[-2] -> 1.1
A1006: 119 | B1006: 2 | C1006: Monday | D1006: 1 | E1006: 1pm-2pm | F1006: 5 | G1006: 2 | H1006: 20 | I1006: 0 | J1006: =RC[-1]/RC[-2] -> 0
A1007: 119 | B1007: 2 | C1007: Monday | D1007: 1 | E1007: 2pm-3pm | F1007: 6 | G1007: 1 | H1007: 20 | I1007: 18 | J1007: =RC[-1]/RC[-2] -> 0.9
A1008: 119 | B1008: 2 | C1008: Monday | D1008: 1 | E1008: 3pm-4pm | F1008: 7 | G1008: 2 | H1008: 20 | I1008: 0 | J1008: =RC[-1]/RC[-2] -> 0
A1009: 119 | B1009: 2 | C1009: Monday | D1009: 1 | E1009: 4pm-5pm | F1009: 8 | G1009: 1 | H1009: 20 | I1009: 4 | J1009: =RC[-1]/RC[-2] -> 0.2
A1010: 119 | B1010: 2 | C1010: Tuesday | D1010: 2 | E1010: 9am-10am | F1010: 1 | G1010: 2 | H1010: 20 | I1010: 0 | J1010: =RC[-1]/RC[-2] -> 0
A1011: 119 | B1011: 2 | C1011: Tuesday | D1011: 2 | E1011: 10am-11am | F1011: 2 | G1011: 2 | H1011: 20 | I1011: 0 | J1011: =RC[-1]/RC[-2] -> 0
A1012: 119 | B1012: 2 | C1012: Tuesday | D1012: 2 | E1012: 11am-12pm | F1012: 3 | G1012: 1 | H1012: 20 | I1012: 1 | J1012: =RC[-1]/RC[-2] -> 0.05
A1013: 119 | B1013: 2 | C1013: Tuesday | D1013: 2 | E1013: 12pm-1pm | F1013: 4 | G1013: 2 | H1013: 20 | I1013: 0 | J1013: =RC[-1]/RC[-2] -> 0
A1014: 119 | B1014: 2 | C1014: Tuesday | D1014: 2 | E1014: 1pm-2pm | F1014: 5 | G1014: 2 | H1014: 20 | I1014: 0 | J1014: =RC[-1]/RC[-2] -> 0
A1015: 119 | B1015: 2 | C1015: Tuesday | D1015: 2 | E1015: 2pm-3pm | F1015: 6 | G1015: 2 | H1015: 20 | I1015: 0 | J1015: =RC[-1]/RC[-2] -> 0
A1016: 119 | B1016: 2 | C1016: Tuesday | D1016: 2 | E1016: 3pm-4pm | F1016: 7 | G1016: 1 | H1016: 20 | I1016: 1 | J1016: =RC[-1]/RC[-2] -> 0.05
A1017: 119 | B1017: 2 | C1017: Tuesday | D1017: 2 | E1017: 4pm-5pm | F1017: 8 | G1017: 1 | H1017: 20 | I1017: 8 | J1017: =RC[-1]/RC[-2] -> 0.4
A1018: 119 | B1018: 2 | C1018: Wednesday | D1018: 3 | E1018: 9am-10am | F1018: 1 | G1018: 2 | H1018: 20 | I1018: 0 | J1018: =RC[-1]/RC[-2] -> 0
A1019: 119 | B1019: 2 | C1019: Wednesday | D1019: 3 | E1019: 10am-11am | F1019: 2 | G1019: 1 | H1019: 20 | I1019: 30 | J1019: =RC[-1]/RC[-2] -> 1.5
A1020: 119 | B1020: 2 | C1020: Wednesday | D1020: 3 | E1020: 11am-12pm | F1020: 3 | G1020: 3 | H1020: 20 | I1020: 1 | J1020: =RC[-1]/RC[-2] -> 0.05
A1021: 119 | B1021: 2 | C1021: Wednesday | D1021: 3 | E1021: 12pm-1pm | F1021: 4 | G1021: 1 | H1021: 20 | I1021: 1 | J1021: =RC[-1]/RC[-2] -> 0.05
A1022: 119 | B1022: 2 | C1022: Wednesday | D1022: 3 | E1022: 1pm-2pm | F1022: 5 | G1022: 1 | H1022: 20 | I1022: 10 | J1022: =RC[-1]/RC[-2] -> 0.5
A1023: 119 | B1023: 2 | C1023: Wednesday | D1023: 3 | E1023: 2pm-3pm | F1023: 6 | G1023: 2 | H1023: 20 | I1023: 0 | J1023: =RC[-1]/RC[-2] -> 0
A1024: 119 | B1024: 2 | C1024: Wednesday | D1024: 3 | E1024: 3pm-4pm | F1024: 7 | G1024: 2 | H1024: 20 | I1024: 0 | J1024: =RC[-1]/RC[-2] -> 0
A1025: 119 | B1025: 2 | C1025: Wednesday | D1025: 3 | E1025: 4pm-5pm | F1025: 8 | G1025: 2 | H1025: 20 | I1025: 0 | J1025: =RC[-1]/RC[-2] -> 0
A1026: 119 | B1026: 2 | C1026: Thursday | D1026: 4 | E1026: 9am-10am | F1026: 1 | G1026: 2 | H1026: 20 | I1026: 0 | J1026: =RC[-1]/RC[-2] -> 0
A1027: 119 | B1027: 2 | C1027: Thursday | D1027: 4 | E1027: 10am-11am | F1027: 2 | G1027: 2 | H1027: 20 | I1027: 0 | J1027: =RC[-1]/RC[-2] -> 0
A1028: 119 | B1028: 2 | C1028: Thursday | D1028: 4 | E1028: 11am-12pm | F1028: 3 | G1028: 2 | H1028: 20 | I1028: 0 | J1028: =RC[-1]/RC[-2] -> 0
A1029: 119 | B1029: 2 | C1029: Thursday | D1029: 4 | E1029: 12pm-1pm | F1029: 4 | G1029: 2 | H1029: 20 | I1029: 0 | J1029: =RC[-1]/RC[-2] -> 0
A1030: 119 | B1030: 2 | C1030: Thursday | D1030: 4 | E1030: 1pm-2pm | F1030: 5 | G1030: 2 | H1030: 20 | I1030: 0 | J1030: =RC[-1]/RC[-2] -> 0
A1031: 119 | B1031: 2 | C1031: Thursday | D1031: 4 | E1031: 2pm-3pm | F1031: 6 | G1031: 1 | H1031: 20 | I1031: 18 | J1031: =RC[-1]/RC[-2] -> 0.9
A1032: 119 | B1032: 2 | C1032: Thursday | D1032: 4 | E1032: 3pm-4pm | F1032: 7 | G1032: 1 | H1032: 20 | I1032: 8 | J1032: =RC[-1]/RC[-2] -> 0.4
A1033: 119 | B1033: 2 | C1033: Thursday | D1033: 4 | E1033: 4pm-5pm | F1033: 8 | G1033: 2 | H1033: 20 | I1033: 0 | J1033: =RC[-1]/RC[-2] -> 0
A1034: 119 | B1034: 2 | C1034: Friday | D1034: 5 | E1034: 9am-10am | F1034: 1 | G1034: 2 | H1034: 20 | I1034: 0 | J1034: =RC[-1]/RC[-2] -> 0
A1035: 119 | B1035: 2 | C1035: Friday | D1035: 5 | E1035: 10am-11am | F1035: 2 | G1035: 2 | H1035: 20 | I1035: 0 | J1035: =RC[-1]/RC[-2] -> 0
A1036: 119 | B1036: 2 | C1036: Friday | D1036: 5 | E1036: 11am-12pm | F1036: 3 | G1036: 2 | H1036: 20 | I1036: 0 | J1036: =RC[-1]/RC[-2] -> 0
A1037: 119 | B1037: 2 | C1037: Friday | D1037: 5 | E1037: 12pm-1pm | F1037: 4 | G1037: 2 | H1037: 20 | I1037: 0 | J1037: =RC[-1]/RC[-2] -> 0
A1038: 119 | B1038: 2 | C1038: Friday | D1038: 5 | E1038: 1pm-2pm | F1038: 5 | G1038: 2 | H1038: 20 | I1038: 0 | J1038: =RC[-1]/RC[-2] -> 0
A1039: 119 | B1039: 2 | C1039: Friday | D1039: 5 | E1039: 2pm-3pm | F1039: 6 | G1039: 2 | H1039: 20 | I1039: 0 | J1039: =RC[-1]/RC[-2] -> 0
A1040: 119 | B1040: 2 | C1040: Friday | D1040: 5 | E1040: 3pm-4pm | F1040: 7 | G1040: 2 | H1040: 20 | I1040: 0 | J1040: =RC[-1]/RC[-2] -> 0
A1041: 119 | B1041: 2 | C1041: Friday | D1041: 5 | E1041: 4pm-5pm | F1041: 8 | G1041: 2 | H1041: 20 | I1041: 0 | J1041: =RC[-1]/RC[-2] -> 0
A1042: 124 | B1042: 2 | C1042: Monday | D1042: 1 | E1042: 9am-10am | F1042: 1 | G1042: 2 | H1042: 44 | I1042: 0 | J1042: =RC[-1]/RC[-2] -> 0
A1043: 124 | B1043: 2 | C1043: Monday | D1043: 1 | E1043: 10am-11am | F1043: 2 | G1043: 3 | H1043: 44 | I1043: 1 | J1043: =RC[-1]/RC[-2] -> 2.2727272727272728E-2
A1044: 124 | B1044: 2 | C1044: Monday | D1044: 1 | E1044: 11am-12pm | F1044: 3 | G1044: 2 | H1044: 44 | I1044: 0 | J1044: =RC[-1]/RC[-2] -> 0
A1045: 124 | B1045: 2 | C1045: Monday | D1045: 1 | E1045: 12pm-1pm | F1045: 4 | G1045: 2 | H1045: 44 | I1045: 0 | J1045: =RC[-1]/RC[-2] -> 0
A1046: 124 | B1046: 2 | C1046: Monday | D1046: 1 | E1046: 1pm-2pm | F1046: 5 | G1046: 2 | H1046: 44 | I1046: 0 | J1046: =RC[-1]/RC[-2] -> 0
A1047: 124 | B1047: 2 | C1047: Monday | D1047: 1 | E1047: 2pm-3pm | F1047: 6 | G1047: 1 | H1047: 44 | I1047: 17 | J1047: =RC[-1]/RC[-2] -> 0.38636363636363635
A1048: 124 | B1048: 2 | C1048: Monday | D1048: 1 | E1048: 3pm-4pm | F1048: 7 | G1048: 1 | H1048: 44 | I1048: 16 | J1048: =RC[-1]/RC[-2] -> 0.36363636363636365
A1049: 124 | B1049: 2 | C1049: Monday | D1049: 1 | E1049: 4pm-5pm | F1049: 8 | G1049: 1 | H1049: 44 | I1049: 15 | J1049: =RC[-1]/RC[-2] -> 0.34090909090909088
A1050: 124 | B1050: 2 | C1050: Tuesday | D1050: 2 | E1050: 9am-10am | F1050: 1 | G1050: 2 | H1050: 44 | I1050: 0 | J1050: =RC[-1]/RC[-2] -> 0
A1051: 124 | B1051: 2 | C1051: Tuesday | D1051: 2 | E1051: 10am-11am | F1051: 2 | G1051: 2 | H1051: 44 | I1051: 0 | J1051: =RC[-1]/RC[-2] -> 0
A1052: 124 | B1052: 2 | C1052: Tuesday | D1052: 2 | E1052: 11am-12pm | F1052: 3 | G1052: 2 | H1052: 44 | I1052: 0 | J1052: =RC[-1]/RC[-2] -> 0
A1053: 124 | B1053: 2 | C1053: Tuesday | D1053: 2 | E1053: 12pm-1pm | F1053: 4 | G1053: 2 | H1053: 44 | I1053: 0 | J1053: =RC[-1]/RC[-2] -> 0
A1054: 124 | B1054: 2 | C1054: Tuesday | D1054: 2 | E1054: 1pm-2pm | F1054: 5 | G1054: 2 | H1054: 44 | I1054: 0 | J1054: =RC[-1]/RC[-2] -> 0
A1055: 124 | B1055: 2 | C1055: Tuesday | D1055: 2 | E1055: 2pm-3pm | F1055: 6 | G1055: 1 | H1055: 44 | I1055: 18 | J1055: =RC[-1]/RC[-2] -> 0.40909090909090912
A1056: 124 | B1056: 2 | C1056: Tuesday | D1056: 2 | E1056: 3pm-4pm | F1056: 7 | G1056: 1 | H1056: 44 | I1056: 6 | J1056: =RC[-1]/RC[-2] -> 0.13636363636363635
A1057: 124 | B1057: 2 | C1057: Tuesday | D1057: 2 | E1057: 4pm-5pm | F1057: 8 | G1057: 1 | H1057: 44 | I1057: 15 | J1057: =RC[-1]/RC[-2] -> 0.34090909090909088
A1058: 124 | B1058: 2 | C1058: Wednesday | D1058: 3 | E1058: 9am-10am | F1058: 1 | G1058: 3 | H1058: 44 | I1058: 1 | J1058: =RC[-1]/RC[-2] -> 2.2727272727272728E-2
A1059: 124 | B1059: 2 | C1059: Wednesday | D1059: 3 | E1059: 10am-11am | F1059: 2 | G1059: 2 | H1059: 44 | I1059: 0 | J1059: =RC[-1]/RC[-2] -> 0
A1060: 124 | B1060: 2 | C1060: Wednesday | D1060: 3 | E1060: 11am-12pm | F1060: 3 | G1060: 2 | H1060: 44 | I1060: 0 | J1060: =RC[-1]/RC[-2] -> 0
A1061: 124 | B1061: 2 | C1061: Wednesday | D1061: 3 | E1061: 12pm-1pm | F1061: 4 | G1061: 2 | H1061: 44 | I1061: 0 | J1061: =RC[-1]/RC[-2] -> 0
A1062: 124 | B1062: 2 | C1062: Wednesday | D1062: 3 | E1062: 1pm-2pm | F1062: 5 | G1062: 2 | H1062: 44 | I1062: 0 | J1062: =RC[-1]/RC[-2] -> 0
A1063: 124 | B1063: 2 | C1063: Wednesday | D1063: 3 | E1063: 2pm-3pm | F1063: 6 | G1063: 2 | H1063: 44 | I1063: 0 | J1063: =RC[-1]/RC[-2] -> 0
A1064: 124 | B1064: 2 | C1064: Wednesday | D1064: 3 | E1064: 3pm-4pm | F1064: 7 | G1064: 2 | H1064: 44 | I1064: 0 | J1064: =RC[-1]/RC[-2] -> 0
A1065: 124 | B1065: 2 | C1065: Wednesday | D1065: 3 | E1065: 4pm-5pm | F1065: 8 | G1065: 2 | H1065: 44 | I1065: 0 | J1065: =RC[-1]/RC[-2] -> 0
A1066: 124 | B1066: 2 | C1066: Thursday | D1066: 4 | E1066: 9am-10am | F1066: 1 | G1066: 1 | H1066: 44 | I1066: 16 | J1066: =RC[-1]/RC[-2] -> 0.36363636363636365
A1067: 124 | B1067: 2 | C1067: Thursday | D1067: 4 | E1067: 10am-11am | F1067: 2 | G1067: 1 | H1067: 44 | I1067: 16 | J1067: =RC[-1]/RC[-2] -> 0.36363636363636365
A1068: 124 | B1068: 2 | C1068: Thursday | D1068: 4 | E1068: 11am-12pm | F1068: 3 | G1068: 1 | H1068: 44 | I1068: 16 | J1068: =RC[-1]/RC[-2] -> 0.36363636363636365
A1069: 124 | B1069: 2 | C1069: Thursday | D1069: 4 | E1069: 12pm-1pm | F1069: 4 | G1069: 2 | H1069: 44 | I1069: 0 | J1069: =RC[-1]/RC[-2] -> 0
A1070: 124 | B1070: 2 | C1070: Thursday | D1070: 4 | E1070: 1pm-2pm | F1070: 5 | G1070: 2 | H1070: 44 | I1070: 0 | J1070: =RC[-1]/RC[-2] -> 0
A1071: 124 | B1071: 2 | C1071: Thursday | D1071: 4 | E1071: 2pm-3pm | F1071: 6 | G1071: 1 | H1071: 44 | I1071: 14 | J1071: =RC[-1]/RC[-2] -> 0.31818181818181818
A1072: 124 | B1072: 2 | C1072: Thursday | D1072: 4 | E1072: 3pm-4pm | F1072: 7 | G1072: 1 | H1072: 44 | I1072: 15 | J1072: =RC[-1]/RC[-2] -> 0.34090909090909088
A1073: 124 | B1073: 2 | C1073: Thursday | D1073: 4 | E1073: 4pm-5pm | F1073: 8 | G1073: 1 | H1073: 44 | I1073: 15 | J1073: =RC[-1]/RC[-2] -> 0.34090909090909088
A1074: 124 | B1074: 2 | C1074: Friday | D1074: 5 | E1074: 9am-10am | F1074: 1 | G1074: 3 | H1074: 44 | I1074: 1 | J1074: =RC[-1]/RC[-2] -> 2.2727272727272728E-2
A1075: 124 | B1075: 2 | C1075: Friday | D1075: 5 | E1075: 10am-11am | F1075: 2 | G1075: 3 | H1075: 44 | I1075: 1 | J1075: =RC[-1]/RC[-2] -> 2.2727272727272728E-2
A1076: 124 | B1076: 2 | C1076: Friday | D1076: 5 | E1076: 11am-12pm | F1076: 3 | G1076: 3 | H1076: 44 | I1076: 1 | J1076: =RC[-1]/RC[-2] -> 2.2727272727272728E-2
A1077: 124 | B1077: 2 | C1077: Friday | D1077: 5 | E1077: 12pm-1pm | F1077: 4 | G1077: 2 | H1077: 44 | I1077: 0 | J1077: =RC[-1]/RC[-2] -> 0
A1078: 124 | B1078: 2 | C1078: Friday | D1078: 5 | E1078: 1pm-2pm | F1078: 5 | G1078: 1 | H1078: 44 | I1078: 1 | J1078: =RC[-1]/RC[-2] -> 2.2727272727272728E-2
A1079: 124 | B1079: 2 | C1079: Friday | D1079: 5 | E1079: 2pm-3pm | F1079: 6 | G1079: 1 | H1079: 44 | I1079: 12 | J1079: =RC[-1]/RC[-2] -> 0.27272727272727271
A1080: 124 | B1080: 2 | C1080: Friday | D1080: 5 | E1080: 3pm-4pm | F1080: 7 | G1080: 1 | H1080: 44 | I1080: 12 | J1080: =RC[-1]/RC[-2] -> 0.27272727272727271
A1081: 124 | B1081: 2 | C1081: Friday | D1081: 5 | E1081: 4pm-5pm | F1081: 8 | G1081: 1 | H1081: 44 | I1081: 12 | J1081: =RC[-1]/RC[-2] -> 0.27272727272727271
A1082: 207 | B1082: 2 | C1082: Monday | D1082: 1 | E1082: 9am-10am | F1082: 1 | G1082: 2 | H1082: 4 | I1082: 0 | J1082: =RC[-1]/RC[-2] -> 0
A1083: 207 | B1083: 2 | C1083: Monday | D1083: 1 | E1083: 10am-11am | F1083: 2 | G1083: 2 | H1083: 4 | I1083: 0 | J1083: =RC[-1]/RC[-2] -> 0
A1084: 207 | B1084: 2 | C1084: Monday | D1084: 1 | E1084: 11am-12pm | F1084: 3 | G1084: 2 | H1084: 4 | I1084: 0 | J1084: =RC[-1]/RC[-2] -> 0
A1085: 207 | B1085: 2 | C1085: Monday | D1085: 1 | E1085: 12pm-1pm | F1085: 4 | G1085: 2 | H1085: 4 | I1085: 0 | J1085: =RC[-1]/RC[-2] -> 0
A1086: 207 | B1086: 2 | C1086: Monday | D1086: 1 | E1086: 1pm-2pm | F1086: 5 | G1086: 2 | H1086: 4 | I1086: 0 | J1086: =RC[-1]/RC[-2] -> 0
A1087: 207 | B1087: 2 | C1087: Monday | D1087: 1 | E1087: 2pm-3pm | F1087: 6 | G1087: 2 | H1087: 4 | I1087: 0 | J1087: =RC[-1]/RC[-2] -> 0
A1088: 207 | B1088: 2 | C1088: Monday | D1088: 1 | E1088: 3pm-4pm | F1088: 7 | G1088: 2 | H1088: 4 | I1088: 0 | J1088: =RC[-1]/RC[-2] -> 0
A1089: 207 | B1089: 2 | C1089: Monday | D1089: 1 | E1089: 4pm-5pm | F1089: 8 | G1089: 2 | H1089: 4 | I1089: 0 | J1089: =RC[-1]/RC[-2] -> 0
A1090: 207 | B1090: 2 | C1090: Tuesday | D1090: 2 | E1090: 9am-10am | F1090: 1 | G1090: 2 | H1090: 4 | I1090: 0 | J1090: =RC[-1]/RC[-2] -> 0
A1091: 207 | B1091: 2 | C1091: Tuesday | D1091: 2 | E1091: 10am-11am | F1091: 2 | G1091: 2 | H1091: 4 | I1091: 0 | J1091: =RC[-1]/RC[-2] -> 0
A1092: 207 | B1092: 2 | C1092: Tuesday | D1092: 2 | E1092: 11am-12pm | F1092: 3 | G1092: 2 | H1092: 4 | I1092: 0 | J1092: =RC[-1]/RC[-2] -> 0
A1093: 207 | B1093: 2 | C1093: Tuesday | D1093: 2 | E1093: 12pm-1pm | F1093: 4 | G1093: 2 | H1093: 4 | I1093: 0 | J1093: =RC[-1]/RC[-2] -> 0
A1094: 207 | B1094: 2 | C1094: Tuesday | D1094: 2 | E1094: 1pm-2pm | F1094: 5 | G1094: 2 | H1094: 4 | I1094: 0 | J1094: =RC[-1]/RC[-2] -> 0
A1095: 207 | B1095: 2 | C1095: Tuesday | D1095: 2 | E1095: 2pm-3pm | F1095: 6 | G1095: 2 | H1095: 4 | I1095: 0 | J1095: =RC[-1]/RC[-2] -> 0
A1096: 207 | B1096: 2 | C1096: Tuesday | D1096: 2 | E1096: 3pm-4pm | F1096: 7 | G1096: 2 | H1096: 4 | I1096: 0 | J1096: =RC[-1]/RC[-2] -> 0
A1097: 207 | B1097: 2 | C1097: Tuesday | D1097: 2 | E1097: 4pm-5pm | F1097: 8 | G1097: 2 | H1097: 4 | I1097: 0 | J1097: =RC[-1]/RC[-2] -> 0
A1098: 207 | B1098: 2 | C1098: Wednesday | D1098: 3 | E1098: 9am-10am | F1098: 1 | G1098: 2 | H1098: 4 | I1098: 0 | J1098: =RC[-1]/RC[-2] -> 0
A1099: 207 | B1099: 2 | C1099: Wednesday | D1099: 3 | E1099: 10am-11am | F1099: 2 | G1099: 2 | H1099: 4 | I1099: 0 | J1099: =RC[-1]/RC[-2] -> 0
A1100: 207 | B1100: 2 | C1100: Wednesday | D1100: 3 | E1100: 11am-12pm | F1100: 3 | G1100: 2 | H1100: 4 | I1100: 0 | J1100: =RC[-1]/RC[-2] -> 0
A1101: 207 | B1101: 2 | C1101: Wednesday | D1101: 3 | E1101: 12pm-1pm | F1101: 4 | G1101: 2 | H1101: 4 | I1101: 0 | J1101: =RC[-1]/RC[-2] -> 0
A1102: 207 | B1102: 2 | C1102: Wednesday | D1102: 3 | E1102: 1pm-2pm | F1102: 5 | G1102: 2 | H1102: 4 | I1102: 0 | J1102: =RC[-1]/RC[-2] -> 0
A1103: 207 | B1103: 2 | C1103: Wednesday | D1103: 3 | E1103: 2pm-3pm | F1103: 6 | G1103: 2 | H1103: 4 | I1103: 0 | J1103: =RC[-1]/RC[-2] -> 0
A1104: 207 | B1104: 2 | C1104: Wednesday | D1104: 3 | E1104: 3pm-4pm | F1104: 7 | G1104: 2 | H1104: 4 | I1104: 0 | J1104: =RC[-1]/RC[-2] -> 0
A1105: 207 | B1105: 2 | C1105: Wednesday | D1105: 3 | E1105: 4pm-5pm | F1105: 8 | G1105: 2 | H1105: 4 | I1105: 0 | J1105: =RC[-1]/RC[-2] -> 0
A1106: 207 | B1106: 2 | C1106: Thursday | D1106: 4 | E1106: 9am-10am | F1106: 1 | G1106: 2 | H1106: 4 | I1106: 0 | J1106: =RC[-1]/RC[-2] -> 0
A1107: 207 | B1107: 2 | C1107: Thursday | D1107: 4 | E1107: 10am-11am | F1107: 2 | G1107: 2 | H1107: 4 | I1107: 0 | J1107: =RC[-1]/RC[-2] -> 0
A1108: 207 | B1108: 2 | C1108: Thursday | D1108: 4 | E1108: 11am-12pm | F1108: 3 | G1108: 2 | H1108: 4 | I1108: 0 | J1108: =RC[-1]/RC[-2] -> 0
A1109: 207 | B1109: 2 | C1109: Thursday | D1109: 4 | E1109: 12pm-1pm | F1109: 4 | G1109: 2 | H1109: 4 | I1109: 0 | J1109: =RC[-1]/RC[-2] -> 0
A1110: 207 | B1110: 2 | C1110: Thursday | D1110: 4 | E1110: 1pm-2pm | F1110: 5 | G1110: 2 | H1110: 4 | I1110: 0 | J1110: =RC[-1]/RC[-2] -> 0
A1111: 207 | B1111: 2 | C1111: Thursday | D1111: 4 | E1111: 2pm-3pm | F1111: 6 | G1111: 2 | H1111: 4 | I1111: 0 | J1111: =RC[-1]/RC[-2] -> 0
A1112: 207 | B1112: 2 | C1112: Thursday | D1112: 4 | E1112: 3pm-4pm | F1112: 7 | G1112: 2 | H1112: 4 | I1112: 0 | J1112: =RC[-1]/RC[-2] -> 0
A1113: 207 | B1113: 2 | C1113: Thursday | D1113: 4 | E1113: 4pm-5pm | F1113: 8 | G1113: 2 | H1113: 4 | I1113: 0 | J1113: =RC[-1]/RC[-2] -> 0
A1114: 207 | B1114: 2 | C1114: Friday | D1114: 5 | E1114: 9am-10am | F1114: 1 | G1114: 2 | H1114: 4 | I1114: 0 | J1114: =RC[-1]/RC[-2] -> 0
A1115: 207 | B1115: 2 | C1115: Friday | D1115: 5 | E1115: 10am-11am | F1115: 2 | G1115: 2 | H1115: 4 | I1115: 0 | J1115: =RC[-1]/RC[-2] -> 0
A1116: 207 | B1116: 2 | C1116: Friday | D1116: 5 | E1116: 11am-12pm | F1116: 3 | G1116: 2 | H1116: 4 | I1116: 0 | J1116: =RC[-1]/RC[-2] -> 0
A1117: 207 | B1117: 2 | C1117: Friday | D1117: 5 | E1117: 12pm-1pm | F1117: 4 | G1117: 2 | H1117: 4 | I1117: 0 | J1117: =RC[-1]/RC[-2] -> 0
A1118: 207 | B1118: 2 | C1118: Friday | D1118: 5 | E1118: 1pm-2pm | F1118: 5 | G1118: 2 | H1118: 4 | I1118: 0 | J1118: =RC[-1]/RC[-2] -> 0
A1119: 207 | B1119: 2 | C1119: Friday | D1119: 5 | E1119: 2pm-3pm | F1119: 6 | G1119: 2 | H1119: 4 | I1119: 0 | J1119: =RC[-1]/RC[-2] -> 0
A1120: 207 | B1120: 2 | C1120: Friday | D1120: 5 | E1120: 3pm-4pm | F1120: 7 | G1120: 2 | H1120: 4 | I1120: 0 | J1120: =RC[-1]/RC[-2] -> 0
A1121: 207 | B1121: 2 | C1121: Friday | D1121: 5 | E1121: 4pm-5pm | F1121: 8 | G1121: 2 | H1121: 4 | I1121: 0 | J1121: =RC[-1]/RC[-2] -> 0
A1122: 208 | B1122: 2 | C1122: Monday | D1122: 1 | E1122: 9am-10am | F1122: 1 | G1122: 2 | H1122: 4 | I1122: 0 | J1122: =RC[-1]/RC[-2] -> 0
A1123: 208 | B1123: 2 | C1123: Monday | D1123: 1 | E1123: 10am-11am | F1123: 2 | G1123: 2 | H1123: 4 | I1123: 0 | J1123: =RC[-1]/RC[-2] -> 0
A1124: 208 | B1124: 2 | C1124: Monday | D1124: 1 | E1124: 11am-12pm | F1124: 3 | G1124: 2 | H1124: 4 | I1124: 0 | J1124: =RC[-1]/RC[-2] -> 0
A1125: 208 | B1125: 2 | C1125: Monday | D1125: 1 | E1125: 12pm-1pm | F1125: 4 | G1125: 2 | H1125: 4 | I1125: 0 | J1125: =RC[-1]/RC[-2] -> 0
A1126: 208 | B1126: 2 | C1126: Monday | D1126: 1 | E1126: 1pm-2pm | F1126: 5 | G1126: 2 | H1126: 4 | I1126: 0 | J1126: =RC[-1]/RC[-2] -> 0
A1127: 208 | B1127: 2 | C1127: Monday | D1127: 1 | E1127: 2pm-3pm | F1127: 6 | G1127: 1 | H1127: 4 | I1127: 1 | J1127: =RC[-1]/RC[-2] -> 0.25
A1128: 208 | B1128: 2 | C1128: Monday | D1128: 1 | E1128: 3pm-4pm | F1128: 7 | G1128: 3 | H1128: 4 | I1128: 2 | J1128: =RC[-1]/RC[-2] -> 0.5
A1129: 208 | B1129: 2 | C1129: Monday | D1129: 1 | E1129: 4pm-5pm | F1129: 8 | G1129: 2 | H1129: 4 | I1129: 0 | J1129: =RC[-1]/RC[-2] -> 0
A1130: 208 | B1130: 2 | C1130: Tuesday | D1130: 2 | E1130: 9am-10am | F1130: 1 | G1130: 3 | H1130: 4 | I1130: 1 | J1130: =RC[-1]/RC[-2] -> 0.25
A1131: 208 | B1131: 2 | C1131: Tuesday | D1131: 2 | E1131: 10am-11am | F1131: 2 | G1131: 2 | H1131: 4 | I1131: 0 | J1131: =RC[-1]/RC[-2] -> 0
A1132: 208 | B1132: 2 | C1132: Tuesday | D1132: 2 | E1132: 11am-12pm | F1132: 3 | G1132: 2 | H1132: 4 | I1132: 0 | J1132: =RC[-1]/RC[-2] -> 0
A1133: 208 | B1133: 2 | C1133: Tuesday | D1133: 2 | E1133: 12pm-1pm | F1133: 4 | G1133: 2 | H1133: 4 | I1133: 0 | J1133: =RC[-1]/RC[-2] -> 0
A1134: 208 | B1134: 2 | C1134: Tuesday | D1134: 2 | E1134: 1pm-2pm | F1134: 5 | G1134: 2 | H1134: 4 | I1134: 0 | J1134: =RC[-1]/RC[-2] -> 0
A1135: 208 | B1135: 2 | C1135: Tuesday | D1135: 2 | E1135: 2pm-3pm | F1135: 6 | G1135: 2 | H1135: 4 | I1135: 0 | J1135: =RC[-1]/RC[-2] -> 0
A1136: 208 | B1136: 2 | C1136: Tuesday | D1136: 2 | E1136: 3pm-4pm | F1136: 7 | G1136: 2 | H1136: 4 | I1136: 0 | J1136: =RC[-1]/RC[-2] -> 0
A1137: 208 | B1137: 2 | C1137: Tuesday | D1137: 2 | E1137: 4pm-5pm | F1137: 8 | G1137: 2 | H1137: 4 | I1137: 0 | J1137: =RC[-1]/RC[-2] -> 0
A1138: 208 | B1138: 2 | C1138: Wednesday | D1138: 3 | E1138: 9am-10am | F1138: 1 | G1138: 2 | H1138: 4 | I1138: 0 | J1138: =RC[-1]/RC[-2] -> 0
A1139: 208 | B1139: 2 | C1139: Wednesday | D1139: 3 | E1139: 10am-11am | F1139: 2 | G1139: 2 | H1139: 4 | I1139: 0 | J1139: =RC[-1]/RC[-2] -> 0
A1140: 208 | B1140: 2 | C1140: Wednesday | D1140: 3 | E1140: 11am-12pm | F1140: 3 | G1140: 2 | H1140: 4 | I1140: 0 | J1140: =RC[-1]/RC[-2] -> 0
A1141: 208 | B1141: 2 | C1141: Wednesday | D1141: 3 | E1141: 12pm-1pm | F1141: 4 | G1141: 2 | H1141: 4 | I1141: 0 | J1141: =RC[-1]/RC[-2] -> 0
A1142: 208 | B1142: 2 | C1142: Wednesday | D1142: 3 | E1142: 1pm-2pm | F1142: 5 | G1142: 2 | H1142: 4 | I1142: 0 | J1142: =RC[-1]/RC[-2] -> 0
A1143: 208 | B1143: 2 | C1143: Wednesday | D1143: 3 | E1143: 2pm-3pm | F1143: 6 | G1143: 2 | H1143: 4 | I1143: 0 | J1143: =RC[-1]/RC[-2] -> 0
A1144: 208 | B1144: 2 | C1144: Wednesday | D1144: 3 | E1144: 3pm-4pm | F1144: 7 | G1144: 2 | H1144: 4 | I1144: 0 | J1144: =RC[-1]/RC[-2] -> 0
A1145: 208 | B1145: 2 | C1145: Wednesday | D1145: 3 | E1145: 4pm-5pm | F1145: 8 | G1145: 2 | H1145: 4 | I1145: 0 | J1145: =RC[-1]/RC[-2] -> 0
A1146: 208 | B1146: 2 | C1146: Thursday | D1146: 4 | E1146: 9am-10am | F1146: 1 | G1146: 3 | H1146: 4 | I1146: 1 | J1146: =RC[-1]/RC[-2] -> 0.25
A1147: 208 | B1147: 2 | C1147: Thursday | D1147: 4 | E1147: 10am-11am | F1147: 2 | G1147: 2 | H1147: 4 | I1147: 0 | J1147: =RC[-1]/RC[-2] -> 0
A1148: 208 | B1148: 2 | C1148: Thursday | D1148: 4 | E1148: 11am-12pm | F1148: 3 | G1148: 2 | H1148: 4 | I1148: 0 | J1148: =RC[-1]/RC[-2] -> 0
A1149: 208 | B1149: 2 | C1149: Thursday | D1149: 4 | E1149: 12pm-1pm | F1149: 4 | G1149: 2 | H1149: 4 | I1149: 0 | J1149: =RC[-1]/RC[-2] -> 0
A1150: 208 | B1150: 2 | C1150: Thursday | D1150: 4 | E1150: 1pm-2pm | F1150: 5 | G1150: 2 | H1150: 4 | I1150: 0 | J1150: =RC[-1]/RC[-2] -> 0
A1151: 208 | B1151: 2 | C1151: Thursday | D1151: 4 | E1151: 2pm-3pm | F1151: 6 | G1151: 2 | H1151: 4 | I1151: 0 | J1151: =RC[-1]/RC[-2] -> 0
A1152: 208 | B1152: 2 | C1152: Thursday | D1152: 4 | E1152: 3pm-4pm | F1152: 7 | G1152: 2 | H1152: 4 | I1152: 0 | J1152: =RC[-1]/RC[-2] -> 0
A1153: 208 | B1153: 2 | C1153: Thursday | D1153: 4 | E1153: 4pm-5pm | F1153: 8 | G1153: 2 | H1153: 4 | I1153: 0 | J1153: =RC[-1]/RC[-2] -> 0
A1154: 208 | B1154: 2 | C1154: Friday | D1154: 5 | E1154: 9am-10am | F1154: 1 | G1154: 2 | H1154: 4 | I1154: 0 | J1154: =RC[-1]/RC[-2] -> 0
A1155: 208 | B1155: 2 | C1155: Friday | D1155: 5 | E1155: 10am-11am | F1155: 2 | G1155: 2 | H1155: 4 | I1155: 0 | J1155: =RC[-1]/RC[-2] -> 0
A1156: 208 | B1156: 2 | C1156: Friday | D1156: 5 | E1156: 11am-12pm | F1156: 3 | G1156: 2 | H1156: 4 | I1156: 0 | J1156: =RC[-1]/RC[-2] -> 0
A1157: 208 | B1157: 2 | C1157: Friday | D1157: 5 | E1157: 12pm-1pm | F1157: 4 | G1157: 2 | H1157: 4 | I1157: 0 | J1157: =RC[-1]/RC[-2] -> 0
A1158: 208 | B1158: 2 | C1158: Friday | D1158: 5 | E1158: 1pm-2pm | F1158: 5 | G1158: 3 | H1158: 4 | I1158: 2 | J1158: =RC[-1]/RC[-2] -> 0.5
A1159: 208 | B1159: 2 | C1159: Friday | D1159: 5 | E1159: 2pm-3pm | F1159: 6 | G1159: 1 | H1159: 4 | I1159: 1 | J1159: =RC[-1]/RC[-2] -> 0.25
A1160: 208 | B1160: 2 | C1160: Friday | D1160: 5 | E1160: 3pm-4pm | F1160: 7 | G1160: 2 | H1160: 4 | I1160: 0 | J1160: =RC[-1]/RC[-2] -> 0
A1161: 208 | B1161: 2 | C1161: Friday | D1161: 5 | E1161: 4pm-5pm | F1161: 8 | G1161: 2 | H1161: 4 | I1161: 0 | J1161: =RC[-1]/RC[-2] -> 0
A1162: 209 | B1162: 2 | C1162: Monday | D1162: 1 | E1162: 9am-10am | F1162: 1 | G1162: 2 | H1162: 4 | I1162: 0 | J1162: =RC[-1]/RC[-2] -> 0
A1163: 209 | B1163: 2 | C1163: Monday | D1163: 1 | E1163: 10am-11am | F1163: 2 | G1163: 2 | H1163: 4 | I1163: 0 | J1163: =RC[-1]/RC[-2] -> 0
A1164: 209 | B1164: 2 | C1164: Monday | D1164: 1 | E1164: 11am-12pm | F1164: 3 | G1164: 2 | H1164: 4 | I1164: 0 | J1164: =RC[-1]/RC[-2] -> 0
A1165: 209 | B1165: 2 | C1165: Monday | D1165: 1 | E1165: 12pm-1pm | F1165: 4 | G1165: 2 | H1165: 4 | I1165: 0 | J1165: =RC[-1]/RC[-2] -> 0
A1166: 209 | B1166: 2 | C1166: Monday | D1166: 1 | E1166: 1pm-2pm | F1166: 5 | G1166: 2 | H1166: 4 | I1166: 0 | J1166: =RC[-1]/RC[-2] -> 0
A1167: 209 | B1167: 2 | C1167: Monday | D1167: 1 | E1167: 2pm-3pm | F1167: 6 | G1167: 3 | H1167: 4 | I1167: 1 | J1167: =RC[-1]/RC[-2] -> 0.25
A1168: 209 | B1168: 2 | C1168: Monday | D1168: 1 | E1168: 3pm-4pm | F1168: 7 | G1168: 2 | H1168: 4 | I1168: 0 | J1168: =RC[-1]/RC[-2] -> 0
A1169: 209 | B1169: 2 | C1169: Monday | D1169: 1 | E1169: 4pm-5pm | F1169: 8 | G1169: 2 | H1169: 4 | I1169: 0 | J1169: =RC[-1]/RC[-2] -> 0
A1170: 209 | B1170: 2 | C1170: Tuesday | D1170: 2 | E1170: 9am-10am | F1170: 1 | G1170: 2 | H1170: 4 | I1170: 0 | J1170: =RC[-1]/RC[-2] -> 0
A1171: 209 | B1171: 2 | C1171: Tuesday | D1171: 2 | E1171: 10am-11am | F1171: 2 | G1171: 3 | H1171: 4 | I1171: 1 | J1171: =RC[-1]/RC[-2] -> 0.25
A1172: 209 | B1172: 2 | C1172: Tuesday | D1172: 2 | E1172: 11am-12pm | F1172: 3 | G1172: 2 | H1172: 4 | I1172: 0 | J1172: =RC[-1]/RC[-2] -> 0
A1173: 209 | B1173: 2 | C1173: Tuesday | D1173: 2 | E1173: 12pm-1pm | F1173: 4 | G1173: 2 | H1173: 4 | I1173: 0 | J1173: =RC[-1]/RC[-2] -> 0
A1174: 209 | B1174: 2 | C1174: Tuesday | D1174: 2 | E1174: 1pm-2pm | F1174: 5 | G1174: 2 | H1174: 4 | I1174: 0 | J1174: =RC[-1]/RC[-2] -> 0
A1175: 209 | B1175: 2 | C1175: Tuesday | D1175: 2 | E1175: 2pm-3pm | F1175: 6 | G1175: 1 | H1175: 4 | I1175: 1 | J1175: =RC[-1]/RC[-2] -> 0.25
A1176: 209 | B1176: 2 | C1176: Tuesday | D1176: 2 | E1176: 3pm-4pm | F1176: 7 | G1176: 2 | H1176: 4 | I1176: 0 | J1176: =RC[-1]/RC[-2] -> 0
A1177: 209 | B1177: 2 | C1177: Tuesday | D1177: 2 | E1177: 4pm-5pm | F1177: 8 | G1177: 2 | H1177: 4 | I1177: 0 | J1177: =RC[-1]/RC[-2] -> 0
A1178: 209 | B1178: 2 | C1178: Wednesday | D1178: 3 | E1178: 9am-10am | F1178: 1 | G1178: 3 | H1178: 4 | I1178: 1 | J1178: =RC[-1]/RC[-2] -> 0.25
A1179: 209 | B1179: 2 | C1179: Wednesday | D1179: 3 | E1179: 10am-11am | F1179: 2 | G1179: 3 | H1179: 4 | I1179: 1 | J1179: =RC[-1]/RC[-2] -> 0.25
A1180: 209 | B1180: 2 | C1180: Wednesday | D1180: 3 | E1180: 11am-12pm | F1180: 3 | G1180: 2 | H1180: 4 | I1180: 0 | J1180: =RC[-1]/RC[-2] -> 0
A1181: 209 | B1181: 2 | C1181: Wednesday | D1181: 3 | E1181: 12pm-1pm | F1181: 4 | G1181: 2 | H1181: 4 | I1181: 0 | J1181: =RC[-1]/RC[-2] -> 0
A1182: 209 | B1182: 2 | C1182: Wednesday | D1182: 3 | E1182: 1pm-2pm | F1182: 5 | G1182: 2 | H1182: 4 | I1182: 0 | J1182: =RC[-1]/RC[-2] -> 0
A1183: 209 | B1183: 2 | C1183: Wednesday | D1183: 3 | E1183: 2pm-3pm | F1183: 6 | G1183: 3 | H1183: 4 | I1183: 1 | J1183: =RC[-1]/RC[-2] -> 0.25
A1184: 209 | B1184: 2 | C1184: Wednesday | D1184: 3 | E1184: 3pm-4pm | F1184: 7 | G1184: 2 | H1184: 4 | I1184: 0 | J1184: =RC[-1]/RC[-2] -> 0
A1185: 209 | B1185: 2 | C1185: Wednesday | D1185: 3 | E1185: 4pm-5pm | F1185: 8 | G1185: 2 | H1185: 4 | I1185: 0 | J1185: =RC[-1]/RC[-2] -> 0
A1186: 209 | B1186: 2 | C1186: Thursday | D1186: 4 | E1186: 9am-10am | F1186: 1 | G1186: 3 | H1186: 4 | I1186: 1 | J1186: =RC[-1]/RC[-2] -> 0.25
A1187: 209 | B1187: 2 | C1187: Thursday | D1187: 4 | E1187: 10am-11am | F1187: 2 | G1187: 2 | H1187: 4 | I1187: 0 | J1187: =RC[-1]/RC[-2] -> 0
A1188: 209 | B1188: 2 | C1188: Thursday | D1188: 4 | E1188: 11am-12pm | F1188: 3 | G1188: 2 | H1188: 4 | I1188: 0 | J1188: =RC[-1]/RC[-2] -> 0
A1189: 209 | B1189: 2 | C1189: Thursday | D1189: 4 | E1189: 12pm-1pm | F1189: 4 | G1189: 3 | H1189: 4 | I1189: 1 | J1189: =RC[-1]/RC[-2] -> 0.25
A1190: 209 | B1190: 2 | C1190: Thursday | D1190: 4 | E1190: 1pm-2pm | F1190: 5 | G1190: 2 | H1190: 4 | I1190: 0 | J1190: =RC[-1]/RC[-2] -> 0
A1191: 209 | B1191: 2 | C1191: Thursday | D1191: 4 | E1191: 2pm-3pm | F1191: 6 | G1191: 1 | H1191: 4 | I1191: 1 | J1191: =RC[-1]/RC[-2] -> 0.25
A1192: 209 | B1192: 2 | C1192: Thursday | D1192: 4 | E1192: 3pm-4pm | F1192: 7 | G1192: 1 | H1192: 4 | I1192: 1 | J1192: =RC[-1]/RC[-2] -> 0.25
A1193: 209 | B1193: 2 | C1193: Thursday | D1193: 4 | E1193: 4pm-5pm | F1193: 8 | G1193: 1 | H1193: 4 | I1193: 1 | J1193: =RC[-1]/RC[-2] -> 0.25
A1194: 209 | B1194: 2 | C1194: Friday | D1194: 5 | E1194: 9am-10am | F1194: 1 | G1194: 2 | H1194: 4 | I1194: 0 | J1194: =RC[-1]/RC[-2] -> 0
A1195: 209 | B1195: 2 | C1195: Friday | D1195: 5 | E1195: 10am-11am | F1195: 2 | G1195: 3 | H1195: 4 | I1195: 3 | J1195: =RC[-1]/RC[-2] -> 0.75
A1196: 209 | B1196: 2 | C1196: Friday | D1196: 5 | E1196: 11am-12pm | F1196: 3 | G1196: 2 | H1196: 4 | I1196: 0 | J1196: =RC[-1]/RC[-2] -> 0
A1197: 209 | B1197: 2 | C1197: Friday | D1197: 5 | E1197: 12pm-1pm | F1197: 4 | G1197: 2 | H1197: 4 | I1197: 0 | J1197: =RC[-1]/RC[-2] -> 0
A1198: 209 | B1198: 2 | C1198: Friday | D1198: 5 | E1198: 1pm-2pm | F1198: 5 | G1198: 2 | H1198: 4 | I1198: 0 | J1198: =RC[-1]/RC[-2] -> 0
A1199: 209 | B1199: 2 | C1199: Friday | D1199: 5 | E1199: 2pm-3pm | F1199: 6 | G1199: 2 | H1199: 4 | I1199: 0 | J1199: =RC[-1]/RC[-2] -> 0
A1200: 209 | B1200: 2 | C1200: Friday | D1200: 5 | E1200: 3pm-4pm | F1200: 7 | G1200: 3 | H1200: 4 | I1200: 1 | J1200: =RC[-1]/RC[-2] -> 0.25
A1201: 209 | B1201: 2 | C1201: Friday | D1201: 5 | E1201: 4pm-5pm | F1201: 8 | G1201: 3 | H1201: 4 | I1201: 1 | J1201: =RC[-1]/RC[-2] -> 0.25
A1202: 210 | B1202: 2 | C1202: Monday | D1202: 1 | E1202: 9am-10am | F1202: 1 | G1202: 2 | H1202: 3 | I1202: 0 | J1202: =RC[-1]/RC[-2] -> 0
A1203: 210 | B1203: 2 | C1203: Monday | D1203: 1 | E1203: 10am-11am | F1203: 2 | G1203: 2 | H1203: 3 | I1203: 0 | J1203: =RC[-1]/RC[-2] -> 0
A1204: 210 | B1204: 2 | C1204: Monday | D1204: 1 | E1204: 11am-12pm | F1204: 3 | G1204: 2 | H1204: 3 | I1204: 0 | J1204: =RC[-1]/RC[-2] -> 0
A1205: 210 | B1205: 2 | C1205: Monday | D1205: 1 | E1205: 12pm-1pm | F1205: 4 | G1205: 2 | H1205: 3 | I1205: 0 | J1205: =RC[-1]/RC[-2] -> 0
A1206: 210 | B1206: 2 | C1206: Monday | D1206: 1 | E1206: 1pm-2pm | F1206: 5 | G1206: 2 | H1206: 3 | I1206: 0 | J1206: =RC[-1]/RC[-2] -> 0
A1207: 210 | B1207: 2 | C1207: Monday | D1207: 1 | E1207: 2pm-3pm | F1207: 6 | G1207: 2 | H1207: 3 | I1207: 0 | J1207: =RC[-1]/RC[-2] -> 0
A1208: 210 | B1208: 2 | C1208: Monday | D1208: 1 | E1208: 3pm-4pm | F1208: 7 | G1208: 2 | H1208: 3 | I1208: 0 | J1208: =RC[-1]/RC[-2] -> 0
A1209: 210 | B1209: 2 | C1209: Monday | D1209: 1 | E1209: 4pm-5pm | F1209: 8 | G1209: 2 | H1209: 3 | I1209: 0 | J1209: =RC[-1]/RC[-2] -> 0
A1210: 210 | B1210: 2 | C1210: Tuesday | D1210: 2 | E1210: 9am-10am | F1210: 1 | G1210: 2 | H1210: 3 | I1210: 0 | J1210: =RC[-1]/RC[-2] -> 0
A1211: 210 | B1211: 2 | C1211: Tuesday | D1211: 2 | E1211: 10am-11am | F1211: 2 | G1211: 2 | H1211: 3 | I1211: 0 | J1211: =RC[-1]/RC[-2] -> 0
A1212: 210 | B1212: 2 | C1212: Tuesday | D1212: 2 | E1212: 11am-12pm | F1212: 3 | G1212: 2 | H1212: 3 | I1212: 0 | J1212: =RC[-1]/RC[-2] -> 0
A1213: 210 | B1213: 2 | C1213: Tuesday | D1213: 2 | E1213: 12pm-1pm | F1213: 4 | G1213: 2 | H1213: 3 | I1213: 0 | J1213: =RC[-1]/RC[-2] -> 0
A1214: 210 | B1214: 2 | C1214: Tuesday | D1214: 2 | E1214: 1pm-2pm | F1214: 5 | G1214: 2 | H1214: 3 | I1214: 0 | J1214: =RC[-1]/RC[-2] -> 0
A1215: 210 | B1215: 2 | C1215: Tuesday | D1215: 2 | E1215: 2pm-3pm | F1215: 6 | G1215: 3 | H1215: 3 | I1215: 1 | J1215: =RC[-1]/RC[-2] -> 0.33333333333333331
A1216: 210 | B1216: 2 | C1216: Tuesday | D1216: 2 | E1216: 3pm-4pm | F1216: 7 | G1216: 2 | H1216: 3 | I1216: 0 | J1216: =RC[-1]/RC[-2] -> 0
A1217: 210 | B1217: 2 | C1217: Tuesday | D1217: 2 | E1217: 4pm-5pm | F1217: 8 | G1217: 2 | H1217: 3 | I1217: 0 | J1217: =RC[-1]/RC[-2] -> 0
A1218: 210 | B1218: 2 | C1218: Wednesday | D1218: 3 | E1218: 9am-10am | F1218: 1 | G1218: 2 | H1218: 3 | I1218: 0 | J1218: =RC[-1]/RC[-2] -> 0
A1219: 210 | B1219: 2 | C1219: Wednesday | D1219: 3 | E1219: 10am-11am | F1219: 2 | G1219: 2 | H1219: 3 | I1219: 0 | J1219: =RC[-1]/RC[-2] -> 0
A1220: 210 | B1220: 2 | C1220: Wednesday | D1220: 3 | E1220: 11am-12pm | F1220: 3 | G1220: 2 | H1220: 3 | I1220: 0 | J1220: =RC[-1]/RC[-2] -> 0
A1221: 210 | B1221: 2 | C1221: Wednesday | D1221: 3 | E1221: 12pm-1pm | F1221: 4 | G1221: 2 | H1221: 3 | I1221: 0 | J1221: =RC[-1]/RC[-2] -> 0
A1222: 210 | B1222: 2 | C1222: Wednesday | D1222: 3 | E1222: 1pm-2pm | F1222: 5 | G1222: 2 | H1222: 3 | I1222: 0 | J1222: =RC[-1]/RC[-2] -> 0
A1223: 210 | B1223: 2 | C1223: Wednesday | D1223: 3 | E1223: 2pm-3pm | F1223: 6 | G1223: 2 | H1223: 3 | I1223: 0 | J1223: =RC[-1]/RC[-2] -> 0
A1224: 210 | B1224: 2 | C1224: Wednesday | D1224: 3 | E1224: 3pm-4pm | F1224: 7 | G1224: 2 | H1224: 3 | I1224: 0 | J1224: =RC[-1]/RC[-2] -> 0
A1225: 210 | B1225: 2 | C1225: Wednesday | D1225: 3 | E1225: 4pm-5pm | F1225: 8 | G1225: 2 | H1225: 3 | I1225: 0 | J1225: =RC[-1]/RC[-2] -> 0
A1226: 210 | B1226: 2 | C1226: Thursday | D1226: 4 | E1226: 9am-10am | F1226: 1 | G1226: 2 | H1226: 3 | I1226: 0 | J1226: =RC[-1]/RC[-2] -> 0
A1227: 210 | B1227: 2 | C1227: Thursday | D1227: 4 | E1227: 10am-11am | F1227: 2 | G1227: 2 | H1227: 3 | I1227: 0 | J1227: =RC[-1]/RC[-2] -> 0
A1228: 210 | B1228: 2 | C1228: Thursday | D1228: 4 | E1228: 11am-12pm | F1228: 3 | G1228: 2 | H1228: 3 | I1228: 0 | J1228: =RC[-1]/RC[-2] -> 0
A1229: 210 | B1229: 2 | C1229: Thursday | D1229: 4 | E1229: 12pm-1pm | F1229: 4 | G1229: 2 | H1229: 3 | I1229: 0 | J1229: =RC[-1]/RC[-2] -> 0
A1230: 210 | B1230: 2 | C1230: Thursday | D1230: 4 | E1230: 1pm-2pm | F1230: 5 | G1230: 2 | H1230: 3 | I1230: 0 | J1230: =RC[-1]/RC[-2] -> 0
A1231: 210 | B1231: 2 | C1231: Thursday | D1231: 4 | E1231: 2pm-3pm | F1231: 6 | G1231: 2 | H1231: 3 | I1231: 0 | J1231: =RC[-1]/RC[-2] -> 0
A1232: 210 | B1232: 2 | C1232: Thursday | D1232: 4 | E1232: 3pm-4pm | F1232: 7 | G1232: 2 | H1232: 3 | I1232: 0 | J1232: =RC[-1]/RC[-2] -> 0
A1233: 210 | B1233: 2 | C1233: Thursday | D1233: 4 | E1233: 4pm-5pm | F1233: 8 | G1233: 2 | H1233: 3 | I1233: 0 | J1233: =RC[-1]/RC[-2] -> 0
A1234: 210 | B1234: 2 | C1234: Friday | D1234: 5 | E1234: 9am-10am | F1234: 1 | G1234: 2 | H1234: 3 | I1234: 0 | J1234: =RC[-1]/RC[-2] -> 0
A1235: 210 | B1235: 2 | C1235: Friday | D1235: 5 | E1235: 10am-11am | F1235: 2 | G1235: 1 | H1235: 3 | I1235: 1 | J1235: =RC[-1]/RC[-2] -> 0.33333333333333331
A1236: 210 | B1236: 2 | C1236: Friday | D1236: 5 | E1236: 11am-12pm | F1236: 3 | G1236: 2 | H1236: 3 | I1236: 0 | J1236: =RC[-1]/RC[-2] -> 0
A1237: 210 | B1237: 2 | C1237: Friday | D1237: 5 | E1237: 12pm-1pm | F1237: 4 | G1237: 2 | H1237: 3 | I1237: 0 | J1237: =RC[-1]/RC[-2] -> 0
A1238: 210 | B1238: 2 | C1238: Friday | D1238: 5 | E1238: 1pm-2pm | F1238: 5 | G1238: 2 | H1238: 3 | I1238: 0 | J1238: =RC[-1]/RC[-2] -> 0
A1239: 210 | B1239: 2 | C1239: Friday | D1239: 5 | E1239: 2pm-3pm | F1239: 6 | G1239: 2 | H1239: 3 | I1239: 0 | J1239: =RC[-1]/RC[-2] -> 0
A1240: 210 | B1240: 2 | C1240: Friday | D1240: 5 | E1240: 3pm-4pm | F1240: 7 | G1240: 2 | H1240: 3 | I1240: 0 | J1240: =RC[-1]/RC[-2] -> 0
A1241: 210 | B1241: 2 | C1241: Friday | D1241: 5 | E1241: 4pm-5pm | F1241: 8 | G1241: 2 | H1241: 3 | I1241: 0 | J1241: =RC[-1]/RC[-2] -> 0
A1242: 211 | B1242: 2 | C1242: Monday | D1242: 1 | E1242: 9am-10am | F1242: 1 | G1242: 1 | H1242: 34 | I1242: 23 | J1242: =RC[-1]/RC[-2] -> 0.67647058823529416
A1243: 211 | B1243: 2 | C1243: Monday | D1243: 1 | E1243: 10am-11am | F1243: 2 | G1243: 1 | H1243: 34 | I1243: 30 | J1243: =RC[-1]/RC[-2] -> 0.88235294117647056
A1244: 211 | B1244: 2 | C1244: Monday | D1244: 1 | E1244: 11am-12pm | F1244: 3 | G1244: 1 | H1244: 34 | I1244: 30 | J1244: =RC[-1]/RC[-2] -> 0.88235294117647056
A1245: 211 | B1245: 2 | C1245: Monday | D1245: 1 | E1245: 12pm-1pm | F1245: 4 | G1245: 2 | H1245: 34 | I1245: 0 | J1245: =RC[-1]/RC[-2] -> 0
A1246: 211 | B1246: 2 | C1246: Monday | D1246: 1 | E1246: 1pm-2pm | F1246: 5 | G1246: 2 | H1246: 34 | I1246: 0 | J1246: =RC[-1]/RC[-2] -> 0
A1247: 211 | B1247: 2 | C1247: Monday | D1247: 1 | E1247: 2pm-3pm | F1247: 6 | G1247: 1 | H1247: 34 | I1247: 11 | J1247: =RC[-1]/RC[-2] -> 0.3235294117647059
A1248: 211 | B1248: 2 | C1248: Monday | D1248: 1 | E1248: 3pm-4pm | F1248: 7 | G1248: 1 | H1248: 34 | I1248: 12 | J1248: =RC[-1]/RC[-2] -> 0.35294117647058826
A1249: 211 | B1249: 2 | C1249: Monday | D1249: 1 | E1249: 4pm-5pm | F1249: 8 | G1249: 1 | H1249: 34 | I1249: 13 | J1249: =RC[-1]/RC[-2] -> 0.38235294117647056
A1250: 211 | B1250: 2 | C1250: Tuesday | D1250: 2 | E1250: 9am-10am | F1250: 1 | G1250: 2 | H1250: 34 | I1250: 0 | J1250: =RC[-1]/RC[-2] -> 0
A1251: 211 | B1251: 2 | C1251: Tuesday | D1251: 2 | E1251: 10am-11am | F1251: 2 | G1251: 2 | H1251: 34 | I1251: 0 | J1251: =RC[-1]/RC[-2] -> 0
A1252: 211 | B1252: 2 | C1252: Tuesday | D1252: 2 | E1252: 11am-12pm | F1252: 3 | G1252: 2 | H1252: 34 | I1252: 0 | J1252: =RC[-1]/RC[-2] -> 0
A1253: 211 | B1253: 2 | C1253: Tuesday | D1253: 2 | E1253: 12pm-1pm | F1253: 4 | G1253: 2 | H1253: 34 | I1253: 0 | J1253: =RC[-1]/RC[-2] -> 0
A1254: 211 | B1254: 2 | C1254: Tuesday | D1254: 2 | E1254: 1pm-2pm | F1254: 5 | G1254: 2 | H1254: 34 | I1254: 0 | J1254: =RC[-1]/RC[-2] -> 0
A1255: 211 | B1255: 2 | C1255: Tuesday | D1255: 2 | E1255: 2pm-3pm | F1255: 6 | G1255: 1 | H1255: 34 | I1255: 30 | J1255: =RC[-1]/RC[-2] -> 0.88235294117647056
A1256: 211 | B1256: 2 | C1256: Tuesday | D1256: 2 | E1256: 3pm-4pm | F1256: 7 | G1256: 1 | H1256: 34 | I1256: 30 | J1256: =RC[-1]/RC[-2] -> 0.88235294117647056
A1257: 211 | B1257: 2 | C1257: Tuesday | D1257: 2 | E1257: 4pm-5pm | F1257: 8 | G1257: 1 | H1257: 34 | I1257: 30 | J1257: =RC[-1]/RC[-2] -> 0.88235294117647056
A1258: 211 | B1258: 2 | C1258: Wednesday | D1258: 3 | E1258: 9am-10am | F1258: 1 | G1258: 1 | H1258: 34 | I1258: 25 | J1258: =RC[-1]/RC[-2] -> 0.73529411764705888
A1259: 211 | B1259: 2 | C1259: Wednesday | D1259: 3 | E1259: 10am-11am | F1259: 2 | G1259: 1 | H1259: 34 | I1259: 25 | J1259: =RC[-1]/RC[-2] -> 0.73529411764705888
A1260: 211 | B1260: 2 | C1260: Wednesday | D1260: 3 | E1260: 11am-12pm | F1260: 3 | G1260: 1 | H1260: 34 | I1260: 20 | J1260: =RC[-1]/RC[-2] -> 0.58823529411764708
A1261: 211 | B1261: 2 | C1261: Wednesday | D1261: 3 | E1261: 12pm-1pm | F1261: 4 | G1261: 1 | H1261: 34 | I1261: 1 | J1261: =RC[-1]/RC[-2] -> 2.9411764705882353E-2
A1262: 211 | B1262: 2 | C1262: Wednesday | D1262: 3 | E1262: 1pm-2pm | F1262: 5 | G1262: 2 | H1262: 34 | I1262: 0 | J1262: =RC[-1]/RC[-2] -> 0
A1263: 211 | B1263: 2 | C1263: Wednesday | D1263: 3 | E1263: 2pm-3pm | F1263: 6 | G1263: 3 | H1263: 34 | I1263: 2 | J1263: =RC[-1]/RC[-2] -> 5.8823529411764705E-2
A1264: 211 | B1264: 2 | C1264: Wednesday | D1264: 3 | E1264: 3pm-4pm | F1264: 7 | G1264: 1 | H1264: 34 | I1264: 20 | J1264: =RC[-1]/RC[-2] -> 0.58823529411764708
A1265: 211 | B1265: 2 | C1265: Wednesday | D1265: 3 | E1265: 4pm-5pm | F1265: 8 | G1265: 1 | H1265: 34 | I1265: 10 | J1265: =RC[-1]/RC[-2] -> 0.29411764705882354
A1266: 211 | B1266: 2 | C1266: Thursday | D1266: 4 | E1266: 9am-10am | F1266: 1 | G1266: 1 | H1266: 34 | I1266: 1 | J1266: =RC[-1]/RC[-2] -> 2.9411764705882353E-2
A1267: 211 | B1267: 2 | C1267: Thursday | D1267: 4 | E1267: 10am-11am | F1267: 2 | G1267: 1 | H1267: 34 | I1267: 9 | J1267: =RC[-1]/RC[-2] -> 0.26470588235294118
A1268: 211 | B1268: 2 | C1268: Thursday | D1268: 4 | E1268: 11am-12pm | F1268: 3 | G1268: 1 | H1268: 34 | I1268: 12 | J1268: =RC[-1]/RC[-2] -> 0.35294117647058826
A1269: 211 | B1269: 2 | C1269: Thursday | D1269: 4 | E1269: 12pm-1pm | F1269: 4 | G1269: 1 | H1269: 34 | I1269: 8 | J1269: =RC[-1]/RC[-2] -> 0.23529411764705882
A1270: 211 | B1270: 2 | C1270: Thursday | D1270: 4 | E1270: 1pm-2pm | F1270: 5 | G1270: 1 | H1270: 34 | I1270: 2 | J1270: =RC[-1]/RC[-2] -> 5.8823529411764705E-2
A1271: 211 | B1271: 2 | C1271: Thursday | D1271: 4 | E1271: 2pm-3pm | F1271: 6 | G1271: 3 | H1271: 34 | I1271: 1 | J1271: =RC[-1]/RC[-2] -> 2.9411764705882353E-2
A1272: 211 | B1272: 2 | C1272: Thursday | D1272: 4 | E1272: 3pm-4pm | F1272: 7 | G1272: 3 | H1272: 34 | I1272: 1 | J1272: =RC[-1]/RC[-2] -> 2.9411764705882353E-2
A1273: 211 | B1273: 2 | C1273: Thursday | D1273: 4 | E1273: 4pm-5pm | F1273: 8 | G1273: 2 | H1273: 34 | I1273: 0 | J1273: =RC[-1]/RC[-2] -> 0
A1274: 211 | B1274: 2 | C1274: Friday | D1274: 5 | E1274: 9am-10am | F1274: 1 | G1274: 2 | H1274: 34 | I1274: 0 | J1274: =RC[-1]/RC[-2] -> 0
A1275: 211 | B1275: 2 | C1275: Friday | D1275: 5 | E1275: 10am-11am | F1275: 2 | G1275: 2 | H1275: 34 | I1275: 0 | J1275: =RC[-1]/RC[-2] -> 0
A1276: 211 | B1276: 2 | C1276: Friday | D1276: 5 | E1276: 11am-12pm | F1276: 3 | G1276: 2 | H1276: 34 | I1276: 0 | J1276: =RC[-1]/RC[-2] -> 0
A1277: 211 | B1277: 2 | C1277: Friday | D1277: 5 | E1277: 12pm-1pm | F1277: 4 | G1277: 2 | H1277: 34 | I1277: 0 | J1277: =RC[-1]/RC[-2] -> 0
A1278: 211 | B1278: 2 | C1278: Friday | D1278: 5 | E1278: 1pm-2pm | F1278: 5 | G1278: 2 | H1278: 34 | I1278: 0 | J1278: =RC[-1]/RC[-2] -> 0
A1279: 211 | B1279: 2 | C1279: Friday | D1279: 5 | E1279: 2pm-3pm | F1279: 6 | G1279: 2 | H1279: 34 | I1279: 0 | J1279: =RC[-1]/RC[-2] -> 0
A1280: 211 | B1280: 2 | C1280: Friday | D1280: 5 | E1280: 3pm-4pm | F1280: 7 | G1280: 2 | H1280: 34 | I1280: 0 | J1280: =RC[-1]/RC[-2] -> 0
A1281: 211 | B1281: 2 | C1281: Friday | D1281: 5 | E1281: 4pm-5pm | F1281: 8 | G1281: 2 | H1281: 34 | I1281: 0 | J1281: =RC[-1]/RC[-2] -> 0
A1282: 217 | B1282: 2 | C1282: Monday | D1282: 1 | E1282: 9am-10am | F1282: 1 | G1282: 2 | H1282: 4 | I1282: 0 | J1282: =RC[-1]/RC[-2] -> 0
A1283: 217 | B1283: 2 | C1283: Monday | D1283: 1 | E1283: 10am-11am | F1283: 2 | G1283: 2 | H1283: 4 | I1283: 0 | J1283: =RC[-1]/RC[-2] -> 0
A1284: 217 | B1284: 2 | C1284: Monday | D1284: 1 | E1284: 11am-12pm | F1284: 3 | G1284: 2 | H1284: 4 | I1284: 0 | J1284: =RC[-1]/RC[-2] -> 0
A1285: 217 | B1285: 2 | C1285: Monday | D1285: 1 | E1285: 12pm-1pm | F1285: 4 | G1285: 2 | H1285: 4 | I1285: 0 | J1285: =RC[-1]/RC[-2] -> 0
A1286: 217 | B1286: 2 | C1286: Monday | D1286: 1 | E1286: 1pm-2pm | F1286: 5 | G1286: 2 | H1286: 4 | I1286: 0 | J1286: =RC[-1]/RC[-2] -> 0
A1287: 217 | B1287: 2 | C1287: Monday | D1287: 1 | E1287: 2pm-3pm | F1287: 6 | G1287: 2 | H1287: 4 | I1287: 0 | J1287: =RC[-1]/RC[-2] -> 0
A1288: 217 | B1288: 2 | C1288: Monday | D1288: 1 | E1288: 3pm-4pm | F1288: 7 | G1288: 2 | H1288: 4 | I1288: 0 | J1288: =RC[-1]/RC[-2] -> 0
A1289: 217 | B1289: 2 | C1289: Monday | D1289: 1 | E1289: 4pm-5pm | F1289: 8 | G1289: 2 | H1289: 4 | I1289: 0 | J1289: =RC[-1]/RC[-2] -> 0
A1290: 217 | B1290: 2 | C1290: Tuesday | D1290: 2 | E1290: 9am-10am | F1290: 1 | G1290: 2 | H1290: 4 | I1290: 0 | J1290: =RC[-1]/RC[-2] -> 0
A1291: 217 | B1291: 2 | C1291: Tuesday | D1291: 2 | E1291: 10am-11am | F1291: 2 | G1291: 2 | H1291: 4 | I1291: 0 | J1291: =RC[-1]/RC[-2] -> 0
A1292: 217 | B1292: 2 | C1292: Tuesday | D1292: 2 | E1292: 11am-12pm | F1292: 3 | G1292: 2 | H1292: 4 | I1292: 0 | J1292: =RC[-1]/RC[-2] -> 0
A1293: 217 | B1293: 2 | C1293: Tuesday | D1293: 2 | E1293: 12pm-1pm | F1293: 4 | G1293: 2 | H1293: 4 | I1293: 0 | J1293: =RC[-1]/RC[-2] -> 0
A1294: 217 | B1294: 2 | C1294: Tuesday | D1294: 2 | E1294: 1pm-2pm | F1294: 5 | G1294: 2 | H1294: 4 | I1294: 0 | J1294: =RC[-1]/RC[-2] -> 0
A1295: 217 | B1295: 2 | C1295: Tuesday | D1295: 2 | E1295: 2pm-3pm | F1295: 6 | G1295: 2 | H1295: 4 | I1295: 0 | J1295: =RC[-1]/RC[-2] -> 0
A1296: 217 | B1296: 2 | C1296: Tuesday | D1296: 2 | E1296: 3pm-4pm | F1296: 7 | G1296: 2 | H1296: 4 | I1296: 0 | J1296: =RC[-1]/RC[-2] -> 0
A1297: 217 | B1297: 2 | C1297: Tuesday | D1297: 2 | E1297: 4pm-5pm | F1297: 8 | G1297: 2 | H1297: 4 | I1297: 0 | J1297: =RC[-1]/RC[-2] -> 0
A1298: 217 | B1298: 2 | C1298: Wednesday | D1298: 3 | E1298: 9am-10am | F1298: 1 | G1298: 2 | H1298: 4 | I1298: 0 | J1298: =RC[-1]/RC[-2] -> 0
A1299: 217 | B1299: 2 | C1299: Wednesday | D1299: 3 | E1299: 10am-11am | F1299: 2 | G1299: 2 | H1299: 4 | I1299: 0 | J1299: =RC[-1]/RC[-2] -> 0
A1300: 217 | B1300: 2 | C1300: Wednesday | D1300: 3 | E1300: 11am-12pm | F1300: 3 | G1300: 2 | H1300: 4 | I1300: 0 | J1300: =RC[-1]/RC[-2] -> 0
A1301: 217 | B1301: 2 | C1301: Wednesday | D1301: 3 | E1301: 12pm-1pm | F1301: 4 | G1301: 2 | H1301: 4 | I1301: 0 | J1301: =RC[-1]/RC[-2] -> 0
A1302: 217 | B1302: 2 | C1302: Wednesday | D1302: 3 | E1302: 1pm-2pm | F1302: 5 | G1302: 2 | H1302: 4 | I1302: 0 | J1302: =RC[-1]/RC[-2] -> 0
A1303: 217 | B1303: 2 | C1303: Wednesday | D1303: 3 | E1303: 2pm-3pm | F1303: 6 | G1303: 2 | H1303: 4 | I1303: 0 | J1303: =RC[-1]/RC[-2] -> 0
A1304: 217 | B1304: 2 | C1304: Wednesday | D1304: 3 | E1304: 3pm-4pm | F1304: 7 | G1304: 2 | H1304: 4 | I1304: 0 | J1304: =RC[-1]/RC[-2] -> 0
A1305: 217 | B1305: 2 | C1305: Wednesday | D1305: 3 | E1305: 4pm-5pm | F1305: 8 | G1305: 2 | H1305: 4 | I1305: 0 | J1305: =RC[-1]/RC[-2] -> 0
A1306: 217 | B1306: 2 | C1306: Thursday | D1306: 4 | E1306: 9am-10am | F1306: 1 | G1306: 2 | H1306: 4 | I1306: 0 | J1306: =RC[-1]/RC[-2] -> 0
A1307: 217 | B1307: 2 | C1307: Thursday | D1307: 4 | E1307: 10am-11am | F1307: 2 | G1307: 2 | H1307: 4 | I1307: 0 | J1307: =RC[-1]/RC[-2] -> 0
A1308: 217 | B1308: 2 | C1308: Thursday | D1308: 4 | E1308: 11am-12pm | F1308: 3 | G1308: 2 | H1308: 4 | I1308: 0 | J1308: =RC[-1]/RC[-2] -> 0
A1309: 217 | B1309: 2 | C1309: Thursday | D1309: 4 | E1309: 12pm-1pm | F1309: 4 | G1309: 2 | H1309: 4 | I1309: 0 | J1309: =RC[-1]/RC[-2] -> 0
A1310: 217 | B1310: 2 | C1310: Thursday | D1310: 4 | E1310: 1pm-2pm | F1310: 5 | G1310: 2 | H1310: 4 | I1310: 0 | J1310: =RC[-1]/RC[-2] -> 0
A1311: 217 | B1311: 2 | C1311: Thursday | D1311: 4 | E1311: 2pm-3pm | F1311: 6 | G1311: 2 | H1311: 4 | I1311: 0 | J1311: =RC[-1]/RC[-2] -> 0
A1312: 217 | B1312: 2 | C1312: Thursday | D1312: 4 | E1312: 3pm-4pm | F1312: 7 | G1312: 2 | H1312: 4 | I1312: 0 | J1312: =RC[-1]/RC[-2] -> 0
A1313: 217 | B1313: 2 | C1313: Thursday | D1313: 4 | E1313: 4pm-5pm | F1313: 8 | G1313: 2 | H1313: 4 | I1313: 0 | J1313: =RC[-1]/RC[-2] -> 0
A1314: 217 | B1314: 2 | C1314: Friday | D1314: 5 | E1314: 9am-10am | F1314: 1 | G1314: 2 | H1314: 4 | I1314: 0 | J1314: =RC[-1]/RC[-2] -> 0
A1315: 217 | B1315: 2 | C1315: Friday | D1315: 5 | E1315: 10am-11am | F1315: 2 | G1315: 2 | H1315: 4 | I1315: 0 | J1315: =RC[-1]/RC[-2] -> 0
A1316: 217 | B1316: 2 | C1316: Friday | D1316: 5 | E1316: 11am-12pm | F1316: 3 | G1316: 2 | H1316: 4 | I1316: 0 | J1316: =RC[-1]/RC[-2] -> 0
A1317: 217 | B1317: 2 | C1317: Friday | D1317: 5 | E1317: 12pm-1pm | F1317: 4 | G1317: 2 | H1317: 4 | I1317: 0 | J1317: =RC[-1]/RC[-2] -> 0
A1318: 217 | B1318: 2 | C1318: Friday | D1318: 5 | E1318: 1pm-2pm | F1318: 5 | G1318: 2 | H1318: 4 | I1318: 0 | J1318: =RC[-1]/RC[-2] -> 0
A1319: 217 | B1319: 2 | C1319: Friday | D1319: 5 | E1319: 2pm-3pm | F1319: 6 | G1319: 2 | H1319: 4 | I1319: 0 | J1319: =RC[-1]/RC[-2] -> 0
A1320: 217 | B1320: 2 | C1320: Friday | D1320: 5 | E1320: 3pm-4pm | F1320: 7 | G1320: 2 | H1320: 4 | I1320: 0 | J1320: =RC[-1]/RC[-2] -> 0
A1321: 217 | B1321: 2 | C1321: Friday | D1321: 5 | E1321: 4pm-5pm | F1321: 8 | G1321: 2 | H1321: 4 | I1321: 0 | J1321: =RC[-1]/RC[-2] -> 0
A1322: 217A | B1322: 2 | C1322: Monday | D1322: 1 | E1322: 9am-10am | F1322: 1 | G1322: 2 | H1322: 4 | I1322: 0 | J1322: =RC[-1]/RC[-2] -> 0
A1323: 217A | B1323: 2 | C1323: Monday | D1323: 1 | E1323: 10am-11am | F1323: 2 | G1323: 2 | H1323: 4 | I1323: 0 | J1323: =RC[-1]/RC[-2] -> 0
A1324: 217A | B1324: 2 | C1324: Monday | D1324: 1 | E1324: 11am-12pm | F1324: 3 | G1324: 2 | H1324: 4 | I1324: 0 | J1324: =RC[-1]/RC[-2] -> 0
A1325: 217A | B1325: 2 | C1325: Monday | D1325: 1 | E1325: 12pm-1pm | F1325: 4 | G1325: 2 | H1325: 4 | I1325: 0 | J1325: =RC[-1]/RC[-2] -> 0
A1326: 217A | B1326: 2 | C1326: Monday | D1326: 1 | E1326: 1pm-2pm | F1326: 5 | G1326: 2 | H1326: 4 | I1326: 0 | J1326: =RC[-1]/RC[-2] -> 0
A1327: 217A | B1327: 2 | C1327: Monday | D1327: 1 | E1327: 2pm-3pm | F1327: 6 | G1327: 2 | H1327: 4 | I1327: 0 | J1327: =RC[-1]/RC[-2] -> 0
A1328: 217A | B1328: 2 | C1328: Monday | D1328: 1 | E1328: 3pm-4pm | F1328: 7 | G1328: 2 | H1328: 4 | I1328: 0 | J1328: =RC[-1]/RC[-2] -> 0
A1329: 217A | B1329: 2 | C1329: Monday | D1329: 1 | E1329: 4pm-5pm | F1329: 8 | G1329: 2 | H1329: 4 | I1329: 0 | J1329: =RC[-1]/RC[-2] -> 0
A1330: 217A | B1330: 2 | C1330: Tuesday | D1330: 2 | E1330: 9am-10am | F1330: 1 | G1330: 2 | H1330: 4 | I1330: 0 | J1330: =RC[-1]/RC[-2] -> 0
A1331: 217A | B1331: 2 | C1331: Tuesday | D1331: 2 | E1331: 10am-11am | F1331: 2 | G1331: 2 | H1331: 4 | I1331: 0 | J1331: =RC[-1]/RC[-2] -> 0
A1332: 217A | B1332: 2 | C1332: Tuesday | D1332: 2 | E1332: 11am-12pm | F1332: 3 | G1332: 2 | H1332: 4 | I1332: 0 | J1332: =RC[-1]/RC[-2] -> 0
A1333: 217A | B1333: 2 | C1333: Tuesday | D1333: 2 | E1333: 12pm-1pm | F1333: 4 | G1333: 2 | H1333: 4 | I1333: 0 | J1333: =RC[-1]/RC[-2] -> 0
A1334: 217A | B1334: 2 | C1334: Tuesday | D1334: 2 | E1334: 1pm-2pm | F1334: 5 | G1334: 1 | H1334: 4 | I1334: 1 | J1334: =RC[-1]/RC[-2] -> 0.25
A1335: 217A | B1335: 2 | C1335: Tuesday | D1335: 2 | E1335: 2pm-3pm | F1335: 6 | G1335: 2 | H1335: 4 | I1335: 0 | J1335: =RC[-1]/RC[-2] -> 0
A1336: 217A | B1336: 2 | C1336: Tuesday | D1336: 2 | E1336: 3pm-4pm | F1336: 7 | G1336: 2 | H1336: 4 | I1336: 0 | J1336: =RC[-1]/RC[-2] -> 0
A1337: 217A | B1337: 2 | C1337: Tuesday | D1337: 2 | E1337: 4pm-5pm | F1337: 8 | G1337: 2 | H1337: 4 | I1337: 0 | J1337: =RC[-1]/RC[-2] -> 0
A1338: 217A | B1338: 2 | C1338: Wednesday | D1338: 3 | E1338: 9am-10am | F1338: 1 | G1338: 2 | H1338: 4 | I1338: 0 | J1338: =RC[-1]/RC[-2] -> 0
A1339: 217A | B1339: 2 | C1339: Wednesday | D1339: 3 | E1339: 10am-11am | F1339: 2 | G1339: 2 | H1339: 4 | I1339: 0 | J1339: =RC[-1]/RC[-2] -> 0
A1340: 217A | B1340: 2 | C1340: Wednesday | D1340: 3 | E1340: 11am-12pm | F1340: 3 | G1340: 2 | H1340: 4 | I1340: 0 | J1340: =RC[-1]/RC[-2] -> 0
A1341: 217A | B1341: 2 | C1341: Wednesday | D1341: 3 | E1341: 12pm-1pm | F1341: 4 | G1341: 2 | H1341: 4 | I1341: 0 | J1341: =RC[-1]/RC[-2] -> 0
A1342: 217A | B1342: 2 | C1342: Wednesday | D1342: 3 | E1342: 1pm-2pm | F1342: 5 | G1342: 2 | H1342: 4 | I1342: 0 | J1342: =RC[-1]/RC[-2] -> 0
A1343: 217A | B1343: 2 | C1343: Wednesday | D1343: 3 | E1343: 2pm-3pm | F1343: 6 | G1343: 2 | H1343: 4 | I1343: 0 | J1343: =RC[-1]/RC[-2] -> 0
A1344: 217A | B1344: 2 | C1344: Wednesday | D1344: 3 | E1344: 3pm-4pm | F1344: 7 | G1344: 2 | H1344: 4 | I1344: 0 | J1344: =RC[-1]/RC[-2] -> 0
A1345: 217A | B1345: 2 | C1345: Wednesday | D1345: 3 | E1345: 4pm-5pm | F1345: 8 | G1345: 2 | H1345: 4 | I1345: 0 | J1345: =RC[-1]/RC[-2] -> 0
A1346: 217A | B1346: 2 | C1346: Thursday | D1346: 4 | E1346: 9am-10am | F1346: 1 | G1346: 2 | H1346: 4 | I1346: 0 | J1346: =RC[-1]/RC[-2] -> 0
A1347: 217A | B1347: 2 | C1347: Thursday | D1347: 4 | E1347: 10am-11am | F1347: 2 | G1347: 2 | H1347: 4 | I1347: 0 | J1347: =RC[-1]/RC[-2] -> 0
A1348: 217A | B1348: 2 | C1348: Thursday | D1348: 4 | E1348: 11am-12pm | F1348: 3 | G1348: 2 | H1348: 4 | I1348: 0 | J1348: =RC[-1]/RC[-2] -> 0
A1349: 217A | B1349: 2 | C1349: Thursday | D1349: 4 | E1349: 12pm-1pm | F1349: 4 | G1349: 2 | H1349: 4 | I1349: 0 | J1349: =RC[-1]/RC[-2] -> 0
A1350: 217A | B1350: 2 | C1350: Thursday | D1350: 4 | E1350: 1pm-2pm | F1350: 5 | G1350: 2 | H1350: 4 | I1350: 0 | J1350: =RC[-1]/RC[-2] -> 0
A1351: 217A | B1351: 2 | C1351: Thursday | D1351: 4 | E1351: 2pm-3pm | F1351: 6 | G1351: 2 | H1351: 4 | I1351: 0 | J1351: =RC[-1]/RC[-2] -> 0
A1352: 217A | B1352: 2 | C1352: Thursday | D1352: 4 | E1352: 3pm-4pm | F1352: 7 | G1352: 2 | H1352: 4 | I1352: 0 | J1352: =RC[-1]/RC[-2] -> 0
A1353: 217A | B1353: 2 | C1353: Thursday | D1353: 4 | E1353: 4pm-5pm | F1353: 8 | G1353: 2 | H1353: 4 | I1353: 0 | J1353: =RC[-1]/RC[-2] -> 0
A1354: 217A | B1354: 2 | C1354: Friday | D1354: 5 | E1354: 9am-10am | F1354: 1 | G1354: 2 | H1354: 4 | I1354: 0 | J1354: =RC[-1]/RC[-2] -> 0
A1355: 217A | B1355: 2 | C1355: Friday | D1355: 5 | E1355: 10am-11am | F1355: 2 | G1355: 2 | H1355: 4 | I1355: 0 | J1355: =RC[-1]/RC[-2] -> 0
A1356: 217A | B1356: 2 | C1356: Friday | D1356: 5 | E1356: 11am-12pm | F1356: 3 | G1356: 2 | H1356: 4 | I1356: 0 | J1356: =RC[-1]/RC[-2] -> 0
A1357: 217A | B1357: 2 | C1357: Friday | D1357: 5 | E1357: 12pm-1pm | F1357: 4 | G1357: 2 | H1357: 4 | I1357: 0 | J1357: =RC[-1]/RC[-2] -> 0
A1358: 217A | B1358: 2 | C1358: Friday | D1358: 5 | E1358: 1pm-2pm | F1358: 5 | G1358: 2 | H1358: 4 | I1358: 0 | J1358: =RC[-1]/RC[-2] -> 0
A1359: 217A | B1359: 2 | C1359: Friday | D1359: 5 | E1359: 2pm-3pm | F1359: 6 | G1359: 2 | H1359: 4 | I1359: 0 | J1359: =RC[-1]/RC[-2] -> 0
A1360: 217A | B1360: 2 | C1360: Friday | D1360: 5 | E1360: 3pm-4pm | F1360: 7 | G1360: 2 | H1360: 4 | I1360: 0 | J1360: =RC[-1]/RC[-2] -> 0
A1361: 217A | B1361: 2 | C1361: Friday | D1361: 5 | E1361: 4pm-5pm | F1361: 8 | G1361: 2 | H1361: 4 | I1361: 0 | J1361: =RC[-1]/RC[-2] -> 0
A1362: 219 | B1362: 2 | C1362: Monday | D1362: 1 | E1362: 9am-10am | F1362: 1 | G1362: 1 | H1362: 34 | I1362: 24 | J1362: =RC[-1]/RC[-2] -> 0.70588235294117652
A1363: 219 | B1363: 2 | C1363: Monday | D1363: 1 | E1363: 10am-11am | F1363: 2 | G1363: 1 | H1363: 34 | I1363: 30 | J1363: =RC[-1]/RC[-2] -> 0.88235294117647056
A1364: 219 | B1364: 2 | C1364: Monday | D1364: 1 | E1364: 11am-12pm | F1364: 3 | G1364: 1 | H1364: 34 | I1364: 30 | J1364: =RC[-1]/RC[-2] -> 0.88235294117647056
A1365: 219 | B1365: 2 | C1365: Monday | D1365: 1 | E1365: 12pm-1pm | F1365: 4 | G1365: 2 | H1365: 34 | I1365: 0 | J1365: =RC[-1]/RC[-2] -> 0
A1366: 219 | B1366: 2 | C1366: Monday | D1366: 1 | E1366: 1pm-2pm | F1366: 5 | G1366: 2 | H1366: 34 | I1366: 0 | J1366: =RC[-1]/RC[-2] -> 0
A1367: 219 | B1367: 2 | C1367: Monday | D1367: 1 | E1367: 2pm-3pm | F1367: 6 | G1367: 2 | H1367: 34 | I1367: 0 | J1367: =RC[-1]/RC[-2] -> 0
A1368: 219 | B1368: 2 | C1368: Monday | D1368: 1 | E1368: 3pm-4pm | F1368: 7 | G1368: 2 | H1368: 34 | I1368: 0 | J1368: =RC[-1]/RC[-2] -> 0
A1369: 219 | B1369: 2 | C1369: Monday | D1369: 1 | E1369: 4pm-5pm | F1369: 8 | G1369: 2 | H1369: 34 | I1369: 0 | J1369: =RC[-1]/RC[-2] -> 0
A1370: 219 | B1370: 2 | C1370: Tuesday | D1370: 2 | E1370: 9am-10am | F1370: 1 | G1370: 1 | H1370: 34 | I1370: 15 | J1370: =RC[-1]/RC[-2] -> 0.44117647058823528
A1371: 219 | B1371: 2 | C1371: Tuesday | D1371: 2 | E1371: 10am-11am | F1371: 2 | G1371: 1 | H1371: 34 | I1371: 20 | J1371: =RC[-1]/RC[-2] -> 0.58823529411764708
A1372: 219 | B1372: 2 | C1372: Tuesday | D1372: 2 | E1372: 11am-12pm | F1372: 3 | G1372: 1 | H1372: 34 | I1372: 20 | J1372: =RC[-1]/RC[-2] -> 0.58823529411764708
A1373: 219 | B1373: 2 | C1373: Tuesday | D1373: 2 | E1373: 12pm-1pm | F1373: 4 | G1373: 2 | H1373: 34 | I1373: 0 | J1373: =RC[-1]/RC[-2] -> 0
A1374: 219 | B1374: 2 | C1374: Tuesday | D1374: 2 | E1374: 1pm-2pm | F1374: 5 | G1374: 2 | H1374: 34 | I1374: 0 | J1374: =RC[-1]/RC[-2] -> 0
A1375: 219 | B1375: 2 | C1375: Tuesday | D1375: 2 | E1375: 2pm-3pm | F1375: 6 | G1375: 1 | H1375: 34 | I1375: 20 | J1375: =RC[-1]/RC[-2] -> 0.58823529411764708
A1376: 219 | B1376: 2 | C1376: Tuesday | D1376: 2 | E1376: 3pm-4pm | F1376: 7 | G1376: 1 | H1376: 34 | I1376: 25 | J1376: =RC[-1]/RC[-2] -> 0.73529411764705888
A1377: 219 | B1377: 2 | C1377: Tuesday | D1377: 2 | E1377: 4pm-5pm | F1377: 8 | G1377: 1 | H1377: 34 | I1377: 25 | J1377: =RC[-1]/RC[-2] -> 0.73529411764705888
A1378: 219 | B1378: 2 | C1378: Wednesday | D1378: 3 | E1378: 9am-10am | F1378: 1 | G1378: 1 | H1378: 34 | I1378: 20 | J1378: =RC[-1]/RC[-2] -> 0.58823529411764708
A1379: 219 | B1379: 2 | C1379: Wednesday | D1379: 3 | E1379: 10am-11am | F1379: 2 | G1379: 1 | H1379: 34 | I1379: 30 | J1379: =RC[-1]/RC[-2] -> 0.88235294117647056
A1380: 219 | B1380: 2 | C1380: Wednesday | D1380: 3 | E1380: 11am-12pm | F1380: 3 | G1380: 1 | H1380: 34 | I1380: 25 | J1380: =RC[-1]/RC[-2] -> 0.73529411764705888
A1381: 219 | B1381: 2 | C1381: Wednesday | D1381: 3 | E1381: 12pm-1pm | F1381: 4 | G1381: 1 | H1381: 34 | I1381: 5 | J1381: =RC[-1]/RC[-2] -> 0.14705882352941177
A1382: 219 | B1382: 2 | C1382: Wednesday | D1382: 3 | E1382: 1pm-2pm | F1382: 5 | G1382: 1 | H1382: 34 | I1382: 1 | J1382: =RC[-1]/RC[-2] -> 2.9411764705882353E-2
A1383: 219 | B1383: 2 | C1383: Wednesday | D1383: 3 | E1383: 2pm-3pm | F1383: 6 | G1383: 1 | H1383: 34 | I1383: 3 | J1383: =RC[-1]/RC[-2] -> 8.8235294117647065E-2
A1384: 219 | B1384: 2 | C1384: Wednesday | D1384: 3 | E1384: 3pm-4pm | F1384: 7 | G1384: 1 | H1384: 34 | I1384: 25 | J1384: =RC[-1]/RC[-2] -> 0.73529411764705888
A1385: 219 | B1385: 2 | C1385: Wednesday | D1385: 3 | E1385: 4pm-5pm | F1385: 8 | G1385: 1 | H1385: 34 | I1385: 19 | J1385: =RC[-1]/RC[-2] -> 0.55882352941176472
A1386: 219 | B1386: 2 | C1386: Thursday | D1386: 4 | E1386: 9am-10am | F1386: 1 | G1386: 3 | H1386: 34 | I1386: 1 | J1386: =RC[-1]/RC[-2] -> 2.9411764705882353E-2
A1387: 219 | B1387: 2 | C1387: Thursday | D1387: 4 | E1387: 10am-11am | F1387: 2 | G1387: 1 | H1387: 34 | I1387: 15 | J1387: =RC[-1]/RC[-2] -> 0.44117647058823528
A1388: 219 | B1388: 2 | C1388: Thursday | D1388: 4 | E1388: 11am-12pm | F1388: 3 | G1388: 1 | H1388: 34 | I1388: 6 | J1388: =RC[-1]/RC[-2] -> 0.17647058823529413
A1389: 219 | B1389: 2 | C1389: Thursday | D1389: 4 | E1389: 12pm-1pm | F1389: 4 | G1389: 1 | H1389: 34 | I1389: 1 | J1389: =RC[-1]/RC[-2] -> 2.9411764705882353E-2
A1390: 219 | B1390: 2 | C1390: Thursday | D1390: 4 | E1390: 1pm-2pm | F1390: 5 | G1390: 1 | H1390: 34 | I1390: 2 | J1390: =RC[-1]/RC[-2] -> 5.8823529411764705E-2
A1391: 219 | B1391: 2 | C1391: Thursday | D1391: 4 | E1391: 2pm-3pm | F1391: 6 | G1391: 2 | H1391: 34 | I1391: 0 | J1391: =RC[-1]/RC[-2] -> 0
A1392: 219 | B1392: 2 | C1392: Thursday | D1392: 4 | E1392: 3pm-4pm | F1392: 7 | G1392: 1 | H1392: 34 | I1392: 20 | J1392: =RC[-1]/RC[-2] -> 0.58823529411764708
A1393: 219 | B1393: 2 | C1393: Thursday | D1393: 4 | E1393: 4pm-5pm | F1393: 8 | G1393: 1 | H1393: 34 | I1393: 10 | J1393: =RC[-1]/RC[-2] -> 0.29411764705882354
A1394: 219 | B1394: 2 | C1394: Friday | D1394: 5 | E1394: 9am-10am | F1394: 1 | G1394: 2 | H1394: 34 | I1394: 0 | J1394: =RC[-1]/RC[-2] -> 0
A1395: 219 | B1395: 2 | C1395: Friday | D1395: 5 | E1395: 10am-11am | F1395: 2 | G1395: 2 | H1395: 34 | I1395: 0 | J1395: =RC[-1]/RC[-2] -> 0
A1396: 219 | B1396: 2 | C1396: Friday | D1396: 5 | E1396: 11am-12pm | F1396: 3 | G1396: 2 | H1396: 34 | I1396: 0 | J1396: =RC[-1]/RC[-2] -> 0
A1397: 219 | B1397: 2 | C1397: Friday | D1397: 5 | E1397: 12pm-1pm | F1397: 4 | G1397: 2 | H1397: 34 | I1397: 0 | J1397: =RC[-1]/RC[-2] -> 0
A1398: 219 | B1398: 2 | C1398: Friday | D1398: 5 | E1398: 1pm-2pm | F1398: 5 | G1398: 2 | H1398: 34 | I1398: 0 | J1398: =RC[-1]/RC[-2] -> 0
A1399: 219 | B1399: 2 | C1399: Friday | D1399: 5 | E1399: 2pm-3pm | F1399: 6 | G1399: 2 | H1399: 34 | I1399: 0 | J1399: =RC[-1]/RC[-2] -> 0
A1400: 219 | B1400: 2 | C1400: Friday | D1400: 5 | E1400: 3pm-4pm | F1400: 7 | G1400: 2 | H1400: 34 | I1400: 0 | J1400: =RC[-1]/RC[-2] -> 0
A1401: 219 | B1401: 2 | C1401: Friday | D1401: 5 | E1401: 4pm-5pm | F1401: 8 | G1401: 2 | H1401: 34 | I1401: 0 | J1401: =RC[-1]/RC[-2] -> 0
A1402: 220 | B1402: 2 | C1402: Monday | D1402: 1 | E1402: 9am-10am | F1402: 1 | G1402: 2 | H1402: 6 | I1402: 0 | J1402: =RC[-1]/RC[-2] -> 0
A1403: 220 | B1403: 2 | C1403: Monday | D1403: 1 | E1403: 10am-11am | F1403: 2 | G1403: 2 | H1403: 6 | I1403: 0 | J1403: =RC[-1]/RC[-2] -> 0
A1404: 220 | B1404: 2 | C1404: Monday | D1404: 1 | E1404: 11am-12pm | F1404: 3 | G1404: 2 | H1404: 6 | I1404: 0 | J1404: =RC[-1]/RC[-2] -> 0
A1405: 220 | B1405: 2 | C1405: Monday | D1405: 1 | E1405: 12pm-1pm | F1405: 4 | G1405: 2 | H1405: 6 | I1405: 0 | J1405: =RC[-1]/RC[-2] -> 0
A1406: 220 | B1406: 2 | C1406: Monday | D1406: 1 | E1406: 1pm-2pm | F1406: 5 | G1406: 2 | H1406: 6 | I1406: 0 | J1406: =RC[-1]/RC[-2] -> 0
A1407: 220 | B1407: 2 | C1407: Monday | D1407: 1 | E1407: 2pm-3pm | F1407: 6 | G1407: 2 | H1407: 6 | I1407: 0 | J1407: =RC[-1]/RC[-2] -> 0
A1408: 220 | B1408: 2 | C1408: Monday | D1408: 1 | E1408: 3pm-4pm | F1408: 7 | G1408: 2 | H1408: 6 | I1408: 0 | J1408: =RC[-1]/RC[-2] -> 0
A1409: 220 | B1409: 2 | C1409: Monday | D1409: 1 | E1409: 4pm-5pm | F1409: 8 | G1409: 2 | H1409: 6 | I1409: 0 | J1409: =RC[-1]/RC[-2] -> 0
A1410: 220 | B1410: 2 | C1410: Tuesday | D1410: 2 | E1410: 9am-10am | F1410: 1 | G1410: 2 | H1410: 6 | I1410: 0 | J1410: =RC[-1]/RC[-2] -> 0
A1411: 220 | B1411: 2 | C1411: Tuesday | D1411: 2 | E1411: 10am-11am | F1411: 2 | G1411: 2 | H1411: 6 | I1411: 0 | J1411: =RC[-1]/RC[-2] -> 0
A1412: 220 | B1412: 2 | C1412: Tuesday | D1412: 2 | E1412: 11am-12pm | F1412: 3 | G1412: 2 | H1412: 6 | I1412: 0 | J1412: =RC[-1]/RC[-2] -> 0
A1413: 220 | B1413: 2 | C1413: Tuesday | D1413: 2 | E1413: 12pm-1pm | F1413: 4 | G1413: 2 | H1413: 6 | I1413: 0 | J1413: =RC[-1]/RC[-2] -> 0
A1414: 220 | B1414: 2 | C1414: Tuesday | D1414: 2 | E1414: 1pm-2pm | F1414: 5 | G1414: 2 | H1414: 6 | I1414: 0 | J1414: =RC[-1]/RC[-2] -> 0
A1415: 220 | B1415: 2 | C1415: Tuesday | D1415: 2 | E1415: 2pm-3pm | F1415: 6 | G1415: 2 | H1415: 6 | I1415: 0 | J1415: =RC[-1]/RC[-2] -> 0
A1416: 220 | B1416: 2 | C1416: Tuesday | D1416: 2 | E1416: 3pm-4pm | F1416: 7 | G1416: 2 | H1416: 6 | I1416: 0 | J1416: =RC[-1]/RC[-2] -> 0
A1417: 220 | B1417: 2 | C1417: Tuesday | D1417: 2 | E1417: 4pm-5pm | F1417: 8 | G1417: 2 | H1417: 6 | I1417: 0 | J1417: =RC[-1]/RC[-2] -> 0
A1418: 220 | B1418: 2 | C1418: Wednesday | D1418: 3 | E1418: 9am-10am | F1418: 1 | G1418: 2 | H1418: 6 | I1418: 0 | J1418: =RC[-1]/RC[-2] -> 0
A1419: 220 | B1419: 2 | C1419: Wednesday | D1419: 3 | E1419: 10am-11am | F1419: 2 | G1419: 2 | H1419: 6 | I1419: 0 | J1419: =RC[-1]/RC[-2] -> 0
A1420: 220 | B1420: 2 | C1420: Wednesday | D1420: 3 | E1420: 11am-12pm | F1420: 3 | G1420: 2 | H1420: 6 | I1420: 0 | J1420: =RC[-1]/RC[-2] -> 0
A1421: 220 | B1421: 2 | C1421: Wednesday | D1421: 3 | E1421: 12pm-1pm | F1421: 4 | G1421: 2 | H1421: 6 | I1421: 0 | J1421: =RC[-1]/RC[-2] -> 0
A1422: 220 | B1422: 2 | C1422: Wednesday | D1422: 3 | E1422: 1pm-2pm | F1422: 5 | G1422: 2 | H1422: 6 | I1422: 0 | J1422: =RC[-1]/RC[-2] -> 0
A1423: 220 | B1423: 2 | C1423: Wednesday | D1423: 3 | E1423: 2pm-3pm | F1423: 6 | G1423: 2 | H1423: 6 | I1423: 0 | J1423: =RC[-1]/RC[-2] -> 0
A1424: 220 | B1424: 2 | C1424: Wednesday | D1424: 3 | E1424: 3pm-4pm | F1424: 7 | G1424: 2 | H1424: 6 | I1424: 0 | J1424: =RC[-1]/RC[-2] -> 0
A1425: 220 | B1425: 2 | C1425: Wednesday | D1425: 3 | E1425: 4pm-5pm | F1425: 8 | G1425: 2 | H1425: 6 | I1425: 0 | J1425: =RC[-1]/RC[-2] -> 0
A1426: 220 | B1426: 2 | C1426: Thursday | D1426: 4 | E1426: 9am-10am | F1426: 1 | G1426: 2 | H1426: 6 | I1426: 0 | J1426: =RC[-1]/RC[-2] -> 0
A1427: 220 | B1427: 2 | C1427: Thursday | D1427: 4 | E1427: 10am-11am | F1427: 2 | G1427: 2 | H1427: 6 | I1427: 0 | J1427: =RC[-1]/RC[-2] -> 0
A1428: 220 | B1428: 2 | C1428: Thursday | D1428: 4 | E1428: 11am-12pm | F1428: 3 | G1428: 2 | H1428: 6 | I1428: 0 | J1428: =RC[-1]/RC[-2] -> 0
A1429: 220 | B1429: 2 | C1429: Thursday | D1429: 4 | E1429: 12pm-1pm | F1429: 4 | G1429: 2 | H1429: 6 | I1429: 0 | J1429: =RC[-1]/RC[-2] -> 0
A1430: 220 | B1430: 2 | C1430: Thursday | D1430: 4 | E1430: 1pm-2pm | F1430: 5 | G1430: 2 | H1430: 6 | I1430: 0 | J1430: =RC[-1]/RC[-2] -> 0
A1431: 220 | B1431: 2 | C1431: Thursday | D1431: 4 | E1431: 2pm-3pm | F1431: 6 | G1431: 2 | H1431: 6 | I1431: 0 | J1431: =RC[-1]/RC[-2] -> 0
A1432: 220 | B1432: 2 | C1432: Thursday | D1432: 4 | E1432: 3pm-4pm | F1432: 7 | G1432: 2 | H1432: 6 | I1432: 0 | J1432: =RC[-1]/RC[-2] -> 0
A1433: 220 | B1433: 2 | C1433: Thursday | D1433: 4 | E1433: 4pm-5pm | F1433: 8 | G1433: 2 | H1433: 6 | I1433: 0 | J1433: =RC[-1]/RC[-2] -> 0
A1434: 220 | B1434: 2 | C1434: Friday | D1434: 5 | E1434: 9am-10am | F1434: 1 | G1434: 2 | H1434: 6 | I1434: 0 | J1434: =RC[-1]/RC[-2] -> 0
A1435: 220 | B1435: 2 | C1435: Friday | D1435: 5 | E1435: 10am-11am | F1435: 2 | G1435: 2 | H1435: 6 | I1435: 0 | J1435: =RC[-1]/RC[-2] -> 0
A1436: 220 | B1436: 2 | C1436: Friday | D1436: 5 | E1436: 11am-12pm | F1436: 3 | G1436: 2 | H1436: 6 | I1436: 0 | J1436: =RC[-1]/RC[-2] -> 0
A1437: 220 | B1437: 2 | C1437: Friday | D1437: 5 | E1437: 12pm-1pm | F1437: 4 | G1437: 2 | H1437: 6 | I1437: 0 | J1437: =RC[-1]/RC[-2] -> 0
A1438: 220 | B1438: 2 | C1438: Friday | D1438: 5 | E1438: 1pm-2pm | F1438: 5 | G1438: 2 | H1438: 6 | I1438: 0 | J1438: =RC[-1]/RC[-2] -> 0
A1439: 220 | B1439: 2 | C1439: Friday | D1439: 5 | E1439: 2pm-3pm | F1439: 6 | G1439: 2 | H1439: 6 | I1439: 0 | J1439: =RC[-1]/RC[-2] -> 0
A1440: 220 | B1440: 2 | C1440: Friday | D1440: 5 | E1440: 3pm-4pm | F1440: 7 | G1440: 2 | H1440: 6 | I1440: 0 | J1440: =RC[-1]/RC[-2] -> 0
A1441: 220 | B1441: 2 | C1441: Friday | D1441: 5 | E1441: 4pm-5pm | F1441: 8 | G1441: 2 | H1441: 6 | I1441: 0 | J1441: =RC[-1]/RC[-2] -> 0
A1442: 232 | B1442: 2 | C1442: Monday | D1442: 1 | E1442: 9am-10am | F1442: 1 | G1442: 2 | H1442: 4 | I1442: 0 | J1442: =RC[-1]/RC[-2] -> 0
A1443: 232 | B1443: 2 | C1443: Monday | D1443: 1 | E1443: 10am-11am | F1443: 2 | G1443: 2 | H1443: 4 | I1443: 0 | J1443: =RC[-1]/RC[-2] -> 0
A1444: 232 | B1444: 2 | C1444: Monday | D1444: 1 | E1444: 11am-12pm | F1444: 3 | G1444: 2 | H1444: 4 | I1444: 0 | J1444: =RC[-1]/RC[-2] -> 0
A1445: 232 | B1445: 2 | C1445: Monday | D1445: 1 | E1445: 12pm-1pm | F1445: 4 | G1445: 2 | H1445: 4 | I1445: 0 | J1445: =RC[-1]/RC[-2] -> 0
A1446: 232 | B1446: 2 | C1446: Monday | D1446: 1 | E1446: 1pm-2pm | F1446: 5 | G1446: 2 | H1446: 4 | I1446: 0 | J1446: =RC[-1]/RC[-2] -> 0
A1447: 232 | B1447: 2 | C1447: Monday | D1447: 1 | E1447: 2pm-3pm | F1447: 6 | G1447: 2 | H1447: 4 | I1447: 0 | J1447: =RC[-1]/RC[-2] -> 0
A1448: 232 | B1448: 2 | C1448: Monday | D1448: 1 | E1448: 3pm-4pm | F1448: 7 | G1448: 2 | H1448: 4 | I1448: 0 | J1448: =RC[-1]/RC[-2] -> 0
A1449: 232 | B1449: 2 | C1449: Monday | D1449: 1 | E1449: 4pm-5pm | F1449: 8 | G1449: 2 | H1449: 4 | I1449: 0 | J1449: =RC[-1]/RC[-2] -> 0
A1450: 232 | B1450: 2 | C1450: Tuesday | D1450: 2 | E1450: 9am-10am | F1450: 1 | G1450: 2 | H1450: 4 | I1450: 0 | J1450: =RC[-1]/RC[-2] -> 0
A1451: 232 | B1451: 2 | C1451: Tuesday | D1451: 2 | E1451: 10am-11am | F1451: 2 | G1451: 2 | H1451: 4 | I1451: 0 | J1451: =RC[-1]/RC[-2] -> 0
A1452: 232 | B1452: 2 | C1452: Tuesday | D1452: 2 | E1452: 11am-12pm | F1452: 3 | G1452: 3 | H1452: 4 | I1452: 1 | J1452: =RC[-1]/RC[-2] -> 0.25
A1453: 232 | B1453: 2 | C1453: Tuesday | D1453: 2 | E1453: 12pm-1pm | F1453: 4 | G1453: 2 | H1453: 4 | I1453: 0 | J1453: =RC[-1]/RC[-2] -> 0
A1454: 232 | B1454: 2 | C1454: Tuesday | D1454: 2 | E1454: 1pm-2pm | F1454: 5 | G1454: 2 | H1454: 4 | I1454: 0 | J1454: =RC[-1]/RC[-2] -> 0
A1455: 232 | B1455: 2 | C1455: Tuesday | D1455: 2 | E1455: 2pm-3pm | F1455: 6 | G1455: 2 | H1455: 4 | I1455: 0 | J1455: =RC[-1]/RC[-2] -> 0
A1456: 232 | B1456: 2 | C1456: Tuesday | D1456: 2 | E1456: 3pm-4pm | F1456: 7 | G1456: 2 | H1456: 4 | I1456: 0 | J1456: =RC[-1]/RC[-2] -> 0
A1457: 232 | B1457: 2 | C1457: Tuesday | D1457: 2 | E1457: 4pm-5pm | F1457: 8 | G1457: 2 | H1457: 4 | I1457: 0 | J1457: =RC[-1]/RC[-2] -> 0
A1458: 232 | B1458: 2 | C1458: Wednesday | D1458: 3 | E1458: 9am-10am | F1458: 1 | G1458: 2 | H1458: 4 | I1458: 0 | J1458: =RC[-1]/RC[-2] -> 0
A1459: 232 | B1459: 2 | C1459: Wednesday | D1459: 3 | E1459: 10am-11am | F1459: 2 | G1459: 2 | H1459: 4 | I1459: 0 | J1459: =RC[-1]/RC[-2] -> 0
A1460: 232 | B1460: 2 | C1460: Wednesday | D1460: 3 | E1460: 11am-12pm | F1460: 3 | G1460: 2 | H1460: 4 | I1460: 0 | J1460: =RC[-1]/RC[-2] -> 0
A1461: 232 | B1461: 2 | C1461: Wednesday | D1461: 3 | E1461: 12pm-1pm | F1461: 4 | G1461: 2 | H1461: 4 | I1461: 0 | J1461: =RC[-1]/RC[-2] -> 0
A1462: 232 | B1462: 2 | C1462: Wednesday | D1462: 3 | E1462: 1pm-2pm | F1462: 5 | G1462: 2 | H1462: 4 | I1462: 0 | J1462: =RC[-1]/RC[-2] -> 0
A1463: 232 | B1463: 2 | C1463: Wednesday | D1463: 3 | E1463: 2pm-3pm | F1463: 6 | G1463: 2 | H1463: 4 | I1463: 0 | J1463: =RC[-1]/RC[-2] -> 0
A1464: 232 | B1464: 2 | C1464: Wednesday | D1464: 3 | E1464: 3pm-4pm | F1464: 7 | G1464: 2 | H1464: 4 | I1464: 0 | J1464: =RC[-1]/RC[-2] -> 0
A1465: 232 | B1465: 2 | C1465: Wednesday | D1465: 3 | E1465: 4pm-5pm | F1465: 8 | G1465: 2 | H1465: 4 | I1465: 0 | J1465: =RC[-1]/RC[-2] -> 0
A1466: 232 | B1466: 2 | C1466: Thursday | D1466: 4 | E1466: 9am-10am | F1466: 1 | G1466: 2 | H1466: 4 | I1466: 0 | J1466: =RC[-1]/RC[-2] -> 0
A1467: 232 | B1467: 2 | C1467: Thursday | D1467: 4 | E1467: 10am-11am | F1467: 2 | G1467: 1 | H1467: 4 | I1467: 12 | J1467: =RC[-1]/RC[-2] -> 3
A1468: 232 | B1468: 2 | C1468: Thursday | D1468: 4 | E1468: 11am-12pm | F1468: 3 | G1468: 2 | H1468: 4 | I1468: 0 | J1468: =RC[-1]/RC[-2] -> 0
A1469: 232 | B1469: 2 | C1469: Thursday | D1469: 4 | E1469: 12pm-1pm | F1469: 4 | G1469: 2 | H1469: 4 | I1469: 0 | J1469: =RC[-1]/RC[-2] -> 0
A1470: 232 | B1470: 2 | C1470: Thursday | D1470: 4 | E1470: 1pm-2pm | F1470: 5 | G1470: 2 | H1470: 4 | I1470: 0 | J1470: =RC[-1]/RC[-2] -> 0
A1471: 232 | B1471: 2 | C1471: Thursday | D1471: 4 | E1471: 2pm-3pm | F1471: 6 | G1471: 2 | H1471: 4 | I1471: 0 | J1471: =RC[-1]/RC[-2] -> 0
A1472: 232 | B1472: 2 | C1472: Thursday | D1472: 4 | E1472: 3pm-4pm | F1472: 7 | G1472: 2 | H1472: 4 | I1472: 0 | J1472: =RC[-1]/RC[-2] -> 0
A1473: 232 | B1473: 2 | C1473: Thursday | D1473: 4 | E1473: 4pm-5pm | F1473: 8 | G1473: 2 | H1473: 4 | I1473: 0 | J1473: =RC[-1]/RC[-2] -> 0
A1474: 232 | B1474: 2 | C1474: Friday | D1474: 5 | E1474: 9am-10am | F1474: 1 | G1474: 2 | H1474: 4 | I1474: 0 | J1474: =RC[-1]/RC[-2] -> 0
A1475: 232 | B1475: 2 | C1475: Friday | D1475: 5 | E1475: 10am-11am | F1475: 2 | G1475: 2 | H1475: 4 | I1475: 0 | J1475: =RC[-1]/RC[-2] -> 0
A1476: 232 | B1476: 2 | C1476: Friday | D1476: 5 | E1476: 11am-12pm | F1476: 3 | G1476: 2 | H1476: 4 | I1476: 0 | J1476: =RC[-1]/RC[-2] -> 0
A1477: 232 | B1477: 2 | C1477: Friday | D1477: 5 | E1477: 12pm-1pm | F1477: 4 | G1477: 2 | H1477: 4 | I1477: 0 | J1477: =RC[-1]/RC[-2] -> 0
A1478: 232 | B1478: 2 | C1478: Friday | D1478: 5 | E1478: 1pm-2pm | F1478: 5 | G1478: 1 | H1478: 4 | I1478: 1 | J1478: =RC[-1]/RC[-2] -> 0.25
A1479: 232 | B1479: 2 | C1479: Friday | D1479: 5 | E1479: 2pm-3pm | F1479: 6 | G1479: 1 | H1479: 4 | I1479: 1 | J1479: =RC[-1]/RC[-2] -> 0.25
A1480: 232 | B1480: 2 | C1480: Friday | D1480: 5 | E1480: 3pm-4pm | F1480: 7 | G1480: 2 | H1480: 4 | I1480: 0 | J1480: =RC[-1]/RC[-2] -> 0
A1481: 232 | B1481: 2 | C1481: Friday | D1481: 5 | E1481: 4pm-5pm | F1481: 8 | G1481: 2 | H1481: 4 | I1481: 0 | J1481: =RC[-1]/RC[-2] -> 0
A1482: 233 | B1482: 2 | C1482: Monday | D1482: 1 | E1482: 9am-10am | F1482: 1 | G1482: 3 | H1482: 4 | I1482: 1 | J1482: =RC[-1]/RC[-2] -> 0.25
A1483: 233 | B1483: 2 | C1483: Monday | D1483: 1 | E1483: 10am-11am | F1483: 2 | G1483: 2 | H1483: 4 | I1483: 0 | J1483: =RC[-1]/RC[-2] -> 0
A1484: 233 | B1484: 2 | C1484: Monday | D1484: 1 | E1484: 11am-12pm | F1484: 3 | G1484: 2 | H1484: 4 | I1484: 0 | J1484: =RC[-1]/RC[-2] -> 0
A1485: 233 | B1485: 2 | C1485: Monday | D1485: 1 | E1485: 12pm-1pm | F1485: 4 | G1485: 2 | H1485: 4 | I1485: 0 | J1485: =RC[-1]/RC[-2] -> 0
A1486: 233 | B1486: 2 | C1486: Monday | D1486: 1 | E1486: 1pm-2pm | F1486: 5 | G1486: 2 | H1486: 4 | I1486: 0 | J1486: =RC[-1]/RC[-2] -> 0
A1487: 233 | B1487: 2 | C1487: Monday | D1487: 1 | E1487: 2pm-3pm | F1487: 6 | G1487: 2 | H1487: 4 | I1487: 0 | J1487: =RC[-1]/RC[-2] -> 0
A1488: 233 | B1488: 2 | C1488: Monday | D1488: 1 | E1488: 3pm-4pm | F1488: 7 | G1488: 2 | H1488: 4 | I1488: 0 | J1488: =RC[-1]/RC[-2] -> 0
A1489: 233 | B1489: 2 | C1489: Monday | D1489: 1 | E1489: 4pm-5pm | F1489: 8 | G1489: 2 | H1489: 4 | I1489: 0 | J1489: =RC[-1]/RC[-2] -> 0
A1490: 233 | B1490: 2 | C1490: Tuesday | D1490: 2 | E1490: 9am-10am | F1490: 1 | G1490: 1 | H1490: 4 | I1490: 13 | J1490: =RC[-1]/RC[-2] -> 3.25
A1491: 233 | B1491: 2 | C1491: Tuesday | D1491: 2 | E1491: 10am-11am | F1491: 2 | G1491: 1 | H1491: 4 | I1491: 11 | J1491: =RC[-1]/RC[-2] -> 2.75
A1492: 233 | B1492: 2 | C1492: Tuesday | D1492: 2 | E1492: 11am-12pm | F1492: 3 | G1492: 1 | H1492: 4 | I1492: 13 | J1492: =RC[-1]/RC[-2] -> 3.25
A1493: 233 | B1493: 2 | C1493: Tuesday | D1493: 2 | E1493: 12pm-1pm | F1493: 4 | G1493: 2 | H1493: 4 | I1493: 0 | J1493: =RC[-1]/RC[-2] -> 0
A1494: 233 | B1494: 2 | C1494: Tuesday | D1494: 2 | E1494: 1pm-2pm | F1494: 5 | G1494: 2 | H1494: 4 | I1494: 0 | J1494: =RC[-1]/RC[-2] -> 0
A1495: 233 | B1495: 2 | C1495: Tuesday | D1495: 2 | E1495: 2pm-3pm | F1495: 6 | G1495: 1 | H1495: 4 | I1495: 1 | J1495: =RC[-1]/RC[-2] -> 0.25
A1496: 233 | B1496: 2 | C1496: Tuesday | D1496: 2 | E1496: 3pm-4pm | F1496: 7 | G1496: 2 | H1496: 4 | I1496: 0 | J1496: =RC[-1]/RC[-2] -> 0
A1497: 233 | B1497: 2 | C1497: Tuesday | D1497: 2 | E1497: 4pm-5pm | F1497: 8 | G1497: 2 | H1497: 4 | I1497: 0 | J1497: =RC[-1]/RC[-2] -> 0
A1498: 233 | B1498: 2 | C1498: Wednesday | D1498: 3 | E1498: 9am-10am | F1498: 1 | G1498: 3 | H1498: 4 | I1498: 1 | J1498: =RC[-1]/RC[-2] -> 0.25
A1499: 233 | B1499: 2 | C1499: Wednesday | D1499: 3 | E1499: 10am-11am | F1499: 2 | G1499: 2 | H1499: 4 | I1499: 0 | J1499: =RC[-1]/RC[-2] -> 0
A1500: 233 | B1500: 2 | C1500: Wednesday | D1500: 3 | E1500: 11am-12pm | F1500: 3 | G1500: 2 | H1500: 4 | I1500: 0 | J1500: =RC[-1]/RC[-2] -> 0
A1501: 233 | B1501: 2 | C1501: Wednesday | D1501: 3 | E1501: 12pm-1pm | F1501: 4 | G1501: 2 | H1501: 4 | I1501: 0 | J1501: =RC[-1]/RC[-2] -> 0
A1502: 233 | B1502: 2 | C1502: Wednesday | D1502: 3 | E1502: 1pm-2pm | F1502: 5 | G1502: 2 | H1502: 4 | I1502: 0 | J1502: =RC[-1]/RC[-2] -> 0
A1503: 233 | B1503: 2 | C1503: Wednesday | D1503: 3 | E1503: 2pm-3pm | F1503: 6 | G1503: 2 | H1503: 4 | I1503: 0 | J1503: =RC[-1]/RC[-2] -> 0
A1504: 233 | B1504: 2 | C1504: Wednesday | D1504: 3 | E1504: 3pm-4pm | F1504: 7 | G1504: 2 | H1504: 4 | I1504: 0 | J1504: =RC[-1]/RC[-2] -> 0
A1505: 233 | B1505: 2 | C1505: Wednesday | D1505: 3 | E1505: 4pm-5pm | F1505: 8 | G1505: 2 | H1505: 4 | I1505: 0 | J1505: =RC[-1]/RC[-2] -> 0
A1506: 233 | B1506: 2 | C1506: Thursday | D1506: 4 | E1506: 9am-10am | F1506: 1 | G1506: 2 | H1506: 4 | I1506: 0 | J1506: =RC[-1]/RC[-2] -> 0
A1507: 233 | B1507: 2 | C1507: Thursday | D1507: 4 | E1507: 10am-11am | F1507: 2 | G1507: 2 | H1507: 4 | I1507: 0 | J1507: =RC[-1]/RC[-2] -> 0
A1508: 233 | B1508: 2 | C1508: Thursday | D1508: 4 | E1508: 11am-12pm | F1508: 3 | G1508: 1 | H1508: 4 | I1508: 9 | J1508: =RC[-1]/RC[-2] -> 2.25
A1509: 233 | B1509: 2 | C1509: Thursday | D1509: 4 | E1509: 12pm-1pm | F1509: 4 | G1509: 1 | H1509: 4 | I1509: 3 | J1509: =RC[-1]/RC[-2] -> 0.75
A1510: 233 | B1510: 2 | C1510: Thursday | D1510: 4 | E1510: 1pm-2pm | F1510: 5 | G1510: 2 | H1510: 4 | I1510: 0 | J1510: =RC[-1]/RC[-2] -> 0
A1511: 233 | B1511: 2 | C1511: Thursday | D1511: 4 | E1511: 2pm-3pm | F1511: 6 | G1511: 2 | H1511: 4 | I1511: 0 | J1511: =RC[-1]/RC[-2] -> 0
A1512: 233 | B1512: 2 | C1512: Thursday | D1512: 4 | E1512: 3pm-4pm | F1512: 7 | G1512: 2 | H1512: 4 | I1512: 0 | J1512: =RC[-1]/RC[-2] -> 0
A1513: 233 | B1513: 2 | C1513: Thursday | D1513: 4 | E1513: 4pm-5pm | F1513: 8 | G1513: 2 | H1513: 4 | I1513: 0 | J1513: =RC[-1]/RC[-2] -> 0
A1514: 233 | B1514: 2 | C1514: Friday | D1514: 5 | E1514: 9am-10am | F1514: 1 | G1514: 2 | H1514: 4 | I1514: 0 | J1514: =RC[-1]/RC[-2] -> 0
A1515: 233 | B1515: 2 | C1515: Friday | D1515: 5 | E1515: 10am-11am | F1515: 2 | G1515: 2 | H1515: 4 | I1515: 0 | J1515: =RC[-1]/RC[-2] -> 0
A1516: 233 | B1516: 2 | C1516: Friday | D1516: 5 | E1516: 11am-12pm | F1516: 3 | G1516: 2 | H1516: 4 | I1516: 0 | J1516: =RC[-1]/RC[-2] -> 0
A1517: 233 | B1517: 2 | C1517: Friday | D1517: 5 | E1517: 12pm-1pm | F1517: 4 | G1517: 2 | H1517: 4 | I1517: 0 | J1517: =RC[-1]/RC[-2] -> 0
A1518: 233 | B1518: 2 | C1518: Friday | D1518: 5 | E1518: 1pm-2pm | F1518: 5 | G1518: 1 | H1518: 4 | I1518: 7 | J1518: =RC[-1]/RC[-2] -> 1.75
A1519: 233 | B1519: 2 | C1519: Friday | D1519: 5 | E1519: 2pm-3pm | F1519: 6 | G1519: 1 | H1519: 4 | I1519: 4 | J1519: =RC[-1]/RC[-2] -> 1
A1520: 233 | B1520: 2 | C1520: Friday | D1520: 5 | E1520: 3pm-4pm | F1520: 7 | G1520: 1 | H1520: 4 | I1520: 11 | J1520: =RC[-1]/RC[-2] -> 2.75
A1521: 233 | B1521: 2 | C1521: Friday | D1521: 5 | E1521: 4pm-5pm | F1521: 8 | G1521: 2 | H1521: 4 | I1521: 0 | J1521: =RC[-1]/RC[-2] -> 0
A1522: 234 | B1522: 2 | C1522: Monday | D1522: 1 | E1522: 9am-10am | F1522: 1 | G1522: 2 | H1522: 4 | I1522: 0 | J1522: =RC[-1]/RC[-2] -> 0
A1523: 234 | B1523: 2 | C1523: Monday | D1523: 1 | E1523: 10am-11am | F1523: 2 | G1523: 3 | H1523: 4 | I1523: 1 | J1523: =RC[-1]/RC[-2] -> 0.25
A1524: 234 | B1524: 2 | C1524: Monday | D1524: 1 | E1524: 11am-12pm | F1524: 3 | G1524: 2 | H1524: 4 | I1524: 0 | J1524: =RC[-1]/RC[-2] -> 0
A1525: 234 | B1525: 2 | C1525: Monday | D1525: 1 | E1525: 12pm-1pm | F1525: 4 | G1525: 2 | H1525: 4 | I1525: 0 | J1525: =RC[-1]/RC[-2] -> 0
A1526: 234 | B1526: 2 | C1526: Monday | D1526: 1 | E1526: 1pm-2pm | F1526: 5 | G1526: 2 | H1526: 4 | I1526: 0 | J1526: =RC[-1]/RC[-2] -> 0
A1527: 234 | B1527: 2 | C1527: Monday | D1527: 1 | E1527: 2pm-3pm | F1527: 6 | G1527: 3 | H1527: 4 | I1527: 1 | J1527: =RC[-1]/RC[-2] -> 0.25
A1528: 234 | B1528: 2 | C1528: Monday | D1528: 1 | E1528: 3pm-4pm | F1528: 7 | G1528: 3 | H1528: 4 | I1528: 1 | J1528: =RC[-1]/RC[-2] -> 0.25
A1529: 234 | B1529: 2 | C1529: Monday | D1529: 1 | E1529: 4pm-5pm | F1529: 8 | G1529: 2 | H1529: 4 | I1529: 0 | J1529: =RC[-1]/RC[-2] -> 0
A1530: 234 | B1530: 2 | C1530: Tuesday | D1530: 2 | E1530: 9am-10am | F1530: 1 | G1530: 1 | H1530: 4 | I1530: 2 | J1530: =RC[-1]/RC[-2] -> 0.5
A1531: 234 | B1531: 2 | C1531: Tuesday | D1531: 2 | E1531: 10am-11am | F1531: 2 | G1531: 2 | H1531: 4 | I1531: 0 | J1531: =RC[-1]/RC[-2] -> 0
A1532: 234 | B1532: 2 | C1532: Tuesday | D1532: 2 | E1532: 11am-12pm | F1532: 3 | G1532: 1 | H1532: 4 | I1532: 3 | J1532: =RC[-1]/RC[-2] -> 0.75
A1533: 234 | B1533: 2 | C1533: Tuesday | D1533: 2 | E1533: 12pm-1pm | F1533: 4 | G1533: 2 | H1533: 4 | I1533: 0 | J1533: =RC[-1]/RC[-2] -> 0
A1534: 234 | B1534: 2 | C1534: Tuesday | D1534: 2 | E1534: 1pm-2pm | F1534: 5 | G1534: 3 | H1534: 4 | I1534: 1 | J1534: =RC[-1]/RC[-2] -> 0.25
A1535: 234 | B1535: 2 | C1535: Tuesday | D1535: 2 | E1535: 2pm-3pm | F1535: 6 | G1535: 3 | H1535: 4 | I1535: 1 | J1535: =RC[-1]/RC[-2] -> 0.25
A1536: 234 | B1536: 2 | C1536: Tuesday | D1536: 2 | E1536: 3pm-4pm | F1536: 7 | G1536: 3 | H1536: 4 | I1536: 1 | J1536: =RC[-1]/RC[-2] -> 0.25
A1537: 234 | B1537: 2 | C1537: Tuesday | D1537: 2 | E1537: 4pm-5pm | F1537: 8 | G1537: 2 | H1537: 4 | I1537: 0 | J1537: =RC[-1]/RC[-2] -> 0
A1538: 234 | B1538: 2 | C1538: Wednesday | D1538: 3 | E1538: 9am-10am | F1538: 1 | G1538: 3 | H1538: 4 | I1538: 1 | J1538: =RC[-1]/RC[-2] -> 0.25
A1539: 234 | B1539: 2 | C1539: Wednesday | D1539: 3 | E1539: 10am-11am | F1539: 2 | G1539: 2 | H1539: 4 | I1539: 0 | J1539: =RC[-1]/RC[-2] -> 0
A1540: 234 | B1540: 2 | C1540: Wednesday | D1540: 3 | E1540: 11am-12pm | F1540: 3 | G1540: 3 | H1540: 4 | I1540: 1 | J1540: =RC[-1]/RC[-2] -> 0.25
A1541: 234 | B1541: 2 | C1541: Wednesday | D1541: 3 | E1541: 12pm-1pm | F1541: 4 | G1541: 2 | H1541: 4 | I1541: 0 | J1541: =RC[-1]/RC[-2] -> 0
A1542: 234 | B1542: 2 | C1542: Wednesday | D1542: 3 | E1542: 1pm-2pm | F1542: 5 | G1542: 2 | H1542: 4 | I1542: 0 | J1542: =RC[-1]/RC[-2] -> 0
A1543: 234 | B1543: 2 | C1543: Wednesday | D1543: 3 | E1543: 2pm-3pm | F1543: 6 | G1543: 2 | H1543: 4 | I1543: 0 | J1543: =RC[-1]/RC[-2] -> 0
A1544: 234 | B1544: 2 | C1544: Wednesday | D1544: 3 | E1544: 3pm-4pm | F1544: 7 | G1544: 2 | H1544: 4 | I1544: 0 | J1544: =RC[-1]/RC[-2] -> 0
A1545: 234 | B1545: 2 | C1545: Wednesday | D1545: 3 | E1545: 4pm-5pm | F1545: 8 | G1545: 2 | H1545: 4 | I1545: 0 | J1545: =RC[-1]/RC[-2] -> 0
A1546: 234 | B1546: 2 | C1546: Thursday | D1546: 4 | E1546: 9am-10am | F1546: 1 | G1546: 2 | H1546: 4 | I1546: 0 | J1546: =RC[-1]/RC[-2] -> 0
A1547: 234 | B1547: 2 | C1547: Thursday | D1547: 4 | E1547: 10am-11am | F1547: 2 | G1547: 1 | H1547: 4 | I1547: 11 | J1547: =RC[-1]/RC[-2] -> 2.75
A1548: 234 | B1548: 2 | C1548: Thursday | D1548: 4 | E1548: 11am-12pm | F1548: 3 | G1548: 1 | H1548: 4 | I1548: 4 | J1548: =RC[-1]/RC[-2] -> 1
A1549: 234 | B1549: 2 | C1549: Thursday | D1549: 4 | E1549: 12pm-1pm | F1549: 4 | G1549: 1 | H1549: 4 | I1549: 10 | J1549: =RC[-1]/RC[-2] -> 2.5
A1550: 234 | B1550: 2 | C1550: Thursday | D1550: 4 | E1550: 1pm-2pm | F1550: 5 | G1550: 1 | H1550: 4 | I1550: 2 | J1550: =RC[-1]/RC[-2] -> 0.5
A1551: 234 | B1551: 2 | C1551: Thursday | D1551: 4 | E1551: 2pm-3pm | F1551: 6 | G1551: 3 | H1551: 4 | I1551: 1 | J1551: =RC[-1]/RC[-2] -> 0.25
A1552: 234 | B1552: 2 | C1552: Thursday | D1552: 4 | E1552: 3pm-4pm | F1552: 7 | G1552: 2 | H1552: 4 | I1552: 0 | J1552: =RC[-1]/RC[-2] -> 0
A1553: 234 | B1553: 2 | C1553: Thursday | D1553: 4 | E1553: 4pm-5pm | F1553: 8 | G1553: 2 | H1553: 4 | I1553: 0 | J1553: =RC[-1]/RC[-2] -> 0
A1554: 234 | B1554: 2 | C1554: Friday | D1554: 5 | E1554: 9am-10am | F1554: 1 | G1554: 3 | H1554: 4 | I1554: 1 | J1554: =RC[-1]/RC[-2] -> 0.25
A1555: 234 | B1555: 2 | C1555: Friday | D1555: 5 | E1555: 10am-11am | F1555: 2 | G1555: 2 | H1555: 4 | I1555: 0 | J1555: =RC[-1]/RC[-2] -> 0
A1556: 234 | B1556: 2 | C1556: Friday | D1556: 5 | E1556: 11am-12pm | F1556: 3 | G1556: 2 | H1556: 4 | I1556: 0 | J1556: =RC[-1]/RC[-2] -> 0
A1557: 234 | B1557: 2 | C1557: Friday | D1557: 5 | E1557: 12pm-1pm | F1557: 4 | G1557: 2 | H1557: 4 | I1557: 0 | J1557: =RC[-1]/RC[-2] -> 0
A1558: 234 | B1558: 2 | C1558: Friday | D1558: 5 | E1558: 1pm-2pm | F1558: 5 | G1558: 1 | H1558: 4 | I1558: 3 | J1558: =RC[-1]/RC[-2] -> 0.75
A1559: 234 | B1559: 2 | C1559: Friday | D1559: 5 | E1559: 2pm-3pm | F1559: 6 | G1559: 1 | H1559: 4 | I1559: 7 | J1559: =RC[-1]/RC[-2] -> 1.75
A1560: 234 | B1560: 2 | C1560: Friday | D1560: 5 | E1560: 3pm-4pm | F1560: 7 | G1560: 2 | H1560: 4 | I1560: 0 | J1560: =RC[-1]/RC[-2] -> 0
A1561: 234 | B1561: 2 | C1561: Friday | D1561: 5 | E1561: 4pm-5pm | F1561: 8 | G1561: 2 | H1561: 4 | I1561: 0 | J1561: =RC[-1]/RC[-2] -> 0
A1562: 237 | B1562: 2 | C1562: Monday | D1562: 1 | E1562: 9am-10am | F1562: 1 | G1562: 2 | H1562: 44 | I1562: 0 | J1562: =RC[-1]/RC[-2] -> 0
A1563: 237 | B1563: 2 | C1563: Monday | D1563: 1 | E1563: 10am-11am | F1563: 2 | G1563: 2 | H1563: 44 | I1563: 0 | J1563: =RC[-1]/RC[-2] -> 0
A1564: 237 | B1564: 2 | C1564: Monday | D1564: 1 | E1564: 11am-12pm | F1564: 3 | G1564: 2 | H1564: 44 | I1564: 0 | J1564: =RC[-1]/RC[-2] -> 0
A1565: 237 | B1565: 2 | C1565: Monday | D1565: 1 | E1565: 12pm-1pm | F1565: 4 | G1565: 2 | H1565: 44 | I1565: 0 | J1565: =RC[-1]/RC[-2] -> 0
A1566: 237 | B1566: 2 | C1566: Monday | D1566: 1 | E1566: 1pm-2pm | F1566: 5 | G1566: 2 | H1566: 44 | I1566: 0 | J1566: =RC[-1]/RC[-2] -> 0
A1567: 237 | B1567: 2 | C1567: Monday | D1567: 1 | E1567: 2pm-3pm | F1567: 6 | G1567: 1 | H1567: 44 | I1567: 13 | J1567: =RC[-1]/RC[-2] -> 0.29545454545454547
A1568: 237 | B1568: 2 | C1568: Monday | D1568: 1 | E1568: 3pm-4pm | F1568: 7 | G1568: 1 | H1568: 44 | I1568: 12 | J1568: =RC[-1]/RC[-2] -> 0.27272727272727271
A1569: 237 | B1569: 2 | C1569: Monday | D1569: 1 | E1569: 4pm-5pm | F1569: 8 | G1569: 1 | H1569: 44 | I1569: 11 | J1569: =RC[-1]/RC[-2] -> 0.25
A1570: 237 | B1570: 2 | C1570: Tuesday | D1570: 2 | E1570: 9am-10am | F1570: 1 | G1570: 1 | H1570: 44 | I1570: 13 | J1570: =RC[-1]/RC[-2] -> 0.29545454545454547
A1571: 237 | B1571: 2 | C1571: Tuesday | D1571: 2 | E1571: 10am-11am | F1571: 2 | G1571: 1 | H1571: 44 | I1571: 13 | J1571: =RC[-1]/RC[-2] -> 0.29545454545454547
A1572: 237 | B1572: 2 | C1572: Tuesday | D1572: 2 | E1572: 11am-12pm | F1572: 3 | G1572: 1 | H1572: 44 | I1572: 15 | J1572: =RC[-1]/RC[-2] -> 0.34090909090909088
A1573: 237 | B1573: 2 | C1573: Tuesday | D1573: 2 | E1573: 12pm-1pm | F1573: 4 | G1573: 2 | H1573: 44 | I1573: 0 | J1573: =RC[-1]/RC[-2] -> 0
A1574: 237 | B1574: 2 | C1574: Tuesday | D1574: 2 | E1574: 1pm-2pm | F1574: 5 | G1574: 2 | H1574: 44 | I1574: 0 | J1574: =RC[-1]/RC[-2] -> 0
A1575: 237 | B1575: 2 | C1575: Tuesday | D1575: 2 | E1575: 2pm-3pm | F1575: 6 | G1575: 2 | H1575: 44 | I1575: 0 | J1575: =RC[-1]/RC[-2] -> 0
A1576: 237 | B1576: 2 | C1576: Tuesday | D1576: 2 | E1576: 3pm-4pm | F1576: 7 | G1576: 2 | H1576: 44 | I1576: 0 | J1576: =RC[-1]/RC[-2] -> 0
A1577: 237 | B1577: 2 | C1577: Tuesday | D1577: 2 | E1577: 4pm-5pm | F1577: 8 | G1577: 2 | H1577: 44 | I1577: 0 | J1577: =RC[-1]/RC[-2] -> 0
A1578: 237 | B1578: 2 | C1578: Wednesday | D1578: 3 | E1578: 9am-10am | F1578: 1 | G1578: 2 | H1578: 44 | I1578: 0 | J1578: =RC[-1]/RC[-2] -> 0
A1579: 237 | B1579: 2 | C1579: Wednesday | D1579: 3 | E1579: 10am-11am | F1579: 2 | G1579: 2 | H1579: 44 | I1579: 0 | J1579: =RC[-1]/RC[-2] -> 0
A1580: 237 | B1580: 2 | C1580: Wednesday | D1580: 3 | E1580: 11am-12pm | F1580: 3 | G1580: 2 | H1580: 44 | I1580: 0 | J1580: =RC[-1]/RC[-2] -> 0
A1581: 237 | B1581: 2 | C1581: Wednesday | D1581: 3 | E1581: 12pm-1pm | F1581: 4 | G1581: 1 | H1581: 44 | I1581: 4 | J1581: =RC[-1]/RC[-2] -> 9.0909090909090912E-2
A1582: 237 | B1582: 2 | C1582: Wednesday | D1582: 3 | E1582: 1pm-2pm | F1582: 5 | G1582: 1 | H1582: 44 | I1582: 5 | J1582: =RC[-1]/RC[-2] -> 0.11363636363636363
A1583: 237 | B1583: 2 | C1583: Wednesday | D1583: 3 | E1583: 2pm-3pm | F1583: 6 | G1583: 1 | H1583: 44 | I1583: 13 | J1583: =RC[-1]/RC[-2] -> 0.29545454545454547
A1584: 237 | B1584: 2 | C1584: Wednesday | D1584: 3 | E1584: 3pm-4pm | F1584: 7 | G1584: 1 | H1584: 44 | I1584: 10 | J1584: =RC[-1]/RC[-2] -> 0.22727272727272727
A1585: 237 | B1585: 2 | C1585: Wednesday | D1585: 3 | E1585: 4pm-5pm | F1585: 8 | G1585: 1 | H1585: 44 | I1585: 10 | J1585: =RC[-1]/RC[-2] -> 0.22727272727272727
A1586: 237 | B1586: 2 | C1586: Thursday | D1586: 4 | E1586: 9am-10am | F1586: 1 | G1586: 2 | H1586: 44 | I1586: 0 | J1586: =RC[-1]/RC[-2] -> 0
A1587: 237 | B1587: 2 | C1587: Thursday | D1587: 4 | E1587: 10am-11am | F1587: 2 | G1587: 1 | H1587: 44 | I1587: 13 | J1587: =RC[-1]/RC[-2] -> 0.29545454545454547
A1588: 237 | B1588: 2 | C1588: Thursday | D1588: 4 | E1588: 11am-12pm | F1588: 3 | G1588: 1 | H1588: 44 | I1588: 12 | J1588: =RC[-1]/RC[-2] -> 0.27272727272727271
A1589: 237 | B1589: 2 | C1589: Thursday | D1589: 4 | E1589: 12pm-1pm | F1589: 4 | G1589: 1 | H1589: 44 | I1589: 10 | J1589: =RC[-1]/RC[-2] -> 0.22727272727272727
A1590: 237 | B1590: 2 | C1590: Thursday | D1590: 4 | E1590: 1pm-2pm | F1590: 5 | G1590: 1 | H1590: 44 | I1590: 5 | J1590: =RC[-1]/RC[-2] -> 0.11363636363636363
A1591: 237 | B1591: 2 | C1591: Thursday | D1591: 4 | E1591: 2pm-3pm | F1591: 6 | G1591: 2 | H1591: 44 | I1591: 0 | J1591: =RC[-1]/RC[-2] -> 0
A1592: 237 | B1592: 2 | C1592: Thursday | D1592: 4 | E1592: 3pm-4pm | F1592: 7 | G1592: 2 | H1592: 44 | I1592: 0 | J1592: =RC[-1]/RC[-2] -> 0
A1593: 237 | B1593: 2 | C1593: Thursday | D1593: 4 | E1593: 4pm-5pm | F1593: 8 | G1593: 2 | H1593: 44 | I1593: 0 | J1593: =RC[-1]/RC[-2] -> 0
A1594: 237 | B1594: 2 | C1594: Friday | D1594: 5 | E1594: 9am-10am | F1594: 1 | G1594: 2 | H1594: 44 | I1594: 0 | J1594: =RC[-1]/RC[-2] -> 0
A1595: 237 | B1595: 2 | C1595: Friday | D1595: 5 | E1595: 10am-11am | F1595: 2 | G1595: 2 | H1595: 44 | I1595: 0 | J1595: =RC[-1]/RC[-2] -> 0
A1596: 237 | B1596: 2 | C1596: Friday | D1596: 5 | E1596: 11am-12pm | F1596: 3 | G1596: 2 | H1596: 44 | I1596: 0 | J1596: =RC[-1]/RC[-2] -> 0
A1597: 237 | B1597: 2 | C1597: Friday | D1597: 5 | E1597: 12pm-1pm | F1597: 4 | G1597: 2 | H1597: 44 | I1597: 0 | J1597: =RC[-1]/RC[-2] -> 0
A1598: 237 | B1598: 2 | C1598: Friday | D1598: 5 | E1598: 1pm-2pm | F1598: 5 | G1598: 2 | H1598: 44 | I1598: 0 | J1598: =RC[-1]/RC[-2] -> 0
A1599: 237 | B1599: 2 | C1599: Friday | D1599: 5 | E1599: 2pm-3pm | F1599: 6 | G1599: 3 | H1599: 44 | I1599: 1 | J1599: =RC[-1]/RC[-2] -> 2.2727272727272728E-2
A1600: 237 | B1600: 2 | C1600: Friday | D1600: 5 | E1600: 3pm-4pm | F1600: 7 | G1600: 2 | H1600: 44 | I1600: 0 | J1600: =RC[-1]/RC[-2] -> 0
A1601: 237 | B1601: 2 | C1601: Friday | D1601: 5 | E1601: 4pm-5pm | F1601: 8 | G1601: 2 | H1601: 44 | I1601: 0 | J1601: =RC[-1]/RC[-2] -> 0
A1602: 237 | B1602: 2 | C1602: Thursday | D1602: 4 | E1602: 4pm-5pm | F1602: 8 | G1602: 2 | H1602: 44 | I1602: 0 | J1602: =RC[-1]/RC[-2] -> 0
A1603: 237 | B1603: 2 | C1603: Friday | D1603: 5 | E1603: 9am-10am | F1603: 1 | G1603: 2 | H1603: 44 | I1603: 0 | J1603: =RC[-1]/RC[-2] -> 0
A1604: 237 | B1604: 2 | C1604: Friday | D1604: 5 | E1604: 10am-11am | F1604: 2 | G1604: 2 | H1604: 44 | I1604: 0 | J1604: =RC[-1]/RC[-2] -> 0
A1605: 237 | B1605: 2 | C1605: Friday | D1605: 5 | E1605: 11am-12pm | F1605: 3 | G1605: 2 | H1605: 44 | I1605: 0 | J1605: =RC[-1]/RC[-2] -> 0
A1606: 237 | B1606: 2 | C1606: Friday | D1606: 5 | E1606: 12pm-1pm | F1606: 4 | G1606: 2 | H1606: 44 | I1606: 0 | J1606: =RC[-1]/RC[-2] -> 0
A1607: 237 | B1607: 2 | C1607: Friday | D1607: 5 | E1607: 1pm-2pm | F1607: 5 | G1607: 2 | H1607: 44 | I1607: 0 | J1607: =RC[-1]/RC[-2] -> 0
A1608: 237 | B1608: 2 | C1608: Friday | D1608: 5 | E1608: 2pm-3pm | F1608: 6 | G1608: 3 | H1608: 44 | I1608: 1 | J1608: =RC[-1]/RC[-2] -> 2.2727272727272728E-2
A1609: 237 | B1609: 2 | C1609: Friday | D1609: 5 | E1609: 3pm-4pm | F1609: 7 | G1609: 2 | H1609: 44 | I1609: 0 | J1609: =RC[-1]/RC[-2] -> 0
A1610: 237 | B1610: 2 | C1610: Friday | D1610: 5 | E1610: 4pm-5pm | F1610: 8 | G1610: 2 | H1610: 44 | I1610: 0 | J1610: =RC[-1]/RC[-2] -> 0
A1611: 237 | B1611: 2 | C1611: Thursday | D1611: 4 | E1611: 4pm-5pm | F1611: 8 | G1611: 2 | H1611: 44 | I1611: 0 | J1611: =RC[-1]/RC[-2] -> 0
A1612: 237 | B1612: 2 | C1612: Friday | D1612: 5 | E1612: 9am-10am | F1612: 1 | G1612: 2 | H1612: 44 | I1612: 0 | J1612: =RC[-1]/RC[-2] -> 0
A1613: 237 | B1613: 2 | C1613: Friday | D1613: 5 | E1613: 10am-11am | F1613: 2 | G1613: 2 | H1613: 44 | I1613: 0 | J1613: =RC[-1]/RC[-2] -> 0
A1614: 237 | B1614: 2 | C1614: Friday | D1614: 5 | E1614: 11am-12pm | F1614: 3 | G1614: 2 | H1614: 44 | I1614: 0 | J1614: =RC[-1]/RC[-2] -> 0
A1615: 237 | B1615: 2 | C1615: Friday | D1615: 5 | E1615: 12pm-1pm | F1615: 4 | G1615: 2 | H1615: 44 | I1615: 0 | J1615: =RC[-1]/RC[-2] -> 0
A1616: 237 | B1616: 2 | C1616: Friday | D1616: 5 | E1616: 1pm-2pm | F1616: 5 | G1616: 2 | H1616: 44 | I1616: 0 | J1616: =RC[-1]/RC[-2] -> 0
A1617: 237 | B1617: 2 | C1617: Friday | D1617: 5 | E1617: 2pm-3pm | F1617: 6 | G1617: 3 | H1617: 44 | I1617: 1 | J1617: =RC[-1]/RC[-2] -> 2.2727272727272728E-2
A1618: 237 | B1618: 2 | C1618: Friday | D1618: 5 | E1618: 3pm-4pm | F1618: 7 | G1618: 2 | H1618: 44 | I1618: 0 | J1618: =RC[-1]/RC[-2] -> 0
A1619: 237 | B1619: 2 | C1619: Friday | D1619: 5 | E1619: 4pm-5pm | F1619: 8 | G1619: 2 | H1619: 44 | I1619: 0 | J1619: =RC[-1]/RC[-2] -> 0
A1620: 237 | B1620: 2 | C1620: Thursday | D1620: 4 | E1620: 4pm-5pm | F1620: 8 | G1620: 2 | H1620: 44 | I1620: 0 | J1620: =RC[-1]/RC[-2] -> 0
A1621: 237 | B1621: 2 | C1621: Friday | D1621: 5 | E1621: 9am-10am | F1621: 1 | G1621: 2 | H1621: 44 | I1621: 0 | J1621: =RC[-1]/RC[-2] -> 0
A1622: 237 | B1622: 2 | C1622: Friday | D1622: 5 | E1622: 10am-11am | F1622: 2 | G1622: 2 | H1622: 44 | I1622: 0 | J1622: =RC[-1]/RC[-2] -> 0
A1623: 237 | B1623: 2 | C1623: Friday | D1623: 5 | E1623: 11am-12pm | F1623: 3 | G1623: 2 | H1623: 44 | I1623: 0 | J1623: =RC[-1]/RC[-2] -> 0
A1624: 237 | B1624: 2 | C1624: Friday | D1624: 5 | E1624: 12pm-1pm | F1624: 4 | G1624: 2 | H1624: 44 | I1624: 0 | J1624: =RC[-1]/RC[-2] -> 0
A1625: 237 | B1625: 2 | C1625: Friday | D1625: 5 | E1625: 1pm-2pm | F1625: 5 | G1625: 2 | H1625: 44 | I1625: 0 | J1625: =RC[-1]/RC[-2] -> 0
A1626: 237 | B1626: 2 | C1626: Friday | D1626: 5 | E1626: 2pm-3pm | F1626: 6 | G1626: 3 | H1626: 44 | I1626: 1 | J1626: =RC[-1]/RC[-2] -> 2.2727272727272728E-2
A1627: 237 | B1627: 2 | C1627: Friday | D1627: 5 | E1627: 3pm-4pm | F1627: 7 | G1627: 2 | H1627: 44 | I1627: 0 | J1627: =RC[-1]/RC[-2] -> 0
A1628: 237 | B1628: 2 | C1628: Friday | D1628: 5 | E1628: 4pm-5pm | F1628: 8 | G1628: 2 | H1628: 44 | I1628: 0 | J1628: =RC[-1]/RC[-2] -> 0
A1629: 237 | B1629: 2 | C1629: Thursday | D1629: 4 | E1629: 4pm-5pm | F1629: 8 | G1629: 2 | H1629: 44 | I1629: 0 | J1629: =RC[-1]/RC[-2] -> 0
A1630: 237 | B1630: 2 | C1630: Friday | D1630: 5 | E1630: 9am-10am | F1630: 1 | G1630: 2 | H1630: 44 | I1630: 0 | J1630: =RC[-1]/RC[-2] -> 0
A1631: 237 | B1631: 2 | C1631: Friday | D1631: 5 | E1631: 10am-11am | F1631: 2 | G1631: 2 | H1631: 44 | I1631: 0 | J1631: =RC[-1]/RC[-2] -> 0
A1632: 237 | B1632: 2 | C1632: Friday | D1632: 5 | E1632: 11am-12pm | F1632: 3 | G1632: 2 | H1632: 44 | I1632: 0 | J1632: =RC[-1]/RC[-2] -> 0
A1633: 237 | B1633: 2 | C1633: Friday | D1633: 5 | E1633: 12pm-1pm | F1633: 4 | G1633: 2 | H1633: 44 | I1633: 0 | J1633: =RC[-1]/RC[-2] -> 0
A1634: 237 | B1634: 2 | C1634: Friday | D1634: 5 | E1634: 1pm-2pm | F1634: 5 | G1634: 2 | H1634: 44 | I1634: 0 | J1634: =RC[-1]/RC[-2] -> 0
A1635: 237 | B1635: 2 | C1635: Friday | D1635: 5 | E1635: 2pm-3pm | F1635: 6 | G1635: 3 | H1635: 44 | I1635: 1 | J1635: =RC[-1]/RC[-2] -> 2.2727272727272728E-2
A1636: 237 | B1636: 2 | C1636: Friday | D1636: 5 | E1636: 3pm-4pm | F1636: 7 | G1636: 2 | H1636: 44 | I1636: 0 | J1636: =RC[-1]/RC[-2] -> 0
A1637: 237 | B1637: 2 | C1637: Friday | D1637: 5 | E1637: 4pm-5pm | F1637: 8 | G1637: 2 | H1637: 44 | I1637: 0 | J1637: =RC[-1]/RC[-2] -> 0
A1638: 237 | B1638: 2 | C1638: Thursday | D1638: 4 | E1638: 4pm-5pm | F1638: 8 | G1638: 2 | H1638: 44 | I1638: 0 | J1638: =RC[-1]/RC[-2] -> 0
A1639: 237 | B1639: 2 | C1639: Friday | D1639: 5 | E1639: 9am-10am | F1639: 1 | G1639: 2 | H1639: 44 | I1639: 0 | J1639: =RC[-1]/RC[-2] -> 0
A1640: 237 | B1640: 2 | C1640: Friday | D1640: 5 | E1640: 10am-11am | F1640: 2 | G1640: 2 | H1640: 44 | I1640: 0 | J1640: =RC[-1]/RC[-2] -> 0
A1641: 237 | B1641: 2 | C1641: Friday | D1641: 5 | E1641: 11am-12pm | F1641: 3 | G1641: 2 | H1641: 44 | I1641: 0 | J1641: =RC[-1]/RC[-2] -> 0
A1642: 237 | B1642: 2 | C1642: Friday | D1642: 5 | E1642: 12pm-1pm | F1642: 4 | G1642: 2 | H1642: 44 | I1642: 0 | J1642: =RC[-1]/RC[-2] -> 0
A1643: 237 | B1643: 2 | C1643: Friday | D1643: 5 | E1643: 1pm-2pm | F1643: 5 | G1643: 2 | H1643: 44 | I1643: 0 | J1643: =RC[-1]/RC[-2] -> 0
A1644: 237 | B1644: 2 | C1644: Friday | D1644: 5 | E1644: 2pm-3pm | F1644: 6 | G1644: 3 | H1644: 44 | I1644: 1 | J1644: =RC[-1]/RC[-2] -> 2.2727272727272728E-2
A1645: 237 | B1645: 2 | C1645: Friday | D1645: 5 | E1645: 3pm-4pm | F1645: 7 | G1645: 2 | H1645: 44 | I1645: 0 | J1645: =RC[-1]/RC[-2] -> 0
A1646: 237 | B1646: 2 | C1646: Friday | D1646: 5 | E1646: 4pm-5pm | F1646: 8 | G1646: 2 | H1646: 44 | I1646: 0 | J1646: =RC[-1]/RC[-2] -> 0
A1647: 237 | B1647: 2 | C1647: Thursday | D1647: 4 | E1647: 4pm-5pm | F1647: 8 | G1647: 2 | H1647: 44 | I1647: 0 | J1647: =RC[-1]/RC[-2] -> 0
A1648: 237 | B1648: 2 | C1648: Friday | D1648: 5 | E1648: 9am-10am | F1648: 1 | G1648: 2 | H1648: 44 | I1648: 0 | J1648: =RC[-1]/RC[-2] -> 0
A1649: 237 | B1649: 2 | C1649: Friday | D1649: 5 | E1649: 10am-11am | F1649: 2 | G1649: 2 | H1649: 44 | I1649: 0 | J1649: =RC[-1]/RC[-2] -> 0
A1650: 237 | B1650: 2 | C1650: Friday | D1650: 5 | E1650: 11am-12pm | F1650: 3 | G1650: 2 | H1650: 44 | I1650: 0 | J1650: =RC[-1]/RC[-2] -> 0
A1651: 237 | B1651: 2 | C1651: Friday | D1651: 5 | E1651: 12pm-1pm | F1651: 4 | G1651: 2 | H1651: 44 | I1651: 0 | J1651: =RC[-1]/RC[-2] -> 0
A1652: 237 | B1652: 2 | C1652: Friday | D1652: 5 | E1652: 1pm-2pm | F1652: 5 | G1652: 2 | H1652: 44 | I1652: 0 | J1652: =RC[-1]/RC[-2] -> 0
A1653: 237 | B1653: 2 | C1653: Friday | D1653: 5 | E1653: 2pm-3pm | F1653: 6 | G1653: 3 | H1653: 44 | I1653: 1 | J1653: =RC[-1]/RC[-2] -> 2.2727272727272728E-2
A1654: 237 | B1654: 2 | C1654: Friday | D1654: 5 | E1654: 3pm-4pm | F1654: 7 | G1654: 2 | H1654: 44 | I1654: 0 | J1654: =RC[-1]/RC[-2] -> 0
A1655: 237 | B1655: 2 | C1655: Friday | D1655: 5 | E1655: 4pm-5pm | F1655: 8 | G1655: 2 | H1655: 44 | I1655: 0 | J1655: =RC[-1]/RC[-2] -> 0
A1656: 237 | B1656: 2 | C1656: Thursday | D1656: 4 | E1656: 4pm-5pm | F1656: 8 | G1656: 2 | H1656: 44 | I1656: 0 | J1656: =RC[-1]/RC[-2] -> 0
A1657: 237 | B1657: 2 | C1657: Friday | D1657: 5 | E1657: 9am-10am | F1657: 1 | G1657: 2 | H1657: 44 | I1657: 0 | J1657: =RC[-1]/RC[-2] -> 0
A1658: 237 | B1658: 2 | C1658: Friday | D1658: 5 | E1658: 10am-11am | F1658: 2 | G1658: 2 | H1658: 44 | I1658: 0 | J1658: =RC[-1]/RC[-2] -> 0
A1659: 237 | B1659: 2 | C1659: Friday | D1659: 5 | E1659: 11am-12pm | F1659: 3 | G1659: 2 | H1659: 44 | I1659: 0 | J1659: =RC[-1]/RC[-2] -> 0
A1660: 237 | B1660: 2 | C1660: Friday | D1660: 5 | E1660: 12pm-1pm | F1660: 4 | G1660: 2 | H1660: 44 | I1660: 0 | J1660: =RC[-1]/RC[-2] -> 0
A1661: 237 | B1661: 2 | C1661: Friday | D1661: 5 | E1661: 1pm-2pm | F1661: 5 | G1661: 2 | H1661: 44 | I1661: 0 | J1661: =RC[-1]/RC[-2] -> 0
A1662: 237 | B1662: 2 | C1662: Friday | D1662: 5 | E1662: 2pm-3pm | F1662: 6 | G1662: 3 | H1662: 44 | I1662: 1 | J1662: =RC[-1]/RC[-2] -> 2.2727272727272728E-2
A1663: 237 | B1663: 2 | C1663: Friday | D1663: 5 | E1663: 3pm-4pm | F1663: 7 | G1663: 2 | H1663: 44 | I1663: 0 | J1663: =RC[-1]/RC[-2] -> 0
A1664: 237 | B1664: 2 | C1664: Friday | D1664: 5 | E1664: 4pm-5pm | F1664: 8 | G1664: 2 | H1664: 44 | I1664: 0 | J1664: =RC[-1]/RC[-2] -> 0
A1665: 237 | B1665: 2 | C1665: Thursday | D1665: 4 | E1665: 4pm-5pm | F1665: 8 | G1665: 2 | H1665: 44 | I1665: 0 | J1665: =RC[-1]/RC[-2] -> 0
A1666: 237 | B1666: 2 | C1666: Friday | D1666: 5 | E1666: 9am-10am | F1666: 1 | G1666: 2 | H1666: 44 | I1666: 0 | J1666: =RC[-1]/RC[-2] -> 0
A1667: 237 | B1667: 2 | C1667: Friday | D1667: 5 | E1667: 10am-11am | F1667: 2 | G1667: 2 | H1667: 44 | I1667: 0 | J1667: =RC[-1]/RC[-2] -> 0
A1668: 237 | B1668: 2 | C1668: Friday | D1668: 5 | E1668: 11am-12pm | F1668: 3 | G1668: 2 | H1668: 44 | I1668: 0 | J1668: =RC[-1]/RC[-2] -> 0
A1669: 237 | B1669: 2 | C1669: Friday | D1669: 5 | E1669: 12pm-1pm | F1669: 4 | G1669: 2 | H1669: 44 | I1669: 0 | J1669: =RC[-1]/RC[-2] -> 0
A1670: 237 | B1670: 2 | C1670: Friday | D1670: 5 | E1670: 1pm-2pm | F1670: 5 | G1670: 2 | H1670: 44 | I1670: 0 | J1670: =RC[-1]/RC[-2] -> 0
A1671: 237 | B1671: 2 | C1671: Friday | D1671: 5 | E1671: 2pm-3pm | F1671: 6 | G1671: 3 | H1671: 44 | I1671: 1 | J1671: =RC[-1]/RC[-2] -> 2.2727272727272728E-2
A1672: 237 | B1672: 2 | C1672: Friday | D1672: 5 | E1672: 3pm-4pm | F1672: 7 | G1672: 2 | H1672: 44 | I1672: 0 | J1672: =RC[-1]/RC[-2] -> 0
A1673: 237 | B1673: 2 | C1673: Friday | D1673: 5 | E1673: 4pm-5pm | F1673: 8 | G1673: 2 | H1673: 44 | I1673: 0 | J1673: =RC[-1]/RC[-2] -> 0
A1674: 237 | B1674: 2 | C1674: Thursday | D1674: 4 | E1674: 4pm-5pm | F1674: 8 | G1674: 2 | H1674: 44 | I1674: 0 | J1674: =RC[-1]/RC[-2] -> 0
A1675: 237 | B1675: 2 | C1675: Friday | D1675: 5 | E1675: 9am-10am | F1675: 1 | G1675: 2 | H1675: 44 | I1675: 0 | J1675: =RC[-1]/RC[-2] -> 0
A1676: 237 | B1676: 2 | C1676: Friday | D1676: 5 | E1676: 10am-11am | F1676: 2 | G1676: 2 | H1676: 44 | I1676: 0 | J1676: =RC[-1]/RC[-2] -> 0
A1677: 237 | B1677: 2 | C1677: Friday | D1677: 5 | E1677: 11am-12pm | F1677: 3 | G1677: 2 | H1677: 44 | I1677: 0 | J1677: =RC[-1]/RC[-2] -> 0
A1678: 237 | B1678: 2 | C1678: Friday | D1678: 5 | E1678: 12pm-1pm | F1678: 4 | G1678: 2 | H1678: 44 | I1678: 0 | J1678: =RC[-1]/RC[-2] -> 0
A1679: 237 | B1679: 2 | C1679: Friday | D1679: 5 | E1679: 1pm-2pm | F1679: 5 | G1679: 2 | H1679: 44 | I1679: 0 | J1679: =RC[-1]/RC[-2] -> 0
A1680: 237 | B1680: 2 | C1680: Friday | D1680: 5 | E1680: 2pm-3pm | F1680: 6 | G1680: 3 | H1680: 44 | I1680: 1 | J1680: =RC[-1]/RC[-2] -> 2.2727272727272728E-2
A1681: 237 | B1681: 2 | C1681: Friday | D1681: 5 | E1681: 3pm-4pm | F1681: 7 | G1681: 2 | H1681: 44 | I1681: 0 | J1681: =RC[-1]/RC[-2] -> 0
A1682: 237 | B1682: 2 | C1682: Friday | D1682: 5 | E1682: 4pm-5pm | F1682: 8 | G1682: 2 | H1682: 44 | I1682: 0 | J1682: =RC[-1]/RC[-2] -> 0
A1683: 237 | B1683: 2 | C1683: Thursday | D1683: 4 | E1683: 4pm-5pm | F1683: 8 | G1683: 2 | H1683: 44 | I1683: 0 | J1683: =RC[-1]/RC[-2] -> 0
A1684: 237 | B1684: 2 | C1684: Friday | D1684: 5 | E1684: 9am-10am | F1684: 1 | G1684: 2 | H1684: 44 | I1684: 0 | J1684: =RC[-1]/RC[-2] -> 0
A1685: 237 | B1685: 2 | C1685: Friday | D1685: 5 | E1685: 10am-11am | F1685: 2 | G1685: 2 | H1685: 44 | I1685: 0 | J1685: =RC[-1]/RC[-2] -> 0
A1686: 237 | B1686: 2 | C1686: Friday | D1686: 5 | E1686: 11am-12pm | F1686: 3 | G1686: 2 | H1686: 44 | I1686: 0 | J1686: =RC[-1]/RC[-2] -> 0
A1687: 237 | B1687: 2 | C1687: Friday | D1687: 5 | E1687: 12pm-1pm | F1687: 4 | G1687: 2 | H1687: 44 | I1687: 0 | J1687: =RC[-1]/RC[-2] -> 0
A1688: 237 | B1688: 2 | C1688: Friday | D1688: 5 | E1688: 1pm-2pm | F1688: 5 | G1688: 2 | H1688: 44 | I1688: 0 | J1688: =RC[-1]/RC[-2] -> 0
A1689: 237 | B1689: 2 | C1689: Friday | D1689: 5 | E1689: 2pm-3pm | F1689: 6 | G1689: 3 | H1689: 44 | I1689: 1 | J1689: =RC[-1]/RC[-2] -> 2.2727272727272728E-2
A1690: 237 | B1690: 2 | C1690: Friday | D1690: 5 | E1690: 3pm-4pm | F1690: 7 | G1690: 2 | H1690: 44 | I1690: 0 | J1690: =RC[-1]/RC[-2] -> 0
A1691: 237 | B1691: 2 | C1691: Friday | D1691: 5 | E1691: 4pm-5pm | F1691: 8 | G1691: 2 | H1691: 44 | I1691: 0 | J1691: =RC[-1]/RC[-2] -> 0
A1692: 237 | B1692: 2 | C1692: Thursday | D1692: 4 | E1692: 4pm-5pm | F1692: 8 | G1692: 2 | H1692: 44 | I1692: 0 | J1692: =RC[-1]/RC[-2] -> 0
A1693: 237 | B1693: 2 | C1693: Friday | D1693: 5 | E1693: 9am-10am | F1693: 1 | G1693: 2 | H1693: 44 | I1693: 0 | J1693: =RC[-1]/RC[-2] -> 0
A1694: 237 | B1694: 2 | C1694: Friday | D1694: 5 | E1694: 10am-11am | F1694: 2 | G1694: 2 | H1694: 44 | I1694: 0 | J1694: =RC[-1]/RC[-2] -> 0
A1695: 237 | B1695: 2 | C1695: Friday | D1695: 5 | E1695: 11am-12pm | F1695: 3 | G1695: 2 | H1695: 44 | I1695: 0 | J1695: =RC[-1]/RC[-2] -> 0
A1696: 237 | B1696: 2 | C1696: Friday | D1696: 5 | E1696: 12pm-1pm | F1696: 4 | G1696: 2 | H1696: 44 | I1696: 0 | J1696: =RC[-1]/RC[-2] -> 0
A1697: 237 | B1697: 2 | C1697: Friday | D1697: 5 | E1697: 1pm-2pm | F1697: 5 | G1697: 2 | H1697: 44 | I1697: 0 | J1697: =RC[-1]/RC[-2] -> 0
A1698: 237 | B1698: 2 | C1698: Friday | D1698: 5 | E1698: 2pm-3pm | F1698: 6 | G1698: 3 | H1698: 44 | I1698: 1 | J1698: =RC[-1]/RC[-2] -> 2.2727272727272728E-2
A1699: 237 | B1699: 2 | C1699: Friday | D1699: 5 | E1699: 3pm-4pm | F1699: 7 | G1699: 2 | H1699: 44 | I1699: 0 | J1699: =RC[-1]/RC[-2] -> 0
A1700: 237 | B1700: 2 | C1700: Friday | D1700: 5 | E1700: 4pm-5pm | F1700: 8 | G1700: 2 | H1700: 44 | I1700: 0 | J1700: =RC[-1]/RC[-2] -> 0
A1701: 237 | B1701: 2 | C1701: Thursday | D1701: 4 | E1701: 4pm-5pm | F1701: 8 | G1701: 2 | H1701: 44 | I1701: 0 | J1701: =RC[-1]/RC[-2] -> 0
A1702: 237 | B1702: 2 | C1702: Friday | D1702: 5 | E1702: 9am-10am | F1702: 1 | G1702: 2 | H1702: 44 | I1702: 0 | J1702: =RC[-1]/RC[-2] -> 0
A1703: 237 | B1703: 2 | C1703: Friday | D1703: 5 | E1703: 10am-11am | F1703: 2 | G1703: 2 | H1703: 44 | I1703: 0 | J1703: =RC[-1]/RC[-2] -> 0
A1704: 237 | B1704: 2 | C1704: Friday | D1704: 5 | E1704: 11am-12pm | F1704: 3 | G1704: 2 | H1704: 44 | I1704: 0 | J1704: =RC[-1]/RC[-2] -> 0
A1705: 237 | B1705: 2 | C1705: Friday | D1705: 5 | E1705: 12pm-1pm | F1705: 4 | G1705: 2 | H1705: 44 | I1705: 0 | J1705: =RC[-1]/RC[-2] -> 0
A1706: 237 | B1706: 2 | C1706: Friday | D1706: 5 | E1706: 1pm-2pm | F1706: 5 | G1706: 2 | H1706: 44 | I1706: 0 | J1706: =RC[-1]/RC[-2] -> 0
A1707: 237 | B1707: 2 | C1707: Friday | D1707: 5 | E1707: 2pm-3pm | F1707: 6 | G1707: 3 | H1707: 44 | I1707: 1 | J1707: =RC[-1]/RC[-2] -> 2.2727272727272728E-2
A1708: 237 | B1708: 2 | C1708: Friday | D1708: 5 | E1708: 3pm-4pm | F1708: 7 | G1708: 2 | H1708: 44 | I1708: 0 | J1708: =RC[-1]/RC[-2] -> 0
A1709: 237 | B1709: 2 | C1709: Friday | D1709: 5 | E1709: 4pm-5pm | F1709: 8 | G1709: 2 | H1709: 44 | I1709: 0 | J1709: =RC[-1]/RC[-2] -> 0
A1710: 237 | B1710: 2 | C1710: Thursday | D1710: 4 | E1710: 4pm-5pm | F1710: 8 | G1710: 2 | H1710: 44 | I1710: 0 | J1710: =RC[-1]/RC[-2] -> 0
A1711: 237 | B1711: 2 | C1711: Friday | D1711: 5 | E1711: 9am-10am | F1711: 1 | G1711: 2 | H1711: 44 | I1711: 0 | J1711: =RC[-1]/RC[-2] -> 0
A1712: 237 | B1712: 2 | C1712: Friday | D1712: 5 | E1712: 10am-11am | F1712: 2 | G1712: 2 | H1712: 44 | I1712: 0 | J1712: =RC[-1]/RC[-2] -> 0
A1713: 237 | B1713: 2 | C1713: Friday | D1713: 5 | E1713: 11am-12pm | F1713: 3 | G1713: 2 | H1713: 44 | I1713: 0 | J1713: =RC[-1]/RC[-2] -> 0
A1714: 237 | B1714: 2 | C1714: Friday | D1714: 5 | E1714: 12pm-1pm | F1714: 4 | G1714: 2 | H1714: 44 | I1714: 0 | J1714: =RC[-1]/RC[-2] -> 0
A1715: 237 | B1715: 2 | C1715: Friday | D1715: 5 | E1715: 1pm-2pm | F1715: 5 | G1715: 2 | H1715: 44 | I1715: 0 | J1715: =RC[-1]/RC[-2] -> 0
A1716: 237 | B1716: 2 | C1716: Friday | D1716: 5 | E1716: 2pm-3pm | F1716: 6 | G1716: 3 | H1716: 44 | I1716: 1 | J1716: =RC[-1]/RC[-2] -> 2.2727272727272728E-2
A1717: 237 | B1717: 2 | C1717: Friday | D1717: 5 | E1717: 3pm-4pm | F1717: 7 | G1717: 2 | H1717: 44 | I1717: 0 | J1717: =RC[-1]/RC[-2] -> 0
A1718: 237 | B1718: 2 | C1718: Friday | D1718: 5 | E1718: 4pm-5pm | F1718: 8 | G1718: 2 | H1718: 44 | I1718: 0 | J1718: =RC[-1]/RC[-2] -> 0
A1719: 237 | B1719: 2 | C1719: Thursday | D1719: 4 | E1719: 4pm-5pm | F1719: 8 | G1719: 2 | H1719: 44 | I1719: 0 | J1719: =RC[-1]/RC[-2] -> 0
A1720: 237 | B1720: 2 | C1720: Friday | D1720: 5 | E1720: 9am-10am | F1720: 1 | G1720: 2 | H1720: 44 | I1720: 0 | J1720: =RC[-1]/RC[-2] -> 0
A1721: 237 | B1721: 2 | C1721: Friday | D1721: 5 | E1721: 10am-11am | F1721: 2 | G1721: 2 | H1721: 44 | I1721: 0 | J1721: =RC[-1]/RC[-2] -> 0
A1722: 237 | B1722: 2 | C1722: Friday | D1722: 5 | E1722: 11am-12pm | F1722: 3 | G1722: 2 | H1722: 44 | I1722: 0 | J1722: =RC[-1]/RC[-2] -> 0
A1723: 237 | B1723: 2 | C1723: Friday | D1723: 5 | E1723: 12pm-1pm | F1723: 4 | G1723: 2 | H1723: 44 | I1723: 0 | J1723: =RC[-1]/RC[-2] -> 0
A1724: 237 | B1724: 2 | C1724: Friday | D1724: 5 | E1724: 1pm-2pm | F1724: 5 | G1724: 2 | H1724: 44 | I1724: 0 | J1724: =RC[-1]/RC[-2] -> 0
A1725: 237 | B1725: 2 | C1725: Friday | D1725: 5 | E1725: 2pm-3pm | F1725: 6 | G1725: 3 | H1725: 44 | I1725: 1 | J1725: =RC[-1]/RC[-2] -> 2.2727272727272728E-2
A1726: 237 | B1726: 2 | C1726: Friday | D1726: 5 | E1726: 3pm-4pm | F1726: 7 | G1726: 2 | H1726: 44 | I1726: 0 | J1726: =RC[-1]/RC[-2] -> 0
A1727: 237 | B1727: 2 | C1727: Friday | D1727: 5 | E1727: 4pm-5pm | F1727: 8 | G1727: 2 | H1727: 44 | I1727: 0 | J1727: =RC[-1]/RC[-2] -> 0
A1728: 237 | B1728: 2 | C1728: Thursday | D1728: 4 | E1728: 4pm-5pm | F1728: 8 | G1728: 2 | H1728: 44 | I1728: 0 | J1728: =RC[-1]/RC[-2] -> 0
A1729: 237 | B1729: 2 | C1729: Friday | D1729: 5 | E1729: 9am-10am | F1729: 1 | G1729: 2 | H1729: 44 | I1729: 0 | J1729: =RC[-1]/RC[-2] -> 0
A1730: 237 | B1730: 2 | C1730: Friday | D1730: 5 | E1730: 10am-11am | F1730: 2 | G1730: 2 | H1730: 44 | I1730: 0 | J1730: =RC[-1]/RC[-2] -> 0
A1731: 237 | B1731: 2 | C1731: Friday | D1731: 5 | E1731: 11am-12pm | F1731: 3 | G1731: 2 | H1731: 44 | I1731: 0 | J1731: =RC[-1]/RC[-2] -> 0
A1732: 237 | B1732: 2 | C1732: Friday | D1732: 5 | E1732: 12pm-1pm | F1732: 4 | G1732: 2 | H1732: 44 | I1732: 0 | J1732: =RC[-1]/RC[-2] -> 0
A1733: 237 | B1733: 2 | C1733: Friday | D1733: 5 | E1733: 1pm-2pm | F1733: 5 | G1733: 2 | H1733: 44 | I1733: 0 | J1733: =RC[-1]/RC[-2] -> 0
A1734: 237 | B1734: 2 | C1734: Friday | D1734: 5 | E1734: 2pm-3pm | F1734: 6 | G1734: 3 | H1734: 44 | I1734: 1 | J1734: =RC[-1]/RC[-2] -> 2.2727272727272728E-2
A1735: 237 | B1735: 2 | C1735: Friday | D1735: 5 | E1735: 3pm-4pm | F1735: 7 | G1735: 2 | H1735: 44 | I1735: 0 | J1735: =RC[-1]/RC[-2] -> 0
A1736: 237 | B1736: 2 | C1736: Friday | D1736: 5 | E1736: 4pm-5pm | F1736: 8 | G1736: 2 | H1736: 44 | I1736: 0 | J1736: =RC[-1]/RC[-2] -> 0
A1737: 237 | B1737: 2 | C1737: Thursday | D1737: 4 | E1737: 4pm-5pm | F1737: 8 | G1737: 2 | H1737: 44 | I1737: 0 | J1737: =RC[-1]/RC[-2] -> 0
A1738: 237 | B1738: 2 | C1738: Friday | D1738: 5 | E1738: 9am-10am | F1738: 1 | G1738: 2 | H1738: 44 | I1738: 0 | J1738: =RC[-1]/RC[-2] -> 0
A1739: 237 | B1739: 2 | C1739: Friday | D1739: 5 | E1739: 10am-11am | F1739: 2 | G1739: 2 | H1739: 44 | I1739: 0 | J1739: =RC[-1]/RC[-2] -> 0
A1740: 237 | B1740: 2 | C1740: Friday | D1740: 5 | E1740: 11am-12pm | F1740: 3 | G1740: 2 | H1740: 44 | I1740: 0 | J1740: =RC[-1]/RC[-2] -> 0
A1741: 237 | B1741: 2 | C1741: Friday | D1741: 5 | E1741: 12pm-1pm | F1741: 4 | G1741: 2 | H1741: 44 | I1741: 0 | J1741: =RC[-1]/RC[-2] -> 0
A1742: 237 | B1742: 2 | C1742: Friday | D1742: 5 | E1742: 1pm-2pm | F1742: 5 | G1742: 2 | H1742: 44 | I1742: 0 | J1742: =RC[-1]/RC[-2] -> 0
A1743: 237 | B1743: 2 | C1743: Friday | D1743: 5 | E1743: 2pm-3pm | F1743: 6 | G1743: 3 | H1743: 44 | I1743: 1 | J1743: =RC[-1]/RC[-2] -> 2.2727272727272728E-2
A1744: 237 | B1744: 2 | C1744: Friday | D1744: 5 | E1744: 3pm-4pm | F1744: 7 | G1744: 2 | H1744: 44 | I1744: 0 | J1744: =RC[-1]/RC[-2] -> 0
A1745: 237 | B1745: 2 | C1745: Friday | D1745: 5 | E1745: 4pm-5pm | F1745: 8 | G1745: 2 | H1745: 44 | I1745: 0 | J1745: =RC[-1]/RC[-2] -> 0
A1746: 237 | B1746: 2 | C1746: Thursday | D1746: 4 | E1746: 4pm-5pm | F1746: 8 | G1746: 2 | H1746: 44 | I1746: 0 | J1746: =RC[-1]/RC[-2] -> 0
A1747: 237 | B1747: 2 | C1747: Friday | D1747: 5 | E1747: 9am-10am | F1747: 1 | G1747: 2 | H1747: 44 | I1747: 0 | J1747: =RC[-1]/RC[-2] -> 0
A1748: 237 | B1748: 2 | C1748: Friday | D1748: 5 | E1748: 10am-11am | F1748: 2 | G1748: 2 | H1748: 44 | I1748: 0 | J1748: =RC[-1]/RC[-2] -> 0
A1749: 237 | B1749: 2 | C1749: Friday | D1749: 5 | E1749: 11am-12pm | F1749: 3 | G1749: 2 | H1749: 44 | I1749: 0 | J1749: =RC[-1]/RC[-2] -> 0
A1750: 237 | B1750: 2 | C1750: Friday | D1750: 5 | E1750: 12pm-1pm | F1750: 4 | G1750: 2 | H1750: 44 | I1750: 0 | J1750: =RC[-1]/RC[-2] -> 0
A1751: 237 | B1751: 2 | C1751: Friday | D1751: 5 | E1751: 1pm-2pm | F1751: 5 | G1751: 2 | H1751: 44 | I1751: 0 | J1751: =RC[-1]/RC[-2] -> 0
A1752: 237 | B1752: 2 | C1752: Friday | D1752: 5 | E1752: 2pm-3pm | F1752: 6 | G1752: 3 | H1752: 44 | I1752: 1 | J1752: =RC[-1]/RC[-2] -> 2.2727272727272728E-2
A1753: 237 | B1753: 2 | C1753: Friday | D1753: 5 | E1753: 3pm-4pm | F1753: 7 | G1753: 2 | H1753: 44 | I1753: 0 | J1753: =RC[-1]/RC[-2] -> 0
A1754: 237 | B1754: 2 | C1754: Friday | D1754: 5 | E1754: 4pm-5pm | F1754: 8 | G1754: 2 | H1754: 44 | I1754: 0 | J1754: =RC[-1]/RC[-2] -> 0
A1755: 237 | B1755: 2 | C1755: Thursday | D1755: 4 | E1755: 4pm-5pm | F1755: 8 | G1755: 2 | H1755: 44 | I1755: 0 | J1755: =RC[-1]/RC[-2] -> 0
A1756: 237 | B1756: 2 | C1756: Friday | D1756: 5 | E1756: 9am-10am | F1756: 1 | G1756: 2 | H1756: 44 | I1756: 0 | J1756: =RC[-1]/RC[-2] -> 0
A1757: 237 | B1757: 2 | C1757: Friday | D1757: 5 | E1757: 10am-11am | F1757: 2 | G1757: 2 | H1757: 44 | I1757: 0 | J1757: =RC[-1]/RC[-2] -> 0
A1758: 237 | B1758: 2 | C1758: Friday | D1758: 5 | E1758: 11am-12pm | F1758: 3 | G1758: 2 | H1758: 44 | I1758: 0 | J1758: =RC[-1]/RC[-2] -> 0
A1759: 237 | B1759: 2 | C1759: Friday | D1759: 5 | E1759: 12pm-1pm | F1759: 4 | G1759: 2 | H1759: 44 | I1759: 0 | J1759: =RC[-1]/RC[-2] -> 0
A1760: 237 | B1760: 2 | C1760: Friday | D1760: 5 | E1760: 1pm-2pm | F1760: 5 | G1760: 2 | H1760: 44 | I1760: 0 | J1760: =RC[-1]/RC[-2] -> 0
A1761: 237 | B1761: 2 | C1761: Friday | D1761: 5 | E1761: 2pm-3pm | F1761: 6 | G1761: 3 | H1761: 44 | I1761: 1 | J1761: =RC[-1]/RC[-2] -> 2.2727272727272728E-2
A1762: 237 | B1762: 2 | C1762: Friday | D1762: 5 | E1762: 3pm-4pm | F1762: 7 | G1762: 2 | H1762: 44 | I1762: 0 | J1762: =RC[-1]/RC[-2] -> 0
A1763: 237 | B1763: 2 | C1763: Friday | D1763: 5 | E1763: 4pm-5pm | F1763: 8 | G1763: 2 | H1763: 44 | I1763: 0 | J1763: =RC[-1]/RC[-2] -> 0
A1764: 237 | B1764: 2 | C1764: Thursday | D1764: 4 | E1764: 4pm-5pm | F1764: 8 | G1764: 2 | H1764: 44 | I1764: 0 | J1764: =RC[-1]/RC[-2] -> 0
A1765: 237 | B1765: 2 | C1765: Friday | D1765: 5 | E1765: 9am-10am | F1765: 1 | G1765: 2 | H1765: 44 | I1765: 0 | J1765: =RC[-1]/RC[-2] -> 0
A1766: 237 | B1766: 2 | C1766: Friday | D1766: 5 | E1766: 10am-11am | F1766: 2 | G1766: 2 | H1766: 44 | I1766: 0 | J1766: =RC[-1]/RC[-2] -> 0
A1767: 237 | B1767: 2 | C1767: Friday | D1767: 5 | E1767: 11am-12pm | F1767: 3 | G1767: 2 | H1767: 44 | I1767: 0 | J1767: =RC[-1]/RC[-2] -> 0
A1768: 237 | B1768: 2 | C1768: Friday | D1768: 5 | E1768: 12pm-1pm | F1768: 4 | G1768: 2 | H1768: 44 | I1768: 0 | J1768: =RC[-1]/RC[-2] -> 0
A1769: 237 | B1769: 2 | C1769: Friday | D1769: 5 | E1769: 1pm-2pm | F1769: 5 | G1769: 2 | H1769: 44 | I1769: 0 | J1769: =RC[-1]/RC[-2] -> 0
A1770: 237 | B1770: 2 | C1770: Friday | D1770: 5 | E1770: 2pm-3pm | F1770: 6 | G1770: 3 | H1770: 44 | I1770: 1 | J1770: =RC[-1]/RC[-2] -> 2.2727272727272728E-2
A1771: 237 | B1771: 2 | C1771: Friday | D1771: 5 | E1771: 3pm-4pm | F1771: 7 | G1771: 2 | H1771: 44 | I1771: 0 | J1771: =RC[-1]/RC[-2] -> 0
A1772: 237 | B1772: 2 | C1772: Friday | D1772: 5 | E1772: 4pm-5pm | F1772: 8 | G1772: 2 | H1772: 44 | I1772: 0 | J1772: =RC[-1]/RC[-2] -> 0
A1773: 237 | B1773: 2 | C1773: Thursday | D1773: 4 | E1773: 4pm-5pm | F1773: 8 | G1773: 2 | H1773: 44 | I1773: 0 | J1773: =RC[-1]/RC[-2] -> 0
A1774: 237 | B1774: 2 | C1774: Friday | D1774: 5 | E1774: 9am-10am | F1774: 1 | G1774: 2 | H1774: 44 | I1774: 0 | J1774: =RC[-1]/RC[-2] -> 0
A1775: 237 | B1775: 2 | C1775: Friday | D1775: 5 | E1775: 10am-11am | F1775: 2 | G1775: 2 | H1775: 44 | I1775: 0 | J1775: =RC[-1]/RC[-2] -> 0
A1776: 237 | B1776: 2 | C1776: Friday | D1776: 5 | E1776: 11am-12pm | F1776: 3 | G1776: 2 | H1776: 44 | I1776: 0 | J1776: =RC[-1]/RC[-2] -> 0
A1777: 237 | B1777: 2 | C1777: Friday | D1777: 5 | E1777: 12pm-1pm | F1777: 4 | G1777: 2 | H1777: 44 | I1777: 0 | J1777: =RC[-1]/RC[-2] -> 0
A1778: 237 | B1778: 2 | C1778: Friday | D1778: 5 | E1778: 1pm-2pm | F1778: 5 | G1778: 2 | H1778: 44 | I1778: 0 | J1778: =RC[-1]/RC[-2] -> 0
A1779: 237 | B1779: 2 | C1779: Friday | D1779: 5 | E1779: 2pm-3pm | F1779: 6 | G1779: 3 | H1779: 44 | I1779: 1 | J1779: =RC[-1]/RC[-2] -> 2.2727272727272728E-2
A1780: 237 | B1780: 2 | C1780: Friday | D1780: 5 | E1780: 3pm-4pm | F1780: 7 | G1780: 2 | H1780: 44 | I1780: 0 | J1780: =RC[-1]/RC[-2] -> 0
A1781: 237 | B1781: 2 | C1781: Friday | D1781: 5 | E1781: 4pm-5pm | F1781: 8 | G1781: 2 | H1781: 44 | I1781: 0 | J1781: =RC[-1]/RC[-2] -> 0
A1782: 237 | B1782: 2 | C1782: Thursday | D1782: 4 | E1782: 4pm-5pm | F1782: 8 | G1782: 2 | H1782: 44 | I1782: 0 | J1782: =RC[-1]/RC[-2] -> 0
A1783: 237 | B1783: 2 | C1783: Friday | D1783: 5 | E1783: 9am-10am | F1783: 1 | G1783: 2 | H1783: 44 | I1783: 0 | J1783: =RC[-1]/RC[-2] -> 0
A1784: 237 | B1784: 2 | C1784: Friday | D1784: 5 | E1784: 10am-11am | F1784: 2 | G1784: 2 | H1784: 44 | I1784: 0 | J1784: =RC[-1]/RC[-2] -> 0
A1785: 237 | B1785: 2 | C1785: Friday | D1785: 5 | E1785: 11am-12pm | F1785: 3 | G1785: 2 | H1785: 44 | I1785: 0 | J1785: =RC[-1]/RC[-2] -> 0
A1786: 237 | B1786: 2 | C1786: Friday | D1786: 5 | E1786: 12pm-1pm | F1786: 4 | G1786: 2 | H1786: 44 | I1786: 0 | J1786: =RC[-1]/RC[-2] -> 0
A1787: 237 | B1787: 2 | C1787: Friday | D1787: 5 | E1787: 1pm-2pm | F1787: 5 | G1787: 2 | H1787: 44 | I1787: 0 | J1787: =RC[-1]/RC[-2] -> 0
A1788: 237 | B1788: 2 | C1788: Friday | D1788: 5 | E1788: 2pm-3pm | F1788: 6 | G1788: 3 | H1788: 44 | I1788: 1 | J1788: =RC[-1]/RC[-2] -> 2.2727272727272728E-2
A1789: 237 | B1789: 2 | C1789: Friday | D1789: 5 | E1789: 3pm-4pm | F1789: 7 | G1789: 2 | H1789: 44 | I1789: 0 | J1789: =RC[-1]/RC[-2] -> 0
A1790: 237 | B1790: 2 | C1790: Friday | D1790: 5 | E1790: 4pm-5pm | F1790: 8 | G1790: 2 | H1790: 44 | I1790: 0 | J1790: =RC[-1]/RC[-2] -> 0
A1791: 237 | B1791: 2 | C1791: Thursday | D1791: 4 | E1791: 4pm-5pm | F1791: 8 | G1791: 2 | H1791: 44 | I1791: 0 | J1791: =RC[-1]/RC[-2] -> 0
A1792: 237 | B1792: 2 | C1792: Friday | D1792: 5 | E1792: 9am-10am | F1792: 1 | G1792: 2 | H1792: 44 | I1792: 0 | J1792: =RC[-1]/RC[-2] -> 0
A1793: 237 | B1793: 2 | C1793: Friday | D1793: 5 | E1793: 10am-11am | F1793: 2 | G1793: 2 | H1793: 44 | I1793: 0 | J1793: =RC[-1]/RC[-2] -> 0
A1794: 237 | B1794: 2 | C1794: Friday | D1794: 5 | E1794: 11am-12pm | F1794: 3 | G1794: 2 | H1794: 44 | I1794: 0 | J1794: =RC[-1]/RC[-2] -> 0
A1795: 237 | B1795: 2 | C1795: Friday | D1795: 5 | E1795: 12pm-1pm | F1795: 4 | G1795: 2 | H1795: 44 | I1795: 0 | J1795: =RC[-1]/RC[-2] -> 0
A1796: 237 | B1796: 2 | C1796: Friday | D1796: 5 | E1796: 1pm-2pm | F1796: 5 | G1796: 2 | H1796: 44 | I1796: 0 | J1796: =RC[-1]/RC[-2] -> 0
A1797: 237 | B1797: 2 | C1797: Friday | D1797: 5 | E1797: 2pm-3pm | F1797: 6 | G1797: 3 | H1797: 44 | I1797: 1 | J1797: =RC[-1]/RC[-2] -> 2.2727272727272728E-2
A1798: 237 | B1798: 2 | C1798: Friday | D1798: 5 | E1798: 3pm-4pm | F1798: 7 | G1798: 2 | H1798: 44 | I1798: 0 | J1798: =RC[-1]/RC[-2] -> 0
A1799: 237 | B1799: 2 | C1799: Friday | D1799: 5 | E1799: 4pm-5pm | F1799: 8 | G1799: 2 | H1799: 44 | I1799: 0 | J1799: =RC[-1]/RC[-2] -> 0
A1800: 237 | B1800: 2 | C1800: Thursday | D1800: 4 | E1800: 4pm-5pm | F1800: 8 | G1800: 2 | H1800: 44 | I1800: 0 | J1800: =RC[-1]/RC[-2] -> 0
A1801: 237 | B1801: 2 | C1801: Friday | D1801: 5 | E1801: 9am-10am | F1801: 1 | G1801: 2 | H1801: 44 | I1801: 0 | J1801: =RC[-1]/RC[-2] -> 0
A1802: 237 | B1802: 2 | C1802: Friday | D1802: 5 | E1802: 10am-11am | F1802: 2 | G1802: 2 | H1802: 44 | I1802: 0 | J1802: =RC[-1]/RC[-2] -> 0
A1803: 237 | B1803: 2 | C1803: Friday | D1803: 5 | E1803: 11am-12pm | F1803: 3 | G1803: 2 | H1803: 44 | I1803: 0 | J1803: =RC[-1]/RC[-2] -> 0
A1804: 237 | B1804: 2 | C1804: Friday | D1804: 5 | E1804: 12pm-1pm | F1804: 4 | G1804: 2 | H1804: 44 | I1804: 0 | J1804: =RC[-1]/RC[-2] -> 0
A1805: 237 | B1805: 2 | C1805: Friday | D1805: 5 | E1805: 1pm-2pm | F1805: 5 | G1805: 2 | H1805: 44 | I1805: 0 | J1805: =RC[-1]/RC[-2] -> 0
A1806: 237 | B1806: 2 | C1806: Friday | D1806: 5 | E1806: 2pm-3pm | F1806: 6 | G1806: 3 | H1806: 44 | I1806: 1 | J1806: =RC[-1]/RC[-2] -> 2.2727272727272728E-2
A1807: 237 | B1807: 2 | C1807: Friday | D1807: 5 | E1807: 3pm-4pm | F1807: 7 | G1807: 2 | H1807: 44 | I1807: 0 | J1807: =RC[-1]/RC[-2] -> 0
A1808: 237 | B1808: 2 | C1808: Friday | D1808: 5 | E1808: 4pm-5pm | F1808: 8 | G1808: 2 | H1808: 44 | I1808: 0 | J1808: =RC[-1]/RC[-2] -> 0
A1809: 237 | B1809: 2 | C1809: Thursday | D1809: 4 | E1809: 4pm-5pm | F1809: 8 | G1809: 2 | H1809: 44 | I1809: 0 | J1809: =RC[-1]/RC[-2] -> 0
A1810: 237 | B1810: 2 | C1810: Friday | D1810: 5 | E1810: 9am-10am | F1810: 1 | G1810: 2 | H1810: 44 | I1810: 0 | J1810: =RC[-1]/RC[-2] -> 0
A1811: 237 | B1811: 2 | C1811: Friday | D1811: 5 | E1811: 10am-11am | F1811: 2 | G1811: 2 | H1811: 44 | I1811: 0 | J1811: =RC[-1]/RC[-2] -> 0
A1812: 237 | B1812: 2 | C1812: Friday | D1812: 5 | E1812: 11am-12pm | F1812: 3 | G1812: 2 | H1812: 44 | I1812: 0 | J1812: =RC[-1]/RC[-2] -> 0
A1813: 237 | B1813: 2 | C1813: Friday | D1813: 5 | E1813: 12pm-1pm | F1813: 4 | G1813: 2 | H1813: 44 | I1813: 0 | J1813: =RC[-1]/RC[-2] -> 0
A1814: 237 | B1814: 2 | C1814: Friday | D1814: 5 | E1814: 1pm-2pm | F1814: 5 | G1814: 2 | H1814: 44 | I1814: 0 | J1814: =RC[-1]/RC[-2] -> 0
A1815: 237 | B1815: 2 | C1815: Friday | D1815: 5 | E1815: 2pm-3pm | F1815: 6 | G1815: 3 | H1815: 44 | I1815: 1 | J1815: =RC[-1]/RC[-2] -> 2.2727272727272728E-2
A1816: 237 | B1816: 2 | C1816: Friday | D1816: 5 | E1816: 3pm-4pm | F1816: 7 | G1816: 2 | H1816: 44 | I1816: 0 | J1816: =RC[-1]/RC[-2] -> 0
A1817: 237 | B1817: 2 | C1817: Friday | D1817: 5 | E1817: 4pm-5pm | F1817: 8 | G1817: 2 | H1817: 44 | I1817: 0 | J1817: =RC[-1]/RC[-2] -> 0
A1818: 237 | B1818: 2 | C1818: Thursday | D1818: 4 | E1818: 4pm-5pm | F1818: 8 | G1818: 2 | H1818: 44 | I1818: 0 | J1818: =RC[-1]/RC[-2] -> 0
A1819: 237 | B1819: 2 | C1819: Friday | D1819: 5 | E1819: 9am-10am | F1819: 1 | G1819: 2 | H1819: 44 | I1819: 0 | J1819: =RC[-1]/RC[-2] -> 0
A1820: 237 | B1820: 2 | C1820: Friday | D1820: 5 | E1820: 10am-11am | F1820: 2 | G1820: 2 | H1820: 44 | I1820: 0 | J1820: =RC[-1]/RC[-2] -> 0
A1821: 237 | B1821: 2 | C1821: Friday | D1821: 5 | E1821: 11am-12pm | F1821: 3 | G1821: 2 | H1821: 44 | I1821: 0 | J1821: =RC[-1]/RC[-2] -> 0
A1822: 237 | B1822: 2 | C1822: Friday | D1822: 5 | E1822: 12pm-1pm | F1822: 4 | G1822: 2 | H1822: 44 | I1822: 0 | J1822: =RC[-1]/RC[-2] -> 0
A1823: 237 | B1823: 2 | C1823: Friday | D1823: 5 | E1823: 1pm-2pm | F1823: 5 | G1823: 2 | H1823: 44 | I1823: 0 | J1823: =RC[-1]/RC[-2] -> 0
A1824: 237 | B1824: 2 | C1824: Friday | D1824: 5 | E1824: 2pm-3pm | F1824: 6 | G1824: 3 | H1824: 44 | I1824: 1 | J1824: =RC[-1]/RC[-2] -> 2.2727272727272728E-2
A1825: 237 | B1825: 2 | C1825: Friday | D1825: 5 | E1825: 3pm-4pm | F1825: 7 | G1825: 2 | H1825: 44 | I1825: 0 | J1825: =RC[-1]/RC[-2] -> 0
A1826: 237 | B1826: 2 | C1826: Friday | D1826: 5 | E1826: 4pm-5pm | F1826: 8 | G1826: 2 | H1826: 44 | I1826: 0 | J1826: =RC[-1]/RC[-2] -> 0
A1827: 237 | B1827: 2 | C1827: Thursday | D1827: 4 | E1827: 4pm-5pm | F1827: 8 | G1827: 2 | H1827: 44 | I1827: 0 | J1827: =RC[-1]/RC[-2] -> 0
A1828: 237 | B1828: 2 | C1828: Friday | D1828: 5 | E1828: 9am-10am | F1828: 1 | G1828: 2 | H1828: 44 | I1828: 0 | J1828: =RC[-1]/RC[-2] -> 0
A1829: 237 | B1829: 2 | C1829: Friday | D1829: 5 | E1829: 10am-11am | F1829: 2 | G1829: 2 | H1829: 44 | I1829: 0 | J1829: =RC[-1]/RC[-2] -> 0
A1830: 237 | B1830: 2 | C1830: Friday | D1830: 5 | E1830: 11am-12pm | F1830: 3 | G1830: 2 | H1830: 44 | I1830: 0 | J1830: =RC[-1]/RC[-2] -> 0
A1831: 237 | B1831: 2 | C1831: Friday | D1831: 5 | E1831: 12pm-1pm | F1831: 4 | G1831: 2 | H1831: 44 | I1831: 0 | J1831: =RC[-1]/RC[-2] -> 0
A1832: 237 | B1832: 2 | C1832: Friday | D1832: 5 | E1832: 1pm-2pm | F1832: 5 | G1832: 2 | H1832: 44 | I1832: 0 | J1832: =RC[-1]/RC[-2] -> 0
A1833: 237 | B1833: 2 | C1833: Friday | D1833: 5 | E1833: 2pm-3pm | F1833: 6 | G1833: 3 | H1833: 44 | I1833: 1 | J1833: =RC[-1]/RC[-2] -> 2.2727272727272728E-2
A1834: 237 | B1834: 2 | C1834: Friday | D1834: 5 | E1834: 3pm-4pm | F1834: 7 | G1834: 2 | H1834: 44 | I1834: 0 | J1834: =RC[-1]/RC[-2] -> 0
A1835: 237 | B1835: 2 | C1835: Friday | D1835: 5 | E1835: 4pm-5pm | F1835: 8 | G1835: 2 | H1835: 44 | I1835: 0 | J1835: =RC[-1]/RC[-2] -> 0
A1836: 237 | B1836: 2 | C1836: Thursday | D1836: 4 | E1836: 4pm-5pm | F1836: 8 | G1836: 2 | H1836: 44 | I1836: 0 | J1836: =RC[-1]/RC[-2] -> 0
A1837: 237 | B1837: 2 | C1837: Friday | D1837: 5 | E1837: 9am-10am | F1837: 1 | G1837: 2 | H1837: 44 | I1837: 0 | J1837: =RC[-1]/RC[-2] -> 0
A1838: 237 | B1838: 2 | C1838: Friday | D1838: 5 | E1838: 10am-11am | F1838: 2 | G1838: 2 | H1838: 44 | I1838: 0 | J1838: =RC[-1]/RC[-2] -> 0
A1839: 237 | B1839: 2 | C1839: Friday | D1839: 5 | E1839: 11am-12pm | F1839: 3 | G1839: 2 | H1839: 44 | I1839: 0 | J1839: =RC[-1]/RC[-2] -> 0
A1840: 237 | B1840: 2 | C1840: Friday | D1840: 5 | E1840: 12pm-1pm | F1840: 4 | G1840: 2 | H1840: 44 | I1840: 0 | J1840: =RC[-1]/RC[-2] -> 0
A1841: 237 | B1841: 2 | C1841: Friday | D1841: 5 | E1841: 1pm-2pm | F1841: 5 | G1841: 2 | H1841: 44 | I1841: 0 | J1841: =RC[-1]/RC[-2] -> 0
A1842: 237 | B1842: 2 | C1842: Friday | D1842: 5 | E1842: 2pm-3pm | F1842: 6 | G1842: 3 | H1842: 44 | I1842: 1 | J1842: =RC[-1]/RC[-2] -> 2.2727272727272728E-2
A1843: 237 | B1843: 2 | C1843: Friday | D1843: 5 | E1843: 3pm-4pm | F1843: 7 | G1843: 2 | H1843: 44 | I1843: 0 | J1843: =RC[-1]/RC[-2] -> 0
A1844: 237 | B1844: 2 | C1844: Friday | D1844: 5 | E1844: 4pm-5pm | F1844: 8 | G1844: 2 | H1844: 44 | I1844: 0 | J1844: =RC[-1]/RC[-2] -> 0
A1845: 237 | B1845: 2 | C1845: Thursday | D1845: 4 | E1845: 4pm-5pm | F1845: 8 | G1845: 2 | H1845: 44 | I1845: 0 | J1845: =RC[-1]/RC[-2] -> 0
A1846: 237 | B1846: 2 | C1846: Friday | D1846: 5 | E1846: 9am-10am | F1846: 1 | G1846: 2 | H1846: 44 | I1846: 0 | J1846: =RC[-1]/RC[-2] -> 0
A1847: 237 | B1847: 2 | C1847: Friday | D1847: 5 | E1847: 10am-11am | F1847: 2 | G1847: 2 | H1847: 44 | I1847: 0 | J1847: =RC[-1]/RC[-2] -> 0
A1848: 237 | B1848: 2 | C1848: Friday | D1848: 5 | E1848: 11am-12pm | F1848: 3 | G1848: 2 | H1848: 44 | I1848: 0 | J1848: =RC[-1]/RC[-2] -> 0
A1849: 237 | B1849: 2 | C1849: Friday | D1849: 5 | E1849: 12pm-1pm | F1849: 4 | G1849: 2 | H1849: 44 | I1849: 0 | J1849: =RC[-1]/RC[-2] -> 0
A1850: 237 | B1850: 2 | C1850: Friday | D1850: 5 | E1850: 1pm-2pm | F1850: 5 | G1850: 2 | H1850: 44 | I1850: 0 | J1850: =RC[-1]/RC[-2] -> 0
A1851: 237 | B1851: 2 | C1851: Friday | D1851: 5 | E1851: 2pm-3pm | F1851: 6 | G1851: 3 | H1851: 44 | I1851: 1 | J1851: =RC[-1]/RC[-2] -> 2.2727272727272728E-2
A1852: 237 | B1852: 2 | C1852: Friday | D1852: 5 | E1852: 3pm-4pm | F1852: 7 | G1852: 2 | H1852: 44 | I1852: 0 | J1852: =RC[-1]/RC[-2] -> 0
A1853: 237 | B1853: 2 | C1853: Friday | D1853: 5 | E1853: 4pm-5pm | F1853: 8 | G1853: 2 | H1853: 44 | I1853: 0 | J1853: =RC[-1]/RC[-2] -> 0
A1854: 237 | B1854: 2 | C1854: Thursday | D1854: 4 | E1854: 4pm-5pm | F1854: 8 | G1854: 2 | H1854: 44 | I1854: 0 | J1854: =RC[-1]/RC[-2] -> 0
A1855: 237 | B1855: 2 | C1855: Friday | D1855: 5 | E1855: 9am-10am | F1855: 1 | G1855: 2 | H1855: 44 | I1855: 0 | J1855: =RC[-1]/RC[-2] -> 0
A1856: 237 | B1856: 2 | C1856: Friday | D1856: 5 | E1856: 10am-11am | F1856: 2 | G1856: 2 | H1856: 44 | I1856: 0 | J1856: =RC[-1]/RC[-2] -> 0
A1857: 237 | B1857: 2 | C1857: Friday | D1857: 5 | E1857: 11am-12pm | F1857: 3 | G1857: 2 | H1857: 44 | I1857: 0 | J1857: =RC[-1]/RC[-2] -> 0
A1858: 237 | B1858: 2 | C1858: Friday | D1858: 5 | E1858: 12pm-1pm | F1858: 4 | G1858: 2 | H1858: 44 | I1858: 0 | J1858: =RC[-1]/RC[-2] -> 0
A1859: 237 | B1859: 2 | C1859: Friday | D1859: 5 | E1859: 1pm-2pm | F1859: 5 | G1859: 2 | H1859: 44 | I1859: 0 | J1859: =RC[-1]/RC[-2] -> 0
A1860: 237 | B1860: 2 | C1860: Friday | D1860: 5 | E1860: 2pm-3pm | F1860: 6 | G1860: 3 | H1860: 44 | I1860: 1 | J1860: =RC[-1]/RC[-2] -> 2.2727272727272728E-2
A1861: 237 | B1861: 2 | C1861: Friday | D1861: 5 | E1861: 3pm-4pm | F1861: 7 | G1861: 2 | H1861: 44 | I1861: 0 | J1861: =RC[-1]/RC[-2] -> 0
A1862: 237 | B1862: 2 | C1862: Friday | D1862: 5 | E1862: 4pm-5pm | F1862: 8 | G1862: 2 | H1862: 44 | I1862: 0 | J1862: =RC[-1]/RC[-2] -> 0
A1863: 237 | B1863: 2 | C1863: Thursday | D1863: 4 | E1863: 4pm-5pm | F1863: 8 | G1863: 2 | H1863: 44 | I1863: 0 | J1863: =RC[-1]/RC[-2] -> 0
A1864: 237 | B1864: 2 | C1864: Friday | D1864: 5 | E1864: 9am-10am | F1864: 1 | G1864: 2 | H1864: 44 | I1864: 0 | J1864: =RC[-1]/RC[-2] -> 0
A1865: 237 | B1865: 2 | C1865: Friday | D1865: 5 | E1865: 10am-11am | F1865: 2 | G1865: 2 | H1865: 44 | I1865: 0 | J1865: =RC[-1]/RC[-2] -> 0
A1866: 237 | B1866: 2 | C1866: Friday | D1866: 5 | E1866: 11am-12pm | F1866: 3 | G1866: 2 | H1866: 44 | I1866: 0 | J1866: =RC[-1]/RC[-2] -> 0
A1867: 237 | B1867: 2 | C1867: Friday | D1867: 5 | E1867: 12pm-1pm | F1867: 4 | G1867: 2 | H1867: 44 | I1867: 0 | J1867: =RC[-1]/RC[-2] -> 0
A1868: 237 | B1868: 2 | C1868: Friday | D1868: 5 | E1868: 1pm-2pm | F1868: 5 | G1868: 2 | H1868: 44 | I1868: 0 | J1868: =RC[-1]/RC[-2] -> 0
A1869: 237 | B1869: 2 | C1869: Friday | D1869: 5 | E1869: 2pm-3pm | F1869: 6 | G1869: 3 | H1869: 44 | I1869: 1 | J1869: =RC[-1]/RC[-2] -> 2.2727272727272728E-2
A1870: 237 | B1870: 2 | C1870: Friday | D1870: 5 | E1870: 3pm-4pm | F1870: 7 | G1870: 2 | H1870: 44 | I1870: 0 | J1870: =RC[-1]/RC[-2] -> 0
A1871: 237 | B1871: 2 | C1871: Friday | D1871: 5 | E1871: 4pm-5pm | F1871: 8 | G1871: 2 | H1871: 44 | I1871: 0 | J1871: =RC[-1]/RC[-2] -> 0
A1872: 237 | B1872: 2 | C1872: Thursday | D1872: 4 | E1872: 4pm-5pm | F1872: 8 | G1872: 2 | H1872: 44 | I1872: 0 | J1872: =RC[-1]/RC[-2] -> 0
A1873: 237 | B1873: 2 | C1873: Friday | D1873: 5 | E1873: 9am-10am | F1873: 1 | G1873: 2 | H1873: 44 | I1873: 0 | J1873: =RC[-1]/RC[-2] -> 0
A1874: 237 | B1874: 2 | C1874: Friday | D1874: 5 | E1874: 10am-11am | F1874: 2 | G1874: 2 | H1874: 44 | I1874: 0 | J1874: =RC[-1]/RC[-2] -> 0
A1875: 237 | B1875: 2 | C1875: Friday | D1875: 5 | E1875: 11am-12pm | F1875: 3 | G1875: 2 | H1875: 44 | I1875: 0 | J1875: =RC[-1]/RC[-2] -> 0
A1876: 237 | B1876: 2 | C1876: Friday | D1876: 5 | E1876: 12pm-1pm | F1876: 4 | G1876: 2 | H1876: 44 | I1876: 0 | J1876: =RC[-1]/RC[-2] -> 0
A1877: 237 | B1877: 2 | C1877: Friday | D1877: 5 | E1877: 1pm-2pm | F1877: 5 | G1877: 2 | H1877: 44 | I1877: 0 | J1877: =RC[-1]/RC[-2] -> 0
A1878: 237 | B1878: 2 | C1878: Friday | D1878: 5 | E1878: 2pm-3pm | F1878: 6 | G1878: 3 | H1878: 44 | I1878: 1 | J1878: =RC[-1]/RC[-2] -> 2.2727272727272728E-2
A1879: 237 | B1879: 2 | C1879: Friday | D1879: 5 | E1879: 3pm-4pm | F1879: 7 | G1879: 2 | H1879: 44 | I1879: 0 | J1879: =RC[-1]/RC[-2] -> 0
A1880: 237 | B1880: 2 | C1880: Friday | D1880: 5 | E1880: 4pm-5pm | F1880: 8 | G1880: 2 | H1880: 44 | I1880: 0 | J1880: =RC[-1]/RC[-2] -> 0
A1881: 237 | B1881: 2 | C1881: Thursday | D1881: 4 | E1881: 4pm-5pm | F1881: 8 | G1881: 2 | H1881: 44 | I1881: 0 | J1881: =RC[-1]/RC[-2] -> 0
A1882: 237 | B1882: 2 | C1882: Friday | D1882: 5 | E1882: 9am-10am | F1882: 1 | G1882: 2 | H1882: 44 | I1882: 0 | J1882: =RC[-1]/RC[-2] -> 0
A1883: 237 | B1883: 2 | C1883: Friday | D1883: 5 | E1883: 10am-11am | F1883: 2 | G1883: 2 | H1883: 44 | I1883: 0 | J1883: =RC[-1]/RC[-2] -> 0
A1884: 237 | B1884: 2 | C1884: Friday | D1884: 5 | E1884: 11am-12pm | F1884: 3 | G1884: 2 | H1884: 44 | I1884: 0 | J1884: =RC[-1]/RC[-2] -> 0
A1885: 237 | B1885: 2 | C1885: Friday | D1885: 5 | E1885: 12pm-1pm | F1885: 4 | G1885: 2 | H1885: 44 | I1885: 0 | J1885: =RC[-1]/RC[-2] -> 0
A1886: 237 | B1886: 2 | C1886: Friday | D1886: 5 | E1886: 1pm-2pm | F1886: 5 | G1886: 2 | H1886: 44 | I1886: 0 | J1886: =RC[-1]/RC[-2] -> 0
A1887: 237 | B1887: 2 | C1887: Friday | D1887: 5 | E1887: 2pm-3pm | F1887: 6 | G1887: 3 | H1887: 44 | I1887: 1 | J1887: =RC[-1]/RC[-2] -> 2.2727272727272728E-2
A1888: 237 | B1888: 2 | C1888: Friday | D1888: 5 | E1888: 3pm-4pm | F1888: 7 | G1888: 2 | H1888: 44 | I1888: 0 | J1888: =RC[-1]/RC[-2] -> 0
A1889: 237 | B1889: 2 | C1889: Friday | D1889: 5 | E1889: 4pm-5pm | F1889: 8 | G1889: 2 | H1889: 44 | I1889: 0 | J1889: =RC[-1]/RC[-2] -> 0
A1890: 237 | B1890: 2 | C1890: Thursday | D1890: 4 | E1890: 4pm-5pm | F1890: 8 | G1890: 2 | H1890: 44 | I1890: 0 | J1890: =RC[-1]/RC[-2] -> 0
A1891: 237 | B1891: 2 | C1891: Friday | D1891: 5 | E1891: 9am-10am | F1891: 1 | G1891: 2 | H1891: 44 | I1891: 0 | J1891: =RC[-1]/RC[-2] -> 0
A1892: 237 | B1892: 2 | C1892: Friday | D1892: 5 | E1892: 10am-11am | F1892: 2 | G1892: 2 | H1892: 44 | I1892: 0 | J1892: =RC[-1]/RC[-2] -> 0
A1893: 237 | B1893: 2 | C1893: Friday | D1893: 5 | E1893: 11am-12pm | F1893: 3 | G1893: 2 | H1893: 44 | I1893: 0 | J1893: =RC[-1]/RC[-2] -> 0
A1894: 237 | B1894: 2 | C1894: Friday | D1894: 5 | E1894: 12pm-1pm | F1894: 4 | G1894: 2 | H1894: 44 | I1894: 0 | J1894: =RC[-1]/RC[-2] -> 0
A1895: 237 | B1895: 2 | C1895: Friday | D1895: 5 | E1895: 1pm-2pm | F1895: 5 | G1895: 2 | H1895: 44 | I1895: 0 | J1895: =RC[-1]/RC[-2] -> 0
A1896: 237 | B1896: 2 | C1896: Friday | D1896: 5 | E1896: 2pm-3pm | F1896: 6 | G1896: 3 | H1896: 44 | I1896: 1 | J1896: =RC[-1]/RC[-2] -> 2.2727272727272728E-2
A1897: 237 | B1897: 2 | C1897: Friday | D1897: 5 | E1897: 3pm-4pm | F1897: 7 | G1897: 2 | H1897: 44 | I1897: 0 | J1897: =RC[-1]/RC[-2] -> 0
A1898: 237 | B1898: 2 | C1898: Friday | D1898: 5 | E1898: 4pm-5pm | F1898: 8 | G1898: 2 | H1898: 44 | I1898: 0 | J1898: =RC[-1]/RC[-2] -> 0
A1899: 237 | B1899: 2 | C1899: Thursday | D1899: 4 | E1899: 4pm-5pm | F1899: 8 | G1899: 2 | H1899: 44 | I1899: 0 | J1899: =RC[-1]/RC[-2] -> 0
A1900: 237 | B1900: 2 | C1900: Friday | D1900: 5 | E1900: 9am-10am | F1900: 1 | G1900: 2 | H1900: 44 | I1900: 0 | J1900: =RC[-1]/RC[-2] -> 0
A1901: 237 | B1901: 2 | C1901: Friday | D1901: 5 | E1901: 10am-11am | F1901: 2 | G1901: 2 | H1901: 44 | I1901: 0 | J1901: =RC[-1]/RC[-2] -> 0
A1902: 237 | B1902: 2 | C1902: Friday | D1902: 5 | E1902: 11am-12pm | F1902: 3 | G1902: 2 | H1902: 44 | I1902: 0 | J1902: =RC[-1]/RC[-2] -> 0
A1903: 237 | B1903: 2 | C1903: Friday | D1903: 5 | E1903: 12pm-1pm | F1903: 4 | G1903: 2 | H1903: 44 | I1903: 0 | J1903: =RC[-1]/RC[-2] -> 0
A1904: 237 | B1904: 2 | C1904: Friday | D1904: 5 | E1904: 1pm-2pm | F1904: 5 | G1904: 2 | H1904: 44 | I1904: 0 | J1904: =RC[-1]/RC[-2] -> 0
A1905: 237 | B1905: 2 | C1905: Friday | D1905: 5 | E1905: 2pm-3pm | F1905: 6 | G1905: 3 | H1905: 44 | I1905: 1 | J1905: =RC[-1]/RC[-2] -> 2.2727272727272728E-2
A1906: 237 | B1906: 2 | C1906: Friday | D1906: 5 | E1906: 3pm-4pm | F1906: 7 | G1906: 2 | H1906: 44 | I1906: 0 | J1906: =RC[-1]/RC[-2] -> 0
A1907: 237 | B1907: 2 | C1907: Friday | D1907: 5 | E1907: 4pm-5pm | F1907: 8 | G1907: 2 | H1907: 44 | I1907: 0 | J1907: =RC[-1]/RC[-2] -> 0
A1908: 237 | B1908: 2 | C1908: Thursday | D1908: 4 | E1908: 4pm-5pm | F1908: 8 | G1908: 2 | H1908: 44 | I1908: 0 | J1908: =RC[-1]/RC[-2] -> 0
A1909: 237 | B1909: 2 | C1909: Friday | D1909: 5 | E1909: 9am-10am | F1909: 1 | G1909: 2 | H1909: 44 | I1909: 0 | J1909: =RC[-1]/RC[-2] -> 0
A1910: 237 | B1910: 2 | C1910: Friday | D1910: 5 | E1910: 10am-11am | F1910: 2 | G1910: 2 | H1910: 44 | I1910: 0 | J1910: =RC[-1]/RC[-2] -> 0
A1911: 237 | B1911: 2 | C1911: Friday | D1911: 5 | E1911: 11am-12pm | F1911: 3 | G1911: 2 | H1911: 44 | I1911: 0 | J1911: =RC[-1]/RC[-2] -> 0
A1912: 237 | B1912: 2 | C1912: Friday | D1912: 5 | E1912: 12pm-1pm | F1912: 4 | G1912: 2 | H1912: 44 | I1912: 0 | J1912: =RC[-1]/RC[-2] -> 0
A1913: 237 | B1913: 2 | C1913: Friday | D1913: 5 | E1913: 1pm-2pm | F1913: 5 | G1913: 2 | H1913: 44 | I1913: 0 | J1913: =RC[-1]/RC[-2] -> 0
A1914: 237 | B1914: 2 | C1914: Friday | D1914: 5 | E1914: 2pm-3pm | F1914: 6 | G1914: 3 | H1914: 44 | I1914: 1 | J1914: =RC[-1]/RC[-2] -> 2.2727272727272728E-2
A1915: 237 | B1915: 2 | C1915: Friday | D1915: 5 | E1915: 3pm-4pm | F1915: 7 | G1915: 2 | H1915: 44 | I1915: 0 | J1915: =RC[-1]/RC[-2] -> 0
A1916: 237 | B1916: 2 | C1916: Friday | D1916: 5 | E1916: 4pm-5pm | F1916: 8 | G1916: 2 | H1916: 44 | I1916: 0 | J1916: =RC[-1]/RC[-2] -> 0
A1917: 237 | B1917: 2 | C1917: Thursday | D1917: 4 | E1917: 4pm-5pm | F1917: 8 | G1917: 2 | H1917: 44 | I1917: 0 | J1917: =RC[-1]/RC[-2] -> 0
A1918: 237 | B1918: 2 | C1918: Friday | D1918: 5 | E1918: 9am-10am | F1918: 1 | G1918: 2 | H1918: 44 | I1918: 0 | J1918: =RC[-1]/RC[-2] -> 0
A1919: 237 | B1919: 2 | C1919: Friday | D1919: 5 | E1919: 10am-11am | F1919: 2 | G1919: 2 | H1919: 44 | I1919: 0 | J1919: =RC[-1]/RC[-2] -> 0
A1920: 237 | B1920: 2 | C1920: Friday | D1920: 5 | E1920: 11am-12pm | F1920: 3 | G1920: 2 | H1920: 44 | I1920: 0 | J1920: =RC[-1]/RC[-2] -> 0
A1921: 237 | B1921: 2 | C1921: Friday | D1921: 5 | E1921: 12pm-1pm | F1921: 4 | G1921: 2 | H1921: 44 | I1921: 0 | J1921: =RC[-1]/RC[-2] -> 0
A1922: 237 | B1922: 2 | C1922: Friday | D1922: 5 | E1922: 1pm-2pm | F1922: 5 | G1922: 2 | H1922: 44 | I1922: 0 | J1922: =RC[-1]/RC[-2] -> 0
A1923: 237 | B1923: 2 | C1923: Friday | D1923: 5 | E1923: 2pm-3pm | F1923: 6 | G1923: 3 | H1923: 44 | I1923: 1 | J1923: =RC[-1]/RC[-2] -> 2.2727272727272728E-2
A1924: 237 | B1924: 2 | C1924: Friday | D1924: 5 | E1924: 3pm-4pm | F1924: 7 | G1924: 2 | H1924: 44 | I1924: 0 | J1924: =RC[-1]/RC[-2] -> 0
A1925: 237 | B1925: 2 | C1925: Friday | D1925: 5 | E1925: 4pm-5pm | F1925: 8 | G1925: 2 | H1925: 44 | I1925: 0 | J1925: =RC[-1]/RC[-2] -> 0
A1926: 237 | B1926: 2 | C1926: Thursday | D1926: 4 | E1926: 4pm-5pm | F1926: 8 | G1926: 2 | H1926: 44 | I1926: 0 | J1926: =RC[-1]/RC[-2] -> 0
A1927: 237 | B1927: 2 | C1927: Friday | D1927: 5 | E1927: 9am-10am | F1927: 1 | G1927: 2 | H1927: 44 | I1927: 0 | J1927: =RC[-1]/RC[-2] -> 0
A1928: 237 | B1928: 2 | C1928: Friday | D1928: 5 | E1928: 10am-11am | F1928: 2 | G1928: 2 | H1928: 44 | I1928: 0 | J1928: =RC[-1]/RC[-2] -> 0
A1929: 237 | B1929: 2 | C1929: Friday | D1929: 5 | E1929: 11am-12pm | F1929: 3 | G1929: 2 | H1929: 44 | I1929: 0 | J1929: =RC[-1]/RC[-2] -> 0
A1930: 237 | B1930: 2 | C1930: Friday | D1930: 5 | E1930: 12pm-1pm | F1930: 4 | G1930: 2 | H1930: 44 | I1930: 0 | J1930: =RC[-1]/RC[-2] -> 0
A1931: 237 | B1931: 2 | C1931: Friday | D1931: 5 | E1931: 1pm-2pm | F1931: 5 | G1931: 2 | H1931: 44 | I1931: 0 | J1931: =RC[-1]/RC[-2] -> 0
A1932: 237 | B1932: 2 | C1932: Friday | D1932: 5 | E1932: 2pm-3pm | F1932: 6 | G1932: 3 | H1932: 44 | I1932: 1 | J1932: =RC[-1]/RC[-2] -> 2.2727272727272728E-2
A1933: 237 | B1933: 2 | C1933: Friday | D1933: 5 | E1933: 3pm-4pm | F1933: 7 | G1933: 2 | H1933: 44 | I1933: 0 | J1933: =RC[-1]/RC[-2] -> 0
A1934: 237 | B1934: 2 | C1934: Friday | D1934: 5 | E1934: 4pm-5pm | F1934: 8 | G1934: 2 | H1934: 44 | I1934: 0 | J1934: =RC[-1]/RC[-2] -> 0
A1935: 237 | B1935: 2 | C1935: Thursday | D1935: 4 | E1935: 4pm-5pm | F1935: 8 | G1935: 2 | H1935: 44 | I1935: 0 | J1935: =RC[-1]/RC[-2] -> 0
A1936: 237 | B1936: 2 | C1936: Friday | D1936: 5 | E1936: 9am-10am | F1936: 1 | G1936: 2 | H1936: 44 | I1936: 0 | J1936: =RC[-1]/RC[-2] -> 0
A1937: 237 | B1937: 2 | C1937: Friday | D1937: 5 | E1937: 10am-11am | F1937: 2 | G1937: 2 | H1937: 44 | I1937: 0 | J1937: =RC[-1]/RC[-2] -> 0
A1938: 237 | B1938: 2 | C1938: Friday | D1938: 5 | E1938: 11am-12pm | F1938: 3 | G1938: 2 | H1938: 44 | I1938: 0 | J1938: =RC[-1]/RC[-2] -> 0
A1939: 237 | B1939: 2 | C1939: Friday | D1939: 5 | E1939: 12pm-1pm | F1939: 4 | G1939: 2 | H1939: 44 | I1939: 0 | J1939: =RC[-1]/RC[-2] -> 0
A1940: 237 | B1940: 2 | C1940: Friday | D1940: 5 | E1940: 1pm-2pm | F1940: 5 | G1940: 2 | H1940: 44 | I1940: 0 | J1940: =RC[-1]/RC[-2] -> 0
A1941: 237 | B1941: 2 | C1941: Friday | D1941: 5 | E1941: 2pm-3pm | F1941: 6 | G1941: 3 | H1941: 44 | I1941: 1 | J1941: =RC[-1]/RC[-2] -> 2.2727272727272728E-2
A1942: 237 | B1942: 2 | C1942: Friday | D1942: 5 | E1942: 3pm-4pm | F1942: 7 | G1942: 2 | H1942: 44 | I1942: 0 | J1942: =RC[-1]/RC[-2] -> 0
A1943: 237 | B1943: 2 | C1943: Friday | D1943: 5 | E1943: 4pm-5pm | F1943: 8 | G1943: 2 | H1943: 44 | I1943: 0 | J1943: =RC[-1]/RC[-2] -> 0
A1944: 237 | B1944: 2 | C1944: Thursday | D1944: 4 | E1944: 4pm-5pm | F1944: 8 | G1944: 2 | H1944: 44 | I1944: 0 | J1944: =RC[-1]/RC[-2] -> 0
A1945: 237 | B1945: 2 | C1945: Friday | D1945: 5 | E1945: 9am-10am | F1945: 1 | G1945: 2 | H1945: 44 | I1945: 0 | J1945: =RC[-1]/RC[-2] -> 0
A1946: 237 | B1946: 2 | C1946: Friday | D1946: 5 | E1946: 10am-11am | F1946: 2 | G1946: 2 | H1946: 44 | I1946: 0 | J1946: =RC[-1]/RC[-2] -> 0
A1947: 237 | B1947: 2 | C1947: Friday | D1947: 5 | E1947: 11am-12pm | F1947: 3 | G1947: 2 | H1947: 44 | I1947: 0 | J1947: =RC[-1]/RC[-2] -> 0
A1948: 237 | B1948: 2 | C1948: Friday | D1948: 5 | E1948: 12pm-1pm | F1948: 4 | G1948: 2 | H1948: 44 | I1948: 0 | J1948: =RC[-1]/RC[-2] -> 0
A1949: 237 | B1949: 2 | C1949: Friday | D1949: 5 | E1949: 1pm-2pm | F1949: 5 | G1949: 2 | H1949: 44 | I1949: 0 | J1949: =RC[-1]/RC[-2] -> 0
A1950: 237 | B1950: 2 | C1950: Friday | D1950: 5 | E1950: 2pm-3pm | F1950: 6 | G1950: 3 | H1950: 44 | I1950: 1 | J1950: =RC[-1]/RC[-2] -> 2.2727272727272728E-2
A1951: 237 | B1951: 2 | C1951: Friday | D1951: 5 | E1951: 3pm-4pm | F1951: 7 | G1951: 2 | H1951: 44 | I1951: 0 | J1951: =RC[-1]/RC[-2] -> 0
A1952: 237 | B1952: 2 | C1952: Friday | D1952: 5 | E1952: 4pm-5pm | F1952: 8 | G1952: 2 | H1952: 44 | I1952: 0 | J1952: =RC[-1]/RC[-2] -> 0
A1953: 237 | B1953: 2 | C1953: Thursday | D1953: 4 | E1953: 4pm-5pm | F1953: 8 | G1953: 2 | H1953: 44 | I1953: 0 | J1953: =RC[-1]/RC[-2] -> 0
A1954: 237 | B1954: 2 | C1954: Friday | D1954: 5 | E1954: 9am-10am | F1954: 1 | G1954: 2 | H1954: 44 | I1954: 0 | J1954: =RC[-1]/RC[-2] -> 0
A1955: 237 | B1955: 2 | C1955: Friday | D1955: 5 | E1955: 10am-11am | F1955: 2 | G1955: 2 | H1955: 44 | I1955: 0 | J1955: =RC[-1]/RC[-2] -> 0
A1956: 237 | B1956: 2 | C1956: Friday | D1956: 5 | E1956: 11am-12pm | F1956: 3 | G1956: 2 | H1956: 44 | I1956: 0 | J1956: =RC[-1]/RC[-2] -> 0
A1957: 237 | B1957: 2 | C1957: Friday | D1957: 5 | E1957: 12pm-1pm | F1957: 4 | G1957: 2 | H1957: 44 | I1957: 0 | J1957: =RC[-1]/RC[-2] -> 0
A1958: 237 | B1958: 2 | C1958: Friday | D1958: 5 | E1958: 1pm-2pm | F1958: 5 | G1958: 2 | H1958: 44 | I1958: 0 | J1958: =RC[-1]/RC[-2] -> 0
A1959: 237 | B1959: 2 | C1959: Friday | D1959: 5 | E1959: 2pm-3pm | F1959: 6 | G1959: 3 | H1959: 44 | I1959: 1 | J1959: =RC[-1]/RC[-2] -> 2.2727272727272728E-2
A1960: 237 | B1960: 2 | C1960: Friday | D1960: 5 | E1960: 3pm-4pm | F1960: 7 | G1960: 2 | H1960: 44 | I1960: 0 | J1960: =RC[-1]/RC[-2] -> 0
A1961: 237 | B1961: 2 | C1961: Friday | D1961: 5 | E1961: 4pm-5pm | F1961: 8 | G1961: 2 | H1961: 44 | I1961: 0 | J1961: =RC[-1]/RC[-2] -> 0
A1962: 237 | B1962: 2 | C1962: Thursday | D1962: 4 | E1962: 4pm-5pm | F1962: 8 | G1962: 2 | H1962: 44 | I1962: 0 | J1962: =RC[-1]/RC[-2] -> 0
A1963: 237 | B1963: 2 | C1963: Friday | D1963: 5 | E1963: 9am-10am | F1963: 1 | G1963: 2 | H1963: 44 | I1963: 0 | J1963: =RC[-1]/RC[-2] -> 0
A1964: 237 | B1964: 2 | C1964: Friday | D1964: 5 | E1964: 10am-11am | F1964: 2 | G1964: 2 | H1964: 44 | I1964: 0 | J1964: =RC[-1]/RC[-2] -> 0
A1965: 237 | B1965: 2 | C1965: Friday | D1965: 5 | E1965: 11am-12pm | F1965: 3 | G1965: 2 | H1965: 44 | I1965: 0 | J1965: =RC[-1]/RC[-2] -> 0
A1966: 237 | B1966: 2 | C1966: Friday | D1966: 5 | E1966: 12pm-1pm | F1966: 4 | G1966: 2 | H1966: 44 | I1966: 0 | J1966: =RC[-1]/RC[-2] -> 0
A1967: 237 | B1967: 2 | C1967: Friday | D1967: 5 | E1967: 1pm-2pm | F1967: 5 | G1967: 2 | H1967: 44 | I1967: 0 | J1967: =RC[-1]/RC[-2] -> 0
A1968: 237 | B1968: 2 | C1968: Friday | D1968: 5 | E1968: 2pm-3pm | F1968: 6 | G1968: 3 | H1968: 44 | I1968: 1 | J1968: =RC[-1]/RC[-2] -> 2.2727272727272728E-2
A1969: 237 | B1969: 2 | C1969: Friday | D1969: 5 | E1969: 3pm-4pm | F1969: 7 | G1969: 2 | H1969: 44 | I1969: 0 | J1969: =RC[-1]/RC[-2] -> 0
A1970: 237 | B1970: 2 | C1970: Friday | D1970: 5 | E1970: 4pm-5pm | F1970: 8 | G1970: 2 | H1970: 44 | I1970: 0 | J1970: =RC[-1]/RC[-2] -> 0
A1971: 237 | B1971: 2 | C1971: Thursday | D1971: 4 | E1971: 4pm-5pm | F1971: 8 | G1971: 2 | H1971: 44 | I1971: 0 | J1971: =RC[-1]/RC[-2] -> 0
A1972: 237 | B1972: 2 | C1972: Friday | D1972: 5 | E1972: 9am-10am | F1972: 1 | G1972: 2 | H1972: 44 | I1972: 0 | J1972: =RC[-1]/RC[-2] -> 0
A1973: 237 | B1973: 2 | C1973: Friday | D1973: 5 | E1973: 10am-11am | F1973: 2 | G1973: 2 | H1973: 44 | I1973: 0 | J1973: =RC[-1]/RC[-2] -> 0
A1974: 237 | B1974: 2 | C1974: Friday | D1974: 5 | E1974: 11am-12pm | F1974: 3 | G1974: 2 | H1974: 44 | I1974: 0 | J1974: =RC[-1]/RC[-2] -> 0
A1975: 237 | B1975: 2 | C1975: Friday | D1975: 5 | E1975: 12pm-1pm | F1975: 4 | G1975: 2 | H1975: 44 | I1975: 0 | J1975: =RC[-1]/RC[-2] -> 0
A1976: 237 | B1976: 2 | C1976: Friday | D1976: 5 | E1976: 1pm-2pm | F1976: 5 | G1976: 2 | H1976: 44 | I1976: 0 | J1976: =RC[-1]/RC[-2] -> 0
A1977: 237 | B1977: 2 | C1977: Friday | D1977: 5 | E1977: 2pm-3pm | F1977: 6 | G1977: 3 | H1977: 44 | I1977: 1 | J1977: =RC[-1]/RC[-2] -> 2.2727272727272728E-2
A1978: 237 | B1978: 2 | C1978: Friday | D1978: 5 | E1978: 3pm-4pm | F1978: 7 | G1978: 2 | H1978: 44 | I1978: 0 | J1978: =RC[-1]/RC[-2] -> 0
A1979: 237 | B1979: 2 | C1979: Friday | D1979: 5 | E1979: 4pm-5pm | F1979: 8 | G1979: 2 | H1979: 44 | I1979: 0 | J1979: =RC[-1]/RC[-2] -> 0
A1980: 237 | B1980: 2 | C1980: Thursday | D1980: 4 | E1980: 4pm-5pm | F1980: 8 | G1980: 2 | H1980: 44 | I1980: 0 | J1980: =RC[-1]/RC[-2] -> 0
A1981: 237 | B1981: 2 | C1981: Friday | D1981: 5 | E1981: 9am-10am | F1981: 1 | G1981: 2 | H1981: 44 | I1981: 0 | J1981: =RC[-1]/RC[-2] -> 0
A1982: 237 | B1982: 2 | C1982: Friday | D1982: 5 | E1982: 10am-11am | F1982: 2 | G1982: 2 | H1982: 44 | I1982: 0 | J1982: =RC[-1]/RC[-2] -> 0
A1983: 237 | B1983: 2 | C1983: Friday | D1983: 5 | E1983: 11am-12pm | F1983: 3 | G1983: 2 | H1983: 44 | I1983: 0 | J1983: =RC[-1]/RC[-2] -> 0
A1984: 237 | B1984: 2 | C1984: Friday | D1984: 5 | E1984: 12pm-1pm | F1984: 4 | G1984: 2 | H1984: 44 | I1984: 0 | J1984: =RC[-1]/RC[-2] -> 0
A1985: 237 | B1985: 2 | C1985: Friday | D1985: 5 | E1985: 1pm-2pm | F1985: 5 | G1985: 2 | H1985: 44 | I1985: 0 | J1985: =RC[-1]/RC[-2] -> 0
A1986: 237 | B1986: 2 | C1986: Friday | D1986: 5 | E1986: 2pm-3pm | F1986: 6 | G1986: 3 | H1986: 44 | I1986: 1 | J1986: =RC[-1]/RC[-2] -> 2.2727272727272728E-2
A1987: 237 | B1987: 2 | C1987: Friday | D1987: 5 | E1987: 3pm-4pm | F1987: 7 | G1987: 2 | H1987: 44 | I1987: 0 | J1987: =RC[-1]/RC[-2] -> 0
A1988: 237 | B1988: 2 | C1988: Friday | D1988: 5 | E1988: 4pm-5pm | F1988: 8 | G1988: 2 | H1988: 44 | I1988: 0 | J1988: =RC[-1]/RC[-2] -> 0
A1989: 237 | B1989: 2 | C1989: Thursday | D1989: 4 | E1989: 4pm-5pm | F1989: 8 | G1989: 2 | H1989: 44 | I1989: 0 | J1989: =RC[-1]/RC[-2] -> 0
A1990: 237 | B1990: 2 | C1990: Friday | D1990: 5 | E1990: 9am-10am | F1990: 1 | G1990: 2 | H1990: 44 | I1990: 0 | J1990: =RC[-1]/RC[-2] -> 0
A1991: 237 | B1991: 2 | C1991: Friday | D1991: 5 | E1991: 10am-11am | F1991: 2 | G1991: 2 | H1991: 44 | I1991: 0 | J1991: =RC[-1]/RC[-2] -> 0
A1992: 237 | B1992: 2 | C1992: Friday | D1992: 5 | E1992: 11am-12pm | F1992: 3 | G1992: 2 | H1992: 44 | I1992: 0 | J1992: =RC[-1]/RC[-2] -> 0
A1993: 237 | B1993: 2 | C1993: Friday | D1993: 5 | E1993: 12pm-1pm | F1993: 4 | G1993: 2 | H1993: 44 | I1993: 0 | J1993: =RC[-1]/RC[-2] -> 0
A1994: 237 | B1994: 2 | C1994: Friday | D1994: 5 | E1994: 1pm-2pm | F1994: 5 | G1994: 2 | H1994: 44 | I1994: 0 | J1994: =RC[-1]/RC[-2] -> 0
A1995: 237 | B1995: 2 | C1995: Friday | D1995: 5 | E1995: 2pm-3pm | F1995: 6 | G1995: 3 | H1995: 44 | I1995: 1 | J1995: =RC[-1]/RC[-2] -> 2.2727272727272728E-2
A1996: 237 | B1996: 2 | C1996: Friday | D1996: 5 | E1996: 3pm-4pm | F1996: 7 | G1996: 2 | H1996: 44 | I1996: 0 | J1996: =RC[-1]/RC[-2] -> 0
A1997: 237 | B1997: 2 | C1997: Friday | D1997: 5 | E1997: 4pm-5pm | F1997: 8 | G1997: 2 | H1997: 44 | I1997: 0 | J1997: =RC[-1]/RC[-2] -> 0
A1998: 237 | B1998: 2 | C1998: Thursday | D1998: 4 | E1998: 4pm-5pm | F1998: 8 | G1998: 2 | H1998: 44 | I1998: 0 | J1998: =RC[-1]/RC[-2] -> 0
A1999: 237 | B1999: 2 | C1999: Friday | D1999: 5 | E1999: 9am-10am | F1999: 1 | G1999: 2 | H1999: 44 | I1999: 0 | J1999: =RC[-1]/RC[-2] -> 0
A2000: 237 | B2000: 2 | C2000: Friday | D2000: 5 | E2000: 10am-11am | F2000: 2 | G2000: 2 | H2000: 44 | I2000: 0 | J2000: =RC[-1]/RC[-2] -> 0
A2001: 237 | B2001: 2 | C2001: Friday | D2001: 5 | E2001: 11am-12pm | F2001: 3 | G2001: 2 | H2001: 44 | I2001: 0 | J2001: =RC[-1]/RC[-2] -> 0
A2002: 237 | B2002: 2 | C2002: Friday | D2002: 5 | E2002: 12pm-1pm | F2002: 4 | G2002: 2 | H2002: 44 | I2002: 0 | J2002: =RC[-1]/RC[-2] -> 0
A2003: 237 | B2003: 2 | C2003: Friday | D2003: 5 | E2003: 1pm-2pm | F2003: 5 | G2003: 2 | H2003: 44 | I2003: 0 | J2003: =RC[-1]/RC[-2] -> 0
A2004: 237 | B2004: 2 | C2004: Friday | D2004: 5 | E2004: 2pm-3pm | F2004: 6 | G2004: 3 | H2004: 44 | I2004: 1 | J2004: =RC[-1]/RC[-2] -> 2.2727272727272728E-2
A2005: 237 | B2005: 2 | C2005: Friday | D2005: 5 | E2005: 3pm-4pm | F2005: 7 | G2005: 2 | H2005: 44 | I2005: 0 | J2005: =RC[-1]/RC[-2] -> 0
A2006: 237 | B2006: 2 | C2006: Friday | D2006: 5 | E2006: 4pm-5pm | F2006: 8 | G2006: 2 | H2006: 44 | I2006: 0 | J2006: =RC[-1]/RC[-2] -> 0
A2007: 237 | B2007: 2 | C2007: Thursday | D2007: 4 | E2007: 4pm-5pm | F2007: 8 | G2007: 2 | H2007: 44 | I2007: 0 | J2007: =RC[-1]/RC[-2] -> 0
A2008: 237 | B2008: 2 | C2008: Friday | D2008: 5 | E2008: 9am-10am | F2008: 1 | G2008: 2 | H2008: 44 | I2008: 0 | J2008: =RC[-1]/RC[-2] -> 0
A2009: 237 | B2009: 2 | C2009: Friday | D2009: 5 | E2009: 10am-11am | F2009: 2 | G2009: 2 | H2009: 44 | I2009: 0 | J2009: =RC[-1]/RC[-2] -> 0
A2010: 237 | B2010: 2 | C2010: Friday | D2010: 5 | E2010: 11am-12pm | F2010: 3 | G2010: 2 | H2010: 44 | I2010: 0 | J2010: =RC[-1]/RC[-2] -> 0
A2011: 237 | B2011: 2 | C2011: Friday | D2011: 5 | E2011: 12pm-1pm | F2011: 4 | G2011: 2 | H2011: 44 | I2011: 0 | J2011: =RC[-1]/RC[-2] -> 0
A2012: 237 | B2012: 2 | C2012: Friday | D2012: 5 | E2012: 1pm-2pm | F2012: 5 | G2012: 2 | H2012: 44 | I2012: 0 | J2012: =RC[-1]/RC[-2] -> 0
A2013: 237 | B2013: 2 | C2013: Friday | D2013: 5 | E2013: 2pm-3pm | F2013: 6 | G2013: 3 | H2013: 44 | I2013: 1 | J2013: =RC[-1]/RC[-2] -> 2.2727272727272728E-2
A2014: 237 | B2014: 2 | C2014: Friday | D2014: 5 | E2014: 3pm-4pm | F2014: 7 | G2014: 2 | H2014: 44 | I2014: 0 | J2014: =RC[-1]/RC[-2] -> 0
A2015: 237 | B2015: 2 | C2015: Friday | D2015: 5 | E2015: 4pm-5pm | F2015: 8 | G2015: 2 | H2015: 44 | I2015: 0 | J2015: =RC[-1]/RC[-2] -> 0
A2016: 237 | B2016: 2 | C2016: Thursday | D2016: 4 | E2016: 4pm-5pm | F2016: 8 | G2016: 2 | H2016: 44 | I2016: 0 | J2016: =RC[-1]/RC[-2] -> 0
A2017: 237 | B2017: 2 | C2017: Friday | D2017: 5 | E2017: 9am-10am | F2017: 1 | G2017: 2 | H2017: 44 | I2017: 0 | J2017: =RC[-1]/RC[-2] -> 0
A2018: 237 | B2018: 2 | C2018: Friday | D2018: 5 | E2018: 10am-11am | F2018: 2 | G2018: 2 | H2018: 44 | I2018: 0 | J2018: =RC[-1]/RC[-2] -> 0
A2019: 237 | B2019: 2 | C2019: Friday | D2019: 5 | E2019: 11am-12pm | F2019: 3 | G2019: 2 | H2019: 44 | I2019: 0 | J2019: =RC[-1]/RC[-2] -> 0
A2020: 237 | B2020: 2 | C2020: Friday | D2020: 5 | E2020: 12pm-1pm | F2020: 4 | G2020: 2 | H2020: 44 | I2020: 0 | J2020: =RC[-1]/RC[-2] -> 0
A2021: 237 | B2021: 2 | C2021: Friday | D2021: 5 | E2021: 1pm-2pm | F2021: 5 | G2021: 2 | H2021: 44 | I2021: 0 | J2021: =RC[-1]/RC[-2] -> 0
A2022: 237 | B2022: 2 | C2022: Friday | D2022: 5 | E2022: 2pm-3pm | F2022: 6 | G2022: 3 | H2022: 44 | I2022: 1 | J2022: =RC[-1]/RC[-2] -> 2.2727272727272728E-2
A2023: 237 | B2023: 2 | C2023: Friday | D2023: 5 | E2023: 3pm-4pm | F2023: 7 | G2023: 2 | H2023: 44 | I2023: 0 | J2023: =RC[-1]/RC[-2] -> 0
A2024: 237 | B2024: 2 | C2024: Friday | D2024: 5 | E2024: 4pm-5pm | F2024: 8 | G2024: 2 | H2024: 44 | I2024: 0 | J2024: =RC[-1]/RC[-2] -> 0
A2025: 237 | B2025: 2 | C2025: Thursday | D2025: 4 | E2025: 4pm-5pm | F2025: 8 | G2025: 2 | H2025: 44 | I2025: 0 | J2025: =RC[-1]/RC[-2] -> 0
A2026: 237 | B2026: 2 | C2026: Friday | D2026: 5 | E2026: 9am-10am | F2026: 1 | G2026: 2 | H2026: 44 | I2026: 0 | J2026: =RC[-1]/RC[-2] -> 0
A2027: 237 | B2027: 2 | C2027: Friday | D2027: 5 | E2027: 10am-11am | F2027: 2 | G2027: 2 | H2027: 44 | I2027: 0 | J2027: =RC[-1]/RC[-2] -> 0
A2028: 237 | B2028: 2 | C2028: Friday | D2028: 5 | E2028: 11am-12pm | F2028: 3 | G2028: 2 | H2028: 44 | I2028: 0 | J2028: =RC[-1]/RC[-2] -> 0
A2029: 237 | B2029: 2 | C2029: Friday | D2029: 5 | E2029: 12pm-1pm | F2029: 4 | G2029: 2 | H2029: 44 | I2029: 0 | J2029: =RC[-1]/RC[-2] -> 0
A2030: 237 | B2030: 2 | C2030: Friday | D2030: 5 | E2030: 1pm-2pm | F2030: 5 | G2030: 2 | H2030: 44 | I2030: 0 | J2030: =RC[-1]/RC[-2] -> 0
A2031: 237 | B2031: 2 | C2031: Friday | D2031: 5 | E2031: 2pm-3pm | F2031: 6 | G2031: 3 | H2031: 44 | I2031: 1 | J2031: =RC[-1]/RC[-2] -> 2.2727272727272728E-2
A2032: 237 | B2032: 2 | C2032: Friday | D2032: 5 | E2032: 3pm-4pm | F2032: 7 | G2032: 2 | H2032: 44 | I2032: 0 | J2032: =RC[-1]/RC[-2] -> 0
A2033: 237 | B2033: 2 | C2033: Friday | D2033: 5 | E2033: 4pm-5pm | F2033: 8 | G2033: 2 | H2033: 44 | I2033: 0 | J2033: =RC[-1]/RC[-2] -> 0
A2034: 237 | B2034: 2 | C2034: Thursday | D2034: 4 | E2034: 4pm-5pm | F2034: 8 | G2034: 2 | H2034: 44 | I2034: 0 | J2034: =RC[-1]/RC[-2] -> 0
A2035: 237 | B2035: 2 | C2035: Friday | D2035: 5 | E2035: 9am-10am | F2035: 1 | G2035: 2 | H2035: 44 | I2035: 0 | J2035: =RC[-1]/RC[-2] -> 0
A2036: 237 | B2036: 2 | C2036: Friday | D2036: 5 | E2036: 10am-11am | F2036: 2 | G2036: 2 | H2036: 44 | I2036: 0 | J2036: =RC[-1]/RC[-2] -> 0
A2037: 237 | B2037: 2 | C2037: Friday | D2037: 5 | E2037: 11am-12pm | F2037: 3 | G2037: 2 | H2037: 44 | I2037: 0 | J2037: =RC[-1]/RC[-2] -> 0
A2038: 237 | B2038: 2 | C2038: Friday | D2038: 5 | E2038: 12pm-1pm | F2038: 4 | G2038: 2 | H2038: 44 | I2038: 0 | J2038: =RC[-1]/RC[-2] -> 0
A2039: 237 | B2039: 2 | C2039: Friday | D2039: 5 | E2039: 1pm-2pm | F2039: 5 | G2039: 2 | H2039: 44 | I2039: 0 | J2039: =RC[-1]/RC[-2] -> 0
A2040: 237 | B2040: 2 | C2040: Friday | D2040: 5 | E2040: 2pm-3pm | F2040: 6 | G2040: 3 | H2040: 44 | I2040: 1 | J2040: =RC[-1]/RC[-2] -> 2.2727272727272728E-2
A2041: 237 | B2041: 2 | C2041: Friday | D2041: 5 | E2041: 3pm-4pm | F2041: 7 | G2041: 2 | H2041: 44 | I2041: 0 | J2041: =RC[-1]/RC[-2] -> 0
A2042: 237 | B2042: 2 | C2042: Friday | D2042: 5 | E2042: 4pm-5pm | F2042: 8 | G2042: 2 | H2042: 44 | I2042: 0 | J2042: =RC[-1]/RC[-2] -> 0
A2043: 237 | B2043: 2 | C2043: Thursday | D2043: 4 | E2043: 4pm-5pm | F2043: 8 | G2043: 2 | H2043: 44 | I2043: 0 | J2043: =RC[-1]/RC[-2] -> 0
A2044: 237 | B2044: 2 | C2044: Friday | D2044: 5 | E2044: 9am-10am | F2044: 1 | G2044: 2 | H2044: 44 | I2044: 0 | J2044: =RC[-1]/RC[-2] -> 0
A2045: 237 | B2045: 2 | C2045: Friday | D2045: 5 | E2045: 10am-11am | F2045: 2 | G2045: 2 | H2045: 44 | I2045: 0 | J2045: =RC[-1]/RC[-2] -> 0
A2046: 237 | B2046: 2 | C2046: Friday | D2046: 5 | E2046: 11am-12pm | F2046: 3 | G2046: 2 | H2046: 44 | I2046: 0 | J2046: =RC[-1]/RC[-2] -> 0
A2047: 237 | B2047: 2 | C2047: Friday | D2047: 5 | E2047: 12pm-1pm | F2047: 4 | G2047: 2 | H2047: 44 | I2047: 0 | J2047: =RC[-1]/RC[-2] -> 0
A2048: 237 | B2048: 2 | C2048: Friday | D2048: 5 | E2048: 1pm-2pm | F2048: 5 | G2048: 2 | H2048: 44 | I2048: 0 | J2048: =RC[-1]/RC[-2] -> 0
A2049: 237 | B2049: 2 | C2049: Friday | D2049: 5 | E2049: 2pm-3pm | F2049: 6 | G2049: 3 | H2049: 44 | I2049: 1 | J2049: =RC[-1]/RC[-2] -> 2.2727272727272728E-2
A2050: 237 | B2050: 2 | C2050: Friday | D2050: 5 | E2050: 3pm-4pm | F2050: 7 | G2050: 2 | H2050: 44 | I2050: 0 | J2050: =RC[-1]/RC[-2] -> 0
A2051: 237 | B2051: 2 | C2051: Friday | D2051: 5 | E2051: 4pm-5pm | F2051: 8 | G2051: 2 | H2051: 44 | I2051: 0 | J2051: =RC[-1]/RC[-2] -> 0
A2052: 237 | B2052: 2 | C2052: Thursday | D2052: 4 | E2052: 4pm-5pm | F2052: 8 | G2052: 2 | H2052: 44 | I2052: 0 | J2052: =RC[-1]/RC[-2] -> 0
A2053: 237 | B2053: 2 | C2053: Friday | D2053: 5 | E2053: 9am-10am | F2053: 1 | G2053: 2 | H2053: 44 | I2053: 0 | J2053: =RC[-1]/RC[-2] -> 0
A2054: 237 | B2054: 2 | C2054: Friday | D2054: 5 | E2054: 10am-11am | F2054: 2 | G2054: 2 | H2054: 44 | I2054: 0 | J2054: =RC[-1]/RC[-2] -> 0
A2055: 237 | B2055: 2 | C2055: Friday | D2055: 5 | E2055: 11am-12pm | F2055: 3 | G2055: 2 | H2055: 44 | I2055: 0 | J2055: =RC[-1]/RC[-2] -> 0
A2056: 237 | B2056: 2 | C2056: Friday | D2056: 5 | E2056: 12pm-1pm | F2056: 4 | G2056: 2 | H2056: 44 | I2056: 0 | J2056: =RC[-1]/RC[-2] -> 0
A2057: 237 | B2057: 2 | C2057: Friday | D2057: 5 | E2057: 1pm-2pm | F2057: 5 | G2057: 2 | H2057: 44 | I2057: 0 | J2057: =RC[-1]/RC[-2] -> 0
A2058: 237 | B2058: 2 | C2058: Friday | D2058: 5 | E2058: 2pm-3pm | F2058: 6 | G2058: 3 | H2058: 44 | I2058: 1 | J2058: =RC[-1]/RC[-2] -> 2.2727272727272728E-2
A2059: 237 | B2059: 2 | C2059: Friday | D2059: 5 | E2059: 3pm-4pm | F2059: 7 | G2059: 2 | H2059: 44 | I2059: 0 | J2059: =RC[-1]/RC[-2] -> 0
A2060: 237 | B2060: 2 | C2060: Friday | D2060: 5 | E2060: 4pm-5pm | F2060: 8 | G2060: 2 | H2060: 44 | I2060: 0 | J2060: =RC[-1]/RC[-2] -> 0
A2061: 237 | B2061: 2 | C2061: Thursday | D2061: 4 | E2061: 4pm-5pm | F2061: 8 | G2061: 2 | H2061: 44 | I2061: 0 | J2061: =RC[-1]/RC[-2] -> 0
A2062: 237 | B2062: 2 | C2062: Friday | D2062: 5 | E2062: 9am-10am | F2062: 1 | G2062: 2 | H2062: 44 | I2062: 0 | J2062: =RC[-1]/RC[-2] -> 0
A2063: 237 | B2063: 2 | C2063: Friday | D2063: 5 | E2063: 10am-11am | F2063: 2 | G2063: 2 | H2063: 44 | I2063: 0 | J2063: =RC[-1]/RC[-2] -> 0
A2064: 237 | B2064: 2 | C2064: Friday | D2064: 5 | E2064: 11am-12pm | F2064: 3 | G2064: 2 | H2064: 44 | I2064: 0 | J2064: =RC[-1]/RC[-2] -> 0
A2065: 237 | B2065: 2 | C2065: Friday | D2065: 5 | E2065: 12pm-1pm | F2065: 4 | G2065: 2 | H2065: 44 | I2065: 0 | J2065: =RC[-1]/RC[-2] -> 0
A2066: 237 | B2066: 2 | C2066: Friday | D2066: 5 | E2066: 1pm-2pm | F2066: 5 | G2066: 2 | H2066: 44 | I2066: 0 | J2066: =RC[-1]/RC[-2] -> 0
A2067: 237 | B2067: 2 | C2067: Friday | D2067: 5 | E2067: 2pm-3pm | F2067: 6 | G2067: 3 | H2067: 44 | I2067: 1 | J2067: =RC[-1]/RC[-2] -> 2.2727272727272728E-2
A2068: 237 | B2068: 2 | C2068: Friday | D2068: 5 | E2068: 3pm-4pm | F2068: 7 | G2068: 2 | H2068: 44 | I2068: 0 | J2068: =RC[-1]/RC[-2] -> 0
A2069: 237 | B2069: 2 | C2069: Friday | D2069: 5 | E2069: 4pm-5pm | F2069: 8 | G2069: 2 | H2069: 44 | I2069: 0 | J2069: =RC[-1]/RC[-2] -> 0
A2070: 237 | B2070: 2 | C2070: Thursday | D2070: 4 | E2070: 4pm-5pm | F2070: 8 | G2070: 2 | H2070: 44 | I2070: 0 | J2070: =RC[-1]/RC[-2] -> 0
A2071: 237 | B2071: 2 | C2071: Friday | D2071: 5 | E2071: 9am-10am | F2071: 1 | G2071: 2 | H2071: 44 | I2071: 0 | J2071: =RC[-1]/RC[-2] -> 0
A2072: 237 | B2072: 2 | C2072: Friday | D2072: 5 | E2072: 10am-11am | F2072: 2 | G2072: 2 | H2072: 44 | I2072: 0 | J2072: =RC[-1]/RC[-2] -> 0
A2073: 237 | B2073: 2 | C2073: Friday | D2073: 5 | E2073: 11am-12pm | F2073: 3 | G2073: 2 | H2073: 44 | I2073: 0 | J2073: =RC[-1]/RC[-2] -> 0
A2074: 237 | B2074: 2 | C2074: Friday | D2074: 5 | E2074: 12pm-1pm | F2074: 4 | G2074: 2 | H2074: 44 | I2074: 0 | J2074: =RC[-1]/RC[-2] -> 0
A2075: 237 | B2075: 2 | C2075: Friday | D2075: 5 | E2075: 1pm-2pm | F2075: 5 | G2075: 2 | H2075: 44 | I2075: 0 | J2075: =RC[-1]/RC[-2] -> 0
A2076: 237 | B2076: 2 | C2076: Friday | D2076: 5 | E2076: 2pm-3pm | F2076: 6 | G2076: 3 | H2076: 44 | I2076: 1 | J2076: =RC[-1]/RC[-2] -> 2.2727272727272728E-2
A2077: 237 | B2077: 2 | C2077: Friday | D2077: 5 | E2077: 3pm-4pm | F2077: 7 | G2077: 2 | H2077: 44 | I2077: 0 | J2077: =RC[-1]/RC[-2] -> 0
A2078: 237 | B2078: 2 | C2078: Friday | D2078: 5 | E2078: 4pm-5pm | F2078: 8 | G2078: 2 | H2078: 44 | I2078: 0 | J2078: =RC[-1]/RC[-2] -> 0
A2079: 237 | B2079: 2 | C2079: Thursday | D2079: 4 | E2079: 4pm-5pm | F2079: 8 | G2079: 2 | H2079: 44 | I2079: 0 | J2079: =RC[-1]/RC[-2] -> 0
A2080: 237 | B2080: 2 | C2080: Friday | D2080: 5 | E2080: 9am-10am | F2080: 1 | G2080: 2 | H2080: 44 | I2080: 0 | J2080: =RC[-1]/RC[-2] -> 0
A2081: 237 | B2081: 2 | C2081: Friday | D2081: 5 | E2081: 10am-11am | F2081: 2 | G2081: 2 | H2081: 44 | I2081: 0 | J2081: =RC[-1]/RC[-2] -> 0
A2082: 237 | B2082: 2 | C2082: Friday | D2082: 5 | E2082: 11am-12pm | F2082: 3 | G2082: 2 | H2082: 44 | I2082: 0 | J2082: =RC[-1]/RC[-2] -> 0
A2083: 237 | B2083: 2 | C2083: Friday | D2083: 5 | E2083: 12pm-1pm | F2083: 4 | G2083: 2 | H2083: 44 | I2083: 0 | J2083: =RC[-1]/RC[-2] -> 0
A2084: 237 | B2084: 2 | C2084: Friday | D2084: 5 | E2084: 1pm-2pm | F2084: 5 | G2084: 2 | H2084: 44 | I2084: 0 | J2084: =RC[-1]/RC[-2] -> 0
A2085: 237 | B2085: 2 | C2085: Friday | D2085: 5 | E2085: 2pm-3pm | F2085: 6 | G2085: 3 | H2085: 44 | I2085: 1 | J2085: =RC[-1]/RC[-2] -> 2.2727272727272728E-2
A2086: 237 | B2086: 2 | C2086: Friday | D2086: 5 | E2086: 3pm-4pm | F2086: 7 | G2086: 2 | H2086: 44 | I2086: 0 | J2086: =RC[-1]/RC[-2] -> 0
A2087: 237 | B2087: 2 | C2087: Friday | D2087: 5 | E2087: 4pm-5pm | F2087: 8 | G2087: 2 | H2087: 44 | I2087: 0 | J2087: =RC[-1]/RC[-2] -> 0
A2088: 237 | B2088: 2 | C2088: Thursday | D2088: 4 | E2088: 4pm-5pm | F2088: 8 | G2088: 2 | H2088: 44 | I2088: 0 | J2088: =RC[-1]/RC[-2] -> 0
A2089: 237 | B2089: 2 | C2089: Friday | D2089: 5 | E2089: 9am-10am | F2089: 1 | G2089: 2 | H2089: 44 | I2089: 0 | J2089: =RC[-1]/RC[-2] -> 0
A2090: 237 | B2090: 2 | C2090: Friday | D2090: 5 | E2090: 10am-11am | F2090: 2 | G2090: 2 | H2090: 44 | I2090: 0 | J2090: =RC[-1]/RC[-2] -> 0
A2091: 237 | B2091: 2 | C2091: Friday | D2091: 5 | E2091: 11am-12pm | F2091: 3 | G2091: 2 | H2091: 44 | I2091: 0 | J2091: =RC[-1]/RC[-2] -> 0
A2092: 237 | B2092: 2 | C2092: Friday | D2092: 5 | E2092: 12pm-1pm | F2092: 4 | G2092: 2 | H2092: 44 | I2092: 0 | J2092: =RC[-1]/RC[-2] -> 0
A2093: 237 | B2093: 2 | C2093: Friday | D2093: 5 | E2093: 1pm-2pm | F2093: 5 | G2093: 2 | H2093: 44 | I2093: 0 | J2093: =RC[-1]/RC[-2] -> 0
A2094: 237 | B2094: 2 | C2094: Friday | D2094: 5 | E2094: 2pm-3pm | F2094: 6 | G2094: 3 | H2094: 44 | I2094: 1 | J2094: =RC[-1]/RC[-2] -> 2.2727272727272728E-2
A2095: 237 | B2095: 2 | C2095: Friday | D2095: 5 | E2095: 3pm-4pm | F2095: 7 | G2095: 2 | H2095: 44 | I2095: 0 | J2095: =RC[-1]/RC[-2] -> 0
A2096: 237 | B2096: 2 | C2096: Friday | D2096: 5 | E2096: 4pm-5pm | F2096: 8 | G2096: 2 | H2096: 44 | I2096: 0 | J2096: =RC[-1]/RC[-2] -> 0
A2097: 237 | B2097: 2 | C2097: Thursday | D2097: 4 | E2097: 4pm-5pm | F2097: 8 | G2097: 2 | H2097: 44 | I2097: 0 | J2097: =RC[-1]/RC[-2] -> 0
A2098: 237 | B2098: 2 | C2098: Friday | D2098: 5 | E2098: 9am-10am | F2098: 1 | G2098: 2 | H2098: 44 | I2098: 0 | J2098: =RC[-1]/RC[-2] -> 0
A2099: 237 | B2099: 2 | C2099: Friday | D2099: 5 | E2099: 10am-11am | F2099: 2 | G2099: 2 | H2099: 44 | I2099: 0 | J2099: =RC[-1]/RC[-2] -> 0
A2100: 237 | B2100: 2 | C2100: Friday | D2100: 5 | E2100: 11am-12pm | F2100: 3 | G2100: 2 | H2100: 44 | I2100: 0 | J2100: =RC[-1]/RC[-2] -> 0
A2101: 237 | B2101: 2 | C2101: Friday | D2101: 5 | E2101: 12pm-1pm | F2101: 4 | G2101: 2 | H2101: 44 | I2101: 0 | J2101: =RC[-1]/RC[-2] -> 0
A2102: 237 | B2102: 2 | C2102: Friday | D2102: 5 | E2102: 1pm-2pm | F2102: 5 | G2102: 2 | H2102: 44 | I2102: 0 | J2102: =RC[-1]/RC[-2] -> 0
A2103: 237 | B2103: 2 | C2103: Friday | D2103: 5 | E2103: 2pm-3pm | F2103: 6 | G2103: 3 | H2103: 44 | I2103: 1 | J2103: =RC[-1]/RC[-2] -> 2.2727272727272728E-2
A2104: 237 | B2104: 2 | C2104: Friday | D2104: 5 | E2104: 3pm-4pm | F2104: 7 | G2104: 2 | H2104: 44 | I2104: 0 | J2104: =RC[-1]/RC[-2] -> 0
A2105: 237 | B2105: 2 | C2105: Friday | D2105: 5 | E2105: 4pm-5pm | F2105: 8 | G2105: 2 | H2105: 44 | I2105: 0 | J2105: =RC[-1]/RC[-2] -> 0
A2106: 237 | B2106: 2 | C2106: Thursday | D2106: 4 | E2106: 4pm-5pm | F2106: 8 | G2106: 2 | H2106: 44 | I2106: 0 | J2106: =RC[-1]/RC[-2] -> 0
A2107: 237 | B2107: 2 | C2107: Friday | D2107: 5 | E2107: 9am-10am | F2107: 1 | G2107: 2 | H2107: 44 | I2107: 0 | J2107: =RC[-1]/RC[-2] -> 0
A2108: 237 | B2108: 2 | C2108: Friday | D2108: 5 | E2108: 10am-11am | F2108: 2 | G2108: 2 | H2108: 44 | I2108: 0 | J2108: =RC[-1]/RC[-2] -> 0
A2109: 237 | B2109: 2 | C2109: Friday | D2109: 5 | E2109: 11am-12pm | F2109: 3 | G2109: 2 | H2109: 44 | I2109: 0 | J2109: =RC[-1]/RC[-2] -> 0
A2110: 237 | B2110: 2 | C2110: Friday | D2110: 5 | E2110: 12pm-1pm | F2110: 4 | G2110: 2 | H2110: 44 | I2110: 0 | J2110: =RC[-1]/RC[-2] -> 0
A2111: 237 | B2111: 2 | C2111: Friday | D2111: 5 | E2111: 1pm-2pm | F2111: 5 | G2111: 2 | H2111: 44 | I2111: 0 | J2111: =RC[-1]/RC[-2] -> 0
A2112: 237 | B2112: 2 | C2112: Friday | D2112: 5 | E2112: 2pm-3pm | F2112: 6 | G2112: 3 | H2112: 44 | I2112: 1 | J2112: =RC[-1]/RC[-2] -> 2.2727272727272728E-2
A2113: 237 | B2113: 2 | C2113: Friday | D2113: 5 | E2113: 3pm-4pm | F2113: 7 | G2113: 2 | H2113: 44 | I2113: 0 | J2113: =RC[-1]/RC[-2] -> 0
A2114: 237 | B2114: 2 | C2114: Friday | D2114: 5 | E2114: 4pm-5pm | F2114: 8 | G2114: 2 | H2114: 44 | I2114: 0 | J2114: =RC[-1]/RC[-2] -> 0
A2115: 237 | B2115: 2 | C2115: Thursday | D2115: 4 | E2115: 4pm-5pm | F2115: 8 | G2115: 2 | H2115: 44 | I2115: 0 | J2115: =RC[-1]/RC[-2] -> 0
A2116: 237 | B2116: 2 | C2116: Friday | D2116: 5 | E2116: 9am-10am | F2116: 1 | G2116: 2 | H2116: 44 | I2116: 0 | J2116: =RC[-1]/RC[-2] -> 0
A2117: 237 | B2117: 2 | C2117: Friday | D2117: 5 | E2117: 10am-11am | F2117: 2 | G2117: 2 | H2117: 44 | I2117: 0 | J2117: =RC[-1]/RC[-2] -> 0
A2118: 237 | B2118: 2 | C2118: Friday | D2118: 5 | E2118: 11am-12pm | F2118: 3 | G2118: 2 | H2118: 44 | I2118: 0 | J2118: =RC[-1]/RC[-2] -> 0
A2119: 237 | B2119: 2 | C2119: Friday | D2119: 5 | E2119: 12pm-1pm | F2119: 4 | G2119: 2 | H2119: 44 | I2119: 0 | J2119: =RC[-1]/RC[-2] -> 0
A2120: 237 | B2120: 2 | C2120: Friday | D2120: 5 | E2120: 1pm-2pm | F2120: 5 | G2120: 2 | H2120: 44 | I2120: 0 | J2120: =RC[-1]/RC[-2] -> 0
A2121: 237 | B2121: 2 | C2121: Friday | D2121: 5 | E2121: 2pm-3pm | F2121: 6 | G2121: 3 | H2121: 44 | I2121: 1 | J2121: =RC[-1]/RC[-2] -> 2.2727272727272728E-2
A2122: 237 | B2122: 2 | C2122: Friday | D2122: 5 | E2122: 3pm-4pm | F2122: 7 | G2122: 2 | H2122: 44 | I2122: 0 | J2122: =RC[-1]/RC[-2] -> 0
A2123: 237 | B2123: 2 | C2123: Friday | D2123: 5 | E2123: 4pm-5pm | F2123: 8 | G2123: 2 | H2123: 44 | I2123: 0 | J2123: =RC[-1]/RC[-2] -> 0
A2124: 237 | B2124: 2 | C2124: Thursday | D2124: 4 | E2124: 4pm-5pm | F2124: 8 | G2124: 2 | H2124: 44 | I2124: 0 | J2124: =RC[-1]/RC[-2] -> 0
A2125: 237 | B2125: 2 | C2125: Friday | D2125: 5 | E2125: 9am-10am | F2125: 1 | G2125: 2 | H2125: 44 | I2125: 0 | J2125: =RC[-1]/RC[-2] -> 0
A2126: 237 | B2126: 2 | C2126: Friday | D2126: 5 | E2126: 10am-11am | F2126: 2 | G2126: 2 | H2126: 44 | I2126: 0 | J2126: =RC[-1]/RC[-2] -> 0
A2127: 237 | B2127: 2 | C2127: Friday | D2127: 5 | E2127: 11am-12pm | F2127: 3 | G2127: 2 | H2127: 44 | I2127: 0 | J2127: =RC[-1]/RC[-2] -> 0
A2128: 237 | B2128: 2 | C2128: Friday | D2128: 5 | E2128: 12pm-1pm | F2128: 4 | G2128: 2 | H2128: 44 | I2128: 0 | J2128: =RC[-1]/RC[-2] -> 0
A2129: 237 | B2129: 2 | C2129: Friday | D2129: 5 | E2129: 1pm-2pm | F2129: 5 | G2129: 2 | H2129: 44 | I2129: 0 | J2129: =RC[-1]/RC[-2] -> 0
A2130: 237 | B2130: 2 | C2130: Friday | D2130: 5 | E2130: 2pm-3pm | F2130: 6 | G2130: 3 | H2130: 44 | I2130: 1 | J2130: =RC[-1]/RC[-2] -> 2.2727272727272728E-2
A2131: 237 | B2131: 2 | C2131: Friday | D2131: 5 | E2131: 3pm-4pm | F2131: 7 | G2131: 2 | H2131: 44 | I2131: 0 | J2131: =RC[-1]/RC[-2] -> 0
A2132: 237 | B2132: 2 | C2132: Friday | D2132: 5 | E2132: 4pm-5pm | F2132: 8 | G2132: 2 | H2132: 44 | I2132: 0 | J2132: =RC[-1]/RC[-2] -> 0
A2133: 237 | B2133: 2 | C2133: Thursday | D2133: 4 | E2133: 4pm-5pm | F2133: 8 | G2133: 2 | H2133: 44 | I2133: 0 | J2133: =RC[-1]/RC[-2] -> 0
A2134: 237 | B2134: 2 | C2134: Friday | D2134: 5 | E2134: 9am-10am | F2134: 1 | G2134: 2 | H2134: 44 | I2134: 0 | J2134: =RC[-1]/RC[-2] -> 0
A2135: 237 | B2135: 2 | C2135: Friday | D2135: 5 | E2135: 10am-11am | F2135: 2 | G2135: 2 | H2135: 44 | I2135: 0 | J2135: =RC[-1]/RC[-2] -> 0
A2136: 237 | B2136: 2 | C2136: Friday | D2136: 5 | E2136: 11am-12pm | F2136: 3 | G2136: 2 | H2136: 44 | I2136: 0 | J2136: =RC[-1]/RC[-2] -> 0
A2137: 237 | B2137: 2 | C2137: Friday | D2137: 5 | E2137: 12pm-1pm | F2137: 4 | G2137: 2 | H2137: 44 | I2137: 0 | J2137: =RC[-1]/RC[-2] -> 0
A2138: 237 | B2138: 2 | C2138: Friday | D2138: 5 | E2138: 1pm-2pm | F2138: 5 | G2138: 2 | H2138: 44 | I2138: 0 | J2138: =RC[-1]/RC[-2] -> 0
A2139: 237 | B2139: 2 | C2139: Friday | D2139: 5 | E2139: 2pm-3pm | F2139: 6 | G2139: 3 | H2139: 44 | I2139: 1 | J2139: =RC[-1]/RC[-2] -> 2.2727272727272728E-2
A2140: 237 | B2140: 2 | C2140: Friday | D2140: 5 | E2140: 3pm-4pm | F2140: 7 | G2140: 2 | H2140: 44 | I2140: 0 | J2140: =RC[-1]/RC[-2] -> 0
A2141: 237 | B2141: 2 | C2141: Friday | D2141: 5 | E2141: 4pm-5pm | F2141: 8 | G2141: 2 | H2141: 44 | I2141: 0 | J2141: =RC[-1]/RC[-2] -> 0
A2142: 237 | B2142: 2 | C2142: Thursday | D2142: 4 | E2142: 4pm-5pm | F2142: 8 | G2142: 2 | H2142: 44 | I2142: 0 | J2142: =RC[-1]/RC[-2] -> 0
A2143: 237 | B2143: 2 | C2143: Friday | D2143: 5 | E2143: 9am-10am | F2143: 1 | G2143: 2 | H2143: 44 | I2143: 0 | J2143: =RC[-1]/RC[-2] -> 0
A2144: 237 | B2144: 2 | C2144: Friday | D2144: 5 | E2144: 10am-11am | F2144: 2 | G2144: 2 | H2144: 44 | I2144: 0 | J2144: =RC[-1]/RC[-2] -> 0
A2145: 237 | B2145: 2 | C2145: Friday | D2145: 5 | E2145: 11am-12pm | F2145: 3 | G2145: 2 | H2145: 44 | I2145: 0 | J2145: =RC[-1]/RC[-2] -> 0
A2146: 237 | B2146: 2 | C2146: Friday | D2146: 5 | E2146: 12pm-1pm | F2146: 4 | G2146: 2 | H2146: 44 | I2146: 0 | J2146: =RC[-1]/RC[-2] -> 0
A2147: 237 | B2147: 2 | C2147: Friday | D2147: 5 | E2147: 1pm-2pm | F2147: 5 | G2147: 2 | H2147: 44 | I2147: 0 | J2147: =RC[-1]/RC[-2] -> 0
A2148: 237 | B2148: 2 | C2148: Friday | D2148: 5 | E2148: 2pm-3pm | F2148: 6 | G2148: 3 | H2148: 44 | I2148: 1 | J2148: =RC[-1]/RC[-2] -> 2.2727272727272728E-2
A2149: 237 | B2149: 2 | C2149: Friday | D2149: 5 | E2149: 3pm-4pm | F2149: 7 | G2149: 2 | H2149: 44 | I2149: 0 | J2149: =RC[-1]/RC[-2] -> 0
A2150: 237 | B2150: 2 | C2150: Friday | D2150: 5 | E2150: 4pm-5pm | F2150: 8 | G2150: 2 | H2150: 44 | I2150: 0 | J2150: =RC[-1]/RC[-2] -> 0
A2151: 237 | B2151: 2 | C2151: Thursday | D2151: 4 | E2151: 4pm-5pm | F2151: 8 | G2151: 2 | H2151: 44 | I2151: 0 | J2151: =RC[-1]/RC[-2] -> 0
A2152: 237 | B2152: 2 | C2152: Friday | D2152: 5 | E2152: 9am-10am | F2152: 1 | G2152: 2 | H2152: 44 | I2152: 0 | J2152: =RC[-1]/RC[-2] -> 0
A2153: 237 | B2153: 2 | C2153: Friday | D2153: 5 | E2153: 10am-11am | F2153: 2 | G2153: 2 | H2153: 44 | I2153: 0 | J2153: =RC[-1]/RC[-2] -> 0
A2154: 237 | B2154: 2 | C2154: Friday | D2154: 5 | E2154: 11am-12pm | F2154: 3 | G2154: 2 | H2154: 44 | I2154: 0 | J2154: =RC[-1]/RC[-2] -> 0
A2155: 237 | B2155: 2 | C2155: Friday | D2155: 5 | E2155: 12pm-1pm | F2155: 4 | G2155: 2 | H2155: 44 | I2155: 0 | J2155: =RC[-1]/RC[-2] -> 0
A2156: 237 | B2156: 2 | C2156: Friday | D2156: 5 | E2156: 1pm-2pm | F2156: 5 | G2156: 2 | H2156: 44 | I2156: 0 | J2156: =RC[-1]/RC[-2] -> 0
A2157: 237 | B2157: 2 | C2157: Friday | D2157: 5 | E2157: 2pm-3pm | F2157: 6 | G2157: 3 | H2157: 44 | I2157: 1 | J2157: =RC[-1]/RC[-2] -> 2.2727272727272728E-2
A2158: 237 | B2158: 2 | C2158: Friday | D2158: 5 | E2158: 3pm-4pm | F2158: 7 | G2158: 2 | H2158: 44 | I2158: 0 | J2158: =RC[-1]/RC[-2] -> 0
A2159: 237 | B2159: 2 | C2159: Friday | D2159: 5 | E2159: 4pm-5pm | F2159: 8 | G2159: 2 | H2159: 44 | I2159: 0 | J2159: =RC[-1]/RC[-2] -> 0
A2160: 237 | B2160: 2 | C2160: Thursday | D2160: 4 | E2160: 4pm-5pm | F2160: 8 | G2160: 2 | H2160: 44 | I2160: 0 | J2160: =RC[-1]/RC[-2] -> 0
A2161: 237 | B2161: 2 | C2161: Friday | D2161: 5 | E2161: 9am-10am | F2161: 1 | G2161: 2 | H2161: 44 | I2161: 0 | J2161: =RC[-1]/RC[-2] -> 0
A2162: 237 | B2162: 2 | C2162: Friday | D2162: 5 | E2162: 10am-11am | F2162: 2 | G2162: 2 | H2162: 44 | I2162: 0 | J2162: =RC[-1]/RC[-2] -> 0
A2163: 237 | B2163: 2 | C2163: Friday | D2163: 5 | E2163: 11am-12pm | F2163: 3 | G2163: 2 | H2163: 44 | I2163: 0 | J2163: =RC[-1]/RC[-2] -> 0
A2164: 237 | B2164: 2 | C2164: Friday | D2164: 5 | E2164: 12pm-1pm | F2164: 4 | G2164: 2 | H2164: 44 | I2164: 0 | J2164: =RC[-1]/RC[-2] -> 0
A2165: 237 | B2165: 2 | C2165: Friday | D2165: 5 | E2165: 1pm-2pm | F2165: 5 | G2165: 2 | H2165: 44 | I2165: 0 | J2165: =RC[-1]/RC[-2] -> 0
A2166: 237 | B2166: 2 | C2166: Friday | D2166: 5 | E2166: 2pm-3pm | F2166: 6 | G2166: 3 | H2166: 44 | I2166: 1 | J2166: =RC[-1]/RC[-2] -> 2.2727272727272728E-2
A2167: 237 | B2167: 2 | C2167: Friday | D2167: 5 | E2167: 3pm-4pm | F2167: 7 | G2167: 2 | H2167: 44 | I2167: 0 | J2167: =RC[-1]/RC[-2] -> 0
A2168: 237 | B2168: 2 | C2168: Friday | D2168: 5 | E2168: 4pm-5pm | F2168: 8 | G2168: 2 | H2168: 44 | I2168: 0 | J2168: =RC[-1]/RC[-2] -> 0
A2169: 237 | B2169: 2 | C2169: Thursday | D2169: 4 | E2169: 4pm-5pm | F2169: 8 | G2169: 2 | H2169: 44 | I2169: 0 | J2169: =RC[-1]/RC[-2] -> 0
A2170: 237 | B2170: 2 | C2170: Friday | D2170: 5 | E2170: 9am-10am | F2170: 1 | G2170: 2 | H2170: 44 | I2170: 0 | J2170: =RC[-1]/RC[-2] -> 0
A2171: 237 | B2171: 2 | C2171: Friday | D2171: 5 | E2171: 10am-11am | F2171: 2 | G2171: 2 | H2171: 44 | I2171: 0 | J2171: =RC[-1]/RC[-2] -> 0
A2172: 237 | B2172: 2 | C2172: Friday | D2172: 5 | E2172: 11am-12pm | F2172: 3 | G2172: 2 | H2172: 44 | I2172: 0 | J2172: =RC[-1]/RC[-2] -> 0
A2173: 237 | B2173: 2 | C2173: Friday | D2173: 5 | E2173: 12pm-1pm | F2173: 4 | G2173: 2 | H2173: 44 | I2173: 0 | J2173: =RC[-1]/RC[-2] -> 0
A2174: 237 | B2174: 2 | C2174: Friday | D2174: 5 | E2174: 1pm-2pm | F2174: 5 | G2174: 2 | H2174: 44 | I2174: 0 | J2174: =RC[-1]/RC[-2] -> 0
A2175: 237 | B2175: 2 | C2175: Friday | D2175: 5 | E2175: 2pm-3pm | F2175: 6 | G2175: 3 | H2175: 44 | I2175: 1 | J2175: =RC[-1]/RC[-2] -> 2.2727272727272728E-2
A2176: 237 | B2176: 2 | C2176: Friday | D2176: 5 | E2176: 3pm-4pm | F2176: 7 | G2176: 2 | H2176: 44 | I2176: 0 | J2176: =RC[-1]/RC[-2] -> 0
A2177: 237 | B2177: 2 | C2177: Friday | D2177: 5 | E2177: 4pm-5pm | F2177: 8 | G2177: 2 | H2177: 44 | I2177: 0 | J2177: =RC[-1]/RC[-2] -> 0
A2178: 111 | B2178: 1 | C2178: Thursday | D2178: 4 | E2178: 3pm-4pm | F2178: 7 | G2178: 1 | H2178: 20 | I2178: 15 | J2178: =RC[-1]/RC[-2] -> 0.75
A2179: 111 | B2179: 1 | C2179: Thursday | D2179: 4 | E2179: 4pm-5pm | F2179: 8 | G2179: 3 | H2179: 20 | I2179: 2 | J2179: =RC[-1]/RC[-2] -> 0.1
A2180: 111 | B2180: 1 | C2180: Friday | D2180: 5 | E2180: 9am-10am | F2180: 1 | G2180: 2 | H2180: 20 | I2180: 0 | J2180: =RC[-1]/RC[-2] -> 0
A2181: 111 | B2181: 1 | C2181: Friday | D2181: 5 | E2181: 10am-11am | F2181: 2 | G2181: 2 | H2181: 20 | I2181: 0 | J2181: =RC[-1]/RC[-2] -> 0
A2182: 111 | B2182: 1 | C2182: Friday | D2182: 5 | E2182: 11am-12pm | F2182: 3 | G2182: 2 | H2182: 20 | I2182: 0 | J2182: =RC[-1]/RC[-2] -> 0
A2183: 111 | B2183: 1 | C2183: Friday | D2183: 5 | E2183: 12pm-1pm | F2183: 4 | G2183: 2 | H2183: 20 | I2183: 0 | J2183: =RC[-1]/RC[-2] -> 0
A2184: 111 | B2184: 1 | C2184: Friday | D2184: 5 | E2184: 1pm-2pm | F2184: 5 | G2184: 2 | H2184: 20 | I2184: 0 | J2184: =RC[-1]/RC[-2] -> 0
A2185: 111 | B2185: 1 | C2185: Friday | D2185: 5 | E2185: 2pm-3pm | F2185: 6 | G2185: 2 | H2185: 20 | I2185: 0 | J2185: =RC[-1]/RC[-2] -> 0
A2186: 111 | B2186: 1 | C2186: Friday | D2186: 5 | E2186: 3pm-4pm | F2186: 7 | G2186: 2 | H2186: 20 | I2186: 0 | J2186: =RC[-1]/RC[-2] -> 0
A2187: 111 | B2187: 1 | C2187: Friday | D2187: 5 | E2187: 4pm-5pm | F2187: 8 | G2187: 2 | H2187: 20 | I2187: 0 | J2187: =RC[-1]/RC[-2] -> 0
A2188: 113 | B2188: 1 | C2188: Monday | D2188: 1 | E2188: 9am-10am | F2188: 1 | G2188: 2 | H2188: 20 | I2188: 0 | J2188: =RC[-1]/RC[-2] -> 0
A2189: 113 | B2189: 1 | C2189: Monday | D2189: 1 | E2189: 10am-11am | F2189: 2 | G2189: 3 | H2189: 20 | I2189: 1 | J2189: =RC[-1]/RC[-2] -> 0.05
A2190: 113 | B2190: 1 | C2190: Monday | D2190: 1 | E2190: 11am-12pm | F2190: 3 | G2190: 2 | H2190: 20 | I2190: 0 | J2190: =RC[-1]/RC[-2] -> 0
A2191: 113 | B2191: 1 | C2191: Monday | D2191: 1 | E2191: 12pm-1pm | F2191: 4 | G2191: 1 | H2191: 20 | I2191: 5 | J2191: =RC[-1]/RC[-2] -> 0.25
A2192: 113 | B2192: 1 | C2192: Monday | D2192: 1 | E2192: 1pm-2pm | F2192: 5 | G2192: 1 | H2192: 20 | I2192: 7 | J2192: =RC[-1]/RC[-2] -> 0.35
A2193: 113 | B2193: 1 | C2193: Monday | D2193: 1 | E2193: 2pm-3pm | F2193: 6 | G2193: 1 | H2193: 20 | I2193: 6 | J2193: =RC[-1]/RC[-2] -> 0.3
A2194: 113 | B2194: 1 | C2194: Monday | D2194: 1 | E2194: 3pm-4pm | F2194: 7 | G2194: 2 | H2194: 20 | I2194: 0 | J2194: =RC[-1]/RC[-2] -> 0
A2195: 113 | B2195: 1 | C2195: Monday | D2195: 1 | E2195: 4pm-5pm | F2195: 8 | G2195: 2 | H2195: 20 | I2195: 0 | J2195: =RC[-1]/RC[-2] -> 0
A2196: 113 | B2196: 1 | C2196: Tuesday | D2196: 2 | E2196: 9am-10am | F2196: 1 | G2196: 2 | H2196: 20 | I2196: 0 | J2196: =RC[-1]/RC[-2] -> 0
A2197: 113 | B2197: 1 | C2197: Tuesday | D2197: 2 | E2197: 10am-11am | F2197: 2 | G2197: 2 | H2197: 20 | I2197: 0 | J2197: =RC[-1]/RC[-2] -> 0
A2198: 113 | B2198: 1 | C2198: Tuesday | D2198: 2 | E2198: 11am-12pm | F2198: 3 | G2198: 2 | H2198: 20 | I2198: 0 | J2198: =RC[-1]/RC[-2] -> 0
A2199: 113 | B2199: 1 | C2199: Tuesday | D2199: 2 | E2199: 12pm-1pm | F2199: 4 | G2199: 2 | H2199: 20 | I2199: 0 | J2199: =RC[-1]/RC[-2] -> 0
A2200: 113 | B2200: 1 | C2200: Tuesday | D2200: 2 | E2200: 1pm-2pm | F2200: 5 | G2200: 2 | H2200: 20 | I2200: 0 | J2200: =RC[-1]/RC[-2] -> 0
A2201: 113 | B2201: 1 | C2201: Tuesday | D2201: 2 | E2201: 2pm-3pm | F2201: 6 | G2201: 1 | H2201: 20 | I2201: 21 | J2201: =RC[-1]/RC[-2] -> 1.05
A2202: 113 | B2202: 1 | C2202: Tuesday | D2202: 2 | E2202: 3pm-4pm | F2202: 7 | G2202: 1 | H2202: 20 | I2202: 20 | J2202: =RC[-1]/RC[-2] -> 1
A2203: 113 | B2203: 1 | C2203: Tuesday | D2203: 2 | E2203: 4pm-5pm | F2203: 8 | G2203: 2 | H2203: 20 | I2203: 0 | J2203: =RC[-1]/RC[-2] -> 0
A2204: 113 | B2204: 1 | C2204: Wednesday | D2204: 3 | E2204: 9am-10am | F2204: 1 | G2204: 1 | H2204: 20 | I2204: 7 | J2204: =RC[-1]/RC[-2] -> 0.35
A2205: 113 | B2205: 1 | C2205: Wednesday | D2205: 3 | E2205: 10am-11am | F2205: 2 | G2205: 1 | H2205: 20 | I2205: 7 | J2205: =RC[-1]/RC[-2] -> 0.35
A2206: 113 | B2206: 1 | C2206: Wednesday | D2206: 3 | E2206: 11am-12pm | F2206: 3 | G2206: 3 | H2206: 20 | I2206: 1 | J2206: =RC[-1]/RC[-2] -> 0.05
A2207: 113 | B2207: 1 | C2207: Wednesday | D2207: 3 | E2207: 12pm-1pm | F2207: 4 | G2207: 2 | H2207: 20 | I2207: 0 | J2207: =RC[-1]/RC[-2] -> 0
A2208: 113 | B2208: 1 | C2208: Wednesday | D2208: 3 | E2208: 1pm-2pm | F2208: 5 | G2208: 2 | H2208: 20 | I2208: 0 | J2208: =RC[-1]/RC[-2] -> 0
A2209: 113 | B2209: 1 | C2209: Wednesday | D2209: 3 | E2209: 2pm-3pm | F2209: 6 | G2209: 2 | H2209: 20 | I2209: 0 | J2209: =RC[-1]/RC[-2] -> 0
A2210: 113 | B2210: 1 | C2210: Wednesday | D2210: 3 | E2210: 3pm-4pm | F2210: 7 | G2210: 2 | H2210: 20 | I2210: 0 | J2210: =RC[-1]/RC[-2] -> 0
A2211: 113 | B2211: 1 | C2211: Wednesday | D2211: 3 | E2211: 4pm-5pm | F2211: 8 | G2211: 2 | H2211: 20 | I2211: 0 | J2211: =RC[-1]/RC[-2] -> 0
A2212: 113 | B2212: 1 | C2212: Thursday | D2212: 4 | E2212: 9am-10am | F2212: 1 | G2212: 1 | H2212: 20 | I2212: 14 | J2212: =RC[-1]/RC[-2] -> 0.7
A2213: 113 | B2213: 1 | C2213: Thursday | D2213: 4 | E2213: 10am-11am | F2213: 2 | G2213: 2 | H2213: 20 | I2213: 0 | J2213: =RC[-1]/RC[-2] -> 0
A2214: 113 | B2214: 1 | C2214: Thursday | D2214: 4 | E2214: 11am-12pm | F2214: 3 | G2214: 1 | H2214: 20 | I2214: 20 | J2214: =RC[-1]/RC[-2] -> 1
A2215: 113 | B2215: 1 | C2215: Thursday | D2215: 4 | E2215: 12pm-1pm | F2215: 4 | G2215: 1 | H2215: 20 | I2215: 20 | J2215: =RC[-1]/RC[-2] -> 1
A2216: 113 | B2216: 1 | C2216: Thursday | D2216: 4 | E2216: 1pm-2pm | F2216: 5 | G2216: 2 | H2216: 20 | I2216: 0 | J2216: =RC[-1]/RC[-2] -> 0
A2217: 113 | B2217: 1 | C2217: Thursday | D2217: 4 | E2217: 2pm-3pm | F2217: 6 | G2217: 1 | H2217: 20 | I2217: 9 | J2217: =RC[-1]/RC[-2] -> 0.45
A2218: 113 | B2218: 1 | C2218: Thursday | D2218: 4 | E2218: 3pm-4pm | F2218: 7 | G2218: 2 | H2218: 20 | I2218: 0 | J2218: =RC[-1]/RC[-2] -> 0
A2219: 113 | B2219: 1 | C2219: Thursday | D2219: 4 | E2219: 4pm-5pm | F2219: 8 | G2219: 2 | H2219: 20 | I2219: 0 | J2219: =RC[-1]/RC[-2] -> 0
A2220: 113 | B2220: 1 | C2220: Friday | D2220: 5 | E2220: 9am-10am | F2220: 1 | G2220: 2 | H2220: 20 | I2220: 0 | J2220: =RC[-1]/RC[-2] -> 0
A2221: 113 | B2221: 1 | C2221: Friday | D2221: 5 | E2221: 10am-11am | F2221: 2 | G2221: 1 | H2221: 20 | I2221: 19 | J2221: =RC[-1]/RC[-2] -> 0.95
A2222: 113 | B2222: 1 | C2222: Friday | D2222: 5 | E2222: 11am-12pm | F2222: 3 | G2222: 1 | H2222: 20 | I2222: 19 | J2222: =RC[-1]/RC[-2] -> 0.95
A2223: 113 | B2223: 1 | C2223: Friday | D2223: 5 | E2223: 12pm-1pm | F2223: 4 | G2223: 1 | H2223: 20 | I2223: 13 | J2223: =RC[-1]/RC[-2] -> 0.65
A2224: 113 | B2224: 1 | C2224: Friday | D2224: 5 | E2224: 1pm-2pm | F2224: 5 | G2224: 1 | H2224: 20 | I2224: 15 | J2224: =RC[-1]/RC[-2] -> 0.75
A2225: 113 | B2225: 1 | C2225: Friday | D2225: 5 | E2225: 2pm-3pm | F2225: 6 | G2225: 3 | H2225: 20 | I2225: 1 | J2225: =RC[-1]/RC[-2] -> 0.05
A2226: 113 | B2226: 1 | C2226: Friday | D2226: 5 | E2226: 3pm-4pm | F2226: 7 | G2226: 1 | H2226: 20 | I2226: 7 | J2226: =RC[-1]/RC[-2] -> 0.35
A2227: 113 | B2227: 1 | C2227: Friday | D2227: 5 | E2227: 4pm-5pm | F2227: 8 | G2227: 2 | H2227: 20 | I2227: 0 | J2227: =RC[-1]/RC[-2] -> 0
A2228: 117 | B2228: 1 | C2228: Monday | D2228: 1 | E2228: 9am-10am | F2228: 1 | G2228: 2 | H2228: 20 | I2228: 0 | J2228: =RC[-1]/RC[-2] -> 0
A2229: 117 | B2229: 1 | C2229: Monday | D2229: 1 | E2229: 10am-11am | F2229: 2 | G2229: 3 | H2229: 20 | I2229: 1 | J2229: =RC[-1]/RC[-2] -> 0.05
A2230: 117 | B2230: 1 | C2230: Monday | D2230: 1 | E2230: 11am-12pm | F2230: 3 | G2230: 2 | H2230: 20 | I2230: 0 | J2230: =RC[-1]/RC[-2] -> 0
A2231: 117 | B2231: 1 | C2231: Monday | D2231: 1 | E2231: 12pm-1pm | F2231: 4 | G2231: 2 | H2231: 20 | I2231: 0 | J2231: =RC[-1]/RC[-2] -> 0
A2232: 117 | B2232: 1 | C2232: Monday | D2232: 1 | E2232: 1pm-2pm | F2232: 5 | G2232: 1 | H2232: 20 | I2232: 18 | J2232: =RC[-1]/RC[-2] -> 0.9
A2233: 117 | B2233: 1 | C2233: Monday | D2233: 1 | E2233: 2pm-3pm | F2233: 6 | G2233: 1 | H2233: 20 | I2233: 17 | J2233: =RC[-1]/RC[-2] -> 0.85
A2234: 117 | B2234: 1 | C2234: Monday | D2234: 1 | E2234: 3pm-4pm | F2234: 7 | G2234: 1 | H2234: 20 | I2234: 15 | J2234: =RC[-1]/RC[-2] -> 0.75
A2235: 117 | B2235: 1 | C2235: Monday | D2235: 1 | E2235: 4pm-5pm | F2235: 8 | G2235: 1 | H2235: 20 | I2235: 8 | J2235: =RC[-1]/RC[-2] -> 0.4
A2236: 117 | B2236: 1 | C2236: Tuesday | D2236: 2 | E2236: 9am-10am | F2236: 1 | G2236: 3 | H2236: 20 | I2236: 2 | J2236: =RC[-1]/RC[-2] -> 0.1
A2237: 117 | B2237: 1 | C2237: Tuesday | D2237: 2 | E2237: 10am-11am | F2237: 2 | G2237: 1 | H2237: 20 | I2237: 18 | J2237: =RC[-1]/RC[-2] -> 0.9
A2238: 117 | B2238: 1 | C2238: Tuesday | D2238: 2 | E2238: 11am-12pm | F2238: 3 | G2238: 1 | H2238: 20 | I2238: 16 | J2238: =RC[-1]/RC[-2] -> 0.8
A2239: 117 | B2239: 1 | C2239: Tuesday | D2239: 2 | E2239: 12pm-1pm | F2239: 4 | G2239: 1 | H2239: 20 | I2239: 17 | J2239: =RC[-1]/RC[-2] -> 0.85
A2240: 117 | B2240: 1 | C2240: Tuesday | D2240: 2 | E2240: 1pm-2pm | F2240: 5 | G2240: 2 | H2240: 20 | I2240: 0 | J2240: =RC[-1]/RC[-2] -> 0
A2241: 117 | B2241: 1 | C2241: Tuesday | D2241: 2 | E2241: 2pm-3pm | F2241: 6 | G2241: 1 | H2241: 20 | I2241: 14 | J2241: =RC[-1]/RC[-2] -> 0.7
A2242: 117 | B2242: 1 | C2242: Tuesday | D2242: 2 | E2242: 3pm-4pm | F2242: 7 | G2242: 1 | H2242: 20 | I2242: 14 | J2242: =RC[-1]/RC[-2] -> 0.7
A2243: 117 | B2243: 1 | C2243: Tuesday | D2243: 2 | E2243: 4pm-5pm | F2243: 8 | G2243: 1 | H2243: 20 | I2243: 11 | J2243: =RC[-1]/RC[-2] -> 0.55
A2244: 117 | B2244: 1 | C2244: Wednesday | D2244: 3 | E2244: 9am-10am | F2244: 1 | G2244: 1 | H2244: 20 | I2244: 20 | J2244: =RC[-1]/RC[-2] -> 1
A2245: 117 | B2245: 1 | C2245: Wednesday | D2245: 3 | E2245: 10am-11am | F2245: 2 | G2245: 1 | H2245: 20 | I2245: 13 | J2245: =RC[-1]/RC[-2] -> 0.65
A2246: 117 | B2246: 1 | C2246: Wednesday | D2246: 3 | E2246: 11am-12pm | F2246: 3 | G2246: 1 | H2246: 20 | I2246: 12 | J2246: =RC[-1]/RC[-2] -> 0.6
A2247: 117 | B2247: 1 | C2247: Wednesday | D2247: 3 | E2247: 12pm-1pm | F2247: 4 | G2247: 2 | H2247: 20 | I2247: 0 | J2247: =RC[-1]/RC[-2] -> 0
A2248: 117 | B2248: 1 | C2248: Wednesday | D2248: 3 | E2248: 1pm-2pm | F2248: 5 | G2248: 1 | H2248: 20 | I2248: 3 | J2248: =RC[-1]/RC[-2] -> 0.15
A2249: 117 | B2249: 1 | C2249: Wednesday | D2249: 3 | E2249: 2pm-3pm | F2249: 6 | G2249: 1 | H2249: 20 | I2249: 18 | J2249: =RC[-1]/RC[-2] -> 0.9
A2250: 117 | B2250: 1 | C2250: Wednesday | D2250: 3 | E2250: 3pm-4pm | F2250: 7 | G2250: 1 | H2250: 20 | I2250: 13 | J2250: =RC[-1]/RC[-2] -> 0.65
A2251: 117 | B2251: 1 | C2251: Wednesday | D2251: 3 | E2251: 4pm-5pm | F2251: 8 | G2251: 1 | H2251: 20 | I2251: 9 | J2251: =RC[-1]/RC[-2] -> 0.45
A2252: 117 | B2252: 1 | C2252: Thursday | D2252: 4 | E2252: 9am-10am | F2252: 1 | G2252: 3 | H2252: 20 | I2252: 1 | J2252: =RC[-1]/RC[-2] -> 0.05
A2253: 117 | B2253: 1 | C2253: Thursday | D2253: 4 | E2253: 10am-11am | F2253: 2 | G2253: 1 | H2253: 20 | I2253: 15 | J2253: =RC[-1]/RC[-2] -> 0.75
A2254: 117 | B2254: 1 | C2254: Thursday | D2254: 4 | E2254: 11am-12pm | F2254: 3 | G2254: 1 | H2254: 20 | I2254: 16 | J2254: =RC[-1]/RC[-2] -> 0.8
A2255: 117 | B2255: 1 | C2255: Thursday | D2255: 4 | E2255: 12pm-1pm | F2255: 4 | G2255: 1 | H2255: 20 | I2255: 13 | J2255: =RC[-1]/RC[-2] -> 0.65
A2256: 117 | B2256: 1 | C2256: Thursday | D2256: 4 | E2256: 1pm-2pm | F2256: 5 | G2256: 2 | H2256: 20 | I2256: 0 | J2256: =RC[-1]/RC[-2] -> 0
A2257: 117 | B2257: 1 | C2257: Thursday | D2257: 4 | E2257: 2pm-3pm | F2257: 6 | G2257: 1 | H2257: 20 | I2257: 20 | J2257: =RC[-1]/RC[-2] -> 1
A2258: 117 | B2258: 1 | C2258: Thursday | D2258: 4 | E2258: 3pm-4pm | F2258: 7 | G2258: 1 | H2258: 20 | I2258: 17 | J2258: =RC[-1]/RC[-2] -> 0.85
A2259: 117 | B2259: 1 | C2259: Thursday | D2259: 4 | E2259: 4pm-5pm | F2259: 8 | G2259: 1 | H2259: 20 | I2259: 7 | J2259: =RC[-1]/RC[-2] -> 0.35
A2260: 117 | B2260: 1 | C2260: Friday | D2260: 5 | E2260: 9am-10am | F2260: 1 | G2260: 2 | H2260: 20 | I2260: 0 | J2260: =RC[-1]/RC[-2] -> 0
A2261: 117 | B2261: 1 | C2261: Friday | D2261: 5 | E2261: 10am-11am | F2261: 2 | G2261: 2 | H2261: 20 | I2261: 0 | J2261: =RC[-1]/RC[-2] -> 0
A2262: 117 | B2262: 1 | C2262: Friday | D2262: 5 | E2262: 11am-12pm | F2262: 3 | G2262: 2 | H2262: 20 | I2262: 0 | J2262: =RC[-1]/RC[-2] -> 0
A2263: 117 | B2263: 1 | C2263: Friday | D2263: 5 | E2263: 12pm-1pm | F2263: 4 | G2263: 2 | H2263: 20 | I2263: 0 | J2263: =RC[-1]/RC[-2] -> 0
A2264: 117 | B2264: 1 | C2264: Friday | D2264: 5 | E2264: 1pm-2pm | F2264: 5 | G2264: 2 | H2264: 20 | I2264: 0 | J2264: =RC[-1]/RC[-2] -> 0
A2265: 117 | B2265: 1 | C2265: Friday | D2265: 5 | E2265: 2pm-3pm | F2265: 6 | G2265: 1 | H2265: 20 | I2265: 18 | J2265: =RC[-1]/RC[-2] -> 0.9
A2266: 117 | B2266: 1 | C2266: Friday | D2266: 5 | E2266: 3pm-4pm | F2266: 7 | G2266: 1 | H2266: 20 | I2266: 18 | J2266: =RC[-1]/RC[-2] -> 0.9
A2267: 117 | B2267: 1 | C2267: Friday | D2267: 5 | E2267: 4pm-5pm | F2267: 8 | G2267: 1 | H2267: 20 | I2267: 18 | J2267: =RC[-1]/RC[-2] -> 0.9
A2268: 118 | B2268: 1 | C2268: Monday | D2268: 1 | E2268: 9am-10am | F2268: 1 | G2268: 3 | H2268: 6 | I2268: 2 | J2268: =RC[-1]/RC[-2] -> 0.33333333333333331
A2269: 118 | B2269: 1 | C2269: Monday | D2269: 1 | E2269: 10am-11am | F2269: 2 | G2269: 3 | H2269: 6 | I2269: 2 | J2269: =RC[-1]/RC[-2] -> 0.33333333333333331
A2270: 118 | B2270: 1 | C2270: Monday | D2270: 1 | E2270: 11am-12pm | F2270: 3 | G2270: 1 | H2270: 6 | I2270: 1 | J2270: =RC[-1]/RC[-2] -> 0.16666666666666666
A2271: 118 | B2271: 1 | C2271: Monday | D2271: 1 | E2271: 12pm-1pm | F2271: 4 | G2271: 1 | H2271: 6 | I2271: 5 | J2271: =RC[-1]/RC[-2] -> 0.83333333333333337
A2272: 118 | B2272: 1 | C2272: Monday | D2272: 1 | E2272: 1pm-2pm | F2272: 5 | G2272: 1 | H2272: 6 | I2272: 3 | J2272: =RC[-1]/RC[-2] -> 0.5
A2273: 118 | B2273: 1 | C2273: Monday | D2273: 1 | E2273: 2pm-3pm | F2273: 6 | G2273: 1 | H2273: 6 | I2273: 3 | J2273: =RC[-1]/RC[-2] -> 0.5
A2274: 118 | B2274: 1 | C2274: Monday | D2274: 1 | E2274: 3pm-4pm | F2274: 7 | G2274: 1 | H2274: 6 | I2274: 4 | J2274: =RC[-1]/RC[-2] -> 0.66666666666666663
A2275: 118 | B2275: 1 | C2275: Monday | D2275: 1 | E2275: 4pm-5pm | F2275: 8 | G2275: 1 | H2275: 6 | I2275: 1 | J2275: =RC[-1]/RC[-2] -> 0.16666666666666666
A2276: 118 | B2276: 1 | C2276: Tuesday | D2276: 2 | E2276: 9am-10am | F2276: 1 | G2276: 1 | H2276: 6 | I2276: 2 | J2276: =RC[-1]/RC[-2] -> 0.33333333333333331
A2277: 118 | B2277: 1 | C2277: Tuesday | D2277: 2 | E2277: 10am-11am | F2277: 2 | G2277: 3 | H2277: 6 | I2277: 2 | J2277: =RC[-1]/RC[-2] -> 0.33333333333333331
A2278: 118 | B2278: 1 | C2278: Tuesday | D2278: 2 | E2278: 11am-12pm | F2278: 3 | G2278: 1 | H2278: 6 | I2278: 1 | J2278: =RC[-1]/RC[-2] -> 0.16666666666666666
A2279: 118 | B2279: 1 | C2279: Tuesday | D2279: 2 | E2279: 12pm-1pm | F2279: 4 | G2279: 2 | H2279: 6 | I2279: 0 | J2279: =RC[-1]/RC[-2] -> 0
A2280: 118 | B2280: 1 | C2280: Tuesday | D2280: 2 | E2280: 1pm-2pm | F2280: 5 | G2280: 2 | H2280: 6 | I2280: 0 | J2280: =RC[-1]/RC[-2] -> 0
A2281: 118 | B2281: 1 | C2281: Tuesday | D2281: 2 | E2281: 2pm-3pm | F2281: 6 | G2281: 1 | H2281: 6 | I2281: 3 | J2281: =RC[-1]/RC[-2] -> 0.5
A2282: 118 | B2282: 1 | C2282: Tuesday | D2282: 2 | E2282: 3pm-4pm | F2282: 7 | G2282: 1 | H2282: 6 | I2282: 4 | J2282: =RC[-1]/RC[-2] -> 0.66666666666666663
A2283: 118 | B2283: 1 | C2283: Tuesday | D2283: 2 | E2283: 4pm-5pm | F2283: 8 | G2283: 1 | H2283: 6 | I2283: 1 | J2283: =RC[-1]/RC[-2] -> 0.16666666666666666
A2284: 118 | B2284: 1 | C2284: Wednesday | D2284: 3 | E2284: 9am-10am | F2284: 1 | G2284: 1 | H2284: 6 | I2284: 2 | J2284: =RC[-1]/RC[-2] -> 0.33333333333333331
A2285: 118 | B2285: 1 | C2285: Wednesday | D2285: 3 | E2285: 10am-11am | F2285: 2 | G2285: 1 | H2285: 6 | I2285: 4 | J2285: =RC[-1]/RC[-2] -> 0.66666666666666663
A2286: 118 | B2286: 1 | C2286: Wednesday | D2286: 3 | E2286: 11am-12pm | F2286: 3 | G2286: 1 | H2286: 6 | I2286: 3 | J2286: =RC[-1]/RC[-2] -> 0.5
A2287: 118 | B2287: 1 | C2287: Wednesday | D2287: 3 | E2287: 12pm-1pm | F2287: 4 | G2287: 2 | H2287: 6 | I2287: 0 | J2287: =RC[-1]/RC[-2] -> 0
A2288: 118 | B2288: 1 | C2288: Wednesday | D2288: 3 | E2288: 1pm-2pm | F2288: 5 | G2288: 1 | H2288: 6 | I2288: 1 | J2288: =RC[-1]/RC[-2] -> 0.16666666666666666
A2289: 118 | B2289: 1 | C2289: Wednesday | D2289: 3 | E2289: 2pm-3pm | F2289: 6 | G2289: 2 | H2289: 6 | I2289: 0 | J2289: =RC[-1]/RC[-2] -> 0
A2290: 118 | B2290: 1 | C2290: Wednesday | D2290: 3 | E2290: 3pm-4pm | F2290: 7 | G2290: 1 | H2290: 6 | I2290: 1 | J2290: =RC[-1]/RC[-2] -> 0.16666666666666666
A2291: 118 | B2291: 1 | C2291: Wednesday | D2291: 3 | E2291: 4pm-5pm | F2291: 8 | G2291: 1 | H2291: 6 | I2291: 4 | J2291: =RC[-1]/RC[-2] -> 0.66666666666666663
A2292: 118 | B2292: 1 | C2292: Thursday | D2292: 4 | E2292: 9am-10am | F2292: 1 | G2292: 2 | H2292: 6 | I2292: 0 | J2292: =RC[-1]/RC[-2] -> 0
A2293: 118 | B2293: 1 | C2293: Thursday | D2293: 4 | E2293: 10am-11am | F2293: 2 | G2293: 2 | H2293: 6 | I2293: 0 | J2293: =RC[-1]/RC[-2] -> 0
A2294: 118 | B2294: 1 | C2294: Thursday | D2294: 4 | E2294: 11am-12pm | F2294: 3 | G2294: 1 | H2294: 6 | I2294: 1 | J2294: =RC[-1]/RC[-2] -> 0.16666666666666666
A2295: 118 | B2295: 1 | C2295: Thursday | D2295: 4 | E2295: 12pm-1pm | F2295: 4 | G2295: 1 | H2295: 6 | I2295: 1 | J2295: =RC[-1]/RC[-2] -> 0.16666666666666666
A2296: 118 | B2296: 1 | C2296: Thursday | D2296: 4 | E2296: 1pm-2pm | F2296: 5 | G2296: 1 | H2296: 6 | I2296: 1 | J2296: =RC[-1]/RC[-2] -> 0.16666666666666666
A2297: 118 | B2297: 1 | C2297: Thursday | D2297: 4 | E2297: 2pm-3pm | F2297: 6 | G2297: 1 | H2297: 6 | I2297: 1 | J2297: =RC[-1]/RC[-2] -> 0.16666666666666666
A2298: 118 | B2298: 1 | C2298: Thursday | D2298: 4 | E2298: 3pm-4pm | F2298: 7 | G2298: 3 | H2298: 6 | I2298: 1 | J2298: =RC[-1]/RC[-2] -> 0.16666666666666666
A2299: 118 | B2299: 1 | C2299: Thursday | D2299: 4 | E2299: 4pm-5pm | F2299: 8 | G2299: 2 | H2299: 6 | I2299: 0 | J2299: =RC[-1]/RC[-2] -> 0
A2300: 118 | B2300: 1 | C2300: Friday | D2300: 5 | E2300: 9am-10am | F2300: 1 | G2300: 2 | H2300: 6 | I2300: 0 | J2300: =RC[-1]/RC[-2] -> 0
A2301: 118 | B2301: 1 | C2301: Friday | D2301: 5 | E2301: 10am-11am | F2301: 2 | G2301: 1 | H2301: 6 | I2301: 1 | J2301: =RC[-1]/RC[-2] -> 0.16666666666666666
A2302: 118 | B2302: 1 | C2302: Friday | D2302: 5 | E2302: 11am-12pm | F2302: 3 | G2302: 2 | H2302: 6 | I2302: 0 | J2302: =RC[-1]/RC[-2] -> 0
A2303: 118 | B2303: 1 | C2303: Friday | D2303: 5 | E2303: 12pm-1pm | F2303: 4 | G2303: 1 | H2303: 6 | I2303: 3 | J2303: =RC[-1]/RC[-2] -> 0.5
A2304: 118 | B2304: 1 | C2304: Friday | D2304: 5 | E2304: 1pm-2pm | F2304: 5 | G2304: 1 | H2304: 6 | I2304: 2 | J2304: =RC[-1]/RC[-2] -> 0.33333333333333331
A2305: 118 | B2305: 1 | C2305: Friday | D2305: 5 | E2305: 2pm-3pm | F2305: 6 | G2305: 2 | H2305: 6 | I2305: 0 | J2305: =RC[-1]/RC[-2] -> 0
A2306: 118 | B2306: 1 | C2306: Friday | D2306: 5 | E2306: 3pm-4pm | F2306: 7 | G2306: 2 | H2306: 6 | I2306: 0 | J2306: =RC[-1]/RC[-2] -> 0
A2307: 118 | B2307: 1 | C2307: Friday | D2307: 5 | E2307: 4pm-5pm | F2307: 8 | G2307: 1 | H2307: 6 | I2307: 1 | J2307: =RC[-1]/RC[-2] -> 0.16666666666666666
A2308: 119 | B2308: 1 | C2308: Monday | D2308: 1 | E2308: 9am-10am | F2308: 1 | G2308: 1 | H2308: 20 | I2308: 20 | J2308: =RC[-1]/RC[-2] -> 1
A2309: 119 | B2309: 1 | C2309: Monday | D2309: 1 | E2309: 10am-11am | F2309: 2 | G2309: 1 | H2309: 20 | I2309: 20 | J2309: =RC[-1]/RC[-2] -> 1
A2310: 119 | B2310: 1 | C2310: Monday | D2310: 1 | E2310: 11am-12pm | F2310: 3 | G2310: 1 | H2310: 20 | I2310: 7 | J2310: =RC[-1]/RC[-2] -> 0.35
A2311: 119 | B2311: 1 | C2311: Monday | D2311: 1 | E2311: 12pm-1pm | F2311: 4 | G2311: 2 | H2311: 20 | I2311: 0 | J2311: =RC[-1]/RC[-2] -> 0
A2312: 119 | B2312: 1 | C2312: Monday | D2312: 1 | E2312: 1pm-2pm | F2312: 5 | G2312: 2 | H2312: 20 | I2312: 0 | J2312: =RC[-1]/RC[-2] -> 0
A2313: 119 | B2313: 1 | C2313: Monday | D2313: 1 | E2313: 2pm-3pm | F2313: 6 | G2313: 2 | H2313: 20 | I2313: 0 | J2313: =RC[-1]/RC[-2] -> 0
A2314: 119 | B2314: 1 | C2314: Monday | D2314: 1 | E2314: 3pm-4pm | F2314: 7 | G2314: 2 | H2314: 20 | I2314: 0 | J2314: =RC[-1]/RC[-2] -> 0
A2315: 119 | B2315: 1 | C2315: Monday | D2315: 1 | E2315: 4pm-5pm | F2315: 8 | G2315: 1 | H2315: 20 | I2315: 1 | J2315: =RC[-1]/RC[-2] -> 0.05
A2316: 119 | B2316: 1 | C2316: Tuesday | D2316: 2 | E2316: 9am-10am | F2316: 1 | G2316: 2 | H2316: 20 | I2316: 0 | J2316: =RC[-1]/RC[-2] -> 0
A2317: 119 | B2317: 1 | C2317: Tuesday | D2317: 2 | E2317: 10am-11am | F2317: 2 | G2317: 1 | H2317: 20 | I2317: 1 | J2317: =RC[-1]/RC[-2] -> 0.05
A2318: 119 | B2318: 1 | C2318: Tuesday | D2318: 2 | E2318: 11am-12pm | F2318: 3 | G2318: 2 | H2318: 20 | I2318: 0 | J2318: =RC[-1]/RC[-2] -> 0
A2319: 119 | B2319: 1 | C2319: Tuesday | D2319: 2 | E2319: 12pm-1pm | F2319: 4 | G2319: 2 | H2319: 20 | I2319: 0 | J2319: =RC[-1]/RC[-2] -> 0
A2320: 119 | B2320: 1 | C2320: Tuesday | D2320: 2 | E2320: 1pm-2pm | F2320: 5 | G2320: 2 | H2320: 20 | I2320: 0 | J2320: =RC[-1]/RC[-2] -> 0
A2321: 119 | B2321: 1 | C2321: Tuesday | D2321: 2 | E2321: 2pm-3pm | F2321: 6 | G2321: 2 | H2321: 20 | I2321: 0 | J2321: =RC[-1]/RC[-2] -> 0
A2322: 119 | B2322: 1 | C2322: Tuesday | D2322: 2 | E2322: 3pm-4pm | F2322: 7 | G2322: 2 | H2322: 20 | I2322: 0 | J2322: =RC[-1]/RC[-2] -> 0
A2323: 119 | B2323: 1 | C2323: Tuesday | D2323: 2 | E2323: 4pm-5pm | F2323: 8 | G2323: 2 | H2323: 20 | I2323: 0 | J2323: =RC[-1]/RC[-2] -> 0
A2324: 119 | B2324: 1 | C2324: Wednesday | D2324: 3 | E2324: 9am-10am | F2324: 1 | G2324: 2 | H2324: 20 | I2324: 0 | J2324: =RC[-1]/RC[-2] -> 0
A2325: 119 | B2325: 1 | C2325: Wednesday | D2325: 3 | E2325: 10am-11am | F2325: 2 | G2325: 1 | H2325: 20 | I2325: 25 | J2325: =RC[-1]/RC[-2] -> 1.25
A2326: 119 | B2326: 1 | C2326: Wednesday | D2326: 3 | E2326: 11am-12pm | F2326: 3 | G2326: 2 | H2326: 20 | I2326: 0 | J2326: =RC[-1]/RC[-2] -> 0
A2327: 119 | B2327: 1 | C2327: Wednesday | D2327: 3 | E2327: 12pm-1pm | F2327: 4 | G2327: 2 | H2327: 20 | I2327: 0 | J2327: =RC[-1]/RC[-2] -> 0
A2328: 119 | B2328: 1 | C2328: Wednesday | D2328: 3 | E2328: 1pm-2pm | F2328: 5 | G2328: 2 | H2328: 20 | I2328: 0 | J2328: =RC[-1]/RC[-2] -> 0
A2329: 119 | B2329: 1 | C2329: Wednesday | D2329: 3 | E2329: 2pm-3pm | F2329: 6 | G2329: 2 | H2329: 20 | I2329: 0 | J2329: =RC[-1]/RC[-2] -> 0
A2330: 119 | B2330: 1 | C2330: Wednesday | D2330: 3 | E2330: 3pm-4pm | F2330: 7 | G2330: 2 | H2330: 20 | I2330: 0 | J2330: =RC[-1]/RC[-2] -> 0
A2331: 119 | B2331: 1 | C2331: Wednesday | D2331: 3 | E2331: 4pm-5pm | F2331: 8 | G2331: 2 | H2331: 20 | I2331: 0 | J2331: =RC[-1]/RC[-2] -> 0
A2332: 119 | B2332: 1 | C2332: Thursday | D2332: 4 | E2332: 9am-10am | F2332: 1 | G2332: 2 | H2332: 20 | I2332: 0 | J2332: =RC[-1]/RC[-2] -> 0
A2333: 119 | B2333: 1 | C2333: Thursday | D2333: 4 | E2333: 10am-11am | F2333: 2 | G2333: 2 | H2333: 20 | I2333: 0 | J2333: =RC[-1]/RC[-2] -> 0
A2334: 119 | B2334: 1 | C2334: Thursday | D2334: 4 | E2334: 11am-12pm | F2334: 3 | G2334: 2 | H2334: 20 | I2334: 0 | J2334: =RC[-1]/RC[-2] -> 0
A2335: 119 | B2335: 1 | C2335: Thursday | D2335: 4 | E2335: 12pm-1pm | F2335: 4 | G2335: 2 | H2335: 20 | I2335: 0 | J2335: =RC[-1]/RC[-2] -> 0
A2336: 119 | B2336: 1 | C2336: Thursday | D2336: 4 | E2336: 1pm-2pm | F2336: 5 | G2336: 2 | H2336: 20 | I2336: 0 | J2336: =RC[-1]/RC[-2] -> 0
A2337: 119 | B2337: 1 | C2337: Thursday | D2337: 4 | E2337: 2pm-3pm | F2337: 6 | G2337: 1 | H2337: 20 | I2337: 18 | J2337: =RC[-1]/RC[-2] -> 0.9
A2338: 119 | B2338: 1 | C2338: Thursday | D2338: 4 | E2338: 3pm-4pm | F2338: 7 | G2338: 1 | H2338: 20 | I2338: 8 | J2338: =RC[-1]/RC[-2] -> 0.4
A2339: 119 | B2339: 1 | C2339: Thursday | D2339: 4 | E2339: 4pm-5pm | F2339: 8 | G2339: 2 | H2339: 20 | I2339: 0 | J2339: =RC[-1]/RC[-2] -> 0
A2340: 119 | B2340: 1 | C2340: Friday | D2340: 5 | E2340: 9am-10am | F2340: 1 | G2340: 2 | H2340: 20 | I2340: 0 | J2340: =RC[-1]/RC[-2] -> 0
A2341: 119 | B2341: 1 | C2341: Friday | D2341: 5 | E2341: 10am-11am | F2341: 2 | G2341: 2 | H2341: 20 | I2341: 0 | J2341: =RC[-1]/RC[-2] -> 0
A2342: 119 | B2342: 1 | C2342: Friday | D2342: 5 | E2342: 11am-12pm | F2342: 3 | G2342: 2 | H2342: 20 | I2342: 0 | J2342: =RC[-1]/RC[-2] -> 0
A2343: 119 | B2343: 1 | C2343: Friday | D2343: 5 | E2343: 12pm-1pm | F2343: 4 | G2343: 2 | H2343: 20 | I2343: 0 | J2343: =RC[-1]/RC[-2] -> 0
A2344: 119 | B2344: 1 | C2344: Friday | D2344: 5 | E2344: 1pm-2pm | F2344: 5 | G2344: 2 | H2344: 20 | I2344: 0 | J2344: =RC[-1]/RC[-2] -> 0
A2345: 119 | B2345: 1 | C2345: Friday | D2345: 5 | E2345: 2pm-3pm | F2345: 6 | G2345: 2 | H2345: 20 | I2345: 0 | J2345: =RC[-1]/RC[-2] -> 0
A2346: 119 | B2346: 1 | C2346: Friday | D2346: 5 | E2346: 3pm-4pm | F2346: 7 | G2346: 2 | H2346: 20 | I2346: 0 | J2346: =RC[-1]/RC[-2] -> 0
A2347: 119 | B2347: 1 | C2347: Friday | D2347: 5 | E2347: 4pm-5pm | F2347: 8 | G2347: 2 | H2347: 20 | I2347: 0 | J2347: =RC[-1]/RC[-2] -> 0
A2348: 124 | B2348: 1 | C2348: Monday | D2348: 1 | E2348: 9am-10am | F2348: 1 | G2348: 2 | H2348: 44 | I2348: 0 | J2348: =RC[-1]/RC[-2] -> 0
A2349: 124 | B2349: 1 | C2349: Monday | D2349: 1 | E2349: 10am-11am | F2349: 2 | G2349: 3 | H2349: 44 | I2349: 1 | J2349: =RC[-1]/RC[-2] -> 2.2727272727272728E-2
A2350: 124 | B2350: 1 | C2350: Monday | D2350: 1 | E2350: 11am-12pm | F2350: 3 | G2350: 2 | H2350: 44 | I2350: 0 | J2350: =RC[-1]/RC[-2] -> 0
A2351: 124 | B2351: 1 | C2351: Monday | D2351: 1 | E2351: 12pm-1pm | F2351: 4 | G2351: 2 | H2351: 44 | I2351: 0 | J2351: =RC[-1]/RC[-2] -> 0
A2352: 124 | B2352: 1 | C2352: Monday | D2352: 1 | E2352: 1pm-2pm | F2352: 5 | G2352: 1 | H2352: 44 | I2352: 16 | J2352: =RC[-1]/RC[-2] -> 0.36363636363636365
A2353: 124 | B2353: 1 | C2353: Monday | D2353: 1 | E2353: 2pm-3pm | F2353: 6 | G2353: 1 | H2353: 44 | I2353: 16 | J2353: =RC[-1]/RC[-2] -> 0.36363636363636365
A2354: 124 | B2354: 1 | C2354: Monday | D2354: 1 | E2354: 3pm-4pm | F2354: 7 | G2354: 1 | H2354: 44 | I2354: 18 | J2354: =RC[-1]/RC[-2] -> 0.40909090909090912
A2355: 124 | B2355: 1 | C2355: Monday | D2355: 1 | E2355: 4pm-5pm | F2355: 8 | G2355: 1 | H2355: 44 | I2355: 17 | J2355: =RC[-1]/RC[-2] -> 0.38636363636363635
A2356: 124 | B2356: 1 | C2356: Tuesday | D2356: 2 | E2356: 9am-10am | F2356: 1 | G2356: 2 | H2356: 44 | I2356: 0 | J2356: =RC[-1]/RC[-2] -> 0
A2357: 124 | B2357: 1 | C2357: Tuesday | D2357: 2 | E2357: 10am-11am | F2357: 2 | G2357: 2 | H2357: 44 | I2357: 0 | J2357: =RC[-1]/RC[-2] -> 0
A2358: 124 | B2358: 1 | C2358: Tuesday | D2358: 2 | E2358: 11am-12pm | F2358: 3 | G2358: 2 | H2358: 44 | I2358: 0 | J2358: =RC[-1]/RC[-2] -> 0
A2359: 124 | B2359: 1 | C2359: Tuesday | D2359: 2 | E2359: 12pm-1pm | F2359: 4 | G2359: 2 | H2359: 44 | I2359: 0 | J2359: =RC[-1]/RC[-2] -> 0
A2360: 124 | B2360: 1 | C2360: Tuesday | D2360: 2 | E2360: 1pm-2pm | F2360: 5 | G2360: 2 | H2360: 44 | I2360: 0 | J2360: =RC[-1]/RC[-2] -> 0
A2361: 124 | B2361: 1 | C2361: Tuesday | D2361: 2 | E2361: 2pm-3pm | F2361: 6 | G2361: 1 | H2361: 44 | I2361: 18 | J2361: =RC[-1]/RC[-2] -> 0.40909090909090912
A2362: 124 | B2362: 1 | C2362: Tuesday | D2362: 2 | E2362: 3pm-4pm | F2362: 7 | G2362: 1 | H2362: 44 | I2362: 17 | J2362: =RC[-1]/RC[-2] -> 0.38636363636363635
A2363: 124 | B2363: 1 | C2363: Tuesday | D2363: 2 | E2363: 4pm-5pm | F2363: 8 | G2363: 1 | H2363: 44 | I2363: 16 | J2363: =RC[-1]/RC[-2] -> 0.36363636363636365
A2364: 124 | B2364: 1 | C2364: Wednesday | D2364: 3 | E2364: 9am-10am | F2364: 1 | G2364: 2 | H2364: 44 | I2364: 0 | J2364: =RC[-1]/RC[-2] -> 0
A2365: 124 | B2365: 1 | C2365: Wednesday | D2365: 3 | E2365: 10am-11am | F2365: 2 | G2365: 2 | H2365: 44 | I2365: 0 | J2365: =RC[-1]/RC[-2] -> 0
A2366: 124 | B2366: 1 | C2366: Wednesday | D2366: 3 | E2366: 11am-12pm | F2366: 3 | G2366: 2 | H2366: 44 | I2366: 0 | J2366: =RC[-1]/RC[-2] -> 0
A2367: 124 | B2367: 1 | C2367: Wednesday | D2367: 3 | E2367: 12pm-1pm | F2367: 4 | G2367: 1 | H2367: 44 | I2367: 2 | J2367: =RC[-1]/RC[-2] -> 4.5454545454545456E-2
A2368: 124 | B2368: 1 | C2368: Wednesday | D2368: 3 | E2368: 1pm-2pm | F2368: 5 | G2368: 1 | H2368: 44 | I2368: 3 | J2368: =RC[-1]/RC[-2] -> 6.8181818181818177E-2
A2369: 124 | B2369: 1 | C2369: Wednesday | D2369: 3 | E2369: 2pm-3pm | F2369: 6 | G2369: 2 | H2369: 44 | I2369: 0 | J2369: =RC[-1]/RC[-2] -> 0
A2370: 124 | B2370: 1 | C2370: Wednesday | D2370: 3 | E2370: 3pm-4pm | F2370: 7 | G2370: 2 | H2370: 44 | I2370: 0 | J2370: =RC[-1]/RC[-2] -> 0
A2371: 124 | B2371: 1 | C2371: Wednesday | D2371: 3 | E2371: 4pm-5pm | F2371: 8 | G2371: 2 | H2371: 44 | I2371: 0 | J2371: =RC[-1]/RC[-2] -> 0
A2372: 124 | B2372: 1 | C2372: Thursday | D2372: 4 | E2372: 9am-10am | F2372: 1 | G2372: 1 | H2372: 44 | I2372: 16 | J2372: =RC[-1]/RC[-2] -> 0.36363636363636365
A2373: 124 | B2373: 1 | C2373: Thursday | D2373: 4 | E2373: 10am-11am | F2373: 2 | G2373: 1 | H2373: 44 | I2373: 16 | J2373: =RC[-1]/RC[-2] -> 0.36363636363636365
A2374: 124 | B2374: 1 | C2374: Thursday | D2374: 4 | E2374: 11am-12pm | F2374: 3 | G2374: 1 | H2374: 44 | I2374: 18 | J2374: =RC[-1]/RC[-2] -> 0.40909090909090912
A2375: 124 | B2375: 1 | C2375: Thursday | D2375: 4 | E2375: 12pm-1pm | F2375: 4 | G2375: 2 | H2375: 44 | I2375: 0 | J2375: =RC[-1]/RC[-2] -> 0
A2376: 124 | B2376: 1 | C2376: Thursday | D2376: 4 | E2376: 1pm-2pm | F2376: 5 | G2376: 2 | H2376: 44 | I2376: 0 | J2376: =RC[-1]/RC[-2] -> 0
A2377: 124 | B2377: 1 | C2377: Thursday | D2377: 4 | E2377: 2pm-3pm | F2377: 6 | G2377: 1 | H2377: 44 | I2377: 14 | J2377: =RC[-1]/RC[-2] -> 0.31818181818181818
A2378: 124 | B2378: 1 | C2378: Thursday | D2378: 4 | E2378: 3pm-4pm | F2378: 7 | G2378: 1 | H2378: 44 | I2378: 15 | J2378: =RC[-1]/RC[-2] -> 0.34090909090909088
A2379: 124 | B2379: 1 | C2379: Thursday | D2379: 4 | E2379: 4pm-5pm | F2379: 8 | G2379: 1 | H2379: 44 | I2379: 15 | J2379: =RC[-1]/RC[-2] -> 0.34090909090909088
A2380: 124 | B2380: 1 | C2380: Friday | D2380: 5 | E2380: 9am-10am | F2380: 1 | G2380: 1 | H2380: 44 | I2380: 15 | J2380: =RC[-1]/RC[-2] -> 0.34090909090909088
A2381: 124 | B2381: 1 | C2381: Friday | D2381: 5 | E2381: 10am-11am | F2381: 2 | G2381: 2 | H2381: 44 | I2381: 0 | J2381: =RC[-1]/RC[-2] -> 0
A2382: 124 | B2382: 1 | C2382: Friday | D2382: 5 | E2382: 11am-12pm | F2382: 3 | G2382: 1 | H2382: 44 | I2382: 1 | J2382: =RC[-1]/RC[-2] -> 2.2727272727272728E-2
A2383: 124 | B2383: 1 | C2383: Friday | D2383: 5 | E2383: 12pm-1pm | F2383: 4 | G2383: 2 | H2383: 44 | I2383: 0 | J2383: =RC[-1]/RC[-2] -> 0
A2384: 124 | B2384: 1 | C2384: Friday | D2384: 5 | E2384: 1pm-2pm | F2384: 5 | G2384: 2 | H2384: 44 | I2384: 0 | J2384: =RC[-1]/RC[-2] -> 0
A2385: 124 | B2385: 1 | C2385: Friday | D2385: 5 | E2385: 2pm-3pm | F2385: 6 | G2385: 1 | H2385: 44 | I2385: 18 | J2385: =RC[-1]/RC[-2] -> 0.40909090909090912
A2386: 124 | B2386: 1 | C2386: Friday | D2386: 5 | E2386: 3pm-4pm | F2386: 7 | G2386: 1 | H2386: 44 | I2386: 18 | J2386: =RC[-1]/RC[-2] -> 0.40909090909090912
A2387: 124 | B2387: 1 | C2387: Friday | D2387: 5 | E2387: 4pm-5pm | F2387: 8 | G2387: 1 | H2387: 44 | I2387: 18 | J2387: =RC[-1]/RC[-2] -> 0.40909090909090912
A2388: 207 | B2388: 1 | C2388: Monday | D2388: 1 | E2388: 9am-10am | F2388: 1 | G2388: 1 | H2388: 4 | I2388: 2 | J2388: =RC[-1]/RC[-2] -> 0.5
A2389: 207 | B2389: 1 | C2389: Monday | D2389: 1 | E2389: 10am-11am | F2389: 2 | G2389: 2 | H2389: 4 | I2389: 0 | J2389: =RC[-1]/RC[-2] -> 0
A2390: 207 | B2390: 1 | C2390: Monday | D2390: 1 | E2390: 11am-12pm | F2390: 3 | G2390: 2 | H2390: 4 | I2390: 0 | J2390: =RC[-1]/RC[-2] -> 0
A2391: 207 | B2391: 1 | C2391: Monday | D2391: 1 | E2391: 12pm-1pm | F2391: 4 | G2391: 2 | H2391: 4 | I2391: 0 | J2391: =RC[-1]/RC[-2] -> 0
A2392: 207 | B2392: 1 | C2392: Monday | D2392: 1 | E2392: 1pm-2pm | F2392: 5 | G2392: 2 | H2392: 4 | I2392: 0 | J2392: =RC[-1]/RC[-2] -> 0
A2393: 207 | B2393: 1 | C2393: Monday | D2393: 1 | E2393: 2pm-3pm | F2393: 6 | G2393: 2 | H2393: 4 | I2393: 0 | J2393: =RC[-1]/RC[-2] -> 0
A2394: 207 | B2394: 1 | C2394: Monday | D2394: 1 | E2394: 3pm-4pm | F2394: 7 | G2394: 1 | H2394: 4 | I2394: 1 | J2394: =RC[-1]/RC[-2] -> 0.25
A2395: 207 | B2395: 1 | C2395: Monday | D2395: 1 | E2395: 4pm-5pm | F2395: 8 | G2395: 3 | H2395: 4 | I2395: 1 | J2395: =RC[-1]/RC[-2] -> 0.25
A2396: 207 | B2396: 1 | C2396: Tuesday | D2396: 2 | E2396: 9am-10am | F2396: 1 | G2396: 2 | H2396: 4 | I2396: 0 | J2396: =RC[-1]/RC[-2] -> 0
A2397: 207 | B2397: 1 | C2397: Tuesday | D2397: 2 | E2397: 10am-11am | F2397: 2 | G2397: 2 | H2397: 4 | I2397: 0 | J2397: =RC[-1]/RC[-2] -> 0
A2398: 207 | B2398: 1 | C2398: Tuesday | D2398: 2 | E2398: 11am-12pm | F2398: 3 | G2398: 2 | H2398: 4 | I2398: 0 | J2398: =RC[-1]/RC[-2] -> 0
A2399: 207 | B2399: 1 | C2399: Tuesday | D2399: 2 | E2399: 12pm-1pm | F2399: 4 | G2399: 2 | H2399: 4 | I2399: 0 | J2399: =RC[-1]/RC[-2] -> 0
A2400: 207 | B2400: 1 | C2400: Tuesday | D2400: 2 | E2400: 1pm-2pm | F2400: 5 | G2400: 2 | H2400: 4 | I2400: 0 | J2400: =RC[-1]/RC[-2] -> 0
A2401: 207 | B2401: 1 | C2401: Tuesday | D2401: 2 | E2401: 2pm-3pm | F2401: 6 | G2401: 2 | H2401: 4 | I2401: 0 | J2401: =RC[-1]/RC[-2] -> 0
A2402: 207 | B2402: 1 | C2402: Tuesday | D2402: 2 | E2402: 3pm-4pm | F2402: 7 | G2402: 2 | H2402: 4 | I2402: 0 | J2402: =RC[-1]/RC[-2] -> 0
A2403: 207 | B2403: 1 | C2403: Tuesday | D2403: 2 | E2403: 4pm-5pm | F2403: 8 | G2403: 2 | H2403: 4 | I2403: 0 | J2403: =RC[-1]/RC[-2] -> 0
A2404: 207 | B2404: 1 | C2404: Wednesday | D2404: 3 | E2404: 9am-10am | F2404: 1 | G2404: 2 | H2404: 4 | I2404: 0 | J2404: =RC[-1]/RC[-2] -> 0
A2405: 207 | B2405: 1 | C2405: Wednesday | D2405: 3 | E2405: 10am-11am | F2405: 2 | G2405: 2 | H2405: 4 | I2405: 0 | J2405: =RC[-1]/RC[-2] -> 0
A2406: 207 | B2406: 1 | C2406: Wednesday | D2406: 3 | E2406: 11am-12pm | F2406: 3 | G2406: 2 | H2406: 4 | I2406: 0 | J2406: =RC[-1]/RC[-2] -> 0
A2407: 207 | B2407: 1 | C2407: Wednesday | D2407: 3 | E2407: 12pm-1pm | F2407: 4 | G2407: 2 | H2407: 4 | I2407: 0 | J2407: =RC[-1]/RC[-2] -> 0
A2408: 207 | B2408: 1 | C2408: Wednesday | D2408: 3 | E2408: 1pm-2pm | F2408: 5 | G2408: 2 | H2408: 4 | I2408: 0 | J2408: =RC[-1]/RC[-2] -> 0
A2409: 207 | B2409: 1 | C2409: Wednesday | D2409: 3 | E2409: 2pm-3pm | F2409: 6 | G2409: 3 | H2409: 4 | I2409: 1 | J2409: =RC[-1]/RC[-2] -> 0.25
A2410: 207 | B2410: 1 | C2410: Wednesday | D2410: 3 | E2410: 3pm-4pm | F2410: 7 | G2410: 1 | H2410: 4 | I2410: 1 | J2410: =RC[-1]/RC[-2] -> 0.25
A2411: 207 | B2411: 1 | C2411: Wednesday | D2411: 3 | E2411: 4pm-5pm | F2411: 8 | G2411: 2 | H2411: 4 | I2411: 0 | J2411: =RC[-1]/RC[-2] -> 0
A2412: 207 | B2412: 1 | C2412: Thursday | D2412: 4 | E2412: 9am-10am | F2412: 1 | G2412: 2 | H2412: 4 | I2412: 0 | J2412: =RC[-1]/RC[-2] -> 0
A2413: 207 | B2413: 1 | C2413: Thursday | D2413: 4 | E2413: 10am-11am | F2413: 2 | G2413: 2 | H2413: 4 | I2413: 0 | J2413: =RC[-1]/RC[-2] -> 0
A2414: 207 | B2414: 1 | C2414: Thursday | D2414: 4 | E2414: 11am-12pm | F2414: 3 | G2414: 2 | H2414: 4 | I2414: 0 | J2414: =RC[-1]/RC[-2] -> 0
A2415: 207 | B2415: 1 | C2415: Thursday | D2415: 4 | E2415: 12pm-1pm | F2415: 4 | G2415: 2 | H2415: 4 | I2415: 0 | J2415: =RC[-1]/RC[-2] -> 0
A2416: 207 | B2416: 1 | C2416: Thursday | D2416: 4 | E2416: 1pm-2pm | F2416: 5 | G2416: 2 | H2416: 4 | I2416: 0 | J2416: =RC[-1]/RC[-2] -> 0
A2417: 207 | B2417: 1 | C2417: Thursday | D2417: 4 | E2417: 2pm-3pm | F2417: 6 | G2417: 2 | H2417: 4 | I2417: 0 | J2417: =RC[-1]/RC[-2] -> 0
A2418: 207 | B2418: 1 | C2418: Thursday | D2418: 4 | E2418: 3pm-4pm | F2418: 7 | G2418: 2 | H2418: 4 | I2418: 0 | J2418: =RC[-1]/RC[-2] -> 0
A2419: 207 | B2419: 1 | C2419: Thursday | D2419: 4 | E2419: 4pm-5pm | F2419: 8 | G2419: 2 | H2419: 4 | I2419: 0 | J2419: =RC[-1]/RC[-2] -> 0
A2420: 207 | B2420: 1 | C2420: Friday | D2420: 5 | E2420: 9am-10am | F2420: 1 | G2420: 2 | H2420: 4 | I2420: 0 | J2420: =RC[-1]/RC[-2] -> 0
A2421: 207 | B2421: 1 | C2421: Friday | D2421: 5 | E2421: 10am-11am | F2421: 2 | G2421: 2 | H2421: 4 | I2421: 0 | J2421: =RC[-1]/RC[-2] -> 0
A2422: 207 | B2422: 1 | C2422: Friday | D2422: 5 | E2422: 11am-12pm | F2422: 3 | G2422: 2 | H2422: 4 | I2422: 0 | J2422: =RC[-1]/RC[-2] -> 0
A2423: 207 | B2423: 1 | C2423: Friday | D2423: 5 | E2423: 12pm-1pm | F2423: 4 | G2423: 2 | H2423: 4 | I2423: 0 | J2423: =RC[-1]/RC[-2] -> 0
A2424: 207 | B2424: 1 | C2424: Friday | D2424: 5 | E2424: 1pm-2pm | F2424: 5 | G2424: 2 | H2424: 4 | I2424: 0 | J2424: =RC[-1]/RC[-2] -> 0
A2425: 207 | B2425: 1 | C2425: Friday | D2425: 5 | E2425: 2pm-3pm | F2425: 6 | G2425: 2 | H2425: 4 | I2425: 0 | J2425: =RC[-1]/RC[-2] -> 0
A2426: 207 | B2426: 1 | C2426: Friday | D2426: 5 | E2426: 3pm-4pm | F2426: 7 | G2426: 2 | H2426: 4 | I2426: 0 | J2426: =RC[-1]/RC[-2] -> 0
A2427: 207 | B2427: 1 | C2427: Friday | D2427: 5 | E2427: 4pm-5pm | F2427: 8 | G2427: 2 | H2427: 4 | I2427: 0 | J2427: =RC[-1]/RC[-2] -> 0
A2428: 208 | B2428: 1 | C2428: Monday | D2428: 1 | E2428: 9am-10am | F2428: 1 | G2428: 3 | H2428: 4 | I2428: 1 | J2428: =RC[-1]/RC[-2] -> 0.25
A2429: 208 | B2429: 1 | C2429: Monday | D2429: 1 | E2429: 10am-11am | F2429: 2 | G2429: 2 | H2429: 4 | I2429: 0 | J2429: =RC[-1]/RC[-2] -> 0
A2430: 208 | B2430: 1 | C2430: Monday | D2430: 1 | E2430: 11am-12pm | F2430: 3 | G2430: 2 | H2430: 4 | I2430: 0 | J2430: =RC[-1]/RC[-2] -> 0
A2431: 208 | B2431: 1 | C2431: Monday | D2431: 1 | E2431: 12pm-1pm | F2431: 4 | G2431: 2 | H2431: 4 | I2431: 0 | J2431: =RC[-1]/RC[-2] -> 0
A2432: 208 | B2432: 1 | C2432: Monday | D2432: 1 | E2432: 1pm-2pm | F2432: 5 | G2432: 2 | H2432: 4 | I2432: 0 | J2432: =RC[-1]/RC[-2] -> 0
A2433: 208 | B2433: 1 | C2433: Monday | D2433: 1 | E2433: 2pm-3pm | F2433: 6 | G2433: 2 | H2433: 4 | I2433: 0 | J2433: =RC[-1]/RC[-2] -> 0
A2434: 208 | B2434: 1 | C2434: Monday | D2434: 1 | E2434: 3pm-4pm | F2434: 7 | G2434: 2 | H2434: 4 | I2434: 0 | J2434: =RC[-1]/RC[-2] -> 0
A2435: 208 | B2435: 1 | C2435: Monday | D2435: 1 | E2435: 4pm-5pm | F2435: 8 | G2435: 2 | H2435: 4 | I2435: 0 | J2435: =RC[-1]/RC[-2] -> 0
A2436: 208 | B2436: 1 | C2436: Tuesday | D2436: 2 | E2436: 9am-10am | F2436: 1 | G2436: 2 | H2436: 4 | I2436: 0 | J2436: =RC[-1]/RC[-2] -> 0
A2437: 208 | B2437: 1 | C2437: Tuesday | D2437: 2 | E2437: 10am-11am | F2437: 2 | G2437: 3 | H2437: 4 | I2437: 1 | J2437: =RC[-1]/RC[-2] -> 0.25
A2438: 208 | B2438: 1 | C2438: Tuesday | D2438: 2 | E2438: 11am-12pm | F2438: 3 | G2438: 2 | H2438: 4 | I2438: 0 | J2438: =RC[-1]/RC[-2] -> 0
A2439: 208 | B2439: 1 | C2439: Tuesday | D2439: 2 | E2439: 12pm-1pm | F2439: 4 | G2439: 3 | H2439: 4 | I2439: 1 | J2439: =RC[-1]/RC[-2] -> 0.25
A2440: 208 | B2440: 1 | C2440: Tuesday | D2440: 2 | E2440: 1pm-2pm | F2440: 5 | G2440: 2 | H2440: 4 | I2440: 0 | J2440: =RC[-1]/RC[-2] -> 0
A2441: 208 | B2441: 1 | C2441: Tuesday | D2441: 2 | E2441: 2pm-3pm | F2441: 6 | G2441: 2 | H2441: 4 | I2441: 0 | J2441: =RC[-1]/RC[-2] -> 0
A2442: 208 | B2442: 1 | C2442: Tuesday | D2442: 2 | E2442: 3pm-4pm | F2442: 7 | G2442: 2 | H2442: 4 | I2442: 0 | J2442: =RC[-1]/RC[-2] -> 0
A2443: 208 | B2443: 1 | C2443: Tuesday | D2443: 2 | E2443: 4pm-5pm | F2443: 8 | G2443: 2 | H2443: 4 | I2443: 0 | J2443: =RC[-1]/RC[-2] -> 0
A2444: 208 | B2444: 1 | C2444: Wednesday | D2444: 3 | E2444: 9am-10am | F2444: 1 | G2444: 3 | H2444: 4 | I2444: 2 | J2444: =RC[-1]/RC[-2] -> 0.5
A2445: 208 | B2445: 1 | C2445: Wednesday | D2445: 3 | E2445: 10am-11am | F2445: 2 | G2445: 3 | H2445: 4 | I2445: 1 | J2445: =RC[-1]/RC[-2] -> 0.25
A2446: 208 | B2446: 1 | C2446: Wednesday | D2446: 3 | E2446: 11am-12pm | F2446: 3 | G2446: 3 | H2446: 4 | I2446: 2 | J2446: =RC[-1]/RC[-2] -> 0.5
A2447: 208 | B2447: 1 | C2447: Wednesday | D2447: 3 | E2447: 12pm-1pm | F2447: 4 | G2447: 2 | H2447: 4 | I2447: 0 | J2447: =RC[-1]/RC[-2] -> 0
A2448: 208 | B2448: 1 | C2448: Wednesday | D2448: 3 | E2448: 1pm-2pm | F2448: 5 | G2448: 2 | H2448: 4 | I2448: 0 | J2448: =RC[-1]/RC[-2] -> 0
A2449: 208 | B2449: 1 | C2449: Wednesday | D2449: 3 | E2449: 2pm-3pm | F2449: 6 | G2449: 2 | H2449: 4 | I2449: 0 | J2449: =RC[-1]/RC[-2] -> 0
A2450: 208 | B2450: 1 | C2450: Wednesday | D2450: 3 | E2450: 3pm-4pm | F2450: 7 | G2450: 2 | H2450: 4 | I2450: 0 | J2450: =RC[-1]/RC[-2] -> 0
A2451: 208 | B2451: 1 | C2451: Wednesday | D2451: 3 | E2451: 4pm-5pm | F2451: 8 | G2451: 2 | H2451: 4 | I2451: 0 | J2451: =RC[-1]/RC[-2] -> 0
A2452: 208 | B2452: 1 | C2452: Thursday | D2452: 4 | E2452: 9am-10am | F2452: 1 | G2452: 3 | H2452: 4 | I2452: 1 | J2452: =RC[-1]/RC[-2] -> 0.25
A2453: 208 | B2453: 1 | C2453: Thursday | D2453: 4 | E2453: 10am-11am | F2453: 2 | G2453: 2 | H2453: 4 | I2453: 0 | J2453: =RC[-1]/RC[-2] -> 0
A2454: 208 | B2454: 1 | C2454: Thursday | D2454: 4 | E2454: 11am-12pm | F2454: 3 | G2454: 2 | H2454: 4 | I2454: 0 | J2454: =RC[-1]/RC[-2] -> 0
A2455: 208 | B2455: 1 | C2455: Thursday | D2455: 4 | E2455: 12pm-1pm | F2455: 4 | G2455: 2 | H2455: 4 | I2455: 0 | J2455: =RC[-1]/RC[-2] -> 0
A2456: 208 | B2456: 1 | C2456: Thursday | D2456: 4 | E2456: 1pm-2pm | F2456: 5 | G2456: 2 | H2456: 4 | I2456: 0 | J2456: =RC[-1]/RC[-2] -> 0
A2457: 208 | B2457: 1 | C2457: Thursday | D2457: 4 | E2457: 2pm-3pm | F2457: 6 | G2457: 2 | H2457: 4 | I2457: 0 | J2457: =RC[-1]/RC[-2] -> 0
A2458: 208 | B2458: 1 | C2458: Thursday | D2458: 4 | E2458: 3pm-4pm | F2458: 7 | G2458: 2 | H2458: 4 | I2458: 0 | J2458: =RC[-1]/RC[-2] -> 0
A2459: 208 | B2459: 1 | C2459: Thursday | D2459: 4 | E2459: 4pm-5pm | F2459: 8 | G2459: 2 | H2459: 4 | I2459: 0 | J2459: =RC[-1]/RC[-2] -> 0
A2460: 208 | B2460: 1 | C2460: Friday | D2460: 5 | E2460: 9am-10am | F2460: 1 | G2460: 2 | H2460: 4 | I2460: 0 | J2460: =RC[-1]/RC[-2] -> 0
A2461: 208 | B2461: 1 | C2461: Friday | D2461: 5 | E2461: 10am-11am | F2461: 2 | G2461: 1 | H2461: 4 | I2461: 1 | J2461: =RC[-1]/RC[-2] -> 0.25
A2462: 208 | B2462: 1 | C2462: Friday | D2462: 5 | E2462: 11am-12pm | F2462: 3 | G2462: 2 | H2462: 4 | I2462: 0 | J2462: =RC[-1]/RC[-2] -> 0
A2463: 208 | B2463: 1 | C2463: Friday | D2463: 5 | E2463: 12pm-1pm | F2463: 4 | G2463: 2 | H2463: 4 | I2463: 0 | J2463: =RC[-1]/RC[-2] -> 0
A2464: 208 | B2464: 1 | C2464: Friday | D2464: 5 | E2464: 1pm-2pm | F2464: 5 | G2464: 2 | H2464: 4 | I2464: 0 | J2464: =RC[-1]/RC[-2] -> 0
A2465: 208 | B2465: 1 | C2465: Friday | D2465: 5 | E2465: 2pm-3pm | F2465: 6 | G2465: 2 | H2465: 4 | I2465: 0 | J2465: =RC[-1]/RC[-2] -> 0
A2466: 208 | B2466: 1 | C2466: Friday | D2466: 5 | E2466: 3pm-4pm | F2466: 7 | G2466: 2 | H2466: 4 | I2466: 0 | J2466: =RC[-1]/RC[-2] -> 0
A2467: 208 | B2467: 1 | C2467: Friday | D2467: 5 | E2467: 4pm-5pm | F2467: 8 | G2467: 1 | H2467: 4 | I2467: 1 | J2467: =RC[-1]/RC[-2] -> 0.25
A2468: 209 | B2468: 1 | C2468: Monday | D2468: 1 | E2468: 9am-10am | F2468: 1 | G2468: 2 | H2468: 4 | I2468: 0 | J2468: =RC[-1]/RC[-2] -> 0
A2469: 209 | B2469: 1 | C2469: Monday | D2469: 1 | E2469: 10am-11am | F2469: 2 | G2469: 2 | H2469: 4 | I2469: 0 | J2469: =RC[-1]/RC[-2] -> 0
A2470: 209 | B2470: 1 | C2470: Monday | D2470: 1 | E2470: 11am-12pm | F2470: 3 | G2470: 2 | H2470: 4 | I2470: 0 | J2470: =RC[-1]/RC[-2] -> 0
A2471: 209 | B2471: 1 | C2471: Monday | D2471: 1 | E2471: 12pm-1pm | F2471: 4 | G2471: 2 | H2471: 4 | I2471: 0 | J2471: =RC[-1]/RC[-2] -> 0
A2472: 209 | B2472: 1 | C2472: Monday | D2472: 1 | E2472: 1pm-2pm | F2472: 5 | G2472: 3 | H2472: 4 | I2472: 1 | J2472: =RC[-1]/RC[-2] -> 0.25
A2473: 209 | B2473: 1 | C2473: Monday | D2473: 1 | E2473: 2pm-3pm | F2473: 6 | G2473: 2 | H2473: 4 | I2473: 0 | J2473: =RC[-1]/RC[-2] -> 0
A2474: 209 | B2474: 1 | C2474: Monday | D2474: 1 | E2474: 3pm-4pm | F2474: 7 | G2474: 2 | H2474: 4 | I2474: 0 | J2474: =RC[-1]/RC[-2] -> 0
A2475: 209 | B2475: 1 | C2475: Monday | D2475: 1 | E2475: 4pm-5pm | F2475: 8 | G2475: 1 | H2475: 4 | I2475: 7 | J2475: =RC[-1]/RC[-2] -> 1.75
A2476: 209 | B2476: 1 | C2476: Tuesday | D2476: 2 | E2476: 9am-10am | F2476: 1 | G2476: 2 | H2476: 4 | I2476: 0 | J2476: =RC[-1]/RC[-2] -> 0
A2477: 209 | B2477: 1 | C2477: Tuesday | D2477: 2 | E2477: 10am-11am | F2477: 2 | G2477: 2 | H2477: 4 | I2477: 0 | J2477: =RC[-1]/RC[-2] -> 0
A2478: 209 | B2478: 1 | C2478: Tuesday | D2478: 2 | E2478: 11am-12pm | F2478: 3 | G2478: 3 | H2478: 4 | I2478: 1 | J2478: =RC[-1]/RC[-2] -> 0.25
A2479: 209 | B2479: 1 | C2479: Tuesday | D2479: 2 | E2479: 12pm-1pm | F2479: 4 | G2479: 2 | H2479: 4 | I2479: 0 | J2479: =RC[-1]/RC[-2] -> 0
A2480: 209 | B2480: 1 | C2480: Tuesday | D2480: 2 | E2480: 1pm-2pm | F2480: 5 | G2480: 2 | H2480: 4 | I2480: 0 | J2480: =RC[-1]/RC[-2] -> 0
A2481: 209 | B2481: 1 | C2481: Tuesday | D2481: 2 | E2481: 2pm-3pm | F2481: 6 | G2481: 2 | H2481: 4 | I2481: 0 | J2481: =RC[-1]/RC[-2] -> 0
A2482: 209 | B2482: 1 | C2482: Tuesday | D2482: 2 | E2482: 3pm-4pm | F2482: 7 | G2482: 2 | H2482: 4 | I2482: 0 | J2482: =RC[-1]/RC[-2] -> 0
A2483: 209 | B2483: 1 | C2483: Tuesday | D2483: 2 | E2483: 4pm-5pm | F2483: 8 | G2483: 3 | H2483: 4 | I2483: 1 | J2483: =RC[-1]/RC[-2] -> 0.25
A2484: 209 | B2484: 1 | C2484: Wednesday | D2484: 3 | E2484: 9am-10am | F2484: 1 | G2484: 1 | H2484: 4 | I2484: 1 | J2484: =RC[-1]/RC[-2] -> 0.25
A2485: 209 | B2485: 1 | C2485: Wednesday | D2485: 3 | E2485: 10am-11am | F2485: 2 | G2485: 2 | H2485: 4 | I2485: 0 | J2485: =RC[-1]/RC[-2] -> 0
A2486: 209 | B2486: 1 | C2486: Wednesday | D2486: 3 | E2486: 11am-12pm | F2486: 3 | G2486: 2 | H2486: 4 | I2486: 0 | J2486: =RC[-1]/RC[-2] -> 0
A2487: 209 | B2487: 1 | C2487: Wednesday | D2487: 3 | E2487: 12pm-1pm | F2487: 4 | G2487: 2 | H2487: 4 | I2487: 0 | J2487: =RC[-1]/RC[-2] -> 0
A2488: 209 | B2488: 1 | C2488: Wednesday | D2488: 3 | E2488: 1pm-2pm | F2488: 5 | G2488: 1 | H2488: 4 | I2488: 1 | J2488: =RC[-1]/RC[-2] -> 0.25
A2489: 209 | B2489: 1 | C2489: Wednesday | D2489: 3 | E2489: 2pm-3pm | F2489: 6 | G2489: 1 | H2489: 4 | I2489: 1 | J2489: =RC[-1]/RC[-2] -> 0.25
A2490: 209 | B2490: 1 | C2490: Wednesday | D2490: 3 | E2490: 3pm-4pm | F2490: 7 | G2490: 2 | H2490: 4 | I2490: 0 | J2490: =RC[-1]/RC[-2] -> 0
A2491: 209 | B2491: 1 | C2491: Wednesday | D2491: 3 | E2491: 4pm-5pm | F2491: 8 | G2491: 2 | H2491: 4 | I2491: 0 | J2491: =RC[-1]/RC[-2] -> 0
A2492: 209 | B2492: 1 | C2492: Thursday | D2492: 4 | E2492: 9am-10am | F2492: 1 | G2492: 3 | H2492: 4 | I2492: 1 | J2492: =RC[-1]/RC[-2] -> 0.25
A2493: 209 | B2493: 1 | C2493: Thursday | D2493: 4 | E2493: 10am-11am | F2493: 2 | G2493: 2 | H2493: 4 | I2493: 0 | J2493: =RC[-1]/RC[-2] -> 0
A2494: 209 | B2494: 1 | C2494: Thursday | D2494: 4 | E2494: 11am-12pm | F2494: 3 | G2494: 2 | H2494: 4 | I2494: 0 | J2494: =RC[-1]/RC[-2] -> 0
A2495: 209 | B2495: 1 | C2495: Thursday | D2495: 4 | E2495: 12pm-1pm | F2495: 4 | G2495: 3 | H2495: 4 | I2495: 1 | J2495: =RC[-1]/RC[-2] -> 0.25
A2496: 209 | B2496: 1 | C2496: Thursday | D2496: 4 | E2496: 1pm-2pm | F2496: 5 | G2496: 2 | H2496: 4 | I2496: 0 | J2496: =RC[-1]/RC[-2] -> 0
A2497: 209 | B2497: 1 | C2497: Thursday | D2497: 4 | E2497: 2pm-3pm | F2497: 6 | G2497: 1 | H2497: 4 | I2497: 1 | J2497: =RC[-1]/RC[-2] -> 0.25
A2498: 209 | B2498: 1 | C2498: Thursday | D2498: 4 | E2498: 3pm-4pm | F2498: 7 | G2498: 1 | H2498: 4 | I2498: 1 | J2498: =RC[-1]/RC[-2] -> 0.25
A2499: 209 | B2499: 1 | C2499: Thursday | D2499: 4 | E2499: 4pm-5pm | F2499: 8 | G2499: 1 | H2499: 4 | I2499: 1 | J2499: =RC[-1]/RC[-2] -> 0.25
A2500: 209 | B2500: 1 | C2500: Friday | D2500: 5 | E2500: 9am-10am | F2500: 1 | G2500: 2 | H2500: 4 | I2500: 0 | J2500: =RC[-1]/RC[-2] -> 0
A2501: 209 | B2501: 1 | C2501: Friday | D2501: 5 | E2501: 10am-11am | F2501: 2 | G2501: 1 | H2501: 4 | I2501: 1 | J2501: =RC[-1]/RC[-2] -> 0.25
A2502: 209 | B2502: 1 | C2502: Friday | D2502: 5 | E2502: 11am-12pm | F2502: 3 | G2502: 2 | H2502: 4 | I2502: 0 | J2502: =RC[-1]/RC[-2] -> 0
A2503: 209 | B2503: 1 | C2503: Friday | D2503: 5 | E2503: 12pm-1pm | F2503: 4 | G2503: 2 | H2503: 4 | I2503: 0 | J2503: =RC[-1]/RC[-2] -> 0
A2504: 209 | B2504: 1 | C2504: Friday | D2504: 5 | E2504: 1pm-2pm | F2504: 5 | G2504: 2 | H2504: 4 | I2504: 0 | J2504: =RC[-1]/RC[-2] -> 0
A2505: 209 | B2505: 1 | C2505: Friday | D2505: 5 | E2505: 2pm-3pm | F2505: 6 | G2505: 2 | H2505: 4 | I2505: 0 | J2505: =RC[-1]/RC[-2] -> 0
A2506: 209 | B2506: 1 | C2506: Friday | D2506: 5 | E2506: 3pm-4pm | F2506: 7 | G2506: 2 | H2506: 4 | I2506: 0 | J2506: =RC[-1]/RC[-2] -> 0
A2507: 209 | B2507: 1 | C2507: Friday | D2507: 5 | E2507: 4pm-5pm | F2507: 8 | G2507: 1 | H2507: 4 | I2507: 1 | J2507: =RC[-1]/RC[-2] -> 0.25
A2508: 210 | B2508: 1 | C2508: Monday | D2508: 1 | E2508: 9am-10am | F2508: 1 | G2508: 2 | H2508: 3 | I2508: 0 | J2508: =RC[-1]/RC[-2] -> 0
A2509: 210 | B2509: 1 | C2509: Monday | D2509: 1 | E2509: 10am-11am | F2509: 2 | G2509: 2 | H2509: 3 | I2509: 0 | J2509: =RC[-1]/RC[-2] -> 0
A2510: 210 | B2510: 1 | C2510: Monday | D2510: 1 | E2510: 11am-12pm | F2510: 3 | G2510: 2 | H2510: 3 | I2510: 0 | J2510: =RC[-1]/RC[-2] -> 0
A2511: 210 | B2511: 1 | C2511: Monday | D2511: 1 | E2511: 12pm-1pm | F2511: 4 | G2511: 2 | H2511: 3 | I2511: 0 | J2511: =RC[-1]/RC[-2] -> 0
A2512: 210 | B2512: 1 | C2512: Monday | D2512: 1 | E2512: 1pm-2pm | F2512: 5 | G2512: 3 | H2512: 3 | I2512: 1 | J2512: =RC[-1]/RC[-2] -> 0.33333333333333331
A2513: 210 | B2513: 1 | C2513: Monday | D2513: 1 | E2513: 2pm-3pm | F2513: 6 | G2513: 2 | H2513: 3 | I2513: 0 | J2513: =RC[-1]/RC[-2] -> 0
A2514: 210 | B2514: 1 | C2514: Monday | D2514: 1 | E2514: 3pm-4pm | F2514: 7 | G2514: 1 | H2514: 3 | I2514: 2 | J2514: =RC[-1]/RC[-2] -> 0.66666666666666663
A2515: 210 | B2515: 1 | C2515: Monday | D2515: 1 | E2515: 4pm-5pm | F2515: 8 | G2515: 1 | H2515: 3 | I2515: 2 | J2515: =RC[-1]/RC[-2] -> 0.66666666666666663
A2516: 210 | B2516: 1 | C2516: Tuesday | D2516: 2 | E2516: 9am-10am | F2516: 1 | G2516: 3 | H2516: 3 | I2516: 1 | J2516: =RC[-1]/RC[-2] -> 0.33333333333333331
A2517: 210 | B2517: 1 | C2517: Tuesday | D2517: 2 | E2517: 10am-11am | F2517: 2 | G2517: 1 | H2517: 3 | I2517: 4 | J2517: =RC[-1]/RC[-2] -> 1.3333333333333333
A2518: 210 | B2518: 1 | C2518: Tuesday | D2518: 2 | E2518: 11am-12pm | F2518: 3 | G2518: 1 | H2518: 3 | I2518: 4 | J2518: =RC[-1]/RC[-2] -> 1.3333333333333333
A2519: 210 | B2519: 1 | C2519: Tuesday | D2519: 2 | E2519: 12pm-1pm | F2519: 4 | G2519: 1 | H2519: 3 | I2519: 3 | J2519: =RC[-1]/RC[-2] -> 1
A2520: 210 | B2520: 1 | C2520: Tuesday | D2520: 2 | E2520: 1pm-2pm | F2520: 5 | G2520: 2 | H2520: 3 | I2520: 0 | J2520: =RC[-1]/RC[-2] -> 0
A2521: 210 | B2521: 1 | C2521: Tuesday | D2521: 2 | E2521: 2pm-3pm | F2521: 6 | G2521: 2 | H2521: 3 | I2521: 0 | J2521: =RC[-1]/RC[-2] -> 0
A2522: 210 | B2522: 1 | C2522: Tuesday | D2522: 2 | E2522: 3pm-4pm | F2522: 7 | G2522: 1 | H2522: 3 | I2522: 2 | J2522: =RC[-1]/RC[-2] -> 0.66666666666666663
A2523: 210 | B2523: 1 | C2523: Tuesday | D2523: 2 | E2523: 4pm-5pm | F2523: 8 | G2523: 1 | H2523: 3 | I2523: 2 | J2523: =RC[-1]/RC[-2] -> 0.66666666666666663
A2524: 210 | B2524: 1 | C2524: Wednesday | D2524: 3 | E2524: 9am-10am | F2524: 1 | G2524: 1 | H2524: 3 | I2524: 1 | J2524: =RC[-1]/RC[-2] -> 0.33333333333333331
A2525: 210 | B2525: 1 | C2525: Wednesday | D2525: 3 | E2525: 10am-11am | F2525: 2 | G2525: 1 | H2525: 3 | I2525: 5 | J2525: =RC[-1]/RC[-2] -> 1.6666666666666667
A2526: 210 | B2526: 1 | C2526: Wednesday | D2526: 3 | E2526: 11am-12pm | F2526: 3 | G2526: 2 | H2526: 3 | I2526: 0 | J2526: =RC[-1]/RC[-2] -> 0
A2527: 210 | B2527: 1 | C2527: Wednesday | D2527: 3 | E2527: 12pm-1pm | F2527: 4 | G2527: 2 | H2527: 3 | I2527: 0 | J2527: =RC[-1]/RC[-2] -> 0
A2528: 210 | B2528: 1 | C2528: Wednesday | D2528: 3 | E2528: 1pm-2pm | F2528: 5 | G2528: 2 | H2528: 3 | I2528: 0 | J2528: =RC[-1]/RC[-2] -> 0
A2529: 210 | B2529: 1 | C2529: Wednesday | D2529: 3 | E2529: 2pm-3pm | F2529: 6 | G2529: 2 | H2529: 3 | I2529: 0 | J2529: =RC[-1]/RC[-2] -> 0
A2530: 210 | B2530: 1 | C2530: Wednesday | D2530: 3 | E2530: 3pm-4pm | F2530: 7 | G2530: 2 | H2530: 3 | I2530: 0 | J2530: =RC[-1]/RC[-2] -> 0
A2531: 210 | B2531: 1 | C2531: Wednesday | D2531: 3 | E2531: 4pm-5pm | F2531: 8 | G2531: 2 | H2531: 3 | I2531: 0 | J2531: =RC[-1]/RC[-2] -> 0
A2532: 210 | B2532: 1 | C2532: Thursday | D2532: 4 | E2532: 9am-10am | F2532: 1 | G2532: 2 | H2532: 3 | I2532: 0 | J2532: =RC[-1]/RC[-2] -> 0
A2533: 210 | B2533: 1 | C2533: Thursday | D2533: 4 | E2533: 10am-11am | F2533: 2 | G2533: 2 | H2533: 3 | I2533: 0 | J2533: =RC[-1]/RC[-2] -> 0
A2534: 210 | B2534: 1 | C2534: Thursday | D2534: 4 | E2534: 11am-12pm | F2534: 3 | G2534: 2 | H2534: 3 | I2534: 0 | J2534: =RC[-1]/RC[-2] -> 0
A2535: 210 | B2535: 1 | C2535: Thursday | D2535: 4 | E2535: 12pm-1pm | F2535: 4 | G2535: 2 | H2535: 3 | I2535: 0 | J2535: =RC[-1]/RC[-2] -> 0
A2536: 210 | B2536: 1 | C2536: Thursday | D2536: 4 | E2536: 1pm-2pm | F2536: 5 | G2536: 2 | H2536: 3 | I2536: 0 | J2536: =RC[-1]/RC[-2] -> 0
A2537: 210 | B2537: 1 | C2537: Thursday | D2537: 4 | E2537: 2pm-3pm | F2537: 6 | G2537: 2 | H2537: 3 | I2537: 0 | J2537: =RC[-1]/RC[-2] -> 0
A2538: 210 | B2538: 1 | C2538: Thursday | D2538: 4 | E2538: 3pm-4pm | F2538: 7 | G2538: 2 | H2538: 3 | I2538: 0 | J2538: =RC[-1]/RC[-2] -> 0
A2539: 210 | B2539: 1 | C2539: Thursday | D2539: 4 | E2539: 4pm-5pm | F2539: 8 | G2539: 2 | H2539: 3 | I2539: 0 | J2539: =RC[-1]/RC[-2] -> 0
A2540: 210 | B2540: 1 | C2540: Friday | D2540: 5 | E2540: 9am-10am | F2540: 1 | G2540: 2 | H2540: 3 | I2540: 0 | J2540: =RC[-1]/RC[-2] -> 0
A2541: 210 | B2541: 1 | C2541: Friday | D2541: 5 | E2541: 10am-11am | F2541: 2 | G2541: 2 | H2541: 3 | I2541: 0 | J2541: =RC[-1]/RC[-2] -> 0
A2542: 210 | B2542: 1 | C2542: Friday | D2542: 5 | E2542: 11am-12pm | F2542: 3 | G2542: 2 | H2542: 3 | I2542: 0 | J2542: =RC[-1]/RC[-2] -> 0
A2543: 210 | B2543: 1 | C2543: Friday | D2543: 5 | E2543: 12pm-1pm | F2543: 4 | G2543: 2 | H2543: 3 | I2543: 0 | J2543: =RC[-1]/RC[-2] -> 0
A2544: 210 | B2544: 1 | C2544: Friday | D2544: 5 | E2544: 1pm-2pm | F2544: 5 | G2544: 2 | H2544: 3 | I2544: 0 | J2544: =RC[-1]/RC[-2] -> 0
A2545: 210 | B2545: 1 | C2545: Friday | D2545: 5 | E2545: 2pm-3pm | F2545: 6 | G2545: 2 | H2545: 3 | I2545: 0 | J2545: =RC[-1]/RC[-2] -> 0
A2546: 210 | B2546: 1 | C2546: Friday | D2546: 5 | E2546: 3pm-4pm | F2546: 7 | G2546: 1 | H2546: 3 | I2546: 4 | J2546: =RC[-1]/RC[-2] -> 1.3333333333333333
A2547: 210 | B2547: 1 | C2547: Friday | D2547: 5 | E2547: 4pm-5pm | F2547: 8 | G2547: 1 | H2547: 3 | I2547: 1 | J2547: =RC[-1]/RC[-2] -> 0.33333333333333331
A2548: 211 | B2548: 1 | C2548: Monday | D2548: 1 | E2548: 9am-10am | F2548: 1 | G2548: 1 | H2548: 34 | I2548: 14 | J2548: =RC[-1]/RC[-2] -> 0.41176470588235292
A2549: 211 | B2549: 1 | C2549: Monday | D2549: 1 | E2549: 10am-11am | F2549: 2 | G2549: 1 | H2549: 34 | I2549: 10 | J2549: =RC[-1]/RC[-2] -> 0.29411764705882354
A2550: 211 | B2550: 1 | C2550: Monday | D2550: 1 | E2550: 11am-12pm | F2550: 3 | G2550: 1 | H2550: 34 | I2550: 14 | J2550: =RC[-1]/RC[-2] -> 0.41176470588235292
A2551: 211 | B2551: 1 | C2551: Monday | D2551: 1 | E2551: 12pm-1pm | F2551: 4 | G2551: 2 | H2551: 34 | I2551: 0 | J2551: =RC[-1]/RC[-2] -> 0
A2552: 211 | B2552: 1 | C2552: Monday | D2552: 1 | E2552: 1pm-2pm | F2552: 5 | G2552: 2 | H2552: 34 | I2552: 0 | J2552: =RC[-1]/RC[-2] -> 0
A2553: 211 | B2553: 1 | C2553: Monday | D2553: 1 | E2553: 2pm-3pm | F2553: 6 | G2553: 3 | H2553: 34 | I2553: 1 | J2553: =RC[-1]/RC[-2] -> 2.9411764705882353E-2
A2554: 211 | B2554: 1 | C2554: Monday | D2554: 1 | E2554: 3pm-4pm | F2554: 7 | G2554: 3 | H2554: 34 | I2554: 2 | J2554: =RC[-1]/RC[-2] -> 5.8823529411764705E-2
A2555: 211 | B2555: 1 | C2555: Monday | D2555: 1 | E2555: 4pm-5pm | F2555: 8 | G2555: 2 | H2555: 34 | I2555: 0 | J2555: =RC[-1]/RC[-2] -> 0
A2556: 211 | B2556: 1 | C2556: Tuesday | D2556: 2 | E2556: 9am-10am | F2556: 1 | G2556: 1 | H2556: 34 | I2556: 26 | J2556: =RC[-1]/RC[-2] -> 0.76470588235294112
A2557: 211 | B2557: 1 | C2557: Tuesday | D2557: 2 | E2557: 10am-11am | F2557: 2 | G2557: 1 | H2557: 34 | I2557: 2 | J2557: =RC[-1]/RC[-2] -> 5.8823529411764705E-2
A2558: 211 | B2558: 1 | C2558: Tuesday | D2558: 2 | E2558: 11am-12pm | F2558: 3 | G2558: 1 | H2558: 34 | I2558: 20 | J2558: =RC[-1]/RC[-2] -> 0.58823529411764708
A2559: 211 | B2559: 1 | C2559: Tuesday | D2559: 2 | E2559: 12pm-1pm | F2559: 4 | G2559: 2 | H2559: 34 | I2559: 0 | J2559: =RC[-1]/RC[-2] -> 0
A2560: 211 | B2560: 1 | C2560: Tuesday | D2560: 2 | E2560: 1pm-2pm | F2560: 5 | G2560: 2 | H2560: 34 | I2560: 0 | J2560: =RC[-1]/RC[-2] -> 0
A2561: 211 | B2561: 1 | C2561: Tuesday | D2561: 2 | E2561: 2pm-3pm | F2561: 6 | G2561: 1 | H2561: 34 | I2561: 20 | J2561: =RC[-1]/RC[-2] -> 0.58823529411764708
A2562: 211 | B2562: 1 | C2562: Tuesday | D2562: 2 | E2562: 3pm-4pm | F2562: 7 | G2562: 1 | H2562: 34 | I2562: 30 | J2562: =RC[-1]/RC[-2] -> 0.88235294117647056
A2563: 211 | B2563: 1 | C2563: Tuesday | D2563: 2 | E2563: 4pm-5pm | F2563: 8 | G2563: 1 | H2563: 34 | I2563: 30 | J2563: =RC[-1]/RC[-2] -> 0.88235294117647056
A2564: 211 | B2564: 1 | C2564: Wednesday | D2564: 3 | E2564: 9am-10am | F2564: 1 | G2564: 1 | H2564: 34 | I2564: 35 | J2564: =RC[-1]/RC[-2] -> 1.0294117647058822
A2565: 211 | B2565: 1 | C2565: Wednesday | D2565: 3 | E2565: 10am-11am | F2565: 2 | G2565: 1 | H2565: 34 | I2565: 23 | J2565: =RC[-1]/RC[-2] -> 0.67647058823529416
A2566: 211 | B2566: 1 | C2566: Wednesday | D2566: 3 | E2566: 11am-12pm | F2566: 3 | G2566: 1 | H2566: 34 | I2566: 25 | J2566: =RC[-1]/RC[-2] -> 0.73529411764705888
A2567: 211 | B2567: 1 | C2567: Wednesday | D2567: 3 | E2567: 12pm-1pm | F2567: 4 | G2567: 1 | H2567: 34 | I2567: 4 | J2567: =RC[-1]/RC[-2] -> 0.11764705882352941
A2568: 211 | B2568: 1 | C2568: Wednesday | D2568: 3 | E2568: 1pm-2pm | F2568: 5 | G2568: 3 | H2568: 34 | I2568: 1 | J2568: =RC[-1]/RC[-2] -> 2.9411764705882353E-2
A2569: 211 | B2569: 1 | C2569: Wednesday | D2569: 3 | E2569: 2pm-3pm | F2569: 6 | G2569: 1 | H2569: 34 | I2569: 1 | J2569: =RC[-1]/RC[-2] -> 2.9411764705882353E-2
A2570: 211 | B2570: 1 | C2570: Wednesday | D2570: 3 | E2570: 3pm-4pm | F2570: 7 | G2570: 1 | H2570: 34 | I2570: 20 | J2570: =RC[-1]/RC[-2] -> 0.58823529411764708
A2571: 211 | B2571: 1 | C2571: Wednesday | D2571: 3 | E2571: 4pm-5pm | F2571: 8 | G2571: 1 | H2571: 34 | I2571: 20 | J2571: =RC[-1]/RC[-2] -> 0.58823529411764708
A2572: 211 | B2572: 1 | C2572: Thursday | D2572: 4 | E2572: 9am-10am | F2572: 1 | G2572: 1 | H2572: 34 | I2572: 1 | J2572: =RC[-1]/RC[-2] -> 2.9411764705882353E-2
A2573: 211 | B2573: 1 | C2573: Thursday | D2573: 4 | E2573: 10am-11am | F2573: 2 | G2573: 1 | H2573: 34 | I2573: 9 | J2573: =RC[-1]/RC[-2] -> 0.26470588235294118
A2574: 211 | B2574: 1 | C2574: Thursday | D2574: 4 | E2574: 11am-12pm | F2574: 3 | G2574: 1 | H2574: 34 | I2574: 12 | J2574: =RC[-1]/RC[-2] -> 0.35294117647058826
A2575: 211 | B2575: 1 | C2575: Thursday | D2575: 4 | E2575: 12pm-1pm | F2575: 4 | G2575: 1 | H2575: 34 | I2575: 8 | J2575: =RC[-1]/RC[-2] -> 0.23529411764705882
A2576: 211 | B2576: 1 | C2576: Thursday | D2576: 4 | E2576: 1pm-2pm | F2576: 5 | G2576: 1 | H2576: 34 | I2576: 2 | J2576: =RC[-1]/RC[-2] -> 5.8823529411764705E-2
A2577: 211 | B2577: 1 | C2577: Thursday | D2577: 4 | E2577: 2pm-3pm | F2577: 6 | G2577: 3 | H2577: 34 | I2577: 1 | J2577: =RC[-1]/RC[-2] -> 2.9411764705882353E-2
A2578: 211 | B2578: 1 | C2578: Thursday | D2578: 4 | E2578: 3pm-4pm | F2578: 7 | G2578: 3 | H2578: 34 | I2578: 1 | J2578: =RC[-1]/RC[-2] -> 2.9411764705882353E-2
A2579: 211 | B2579: 1 | C2579: Thursday | D2579: 4 | E2579: 4pm-5pm | F2579: 8 | G2579: 2 | H2579: 34 | I2579: 0 | J2579: =RC[-1]/RC[-2] -> 0
A2580: 211 | B2580: 1 | C2580: Friday | D2580: 5 | E2580: 9am-10am | F2580: 1 | G2580: 3 | H2580: 34 | I2580: 2 | J2580: =RC[-1]/RC[-2] -> 5.8823529411764705E-2
A2581: 211 | B2581: 1 | C2581: Friday | D2581: 5 | E2581: 10am-11am | F2581: 2 | G2581: 2 | H2581: 34 | I2581: 0 | J2581: =RC[-1]/RC[-2] -> 0
A2582: 211 | B2582: 1 | C2582: Friday | D2582: 5 | E2582: 11am-12pm | F2582: 3 | G2582: 2 | H2582: 34 | I2582: 0 | J2582: =RC[-1]/RC[-2] -> 0
A2583: 211 | B2583: 1 | C2583: Friday | D2583: 5 | E2583: 12pm-1pm | F2583: 4 | G2583: 2 | H2583: 34 | I2583: 0 | J2583: =RC[-1]/RC[-2] -> 0
A2584: 211 | B2584: 1 | C2584: Friday | D2584: 5 | E2584: 1pm-2pm | F2584: 5 | G2584: 2 | H2584: 34 | I2584: 0 | J2584: =RC[-1]/RC[-2] -> 0
A2585: 211 | B2585: 1 | C2585: Friday | D2585: 5 | E2585: 2pm-3pm | F2585: 6 | G2585: 2 | H2585: 34 | I2585: 0 | J2585: =RC[-1]/RC[-2] -> 0
A2586: 211 | B2586: 1 | C2586: Friday | D2586: 5 | E2586: 3pm-4pm | F2586: 7 | G2586: 2 | H2586: 34 | I2586: 0 | J2586: =RC[-1]/RC[-2] -> 0
A2587: 211 | B2587: 1 | C2587: Friday | D2587: 5 | E2587: 4pm-5pm | F2587: 8 | G2587: 2 | H2587: 34 | I2587: 0 | J2587: =RC[-1]/RC[-2] -> 0
A2588: 217 | B2588: 1 | C2588: Monday | D2588: 1 | E2588: 9am-10am | F2588: 1 | G2588: 2 | H2588: 4 | I2588: 0 | J2588: =RC[-1]/RC[-2] -> 0
A2589: 217 | B2589: 1 | C2589: Monday | D2589: 1 | E2589: 10am-11am | F2589: 2 | G2589: 2 | H2589: 4 | I2589: 0 | J2589: =RC[-1]/RC[-2] -> 0
A2590: 217 | B2590: 1 | C2590: Monday | D2590: 1 | E2590: 11am-12pm | F2590: 3 | G2590: 2 | H2590: 4 | I2590: 0 | J2590: =RC[-1]/RC[-2] -> 0
A2591: 217 | B2591: 1 | C2591: Monday | D2591: 1 | E2591: 12pm-1pm | F2591: 4 | G2591: 2 | H2591: 4 | I2591: 0 | J2591: =RC[-1]/RC[-2] -> 0
A2592: 217 | B2592: 1 | C2592: Monday | D2592: 1 | E2592: 1pm-2pm | F2592: 5 | G2592: 2 | H2592: 4 | I2592: 0 | J2592: =RC[-1]/RC[-2] -> 0
A2593: 217 | B2593: 1 | C2593: Monday | D2593: 1 | E2593: 2pm-3pm | F2593: 6 | G2593: 2 | H2593: 4 | I2593: 0 | J2593: =RC[-1]/RC[-2] -> 0
A2594: 217 | B2594: 1 | C2594: Monday | D2594: 1 | E2594: 3pm-4pm | F2594: 7 | G2594: 2 | H2594: 4 | I2594: 0 | J2594: =RC[-1]/RC[-2] -> 0
A2595: 217 | B2595: 1 | C2595: Monday | D2595: 1 | E2595: 4pm-5pm | F2595: 8 | G2595: 2 | H2595: 4 | I2595: 0 | J2595: =RC[-1]/RC[-2] -> 0
A2596: 217 | B2596: 1 | C2596: Tuesday | D2596: 2 | E2596: 9am-10am | F2596: 1 | G2596: 2 | H2596: 4 | I2596: 0 | J2596: =RC[-1]/RC[-2] -> 0
A2597: 217 | B2597: 1 | C2597: Tuesday | D2597: 2 | E2597: 10am-11am | F2597: 2 | G2597: 2 | H2597: 4 | I2597: 0 | J2597: =RC[-1]/RC[-2] -> 0
A2598: 217 | B2598: 1 | C2598: Tuesday | D2598: 2 | E2598: 11am-12pm | F2598: 3 | G2598: 2 | H2598: 4 | I2598: 0 | J2598: =RC[-1]/RC[-2] -> 0
A2599: 217 | B2599: 1 | C2599: Tuesday | D2599: 2 | E2599: 12pm-1pm | F2599: 4 | G2599: 2 | H2599: 4 | I2599: 0 | J2599: =RC[-1]/RC[-2] -> 0
A2600: 217 | B2600: 1 | C2600: Tuesday | D2600: 2 | E2600: 1pm-2pm | F2600: 5 | G2600: 2 | H2600: 4 | I2600: 0 | J2600: =RC[-1]/RC[-2] -> 0
A2601: 217 | B2601: 1 | C2601: Tuesday | D2601: 2 | E2601: 2pm-3pm | F2601: 6 | G2601: 2 | H2601: 4 | I2601: 0 | J2601: =RC[-1]/RC[-2] -> 0
A2602: 217 | B2602: 1 | C2602: Tuesday | D2602: 2 | E2602: 3pm-4pm | F2602: 7 | G2602: 2 | H2602: 4 | I2602: 0 | J2602: =RC[-1]/RC[-2] -> 0
A2603: 217 | B2603: 1 | C2603: Tuesday | D2603: 2 | E2603: 4pm-5pm | F2603: 8 | G2603: 2 | H2603: 4 | I2603: 0 | J2603: =RC[-1]/RC[-2] -> 0
A2604: 217 | B2604: 1 | C2604: Wednesday | D2604: 3 | E2604: 9am-10am | F2604: 1 | G2604: 2 | H2604: 4 | I2604: 0 | J2604: =RC[-1]/RC[-2] -> 0
A2605: 217 | B2605: 1 | C2605: Wednesday | D2605: 3 | E2605: 10am-11am | F2605: 2 | G2605: 2 | H2605: 4 | I2605: 0 | J2605: =RC[-1]/RC[-2] -> 0
A2606: 217 | B2606: 1 | C2606: Wednesday | D2606: 3 | E2606: 11am-12pm | F2606: 3 | G2606: 2 | H2606: 4 | I2606: 0 | J2606: =RC[-1]/RC[-2] -> 0
A2607: 217 | B2607: 1 | C2607: Wednesday | D2607: 3 | E2607: 12pm-1pm | F2607: 4 | G2607: 2 | H2607: 4 | I2607: 0 | J2607: =RC[-1]/RC[-2] -> 0
A2608: 217 | B2608: 1 | C2608: Wednesday | D2608: 3 | E2608: 1pm-2pm | F2608: 5 | G2608: 2 | H2608: 4 | I2608: 0 | J2608: =RC[-1]/RC[-2] -> 0
A2609: 217 | B2609: 1 | C2609: Wednesday | D2609: 3 | E2609: 2pm-3pm | F2609: 6 | G2609: 2 | H2609: 4 | I2609: 0 | J2609: =RC[-1]/RC[-2] -> 0
A2610: 217 | B2610: 1 | C2610: Wednesday | D2610: 3 | E2610: 3pm-4pm | F2610: 7 | G2610: 2 | H2610: 4 | I2610: 0 | J2610: =RC[-1]/RC[-2] -> 0
A2611: 217 | B2611: 1 | C2611: Wednesday | D2611: 3 | E2611: 4pm-5pm | F2611: 8 | G2611: 2 | H2611: 4 | I2611: 0 | J2611: =RC[-1]/RC[-2] -> 0
A2612: 217 | B2612: 1 | C2612: Thursday | D2612: 4 | E2612: 9am-10am | F2612: 1 | G2612: 2 | H2612: 4 | I2612: 0 | J2612: =RC[-1]/RC[-2] -> 0
A2613: 217 | B2613: 1 | C2613: Thursday | D2613: 4 | E2613: 10am-11am | F2613: 2 | G2613: 2 | H2613: 4 | I2613: 0 | J2613: =RC[-1]/RC[-2] -> 0
A2614: 217 | B2614: 1 | C2614: Thursday | D2614: 4 | E2614: 11am-12pm | F2614: 3 | G2614: 2 | H2614: 4 | I2614: 0 | J2614: =RC[-1]/RC[-2] -> 0
A2615: 217 | B2615: 1 | C2615: Thursday | D2615: 4 | E2615: 12pm-1pm | F2615: 4 | G2615: 2 | H2615: 4 | I2615: 0 | J2615: =RC[-1]/RC[-2] -> 0
A2616: 217 | B2616: 1 | C2616: Thursday | D2616: 4 | E2616: 1pm-2pm | F2616: 5 | G2616: 2 | H2616: 4 | I2616: 0 | J2616: =RC[-1]/RC[-2] -> 0
A2617: 217 | B2617: 1 | C2617: Thursday | D2617: 4 | E2617: 2pm-3pm | F2617: 6 | G2617: 2 | H2617: 4 | I2617: 0 | J2617: =RC[-1]/RC[-2] -> 0
A2618: 217 | B2618: 1 | C2618: Thursday | D2618: 4 | E2618: 3pm-4pm | F2618: 7 | G2618: 2 | H2618: 4 | I2618: 0 | J2618: =RC[-1]/RC[-2] -> 0
A2619: 217 | B2619: 1 | C2619: Thursday | D2619: 4 | E2619: 4pm-5pm | F2619: 8 | G2619: 2 | H2619: 4 | I2619: 0 | J2619: =RC[-1]/RC[-2] -> 0
A2620: 217 | B2620: 1 | C2620: Friday | D2620: 5 | E2620: 9am-10am | F2620: 1 | G2620: 2 | H2620: 4 | I2620: 0 | J2620: =RC[-1]/RC[-2] -> 0
A2621: 217 | B2621: 1 | C2621: Friday | D2621: 5 | E2621: 10am-11am | F2621: 2 | G2621: 2 | H2621: 4 | I2621: 0 | J2621: =RC[-1]/RC[-2] -> 0
A2622: 217 | B2622: 1 | C2622: Friday | D2622: 5 | E2622: 11am-12pm | F2622: 3 | G2622: 2 | H2622: 4 | I2622: 0 | J2622: =RC[-1]/RC[-2] -> 0
A2623: 217 | B2623: 1 | C2623: Friday | D2623: 5 | E2623: 12pm-1pm | F2623: 4 | G2623: 2 | H2623: 4 | I2623: 0 | J2623: =RC[-1]/RC[-2] -> 0
A2624: 217 | B2624: 1 | C2624: Friday | D2624: 5 | E2624: 1pm-2pm | F2624: 5 | G2624: 2 | H2624: 4 | I2624: 0 | J2624: =RC[-1]/RC[-2] -> 0
A2625: 217 | B2625: 1 | C2625: Friday | D2625: 5 | E2625: 2pm-3pm | F2625: 6 | G2625: 2 | H2625: 4 | I2625: 0 | J2625: =RC[-1]/RC[-2] -> 0
A2626: 217 | B2626: 1 | C2626: Friday | D2626: 5 | E2626: 3pm-4pm | F2626: 7 | G2626: 2 | H2626: 4 | I2626: 0 | J2626: =RC[-1]/RC[-2] -> 0
A2627: 217 | B2627: 1 | C2627: Friday | D2627: 5 | E2627: 4pm-5pm | F2627: 8 | G2627: 2 | H2627: 4 | I2627: 0 | J2627: =RC[-1]/RC[-2] -> 0
A2628: 217A | B2628: 1 | C2628: Monday | D2628: 1 | E2628: 9am-10am | F2628: 1 | G2628: 2 | H2628: 4 | I2628: 0 | J2628: =RC[-1]/RC[-2] -> 0
A2629: 217A | B2629: 1 | C2629: Monday | D2629: 1 | E2629: 10am-11am | F2629: 2 | G2629: 2 | H2629: 4 | I2629: 0 | J2629: =RC[-1]/RC[-2] -> 0
A2630: 217A | B2630: 1 | C2630: Monday | D2630: 1 | E2630: 11am-12pm | F2630: 3 | G2630: 2 | H2630: 4 | I2630: 0 | J2630: =RC[-1]/RC[-2] -> 0
A2631: 217A | B2631: 1 | C2631: Monday | D2631: 1 | E2631: 12pm-1pm | F2631: 4 | G2631: 2 | H2631: 4 | I2631: 0 | J2631: =RC[-1]/RC[-2] -> 0
A2632: 217A | B2632: 1 | C2632: Monday | D2632: 1 | E2632: 1pm-2pm | F2632: 5 | G2632: 2 | H2632: 4 | I2632: 0 | J2632: =RC[-1]/RC[-2] -> 0
A2633: 217A | B2633: 1 | C2633: Monday | D2633: 1 | E2633: 2pm-3pm | F2633: 6 | G2633: 2 | H2633: 4 | I2633: 0 | J2633: =RC[-1]/RC[-2] -> 0
A2634: 217A | B2634: 1 | C2634: Monday | D2634: 1 | E2634: 3pm-4pm | F2634: 7 | G2634: 2 | H2634: 4 | I2634: 0 | J2634: =RC[-1]/RC[-2] -> 0
A2635: 217A | B2635: 1 | C2635: Monday | D2635: 1 | E2635: 4pm-5pm | F2635: 8 | G2635: 2 | H2635: 4 | I2635: 0 | J2635: =RC[-1]/RC[-2] -> 0
A2636: 217A | B2636: 1 | C2636: Tuesday | D2636: 2 | E2636: 9am-10am | F2636: 1 | G2636: 2 | H2636: 4 | I2636: 0 | J2636: =RC[-1]/RC[-2] -> 0
A2637: 217A | B2637: 1 | C2637: Tuesday | D2637: 2 | E2637: 10am-11am | F2637: 2 | G2637: 2 | H2637: 4 | I2637: 0 | J2637: =RC[-1]/RC[-2] -> 0
A2638: 217A | B2638: 1 | C2638: Tuesday | D2638: 2 | E2638: 11am-12pm | F2638: 3 | G2638: 2 | H2638: 4 | I2638: 0 | J2638: =RC[-1]/RC[-2] -> 0
A2639: 217A | B2639: 1 | C2639: Tuesday | D2639: 2 | E2639: 12pm-1pm | F2639: 4 | G2639: 2 | H2639: 4 | I2639: 0 | J2639: =RC[-1]/RC[-2] -> 0
A2640: 217A | B2640: 1 | C2640: Tuesday | D2640: 2 | E2640: 1pm-2pm | F2640: 5 | G2640: 2 | H2640: 4 | I2640: 0 | J2640: =RC[-1]/RC[-2] -> 0
A2641: 217A | B2641: 1 | C2641: Tuesday | D2641: 2 | E2641: 2pm-3pm | F2641: 6 | G2641: 2 | H2641: 4 | I2641: 0 | J2641: =RC[-1]/RC[-2] -> 0
A2642: 217A | B2642: 1 | C2642: Tuesday | D2642: 2 | E2642: 3pm-4pm | F2642: 7 | G2642: 2 | H2642: 4 | I2642: 0 | J2642: =RC[-1]/RC[-2] -> 0
A2643: 217A | B2643: 1 | C2643: Tuesday | D2643: 2 | E2643: 4pm-5pm | F2643: 8 | G2643: 2 | H2643: 4 | I2643: 0 | J2643: =RC[-1]/RC[-2] -> 0
A2644: 217A | B2644: 1 | C2644: Wednesday | D2644: 3 | E2644: 9am-10am | F2644: 1 | G2644: 2 | H2644: 4 | I2644: 0 | J2644: =RC[-1]/RC[-2] -> 0
A2645: 217A | B2645: 1 | C2645: Wednesday | D2645: 3 | E2645: 10am-11am | F2645: 2 | G2645: 2 | H2645: 4 | I2645: 0 | J2645: =RC[-1]/RC[-2] -> 0
A2646: 217A | B2646: 1 | C2646: Wednesday | D2646: 3 | E2646: 11am-12pm | F2646: 3 | G2646: 2 | H2646: 4 | I2646: 0 | J2646: =RC[-1]/RC[-2] -> 0
A2647: 217A | B2647: 1 | C2647: Wednesday | D2647: 3 | E2647: 12pm-1pm | F2647: 4 | G2647: 2 | H2647: 4 | I2647: 0 | J2647: =RC[-1]/RC[-2] -> 0
A2648: 217A | B2648: 1 | C2648: Wednesday | D2648: 3 | E2648: 1pm-2pm | F2648: 5 | G2648: 2 | H2648: 4 | I2648: 0 | J2648: =RC[-1]/RC[-2] -> 0
A2649: 217A | B2649: 1 | C2649: Wednesday | D2649: 3 | E2649: 2pm-3pm | F2649: 6 | G2649: 2 | H2649: 4 | I2649: 0 | J2649: =RC[-1]/RC[-2] -> 0
A2650: 217A | B2650: 1 | C2650: Wednesday | D2650: 3 | E2650: 3pm-4pm | F2650: 7 | G2650: 2 | H2650: 4 | I2650: 0 | J2650: =RC[-1]/RC[-2] -> 0
A2651: 217A | B2651: 1 | C2651: Wednesday | D2651: 3 | E2651: 4pm-5pm | F2651: 8 | G2651: 2 | H2651: 4 | I2651: 0 | J2651: =RC[-1]/RC[-2] -> 0
A2652: 217A | B2652: 1 | C2652: Thursday | D2652: 4 | E2652: 9am-10am | F2652: 1 | G2652: 2 | H2652: 4 | I2652: 0 | J2652: =RC[-1]/RC[-2] -> 0
A2653: 217A | B2653: 1 | C2653: Thursday | D2653: 4 | E2653: 10am-11am | F2653: 2 | G2653: 2 | H2653: 4 | I2653: 0 | J2653: =RC[-1]/RC[-2] -> 0
A2654: 217A | B2654: 1 | C2654: Thursday | D2654: 4 | E2654: 11am-12pm | F2654: 3 | G2654: 2 | H2654: 4 | I2654: 0 | J2654: =RC[-1]/RC[-2] -> 0
A2655: 217A | B2655: 1 | C2655: Thursday | D2655: 4 | E2655: 12pm-1pm | F2655: 4 | G2655: 2 | H2655: 4 | I2655: 0 | J2655: =RC[-1]/RC[-2] -> 0
A2656: 217A | B2656: 1 | C2656: Thursday | D2656: 4 | E2656: 1pm-2pm | F2656: 5 | G2656: 2 | H2656: 4 | I2656: 0 | J2656: =RC[-1]/RC[-2] -> 0
A2657: 217A | B2657: 1 | C2657: Thursday | D2657: 4 | E2657: 2pm-3pm | F2657: 6 | G2657: 2 | H2657: 4 | I2657: 0 | J2657: =RC[-1]/RC[-2] -> 0
A2658: 217A | B2658: 1 | C2658: Thursday | D2658: 4 | E2658: 3pm-4pm | F2658: 7 | G2658: 2 | H2658: 4 | I2658: 0 | J2658: =RC[-1]/RC[-2] -> 0
A2659: 217A | B2659: 1 | C2659: Thursday | D2659: 4 | E2659: 4pm-5pm | F2659: 8 | G2659: 2 | H2659: 4 | I2659: 0 | J2659: =RC[-1]/RC[-2] -> 0
A2660: 217A | B2660: 1 | C2660: Friday | D2660: 5 | E2660: 9am-10am | F2660: 1 | G2660: 2 | H2660: 4 | I2660: 0 | J2660: =RC[-1]/RC[-2] -> 0
A2661: 217A | B2661: 1 | C2661: Friday | D2661: 5 | E2661: 10am-11am | F2661: 2 | G2661: 2 | H2661: 4 | I2661: 0 | J2661: =RC[-1]/RC[-2] -> 0
A2662: 217A | B2662: 1 | C2662: Friday | D2662: 5 | E2662: 11am-12pm | F2662: 3 | G2662: 2 | H2662: 4 | I2662: 0 | J2662: =RC[-1]/RC[-2] -> 0
A2663: 217A | B2663: 1 | C2663: Friday | D2663: 5 | E2663: 12pm-1pm | F2663: 4 | G2663: 2 | H2663: 4 | I2663: 0 | J2663: =RC[-1]/RC[-2] -> 0
A2664: 217A | B2664: 1 | C2664: Friday | D2664: 5 | E2664: 1pm-2pm | F2664: 5 | G2664: 2 | H2664: 4 | I2664: 0 | J2664: =RC[-1]/RC[-2] -> 0
A2665: 217A | B2665: 1 | C2665: Friday | D2665: 5 | E2665: 2pm-3pm | F2665: 6 | G2665: 2 | H2665: 4 | I2665: 0 | J2665: =RC[-1]/RC[-2] -> 0
A2666: 217A | B2666: 1 | C2666: Friday | D2666: 5 | E2666: 3pm-4pm | F2666: 7 | G2666: 2 | H2666: 4 | I2666: 0 | J2666: =RC[-1]/RC[-2] -> 0
A2667: 217A | B2667: 1 | C2667: Friday | D2667: 5 | E2667: 4pm-5pm | F2667: 8 | G2667: 2 | H2667: 4 | I2667: 0 | J2667: =RC[-1]/RC[-2] -> 0
A2668: 219 | B2668: 1 | C2668: Monday | D2668: 1 | E2668: 9am-10am | F2668: 1 | G2668: 1 | H2668: 34 | I2668: 15 | J2668: =RC[-1]/RC[-2] -> 0.44117647058823528
A2669: 219 | B2669: 1 | C2669: Monday | D2669: 1 | E2669: 10am-11am | F2669: 2 | G2669: 1 | H2669: 34 | I2669: 16 | J2669: =RC[-1]/RC[-2] -> 0.47058823529411764
A2670: 219 | B2670: 1 | C2670: Monday | D2670: 1 | E2670: 11am-12pm | F2670: 3 | G2670: 1 | H2670: 34 | I2670: 16 | J2670: =RC[-1]/RC[-2] -> 0.47058823529411764
A2671: 219 | B2671: 1 | C2671: Monday | D2671: 1 | E2671: 12pm-1pm | F2671: 4 | G2671: 2 | H2671: 34 | I2671: 0 | J2671: =RC[-1]/RC[-2] -> 0
A2672: 219 | B2672: 1 | C2672: Monday | D2672: 1 | E2672: 1pm-2pm | F2672: 5 | G2672: 2 | H2672: 34 | I2672: 0 | J2672: =RC[-1]/RC[-2] -> 0
A2673: 219 | B2673: 1 | C2673: Monday | D2673: 1 | E2673: 2pm-3pm | F2673: 6 | G2673: 1 | H2673: 34 | I2673: 10 | J2673: =RC[-1]/RC[-2] -> 0.29411764705882354
A2674: 219 | B2674: 1 | C2674: Monday | D2674: 1 | E2674: 3pm-4pm | F2674: 7 | G2674: 1 | H2674: 34 | I2674: 15 | J2674: =RC[-1]/RC[-2] -> 0.44117647058823528
A2675: 219 | B2675: 1 | C2675: Monday | D2675: 1 | E2675: 4pm-5pm | F2675: 8 | G2675: 1 | H2675: 34 | I2675: 9 | J2675: =RC[-1]/RC[-2] -> 0.26470588235294118
A2676: 219 | B2676: 1 | C2676: Tuesday | D2676: 2 | E2676: 9am-10am | F2676: 1 | G2676: 2 | H2676: 34 | I2676: 0 | J2676: =RC[-1]/RC[-2] -> 0
A2677: 219 | B2677: 1 | C2677: Tuesday | D2677: 2 | E2677: 10am-11am | F2677: 2 | G2677: 2 | H2677: 34 | I2677: 0 | J2677: =RC[-1]/RC[-2] -> 0
A2678: 219 | B2678: 1 | C2678: Tuesday | D2678: 2 | E2678: 11am-12pm | F2678: 3 | G2678: 2 | H2678: 34 | I2678: 0 | J2678: =RC[-1]/RC[-2] -> 0
A2679: 219 | B2679: 1 | C2679: Tuesday | D2679: 2 | E2679: 12pm-1pm | F2679: 4 | G2679: 2 | H2679: 34 | I2679: 0 | J2679: =RC[-1]/RC[-2] -> 0
A2680: 219 | B2680: 1 | C2680: Tuesday | D2680: 2 | E2680: 1pm-2pm | F2680: 5 | G2680: 2 | H2680: 34 | I2680: 0 | J2680: =RC[-1]/RC[-2] -> 0
A2681: 219 | B2681: 1 | C2681: Tuesday | D2681: 2 | E2681: 2pm-3pm | F2681: 6 | G2681: 1 | H2681: 34 | I2681: 30 | J2681: =RC[-1]/RC[-2] -> 0.88235294117647056
A2682: 219 | B2682: 1 | C2682: Tuesday | D2682: 2 | E2682: 3pm-4pm | F2682: 7 | G2682: 1 | H2682: 34 | I2682: 30 | J2682: =RC[-1]/RC[-2] -> 0.88235294117647056
A2683: 219 | B2683: 1 | C2683: Tuesday | D2683: 2 | E2683: 4pm-5pm | F2683: 8 | G2683: 1 | H2683: 34 | I2683: 30 | J2683: =RC[-1]/RC[-2] -> 0.88235294117647056
A2684: 219 | B2684: 1 | C2684: Wednesday | D2684: 3 | E2684: 9am-10am | F2684: 1 | G2684: 2 | H2684: 34 | I2684: 0 | J2684: =RC[-1]/RC[-2] -> 0
A2685: 219 | B2685: 1 | C2685: Wednesday | D2685: 3 | E2685: 10am-11am | F2685: 2 | G2685: 1 | H2685: 34 | I2685: 24 | J2685: =RC[-1]/RC[-2] -> 0.70588235294117652
A2686: 219 | B2686: 1 | C2686: Wednesday | D2686: 3 | E2686: 11am-12pm | F2686: 3 | G2686: 1 | H2686: 34 | I2686: 22 | J2686: =RC[-1]/RC[-2] -> 0.6470588235294118
A2687: 219 | B2687: 1 | C2687: Wednesday | D2687: 3 | E2687: 12pm-1pm | F2687: 4 | G2687: 2 | H2687: 34 | I2687: 0 | J2687: =RC[-1]/RC[-2] -> 0
A2688: 219 | B2688: 1 | C2688: Wednesday | D2688: 3 | E2688: 1pm-2pm | F2688: 5 | G2688: 3 | H2688: 34 | I2688: 1 | J2688: =RC[-1]/RC[-2] -> 2.9411764705882353E-2
A2689: 219 | B2689: 1 | C2689: Wednesday | D2689: 3 | E2689: 2pm-3pm | F2689: 6 | G2689: 3 | H2689: 34 | I2689: 1 | J2689: =RC[-1]/RC[-2] -> 2.9411764705882353E-2
A2690: 219 | B2690: 1 | C2690: Wednesday | D2690: 3 | E2690: 3pm-4pm | F2690: 7 | G2690: 1 | H2690: 34 | I2690: 23 | J2690: =RC[-1]/RC[-2] -> 0.67647058823529416
A2691: 219 | B2691: 1 | C2691: Wednesday | D2691: 3 | E2691: 4pm-5pm | F2691: 8 | G2691: 1 | H2691: 34 | I2691: 23 | J2691: =RC[-1]/RC[-2] -> 0.67647058823529416
A2692: 219 | B2692: 1 | C2692: Thursday | D2692: 4 | E2692: 9am-10am | F2692: 1 | G2692: 3 | H2692: 34 | I2692: 1 | J2692: =RC[-1]/RC[-2] -> 2.9411764705882353E-2
A2693: 219 | B2693: 1 | C2693: Thursday | D2693: 4 | E2693: 10am-11am | F2693: 2 | G2693: 1 | H2693: 34 | I2693: 15 | J2693: =RC[-1]/RC[-2] -> 0.44117647058823528
A2694: 219 | B2694: 1 | C2694: Thursday | D2694: 4 | E2694: 11am-12pm | F2694: 3 | G2694: 1 | H2694: 34 | I2694: 6 | J2694: =RC[-1]/RC[-2] -> 0.17647058823529413
A2695: 219 | B2695: 1 | C2695: Thursday | D2695: 4 | E2695: 12pm-1pm | F2695: 4 | G2695: 1 | H2695: 34 | I2695: 1 | J2695: =RC[-1]/RC[-2] -> 2.9411764705882353E-2
A2696: 219 | B2696: 1 | C2696: Thursday | D2696: 4 | E2696: 1pm-2pm | F2696: 5 | G2696: 1 | H2696: 34 | I2696: 2 | J2696: =RC[-1]/RC[-2] -> 5.8823529411764705E-2
A2697: 219 | B2697: 1 | C2697: Thursday | D2697: 4 | E2697: 2pm-3pm | F2697: 6 | G2697: 2 | H2697: 34 | I2697: 0 | J2697: =RC[-1]/RC[-2] -> 0
A2698: 219 | B2698: 1 | C2698: Thursday | D2698: 4 | E2698: 3pm-4pm | F2698: 7 | G2698: 1 | H2698: 34 | I2698: 20 | J2698: =RC[-1]/RC[-2] -> 0.58823529411764708
A2699: 219 | B2699: 1 | C2699: Thursday | D2699: 4 | E2699: 4pm-5pm | F2699: 8 | G2699: 1 | H2699: 34 | I2699: 10 | J2699: =RC[-1]/RC[-2] -> 0.29411764705882354
A2700: 219 | B2700: 1 | C2700: Friday | D2700: 5 | E2700: 9am-10am | F2700: 1 | G2700: 2 | H2700: 34 | I2700: 0 | J2700: =RC[-1]/RC[-2] -> 0
A2701: 219 | B2701: 1 | C2701: Friday | D2701: 5 | E2701: 10am-11am | F2701: 2 | G2701: 3 | H2701: 34 | I2701: 1 | J2701: =RC[-1]/RC[-2] -> 2.9411764705882353E-2
A2702: 219 | B2702: 1 | C2702: Friday | D2702: 5 | E2702: 11am-12pm | F2702: 3 | G2702: 3 | H2702: 34 | I2702: 1 | J2702: =RC[-1]/RC[-2] -> 2.9411764705882353E-2
A2703: 219 | B2703: 1 | C2703: Friday | D2703: 5 | E2703: 12pm-1pm | F2703: 4 | G2703: 2 | H2703: 34 | I2703: 0 | J2703: =RC[-1]/RC[-2] -> 0
A2704: 219 | B2704: 1 | C2704: Friday | D2704: 5 | E2704: 1pm-2pm | F2704: 5 | G2704: 1 | H2704: 34 | I2704: 3 | J2704: =RC[-1]/RC[-2] -> 8.8235294117647065E-2
A2705: 219 | B2705: 1 | C2705: Friday | D2705: 5 | E2705: 2pm-3pm | F2705: 6 | G2705: 1 | H2705: 34 | I2705: 2 | J2705: =RC[-1]/RC[-2] -> 5.8823529411764705E-2
A2706: 219 | B2706: 1 | C2706: Friday | D2706: 5 | E2706: 3pm-4pm | F2706: 7 | G2706: 2 | H2706: 34 | I2706: 0 | J2706: =RC[-1]/RC[-2] -> 0
A2707: 219 | B2707: 1 | C2707: Friday | D2707: 5 | E2707: 4pm-5pm | F2707: 8 | G2707: 1 | H2707: 34 | I2707: 2 | J2707: =RC[-1]/RC[-2] -> 5.8823529411764705E-2
A2708: 220 | B2708: 1 | C2708: Monday | D2708: 1 | E2708: 9am-10am | F2708: 1 | G2708: 2 | H2708: 6 | I2708: 0 | J2708: =RC[-1]/RC[-2] -> 0
A2709: 220 | B2709: 1 | C2709: Monday | D2709: 1 | E2709: 10am-11am | F2709: 2 | G2709: 2 | H2709: 6 | I2709: 0 | J2709: =RC[-1]/RC[-2] -> 0
A2710: 220 | B2710: 1 | C2710: Monday | D2710: 1 | E2710: 11am-12pm | F2710: 3 | G2710: 2 | H2710: 6 | I2710: 0 | J2710: =RC[-1]/RC[-2] -> 0
A2711: 220 | B2711: 1 | C2711: Monday | D2711: 1 | E2711: 12pm-1pm | F2711: 4 | G2711: 2 | H2711: 6 | I2711: 0 | J2711: =RC[-1]/RC[-2] -> 0
A2712: 220 | B2712: 1 | C2712: Monday | D2712: 1 | E2712: 1pm-2pm | F2712: 5 | G2712: 2 | H2712: 6 | I2712: 0 | J2712: =RC[-1]/RC[-2] -> 0
A2713: 220 | B2713: 1 | C2713: Monday | D2713: 1 | E2713: 2pm-3pm | F2713: 6 | G2713: 2 | H2713: 6 | I2713: 0 | J2713: =RC[-1]/RC[-2] -> 0
A2714: 220 | B2714: 1 | C2714: Monday | D2714: 1 | E2714: 3pm-4pm | F2714: 7 | G2714: 2 | H2714: 6 | I2714: 0 | J2714: =RC[-1]/RC[-2] -> 0
A2715: 220 | B2715: 1 | C2715: Monday | D2715: 1 | E2715: 4pm-5pm | F2715: 8 | G2715: 2 | H2715: 6 | I2715: 0 | J2715: =RC[-1]/RC[-2] -> 0
A2716: 220 | B2716: 1 | C2716: Tuesday | D2716: 2 | E2716: 9am-10am | F2716: 1 | G2716: 2 | H2716: 6 | I2716: 0 | J2716: =RC[-1]/RC[-2] -> 0
A2717: 220 | B2717: 1 | C2717: Tuesday | D2717: 2 | E2717: 10am-11am | F2717: 2 | G2717: 2 | H2717: 6 | I2717: 0 | J2717: =RC[-1]/RC[-2] -> 0
A2718: 220 | B2718: 1 | C2718: Tuesday | D2718: 2 | E2718: 11am-12pm | F2718: 3 | G2718: 2 | H2718: 6 | I2718: 0 | J2718: =RC[-1]/RC[-2] -> 0
A2719: 220 | B2719: 1 | C2719: Tuesday | D2719: 2 | E2719: 12pm-1pm | F2719: 4 | G2719: 2 | H2719: 6 | I2719: 0 | J2719: =RC[-1]/RC[-2] -> 0
A2720: 220 | B2720: 1 | C2720: Tuesday | D2720: 2 | E2720: 1pm-2pm | F2720: 5 | G2720: 2 | H2720: 6 | I2720: 0 | J2720: =RC[-1]/RC[-2] -> 0
A2721: 220 | B2721: 1 | C2721: Tuesday | D2721: 2 | E2721: 2pm-3pm | F2721: 6 | G2721: 2 | H2721: 6 | I2721: 0 | J2721: =RC[-1]/RC[-2] -> 0
A2722: 220 | B2722: 1 | C2722: Tuesday | D2722: 2 | E2722: 3pm-4pm | F2722: 7 | G2722: 2 | H2722: 6 | I2722: 0 | J2722: =RC[-1]/RC[-2] -> 0
A2723: 220 | B2723: 1 | C2723: Tuesday | D2723: 2 | E2723: 4pm-5pm | F2723: 8 | G2723: 2 | H2723: 6 | I2723: 0 | J2723: =RC[-1]/RC[-2] -> 0
A2724: 220 | B2724: 1 | C2724: Wednesday | D2724: 3 | E2724: 9am-10am | F2724: 1 | G2724: 2 | H2724: 6 | I2724: 0 | J2724: =RC[-1]/RC[-2] -> 0
A2725: 220 | B2725: 1 | C2725: Wednesday | D2725: 3 | E2725: 10am-11am | F2725: 2 | G2725: 2 | H2725: 6 | I2725: 0 | J2725: =RC[-1]/RC[-2] -> 0
A2726: 220 | B2726: 1 | C2726: Wednesday | D2726: 3 | E2726: 11am-12pm | F2726: 3 | G2726: 2 | H2726: 6 | I2726: 0 | J2726: =RC[-1]/RC[-2] -> 0
A2727: 220 | B2727: 1 | C2727: Wednesday | D2727: 3 | E2727: 12pm-1pm | F2727: 4 | G2727: 2 | H2727: 6 | I2727: 0 | J2727: =RC[-1]/RC[-2] -> 0
A2728: 220 | B2728: 1 | C2728: Wednesday | D2728: 3 | E2728: 1pm-2pm | F2728: 5 | G2728: 2 | H2728: 6 | I2728: 0 | J2728: =RC[-1]/RC[-2] -> 0
A2729: 220 | B2729: 1 | C2729: Wednesday | D2729: 3 | E2729: 2pm-3pm | F2729: 6 | G2729: 2 | H2729: 6 | I2729: 0 | J2729: =RC[-1]/RC[-2] -> 0
A2730: 220 | B2730: 1 | C2730: Wednesday | D2730: 3 | E2730: 3pm-4pm | F2730: 7 | G2730: 2 | H2730: 6 | I2730: 0 | J2730: =RC[-1]/RC[-2] -> 0
A2731: 220 | B2731: 1 | C2731: Wednesday | D2731: 3 | E2731: 4pm-5pm | F2731: 8 | G2731: 2 | H2731: 6 | I2731: 0 | J2731: =RC[-1]/RC[-2] -> 0
A2732: 220 | B2732: 1 | C2732: Thursday | D2732: 4 | E2732: 9am-10am | F2732: 1 | G2732: 2 | H2732: 6 | I2732: 0 | J2732: =RC[-1]/RC[-2] -> 0
A2733: 220 | B2733: 1 | C2733: Thursday | D2733: 4 | E2733: 10am-11am | F2733: 2 | G2733: 2 | H2733: 6 | I2733: 0 | J2733: =RC[-1]/RC[-2] -> 0
A2734: 220 | B2734: 1 | C2734: Thursday | D2734: 4 | E2734: 11am-12pm | F2734: 3 | G2734: 2 | H2734: 6 | I2734: 0 | J2734: =RC[-1]/RC[-2] -> 0
A2735: 220 | B2735: 1 | C2735: Thursday | D2735: 4 | E2735: 12pm-1pm | F2735: 4 | G2735: 2 | H2735: 6 | I2735: 0 | J2735: =RC[-1]/RC[-2] -> 0
A2736: 220 | B2736: 1 | C2736: Thursday | D2736: 4 | E2736: 1pm-2pm | F2736: 5 | G2736: 2 | H2736: 6 | I2736: 0 | J2736: =RC[-1]/RC[-2] -> 0
A2737: 220 | B2737: 1 | C2737: Thursday | D2737: 4 | E2737: 2pm-3pm | F2737: 6 | G2737: 2 | H2737: 6 | I2737: 0 | J2737: =RC[-1]/RC[-2] -> 0
A2738: 220 | B2738: 1 | C2738: Thursday | D2738: 4 | E2738: 3pm-4pm | F2738: 7 | G2738: 2 | H2738: 6 | I2738: 0 | J2738: =RC[-1]/RC[-2] -> 0
A2739: 220 | B2739: 1 | C2739: Thursday | D2739: 4 | E2739: 4pm-5pm | F2739: 8 | G2739: 2 | H2739: 6 | I2739: 0 | J2739: =RC[-1]/RC[-2] -> 0
A2740: 220 | B2740: 1 | C2740: Friday | D2740: 5 | E2740: 9am-10am | F2740: 1 | G2740: 2 | H2740: 6 | I2740: 0 | J2740: =RC[-1]/RC[-2] -> 0
A2741: 220 | B2741: 1 | C2741: Friday | D2741: 5 | E2741: 10am-11am | F2741: 2 | G2741: 2 | H2741: 6 | I2741: 0 | J2741: =RC[-1]/RC[-2] -> 0
A2742: 220 | B2742: 1 | C2742: Friday | D2742: 5 | E2742: 11am-12pm | F2742: 3 | G2742: 2 | H2742: 6 | I2742: 0 | J2742: =RC[-1]/RC[-2] -> 0
A2743: 220 | B2743: 1 | C2743: Friday | D2743: 5 | E2743: 12pm-1pm | F2743: 4 | G2743: 2 | H2743: 6 | I2743: 0 | J2743: =RC[-1]/RC[-2] -> 0
A2744: 220 | B2744: 1 | C2744: Friday | D2744: 5 | E2744: 1pm-2pm | F2744: 5 | G2744: 2 | H2744: 6 | I2744: 0 | J2744: =RC[-1]/RC[-2] -> 0
A2745: 220 | B2745: 1 | C2745: Friday | D2745: 5 | E2745: 2pm-3pm | F2745: 6 | G2745: 2 | H2745: 6 | I2745: 0 | J2745: =RC[-1]/RC[-2] -> 0
A2746: 220 | B2746: 1 | C2746: Friday | D2746: 5 | E2746: 3pm-4pm | F2746: 7 | G2746: 2 | H2746: 6 | I2746: 0 | J2746: =RC[-1]/RC[-2] -> 0
A2747: 220 | B2747: 1 | C2747: Friday | D2747: 5 | E2747: 4pm-5pm | F2747: 8 | G2747: 2 | H2747: 6 | I2747: 0 | J2747: =RC[-1]/RC[-2] -> 0
A2748: 232 | B2748: 1 | C2748: Monday | D2748: 1 | E2748: 9am-10am | F2748: 1 | G2748: 2 | H2748: 4 | I2748: 0 | J2748: =RC[-1]/RC[-2] -> 0
A2749: 232 | B2749: 1 | C2749: Monday | D2749: 1 | E2749: 10am-11am | F2749: 2 | G2749: 2 | H2749: 4 | I2749: 0 | J2749: =RC[-1]/RC[-2] -> 0
A2750: 232 | B2750: 1 | C2750: Monday | D2750: 1 | E2750: 11am-12pm | F2750: 3 | G2750: 2 | H2750: 4 | I2750: 0 | J2750: =RC[-1]/RC[-2] -> 0
A2751: 232 | B2751: 1 | C2751: Monday | D2751: 1 | E2751: 12pm-1pm | F2751: 4 | G2751: 2 | H2751: 4 | I2751: 0 | J2751: =RC[-1]/RC[-2] -> 0
A2752: 232 | B2752: 1 | C2752: Monday | D2752: 1 | E2752: 1pm-2pm | F2752: 5 | G2752: 2 | H2752: 4 | I2752: 0 | J2752: =RC[-1]/RC[-2] -> 0
A2753: 232 | B2753: 1 | C2753: Monday | D2753: 1 | E2753: 2pm-3pm | F2753: 6 | G2753: 1 | H2753: 4 | I2753: 1 | J2753: =RC[-1]/RC[-2] -> 0.25
A2754: 232 | B2754: 1 | C2754: Monday | D2754: 1 | E2754: 3pm-4pm | F2754: 7 | G2754: 2 | H2754: 4 | I2754: 0 | J2754: =RC[-1]/RC[-2] -> 0
A2755: 232 | B2755: 1 | C2755: Monday | D2755: 1 | E2755: 4pm-5pm | F2755: 8 | G2755: 2 | H2755: 4 | I2755: 0 | J2755: =RC[-1]/RC[-2] -> 0
A2756: 232 | B2756: 1 | C2756: Tuesday | D2756: 2 | E2756: 9am-10am | F2756: 1 | G2756: 2 | H2756: 4 | I2756: 0 | J2756: =RC[-1]/RC[-2] -> 0
A2757: 232 | B2757: 1 | C2757: Tuesday | D2757: 2 | E2757: 10am-11am | F2757: 2 | G2757: 1 | H2757: 4 | I2757: 13 | J2757: =RC[-1]/RC[-2] -> 3.25
A2758: 232 | B2758: 1 | C2758: Tuesday | D2758: 2 | E2758: 11am-12pm | F2758: 3 | G2758: 1 | H2758: 4 | I2758: 2 | J2758: =RC[-1]/RC[-2] -> 0.5
A2759: 232 | B2759: 1 | C2759: Tuesday | D2759: 2 | E2759: 12pm-1pm | F2759: 4 | G2759: 2 | H2759: 4 | I2759: 0 | J2759: =RC[-1]/RC[-2] -> 0
A2760: 232 | B2760: 1 | C2760: Tuesday | D2760: 2 | E2760: 1pm-2pm | F2760: 5 | G2760: 2 | H2760: 4 | I2760: 0 | J2760: =RC[-1]/RC[-2] -> 0
A2761: 232 | B2761: 1 | C2761: Tuesday | D2761: 2 | E2761: 2pm-3pm | F2761: 6 | G2761: 2 | H2761: 4 | I2761: 0 | J2761: =RC[-1]/RC[-2] -> 0
A2762: 232 | B2762: 1 | C2762: Tuesday | D2762: 2 | E2762: 3pm-4pm | F2762: 7 | G2762: 2 | H2762: 4 | I2762: 0 | J2762: =RC[-1]/RC[-2] -> 0
A2763: 232 | B2763: 1 | C2763: Tuesday | D2763: 2 | E2763: 4pm-5pm | F2763: 8 | G2763: 2 | H2763: 4 | I2763: 0 | J2763: =RC[-1]/RC[-2] -> 0
A2764: 232 | B2764: 1 | C2764: Wednesday | D2764: 3 | E2764: 9am-10am | F2764: 1 | G2764: 2 | H2764: 4 | I2764: 0 | J2764: =RC[-1]/RC[-2] -> 0
A2765: 232 | B2765: 1 | C2765: Wednesday | D2765: 3 | E2765: 10am-11am | F2765: 2 | G2765: 2 | H2765: 4 | I2765: 0 | J2765: =RC[-1]/RC[-2] -> 0
A2766: 232 | B2766: 1 | C2766: Wednesday | D2766: 3 | E2766: 11am-12pm | F2766: 3 | G2766: 2 | H2766: 4 | I2766: 0 | J2766: =RC[-1]/RC[-2] -> 0
A2767: 232 | B2767: 1 | C2767: Wednesday | D2767: 3 | E2767: 12pm-1pm | F2767: 4 | G2767: 2 | H2767: 4 | I2767: 0 | J2767: =RC[-1]/RC[-2] -> 0
A2768: 232 | B2768: 1 | C2768: Wednesday | D2768: 3 | E2768: 1pm-2pm | F2768: 5 | G2768: 2 | H2768: 4 | I2768: 0 | J2768: =RC[-1]/RC[-2] -> 0
A2769: 232 | B2769: 1 | C2769: Wednesday | D2769: 3 | E2769: 2pm-3pm | F2769: 6 | G2769: 2 | H2769: 4 | I2769: 0 | J2769: =RC[-1]/RC[-2] -> 0
A2770: 232 | B2770: 1 | C2770: Wednesday | D2770: 3 | E2770: 3pm-4pm | F2770: 7 | G2770: 2 | H2770: 4 | I2770: 0 | J2770: =RC[-1]/RC[-2] -> 0
A2771: 232 | B2771: 1 | C2771: Wednesday | D2771: 3 | E2771: 4pm-5pm | F2771: 8 | G2771: 2 | H2771: 4 | I2771: 0 | J2771: =RC[-1]/RC[-2] -> 0
A2772: 232 | B2772: 1 | C2772: Thursday | D2772: 4 | E2772: 9am-10am | F2772: 1 | G2772: 2 | H2772: 4 | I2772: 0 | J2772: =RC[-1]/RC[-2] -> 0
A2773: 232 | B2773: 1 | C2773: Thursday | D2773: 4 | E2773: 10am-11am | F2773: 2 | G2773: 1 | H2773: 4 | I2773: 12 | J2773: =RC[-1]/RC[-2] -> 3
A2774: 232 | B2774: 1 | C2774: Thursday | D2774: 4 | E2774: 11am-12pm | F2774: 3 | G2774: 2 | H2774: 4 | I2774: 0 | J2774: =RC[-1]/RC[-2] -> 0
A2775: 232 | B2775: 1 | C2775: Thursday | D2775: 4 | E2775: 12pm-1pm | F2775: 4 | G2775: 2 | H2775: 4 | I2775: 0 | J2775: =RC[-1]/RC[-2] -> 0
A2776: 232 | B2776: 1 | C2776: Thursday | D2776: 4 | E2776: 1pm-2pm | F2776: 5 | G2776: 2 | H2776: 4 | I2776: 0 | J2776: =RC[-1]/RC[-2] -> 0
A2777: 232 | B2777: 1 | C2777: Thursday | D2777: 4 | E2777: 2pm-3pm | F2777: 6 | G2777: 2 | H2777: 4 | I2777: 0 | J2777: =RC[-1]/RC[-2] -> 0
A2778: 232 | B2778: 1 | C2778: Thursday | D2778: 4 | E2778: 3pm-4pm | F2778: 7 | G2778: 2 | H2778: 4 | I2778: 0 | J2778: =RC[-1]/RC[-2] -> 0
A2779: 232 | B2779: 1 | C2779: Thursday | D2779: 4 | E2779: 4pm-5pm | F2779: 8 | G2779: 2 | H2779: 4 | I2779: 0 | J2779: =RC[-1]/RC[-2] -> 0
A2780: 232 | B2780: 1 | C2780: Friday | D2780: 5 | E2780: 9am-10am | F2780: 1 | G2780: 2 | H2780: 4 | I2780: 0 | J2780: =RC[-1]/RC[-2] -> 0
A2781: 232 | B2781: 1 | C2781: Friday | D2781: 5 | E2781: 10am-11am | F2781: 2 | G2781: 2 | H2781: 4 | I2781: 0 | J2781: =RC[-1]/RC[-2] -> 0
A2782: 232 | B2782: 1 | C2782: Friday | D2782: 5 | E2782: 11am-12pm | F2782: 3 | G2782: 2 | H2782: 4 | I2782: 0 | J2782: =RC[-1]/RC[-2] -> 0
A2783: 232 | B2783: 1 | C2783: Friday | D2783: 5 | E2783: 12pm-1pm | F2783: 4 | G2783: 2 | H2783: 4 | I2783: 0 | J2783: =RC[-1]/RC[-2] -> 0
A2784: 232 | B2784: 1 | C2784: Friday | D2784: 5 | E2784: 1pm-2pm | F2784: 5 | G2784: 2 | H2784: 4 | I2784: 0 | J2784: =RC[-1]/RC[-2] -> 0
A2785: 232 | B2785: 1 | C2785: Friday | D2785: 5 | E2785: 2pm-3pm | F2785: 6 | G2785: 2 | H2785: 4 | I2785: 0 | J2785: =RC[-1]/RC[-2] -> 0
A2786: 232 | B2786: 1 | C2786: Friday | D2786: 5 | E2786: 3pm-4pm | F2786: 7 | G2786: 1 | H2786: 4 | I2786: 4 | J2786: =RC[-1]/RC[-2] -> 1
A2787: 232 | B2787: 1 | C2787: Friday | D2787: 5 | E2787: 4pm-5pm | F2787: 8 | G2787: 1 | H2787: 4 | I2787: 6 | J2787: =RC[-1]/RC[-2] -> 1.5
A2788: 233 | B2788: 1 | C2788: Monday | D2788: 1 | E2788: 9am-10am | F2788: 1 | G2788: 2 | H2788: 4 | I2788: 0 | J2788: =RC[-1]/RC[-2] -> 0
A2789: 233 | B2789: 1 | C2789: Monday | D2789: 1 | E2789: 10am-11am | F2789: 2 | G2789: 2 | H2789: 4 | I2789: 0 | J2789: =RC[-1]/RC[-2] -> 0
A2790: 233 | B2790: 1 | C2790: Monday | D2790: 1 | E2790: 11am-12pm | F2790: 3 | G2790: 2 | H2790: 4 | I2790: 0 | J2790: =RC[-1]/RC[-2] -> 0
A2791: 233 | B2791: 1 | C2791: Monday | D2791: 1 | E2791: 12pm-1pm | F2791: 4 | G2791: 2 | H2791: 4 | I2791: 0 | J2791: =RC[-1]/RC[-2] -> 0
A2792: 233 | B2792: 1 | C2792: Monday | D2792: 1 | E2792: 1pm-2pm | F2792: 5 | G2792: 2 | H2792: 4 | I2792: 0 | J2792: =RC[-1]/RC[-2] -> 0
A2793: 233 | B2793: 1 | C2793: Monday | D2793: 1 | E2793: 2pm-3pm | F2793: 6 | G2793: 2 | H2793: 4 | I2793: 0 | J2793: =RC[-1]/RC[-2] -> 0
A2794: 233 | B2794: 1 | C2794: Monday | D2794: 1 | E2794: 3pm-4pm | F2794: 7 | G2794: 2 | H2794: 4 | I2794: 0 | J2794: =RC[-1]/RC[-2] -> 0
A2795: 233 | B2795: 1 | C2795: Monday | D2795: 1 | E2795: 4pm-5pm | F2795: 8 | G2795: 2 | H2795: 4 | I2795: 0 | J2795: =RC[-1]/RC[-2] -> 0
A2796: 233 | B2796: 1 | C2796: Tuesday | D2796: 2 | E2796: 9am-10am | F2796: 1 | G2796: 1 | H2796: 4 | I2796: 6 | J2796: =RC[-1]/RC[-2] -> 1.5
A2797: 233 | B2797: 1 | C2797: Tuesday | D2797: 2 | E2797: 10am-11am | F2797: 2 | G2797: 1 | H2797: 4 | I2797: 13 | J2797: =RC[-1]/RC[-2] -> 3.25
A2798: 233 | B2798: 1 | C2798: Tuesday | D2798: 2 | E2798: 11am-12pm | F2798: 3 | G2798: 1 | H2798: 4 | I2798: 5 | J2798: =RC[-1]/RC[-2] -> 1.25
A2799: 233 | B2799: 1 | C2799: Tuesday | D2799: 2 | E2799: 12pm-1pm | F2799: 4 | G2799: 2 | H2799: 4 | I2799: 0 | J2799: =RC[-1]/RC[-2] -> 0
A2800: 233 | B2800: 1 | C2800: Tuesday | D2800: 2 | E2800: 1pm-2pm | F2800: 5 | G2800: 2 | H2800: 4 | I2800: 0 | J2800: =RC[-1]/RC[-2] -> 0
A2801: 233 | B2801: 1 | C2801: Tuesday | D2801: 2 | E2801: 2pm-3pm | F2801: 6 | G2801: 1 | H2801: 4 | I2801: 1 | J2801: =RC[-1]/RC[-2] -> 0.25
A2802: 233 | B2802: 1 | C2802: Tuesday | D2802: 2 | E2802: 3pm-4pm | F2802: 7 | G2802: 2 | H2802: 4 | I2802: 0 | J2802: =RC[-1]/RC[-2] -> 0
A2803: 233 | B2803: 1 | C2803: Tuesday | D2803: 2 | E2803: 4pm-5pm | F2803: 8 | G2803: 2 | H2803: 4 | I2803: 0 | J2803: =RC[-1]/RC[-2] -> 0
A2804: 233 | B2804: 1 | C2804: Wednesday | D2804: 3 | E2804: 9am-10am | F2804: 1 | G2804: 2 | H2804: 4 | I2804: 0 | J2804: =RC[-1]/RC[-2] -> 0
A2805: 233 | B2805: 1 | C2805: Wednesday | D2805: 3 | E2805: 10am-11am | F2805: 2 | G2805: 2 | H2805: 4 | I2805: 0 | J2805: =RC[-1]/RC[-2] -> 0
A2806: 233 | B2806: 1 | C2806: Wednesday | D2806: 3 | E2806: 11am-12pm | F2806: 3 | G2806: 2 | H2806: 4 | I2806: 0 | J2806: =RC[-1]/RC[-2] -> 0
A2807: 233 | B2807: 1 | C2807: Wednesday | D2807: 3 | E2807: 12pm-1pm | F2807: 4 | G2807: 2 | H2807: 4 | I2807: 0 | J2807: =RC[-1]/RC[-2] -> 0
A2808: 233 | B2808: 1 | C2808: Wednesday | D2808: 3 | E2808: 1pm-2pm | F2808: 5 | G2808: 2 | H2808: 4 | I2808: 0 | J2808: =RC[-1]/RC[-2] -> 0
A2809: 233 | B2809: 1 | C2809: Wednesday | D2809: 3 | E2809: 2pm-3pm | F2809: 6 | G2809: 2 | H2809: 4 | I2809: 0 | J2809: =RC[-1]/RC[-2] -> 0
A2810: 233 | B2810: 1 | C2810: Wednesday | D2810: 3 | E2810: 3pm-4pm | F2810: 7 | G2810: 2 | H2810: 4 | I2810: 0 | J2810: =RC[-1]/RC[-2] -> 0
A2811: 233 | B2811: 1 | C2811: Wednesday | D2811: 3 | E2811: 4pm-5pm | F2811: 8 | G2811: 2 | H2811: 4 | I2811: 0 | J2811: =RC[-1]/RC[-2] -> 0
A2812: 233 | B2812: 1 | C2812: Thursday | D2812: 4 | E2812: 9am-10am | F2812: 1 | G2812: 2 | H2812: 4 | I2812: 0 | J2812: =RC[-1]/RC[-2] -> 0
A2813: 233 | B2813: 1 | C2813: Thursday | D2813: 4 | E2813: 10am-11am | F2813: 2 | G2813: 2 | H2813: 4 | I2813: 0 | J2813: =RC[-1]/RC[-2] -> 0
A2814: 233 | B2814: 1 | C2814: Thursday | D2814: 4 | E2814: 11am-12pm | F2814: 3 | G2814: 1 | H2814: 4 | I2814: 9 | J2814: =RC[-1]/RC[-2] -> 2.25
A2815: 233 | B2815: 1 | C2815: Thursday | D2815: 4 | E2815: 12pm-1pm | F2815: 4 | G2815: 1 | H2815: 4 | I2815: 3 | J2815: =RC[-1]/RC[-2] -> 0.75
A2816: 233 | B2816: 1 | C2816: Thursday | D2816: 4 | E2816: 1pm-2pm | F2816: 5 | G2816: 2 | H2816: 4 | I2816: 0 | J2816: =RC[-1]/RC[-2] -> 0
A2817: 233 | B2817: 1 | C2817: Thursday | D2817: 4 | E2817: 2pm-3pm | F2817: 6 | G2817: 2 | H2817: 4 | I2817: 0 | J2817: =RC[-1]/RC[-2] -> 0
A2818: 233 | B2818: 1 | C2818: Thursday | D2818: 4 | E2818: 3pm-4pm | F2818: 7 | G2818: 2 | H2818: 4 | I2818: 0 | J2818: =RC[-1]/RC[-2] -> 0
A2819: 233 | B2819: 1 | C2819: Thursday | D2819: 4 | E2819: 4pm-5pm | F2819: 8 | G2819: 2 | H2819: 4 | I2819: 0 | J2819: =RC[-1]/RC[-2] -> 0
A2820: 233 | B2820: 1 | C2820: Friday | D2820: 5 | E2820: 9am-10am | F2820: 1 | G2820: 2 | H2820: 4 | I2820: 0 | J2820: =RC[-1]/RC[-2] -> 0
A2821: 233 | B2821: 1 | C2821: Friday | D2821: 5 | E2821: 10am-11am | F2821: 2 | G2821: 2 | H2821: 4 | I2821: 0 | J2821: =RC[-1]/RC[-2] -> 0
A2822: 233 | B2822: 1 | C2822: Friday | D2822: 5 | E2822: 11am-12pm | F2822: 3 | G2822: 2 | H2822: 4 | I2822: 0 | J2822: =RC[-1]/RC[-2] -> 0
A2823: 233 | B2823: 1 | C2823: Friday | D2823: 5 | E2823: 12pm-1pm | F2823: 4 | G2823: 2 | H2823: 4 | I2823: 0 | J2823: =RC[-1]/RC[-2] -> 0
A2824: 233 | B2824: 1 | C2824: Friday | D2824: 5 | E2824: 1pm-2pm | F2824: 5 | G2824: 2 | H2824: 4 | I2824: 0 | J2824: =RC[-1]/RC[-2] -> 0
A2825: 233 | B2825: 1 | C2825: Friday | D2825: 5 | E2825: 2pm-3pm | F2825: 6 | G2825: 2 | H2825: 4 | I2825: 0 | J2825: =RC[-1]/RC[-2] -> 0
A2826: 233 | B2826: 1 | C2826: Friday | D2826: 5 | E2826: 3pm-4pm | F2826: 7 | G2826: 2 | H2826: 4 | I2826: 0 | J2826: =RC[-1]/RC[-2] -> 0
A2827: 233 | B2827: 1 | C2827: Friday | D2827: 5 | E2827: 4pm-5pm | F2827: 8 | G2827: 2 | H2827: 4 | I2827: 0 | J2827: =RC[-1]/RC[-2] -> 0
A2828: 234 | B2828: 1 | C2828: Monday | D2828: 1 | E2828: 9am-10am | F2828: 1 | G2828: 2 | H2828: 4 | I2828: 0 | J2828: =RC[-1]/RC[-2] -> 0
A2829: 234 | B2829: 1 | C2829: Monday | D2829: 1 | E2829: 10am-11am | F2829: 2 | G2829: 2 | H2829: 4 | I2829: 0 | J2829: =RC[-1]/RC[-2] -> 0
A2830: 234 | B2830: 1 | C2830: Monday | D2830: 1 | E2830: 11am-12pm | F2830: 3 | G2830: 2 | H2830: 4 | I2830: 0 | J2830: =RC[-1]/RC[-2] -> 0
A2831: 234 | B2831: 1 | C2831: Monday | D2831: 1 | E2831: 12pm-1pm | F2831: 4 | G2831: 1 | H2831: 4 | I2831: 1 | J2831: =RC[-1]/RC[-2] -> 0.25
A2832: 234 | B2832: 1 | C2832: Monday | D2832: 1 | E2832: 1pm-2pm | F2832: 5 | G2832: 2 | H2832: 4 | I2832: 0 | J2832: =RC[-1]/RC[-2] -> 0
A2833: 234 | B2833: 1 | C2833: Monday | D2833: 1 | E2833: 2pm-3pm | F2833: 6 | G2833: 3 | H2833: 4 | I2833: 1 | J2833: =RC[-1]/RC[-2] -> 0.25
A2834: 234 | B2834: 1 | C2834: Monday | D2834: 1 | E2834: 3pm-4pm | F2834: 7 | G2834: 2 | H2834: 4 | I2834: 0 | J2834: =RC[-1]/RC[-2] -> 0
A2835: 234 | B2835: 1 | C2835: Monday | D2835: 1 | E2835: 4pm-5pm | F2835: 8 | G2835: 2 | H2835: 4 | I2835: 0 | J2835: =RC[-1]/RC[-2] -> 0
A2836: 234 | B2836: 1 | C2836: Tuesday | D2836: 2 | E2836: 9am-10am | F2836: 1 | G2836: 1 | H2836: 4 | I2836: 2 | J2836: =RC[-1]/RC[-2] -> 0.5
A2837: 234 | B2837: 1 | C2837: Tuesday | D2837: 2 | E2837: 10am-11am | F2837: 2 | G2837: 1 | H2837: 4 | I2837: 6 | J2837: =RC[-1]/RC[-2] -> 1.5
A2838: 234 | B2838: 1 | C2838: Tuesday | D2838: 2 | E2838: 11am-12pm | F2838: 3 | G2838: 1 | H2838: 4 | I2838: 7 | J2838: =RC[-1]/RC[-2] -> 1.75
A2839: 234 | B2839: 1 | C2839: Tuesday | D2839: 2 | E2839: 12pm-1pm | F2839: 4 | G2839: 2 | H2839: 4 | I2839: 0 | J2839: =RC[-1]/RC[-2] -> 0
A2840: 234 | B2840: 1 | C2840: Tuesday | D2840: 2 | E2840: 1pm-2pm | F2840: 5 | G2840: 2 | H2840: 4 | I2840: 0 | J2840: =RC[-1]/RC[-2] -> 0
A2841: 234 | B2841: 1 | C2841: Tuesday | D2841: 2 | E2841: 2pm-3pm | F2841: 6 | G2841: 2 | H2841: 4 | I2841: 0 | J2841: =RC[-1]/RC[-2] -> 0
A2842: 234 | B2842: 1 | C2842: Tuesday | D2842: 2 | E2842: 3pm-4pm | F2842: 7 | G2842: 2 | H2842: 4 | I2842: 0 | J2842: =RC[-1]/RC[-2] -> 0
A2843: 234 | B2843: 1 | C2843: Tuesday | D2843: 2 | E2843: 4pm-5pm | F2843: 8 | G2843: 2 | H2843: 4 | I2843: 0 | J2843: =RC[-1]/RC[-2] -> 0
A2844: 234 | B2844: 1 | C2844: Wednesday | D2844: 3 | E2844: 9am-10am | F2844: 1 | G2844: 2 | H2844: 4 | I2844: 0 | J2844: =RC[-1]/RC[-2] -> 0
A2845: 234 | B2845: 1 | C2845: Wednesday | D2845: 3 | E2845: 10am-11am | F2845: 2 | G2845: 2 | H2845: 4 | I2845: 0 | J2845: =RC[-1]/RC[-2] -> 0
A2846: 234 | B2846: 1 | C2846: Wednesday | D2846: 3 | E2846: 11am-12pm | F2846: 3 | G2846: 2 | H2846: 4 | I2846: 0 | J2846: =RC[-1]/RC[-2] -> 0
A2847: 234 | B2847: 1 | C2847: Wednesday | D2847: 3 | E2847: 12pm-1pm | F2847: 4 | G2847: 2 | H2847: 4 | I2847: 0 | J2847: =RC[-1]/RC[-2] -> 0
A2848: 234 | B2848: 1 | C2848: Wednesday | D2848: 3 | E2848: 1pm-2pm | F2848: 5 | G2848: 2 | H2848: 4 | I2848: 0 | J2848: =RC[-1]/RC[-2] -> 0
A2849: 234 | B2849: 1 | C2849: Wednesday | D2849: 3 | E2849: 2pm-3pm | F2849: 6 | G2849: 2 | H2849: 4 | I2849: 0 | J2849: =RC[-1]/RC[-2] -> 0
A2850: 234 | B2850: 1 | C2850: Wednesday | D2850: 3 | E2850: 3pm-4pm | F2850: 7 | G2850: 2 | H2850: 4 | I2850: 0 | J2850: =RC[-1]/RC[-2] -> 0
A2851: 234 | B2851: 1 | C2851: Wednesday | D2851: 3 | E2851: 4pm-5pm | F2851: 8 | G2851: 3 | H2851: 4 | I2851: 2 | J2851: =RC[-1]/RC[-2] -> 0.5
A2852: 234 | B2852: 1 | C2852: Thursday | D2852: 4 | E2852: 9am-10am | F2852: 1 | G2852: 2 | H2852: 4 | I2852: 0 | J2852: =RC[-1]/RC[-2] -> 0
A2853: 234 | B2853: 1 | C2853: Thursday | D2853: 4 | E2853: 10am-11am | F2853: 2 | G2853: 1 | H2853: 4 | I2853: 11 | J2853: =RC[-1]/RC[-2] -> 2.75
A2854: 234 | B2854: 1 | C2854: Thursday | D2854: 4 | E2854: 11am-12pm | F2854: 3 | G2854: 1 | H2854: 4 | I2854: 4 | J2854: =RC[-1]/RC[-2] -> 1
A2855: 234 | B2855: 1 | C2855: Thursday | D2855: 4 | E2855: 12pm-1pm | F2855: 4 | G2855: 1 | H2855: 4 | I2855: 10 | J2855: =RC[-1]/RC[-2] -> 2.5
A2856: 234 | B2856: 1 | C2856: Thursday | D2856: 4 | E2856: 1pm-2pm | F2856: 5 | G2856: 1 | H2856: 4 | I2856: 2 | J2856: =RC[-1]/RC[-2] -> 0.5
A2857: 234 | B2857: 1 | C2857: Thursday | D2857: 4 | E2857: 2pm-3pm | F2857: 6 | G2857: 3 | H2857: 4 | I2857: 1 | J2857: =RC[-1]/RC[-2] -> 0.25
A2858: 234 | B2858: 1 | C2858: Thursday | D2858: 4 | E2858: 3pm-4pm | F2858: 7 | G2858: 2 | H2858: 4 | I2858: 0 | J2858: =RC[-1]/RC[-2] -> 0
A2859: 234 | B2859: 1 | C2859: Thursday | D2859: 4 | E2859: 4pm-5pm | F2859: 8 | G2859: 2 | H2859: 4 | I2859: 0 | J2859: =RC[-1]/RC[-2] -> 0
A2860: 234 | B2860: 1 | C2860: Friday | D2860: 5 | E2860: 9am-10am | F2860: 1 | G2860: 2 | H2860: 4 | I2860: 0 | J2860: =RC[-1]/RC[-2] -> 0
A2861: 234 | B2861: 1 | C2861: Friday | D2861: 5 | E2861: 10am-11am | F2861: 2 | G2861: 3 | H2861: 4 | I2861: 1 | J2861: =RC[-1]/RC[-2] -> 0.25
A2862: 234 | B2862: 1 | C2862: Friday | D2862: 5 | E2862: 11am-12pm | F2862: 3 | G2862: 2 | H2862: 4 | I2862: 0 | J2862: =RC[-1]/RC[-2] -> 0
A2863: 234 | B2863: 1 | C2863: Friday | D2863: 5 | E2863: 12pm-1pm | F2863: 4 | G2863: 2 | H2863: 4 | I2863: 0 | J2863: =RC[-1]/RC[-2] -> 0
A2864: 234 | B2864: 1 | C2864: Friday | D2864: 5 | E2864: 1pm-2pm | F2864: 5 | G2864: 2 | H2864: 4 | I2864: 0 | J2864: =RC[-1]/RC[-2] -> 0
A2865: 234 | B2865: 1 | C2865: Friday | D2865: 5 | E2865: 2pm-3pm | F2865: 6 | G2865: 1 | H2865: 4 | I2865: 13 | J2865: =RC[-1]/RC[-2] -> 3.25
A2866: 234 | B2866: 1 | C2866: Friday | D2866: 5 | E2866: 3pm-4pm | F2866: 7 | G2866: 1 | H2866: 4 | I2866: 5 | J2866: =RC[-1]/RC[-2] -> 1.25
A2867: 234 | B2867: 1 | C2867: Friday | D2867: 5 | E2867: 4pm-5pm | F2867: 8 | G2867: 1 | H2867: 4 | I2867: 6 | J2867: =RC[-1]/RC[-2] -> 1.5
A2868: 237 | B2868: 1 | C2868: Monday | D2868: 1 | E2868: 9am-10am | F2868: 1 | G2868: 2 | H2868: 44 | I2868: 0 | J2868: =RC[-1]/RC[-2] -> 0
A2869: 237 | B2869: 1 | C2869: Monday | D2869: 1 | E2869: 10am-11am | F2869: 2 | G2869: 2 | H2869: 44 | I2869: 0 | J2869: =RC[-1]/RC[-2] -> 0
A2870: 237 | B2870: 1 | C2870: Monday | D2870: 1 | E2870: 11am-12pm | F2870: 3 | G2870: 2 | H2870: 44 | I2870: 0 | J2870: =RC[-1]/RC[-2] -> 0
A2871: 237 | B2871: 1 | C2871: Monday | D2871: 1 | E2871: 12pm-1pm | F2871: 4 | G2871: 2 | H2871: 44 | I2871: 0 | J2871: =RC[-1]/RC[-2] -> 0
A2872: 237 | B2872: 1 | C2872: Monday | D2872: 1 | E2872: 1pm-2pm | F2872: 5 | G2872: 1 | H2872: 44 | I2872: 13 | J2872: =RC[-1]/RC[-2] -> 0.29545454545454547
A2873: 237 | B2873: 1 | C2873: Monday | D2873: 1 | E2873: 2pm-3pm | F2873: 6 | G2873: 1 | H2873: 44 | I2873: 12 | J2873: =RC[-1]/RC[-2] -> 0.27272727272727271
A2874: 237 | B2874: 1 | C2874: Monday | D2874: 1 | E2874: 3pm-4pm | F2874: 7 | G2874: 1 | H2874: 44 | I2874: 12 | J2874: =RC[-1]/RC[-2] -> 0.27272727272727271
A2875: 237 | B2875: 1 | C2875: Monday | D2875: 1 | E2875: 4pm-5pm | F2875: 8 | G2875: 1 | H2875: 44 | I2875: 12 | J2875: =RC[-1]/RC[-2] -> 0.27272727272727271
A2876: 237 | B2876: 1 | C2876: Tuesday | D2876: 2 | E2876: 9am-10am | F2876: 1 | G2876: 1 | H2876: 44 | I2876: 12 | J2876: =RC[-1]/RC[-2] -> 0.27272727272727271
A2877: 237 | B2877: 1 | C2877: Tuesday | D2877: 2 | E2877: 10am-11am | F2877: 2 | G2877: 1 | H2877: 44 | I2877: 10 | J2877: =RC[-1]/RC[-2] -> 0.22727272727272727
A2878: 237 | B2878: 1 | C2878: Tuesday | D2878: 2 | E2878: 11am-12pm | F2878: 3 | G2878: 1 | H2878: 44 | I2878: 16 | J2878: =RC[-1]/RC[-2] -> 0.36363636363636365
A2879: 237 | B2879: 1 | C2879: Tuesday | D2879: 2 | E2879: 12pm-1pm | F2879: 4 | G2879: 2 | H2879: 44 | I2879: 0 | J2879: =RC[-1]/RC[-2] -> 0
A2880: 237 | B2880: 1 | C2880: Tuesday | D2880: 2 | E2880: 1pm-2pm | F2880: 5 | G2880: 2 | H2880: 44 | I2880: 0 | J2880: =RC[-1]/RC[-2] -> 0
A2881: 237 | B2881: 1 | C2881: Tuesday | D2881: 2 | E2881: 2pm-3pm | F2881: 6 | G2881: 1 | H2881: 44 | I2881: 2 | J2881: =RC[-1]/RC[-2] -> 4.5454545454545456E-2
A2882: 237 | B2882: 1 | C2882: Tuesday | D2882: 2 | E2882: 3pm-4pm | F2882: 7 | G2882: 2 | H2882: 44 | I2882: 0 | J2882: =RC[-1]/RC[-2] -> 0
A2883: 237 | B2883: 1 | C2883: Tuesday | D2883: 2 | E2883: 4pm-5pm | F2883: 8 | G2883: 1 | H2883: 44 | I2883: 3 | J2883: =RC[-1]/RC[-2] -> 6.8181818181818177E-2
A2884: 237 | B2884: 1 | C2884: Wednesday | D2884: 3 | E2884: 9am-10am | F2884: 1 | G2884: 2 | H2884: 44 | I2884: 0 | J2884: =RC[-1]/RC[-2] -> 0
A2885: 237 | B2885: 1 | C2885: Wednesday | D2885: 3 | E2885: 10am-11am | F2885: 2 | G2885: 2 | H2885: 44 | I2885: 0 | J2885: =RC[-1]/RC[-2] -> 0
A2886: 237 | B2886: 1 | C2886: Wednesday | D2886: 3 | E2886: 11am-12pm | F2886: 3 | G2886: 2 | H2886: 44 | I2886: 0 | J2886: =RC[-1]/RC[-2] -> 0
A2887: 237 | B2887: 1 | C2887: Wednesday | D2887: 3 | E2887: 12pm-1pm | F2887: 4 | G2887: 2 | H2887: 44 | I2887: 0 | J2887: =RC[-1]/RC[-2] -> 0
A2888: 237 | B2888: 1 | C2888: Wednesday | D2888: 3 | E2888: 1pm-2pm | F2888: 5 | G2888: 1 | H2888: 44 | I2888: 3 | J2888: =RC[-1]/RC[-2] -> 6.8181818181818177E-2
A2889: 237 | B2889: 1 | C2889: Wednesday | D2889: 3 | E2889: 2pm-3pm | F2889: 6 | G2889: 1 | H2889: 44 | I2889: 12 | J2889: =RC[-1]/RC[-2] -> 0.27272727272727271
A2890: 237 | B2890: 1 | C2890: Wednesday | D2890: 3 | E2890: 3pm-4pm | F2890: 7 | G2890: 1 | H2890: 44 | I2890: 11 | J2890: =RC[-1]/RC[-2] -> 0.25
A2891: 237 | B2891: 1 | C2891: Wednesday | D2891: 3 | E2891: 4pm-5pm | F2891: 8 | G2891: 1 | H2891: 44 | I2891: 11 | J2891: =RC[-1]/RC[-2] -> 0.25
A2892: 237 | B2892: 1 | C2892: Thursday | D2892: 4 | E2892: 9am-10am | F2892: 1 | G2892: 2 | H2892: 44 | I2892: 0 | J2892: =RC[-1]/RC[-2] -> 0
A2893: 237 | B2893: 1 | C2893: Thursday | D2893: 4 | E2893: 10am-11am | F2893: 2 | G2893: 1 | H2893: 44 | I2893: 13 | J2893: =RC[-1]/RC[-2] -> 0.29545454545454547
A2894: 237 | B2894: 1 | C2894: Thursday | D2894: 4 | E2894: 11am-12pm | F2894: 3 | G2894: 1 | H2894: 44 | I2894: 12 | J2894: =RC[-1]/RC[-2] -> 0.27272727272727271
A2895: 237 | B2895: 1 | C2895: Thursday | D2895: 4 | E2895: 12pm-1pm | F2895: 4 | G2895: 1 | H2895: 44 | I2895: 10 | J2895: =RC[-1]/RC[-2] -> 0.22727272727272727
A2896: 237 | B2896: 1 | C2896: Thursday | D2896: 4 | E2896: 1pm-2pm | F2896: 5 | G2896: 1 | H2896: 44 | I2896: 5 | J2896: =RC[-1]/RC[-2] -> 0.11363636363636363
A2897: 237 | B2897: 1 | C2897: Thursday | D2897: 4 | E2897: 2pm-3pm | F2897: 6 | G2897: 2 | H2897: 44 | I2897: 0 | J2897: =RC[-1]/RC[-2] -> 0
A2898: 237 | B2898: 1 | C2898: Thursday | D2898: 4 | E2898: 3pm-4pm | F2898: 7 | G2898: 2 | H2898: 44 | I2898: 0 | J2898: =RC[-1]/RC[-2] -> 0
A2899: 237 | B2899: 1 | C2899: Thursday | D2899: 4 | E2899: 4pm-5pm | F2899: 8 | G2899: 2 | H2899: 44 | I2899: 0 | J2899: =RC[-1]/RC[-2] -> 0
A2900: 237 | B2900: 1 | C2900: Friday | D2900: 5 | E2900: 9am-10am | F2900: 1 | G2900: 2 | H2900: 44 | I2900: 0 | J2900: =RC[-1]/RC[-2] -> 0
A2901: 237 | B2901: 1 | C2901: Friday | D2901: 5 | E2901: 10am-11am | F2901: 2 | G2901: 2 | H2901: 44 | I2901: 0 | J2901: =RC[-1]/RC[-2] -> 0
A2902: 237 | B2902: 1 | C2902: Friday | D2902: 5 | E2902: 11am-12pm | F2902: 3 | G2902: 2 | H2902: 44 | I2902: 0 | J2902: =RC[-1]/RC[-2] -> 0
A2903: 237 | B2903: 1 | C2903: Friday | D2903: 5 | E2903: 12pm-1pm | F2903: 4 | G2903: 2 | H2903: 44 | I2903: 0 | J2903: =RC[-1]/RC[-2] -> 0
A2904: 237 | B2904: 1 | C2904: Friday | D2904: 5 | E2904: 1pm-2pm | F2904: 5 | G2904: 2 | H2904: 44 | I2904: 0 | J2904: =RC[-1]/RC[-2] -> 0
A2905: 237 | B2905: 1 | C2905: Friday | D2905: 5 | E2905: 2pm-3pm | F2905: 6 | G2905: 2 | H2905: 44 | I2905: 0 | J2905: =RC[-1]/RC[-2] -> 0
A2906: 237 | B2906: 1 | C2906: Friday | D2906: 5 | E2906: 3pm-4pm | F2906: 7 | G2906: 2 | H2906: 44 | I2906: 0 | J2906: =RC[-1]/RC[-2] -> 0
A2907: 237 | B2907: 1 | C2907: Friday | D2907: 5 | E2907: 4pm-5pm | F2907: 8 | G2907: 2 | H2907: 44 | I2907: 0 | J2907: =RC[-1]/RC[-2] -> 0
A2908: 104 | B2908: 2 | C2908: Monday | D2908: 1 | E2908: 9am-10am | F2908: 1 | G2908: 3 | H2908: 20 | I2908: 1 | J2908: =RC[-1]/RC[-2] -> 0.05
A2909: 104 | B2909: 2 | C2909: Monday | D2909: 1 | E2909: 10am-11am | F2909: 2 | G2909: 3 | H2909: 20 | I2909: 1 | J2909: =RC[-1]/RC[-2] -> 0.05
A2910: 104 | B2910: 2 | C2910: Monday | D2910: 1 | E2910: 11am-12pm | F2910: 3 | G2910: 3 | H2910: 20 | I2910: 1 | J2910: =RC[-1]/RC[-2] -> 0.05
A2911: 104 | B2911: 2 | C2911: Monday | D2911: 1 | E2911: 12pm-1pm | F2911: 4 | G2911: 2 | H2911: 20 | I2911: 0 | J2911: =RC[-1]/RC[-2] -> 0
A2912: 104 | B2912: 2 | C2912: Monday | D2912: 1 | E2912: 1pm-2pm | F2912: 5 | G2912: 2 | H2912: 20 | I2912: 0 | J2912: =RC[-1]/RC[-2] -> 0
A2913: 104 | B2913: 2 | C2913: Monday | D2913: 1 | E2913: 2pm-3pm | F2913: 6 | G2913: 1 | H2913: 20 | I2913: 19 | J2913: =RC[-1]/RC[-2] -> 0.95
A2914: 104 | B2914: 2 | C2914: Monday | D2914: 1 | E2914: 3pm-4pm | F2914: 7 | G2914: 1 | H2914: 20 | I2914: 18 | J2914: =RC[-1]/RC[-2] -> 0.9
A2915: 104 | B2915: 2 | C2915: Monday | D2915: 1 | E2915: 4pm-5pm | F2915: 8 | G2915: 2 | H2915: 20 | I2915: 0 | J2915: =RC[-1]/RC[-2] -> 0
A2916: 104 | B2916: 2 | C2916: Tuesday | D2916: 2 | E2916: 9am-10am | F2916: 1 | G2916: 2 | H2916: 20 | I2916: 0 | J2916: =RC[-1]/RC[-2] -> 0
A2917: 104 | B2917: 2 | C2917: Tuesday | D2917: 2 | E2917: 10am-11am | F2917: 2 | G2917: 1 | H2917: 20 | I2917: 16 | J2917: =RC[-1]/RC[-2] -> 0.8
A2918: 104 | B2918: 2 | C2918: Tuesday | D2918: 2 | E2918: 11am-12pm | F2918: 3 | G2918: 1 | H2918: 20 | I2918: 16 | J2918: =RC[-1]/RC[-2] -> 0.8
A2919: 104 | B2919: 2 | C2919: Tuesday | D2919: 2 | E2919: 12pm-1pm | F2919: 4 | G2919: 2 | H2919: 20 | I2919: 0 | J2919: =RC[-1]/RC[-2] -> 0
A2920: 104 | B2920: 2 | C2920: Tuesday | D2920: 2 | E2920: 1pm-2pm | F2920: 5 | G2920: 2 | H2920: 20 | I2920: 0 | J2920: =RC[-1]/RC[-2] -> 0
A2921: 104 | B2921: 2 | C2921: Tuesday | D2921: 2 | E2921: 2pm-3pm | F2921: 6 | G2921: 1 | H2921: 20 | I2921: 12 | J2921: =RC[-1]/RC[-2] -> 0.6
A2922: 104 | B2922: 2 | C2922: Tuesday | D2922: 2 | E2922: 3pm-4pm | F2922: 7 | G2922: 1 | H2922: 20 | I2922: 11 | J2922: =RC[-1]/RC[-2] -> 0.55
A2923: 104 | B2923: 2 | C2923: Tuesday | D2923: 2 | E2923: 4pm-5pm | F2923: 8 | G2923: 1 | H2923: 20 | I2923: 5 | J2923: =RC[-1]/RC[-2] -> 0.25
A2924: 104 | B2924: 2 | C2924: Wednesday | D2924: 3 | E2924: 9am-10am | F2924: 1 | G2924: 2 | H2924: 20 | I2924: 0 | J2924: =RC[-1]/RC[-2] -> 0
A2925: 104 | B2925: 2 | C2925: Wednesday | D2925: 3 | E2925: 10am-11am | F2925: 2 | G2925: 2 | H2925: 20 | I2925: 0 | J2925: =RC[-1]/RC[-2] -> 0
A2926: 104 | B2926: 2 | C2926: Wednesday | D2926: 3 | E2926: 11am-12pm | F2926: 3 | G2926: 2 | H2926: 20 | I2926: 0 | J2926: =RC[-1]/RC[-2] -> 0
A2927: 104 | B2927: 2 | C2927: Wednesday | D2927: 3 | E2927: 12pm-1pm | F2927: 4 | G2927: 2 | H2927: 20 | I2927: 0 | J2927: =RC[-1]/RC[-2] -> 0
A2928: 104 | B2928: 2 | C2928: Wednesday | D2928: 3 | E2928: 1pm-2pm | F2928: 5 | G2928: 2 | H2928: 20 | I2928: 0 | J2928: =RC[-1]/RC[-2] -> 0
A2929: 104 | B2929: 2 | C2929: Wednesday | D2929: 3 | E2929: 2pm-3pm | F2929: 6 | G2929: 2 | H2929: 20 | I2929: 0 | J2929: =RC[-1]/RC[-2] -> 0
A2930: 104 | B2930: 2 | C2930: Wednesday | D2930: 3 | E2930: 3pm-4pm | F2930: 7 | G2930: 1 | H2930: 20 | I2930: 17 | J2930: =RC[-1]/RC[-2] -> 0.85
A2931: 104 | B2931: 2 | C2931: Wednesday | D2931: 3 | E2931: 4pm-5pm | F2931: 8 | G2931: 1 | H2931: 20 | I2931: 14 | J2931: =RC[-1]/RC[-2] -> 0.7
A2932: 104 | B2932: 2 | C2932: Thursday | D2932: 4 | E2932: 9am-10am | F2932: 1 | G2932: 2 | H2932: 20 | I2932: 0 | J2932: =RC[-1]/RC[-2] -> 0
A2933: 104 | B2933: 2 | C2933: Thursday | D2933: 4 | E2933: 10am-11am | F2933: 2 | G2933: 3 | H2933: 20 | I2933: 2 | J2933: =RC[-1]/RC[-2] -> 0.1
A2934: 104 | B2934: 2 | C2934: Thursday | D2934: 4 | E2934: 11am-12pm | F2934: 3 | G2934: 1 | H2934: 20 | I2934: 20 | J2934: =RC[-1]/RC[-2] -> 1
A2935: 104 | B2935: 2 | C2935: Thursday | D2935: 4 | E2935: 12pm-1pm | F2935: 4 | G2935: 1 | H2935: 20 | I2935: 3 | J2935: =RC[-1]/RC[-2] -> 0.15
A2936: 104 | B2936: 2 | C2936: Thursday | D2936: 4 | E2936: 1pm-2pm | F2936: 5 | G2936: 2 | H2936: 20 | I2936: 0 | J2936: =RC[-1]/RC[-2] -> 0
A2937: 104 | B2937: 2 | C2937: Thursday | D2937: 4 | E2937: 2pm-3pm | F2937: 6 | G2937: 1 | H2937: 20 | I2937: 20 | J2937: =RC[-1]/RC[-2] -> 1
A2938: 104 | B2938: 2 | C2938: Thursday | D2938: 4 | E2938: 3pm-4pm | F2938: 7 | G2938: 2 | H2938: 20 | I2938: 0 | J2938: =RC[-1]/RC[-2] -> 0
A2939: 104 | B2939: 2 | C2939: Thursday | D2939: 4 | E2939: 4pm-5pm | F2939: 8 | G2939: 2 | H2939: 20 | I2939: 0 | J2939: =RC[-1]/RC[-2] -> 0
A2940: 104 | B2940: 2 | C2940: Friday | D2940: 5 | E2940: 9am-10am | F2940: 1 | G2940: 2 | H2940: 20 | I2940: 0 | J2940: =RC[-1]/RC[-2] -> 0
A2941: 104 | B2941: 2 | C2941: Friday | D2941: 5 | E2941: 10am-11am | F2941: 2 | G2941: 2 | H2941: 20 | I2941: 0 | J2941: =RC[-1]/RC[-2] -> 0
A2942: 104 | B2942: 2 | C2942: Friday | D2942: 5 | E2942: 11am-12pm | F2942: 3 | G2942: 2 | H2942: 20 | I2942: 0 | J2942: =RC[-1]/RC[-2] -> 0
A2943: 104 | B2943: 2 | C2943: Friday | D2943: 5 | E2943: 12pm-1pm | F2943: 4 | G2943: 2 | H2943: 20 | I2943: 0 | J2943: =RC[-1]/RC[-2] -> 0
A2944: 104 | B2944: 2 | C2944: Friday | D2944: 5 | E2944: 1pm-2pm | F2944: 5 | G2944: 2 | H2944: 20 | I2944: 0 | J2944: =RC[-1]/RC[-2] -> 0
A2945: 104 | B2945: 2 | C2945: Friday | D2945: 5 | E2945: 2pm-3pm | F2945: 6 | G2945: 1 | H2945: 20 | I2945: 11 | J2945: =RC[-1]/RC[-2] -> 0.55
A2946: 104 | B2946: 2 | C2946: Friday | D2946: 5 | E2946: 3pm-4pm | F2946: 7 | G2946: 2 | H2946: 20 | I2946: 0 | J2946: =RC[-1]/RC[-2] -> 0
A2947: 104 | B2947: 2 | C2947: Friday | D2947: 5 | E2947: 4pm-5pm | F2947: 8 | G2947: 2 | H2947: 20 | I2947: 0 | J2947: =RC[-1]/RC[-2] -> 0
A2948: 111 | B2948: 2 | C2948: Monday | D2948: 1 | E2948: 9am-10am | F2948: 1 | G2948: 2 | H2948: 20 | I2948: 0 | J2948: =RC[-1]/RC[-2] -> 0
A2949: 111 | B2949: 2 | C2949: Monday | D2949: 1 | E2949: 10am-11am | F2949: 2 | G2949: 2 | H2949: 20 | I2949: 0 | J2949: =RC[-1]/RC[-2] -> 0
A2950: 111 | B2950: 2 | C2950: Monday | D2950: 1 | E2950: 11am-12pm | F2950: 3 | G2950: 2 | H2950: 20 | I2950: 0 | J2950: =RC[-1]/RC[-2] -> 0
A2951: 111 | B2951: 2 | C2951: Monday | D2951: 1 | E2951: 12pm-1pm | F2951: 4 | G2951: 2 | H2951: 20 | I2951: 0 | J2951: =RC[-1]/RC[-2] -> 0
A2952: 111 | B2952: 2 | C2952: Monday | D2952: 1 | E2952: 1pm-2pm | F2952: 5 | G2952: 2 | H2952: 20 | I2952: 0 | J2952: =RC[-1]/RC[-2] -> 0
A2953: 111 | B2953: 2 | C2953: Monday | D2953: 1 | E2953: 2pm-3pm | F2953: 6 | G2953: 2 | H2953: 20 | I2953: 0 | J2953: =RC[-1]/RC[-2] -> 0
A2954: 111 | B2954: 2 | C2954: Monday | D2954: 1 | E2954: 3pm-4pm | F2954: 7 | G2954: 3 | H2954: 20 | I2954: 1 | J2954: =RC[-1]/RC[-2] -> 0.05
A2955: 111 | B2955: 2 | C2955: Monday | D2955: 1 | E2955: 4pm-5pm | F2955: 8 | G2955: 2 | H2955: 20 | I2955: 0 | J2955: =RC[-1]/RC[-2] -> 0
A2956: 111 | B2956: 2 | C2956: Tuesday | D2956: 2 | E2956: 9am-10am | F2956: 1 | G2956: 2 | H2956: 20 | I2956: 0 | J2956: =RC[-1]/RC[-2] -> 0
A2957: 111 | B2957: 2 | C2957: Tuesday | D2957: 2 | E2957: 10am-11am | F2957: 2 | G2957: 1 | H2957: 20 | I2957: 16 | J2957: =RC[-1]/RC[-2] -> 0.8
A2958: 111 | B2958: 2 | C2958: Tuesday | D2958: 2 | E2958: 11am-12pm | F2958: 3 | G2958: 1 | H2958: 20 | I2958: 20 | J2958: =RC[-1]/RC[-2] -> 1
A2959: 111 | B2959: 2 | C2959: Tuesday | D2959: 2 | E2959: 12pm-1pm | F2959: 4 | G2959: 1 | H2959: 20 | I2959: 2 | J2959: =RC[-1]/RC[-2] -> 0.1
A2960: 111 | B2960: 2 | C2960: Tuesday | D2960: 2 | E2960: 1pm-2pm | F2960: 5 | G2960: 2 | H2960: 20 | I2960: 0 | J2960: =RC[-1]/RC[-2] -> 0
A2961: 111 | B2961: 2 | C2961: Tuesday | D2961: 2 | E2961: 2pm-3pm | F2961: 6 | G2961: 1 | H2961: 20 | I2961: 25 | J2961: =RC[-1]/RC[-2] -> 1.25
A2962: 111 | B2962: 2 | C2962: Tuesday | D2962: 2 | E2962: 3pm-4pm | F2962: 7 | G2962: 1 | H2962: 20 | I2962: 14 | J2962: =RC[-1]/RC[-2] -> 0.7
A2963: 111 | B2963: 2 | C2963: Tuesday | D2963: 2 | E2963: 4pm-5pm | F2963: 8 | G2963: 1 | H2963: 20 | I2963: 17 | J2963: =RC[-1]/RC[-2] -> 0.85
A2964: 111 | B2964: 2 | C2964: Wednesday | D2964: 3 | E2964: 9am-10am | F2964: 1 | G2964: 1 | H2964: 20 | I2964: 18 | J2964: =RC[-1]/RC[-2] -> 0.9
A2965: 111 | B2965: 2 | C2965: Wednesday | D2965: 3 | E2965: 10am-11am | F2965: 2 | G2965: 1 | H2965: 20 | I2965: 15 | J2965: =RC[-1]/RC[-2] -> 0.75
A2966: 111 | B2966: 2 | C2966: Wednesday | D2966: 3 | E2966: 11am-12pm | F2966: 3 | G2966: 1 | H2966: 20 | I2966: 6 | J2966: =RC[-1]/RC[-2] -> 0.3
A2967: 111 | B2967: 2 | C2967: Wednesday | D2967: 3 | E2967: 12pm-1pm | F2967: 4 | G2967: 2 | H2967: 20 | I2967: 0 | J2967: =RC[-1]/RC[-2] -> 0
A2968: 111 | B2968: 2 | C2968: Wednesday | D2968: 3 | E2968: 1pm-2pm | F2968: 5 | G2968: 2 | H2968: 20 | I2968: 0 | J2968: =RC[-1]/RC[-2] -> 0
A2969: 111 | B2969: 2 | C2969: Wednesday | D2969: 3 | E2969: 2pm-3pm | F2969: 6 | G2969: 2 | H2969: 20 | I2969: 0 | J2969: =RC[-1]/RC[-2] -> 0
A2970: 111 | B2970: 2 | C2970: Wednesday | D2970: 3 | E2970: 3pm-4pm | F2970: 7 | G2970: 2 | H2970: 20 | I2970: 0 | J2970: =RC[-1]/RC[-2] -> 0
A2971: 111 | B2971: 2 | C2971: Wednesday | D2971: 3 | E2971: 4pm-5pm | F2971: 8 | G2971: 2 | H2971: 20 | I2971: 0 | J2971: =RC[-1]/RC[-2] -> 0
A2972: 111 | B2972: 2 | C2972: Thursday | D2972: 4 | E2972: 9am-10am | F2972: 1 | G2972: 1 | H2972: 20 | I2972: 13 | J2972: =RC[-1]/RC[-2] -> 0.65
A2973: 111 | B2973: 2 | C2973: Thursday | D2973: 4 | E2973: 10am-11am | F2973: 2 | G2973: 1 | H2973: 20 | I2973: 15 | J2973: =RC[-1]/RC[-2] -> 0.75
A2974: 111 | B2974: 2 | C2974: Thursday | D2974: 4 | E2974: 11am-12pm | F2974: 3 | G2974: 2 | H2974: 20 | I2974: 0 | J2974: =RC[-1]/RC[-2] -> 0
A2975: 111 | B2975: 2 | C2975: Thursday | D2975: 4 | E2975: 12pm-1pm | F2975: 4 | G2975: 2 | H2975: 20 | I2975: 0 | J2975: =RC[-1]/RC[-2] -> 0
A2976: 111 | B2976: 2 | C2976: Thursday | D2976: 4 | E2976: 1pm-2pm | F2976: 5 | G2976: 2 | H2976: 20 | I2976: 0 | J2976: =RC[-1]/RC[-2] -> 0
A2977: 111 | B2977: 2 | C2977: Thursday | D2977: 4 | E2977: 2pm-3pm | F2977: 6 | G2977: 1 | H2977: 20 | I2977: 14 | J2977: =RC[-1]/RC[-2] -> 0.7
A2978: 111 | B2978: 2 | C2978: Thursday | D2978: 4 | E2978: 3pm-4pm | F2978: 7 | G2978: 1 | H2978: 20 | I2978: 15 | J2978: =RC[-1]/RC[-2] -> 0.75
A2979: 111 | B2979: 2 | C2979: Thursday | D2979: 4 | E2979: 4pm-5pm | F2979: 8 | G2979: 3 | H2979: 20 | I2979: 2 | J2979: =RC[-1]/RC[-2] -> 0.1
A2980: 111 | B2980: 2 | C2980: Friday | D2980: 5 | E2980: 9am-10am | F2980: 1 | G2980: 2 | H2980: 20 | I2980: 0 | J2980: =RC[-1]/RC[-2] -> 0
A2981: 111 | B2981: 2 | C2981: Friday | D2981: 5 | E2981: 10am-11am | F2981: 2 | G2981: 3 | H2981: 20 | I2981: 1 | J2981: =RC[-1]/RC[-2] -> 0.05
A2982: 111 | B2982: 2 | C2982: Friday | D2982: 5 | E2982: 11am-12pm | F2982: 3 | G2982: 1 | H2982: 20 | I2982: 1 | J2982: =RC[-1]/RC[-2] -> 0.05
A2983: 111 | B2983: 2 | C2983: Friday | D2983: 5 | E2983: 12pm-1pm | F2983: 4 | G2983: 2 | H2983: 20 | I2983: 0 | J2983: =RC[-1]/RC[-2] -> 0
A2984: 111 | B2984: 2 | C2984: Friday | D2984: 5 | E2984: 1pm-2pm | F2984: 5 | G2984: 2 | H2984: 20 | I2984: 0 | J2984: =RC[-1]/RC[-2] -> 0
A2985: 111 | B2985: 2 | C2985: Friday | D2985: 5 | E2985: 2pm-3pm | F2985: 6 | G2985: 2 | H2985: 20 | I2985: 0 | J2985: =RC[-1]/RC[-2] -> 0
A2986: 111 | B2986: 2 | C2986: Friday | D2986: 5 | E2986: 3pm-4pm | F2986: 7 | G2986: 2 | H2986: 20 | I2986: 0 | J2986: =RC[-1]/RC[-2] -> 0
A2987: 111 | B2987: 2 | C2987: Friday | D2987: 5 | E2987: 4pm-5pm | F2987: 8 | G2987: 2 | H2987: 20 | I2987: 0 | J2987: =RC[-1]/RC[-2] -> 0
A2988: 113 | B2988: 2 | C2988: Monday | D2988: 1 | E2988: 9am-10am | F2988: 1 | G2988: 2 | H2988: 20 | I2988: 0 | J2988: =RC[-1]/RC[-2] -> 0
A2989: 113 | B2989: 2 | C2989: Monday | D2989: 1 | E2989: 10am-11am | F2989: 2 | G2989: 2 | H2989: 20 | I2989: 0 | J2989: =RC[-1]/RC[-2] -> 0
A2990: 113 | B2990: 2 | C2990: Monday | D2990: 1 | E2990: 11am-12pm | F2990: 3 | G2990: 2 | H2990: 20 | I2990: 0 | J2990: =RC[-1]/RC[-2] -> 0
A2991: 113 | B2991: 2 | C2991: Monday | D2991: 1 | E2991: 12pm-1pm | F2991: 4 | G2991: 1 | H2991: 20 | I2991: 6 | J2991: =RC[-1]/RC[-2] -> 0.3
A2992: 113 | B2992: 2 | C2992: Monday | D2992: 1 | E2992: 1pm-2pm | F2992: 5 | G2992: 1 | H2992: 20 | I2992: 8 | J2992: =RC[-1]/RC[-2] -> 0.4
A2993: 113 | B2993: 2 | C2993: Monday | D2993: 1 | E2993: 2pm-3pm | F2993: 6 | G2993: 2 | H2993: 20 | I2993: 0 | J2993: =RC[-1]/RC[-2] -> 0
A2994: 113 | B2994: 2 | C2994: Monday | D2994: 1 | E2994: 3pm-4pm | F2994: 7 | G2994: 2 | H2994: 20 | I2994: 0 | J2994: =RC[-1]/RC[-2] -> 0
A2995: 113 | B2995: 2 | C2995: Monday | D2995: 1 | E2995: 4pm-5pm | F2995: 8 | G2995: 2 | H2995: 20 | I2995: 0 | J2995: =RC[-1]/RC[-2] -> 0
A2996: 113 | B2996: 2 | C2996: Tuesday | D2996: 2 | E2996: 9am-10am | F2996: 1 | G2996: 2 | H2996: 20 | I2996: 0 | J2996: =RC[-1]/RC[-2] -> 0
A2997: 113 | B2997: 2 | C2997: Tuesday | D2997: 2 | E2997: 10am-11am | F2997: 2 | G2997: 2 | H2997: 20 | I2997: 0 | J2997: =RC[-1]/RC[-2] -> 0
A2998: 113 | B2998: 2 | C2998: Tuesday | D2998: 2 | E2998: 11am-12pm | F2998: 3 | G2998: 3 | H2998: 20 | I2998: 1 | J2998: =RC[-1]/RC[-2] -> 0.05
A2999: 113 | B2999: 2 | C2999: Tuesday | D2999: 2 | E2999: 12pm-1pm | F2999: 4 | G2999: 2 | H2999: 20 | I2999: 0 | J2999: =RC[-1]/RC[-2] -> 0
A3000: 113 | B3000: 2 | C3000: Tuesday | D3000: 2 | E3000: 1pm-2pm | F3000: 5 | G3000: 2 | H3000: 20 | I3000: 0 | J3000: =RC[-1]/RC[-2] -> 0
A3001: 113 | B3001: 2 | C3001: Tuesday | D3001: 2 | E3001: 2pm-3pm | F3001: 6 | G3001: 1 | H3001: 20 | I3001: 20 | J3001: =RC[-1]/RC[-2] -> 1
A3002: 113 | B3002: 2 | C3002: Tuesday | D3002: 2 | E3002: 3pm-4pm | F3002: 7 | G3002: 1 | H3002: 20 | I3002: 14 | J3002: =RC[-1]/RC[-2] -> 0.7
A3003: 113 | B3003: 2 | C3003: Tuesday | D3003: 2 | E3003: 4pm-5pm | F3003: 8 | G3003: 2 | H3003: 20 | I3003: 0 | J3003: =RC[-1]/RC[-2] -> 0
A3004: 113 | B3004: 2 | C3004: Wednesday | D3004: 3 | E3004: 9am-10am | F3004: 1 | G3004: 1 | H3004: 20 | I3004: 7 | J3004: =RC[-1]/RC[-2] -> 0.35
A3005: 113 | B3005: 2 | C3005: Wednesday | D3005: 3 | E3005: 10am-11am | F3005: 2 | G3005: 1 | H3005: 20 | I3005: 10 | J3005: =RC[-1]/RC[-2] -> 0.5
A3006: 113 | B3006: 2 | C3006: Wednesday | D3006: 3 | E3006: 11am-12pm | F3006: 3 | G3006: 2 | H3006: 20 | I3006: 0 | J3006: =RC[-1]/RC[-2] -> 0
A3007: 113 | B3007: 2 | C3007: Wednesday | D3007: 3 | E3007: 12pm-1pm | F3007: 4 | G3007: 2 | H3007: 20 | I3007: 0 | J3007: =RC[-1]/RC[-2] -> 0
A3008: 113 | B3008: 2 | C3008: Wednesday | D3008: 3 | E3008: 1pm-2pm | F3008: 5 | G3008: 2 | H3008: 20 | I3008: 0 | J3008: =RC[-1]/RC[-2] -> 0
A3009: 113 | B3009: 2 | C3009: Wednesday | D3009: 3 | E3009: 2pm-3pm | F3009: 6 | G3009: 2 | H3009: 20 | I3009: 0 | J3009: =RC[-1]/RC[-2] -> 0
A3010: 113 | B3010: 2 | C3010: Wednesday | D3010: 3 | E3010: 3pm-4pm | F3010: 7 | G3010: 2 | H3010: 20 | I3010: 0 | J3010: =RC[-1]/RC[-2] -> 0
A3011: 113 | B3011: 2 | C3011: Wednesday | D3011: 3 | E3011: 4pm-5pm | F3011: 8 | G3011: 2 | H3011: 20 | I3011: 0 | J3011: =RC[-1]/RC[-2] -> 0
A3012: 113 | B3012: 2 | C3012: Thursday | D3012: 4 | E3012: 9am-10am | F3012: 1 | G3012: 1 | H3012: 20 | I3012: 14 | J3012: =RC[-1]/RC[-2] -> 0.7
A3013: 113 | B3013: 2 | C3013: Thursday | D3013: 4 | E3013: 10am-11am | F3013: 2 | G3013: 2 | H3013: 20 | I3013: 0 | J3013: =RC[-1]/RC[-2] -> 0
A3014: 113 | B3014: 2 | C3014: Thursday | D3014: 4 | E3014: 11am-12pm | F3014: 3 | G3014: 1 | H3014: 20 | I3014: 20 | J3014: =RC[-1]/RC[-2] -> 1
A3015: 113 | B3015: 2 | C3015: Thursday | D3015: 4 | E3015: 12pm-1pm | F3015: 4 | G3015: 1 | H3015: 20 | I3015: 20 | J3015: =RC[-1]/RC[-2] -> 1
A3016: 113 | B3016: 2 | C3016: Thursday | D3016: 4 | E3016: 1pm-2pm | F3016: 5 | G3016: 2 | H3016: 20 | I3016: 0 | J3016: =RC[-1]/RC[-2] -> 0
A3017: 113 | B3017: 2 | C3017: Thursday | D3017: 4 | E3017: 2pm-3pm | F3017: 6 | G3017: 1 | H3017: 20 | I3017: 9 | J3017: =RC[-1]/RC[-2] -> 0.45
A3018: 113 | B3018: 2 | C3018: Thursday | D3018: 4 | E3018: 3pm-4pm | F3018: 7 | G3018: 2 | H3018: 20 | I3018: 0 | J3018: =RC[-1]/RC[-2] -> 0
A3019: 113 | B3019: 2 | C3019: Thursday | D3019: 4 | E3019: 4pm-5pm | F3019: 8 | G3019: 2 | H3019: 20 | I3019: 0 | J3019: =RC[-1]/RC[-2] -> 0
A3020: 113 | B3020: 2 | C3020: Friday | D3020: 5 | E3020: 9am-10am | F3020: 1 | G3020: 2 | H3020: 20 | I3020: 0 | J3020: =RC[-1]/RC[-2] -> 0
A3021: 113 | B3021: 2 | C3021: Friday | D3021: 5 | E3021: 10am-11am | F3021: 2 | G3021: 1 | H3021: 20 | I3021: 16 | J3021: =RC[-1]/RC[-2] -> 0.8
A3022: 113 | B3022: 2 | C3022: Friday | D3022: 5 | E3022: 11am-12pm | F3022: 3 | G3022: 2 | H3022: 20 | I3022: 0 | J3022: =RC[-1]/RC[-2] -> 0
A3023: 113 | B3023: 2 | C3023: Friday | D3023: 5 | E3023: 12pm-1pm | F3023: 4 | G3023: 1 | H3023: 20 | I3023: 13 | J3023: =RC[-1]/RC[-2] -> 0.65
A3024: 113 | B3024: 2 | C3024: Friday | D3024: 5 | E3024: 1pm-2pm | F3024: 5 | G3024: 1 | H3024: 20 | I3024: 11 | J3024: =RC[-1]/RC[-2] -> 0.55
A3025: 113 | B3025: 2 | C3025: Friday | D3025: 5 | E3025: 2pm-3pm | F3025: 6 | G3025: 2 | H3025: 20 | I3025: 0 | J3025: =RC[-1]/RC[-2] -> 0
A3026: 113 | B3026: 2 | C3026: Friday | D3026: 5 | E3026: 3pm-4pm | F3026: 7 | G3026: 2 | H3026: 20 | I3026: 0 | J3026: =RC[-1]/RC[-2] -> 0
A3027: 113 | B3027: 2 | C3027: Friday | D3027: 5 | E3027: 4pm-5pm | F3027: 8 | G3027: 2 | H3027: 20 | I3027: 0 | J3027: =RC[-1]/RC[-2] -> 0
A3028: 117 | B3028: 2 | C3028: Monday | D3028: 1 | E3028: 9am-10am | F3028: 1 | G3028: 2 | H3028: 20 | I3028: 0 | J3028: =RC[-1]/RC[-2] -> 0
A3029: 117 | B3029: 2 | C3029: Monday | D3029: 1 | E3029: 10am-11am | F3029: 2 | G3029: 3 | H3029: 20 | I3029: 2 | J3029: =RC[-1]/RC[-2] -> 0.1
A3030: 117 | B3030: 2 | C3030: Monday | D3030: 1 | E3030: 11am-12pm | F3030: 3 | G3030: 2 | H3030: 20 | I3030: 0 | J3030: =RC[-1]/RC[-2] -> 0
A3031: 117 | B3031: 2 | C3031: Monday | D3031: 1 | E3031: 12pm-1pm | F3031: 4 | G3031: 2 | H3031: 20 | I3031: 0 | J3031: =RC[-1]/RC[-2] -> 0
A3032: 117 | B3032: 2 | C3032: Monday | D3032: 1 | E3032: 1pm-2pm | F3032: 5 | G3032: 2 | H3032: 20 | I3032: 0 | J3032: =RC[-1]/RC[-2] -> 0
A3033: 117 | B3033: 2 | C3033: Monday | D3033: 1 | E3033: 2pm-3pm | F3033: 6 | G3033: 1 | H3033: 20 | I3033: 18 | J3033: =RC[-1]/RC[-2] -> 0.9
A3034: 117 | B3034: 2 | C3034: Monday | D3034: 1 | E3034: 3pm-4pm | F3034: 7 | G3034: 1 | H3034: 20 | I3034: 19 | J3034: =RC[-1]/RC[-2] -> 0.95
A3035: 117 | B3035: 2 | C3035: Monday | D3035: 1 | E3035: 4pm-5pm | F3035: 8 | G3035: 1 | H3035: 20 | I3035: 4 | J3035: =RC[-1]/RC[-2] -> 0.2
A3036: 117 | B3036: 2 | C3036: Tuesday | D3036: 2 | E3036: 9am-10am | F3036: 1 | G3036: 3 | H3036: 20 | I3036: 1 | J3036: =RC[-1]/RC[-2] -> 0.05
A3037: 117 | B3037: 2 | C3037: Tuesday | D3037: 2 | E3037: 10am-11am | F3037: 2 | G3037: 1 | H3037: 20 | I3037: 20 | J3037: =RC[-1]/RC[-2] -> 1
A3038: 117 | B3038: 2 | C3038: Tuesday | D3038: 2 | E3038: 11am-12pm | F3038: 3 | G3038: 1 | H3038: 20 | I3038: 25 | J3038: =RC[-1]/RC[-2] -> 1.25
A3039: 117 | B3039: 2 | C3039: Tuesday | D3039: 2 | E3039: 12pm-1pm | F3039: 4 | G3039: 1 | H3039: 20 | I3039: 4 | J3039: =RC[-1]/RC[-2] -> 0.2
A3040: 117 | B3040: 2 | C3040: Tuesday | D3040: 2 | E3040: 1pm-2pm | F3040: 5 | G3040: 2 | H3040: 20 | I3040: 0 | J3040: =RC[-1]/RC[-2] -> 0
A3041: 117 | B3041: 2 | C3041: Tuesday | D3041: 2 | E3041: 2pm-3pm | F3041: 6 | G3041: 1 | H3041: 20 | I3041: 20 | J3041: =RC[-1]/RC[-2] -> 1
A3042: 117 | B3042: 2 | C3042: Tuesday | D3042: 2 | E3042: 3pm-4pm | F3042: 7 | G3042: 1 | H3042: 20 | I3042: 22 | J3042: =RC[-1]/RC[-2] -> 1.1
A3043: 117 | B3043: 2 | C3043: Tuesday | D3043: 2 | E3043: 4pm-5pm | F3043: 8 | G3043: 1 | H3043: 20 | I3043: 25 | J3043: =RC[-1]/RC[-2] -> 1.25
A3044: 117 | B3044: 2 | C3044: Wednesday | D3044: 3 | E3044: 9am-10am | F3044: 1 | G3044: 1 | H3044: 20 | I3044: 18 | J3044: =RC[-1]/RC[-2] -> 0.9
A3045: 117 | B3045: 2 | C3045: Wednesday | D3045: 3 | E3045: 10am-11am | F3045: 2 | G3045: 1 | H3045: 20 | I3045: 20 | J3045: =RC[-1]/RC[-2] -> 1
A3046: 117 | B3046: 2 | C3046: Wednesday | D3046: 3 | E3046: 11am-12pm | F3046: 3 | G3046: 1 | H3046: 20 | I3046: 20 | J3046: =RC[-1]/RC[-2] -> 1
A3047: 117 | B3047: 2 | C3047: Wednesday | D3047: 3 | E3047: 12pm-1pm | F3047: 4 | G3047: 1 | H3047: 20 | I3047: 2 | J3047: =RC[-1]/RC[-2] -> 0.1
A3048: 117 | B3048: 2 | C3048: Wednesday | D3048: 3 | E3048: 1pm-2pm | F3048: 5 | G3048: 1 | H3048: 20 | I3048: 7 | J3048: =RC[-1]/RC[-2] -> 0.35
A3049: 117 | B3049: 2 | C3049: Wednesday | D3049: 3 | E3049: 2pm-3pm | F3049: 6 | G3049: 1 | H3049: 20 | I3049: 13 | J3049: =RC[-1]/RC[-2] -> 0.65
A3050: 117 | B3050: 2 | C3050: Wednesday | D3050: 3 | E3050: 3pm-4pm | F3050: 7 | G3050: 1 | H3050: 20 | I3050: 17 | J3050: =RC[-1]/RC[-2] -> 0.85
A3051: 117 | B3051: 2 | C3051: Wednesday | D3051: 3 | E3051: 4pm-5pm | F3051: 8 | G3051: 3 | H3051: 20 | I3051: 2 | J3051: =RC[-1]/RC[-2] -> 0.1
A3052: 117 | B3052: 2 | C3052: Thursday | D3052: 4 | E3052: 9am-10am | F3052: 1 | G3052: 3 | H3052: 20 | I3052: 1 | J3052: =RC[-1]/RC[-2] -> 0.05
A3053: 117 | B3053: 2 | C3053: Thursday | D3053: 4 | E3053: 10am-11am | F3053: 2 | G3053: 1 | H3053: 20 | I3053: 15 | J3053: =RC[-1]/RC[-2] -> 0.75
A3054: 117 | B3054: 2 | C3054: Thursday | D3054: 4 | E3054: 11am-12pm | F3054: 3 | G3054: 1 | H3054: 20 | I3054: 16 | J3054: =RC[-1]/RC[-2] -> 0.8
A3055: 117 | B3055: 2 | C3055: Thursday | D3055: 4 | E3055: 12pm-1pm | F3055: 4 | G3055: 1 | H3055: 20 | I3055: 13 | J3055: =RC[-1]/RC[-2] -> 0.65
A3056: 117 | B3056: 2 | C3056: Thursday | D3056: 4 | E3056: 1pm-2pm | F3056: 5 | G3056: 2 | H3056: 20 | I3056: 0 | J3056: =RC[-1]/RC[-2] -> 0
A3057: 117 | B3057: 2 | C3057: Thursday | D3057: 4 | E3057: 2pm-3pm | F3057: 6 | G3057: 1 | H3057: 20 | I3057: 20 | J3057: =RC[-1]/RC[-2] -> 1
A3058: 117 | B3058: 2 | C3058: Thursday | D3058: 4 | E3058: 3pm-4pm | F3058: 7 | G3058: 1 | H3058: 20 | I3058: 17 | J3058: =RC[-1]/RC[-2] -> 0.85
A3059: 117 | B3059: 2 | C3059: Thursday | D3059: 4 | E3059: 4pm-5pm | F3059: 8 | G3059: 1 | H3059: 20 | I3059: 7 | J3059: =RC[-1]/RC[-2] -> 0.35
A3060: 117 | B3060: 2 | C3060: Friday | D3060: 5 | E3060: 9am-10am | F3060: 1 | G3060: 2 | H3060: 20 | I3060: 0 | J3060: =RC[-1]/RC[-2] -> 0
A3061: 117 | B3061: 2 | C3061: Friday | D3061: 5 | E3061: 10am-11am | F3061: 2 | G3061: 2 | H3061: 20 | I3061: 0 | J3061: =RC[-1]/RC[-2] -> 0
A3062: 117 | B3062: 2 | C3062: Friday | D3062: 5 | E3062: 11am-12pm | F3062: 3 | G3062: 2 | H3062: 20 | I3062: 0 | J3062: =RC[-1]/RC[-2] -> 0
A3063: 117 | B3063: 2 | C3063: Friday | D3063: 5 | E3063: 12pm-1pm | F3063: 4 | G3063: 2 | H3063: 20 | I3063: 0 | J3063: =RC[-1]/RC[-2] -> 0
A3064: 117 | B3064: 2 | C3064: Friday | D3064: 5 | E3064: 1pm-2pm | F3064: 5 | G3064: 2 | H3064: 20 | I3064: 0 | J3064: =RC[-1]/RC[-2] -> 0
A3065: 117 | B3065: 2 | C3065: Friday | D3065: 5 | E3065: 2pm-3pm | F3065: 6 | G3065: 1 | H3065: 20 | I3065: 19 | J3065: =RC[-1]/RC[-2] -> 0.95
A3066: 117 | B3066: 2 | C3066: Friday | D3066: 5 | E3066: 3pm-4pm | F3066: 7 | G3066: 1 | H3066: 20 | I3066: 10 | J3066: =RC[-1]/RC[-2] -> 0.5
A3067: 117 | B3067: 2 | C3067: Friday | D3067: 5 | E3067: 4pm-5pm | F3067: 8 | G3067: 2 | H3067: 20 | I3067: 0 | J3067: =RC[-1]/RC[-2] -> 0
A3068: 118 | B3068: 2 | C3068: Monday | D3068: 1 | E3068: 9am-10am | F3068: 1 | G3068: 3 | H3068: 6 | I3068: 1 | J3068: =RC[-1]/RC[-2] -> 0.16666666666666666
A3069: 118 | B3069: 2 | C3069: Monday | D3069: 1 | E3069: 10am-11am | F3069: 2 | G3069: 2 | H3069: 6 | I3069: 0 | J3069: =RC[-1]/RC[-2] -> 0
A3070: 118 | B3070: 2 | C3070: Monday | D3070: 1 | E3070: 11am-12pm | F3070: 3 | G3070: 2 | H3070: 6 | I3070: 0 | J3070: =RC[-1]/RC[-2] -> 0
A3071: 118 | B3071: 2 | C3071: Monday | D3071: 1 | E3071: 12pm-1pm | F3071: 4 | G3071: 2 | H3071: 6 | I3071: 0 | J3071: =RC[-1]/RC[-2] -> 0
A3072: 118 | B3072: 2 | C3072: Monday | D3072: 1 | E3072: 1pm-2pm | F3072: 5 | G3072: 2 | H3072: 6 | I3072: 0 | J3072: =RC[-1]/RC[-2] -> 0
A3073: 118 | B3073: 2 | C3073: Monday | D3073: 1 | E3073: 2pm-3pm | F3073: 6 | G3073: 2 | H3073: 6 | I3073: 0 | J3073: =RC[-1]/RC[-2] -> 0
A3074: 118 | B3074: 2 | C3074: Monday | D3074: 1 | E3074: 3pm-4pm | F3074: 7 | G3074: 1 | H3074: 6 | I3074: 2 | J3074: =RC[-1]/RC[-2] -> 0.33333333333333331
A3075: 118 | B3075: 2 | C3075: Monday | D3075: 1 | E3075: 4pm-5pm | F3075: 8 | G3075: 2 | H3075: 6 | I3075: 0 | J3075: =RC[-1]/RC[-2] -> 0
A3076: 118 | B3076: 2 | C3076: Tuesday | D3076: 2 | E3076: 9am-10am | F3076: 1 | G3076: 2 | H3076: 6 | I3076: 0 | J3076: =RC[-1]/RC[-2] -> 0
A3077: 118 | B3077: 2 | C3077: Tuesday | D3077: 2 | E3077: 10am-11am | F3077: 2 | G3077: 2 | H3077: 6 | I3077: 0 | J3077: =RC[-1]/RC[-2] -> 0
A3078: 118 | B3078: 2 | C3078: Tuesday | D3078: 2 | E3078: 11am-12pm | F3078: 3 | G3078: 1 | H3078: 6 | I3078: 2 | J3078: =RC[-1]/RC[-2] -> 0.33333333333333331
A3079: 118 | B3079: 2 | C3079: Tuesday | D3079: 2 | E3079: 12pm-1pm | F3079: 4 | G3079: 2 | H3079: 6 | I3079: 0 | J3079: =RC[-1]/RC[-2] -> 0
A3080: 118 | B3080: 2 | C3080: Tuesday | D3080: 2 | E3080: 1pm-2pm | F3080: 5 | G3080: 1 | H3080: 6 | I3080: 7 | J3080: =RC[-1]/RC[-2] -> 1.1666666666666667
A3081: 118 | B3081: 2 | C3081: Tuesday | D3081: 2 | E3081: 2pm-3pm | F3081: 6 | G3081: 1 | H3081: 6 | I3081: 2 | J3081: =RC[-1]/RC[-2] -> 0.33333333333333331
A3082: 118 | B3082: 2 | C3082: Tuesday | D3082: 2 | E3082: 3pm-4pm | F3082: 7 | G3082: 1 | H3082: 6 | I3082: 1 | J3082: =RC[-1]/RC[-2] -> 0.16666666666666666
A3083: 118 | B3083: 2 | C3083: Tuesday | D3083: 2 | E3083: 4pm-5pm | F3083: 8 | G3083: 1 | H3083: 6 | I3083: 3 | J3083: =RC[-1]/RC[-2] -> 0.5
A3084: 118 | B3084: 2 | C3084: Wednesday | D3084: 3 | E3084: 9am-10am | F3084: 1 | G3084: 2 | H3084: 6 | I3084: 0 | J3084: =RC[-1]/RC[-2] -> 0
A3085: 118 | B3085: 2 | C3085: Wednesday | D3085: 3 | E3085: 10am-11am | F3085: 2 | G3085: 2 | H3085: 6 | I3085: 0 | J3085: =RC[-1]/RC[-2] -> 0
A3086: 118 | B3086: 2 | C3086: Wednesday | D3086: 3 | E3086: 11am-12pm | F3086: 3 | G3086: 1 | H3086: 6 | I3086: 1 | J3086: =RC[-1]/RC[-2] -> 0.16666666666666666
A3087: 118 | B3087: 2 | C3087: Wednesday | D3087: 3 | E3087: 12pm-1pm | F3087: 4 | G3087: 2 | H3087: 6 | I3087: 0 | J3087: =RC[-1]/RC[-2] -> 0
A3088: 118 | B3088: 2 | C3088: Wednesday | D3088: 3 | E3088: 1pm-2pm | F3088: 5 | G3088: 2 | H3088: 6 | I3088: 0 | J3088: =RC[-1]/RC[-2] -> 0
A3089: 118 | B3089: 2 | C3089: Wednesday | D3089: 3 | E3089: 2pm-3pm | F3089: 6 | G3089: 2 | H3089: 6 | I3089: 0 | J3089: =RC[-1]/RC[-2] -> 0
A3090: 118 | B3090: 2 | C3090: Wednesday | D3090: 3 | E3090: 3pm-4pm | F3090: 7 | G3090: 1 | H3090: 6 | I3090: 3 | J3090: =RC[-1]/RC[-2] -> 0.5
A3091: 118 | B3091: 2 | C3091: Wednesday | D3091: 3 | E3091: 4pm-5pm | F3091: 8 | G3091: 2 | H3091: 6 | I3091: 0 | J3091: =RC[-1]/RC[-2] -> 0
A3092: 118 | B3092: 2 | C3092: Thursday | D3092: 4 | E3092: 9am-10am | F3092: 1 | G3092: 2 | H3092: 6 | I3092: 0 | J3092: =RC[-1]/RC[-2] -> 0
A3093: 118 | B3093: 2 | C3093: Thursday | D3093: 4 | E3093: 10am-11am | F3093: 2 | G3093: 2 | H3093: 6 | I3093: 0 | J3093: =RC[-1]/RC[-2] -> 0
A3094: 118 | B3094: 2 | C3094: Thursday | D3094: 4 | E3094: 11am-12pm | F3094: 3 | G3094: 1 | H3094: 6 | I3094: 1 | J3094: =RC[-1]/RC[-2] -> 0.16666666666666666
A3095: 118 | B3095: 2 | C3095: Thursday | D3095: 4 | E3095: 12pm-1pm | F3095: 4 | G3095: 1 | H3095: 6 | I3095: 1 | J3095: =RC[-1]/RC[-2] -> 0.16666666666666666
A3096: 118 | B3096: 2 | C3096: Thursday | D3096: 4 | E3096: 1pm-2pm | F3096: 5 | G3096: 1 | H3096: 6 | I3096: 1 | J3096: =RC[-1]/RC[-2] -> 0.16666666666666666
A3097: 118 | B3097: 2 | C3097: Thursday | D3097: 4 | E3097: 2pm-3pm | F3097: 6 | G3097: 1 | H3097: 6 | I3097: 1 | J3097: =RC[-1]/RC[-2] -> 0.16666666666666666
A3098: 118 | B3098: 2 | C3098: Thursday | D3098: 4 | E3098: 3pm-4pm | F3098: 7 | G3098: 3 | H3098: 6 | I3098: 1 | J3098: =RC[-1]/RC[-2] -> 0.16666666666666666
A3099: 118 | B3099: 2 | C3099: Thursday | D3099: 4 | E3099: 4pm-5pm | F3099: 8 | G3099: 2 | H3099: 6 | I3099: 0 | J3099: =RC[-1]/RC[-2] -> 0
A3100: 118 | B3100: 2 | C3100: Friday | D3100: 5 | E3100: 9am-10am | F3100: 1 | G3100: 3 | H3100: 6 | I3100: 1 | J3100: =RC[-1]/RC[-2] -> 0.16666666666666666
A3101: 118 | B3101: 2 | C3101: Friday | D3101: 5 | E3101: 10am-11am | F3101: 2 | G3101: 2 | H3101: 6 | I3101: 0 | J3101: =RC[-1]/RC[-2] -> 0
A3102: 118 | B3102: 2 | C3102: Friday | D3102: 5 | E3102: 11am-12pm | F3102: 3 | G3102: 3 | H3102: 6 | I3102: 1 | J3102: =RC[-1]/RC[-2] -> 0.16666666666666666
A3103: 118 | B3103: 2 | C3103: Friday | D3103: 5 | E3103: 12pm-1pm | F3103: 4 | G3103: 1 | H3103: 6 | I3103: 2 | J3103: =RC[-1]/RC[-2] -> 0.33333333333333331
A3104: 118 | B3104: 2 | C3104: Friday | D3104: 5 | E3104: 1pm-2pm | F3104: 5 | G3104: 1 | H3104: 6 | I3104: 3 | J3104: =RC[-1]/RC[-2] -> 0.5
A3105: 118 | B3105: 2 | C3105: Friday | D3105: 5 | E3105: 2pm-3pm | F3105: 6 | G3105: 2 | H3105: 6 | I3105: 0 | J3105: =RC[-1]/RC[-2] -> 0
A3106: 118 | B3106: 2 | C3106: Friday | D3106: 5 | E3106: 3pm-4pm | F3106: 7 | G3106: 3 | H3106: 6 | I3106: 1 | J3106: =RC[-1]/RC[-2] -> 0.16666666666666666
A3107: 118 | B3107: 2 | C3107: Friday | D3107: 5 | E3107: 4pm-5pm | F3107: 8 | G3107: 1 | H3107: 6 | I3107: 4 | J3107: =RC[-1]/RC[-2] -> 0.66666666666666663
A3108: 119 | B3108: 2 | C3108: Monday | D3108: 1 | E3108: 9am-10am | F3108: 1 | G3108: 2 | H3108: 20 | I3108: 0 | J3108: =RC[-1]/RC[-2] -> 0
A3109: 119 | B3109: 2 | C3109: Monday | D3109: 1 | E3109: 10am-11am | F3109: 2 | G3109: 1 | H3109: 20 | I3109: 22 | J3109: =RC[-1]/RC[-2] -> 1.1
A3110: 119 | B3110: 2 | C3110: Monday | D3110: 1 | E3110: 11am-12pm | F3110: 3 | G3110: 1 | H3110: 20 | I3110: 22 | J3110: =RC[-1]/RC[-2] -> 1.1
A3111: 119 | B3111: 2 | C3111: Monday | D3111: 1 | E3111: 12pm-1pm | F3111: 4 | G3111: 1 | H3111: 20 | I3111: 22 | J3111: =RC[-1]/RC[-2] -> 1.1
A3112: 119 | B3112: 2 | C3112: Monday | D3112: 1 | E3112: 1pm-2pm | F3112: 5 | G3112: 2 | H3112: 20 | I3112: 0 | J3112: =RC[-1]/RC[-2] -> 0
A3113: 119 | B3113: 2 | C3113: Monday | D3113: 1 | E3113: 2pm-3pm | F3113: 6 | G3113: 1 | H3113: 20 | I3113: 18 | J3113: =RC[-1]/RC[-2] -> 0.9
A3114: 119 | B3114: 2 | C3114: Monday | D3114: 1 | E3114: 3pm-4pm | F3114: 7 | G3114: 2 | H3114: 20 | I3114: 0 | J3114: =RC[-1]/RC[-2] -> 0
A3115: 119 | B3115: 2 | C3115: Monday | D3115: 1 | E3115: 4pm-5pm | F3115: 8 | G3115: 1 | H3115: 20 | I3115: 4 | J3115: =RC[-1]/RC[-2] -> 0.2
A3116: 119 | B3116: 2 | C3116: Tuesday | D3116: 2 | E3116: 9am-10am | F3116: 1 | G3116: 2 | H3116: 20 | I3116: 0 | J3116: =RC[-1]/RC[-2] -> 0
A3117: 119 | B3117: 2 | C3117: Tuesday | D3117: 2 | E3117: 10am-11am | F3117: 2 | G3117: 2 | H3117: 20 | I3117: 0 | J3117: =RC[-1]/RC[-2] -> 0
A3118: 119 | B3118: 2 | C3118: Tuesday | D3118: 2 | E3118: 11am-12pm | F3118: 3 | G3118: 1 | H3118: 20 | I3118: 1 | J3118: =RC[-1]/RC[-2] -> 0.05
A3119: 119 | B3119: 2 | C3119: Tuesday | D3119: 2 | E3119: 12pm-1pm | F3119: 4 | G3119: 2 | H3119: 20 | I3119: 0 | J3119: =RC[-1]/RC[-2] -> 0
A3120: 119 | B3120: 2 | C3120: Tuesday | D3120: 2 | E3120: 1pm-2pm | F3120: 5 | G3120: 2 | H3120: 20 | I3120: 0 | J3120: =RC[-1]/RC[-2] -> 0
A3121: 119 | B3121: 2 | C3121: Tuesday | D3121: 2 | E3121: 2pm-3pm | F3121: 6 | G3121: 2 | H3121: 20 | I3121: 0 | J3121: =RC[-1]/RC[-2] -> 0
A3122: 119 | B3122: 2 | C3122: Tuesday | D3122: 2 | E3122: 3pm-4pm | F3122: 7 | G3122: 1 | H3122: 20 | I3122: 1 | J3122: =RC[-1]/RC[-2] -> 0.05
A3123: 119 | B3123: 2 | C3123: Tuesday | D3123: 2 | E3123: 4pm-5pm | F3123: 8 | G3123: 1 | H3123: 20 | I3123: 8 | J3123: =RC[-1]/RC[-2] -> 0.4
A3124: 119 | B3124: 2 | C3124: Wednesday | D3124: 3 | E3124: 9am-10am | F3124: 1 | G3124: 2 | H3124: 20 | I3124: 0 | J3124: =RC[-1]/RC[-2] -> 0
A3125: 119 | B3125: 2 | C3125: Wednesday | D3125: 3 | E3125: 10am-11am | F3125: 2 | G3125: 1 | H3125: 20 | I3125: 30 | J3125: =RC[-1]/RC[-2] -> 1.5
A3126: 119 | B3126: 2 | C3126: Wednesday | D3126: 3 | E3126: 11am-12pm | F3126: 3 | G3126: 3 | H3126: 20 | I3126: 1 | J3126: =RC[-1]/RC[-2] -> 0.05
A3127: 119 | B3127: 2 | C3127: Wednesday | D3127: 3 | E3127: 12pm-1pm | F3127: 4 | G3127: 1 | H3127: 20 | I3127: 1 | J3127: =RC[-1]/RC[-2] -> 0.05
A3128: 119 | B3128: 2 | C3128: Wednesday | D3128: 3 | E3128: 1pm-2pm | F3128: 5 | G3128: 1 | H3128: 20 | I3128: 10 | J3128: =RC[-1]/RC[-2] -> 0.5
A3129: 119 | B3129: 2 | C3129: Wednesday | D3129: 3 | E3129: 2pm-3pm | F3129: 6 | G3129: 2 | H3129: 20 | I3129: 0 | J3129: =RC[-1]/RC[-2] -> 0
A3130: 119 | B3130: 2 | C3130: Wednesday | D3130: 3 | E3130: 3pm-4pm | F3130: 7 | G3130: 2 | H3130: 20 | I3130: 0 | J3130: =RC[-1]/RC[-2] -> 0
A3131: 119 | B3131: 2 | C3131: Wednesday | D3131: 3 | E3131: 4pm-5pm | F3131: 8 | G3131: 2 | H3131: 20 | I3131: 0 | J3131: =RC[-1]/RC[-2] -> 0
A3132: 119 | B3132: 2 | C3132: Thursday | D3132: 4 | E3132: 9am-10am | F3132: 1 | G3132: 2 | H3132: 20 | I3132: 0 | J3132: =RC[-1]/RC[-2] -> 0
A3133: 119 | B3133: 2 | C3133: Thursday | D3133: 4 | E3133: 10am-11am | F3133: 2 | G3133: 2 | H3133: 20 | I3133: 0 | J3133: =RC[-1]/RC[-2] -> 0
A3134: 119 | B3134: 2 | C3134: Thursday | D3134: 4 | E3134: 11am-12pm | F3134: 3 | G3134: 2 | H3134: 20 | I3134: 0 | J3134: =RC[-1]/RC[-2] -> 0
A3135: 119 | B3135: 2 | C3135: Thursday | D3135: 4 | E3135: 12pm-1pm | F3135: 4 | G3135: 2 | H3135: 20 | I3135: 0 | J3135: =RC[-1]/RC[-2] -> 0
A3136: 119 | B3136: 2 | C3136: Thursday | D3136: 4 | E3136: 1pm-2pm | F3136: 5 | G3136: 2 | H3136: 20 | I3136: 0 | J3136: =RC[-1]/RC[-2] -> 0
A3137: 119 | B3137: 2 | C3137: Thursday | D3137: 4 | E3137: 2pm-3pm | F3137: 6 | G3137: 1 | H3137: 20 | I3137: 18 | J3137: =RC[-1]/RC[-2] -> 0.9
A3138: 119 | B3138: 2 | C3138: Thursday | D3138: 4 | E3138: 3pm-4pm | F3138: 7 | G3138: 1 | H3138: 20 | I3138: 8 | J3138: =RC[-1]/RC[-2] -> 0.4
A3139: 119 | B3139: 2 | C3139: Thursday | D3139: 4 | E3139: 4pm-5pm | F3139: 8 | G3139: 2 | H3139: 20 | I3139: 0 | J3139: =RC[-1]/RC[-2] -> 0
A3140: 119 | B3140: 2 | C3140: Friday | D3140: 5 | E3140: 9am-10am | F3140: 1 | G3140: 2 | H3140: 20 | I3140: 0 | J3140: =RC[-1]/RC[-2] -> 0
A3141: 119 | B3141: 2 | C3141: Friday | D3141: 5 | E3141: 10am-11am | F3141: 2 | G3141: 2 | H3141: 20 | I3141: 0 | J3141: =RC[-1]/RC[-2] -> 0
A3142: 119 | B3142: 2 | C3142: Friday | D3142: 5 | E3142: 11am-12pm | F3142: 3 | G3142: 2 | H3142: 20 | I3142: 0 | J3142: =RC[-1]/RC[-2] -> 0
A3143: 119 | B3143: 2 | C3143: Friday | D3143: 5 | E3143: 12pm-1pm | F3143: 4 | G3143: 2 | H3143: 20 | I3143: 0 | J3143: =RC[-1]/RC[-2] -> 0
A3144: 119 | B3144: 2 | C3144: Friday | D3144: 5 | E3144: 1pm-2pm | F3144: 5 | G3144: 2 | H3144: 20 | I3144: 0 | J3144: =RC[-1]/RC[-2] -> 0
A3145: 119 | B3145: 2 | C3145: Friday | D3145: 5 | E3145: 2pm-3pm | F3145: 6 | G3145: 2 | H3145: 20 | I3145: 0 | J3145: =RC[-1]/RC[-2] -> 0
A3146: 119 | B3146: 2 | C3146: Friday | D3146: 5 | E3146: 3pm-4pm | F3146: 7 | G3146: 2 | H3146: 20 | I3146: 0 | J3146: =RC[-1]/RC[-2] -> 0
A3147: 119 | B3147: 2 | C3147: Friday | D3147: 5 | E3147: 4pm-5pm | F3147: 8 | G3147: 2 | H3147: 20 | I3147: 0 | J3147: =RC[-1]/RC[-2] -> 0
A3148: 124 | B3148: 2 | C3148: Monday | D3148: 1 | E3148: 9am-10am | F3148: 1 | G3148: 2 | H3148: 44 | I3148: 0 | J3148: =RC[-1]/RC[-2] -> 0
A3149: 124 | B3149: 2 | C3149: Monday | D3149: 1 | E3149: 10am-11am | F3149: 2 | G3149: 3 | H3149: 44 | I3149: 1 | J3149: =RC[-1]/RC[-2] -> 2.2727272727272728E-2
A3150: 124 | B3150: 2 | C3150: Monday | D3150: 1 | E3150: 11am-12pm | F3150: 3 | G3150: 2 | H3150: 44 | I3150: 0 | J3150: =RC[-1]/RC[-2] -> 0
A3151: 124 | B3151: 2 | C3151: Monday | D3151: 1 | E3151: 12pm-1pm | F3151: 4 | G3151: 2 | H3151: 44 | I3151: 0 | J3151: =RC[-1]/RC[-2] -> 0
A3152: 124 | B3152: 2 | C3152: Monday | D3152: 1 | E3152: 1pm-2pm | F3152: 5 | G3152: 2 | H3152: 44 | I3152: 0 | J3152: =RC[-1]/RC[-2] -> 0
A3153: 124 | B3153: 2 | C3153: Monday | D3153: 1 | E3153: 2pm-3pm | F3153: 6 | G3153: 1 | H3153: 44 | I3153: 17 | J3153: =RC[-1]/RC[-2] -> 0.38636363636363635
A3154: 124 | B3154: 2 | C3154: Monday | D3154: 1 | E3154: 3pm-4pm | F3154: 7 | G3154: 1 | H3154: 44 | I3154: 16 | J3154: =RC[-1]/RC[-2] -> 0.36363636363636365
A3155: 124 | B3155: 2 | C3155: Monday | D3155: 1 | E3155: 4pm-5pm | F3155: 8 | G3155: 1 | H3155: 44 | I3155: 15 | J3155: =RC[-1]/RC[-2] -> 0.34090909090909088
A3156: 124 | B3156: 2 | C3156: Tuesday | D3156: 2 | E3156: 9am-10am | F3156: 1 | G3156: 2 | H3156: 44 | I3156: 0 | J3156: =RC[-1]/RC[-2] -> 0
A3157: 124 | B3157: 2 | C3157: Tuesday | D3157: 2 | E3157: 10am-11am | F3157: 2 | G3157: 2 | H3157: 44 | I3157: 0 | J3157: =RC[-1]/RC[-2] -> 0
A3158: 124 | B3158: 2 | C3158: Tuesday | D3158: 2 | E3158: 11am-12pm | F3158: 3 | G3158: 2 | H3158: 44 | I3158: 0 | J3158: =RC[-1]/RC[-2] -> 0
A3159: 124 | B3159: 2 | C3159: Tuesday | D3159: 2 | E3159: 12pm-1pm | F3159: 4 | G3159: 2 | H3159: 44 | I3159: 0 | J3159: =RC[-1]/RC[-2] -> 0
A3160: 124 | B3160: 2 | C3160: Tuesday | D3160: 2 | E3160: 1pm-2pm | F3160: 5 | G3160: 2 | H3160: 44 | I3160: 0 | J3160: =RC[-1]/RC[-2] -> 0
A3161: 124 | B3161: 2 | C3161: Tuesday | D3161: 2 | E3161: 2pm-3pm | F3161: 6 | G3161: 1 | H3161: 44 | I3161: 18 | J3161: =RC[-1]/RC[-2] -> 0.40909090909090912
A3162: 124 | B3162: 2 | C3162: Tuesday | D3162: 2 | E3162: 3pm-4pm | F3162: 7 | G3162: 1 | H3162: 44 | I3162: 6 | J3162: =RC[-1]/RC[-2] -> 0.13636363636363635
A3163: 124 | B3163: 2 | C3163: Tuesday | D3163: 2 | E3163: 4pm-5pm | F3163: 8 | G3163: 1 | H3163: 44 | I3163: 15 | J3163: =RC[-1]/RC[-2] -> 0.34090909090909088
A3164: 124 | B3164: 2 | C3164: Wednesday | D3164: 3 | E3164: 9am-10am | F3164: 1 | G3164: 3 | H3164: 44 | I3164: 1 | J3164: =RC[-1]/RC[-2] -> 2.2727272727272728E-2
A3165: 124 | B3165: 2 | C3165: Wednesday | D3165: 3 | E3165: 10am-11am | F3165: 2 | G3165: 2 | H3165: 44 | I3165: 0 | J3165: =RC[-1]/RC[-2] -> 0
A3166: 124 | B3166: 2 | C3166: Wednesday | D3166: 3 | E3166: 11am-12pm | F3166: 3 | G3166: 2 | H3166: 44 | I3166: 0 | J3166: =RC[-1]/RC[-2] -> 0
A3167: 124 | B3167: 2 | C3167: Wednesday | D3167: 3 | E3167: 12pm-1pm | F3167: 4 | G3167: 2 | H3167: 44 | I3167: 0 | J3167: =RC[-1]/RC[-2] -> 0
A3168: 124 | B3168: 2 | C3168: Wednesday | D3168: 3 | E3168: 1pm-2pm | F3168: 5 | G3168: 2 | H3168: 44 | I3168: 0 | J3168: =RC[-1]/RC[-2] -> 0
A3169: 124 | B3169: 2 | C3169: Wednesday | D3169: 3 | E3169: 2pm-3pm | F3169: 6 | G3169: 2 | H3169: 44 | I3169: 0 | J3169: =RC[-1]/RC[-2] -> 0
A3170: 124 | B3170: 2 | C3170: Wednesday | D3170: 3 | E3170: 3pm-4pm | F3170: 7 | G3170: 2 | H3170: 44 | I3170: 0 | J3170: =RC[-1]/RC[-2] -> 0
A3171: 124 | B3171: 2 | C3171: Wednesday | D3171: 3 | E3171: 4pm-5pm | F3171: 8 | G3171: 2 | H3171: 44 | I3171: 0 | J3171: =RC[-1]/RC[-2] -> 0
A3172: 124 | B3172: 2 | C3172: Thursday | D3172: 4 | E3172: 9am-10am | F3172: 1 | G3172: 1 | H3172: 44 | I3172: 16 | J3172: =RC[-1]/RC[-2] -> 0.36363636363636365
A3173: 124 | B3173: 2 | C3173: Thursday | D3173: 4 | E3173: 10am-11am | F3173: 2 | G3173: 1 | H3173: 44 | I3173: 16 | J3173: =RC[-1]/RC[-2] -> 0.36363636363636365
A3174: 124 | B3174: 2 | C3174: Thursday | D3174: 4 | E3174: 11am-12pm | F3174: 3 | G3174: 1 | H3174: 44 | I3174: 16 | J3174: =RC[-1]/RC[-2] -> 0.36363636363636365
A3175: 124 | B3175: 2 | C3175: Thursday | D3175: 4 | E3175: 12pm-1pm | F3175: 4 | G3175: 2 | H3175: 44 | I3175: 0 | J3175: =RC[-1]/RC[-2] -> 0
A3176: 124 | B3176: 2 | C3176: Thursday | D3176: 4 | E3176: 1pm-2pm | F3176: 5 | G3176: 2 | H3176: 44 | I3176: 0 | J3176: =RC[-1]/RC[-2] -> 0
A3177: 124 | B3177: 2 | C3177: Thursday | D3177: 4 | E3177: 2pm-3pm | F3177: 6 | G3177: 1 | H3177: 44 | I3177: 14 | J3177: =RC[-1]/RC[-2] -> 0.31818181818181818
A3178: 124 | B3178: 2 | C3178: Thursday | D3178: 4 | E3178: 3pm-4pm | F3178: 7 | G3178: 1 | H3178: 44 | I3178: 15 | J3178: =RC[-1]/RC[-2] -> 0.34090909090909088
A3179: 124 | B3179: 2 | C3179: Thursday | D3179: 4 | E3179: 4pm-5pm | F3179: 8 | G3179: 1 | H3179: 44 | I3179: 15 | J3179: =RC[-1]/RC[-2] -> 0.34090909090909088
A3180: 124 | B3180: 2 | C3180: Friday | D3180: 5 | E3180: 9am-10am | F3180: 1 | G3180: 3 | H3180: 44 | I3180: 1 | J3180: =RC[-1]/RC[-2] -> 2.2727272727272728E-2
A3181: 124 | B3181: 2 | C3181: Friday | D3181: 5 | E3181: 10am-11am | F3181: 2 | G3181: 3 | H3181: 44 | I3181: 1 | J3181: =RC[-1]/RC[-2] -> 2.2727272727272728E-2
A3182: 124 | B3182: 2 | C3182: Friday | D3182: 5 | E3182: 11am-12pm | F3182: 3 | G3182: 3 | H3182: 44 | I3182: 1 | J3182: =RC[-1]/RC[-2] -> 2.2727272727272728E-2
A3183: 124 | B3183: 2 | C3183: Friday | D3183: 5 | E3183: 12pm-1pm | F3183: 4 | G3183: 2 | H3183: 44 | I3183: 0 | J3183: =RC[-1]/RC[-2] -> 0
A3184: 124 | B3184: 2 | C3184: Friday | D3184: 5 | E3184: 1pm-2pm | F3184: 5 | G3184: 1 | H3184: 44 | I3184: 1 | J3184: =RC[-1]/RC[-2] -> 2.2727272727272728E-2
A3185: 124 | B3185: 2 | C3185: Friday | D3185: 5 | E3185: 2pm-3pm | F3185: 6 | G3185: 1 | H3185: 44 | I3185: 12 | J3185: =RC[-1]/RC[-2] -> 0.27272727272727271
A3186: 124 | B3186: 2 | C3186: Friday | D3186: 5 | E3186: 3pm-4pm | F3186: 7 | G3186: 1 | H3186: 44 | I3186: 12 | J3186: =RC[-1]/RC[-2] -> 0.27272727272727271
A3187: 124 | B3187: 2 | C3187: Friday | D3187: 5 | E3187: 4pm-5pm | F3187: 8 | G3187: 1 | H3187: 44 | I3187: 12 | J3187: =RC[-1]/RC[-2] -> 0.27272727272727271
A3188: 207 | B3188: 2 | C3188: Monday | D3188: 1 | E3188: 9am-10am | F3188: 1 | G3188: 2 | H3188: 4 | I3188: 0 | J3188: =RC[-1]/RC[-2] -> 0
A3189: 207 | B3189: 2 | C3189: Monday | D3189: 1 | E3189: 10am-11am | F3189: 2 | G3189: 2 | H3189: 4 | I3189: 0 | J3189: =RC[-1]/RC[-2] -> 0
A3190: 207 | B3190: 2 | C3190: Monday | D3190: 1 | E3190: 11am-12pm | F3190: 3 | G3190: 2 | H3190: 4 | I3190: 0 | J3190: =RC[-1]/RC[-2] -> 0
A3191: 207 | B3191: 2 | C3191: Monday | D3191: 1 | E3191: 12pm-1pm | F3191: 4 | G3191: 2 | H3191: 4 | I3191: 0 | J3191: =RC[-1]/RC[-2] -> 0
A3192: 207 | B3192: 2 | C3192: Monday | D3192: 1 | E3192: 1pm-2pm | F3192: 5 | G3192: 2 | H3192: 4 | I3192: 0 | J3192: =RC[-1]/RC[-2] -> 0
A3193: 207 | B3193: 2 | C3193: Monday | D3193: 1 | E3193: 2pm-3pm | F3193: 6 | G3193: 2 | H3193: 4 | I3193: 0 | J3193: =RC[-1]/RC[-2] -> 0
A3194: 207 | B3194: 2 | C3194: Monday | D3194: 1 | E3194: 3pm-4pm | F3194: 7 | G3194: 2 | H3194: 4 | I3194: 0 | J3194: =RC[-1]/RC[-2] -> 0
A3195: 207 | B3195: 2 | C3195: Monday | D3195: 1 | E3195: 4pm-5pm | F3195: 8 | G3195: 2 | H3195: 4 | I3195: 0 | J3195: =RC[-1]/RC[-2] -> 0
A3196: 207 | B3196: 2 | C3196: Tuesday | D3196: 2 | E3196: 9am-10am | F3196: 1 | G3196: 2 | H3196: 4 | I3196: 0 | J3196: =RC[-1]/RC[-2] -> 0
A3197: 207 | B3197: 2 | C3197: Tuesday | D3197: 2 | E3197: 10am-11am | F3197: 2 | G3197: 2 | H3197: 4 | I3197: 0 | J3197: =RC[-1]/RC[-2] -> 0
A3198: 207 | B3198: 2 | C3198: Tuesday | D3198: 2 | E3198: 11am-12pm | F3198: 3 | G3198: 2 | H3198: 4 | I3198: 0 | J3198: =RC[-1]/RC[-2] -> 0
A3199: 207 | B3199: 2 | C3199: Tuesday | D3199: 2 | E3199: 12pm-1pm | F3199: 4 | G3199: 2 | H3199: 4 | I3199: 0 | J3199: =RC[-1]/RC[-2] -> 0
A3200: 207 | B3200: 2 | C3200: Tuesday | D3200: 2 | E3200: 1pm-2pm | F3200: 5 | G3200: 2 | H3200: 4 | I3200: 0 | J3200: =RC[-1]/RC[-2] -> 0
A3201: 207 | B3201: 2 | C3201: Tuesday | D3201: 2 | E3201: 2pm-3pm | F3201: 6 | G3201: 2 | H3201: 4 | I3201: 0 | J3201: =RC[-1]/RC[-2] -> 0
A3202: 207 | B3202: 2 | C3202: Tuesday | D3202: 2 | E3202: 3pm-4pm | F3202: 7 | G3202: 2 | H3202: 4 | I3202: 0 | J3202: =RC[-1]/RC[-2] -> 0
A3203: 207 | B3203: 2 | C3203: Tuesday | D3203: 2 | E3203: 4pm-5pm | F3203: 8 | G3203: 2 | H3203: 4 | I3203: 0 | J3203: =RC[-1]/RC[-2] -> 0
A3204: 207 | B3204: 2 | C3204: Wednesday | D3204: 3 | E3204: 9am-10am | F3204: 1 | G3204: 2 | H3204: 4 | I3204: 0 | J3204: =RC[-1]/RC[-2] -> 0
A3205: 207 | B3205: 2 | C3205: Wednesday | D3205: 3 | E3205: 10am-11am | F3205: 2 | G3205: 2 | H3205: 4 | I3205: 0 | J3205: =RC[-1]/RC[-2] -> 0
A3206: 207 | B3206: 2 | C3206: Wednesday | D3206: 3 | E3206: 11am-12pm | F3206: 3 | G3206: 2 | H3206: 4 | I3206: 0 | J3206: =RC[-1]/RC[-2] -> 0
A3207: 207 | B3207: 2 | C3207: Wednesday | D3207: 3 | E3207: 12pm-1pm | F3207: 4 | G3207: 2 | H3207: 4 | I3207: 0 | J3207: =RC[-1]/RC[-2] -> 0
A3208: 207 | B3208: 2 | C3208: Wednesday | D3208: 3 | E3208: 1pm-2pm | F3208: 5 | G3208: 2 | H3208: 4 | I3208: 0 | J3208: =RC[-1]/RC[-2] -> 0
A3209: 207 | B3209: 2 | C3209: Wednesday | D3209: 3 | E3209: 2pm-3pm | F3209: 6 | G3209: 2 | H3209: 4 | I3209: 0 | J3209: =RC[-1]/RC[-2] -> 0
A3210: 207 | B3210: 2 | C3210: Wednesday | D3210: 3 | E3210: 3pm-4pm | F3210: 7 | G3210: 2 | H3210: 4 | I3210: 0 | J3210: =RC[-1]/RC[-2] -> 0
A3211: 207 | B3211: 2 | C3211: Wednesday | D3211: 3 | E3211: 4pm-5pm | F3211: 8 | G3211: 2 | H3211: 4 | I3211: 0 | J3211: =RC[-1]/RC[-2] -> 0
A3212: 207 | B3212: 2 | C3212: Thursday | D3212: 4 | E3212: 9am-10am | F3212: 1 | G3212: 2 | H3212: 4 | I3212: 0 | J3212: =RC[-1]/RC[-2] -> 0
A3213: 207 | B3213: 2 | C3213: Thursday | D3213: 4 | E3213: 10am-11am | F3213: 2 | G3213: 2 | H3213: 4 | I3213: 0 | J3213: =RC[-1]/RC[-2] -> 0
A3214: 207 | B3214: 2 | C3214: Thursday | D3214: 4 | E3214: 11am-12pm | F3214: 3 | G3214: 2 | H3214: 4 | I3214: 0 | J3214: =RC[-1]/RC[-2] -> 0
A3215: 207 | B3215: 2 | C3215: Thursday | D3215: 4 | E3215: 12pm-1pm | F3215: 4 | G3215: 2 | H3215: 4 | I3215: 0 | J3215: =RC[-1]/RC[-2] -> 0
A3216: 207 | B3216: 2 | C3216: Thursday | D3216: 4 | E3216: 1pm-2pm | F3216: 5 | G3216: 2 | H3216: 4 | I3216: 0 | J3216: =RC[-1]/RC[-2] -> 0
A3217: 207 | B3217: 2 | C3217: Thursday | D3217: 4 | E3217: 2pm-3pm | F3217: 6 | G3217: 2 | H3217: 4 | I3217: 0 | J3217: =RC[-1]/RC[-2] -> 0
A3218: 207 | B3218: 2 | C3218: Thursday | D3218: 4 | E3218: 3pm-4pm | F3218: 7 | G3218: 2 | H3218: 4 | I3218: 0 | J3218: =RC[-1]/RC[-2] -> 0
A3219: 207 | B3219: 2 | C3219: Thursday | D3219: 4 | E3219: 4pm-5pm | F3219: 8 | G3219: 2 | H3219: 4 | I3219: 0 | J3219: =RC[-1]/RC[-2] -> 0
A3220: 207 | B3220: 2 | C3220: Friday | D3220: 5 | E3220: 9am-10am | F3220: 1 | G3220: 2 | H3220: 4 | I3220: 0 | J3220: =RC[-1]/RC[-2] -> 0
A3221: 207 | B3221: 2 | C3221: Friday | D3221: 5 | E3221: 10am-11am | F3221: 2 | G3221: 2 | H3221: 4 | I3221: 0 | J3221: =RC[-1]/RC[-2] -> 0
A3222: 207 | B3222: 2 | C3222: Friday | D3222: 5 | E3222: 11am-12pm | F3222: 3 | G3222: 2 | H3222: 4 | I3222: 0 | J3222: =RC[-1]/RC[-2] -> 0
A3223: 207 | B3223: 2 | C3223: Friday | D3223: 5 | E3223: 12pm-1pm | F3223: 4 | G3223: 2 | H3223: 4 | I3223: 0 | J3223: =RC[-1]/RC[-2] -> 0
A3224: 207 | B3224: 2 | C3224: Friday | D3224: 5 | E3224: 1pm-2pm | F3224: 5 | G3224: 2 | H3224: 4 | I3224: 0 | J3224: =RC[-1]/RC[-2] -> 0
A3225: 207 | B3225: 2 | C3225: Friday | D3225: 5 | E3225: 2pm-3pm | F3225: 6 | G3225: 2 | H3225: 4 | I3225: 0 | J3225: =RC[-1]/RC[-2] -> 0
A3226: 207 | B3226: 2 | C3226: Friday | D3226: 5 | E3226: 3pm-4pm | F3226: 7 | G3226: 2 | H3226: 4 | I3226: 0 | J3226: =RC[-1]/RC[-2] -> 0
A3227: 207 | B3227: 2 | C3227: Friday | D3227: 5 | E3227: 4pm-5pm | F3227: 8 | G3227: 2 | H3227: 4 | I3227: 0 | J3227: =RC[-1]/RC[-2] -> 0
A3228: 208 | B3228: 2 | C3228: Monday | D3228: 1 | E3228: 9am-10am | F3228: 1 | G3228: 2 | H3228: 4 | I3228: 0 | J3228: =RC[-1]/RC[-2] -> 0
A3229: 208 | B3229: 2 | C3229: Monday | D3229: 1 | E3229: 10am-11am | F3229: 2 | G3229: 2 | H3229: 4 | I3229: 0 | J3229: =RC[-1]/RC[-2] -> 0
A3230: 208 | B3230: 2 | C3230: Monday | D3230: 1 | E3230: 11am-12pm | F3230: 3 | G3230: 2 | H3230: 4 | I3230: 0 | J3230: =RC[-1]/RC[-2] -> 0
A3231: 208 | B3231: 2 | C3231: Monday | D3231: 1 | E3231: 12pm-1pm | F3231: 4 | G3231: 2 | H3231: 4 | I3231: 0 | J3231: =RC[-1]/RC[-2] -> 0
A3232: 208 | B3232: 2 | C3232: Monday | D3232: 1 | E3232: 1pm-2pm | F3232: 5 | G3232: 2 | H3232: 4 | I3232: 0 | J3232: =RC[-1]/RC[-2] -> 0
A3233: 208 | B3233: 2 | C3233: Monday | D3233: 1 | E3233: 2pm-3pm | F3233: 6 | G3233: 1 | H3233: 4 | I3233: 1 | J3233: =RC[-1]/RC[-2] -> 0.25
A3234: 208 | B3234: 2 | C3234: Monday | D3234: 1 | E3234: 3pm-4pm | F3234: 7 | G3234: 3 | H3234: 4 | I3234: 2 | J3234: =RC[-1]/RC[-2] -> 0.5
A3235: 208 | B3235: 2 | C3235: Monday | D3235: 1 | E3235: 4pm-5pm | F3235: 8 | G3235: 2 | H3235: 4 | I3235: 0 | J3235: =RC[-1]/RC[-2] -> 0
A3236: 208 | B3236: 2 | C3236: Tuesday | D3236: 2 | E3236: 9am-10am | F3236: 1 | G3236: 3 | H3236: 4 | I3236: 1 | J3236: =RC[-1]/RC[-2] -> 0.25
A3237: 208 | B3237: 2 | C3237: Tuesday | D3237: 2 | E3237: 10am-11am | F3237: 2 | G3237: 2 | H3237: 4 | I3237: 0 | J3237: =RC[-1]/RC[-2] -> 0
A3238: 208 | B3238: 2 | C3238: Tuesday | D3238: 2 | E3238: 11am-12pm | F3238: 3 | G3238: 2 | H3238: 4 | I3238: 0 | J3238: =RC[-1]/RC[-2] -> 0
A3239: 208 | B3239: 2 | C3239: Tuesday | D3239: 2 | E3239: 12pm-1pm | F3239: 4 | G3239: 2 | H3239: 4 | I3239: 0 | J3239: =RC[-1]/RC[-2] -> 0
A3240: 208 | B3240: 2 | C3240: Tuesday | D3240: 2 | E3240: 1pm-2pm | F3240: 5 | G3240: 2 | H3240: 4 | I3240: 0 | J3240: =RC[-1]/RC[-2] -> 0
A3241: 208 | B3241: 2 | C3241: Tuesday | D3241: 2 | E3241: 2pm-3pm | F3241: 6 | G3241: 2 | H3241: 4 | I3241: 0 | J3241: =RC[-1]/RC[-2] -> 0
A3242: 208 | B3242: 2 | C3242: Tuesday | D3242: 2 | E3242: 3pm-4pm | F3242: 7 | G3242: 2 | H3242: 4 | I3242: 0 | J3242: =RC[-1]/RC[-2] -> 0
A3243: 208 | B3243: 2 | C3243: Tuesday | D3243: 2 | E3243: 4pm-5pm | F3243: 8 | G3243: 2 | H3243: 4 | I3243: 0 | J3243: =RC[-1]/RC[-2] -> 0
A3244: 208 | B3244: 2 | C3244: Wednesday | D3244: 3 | E3244: 9am-10am | F3244: 1 | G3244: 2 | H3244: 4 | I3244: 0 | J3244: =RC[-1]/RC[-2] -> 0
A3245: 208 | B3245: 2 | C3245: Wednesday | D3245: 3 | E3245: 10am-11am | F3245: 2 | G3245: 2 | H3245: 4 | I3245: 0 | J3245: =RC[-1]/RC[-2] -> 0
A3246: 208 | B3246: 2 | C3246: Wednesday | D3246: 3 | E3246: 11am-12pm | F3246: 3 | G3246: 2 | H3246: 4 | I3246: 0 | J3246: =RC[-1]/RC[-2] -> 0
A3247: 208 | B3247: 2 | C3247: Wednesday | D3247: 3 | E3247: 12pm-1pm | F3247: 4 | G3247: 2 | H3247: 4 | I3247: 0 | J3247: =RC[-1]/RC[-2] -> 0
A3248: 208 | B3248: 2 | C3248: Wednesday | D3248: 3 | E3248: 1pm-2pm | F3248: 5 | G3248: 2 | H3248: 4 | I3248: 0 | J3248: =RC[-1]/RC[-2] -> 0
A3249: 208 | B3249: 2 | C3249: Wednesday | D3249: 3 | E3249: 2pm-3pm | F3249: 6 | G3249: 2 | H3249: 4 | I3249: 0 | J3249: =RC[-1]/RC[-2] -> 0
A3250: 208 | B3250: 2 | C3250: Wednesday | D3250: 3 | E3250: 3pm-4pm | F3250: 7 | G3250: 2 | H3250: 4 | I3250: 0 | J3250: =RC[-1]/RC[-2] -> 0
A3251: 208 | B3251: 2 | C3251: Wednesday | D3251: 3 | E3251: 4pm-5pm | F3251: 8 | G3251: 2 | H3251: 4 | I3251: 0 | J3251: =RC[-1]/RC[-2] -> 0
A3252: 208 | B3252: 2 | C3252: Thursday | D3252: 4 | E3252: 9am-10am | F3252: 1 | G3252: 3 | H3252: 4 | I3252: 1 | J3252: =RC[-1]/RC[-2] -> 0.25
A3253: 208 | B3253: 2 | C3253: Thursday | D3253: 4 | E3253: 10am-11am | F3253: 2 | G3253: 2 | H3253: 4 | I3253: 0 | J3253: =RC[-1]/RC[-2] -> 0
A3254: 208 | B3254: 2 | C3254: Thursday | D3254: 4 | E3254: 11am-12pm | F3254: 3 | G3254: 2 | H3254: 4 | I3254: 0 | J3254: =RC[-1]/RC[-2] -> 0
A3255: 208 | B3255: 2 | C3255: Thursday | D3255: 4 | E3255: 12pm-1pm | F3255: 4 | G3255: 2 | H3255: 4 | I3255: 0 | J3255: =RC[-1]/RC[-2] -> 0
A3256: 208 | B3256: 2 | C3256: Thursday | D3256: 4 | E3256: 1pm-2pm | F3256: 5 | G3256: 2 | H3256: 4 | I3256: 0 | J3256: =RC[-1]/RC[-2] -> 0
A3257: 208 | B3257: 2 | C3257: Thursday | D3257: 4 | E3257: 2pm-3pm | F3257: 6 | G3257: 2 | H3257: 4 | I3257: 0 | J3257: =RC[-1]/RC[-2] -> 0
A3258: 208 | B3258: 2 | C3258: Thursday | D3258: 4 | E3258: 3pm-4pm | F3258: 7 | G3258: 2 | H3258: 4 | I3258: 0 | J3258: =RC[-1]/RC[-2] -> 0
A3259: 208 | B3259: 2 | C3259: Thursday | D3259: 4 | E3259: 4pm-5pm | F3259: 8 | G3259: 2 | H3259: 4 | I3259: 0 | J3259: =RC[-1]/RC[-2] -> 0
A3260: 208 | B3260: 2 | C3260: Friday | D3260: 5 | E3260: 9am-10am | F3260: 1 | G3260: 2 | H3260: 4 | I3260: 0 | J3260: =RC[-1]/RC[-2] -> 0
A3261: 208 | B3261: 2 | C3261: Friday | D3261: 5 | E3261: 10am-11am | F3261: 2 | G3261: 2 | H3261: 4 | I3261: 0 | J3261: =RC[-1]/RC[-2] -> 0
A3262: 208 | B3262: 2 | C3262: Friday | D3262: 5 | E3262: 11am-12pm | F3262: 3 | G3262: 2 | H3262: 4 | I3262: 0 | J3262: =RC[-1]/RC[-2] -> 0
A3263: 208 | B3263: 2 | C3263: Friday | D3263: 5 | E3263: 12pm-1pm | F3263: 4 | G3263: 2 | H3263: 4 | I3263: 0 | J3263: =RC[-1]/RC[-2] -> 0
A3264: 208 | B3264: 2 | C3264: Friday | D3264: 5 | E3264: 1pm-2pm | F3264: 5 | G3264: 3 | H3264: 4 | I3264: 2 | J3264: =RC[-1]/RC[-2] -> 0.5
A3265: 208 | B3265: 2 | C3265: Friday | D3265: 5 | E3265: 2pm-3pm | F3265: 6 | G3265: 1 | H3265: 4 | I3265: 1 | J3265: =RC[-1]/RC[-2] -> 0.25
A3266: 208 | B3266: 2 | C3266: Friday | D3266: 5 | E3266: 3pm-4pm | F3266: 7 | G3266: 2 | H3266: 4 | I3266: 0 | J3266: =RC[-1]/RC[-2] -> 0
A3267: 208 | B3267: 2 | C3267: Friday | D3267: 5 | E3267: 4pm-5pm | F3267: 8 | G3267: 2 | H3267: 4 | I3267: 0 | J3267: =RC[-1]/RC[-2] -> 0
A3268: 209 | B3268: 2 | C3268: Monday | D3268: 1 | E3268: 9am-10am | F3268: 1 | G3268: 2 | H3268: 4 | I3268: 0 | J3268: =RC[-1]/RC[-2] -> 0
A3269: 209 | B3269: 2 | C3269: Monday | D3269: 1 | E3269: 10am-11am | F3269: 2 | G3269: 2 | H3269: 4 | I3269: 0 | J3269: =RC[-1]/RC[-2] -> 0
A3270: 209 | B3270: 2 | C3270: Monday | D3270: 1 | E3270: 11am-12pm | F3270: 3 | G3270: 2 | H3270: 4 | I3270: 0 | J3270: =RC[-1]/RC[-2] -> 0
A3271: 209 | B3271: 2 | C3271: Monday | D3271: 1 | E3271: 12pm-1pm | F3271: 4 | G3271: 2 | H3271: 4 | I3271: 0 | J3271: =RC[-1]/RC[-2] -> 0
A3272: 209 | B3272: 2 | C3272: Monday | D3272: 1 | E3272: 1pm-2pm | F3272: 5 | G3272: 2 | H3272: 4 | I3272: 0 | J3272: =RC[-1]/RC[-2] -> 0
A3273: 209 | B3273: 2 | C3273: Monday | D3273: 1 | E3273: 2pm-3pm | F3273: 6 | G3273: 3 | H3273: 4 | I3273: 1 | J3273: =RC[-1]/RC[-2] -> 0.25
A3274: 209 | B3274: 2 | C3274: Monday | D3274: 1 | E3274: 3pm-4pm | F3274: 7 | G3274: 2 | H3274: 4 | I3274: 0 | J3274: =RC[-1]/RC[-2] -> 0
A3275: 209 | B3275: 2 | C3275: Monday | D3275: 1 | E3275: 4pm-5pm | F3275: 8 | G3275: 2 | H3275: 4 | I3275: 0 | J3275: =RC[-1]/RC[-2] -> 0
A3276: 209 | B3276: 2 | C3276: Tuesday | D3276: 2 | E3276: 9am-10am | F3276: 1 | G3276: 2 | H3276: 4 | I3276: 0 | J3276: =RC[-1]/RC[-2] -> 0
A3277: 209 | B3277: 2 | C3277: Tuesday | D3277: 2 | E3277: 10am-11am | F3277: 2 | G3277: 3 | H3277: 4 | I3277: 1 | J3277: =RC[-1]/RC[-2] -> 0.25
A3278: 209 | B3278: 2 | C3278: Tuesday | D3278: 2 | E3278: 11am-12pm | F3278: 3 | G3278: 2 | H3278: 4 | I3278: 0 | J3278: =RC[-1]/RC[-2] -> 0
A3279: 209 | B3279: 2 | C3279: Tuesday | D3279: 2 | E3279: 12pm-1pm | F3279: 4 | G3279: 2 | H3279: 4 | I3279: 0 | J3279: =RC[-1]/RC[-2] -> 0
A3280: 209 | B3280: 2 | C3280: Tuesday | D3280: 2 | E3280: 1pm-2pm | F3280: 5 | G3280: 2 | H3280: 4 | I3280: 0 | J3280: =RC[-1]/RC[-2] -> 0
A3281: 209 | B3281: 2 | C3281: Tuesday | D3281: 2 | E3281: 2pm-3pm | F3281: 6 | G3281: 1 | H3281: 4 | I3281: 1 | J3281: =RC[-1]/RC[-2] -> 0.25
A3282: 209 | B3282: 2 | C3282: Tuesday | D3282: 2 | E3282: 3pm-4pm | F3282: 7 | G3282: 2 | H3282: 4 | I3282: 0 | J3282: =RC[-1]/RC[-2] -> 0
A3283: 209 | B3283: 2 | C3283: Tuesday | D3283: 2 | E3283: 4pm-5pm | F3283: 8 | G3283: 2 | H3283: 4 | I3283: 0 | J3283: =RC[-1]/RC[-2] -> 0
A3284: 209 | B3284: 2 | C3284: Wednesday | D3284: 3 | E3284: 9am-10am | F3284: 1 | G3284: 3 | H3284: 4 | I3284: 1 | J3284: =RC[-1]/RC[-2] -> 0.25
A3285: 209 | B3285: 2 | C3285: Wednesday | D3285: 3 | E3285: 10am-11am | F3285: 2 | G3285: 3 | H3285: 4 | I3285: 1 | J3285: =RC[-1]/RC[-2] -> 0.25
A3286: 209 | B3286: 2 | C3286: Wednesday | D3286: 3 | E3286: 11am-12pm | F3286: 3 | G3286: 2 | H3286: 4 | I3286: 0 | J3286: =RC[-1]/RC[-2] -> 0
A3287: 209 | B3287: 2 | C3287: Wednesday | D3287: 3 | E3287: 12pm-1pm | F3287: 4 | G3287: 2 | H3287: 4 | I3287: 0 | J3287: =RC[-1]/RC[-2] -> 0
A3288: 209 | B3288: 2 | C3288: Wednesday | D3288: 3 | E3288: 1pm-2pm | F3288: 5 | G3288: 2 | H3288: 4 | I3288: 0 | J3288: =RC[-1]/RC[-2] -> 0
A3289: 209 | B3289: 2 | C3289: Wednesday | D3289: 3 | E3289: 2pm-3pm | F3289: 6 | G3289: 3 | H3289: 4 | I3289: 1 | J3289: =RC[-1]/RC[-2] -> 0.25
A3290: 209 | B3290: 2 | C3290: Wednesday | D3290: 3 | E3290: 3pm-4pm | F3290: 7 | G3290: 2 | H3290: 4 | I3290: 0 | J3290: =RC[-1]/RC[-2] -> 0
A3291: 209 | B3291: 2 | C3291: Wednesday | D3291: 3 | E3291: 4pm-5pm | F3291: 8 | G3291: 2 | H3291: 4 | I3291: 0 | J3291: =RC[-1]/RC[-2] -> 0
A3292: 209 | B3292: 2 | C3292: Thursday | D3292: 4 | E3292: 9am-10am | F3292: 1 | G3292: 3 | H3292: 4 | I3292: 1 | J3292: =RC[-1]/RC[-2] -> 0.25
A3293: 209 | B3293: 2 | C3293: Thursday | D3293: 4 | E3293: 10am-11am | F3293: 2 | G3293: 2 | H3293: 4 | I3293: 0 | J3293: =RC[-1]/RC[-2] -> 0
A3294: 209 | B3294: 2 | C3294: Thursday | D3294: 4 | E3294: 11am-12pm | F3294: 3 | G3294: 2 | H3294: 4 | I3294: 0 | J3294: =RC[-1]/RC[-2] -> 0
A3295: 209 | B3295: 2 | C3295: Thursday | D3295: 4 | E3295: 12pm-1pm | F3295: 4 | G3295: 3 | H3295: 4 | I3295: 1 | J3295: =RC[-1]/RC[-2] -> 0.25
A3296: 209 | B3296: 2 | C3296: Thursday | D3296: 4 | E3296: 1pm-2pm | F3296: 5 | G3296: 2 | H3296: 4 | I3296: 0 | J3296: =RC[-1]/RC[-2] -> 0
A3297: 209 | B3297: 2 | C3297: Thursday | D3297: 4 | E3297: 2pm-3pm | F3297: 6 | G3297: 1 | H3297: 4 | I3297: 1 | J3297: =RC[-1]/RC[-2] -> 0.25
A3298: 209 | B3298: 2 | C3298: Thursday | D3298: 4 | E3298: 3pm-4pm | F3298: 7 | G3298: 1 | H3298: 4 | I3298: 1 | J3298: =RC[-1]/RC[-2] -> 0.25
A3299: 209 | B3299: 2 | C3299: Thursday | D3299: 4 | E3299: 4pm-5pm | F3299: 8 | G3299: 1 | H3299: 4 | I3299: 1 | J3299: =RC[-1]/RC[-2] -> 0.25
A3300: 209 | B3300: 2 | C3300: Friday | D3300: 5 | E3300: 9am-10am | F3300: 1 | G3300: 2 | H3300: 4 | I3300: 0 | J3300: =RC[-1]/RC[-2] -> 0
A3301: 209 | B3301: 2 | C3301: Friday | D3301: 5 | E3301: 10am-11am | F3301: 2 | G3301: 3 | H3301: 4 | I3301: 3 | J3301: =RC[-1]/RC[-2] -> 0.75
A3302: 209 | B3302: 2 | C3302: Friday | D3302: 5 | E3302: 11am-12pm | F3302: 3 | G3302: 2 | H3302: 4 | I3302: 0 | J3302: =RC[-1]/RC[-2] -> 0
A3303: 209 | B3303: 2 | C3303: Friday | D3303: 5 | E3303: 12pm-1pm | F3303: 4 | G3303: 2 | H3303: 4 | I3303: 0 | J3303: =RC[-1]/RC[-2] -> 0
A3304: 209 | B3304: 2 | C3304: Friday | D3304: 5 | E3304: 1pm-2pm | F3304: 5 | G3304: 2 | H3304: 4 | I3304: 0 | J3304: =RC[-1]/RC[-2] -> 0
A3305: 209 | B3305: 2 | C3305: Friday | D3305: 5 | E3305: 2pm-3pm | F3305: 6 | G3305: 2 | H3305: 4 | I3305: 0 | J3305: =RC[-1]/RC[-2] -> 0
A3306: 209 | B3306: 2 | C3306: Friday | D3306: 5 | E3306: 3pm-4pm | F3306: 7 | G3306: 3 | H3306: 4 | I3306: 1 | J3306: =RC[-1]/RC[-2] -> 0.25
A3307: 209 | B3307: 2 | C3307: Friday | D3307: 5 | E3307: 4pm-5pm | F3307: 8 | G3307: 3 | H3307: 4 | I3307: 1 | J3307: =RC[-1]/RC[-2] -> 0.25
A3308: 210 | B3308: 2 | C3308: Monday | D3308: 1 | E3308: 9am-10am | F3308: 1 | G3308: 2 | H3308: 3 | I3308: 0 | J3308: =RC[-1]/RC[-2] -> 0
A3309: 210 | B3309: 2 | C3309: Monday | D3309: 1 | E3309: 10am-11am | F3309: 2 | G3309: 2 | H3309: 3 | I3309: 0 | J3309: =RC[-1]/RC[-2] -> 0
A3310: 210 | B3310: 2 | C3310: Monday | D3310: 1 | E3310: 11am-12pm | F3310: 3 | G3310: 2 | H3310: 3 | I3310: 0 | J3310: =RC[-1]/RC[-2] -> 0
A3311: 210 | B3311: 2 | C3311: Monday | D3311: 1 | E3311: 12pm-1pm | F3311: 4 | G3311: 2 | H3311: 3 | I3311: 0 | J3311: =RC[-1]/RC[-2] -> 0
A3312: 210 | B3312: 2 | C3312: Monday | D3312: 1 | E3312: 1pm-2pm | F3312: 5 | G3312: 2 | H3312: 3 | I3312: 0 | J3312: =RC[-1]/RC[-2] -> 0
A3313: 210 | B3313: 2 | C3313: Monday | D3313: 1 | E3313: 2pm-3pm | F3313: 6 | G3313: 2 | H3313: 3 | I3313: 0 | J3313: =RC[-1]/RC[-2] -> 0
A3314: 210 | B3314: 2 | C3314: Monday | D3314: 1 | E3314: 3pm-4pm | F3314: 7 | G3314: 2 | H3314: 3 | I3314: 0 | J3314: =RC[-1]/RC[-2] -> 0
A3315: 210 | B3315: 2 | C3315: Monday | D3315: 1 | E3315: 4pm-5pm | F3315: 8 | G3315: 2 | H3315: 3 | I3315: 0 | J3315: =RC[-1]/RC[-2] -> 0
A3316: 210 | B3316: 2 | C3316: Tuesday | D3316: 2 | E3316: 9am-10am | F3316: 1 | G3316: 2 | H3316: 3 | I3316: 0 | J3316: =RC[-1]/RC[-2] -> 0
A3317: 210 | B3317: 2 | C3317: Tuesday | D3317: 2 | E3317: 10am-11am | F3317: 2 | G3317: 2 | H3317: 3 | I3317: 0 | J3317: =RC[-1]/RC[-2] -> 0
A3318: 210 | B3318: 2 | C3318: Tuesday | D3318: 2 | E3318: 11am-12pm | F3318: 3 | G3318: 2 | H3318: 3 | I3318: 0 | J3318: =RC[-1]/RC[-2] -> 0
A3319: 210 | B3319: 2 | C3319: Tuesday | D3319: 2 | E3319: 12pm-1pm | F3319: 4 | G3319: 2 | H3319: 3 | I3319: 0 | J3319: =RC[-1]/RC[-2] -> 0
A3320: 210 | B3320: 2 | C3320: Tuesday | D3320: 2 | E3320: 1pm-2pm | F3320: 5 | G3320: 2 | H3320: 3 | I3320: 0 | J3320: =RC[-1]/RC[-2] -> 0
A3321: 210 | B3321: 2 | C3321: Tuesday | D3321: 2 | E3321: 2pm-3pm | F3321: 6 | G3321: 3 | H3321: 3 | I3321: 1 | J3321: =RC[-1]/RC[-2] -> 0.33333333333333331
A3322: 210 | B3322: 2 | C3322: Tuesday | D3322: 2 | E3322: 3pm-4pm | F3322: 7 | G3322: 2 | H3322: 3 | I3322: 0 | J3322: =RC[-1]/RC[-2] -> 0
A3323: 210 | B3323: 2 | C3323: Tuesday | D3323: 2 | E3323: 4pm-5pm | F3323: 8 | G3323: 2 | H3323: 3 | I3323: 0 | J3323: =RC[-1]/RC[-2] -> 0
A3324: 210 | B3324: 2 | C3324: Wednesday | D3324: 3 | E3324: 9am-10am | F3324: 1 | G3324: 2 | H3324: 3 | I3324: 0 | J3324: =RC[-1]/RC[-2] -> 0
A3325: 210 | B3325: 2 | C3325: Wednesday | D3325: 3 | E3325: 10am-11am | F3325: 2 | G3325: 2 | H3325: 3 | I3325: 0 | J3325: =RC[-1]/RC[-2] -> 0
A3326: 210 | B3326: 2 | C3326: Wednesday | D3326: 3 | E3326: 11am-12pm | F3326: 3 | G3326: 2 | H3326: 3 | I3326: 0 | J3326: =RC[-1]/RC[-2] -> 0
A3327: 210 | B3327: 2 | C3327: Wednesday | D3327: 3 | E3327: 12pm-1pm | F3327: 4 | G3327: 2 | H3327: 3 | I3327: 0 | J3327: =RC[-1]/RC[-2] -> 0
A3328: 210 | B3328: 2 | C3328: Wednesday | D3328: 3 | E3328: 1pm-2pm | F3328: 5 | G3328: 2 | H3328: 3 | I3328: 0 | J3328: =RC[-1]/RC[-2] -> 0
A3329: 210 | B3329: 2 | C3329: Wednesday | D3329: 3 | E3329: 2pm-3pm | F3329: 6 | G3329: 2 | H3329: 3 | I3329: 0 | J3329: =RC[-1]/RC[-2] -> 0
A3330: 210 | B3330: 2 | C3330: Wednesday | D3330: 3 | E3330: 3pm-4pm | F3330: 7 | G3330: 2 | H3330: 3 | I3330: 0 | J3330: =RC[-1]/RC[-2] -> 0
A3331: 210 | B3331: 2 | C3331: Wednesday | D3331: 3 | E3331: 4pm-5pm | F3331: 8 | G3331: 2 | H3331: 3 | I3331: 0 | J3331: =RC[-1]/RC[-2] -> 0
A3332: 210 | B3332: 2 | C3332: Thursday | D3332: 4 | E3332: 9am-10am | F3332: 1 | G3332: 2 | H3332: 3 | I3332: 0 | J3332: =RC[-1]/RC[-2] -> 0
A3333: 210 | B3333: 2 | C3333: Thursday | D3333: 4 | E3333: 10am-11am | F3333: 2 | G3333: 2 | H3333: 3 | I3333: 0 | J3333: =RC[-1]/RC[-2] -> 0
A3334: 210 | B3334: 2 | C3334: Thursday | D3334: 4 | E3334: 11am-12pm | F3334: 3 | G3334: 2 | H3334: 3 | I3334: 0 | J3334: =RC[-1]/RC[-2] -> 0
A3335: 210 | B3335: 2 | C3335: Thursday | D3335: 4 | E3335: 12pm-1pm | F3335: 4 | G3335: 2 | H3335: 3 | I3335: 0 | J3335: =RC[-1]/RC[-2] -> 0
A3336: 210 | B3336: 2 | C3336: Thursday | D3336: 4 | E3336: 1pm-2pm | F3336: 5 | G3336: 2 | H3336: 3 | I3336: 0 | J3336: =RC[-1]/RC[-2] -> 0
A3337: 210 | B3337: 2 | C3337: Thursday | D3337: 4 | E3337: 2pm-3pm | F3337: 6 | G3337: 2 | H3337: 3 | I3337: 0 | J3337: =RC[-1]/RC[-2] -> 0
A3338: 210 | B3338: 2 | C3338: Thursday | D3338: 4 | E3338: 3pm-4pm | F3338: 7 | G3338: 2 | H3338: 3 | I3338: 0 | J3338: =RC[-1]/RC[-2] -> 0
A3339: 210 | B3339: 2 | C3339: Thursday | D3339: 4 | E3339: 4pm-5pm | F3339: 8 | G3339: 2 | H3339: 3 | I3339: 0 | J3339: =RC[-1]/RC[-2] -> 0
A3340: 210 | B3340: 2 | C3340: Friday | D3340: 5 | E3340: 9am-10am | F3340: 1 | G3340: 2 | H3340: 3 | I3340: 0 | J3340: =RC[-1]/RC[-2] -> 0
A3341: 210 | B3341: 2 | C3341: Friday | D3341: 5 | E3341: 10am-11am | F3341: 2 | G3341: 1 | H3341: 3 | I3341: 1 | J3341: =RC[-1]/RC[-2] -> 0.33333333333333331
A3342: 210 | B3342: 2 | C3342: Friday | D3342: 5 | E3342: 11am-12pm | F3342: 3 | G3342: 2 | H3342: 3 | I3342: 0 | J3342: =RC[-1]/RC[-2] -> 0
A3343: 210 | B3343: 2 | C3343: Friday | D3343: 5 | E3343: 12pm-1pm | F3343: 4 | G3343: 2 | H3343: 3 | I3343: 0 | J3343: =RC[-1]/RC[-2] -> 0
A3344: 210 | B3344: 2 | C3344: Friday | D3344: 5 | E3344: 1pm-2pm | F3344: 5 | G3344: 2 | H3344: 3 | I3344: 0 | J3344: =RC[-1]/RC[-2] -> 0
A3345: 210 | B3345: 2 | C3345: Friday | D3345: 5 | E3345: 2pm-3pm | F3345: 6 | G3345: 2 | H3345: 3 | I3345: 0 | J3345: =RC[-1]/RC[-2] -> 0
A3346: 210 | B3346: 2 | C3346: Friday | D3346: 5 | E3346: 3pm-4pm | F3346: 7 | G3346: 2 | H3346: 3 | I3346: 0 | J3346: =RC[-1]/RC[-2] -> 0
A3347: 210 | B3347: 2 | C3347: Friday | D3347: 5 | E3347: 4pm-5pm | F3347: 8 | G3347: 2 | H3347: 3 | I3347: 0 | J3347: =RC[-1]/RC[-2] -> 0
A3348: 211 | B3348: 2 | C3348: Monday | D3348: 1 | E3348: 9am-10am | F3348: 1 | G3348: 1 | H3348: 34 | I3348: 23 | J3348: =RC[-1]/RC[-2] -> 0.67647058823529416
A3349: 211 | B3349: 2 | C3349: Monday | D3349: 1 | E3349: 10am-11am | F3349: 2 | G3349: 1 | H3349: 34 | I3349: 30 | J3349: =RC[-1]/RC[-2] -> 0.88235294117647056
A3350: 211 | B3350: 2 | C3350: Monday | D3350: 1 | E3350: 11am-12pm | F3350: 3 | G3350: 1 | H3350: 34 | I3350: 30 | J3350: =RC[-1]/RC[-2] -> 0.88235294117647056
A3351: 211 | B3351: 2 | C3351: Monday | D3351: 1 | E3351: 12pm-1pm | F3351: 4 | G3351: 2 | H3351: 34 | I3351: 0 | J3351: =RC[-1]/RC[-2] -> 0
A3352: 211 | B3352: 2 | C3352: Monday | D3352: 1 | E3352: 1pm-2pm | F3352: 5 | G3352: 2 | H3352: 34 | I3352: 0 | J3352: =RC[-1]/RC[-2] -> 0
A3353: 211 | B3353: 2 | C3353: Monday | D3353: 1 | E3353: 2pm-3pm | F3353: 6 | G3353: 1 | H3353: 34 | I3353: 11 | J3353: =RC[-1]/RC[-2] -> 0.3235294117647059
A3354: 211 | B3354: 2 | C3354: Monday | D3354: 1 | E3354: 3pm-4pm | F3354: 7 | G3354: 1 | H3354: 34 | I3354: 12 | J3354: =RC[-1]/RC[-2] -> 0.35294117647058826
A3355: 211 | B3355: 2 | C3355: Monday | D3355: 1 | E3355: 4pm-5pm | F3355: 8 | G3355: 1 | H3355: 34 | I3355: 13 | J3355: =RC[-1]/RC[-2] -> 0.38235294117647056
A3356: 211 | B3356: 2 | C3356: Tuesday | D3356: 2 | E3356: 9am-10am | F3356: 1 | G3356: 2 | H3356: 34 | I3356: 0 | J3356: =RC[-1]/RC[-2] -> 0
A3357: 211 | B3357: 2 | C3357: Tuesday | D3357: 2 | E3357: 10am-11am | F3357: 2 | G3357: 2 | H3357: 34 | I3357: 0 | J3357: =RC[-1]/RC[-2] -> 0
A3358: 211 | B3358: 2 | C3358: Tuesday | D3358: 2 | E3358: 11am-12pm | F3358: 3 | G3358: 2 | H3358: 34 | I3358: 0 | J3358: =RC[-1]/RC[-2] -> 0
A3359: 211 | B3359: 2 | C3359: Tuesday | D3359: 2 | E3359: 12pm-1pm | F3359: 4 | G3359: 2 | H3359: 34 | I3359: 0 | J3359: =RC[-1]/RC[-2] -> 0
A3360: 211 | B3360: 2 | C3360: Tuesday | D3360: 2 | E3360: 1pm-2pm | F3360: 5 | G3360: 2 | H3360: 34 | I3360: 0 | J3360: =RC[-1]/RC[-2] -> 0
A3361: 211 | B3361: 2 | C3361: Tuesday | D3361: 2 | E3361: 2pm-3pm | F3361: 6 | G3361: 1 | H3361: 34 | I3361: 30 | J3361: =RC[-1]/RC[-2] -> 0.88235294117647056
A3362: 211 | B3362: 2 | C3362: Tuesday | D3362: 2 | E3362: 3pm-4pm | F3362: 7 | G3362: 1 | H3362: 34 | I3362: 30 | J3362: =RC[-1]/RC[-2] -> 0.88235294117647056
A3363: 211 | B3363: 2 | C3363: Tuesday | D3363: 2 | E3363: 4pm-5pm | F3363: 8 | G3363: 1 | H3363: 34 | I3363: 30 | J3363: =RC[-1]/RC[-2] -> 0.88235294117647056
A3364: 211 | B3364: 2 | C3364: Wednesday | D3364: 3 | E3364: 9am-10am | F3364: 1 | G3364: 1 | H3364: 34 | I3364: 25 | J3364: =RC[-1]/RC[-2] -> 0.73529411764705888
A3365: 211 | B3365: 2 | C3365: Wednesday | D3365: 3 | E3365: 10am-11am | F3365: 2 | G3365: 1 | H3365: 34 | I3365: 25 | J3365: =RC[-1]/RC[-2] -> 0.73529411764705888
A3366: 211 | B3366: 2 | C3366: Wednesday | D3366: 3 | E3366: 11am-12pm | F3366: 3 | G3366: 1 | H3366: 34 | I3366: 20 | J3366: =RC[-1]/RC[-2] -> 0.58823529411764708
A3367: 211 | B3367: 2 | C3367: Wednesday | D3367: 3 | E3367: 12pm-1pm | F3367: 4 | G3367: 1 | H3367: 34 | I3367: 1 | J3367: =RC[-1]/RC[-2] -> 2.9411764705882353E-2
A3368: 211 | B3368: 2 | C3368: Wednesday | D3368: 3 | E3368: 1pm-2pm | F3368: 5 | G3368: 2 | H3368: 34 | I3368: 0 | J3368: =RC[-1]/RC[-2] -> 0
A3369: 211 | B3369: 2 | C3369: Wednesday | D3369: 3 | E3369: 2pm-3pm | F3369: 6 | G3369: 3 | H3369: 34 | I3369: 2 | J3369: =RC[-1]/RC[-2] -> 5.8823529411764705E-2
A3370: 211 | B3370: 2 | C3370: Wednesday | D3370: 3 | E3370: 3pm-4pm | F3370: 7 | G3370: 1 | H3370: 34 | I3370: 20 | J3370: =RC[-1]/RC[-2] -> 0.58823529411764708
A3371: 211 | B3371: 2 | C3371: Wednesday | D3371: 3 | E3371: 4pm-5pm | F3371: 8 | G3371: 1 | H3371: 34 | I3371: 10 | J3371: =RC[-1]/RC[-2] -> 0.29411764705882354
A3372: 211 | B3372: 2 | C3372: Thursday | D3372: 4 | E3372: 9am-10am | F3372: 1 | G3372: 1 | H3372: 34 | I3372: 1 | J3372: =RC[-1]/RC[-2] -> 2.9411764705882353E-2
A3373: 211 | B3373: 2 | C3373: Thursday | D3373: 4 | E3373: 10am-11am | F3373: 2 | G3373: 1 | H3373: 34 | I3373: 9 | J3373: =RC[-1]/RC[-2] -> 0.26470588235294118
A3374: 211 | B3374: 2 | C3374: Thursday | D3374: 4 | E3374: 11am-12pm | F3374: 3 | G3374: 1 | H3374: 34 | I3374: 12 | J3374: =RC[-1]/RC[-2] -> 0.35294117647058826
A3375: 211 | B3375: 2 | C3375: Thursday | D3375: 4 | E3375: 12pm-1pm | F3375: 4 | G3375: 1 | H3375: 34 | I3375: 8 | J3375: =RC[-1]/RC[-2] -> 0.23529411764705882
A3376: 211 | B3376: 2 | C3376: Thursday | D3376: 4 | E3376: 1pm-2pm | F3376: 5 | G3376: 1 | H3376: 34 | I3376: 2 | J3376: =RC[-1]/RC[-2] -> 5.8823529411764705E-2
A3377: 211 | B3377: 2 | C3377: Thursday | D3377: 4 | E3377: 2pm-3pm | F3377: 6 | G3377: 3 | H3377: 34 | I3377: 1 | J3377: =RC[-1]/RC[-2] -> 2.9411764705882353E-2
A3378: 211 | B3378: 2 | C3378: Thursday | D3378: 4 | E3378: 3pm-4pm | F3378: 7 | G3378: 3 | H3378: 34 | I3378: 1 | J3378: =RC[-1]/RC[-2] -> 2.9411764705882353E-2
A3379: 211 | B3379: 2 | C3379: Thursday | D3379: 4 | E3379: 4pm-5pm | F3379: 8 | G3379: 2 | H3379: 34 | I3379: 0 | J3379: =RC[-1]/RC[-2] -> 0
A3380: 211 | B3380: 2 | C3380: Friday | D3380: 5 | E3380: 9am-10am | F3380: 1 | G3380: 2 | H3380: 34 | I3380: 0 | J3380: =RC[-1]/RC[-2] -> 0
A3381: 211 | B3381: 2 | C3381: Friday | D3381: 5 | E3381: 10am-11am | F3381: 2 | G3381: 2 | H3381: 34 | I3381: 0 | J3381: =RC[-1]/RC[-2] -> 0
A3382: 211 | B3382: 2 | C3382: Friday | D3382: 5 | E3382: 11am-12pm | F3382: 3 | G3382: 2 | H3382: 34 | I3382: 0 | J3382: =RC[-1]/RC[-2] -> 0
A3383: 211 | B3383: 2 | C3383: Friday | D3383: 5 | E3383: 12pm-1pm | F3383: 4 | G3383: 2 | H3383: 34 | I3383: 0 | J3383: =RC[-1]/RC[-2] -> 0
A3384: 211 | B3384: 2 | C3384: Friday | D3384: 5 | E3384: 1pm-2pm | F3384: 5 | G3384: 2 | H3384: 34 | I3384: 0 | J3384: =RC[-1]/RC[-2] -> 0
A3385: 211 | B3385: 2 | C3385: Friday | D3385: 5 | E3385: 2pm-3pm | F3385: 6 | G3385: 2 | H3385: 34 | I3385: 0 | J3385: =RC[-1]/RC[-2] -> 0
A3386: 211 | B3386: 2 | C3386: Friday | D3386: 5 | E3386: 3pm-4pm | F3386: 7 | G3386: 2 | H3386: 34 | I3386: 0 | J3386: =RC[-1]/RC[-2] -> 0
A3387: 211 | B3387: 2 | C3387: Friday | D3387: 5 | E3387: 4pm-5pm | F3387: 8 | G3387: 2 | H3387: 34 | I3387: 0 | J3387: =RC[-1]/RC[-2] -> 0
A3388: 217 | B3388: 2 | C3388: Monday | D3388: 1 | E3388: 9am-10am | F3388: 1 | G3388: 2 | H3388: 4 | I3388: 0 | J3388: =RC[-1]/RC[-2] -> 0
A3389: 217 | B3389: 2 | C3389: Monday | D3389: 1 | E3389: 10am-11am | F3389: 2 | G3389: 2 | H3389: 4 | I3389: 0 | J3389: =RC[-1]/RC[-2] -> 0
A3390: 217 | B3390: 2 | C3390: Monday | D3390: 1 | E3390: 11am-12pm | F3390: 3 | G3390: 2 | H3390: 4 | I3390: 0 | J3390: =RC[-1]/RC[-2] -> 0
A3391: 217 | B3391: 2 | C3391: Monday | D3391: 1 | E3391: 12pm-1pm | F3391: 4 | G3391: 2 | H3391: 4 | I3391: 0 | J3391: =RC[-1]/RC[-2] -> 0
A3392: 217 | B3392: 2 | C3392: Monday | D3392: 1 | E3392: 1pm-2pm | F3392: 5 | G3392: 2 | H3392: 4 | I3392: 0 | J3392: =RC[-1]/RC[-2] -> 0
A3393: 217 | B3393: 2 | C3393: Monday | D3393: 1 | E3393: 2pm-3pm | F3393: 6 | G3393: 2 | H3393: 4 | I3393: 0 | J3393: =RC[-1]/RC[-2] -> 0
A3394: 217 | B3394: 2 | C3394: Monday | D3394: 1 | E3394: 3pm-4pm | F3394: 7 | G3394: 2 | H3394: 4 | I3394: 0 | J3394: =RC[-1]/RC[-2] -> 0
A3395: 217 | B3395: 2 | C3395: Monday | D3395: 1 | E3395: 4pm-5pm | F3395: 8 | G3395: 2 | H3395: 4 | I3395: 0 | J3395: =RC[-1]/RC[-2] -> 0
A3396: 217 | B3396: 2 | C3396: Tuesday | D3396: 2 | E3396: 9am-10am | F3396: 1 | G3396: 2 | H3396: 4 | I3396: 0 | J3396: =RC[-1]/RC[-2] -> 0
A3397: 217 | B3397: 2 | C3397: Tuesday | D3397: 2 | E3397: 10am-11am | F3397: 2 | G3397: 2 | H3397: 4 | I3397: 0 | J3397: =RC[-1]/RC[-2] -> 0
A3398: 217 | B3398: 2 | C3398: Tuesday | D3398: 2 | E3398: 11am-12pm | F3398: 3 | G3398: 2 | H3398: 4 | I3398: 0 | J3398: =RC[-1]/RC[-2] -> 0
A3399: 217 | B3399: 2 | C3399: Tuesday | D3399: 2 | E3399: 12pm-1pm | F3399: 4 | G3399: 2 | H3399: 4 | I3399: 0 | J3399: =RC[-1]/RC[-2] -> 0
A3400: 217 | B3400: 2 | C3400: Tuesday | D3400: 2 | E3400: 1pm-2pm | F3400: 5 | G3400: 2 | H3400: 4 | I3400: 0 | J3400: =RC[-1]/RC[-2] -> 0
A3401: 217 | B3401: 2 | C3401: Tuesday | D3401: 2 | E3401: 2pm-3pm | F3401: 6 | G3401: 2 | H3401: 4 | I3401: 0 | J3401: =RC[-1]/RC[-2] -> 0
A3402: 217 | B3402: 2 | C3402: Tuesday | D3402: 2 | E3402: 3pm-4pm | F3402: 7 | G3402: 2 | H3402: 4 | I3402: 0 | J3402: =RC[-1]/RC[-2] -> 0
A3403: 217 | B3403: 2 | C3403: Tuesday | D3403: 2 | E3403: 4pm-5pm | F3403: 8 | G3403: 2 | H3403: 4 | I3403: 0 | J3403: =RC[-1]/RC[-2] -> 0
A3404: 217 | B3404: 2 | C3404: Wednesday | D3404: 3 | E3404: 9am-10am | F3404: 1 | G3404: 2 | H3404: 4 | I3404: 0 | J3404: =RC[-1]/RC[-2] -> 0
A3405: 217 | B3405: 2 | C3405: Wednesday | D3405: 3 | E3405: 10am-11am | F3405: 2 | G3405: 2 | H3405: 4 | I3405: 0 | J3405: =RC[-1]/RC[-2] -> 0
A3406: 217 | B3406: 2 | C3406: Wednesday | D3406: 3 | E3406: 11am-12pm | F3406: 3 | G3406: 2 | H3406: 4 | I3406: 0 | J3406: =RC[-1]/RC[-2] -> 0
A3407: 217 | B3407: 2 | C3407: Wednesday | D3407: 3 | E3407: 12pm-1pm | F3407: 4 | G3407: 2 | H3407: 4 | I3407: 0 | J3407: =RC[-1]/RC[-2] -> 0
A3408: 217 | B3408: 2 | C3408: Wednesday | D3408: 3 | E3408: 1pm-2pm | F3408: 5 | G3408: 2 | H3408: 4 | I3408: 0 | J3408: =RC[-1]/RC[-2] -> 0
A3409: 217 | B3409: 2 | C3409: Wednesday | D3409: 3 | E3409: 2pm-3pm | F3409: 6 | G3409: 2 | H3409: 4 | I3409: 0 | J3409: =RC[-1]/RC[-2] -> 0
A3410: 217 | B3410: 2 | C3410: Wednesday | D3410: 3 | E3410: 3pm-4pm | F3410: 7 | G3410: 2 | H3410: 4 | I3410: 0 | J3410: =RC[-1]/RC[-2] -> 0
A3411: 217 | B3411: 2 | C3411: Wednesday | D3411: 3 | E3411: 4pm-5pm | F3411: 8 | G3411: 2 | H3411: 4 | I3411: 0 | J3411: =RC[-1]/RC[-2] -> 0
A3412: 217 | B3412: 2 | C3412: Thursday | D3412: 4 | E3412: 9am-10am | F3412: 1 | G3412: 2 | H3412: 4 | I3412: 0 | J3412: =RC[-1]/RC[-2] -> 0
A3413: 217 | B3413: 2 | C3413: Thursday | D3413: 4 | E3413: 10am-11am | F3413: 2 | G3413: 2 | H3413: 4 | I3413: 0 | J3413: =RC[-1]/RC[-2] -> 0
A3414: 217 | B3414: 2 | C3414: Thursday | D3414: 4 | E3414: 11am-12pm | F3414: 3 | G3414: 2 | H3414: 4 | I3414: 0 | J3414: =RC[-1]/RC[-2] -> 0
A3415: 217 | B3415: 2 | C3415: Thursday | D3415: 4 | E3415: 12pm-1pm | F3415: 4 | G3415: 2 | H3415: 4 | I3415: 0 | J3415: =RC[-1]/RC[-2] -> 0
A3416: 217 | B3416: 2 | C3416: Thursday | D3416: 4 | E3416: 1pm-2pm | F3416: 5 | G3416: 2 | H3416: 4 | I3416: 0 | J3416: =RC[-1]/RC[-2] -> 0
A3417: 217 | B3417: 2 | C3417: Thursday | D3417: 4 | E3417: 2pm-3pm | F3417: 6 | G3417: 2 | H3417: 4 | I3417: 0 | J3417: =RC[-1]/RC[-2] -> 0
A3418: 217 | B3418: 2 | C3418: Thursday | D3418: 4 | E3418: 3pm-4pm | F3418: 7 | G3418: 2 | H3418: 4 | I3418: 0 | J3418: =RC[-1]/RC[-2] -> 0
A3419: 217 | B3419: 2 | C3419: Thursday | D3419: 4 | E3419: 4pm-5pm | F3419: 8 | G3419: 2 | H3419: 4 | I3419: 0 | J3419: =RC[-1]/RC[-2] -> 0
A3420: 217 | B3420: 2 | C3420: Friday | D3420: 5 | E3420: 9am-10am | F3420: 1 | G3420: 2 | H3420: 4 | I3420: 0 | J3420: =RC[-1]/RC[-2] -> 0
A3421: 217 | B3421: 2 | C3421: Friday | D3421: 5 | E3421: 10am-11am | F3421: 2 | G3421: 2 | H3421: 4 | I3421: 0 | J3421: =RC[-1]/RC[-2] -> 0
A3422: 217 | B3422: 2 | C3422: Friday | D3422: 5 | E3422: 11am-12pm | F3422: 3 | G3422: 2 | H3422: 4 | I3422: 0 | J3422: =RC[-1]/RC[-2] -> 0
A3423: 217 | B3423: 2 | C3423: Friday | D3423: 5 | E3423: 12pm-1pm | F3423: 4 | G3423: 2 | H3423: 4 | I3423: 0 | J3423: =RC[-1]/RC[-2] -> 0
A3424: 217 | B3424: 2 | C3424: Friday | D3424: 5 | E3424: 1pm-2pm | F3424: 5 | G3424: 2 | H3424: 4 | I3424: 0 | J3424: =RC[-1]/RC[-2] -> 0
A3425: 217 | B3425: 2 | C3425: Friday | D3425: 5 | E3425: 2pm-3pm | F3425: 6 | G3425: 2 | H3425: 4 | I3425: 0 | J3425: =RC[-1]/RC[-2] -> 0
A3426: 217 | B3426: 2 | C3426: Friday | D3426: 5 | E3426: 3pm-4pm | F3426: 7 | G3426: 2 | H3426: 4 | I3426: 0 | J3426: =RC[-1]/RC[-2] -> 0
A3427: 217 | B3427: 2 | C3427: Friday | D3427: 5 | E3427: 4pm-5pm | F3427: 8 | G3427: 2 | H3427: 4 | I3427: 0 | J3427: =RC[-1]/RC[-2] -> 0
A3428: 217A | B3428: 2 | C3428: Monday | D3428: 1 | E3428: 9am-10am | F3428: 1 | G3428: 2 | H3428: 4 | I3428: 0 | J3428: =RC[-1]/RC[-2] -> 0
A3429: 217A | B3429: 2 | C3429: Monday | D3429: 1 | E3429: 10am-11am | F3429: 2 | G3429: 2 | H3429: 4 | I3429: 0 | J3429: =RC[-1]/RC[-2] -> 0
A3430: 217A | B3430: 2 | C3430: Monday | D3430: 1 | E3430: 11am-12pm | F3430: 3 | G3430: 2 | H3430: 4 | I3430: 0 | J3430: =RC[-1]/RC[-2] -> 0
A3431: 217A | B3431: 2 | C3431: Monday | D3431: 1 | E3431: 12pm-1pm | F3431: 4 | G3431: 2 | H3431: 4 | I3431: 0 | J3431: =RC[-1]/RC[-2] -> 0
A3432: 217A | B3432: 2 | C3432: Monday | D3432: 1 | E3432: 1pm-2pm | F3432: 5 | G3432: 2 | H3432: 4 | I3432: 0 | J3432: =RC[-1]/RC[-2] -> 0
A3433: 217A | B3433: 2 | C3433: Monday | D3433: 1 | E3433: 2pm-3pm | F3433: 6 | G3433: 2 | H3433: 4 | I3433: 0 | J3433: =RC[-1]/RC[-2] -> 0
A3434: 217A | B3434: 2 | C3434: Monday | D3434: 1 | E3434: 3pm-4pm | F3434: 7 | G3434: 2 | H3434: 4 | I3434: 0 | J3434: =RC[-1]/RC[-2] -> 0
A3435: 217A | B3435: 2 | C3435: Monday | D3435: 1 | E3435: 4pm-5pm | F3435: 8 | G3435: 2 | H3435: 4 | I3435: 0 | J3435: =RC[-1]/RC[-2] -> 0
A3436: 217A | B3436: 2 | C3436: Tuesday | D3436: 2 | E3436: 9am-10am | F3436: 1 | G3436: 2 | H3436: 4 | I3436: 0 | J3436: =RC[-1]/RC[-2] -> 0
A3437: 217A | B3437: 2 | C3437: Tuesday | D3437: 2 | E3437: 10am-11am | F3437: 2 | G3437: 2 | H3437: 4 | I3437: 0 | J3437: =RC[-1]/RC[-2] -> 0
A3438: 217A | B3438: 2 | C3438: Tuesday | D3438: 2 | E3438: 11am-12pm | F3438: 3 | G3438: 2 | H3438: 4 | I3438: 0 | J3438: =RC[-1]/RC[-2] -> 0
A3439: 217A | B3439: 2 | C3439: Tuesday | D3439: 2 | E3439: 12pm-1pm | F3439: 4 | G3439: 2 | H3439: 4 | I3439: 0 | J3439: =RC[-1]/RC[-2] -> 0
A3440: 217A | B3440: 2 | C3440: Tuesday | D3440: 2 | E3440: 1pm-2pm | F3440: 5 | G3440: 1 | H3440: 4 | I3440: 1 | J3440: =RC[-1]/RC[-2] -> 0.25
A3441: 217A | B3441: 2 | C3441: Tuesday | D3441: 2 | E3441: 2pm-3pm | F3441: 6 | G3441: 2 | H3441: 4 | I3441: 0 | J3441: =RC[-1]/RC[-2] -> 0
A3442: 217A | B3442: 2 | C3442: Tuesday | D3442: 2 | E3442: 3pm-4pm | F3442: 7 | G3442: 2 | H3442: 4 | I3442: 0 | J3442: =RC[-1]/RC[-2] -> 0
A3443: 217A | B3443: 2 | C3443: Tuesday | D3443: 2 | E3443: 4pm-5pm | F3443: 8 | G3443: 2 | H3443: 4 | I3443: 0 | J3443: =RC[-1]/RC[-2] -> 0
A3444: 217A | B3444: 2 | C3444: Wednesday | D3444: 3 | E3444: 9am-10am | F3444: 1 | G3444: 2 | H3444: 4 | I3444: 0 | J3444: =RC[-1]/RC[-2] -> 0
A3445: 217A | B3445: 2 | C3445: Wednesday | D3445: 3 | E3445: 10am-11am | F3445: 2 | G3445: 2 | H3445: 4 | I3445: 0 | J3445: =RC[-1]/RC[-2] -> 0
A3446: 217A | B3446: 2 | C3446: Wednesday | D3446: 3 | E3446: 11am-12pm | F3446: 3 | G3446: 2 | H3446: 4 | I3446: 0 | J3446: =RC[-1]/RC[-2] -> 0
A3447: 217A | B3447: 2 | C3447: Wednesday | D3447: 3 | E3447: 12pm-1pm | F3447: 4 | G3447: 2 | H3447: 4 | I3447: 0 | J3447: =RC[-1]/RC[-2] -> 0
A3448: 217A | B3448: 2 | C3448: Wednesday | D3448: 3 | E3448: 1pm-2pm | F3448: 5 | G3448: 2 | H3448: 4 | I3448: 0 | J3448: =RC[-1]/RC[-2] -> 0
A3449: 217A | B3449: 2 | C3449: Wednesday | D3449: 3 | E3449: 2pm-3pm | F3449: 6 | G3449: 2 | H3449: 4 | I3449: 0 | J3449: =RC[-1]/RC[-2] -> 0
A3450: 217A | B3450: 2 | C3450: Wednesday | D3450: 3 | E3450: 3pm-4pm | F3450: 7 | G3450: 2 | H3450: 4 | I3450: 0 | J3450: =RC[-1]/RC[-2] -> 0
A3451: 217A | B3451: 2 | C3451: Wednesday | D3451: 3 | E3451: 4pm-5pm | F3451: 8 | G3451: 2 | H3451: 4 | I3451: 0 | J3451: =RC[-1]/RC[-2] -> 0
A3452: 217A | B3452: 2 | C3452: Thursday | D3452: 4 | E3452: 9am-10am | F3452: 1 | G3452: 2 | H3452: 4 | I3452: 0 | J3452: =RC[-1]/RC[-2] -> 0
A3453: 217A | B3453: 2 | C3453: Thursday | D3453: 4 | E3453: 10am-11am | F3453: 2 | G3453: 2 | H3453: 4 | I3453: 0 | J3453: =RC[-1]/RC[-2] -> 0
A3454: 217A | B3454: 2 | C3454: Thursday | D3454: 4 | E3454: 11am-12pm | F3454: 3 | G3454: 2 | H3454: 4 | I3454: 0 | J3454: =RC[-1]/RC[-2] -> 0
A3455: 217A | B3455: 2 | C3455: Thursday | D3455: 4 | E3455: 12pm-1pm | F3455: 4 | G3455: 2 | H3455: 4 | I3455: 0 | J3455: =RC[-1]/RC[-2] -> 0
A3456: 217A | B3456: 2 | C3456: Thursday | D3456: 4 | E3456: 1pm-2pm | F3456: 5 | G3456: 2 | H3456: 4 | I3456: 0 | J3456: =RC[-1]/RC[-2] -> 0
A3457: 217A | B3457: 2 | C3457: Thursday | D3457: 4 | E3457: 2pm-3pm | F3457: 6 | G3457: 2 | H3457: 4 | I3457: 0 | J3457: =RC[-1]/RC[-2] -> 0
A3458: 217A | B3458: 2 | C3458: Thursday | D3458: 4 | E3458: 3pm-4pm | F3458: 7 | G3458: 2 | H3458: 4 | I3458: 0 | J3458: =RC[-1]/RC[-2] -> 0
A3459: 217A | B3459: 2 | C3459: Thursday | D3459: 4 | E3459: 4pm-5pm | F3459: 8 | G3459: 2 | H3459: 4 | I3459: 0 | J3459: =RC[-1]/RC[-2] -> 0
A3460: 217A | B3460: 2 | C3460: Friday | D3460: 5 | E3460: 9am-10am | F3460: 1 | G3460: 2 | H3460: 4 | I3460: 0 | J3460: =RC[-1]/RC[-2] -> 0
A3461: 217A | B3461: 2 | C3461: Friday | D3461: 5 | E3461: 10am-11am | F3461: 2 | G3461: 2 | H3461: 4 | I3461: 0 | J3461: =RC[-1]/RC[-2] -> 0
A3462: 217A | B3462: 2 | C3462: Friday | D3462: 5 | E3462: 11am-12pm | F3462: 3 | G3462: 2 | H3462: 4 | I3462: 0 | J3462: =RC[-1]/RC[-2] -> 0
A3463: 217A | B3463: 2 | C3463: Friday | D3463: 5 | E3463: 12pm-1pm | F3463: 4 | G3463: 2 | H3463: 4 | I3463: 0 | J3463: =RC[-1]/RC[-2] -> 0
A3464: 217A | B3464: 2 | C3464: Friday | D3464: 5 | E3464: 1pm-2pm | F3464: 5 | G3464: 2 | H3464: 4 | I3464: 0 | J3464: =RC[-1]/RC[-2] -> 0
A3465: 217A | B3465: 2 | C3465: Friday | D3465: 5 | E3465: 2pm-3pm | F3465: 6 | G3465: 2 | H3465: 4 | I3465: 0 | J3465: =RC[-1]/RC[-2] -> 0
A3466: 217A | B3466: 2 | C3466: Friday | D3466: 5 | E3466: 3pm-4pm | F3466: 7 | G3466: 2 | H3466: 4 | I3466: 0 | J3466: =RC[-1]/RC[-2] -> 0
A3467: 217A | B3467: 2 | C3467: Friday | D3467: 5 | E3467: 4pm-5pm | F3467: 8 | G3467: 2 | H3467: 4 | I3467: 0 | J3467: =RC[-1]/RC[-2] -> 0
A3468: 219 | B3468: 2 | C3468: Monday | D3468: 1 | E3468: 9am-10am | F3468: 1 | G3468: 1 | H3468: 34 | I3468: 24 | J3468: =RC[-1]/RC[-2] -> 0.70588235294117652
A3469: 219 | B3469: 2 | C3469: Monday | D3469: 1 | E3469: 10am-11am | F3469: 2 | G3469: 1 | H3469: 34 | I3469: 30 | J3469: =RC[-1]/RC[-2] -> 0.88235294117647056
A3470: 219 | B3470: 2 | C3470: Monday | D3470: 1 | E3470: 11am-12pm | F3470: 3 | G3470: 1 | H3470: 34 | I3470: 30 | J3470: =RC[-1]/RC[-2] -> 0.88235294117647056
A3471: 219 | B3471: 2 | C3471: Monday | D3471: 1 | E3471: 12pm-1pm | F3471: 4 | G3471: 2 | H3471: 34 | I3471: 0 | J3471: =RC[-1]/RC[-2] -> 0
A3472: 219 | B3472: 2 | C3472: Monday | D3472: 1 | E3472: 1pm-2pm | F3472: 5 | G3472: 2 | H3472: 34 | I3472: 0 | J3472: =RC[-1]/RC[-2] -> 0
A3473: 219 | B3473: 2 | C3473: Monday | D3473: 1 | E3473: 2pm-3pm | F3473: 6 | G3473: 2 | H3473: 34 | I3473: 0 | J3473: =RC[-1]/RC[-2] -> 0
A3474: 219 | B3474: 2 | C3474: Monday | D3474: 1 | E3474: 3pm-4pm | F3474: 7 | G3474: 2 | H3474: 34 | I3474: 0 | J3474: =RC[-1]/RC[-2] -> 0
A3475: 219 | B3475: 2 | C3475: Monday | D3475: 1 | E3475: 4pm-5pm | F3475: 8 | G3475: 2 | H3475: 34 | I3475: 0 | J3475: =RC[-1]/RC[-2] -> 0
A3476: 219 | B3476: 2 | C3476: Tuesday | D3476: 2 | E3476: 9am-10am | F3476: 1 | G3476: 1 | H3476: 34 | I3476: 15 | J3476: =RC[-1]/RC[-2] -> 0.44117647058823528
A3477: 219 | B3477: 2 | C3477: Tuesday | D3477: 2 | E3477: 10am-11am | F3477: 2 | G3477: 1 | H3477: 34 | I3477: 20 | J3477: =RC[-1]/RC[-2] -> 0.58823529411764708
A3478: 219 | B3478: 2 | C3478: Tuesday | D3478: 2 | E3478: 11am-12pm | F3478: 3 | G3478: 1 | H3478: 34 | I3478: 20 | J3478: =RC[-1]/RC[-2] -> 0.58823529411764708
A3479: 219 | B3479: 2 | C3479: Tuesday | D3479: 2 | E3479: 12pm-1pm | F3479: 4 | G3479: 2 | H3479: 34 | I3479: 0 | J3479: =RC[-1]/RC[-2] -> 0
A3480: 219 | B3480: 2 | C3480: Tuesday | D3480: 2 | E3480: 1pm-2pm | F3480: 5 | G3480: 2 | H3480: 34 | I3480: 0 | J3480: =RC[-1]/RC[-2] -> 0
A3481: 219 | B3481: 2 | C3481: Tuesday | D3481: 2 | E3481: 2pm-3pm | F3481: 6 | G3481: 1 | H3481: 34 | I3481: 20 | J3481: =RC[-1]/RC[-2] -> 0.58823529411764708
A3482: 219 | B3482: 2 | C3482: Tuesday | D3482: 2 | E3482: 3pm-4pm | F3482: 7 | G3482: 1 | H3482: 34 | I3482: 25 | J3482: =RC[-1]/RC[-2] -> 0.73529411764705888
A3483: 219 | B3483: 2 | C3483: Tuesday | D3483: 2 | E3483: 4pm-5pm | F3483: 8 | G3483: 1 | H3483: 34 | I3483: 25 | J3483: =RC[-1]/RC[-2] -> 0.73529411764705888
A3484: 219 | B3484: 2 | C3484: Wednesday | D3484: 3 | E3484: 9am-10am | F3484: 1 | G3484: 1 | H3484: 34 | I3484: 20 | J3484: =RC[-1]/RC[-2] -> 0.58823529411764708
A3485: 219 | B3485: 2 | C3485: Wednesday | D3485: 3 | E3485: 10am-11am | F3485: 2 | G3485: 1 | H3485: 34 | I3485: 30 | J3485: =RC[-1]/RC[-2] -> 0.88235294117647056
A3486: 219 | B3486: 2 | C3486: Wednesday | D3486: 3 | E3486: 11am-12pm | F3486: 3 | G3486: 1 | H3486: 34 | I3486: 25 | J3486: =RC[-1]/RC[-2] -> 0.73529411764705888
A3487: 219 | B3487: 2 | C3487: Wednesday | D3487: 3 | E3487: 12pm-1pm | F3487: 4 | G3487: 1 | H3487: 34 | I3487: 5 | J3487: =RC[-1]/RC[-2] -> 0.14705882352941177
A3488: 219 | B3488: 2 | C3488: Wednesday | D3488: 3 | E3488: 1pm-2pm | F3488: 5 | G3488: 1 | H3488: 34 | I3488: 1 | J3488: =RC[-1]/RC[-2] -> 2.9411764705882353E-2
A3489: 219 | B3489: 2 | C3489: Wednesday | D3489: 3 | E3489: 2pm-3pm | F3489: 6 | G3489: 1 | H3489: 34 | I3489: 3 | J3489: =RC[-1]/RC[-2] -> 8.8235294117647065E-2
A3490: 219 | B3490: 2 | C3490: Wednesday | D3490: 3 | E3490: 3pm-4pm | F3490: 7 | G3490: 1 | H3490: 34 | I3490: 25 | J3490: =RC[-1]/RC[-2] -> 0.73529411764705888
A3491: 219 | B3491: 2 | C3491: Wednesday | D3491: 3 | E3491: 4pm-5pm | F3491: 8 | G3491: 1 | H3491: 34 | I3491: 19 | J3491: =RC[-1]/RC[-2] -> 0.55882352941176472
A3492: 219 | B3492: 2 | C3492: Thursday | D3492: 4 | E3492: 9am-10am | F3492: 1 | G3492: 3 | H3492: 34 | I3492: 1 | J3492: =RC[-1]/RC[-2] -> 2.9411764705882353E-2
A3493: 219 | B3493: 2 | C3493: Thursday | D3493: 4 | E3493: 10am-11am | F3493: 2 | G3493: 1 | H3493: 34 | I3493: 15 | J3493: =RC[-1]/RC[-2] -> 0.44117647058823528
A3494: 219 | B3494: 2 | C3494: Thursday | D3494: 4 | E3494: 11am-12pm | F3494: 3 | G3494: 1 | H3494: 34 | I3494: 6 | J3494: =RC[-1]/RC[-2] -> 0.17647058823529413
A3495: 219 | B3495: 2 | C3495: Thursday | D3495: 4 | E3495: 12pm-1pm | F3495: 4 | G3495: 1 | H3495: 34 | I3495: 1 | J3495: =RC[-1]/RC[-2] -> 2.9411764705882353E-2
A3496: 219 | B3496: 2 | C3496: Thursday | D3496: 4 | E3496: 1pm-2pm | F3496: 5 | G3496: 1 | H3496: 34 | I3496: 2 | J3496: =RC[-1]/RC[-2] -> 5.8823529411764705E-2
A3497: 219 | B3497: 2 | C3497: Thursday | D3497: 4 | E3497: 2pm-3pm | F3497: 6 | G3497: 2 | H3497: 34 | I3497: 0 | J3497: =RC[-1]/RC[-2] -> 0
A3498: 219 | B3498: 2 | C3498: Thursday | D3498: 4 | E3498: 3pm-4pm | F3498: 7 | G3498: 1 | H3498: 34 | I3498: 20 | J3498: =RC[-1]/RC[-2] -> 0.58823529411764708
A3499: 219 | B3499: 2 | C3499: Thursday | D3499: 4 | E3499: 4pm-5pm | F3499: 8 | G3499: 1 | H3499: 34 | I3499: 10 | J3499: =RC[-1]/RC[-2] -> 0.29411764705882354
A3500: 219 | B3500: 2 | C3500: Friday | D3500: 5 | E3500: 9am-10am | F3500: 1 | G3500: 2 | H3500: 34 | I3500: 0 | J3500: =RC[-1]/RC[-2] -> 0
A3501: 219 | B3501: 2 | C3501: Friday | D3501: 5 | E3501: 10am-11am | F3501: 2 | G3501: 2 | H3501: 34 | I3501: 0 | J3501: =RC[-1]/RC[-2] -> 0
A3502: 219 | B3502: 2 | C3502: Friday | D3502: 5 | E3502: 11am-12pm | F3502: 3 | G3502: 2 | H3502: 34 | I3502: 0 | J3502: =RC[-1]/RC[-2] -> 0
A3503: 219 | B3503: 2 | C3503: Friday | D3503: 5 | E3503: 12pm-1pm | F3503: 4 | G3503: 2 | H3503: 34 | I3503: 0 | J3503: =RC[-1]/RC[-2] -> 0
A3504: 219 | B3504: 2 | C3504: Friday | D3504: 5 | E3504: 1pm-2pm | F3504: 5 | G3504: 2 | H3504: 34 | I3504: 0 | J3504: =RC[-1]/RC[-2] -> 0
A3505: 219 | B3505: 2 | C3505: Friday | D3505: 5 | E3505: 2pm-3pm | F3505: 6 | G3505: 2 | H3505: 34 | I3505: 0 | J3505: =RC[-1]/RC[-2] -> 0
A3506: 219 | B3506: 2 | C3506: Friday | D3506: 5 | E3506: 3pm-4pm | F3506: 7 | G3506: 2 | H3506: 34 | I3506: 0 | J3506: =RC[-1]/RC[-2] -> 0
A3507: 219 | B3507: 2 | C3507: Friday | D3507: 5 | E3507: 4pm-5pm | F3507: 8 | G3507: 2 | H3507: 34 | I3507: 0 | J3507: =RC[-1]/RC[-2] -> 0
A3508: 220 | B3508: 2 | C3508: Monday | D3508: 1 | E3508: 9am-10am | F3508: 1 | G3508: 2 | H3508: 6 | I3508: 0 | J3508: =RC[-1]/RC[-2] -> 0
A3509: 220 | B3509: 2 | C3509: Monday | D3509: 1 | E3509: 10am-11am | F3509: 2 | G3509: 2 | H3509: 6 | I3509: 0 | J3509: =RC[-1]/RC[-2] -> 0
A3510: 220 | B3510: 2 | C3510: Monday | D3510: 1 | E3510: 11am-12pm | F3510: 3 | G3510: 2 | H3510: 6 | I3510: 0 | J3510: =RC[-1]/RC[-2] -> 0
A3511: 220 | B3511: 2 | C3511: Monday | D3511: 1 | E3511: 12pm-1pm | F3511: 4 | G3511: 2 | H3511: 6 | I3511: 0 | J3511: =RC[-1]/RC[-2] -> 0
A3512: 220 | B3512: 2 | C3512: Monday | D3512: 1 | E3512: 1pm-2pm | F3512: 5 | G3512: 2 | H3512: 6 | I3512: 0 | J3512: =RC[-1]/RC[-2] -> 0
A3513: 220 | B3513: 2 | C3513: Monday | D3513: 1 | E3513: 2pm-3pm | F3513: 6 | G3513: 2 | H3513: 6 | I3513: 0 | J3513: =RC[-1]/RC[-2] -> 0
A3514: 220 | B3514: 2 | C3514: Monday | D3514: 1 | E3514: 3pm-4pm | F3514: 7 | G3514: 2 | H3514: 6 | I3514: 0 | J3514: =RC[-1]/RC[-2] -> 0
A3515: 220 | B3515: 2 | C3515: Monday | D3515: 1 | E3515: 4pm-5pm | F3515: 8 | G3515: 2 | H3515: 6 | I3515: 0 | J3515: =RC[-1]/RC[-2] -> 0
A3516: 220 | B3516: 2 | C3516: Tuesday | D3516: 2 | E3516: 9am-10am | F3516: 1 | G3516: 2 | H3516: 6 | I3516: 0 | J3516: =RC[-1]/RC[-2] -> 0
A3517: 220 | B3517: 2 | C3517: Tuesday | D3517: 2 | E3517: 10am-11am | F3517: 2 | G3517: 2 | H3517: 6 | I3517: 0 | J3517: =RC[-1]/RC[-2] -> 0
A3518: 220 | B3518: 2 | C3518: Tuesday | D3518: 2 | E3518: 11am-12pm | F3518: 3 | G3518: 2 | H3518: 6 | I3518: 0 | J3518: =RC[-1]/RC[-2] -> 0
A3519: 220 | B3519: 2 | C3519: Tuesday | D3519: 2 | E3519: 12pm-1pm | F3519: 4 | G3519: 2 | H3519: 6 | I3519: 0 | J3519: =RC[-1]/RC[-2] -> 0
A3520: 220 | B3520: 2 | C3520: Tuesday | D3520: 2 | E3520: 1pm-2pm | F3520: 5 | G3520: 2 | H3520: 6 | I3520: 0 | J3520: =RC[-1]/RC[-2] -> 0
A3521: 220 | B3521: 2 | C3521: Tuesday | D3521: 2 | E3521: 2pm-3pm | F3521: 6 | G3521: 2 | H3521: 6 | I3521: 0 | J3521: =RC[-1]/RC[-2] -> 0
A3522: 220 | B3522: 2 | C3522: Tuesday | D3522: 2 | E3522: 3pm-4pm | F3522: 7 | G3522: 2 | H3522: 6 | I3522: 0 | J3522: =RC[-1]/RC[-2] -> 0
A3523: 220 | B3523: 2 | C3523: Tuesday | D3523: 2 | E3523: 4pm-5pm | F3523: 8 | G3523: 2 | H3523: 6 | I3523: 0 | J3523: =RC[-1]/RC[-2] -> 0
A3524: 220 | B3524: 2 | C3524: Wednesday | D3524: 3 | E3524: 9am-10am | F3524: 1 | G3524: 2 | H3524: 6 | I3524: 0 | J3524: =RC[-1]/RC[-2] -> 0
A3525: 220 | B3525: 2 | C3525: Wednesday | D3525: 3 | E3525: 10am-11am | F3525: 2 | G3525: 2 | H3525: 6 | I3525: 0 | J3525: =RC[-1]/RC[-2] -> 0
A3526: 220 | B3526: 2 | C3526: Wednesday | D3526: 3 | E3526: 11am-12pm | F3526: 3 | G3526: 2 | H3526: 6 | I3526: 0 | J3526: =RC[-1]/RC[-2] -> 0
A3527: 220 | B3527: 2 | C3527: Wednesday | D3527: 3 | E3527: 12pm-1pm | F3527: 4 | G3527: 2 | H3527: 6 | I3527: 0 | J3527: =RC[-1]/RC[-2] -> 0
A3528: 220 | B3528: 2 | C3528: Wednesday | D3528: 3 | E3528: 1pm-2pm | F3528: 5 | G3528: 2 | H3528: 6 | I3528: 0 | J3528: =RC[-1]/RC[-2] -> 0
A3529: 220 | B3529: 2 | C3529: Wednesday | D3529: 3 | E3529: 2pm-3pm | F3529: 6 | G3529: 2 | H3529: 6 | I3529: 0 | J3529: =RC[-1]/RC[-2] -> 0
A3530: 220 | B3530: 2 | C3530: Wednesday | D3530: 3 | E3530: 3pm-4pm | F3530: 7 | G3530: 2 | H3530: 6 | I3530: 0 | J3530: =RC[-1]/RC[-2] -> 0
A3531: 220 | B3531: 2 | C3531: Wednesday | D3531: 3 | E3531: 4pm-5pm | F3531: 8 | G3531: 2 | H3531: 6 | I3531: 0 | J3531: =RC[-1]/RC[-2] -> 0
A3532: 220 | B3532: 2 | C3532: Thursday | D3532: 4 | E3532: 9am-10am | F3532: 1 | G3532: 2 | H3532: 6 | I3532: 0 | J3532: =RC[-1]/RC[-2] -> 0
A3533: 220 | B3533: 2 | C3533: Thursday | D3533: 4 | E3533: 10am-11am | F3533: 2 | G3533: 2 | H3533: 6 | I3533: 0 | J3533: =RC[-1]/RC[-2] -> 0
A3534: 220 | B3534: 2 | C3534: Thursday | D3534: 4 | E3534: 11am-12pm | F3534: 3 | G3534: 2 | H3534: 6 | I3534: 0 | J3534: =RC[-1]/RC[-2] -> 0
A3535: 220 | B3535: 2 | C3535: Thursday | D3535: 4 | E3535: 12pm-1pm | F3535: 4 | G3535: 2 | H3535: 6 | I3535: 0 | J3535: =RC[-1]/RC[-2] -> 0
A3536: 220 | B3536: 2 | C3536: Thursday | D3536: 4 | E3536: 1pm-2pm | F3536: 5 | G3536: 2 | H3536: 6 | I3536: 0 | J3536: =RC[-1]/RC[-2] -> 0
A3537: 220 | B3537: 2 | C3537: Thursday | D3537: 4 | E3537: 2pm-3pm | F3537: 6 | G3537: 2 | H3537: 6 | I3537: 0 | J3537: =RC[-1]/RC[-2] -> 0
A3538: 220 | B3538: 2 | C3538: Thursday | D3538: 4 | E3538: 3pm-4pm | F3538: 7 | G3538: 2 | H3538: 6 | I3538: 0 | J3538: =RC[-1]/RC[-2] -> 0
A3539: 220 | B3539: 2 | C3539: Thursday | D3539: 4 | E3539: 4pm-5pm | F3539: 8 | G3539: 2 | H3539: 6 | I3539: 0 | J3539: =RC[-1]/RC[-2] -> 0
A3540: 220 | B3540: 2 | C3540: Friday | D3540: 5 | E3540: 9am-10am | F3540: 1 | G3540: 2 | H3540: 6 | I3540: 0 | J3540: =RC[-1]/RC[-2] -> 0
A3541: 220 | B3541: 2 | C3541: Friday | D3541: 5 | E3541: 10am-11am | F3541: 2 | G3541: 2 | H3541: 6 | I3541: 0 | J3541: =RC[-1]/RC[-2] -> 0
A3542: 220 | B3542: 2 | C3542: Friday | D3542: 5 | E3542: 11am-12pm | F3542: 3 | G3542: 2 | H3542: 6 | I3542: 0 | J3542: =RC[-1]/RC[-2] -> 0
A3543: 220 | B3543: 2 | C3543: Friday | D3543: 5 | E3543: 12pm-1pm | F3543: 4 | G3543: 2 | H3543: 6 | I3543: 0 | J3543: =RC[-1]/RC[-2] -> 0
A3544: 220 | B3544: 2 | C3544: Friday | D3544: 5 | E3544: 1pm-2pm | F3544: 5 | G3544: 2 | H3544: 6 | I3544: 0 | J3544: =RC[-1]/RC[-2] -> 0
A3545: 220 | B3545: 2 | C3545: Friday | D3545: 5 | E3545: 2pm-3pm | F3545: 6 | G3545: 2 | H3545: 6 | I3545: 0 | J3545: =RC[-1]/RC[-2] -> 0
A3546: 220 | B3546: 2 | C3546: Friday | D3546: 5 | E3546: 3pm-4pm | F3546: 7 | G3546: 2 | H3546: 6 | I3546: 0 | J3546: =RC[-1]/RC[-2] -> 0
A3547: 220 | B3547: 2 | C3547: Friday | D3547: 5 | E3547: 4pm-5pm | F3547: 8 | G3547: 2 | H3547: 6 | I3547: 0 | J3547: =RC[-1]/RC[-2] -> 0
A3548: 232 | B3548: 2 | C3548: Monday | D3548: 1 | E3548: 9am-10am | F3548: 1 | G3548: 2 | H3548: 4 | I3548: 0 | J3548: =RC[-1]/RC[-2] -> 0
A3549: 232 | B3549: 2 | C3549: Monday | D3549: 1 | E3549: 10am-11am | F3549: 2 | G3549: 2 | H3549: 4 | I3549: 0 | J3549: =RC[-1]/RC[-2] -> 0
A3550: 232 | B3550: 2 | C3550: Monday | D3550: 1 | E3550: 11am-12pm | F3550: 3 | G3550: 2 | H3550: 4 | I3550: 0 | J3550: =RC[-1]/RC[-2] -> 0
A3551: 232 | B3551: 2 | C3551: Monday | D3551: 1 | E3551: 12pm-1pm | F3551: 4 | G3551: 2 | H3551: 4 | I3551: 0 | J3551: =RC[-1]/RC[-2] -> 0
A3552: 232 | B3552: 2 | C3552: Monday | D3552: 1 | E3552: 1pm-2pm | F3552: 5 | G3552: 2 | H3552: 4 | I3552: 0 | J3552: =RC[-1]/RC[-2] -> 0
A3553: 232 | B3553: 2 | C3553: Monday | D3553: 1 | E3553: 2pm-3pm | F3553: 6 | G3553: 2 | H3553: 4 | I3553: 0 | J3553: =RC[-1]/RC[-2] -> 0
A3554: 232 | B3554: 2 | C3554: Monday | D3554: 1 | E3554: 3pm-4pm | F3554: 7 | G3554: 2 | H3554: 4 | I3554: 0 | J3554: =RC[-1]/RC[-2] -> 0
A3555: 232 | B3555: 2 | C3555: Monday | D3555: 1 | E3555: 4pm-5pm | F3555: 8 | G3555: 2 | H3555: 4 | I3555: 0 | J3555: =RC[-1]/RC[-2] -> 0
A3556: 232 | B3556: 2 | C3556: Tuesday | D3556: 2 | E3556: 9am-10am | F3556: 1 | G3556: 2 | H3556: 4 | I3556: 0 | J3556: =RC[-1]/RC[-2] -> 0
A3557: 232 | B3557: 2 | C3557: Tuesday | D3557: 2 | E3557: 10am-11am | F3557: 2 | G3557: 2 | H3557: 4 | I3557: 0 | J3557: =RC[-1]/RC[-2] -> 0
A3558: 232 | B3558: 2 | C3558: Tuesday | D3558: 2 | E3558: 11am-12pm | F3558: 3 | G3558: 3 | H3558: 4 | I3558: 1 | J3558: =RC[-1]/RC[-2] -> 0.25
A3559: 232 | B3559: 2 | C3559: Tuesday | D3559: 2 | E3559: 12pm-1pm | F3559: 4 | G3559: 2 | H3559: 4 | I3559: 0 | J3559: =RC[-1]/RC[-2] -> 0
A3560: 232 | B3560: 2 | C3560: Tuesday | D3560: 2 | E3560: 1pm-2pm | F3560: 5 | G3560: 2 | H3560: 4 | I3560: 0 | J3560: =RC[-1]/RC[-2] -> 0
A3561: 232 | B3561: 2 | C3561: Tuesday | D3561: 2 | E3561: 2pm-3pm | F3561: 6 | G3561: 2 | H3561: 4 | I3561: 0 | J3561: =RC[-1]/RC[-2] -> 0
A3562: 232 | B3562: 2 | C3562: Tuesday | D3562: 2 | E3562: 3pm-4pm | F3562: 7 | G3562: 2 | H3562: 4 | I3562: 0 | J3562: =RC[-1]/RC[-2] -> 0
A3563: 232 | B3563: 2 | C3563: Tuesday | D3563: 2 | E3563: 4pm-5pm | F3563: 8 | G3563: 2 | H3563: 4 | I3563: 0 | J3563: =RC[-1]/RC[-2] -> 0
A3564: 232 | B3564: 2 | C3564: Wednesday | D3564: 3 | E3564: 9am-10am | F3564: 1 | G3564: 2 | H3564: 4 | I3564: 0 | J3564: =RC[-1]/RC[-2] -> 0
A3565: 232 | B3565: 2 | C3565: Wednesday | D3565: 3 | E3565: 10am-11am | F3565: 2 | G3565: 2 | H3565: 4 | I3565: 0 | J3565: =RC[-1]/RC[-2] -> 0
A3566: 232 | B3566: 2 | C3566: Wednesday | D3566: 3 | E3566: 11am-12pm | F3566: 3 | G3566: 2 | H3566: 4 | I3566: 0 | J3566: =RC[-1]/RC[-2] -> 0
A3567: 232 | B3567: 2 | C3567: Wednesday | D3567: 3 | E3567: 12pm-1pm | F3567: 4 | G3567: 2 | H3567: 4 | I3567: 0 | J3567: =RC[-1]/RC[-2] -> 0
A3568: 232 | B3568: 2 | C3568: Wednesday | D3568: 3 | E3568: 1pm-2pm | F3568: 5 | G3568: 2 | H3568: 4 | I3568: 0 | J3568: =RC[-1]/RC[-2] -> 0
A3569: 232 | B3569: 2 | C3569: Wednesday | D3569: 3 | E3569: 2pm-3pm | F3569: 6 | G3569: 2 | H3569: 4 | I3569: 0 | J3569: =RC[-1]/RC[-2] -> 0
A3570: 232 | B3570: 2 | C3570: Wednesday | D3570: 3 | E3570: 3pm-4pm | F3570: 7 | G3570: 2 | H3570: 4 | I3570: 0 | J3570: =RC[-1]/RC[-2] -> 0
A3571: 232 | B3571: 2 | C3571: Wednesday | D3571: 3 | E3571: 4pm-5pm | F3571: 8 | G3571: 2 | H3571: 4 | I3571: 0 | J3571: =RC[-1]/RC[-2] -> 0
A3572: 232 | B3572: 2 | C3572: Thursday | D3572: 4 | E3572: 9am-10am | F3572: 1 | G3572: 2 | H3572: 4 | I3572: 0 | J3572: =RC[-1]/RC[-2] -> 0
A3573: 232 | B3573: 2 | C3573: Thursday | D3573: 4 | E3573: 10am-11am | F3573: 2 | G3573: 1 | H3573: 4 | I3573: 12 | J3573: =RC[-1]/RC[-2] -> 3
A3574: 232 | B3574: 2 | C3574: Thursday | D3574: 4 | E3574: 11am-12pm | F3574: 3 | G3574: 2 | H3574: 4 | I3574: 0 | J3574: =RC[-1]/RC[-2] -> 0
A3575: 232 | B3575: 2 | C3575: Thursday | D3575: 4 | E3575: 12pm-1pm | F3575: 4 | G3575: 2 | H3575: 4 | I3575: 0 | J3575: =RC[-1]/RC[-2] -> 0
A3576: 232 | B3576: 2 | C3576: Thursday | D3576: 4 | E3576: 1pm-2pm | F3576: 5 | G3576: 2 | H3576: 4 | I3576: 0 | J3576: =RC[-1]/RC[-2] -> 0
A3577: 232 | B3577: 2 | C3577: Thursday | D3577: 4 | E3577: 2pm-3pm | F3577: 6 | G3577: 2 | H3577: 4 | I3577: 0 | J3577: =RC[-1]/RC[-2] -> 0
A3578: 232 | B3578: 2 | C3578: Thursday | D3578: 4 | E3578: 3pm-4pm | F3578: 7 | G3578: 2 | H3578: 4 | I3578: 0 | J3578: =RC[-1]/RC[-2] -> 0
A3579: 232 | B3579: 2 | C3579: Thursday | D3579: 4 | E3579: 4pm-5pm | F3579: 8 | G3579: 2 | H3579: 4 | I3579: 0 | J3579: =RC[-1]/RC[-2] -> 0
A3580: 232 | B3580: 2 | C3580: Friday | D3580: 5 | E3580: 9am-10am | F3580: 1 | G3580: 2 | H3580: 4 | I3580: 0 | J3580: =RC[-1]/RC[-2] -> 0
A3581: 232 | B3581: 2 | C3581: Friday | D3581: 5 | E3581: 10am-11am | F3581: 2 | G3581: 2 | H3581: 4 | I3581: 0 | J3581: =RC[-1]/RC[-2] -> 0
A3582: 232 | B3582: 2 | C3582: Friday | D3582: 5 | E3582: 11am-12pm | F3582: 3 | G3582: 2 | H3582: 4 | I3582: 0 | J3582: =RC[-1]/RC[-2] -> 0
A3583: 232 | B3583: 2 | C3583: Friday | D3583: 5 | E3583: 12pm-1pm | F3583: 4 | G3583: 2 | H3583: 4 | I3583: 0 | J3583: =RC[-1]/RC[-2] -> 0
A3584: 232 | B3584: 2 | C3584: Friday | D3584: 5 | E3584: 1pm-2pm | F3584: 5 | G3584: 1 | H3584: 4 | I3584: 1 | J3584: =RC[-1]/RC[-2] -> 0.25
A3585: 232 | B3585: 2 | C3585: Friday | D3585: 5 | E3585: 2pm-3pm | F3585: 6 | G3585: 1 | H3585: 4 | I3585: 1 | J3585: =RC[-1]/RC[-2] -> 0.25
A3586: 232 | B3586: 2 | C3586: Friday | D3586: 5 | E3586: 3pm-4pm | F3586: 7 | G3586: 2 | H3586: 4 | I3586: 0 | J3586: =RC[-1]/RC[-2] -> 0
A3587: 232 | B3587: 2 | C3587: Friday | D3587: 5 | E3587: 4pm-5pm | F3587: 8 | G3587: 2 | H3587: 4 | I3587: 0 | J3587: =RC[-1]/RC[-2] -> 0
A3588: 233 | B3588: 2 | C3588: Monday | D3588: 1 | E3588: 9am-10am | F3588: 1 | G3588: 3 | H3588: 4 | I3588: 1 | J3588: =RC[-1]/RC[-2] -> 0.25
A3589: 233 | B3589: 2 | C3589: Monday | D3589: 1 | E3589: 10am-11am | F3589: 2 | G3589: 2 | H3589: 4 | I3589: 0 | J3589: =RC[-1]/RC[-2] -> 0
A3590: 233 | B3590: 2 | C3590: Monday | D3590: 1 | E3590: 11am-12pm | F3590: 3 | G3590: 2 | H3590: 4 | I3590: 0 | J3590: =RC[-1]/RC[-2] -> 0
A3591: 233 | B3591: 2 | C3591: Monday | D3591: 1 | E3591: 12pm-1pm | F3591: 4 | G3591: 2 | H3591: 4 | I3591: 0 | J3591: =RC[-1]/RC[-2] -> 0
A3592: 233 | B3592: 2 | C3592: Monday | D3592: 1 | E3592: 1pm-2pm | F3592: 5 | G3592: 2 | H3592: 4 | I3592: 0 | J3592: =RC[-1]/RC[-2] -> 0
A3593: 233 | B3593: 2 | C3593: Monday | D3593: 1 | E3593: 2pm-3pm | F3593: 6 | G3593: 2 | H3593: 4 | I3593: 0 | J3593: =RC[-1]/RC[-2] -> 0
A3594: 233 | B3594: 2 | C3594: Monday | D3594: 1 | E3594: 3pm-4pm | F3594: 7 | G3594: 2 | H3594: 4 | I3594: 0 | J3594: =RC[-1]/RC[-2] -> 0
A3595: 233 | B3595: 2 | C3595: Monday | D3595: 1 | E3595: 4pm-5pm | F3595: 8 | G3595: 2 | H3595: 4 | I3595: 0 | J3595: =RC[-1]/RC[-2] -> 0
A3596: 233 | B3596: 2 | C3596: Tuesday | D3596: 2 | E3596: 9am-10am | F3596: 1 | G3596: 1 | H3596: 4 | I3596: 13 | J3596: =RC[-1]/RC[-2] -> 3.25
A3597: 233 | B3597: 2 | C3597: Tuesday | D3597: 2 | E3597: 10am-11am | F3597: 2 | G3597: 1 | H3597: 4 | I3597: 11 | J3597: =RC[-1]/RC[-2] -> 2.75
A3598: 233 | B3598: 2 | C3598: Tuesday | D3598: 2 | E3598: 11am-12pm | F3598: 3 | G3598: 1 | H3598: 4 | I3598: 13 | J3598: =RC[-1]/RC[-2] -> 3.25
A3599: 233 | B3599: 2 | C3599: Tuesday | D3599: 2 | E3599: 12pm-1pm | F3599: 4 | G3599: 2 | H3599: 4 | I3599: 0 | J3599: =RC[-1]/RC[-2] -> 0
A3600: 233 | B3600: 2 | C3600: Tuesday | D3600: 2 | E3600: 1pm-2pm | F3600: 5 | G3600: 2 | H3600: 4 | I3600: 0 | J3600: =RC[-1]/RC[-2] -> 0
A3601: 233 | B3601: 2 | C3601: Tuesday | D3601: 2 | E3601: 2pm-3pm | F3601: 6 | G3601: 1 | H3601: 4 | I3601: 1 | J3601: =RC[-1]/RC[-2] -> 0.25
A3602: 233 | B3602: 2 | C3602: Tuesday | D3602: 2 | E3602: 3pm-4pm | F3602: 7 | G3602: 2 | H3602: 4 | I3602: 0 | J3602: =RC[-1]/RC[-2] -> 0
A3603: 233 | B3603: 2 | C3603: Tuesday | D3603: 2 | E3603: 4pm-5pm | F3603: 8 | G3603: 2 | H3603: 4 | I3603: 0 | J3603: =RC[-1]/RC[-2] -> 0
A3604: 233 | B3604: 2 | C3604: Wednesday | D3604: 3 | E3604: 9am-10am | F3604: 1 | G3604: 3 | H3604: 4 | I3604: 1 | J3604: =RC[-1]/RC[-2] -> 0.25
A3605: 233 | B3605: 2 | C3605: Wednesday | D3605: 3 | E3605: 10am-11am | F3605: 2 | G3605: 2 | H3605: 4 | I3605: 0 | J3605: =RC[-1]/RC[-2] -> 0
A3606: 233 | B3606: 2 | C3606: Wednesday | D3606: 3 | E3606: 11am-12pm | F3606: 3 | G3606: 2 | H3606: 4 | I3606: 0 | J3606: =RC[-1]/RC[-2] -> 0
A3607: 233 | B3607: 2 | C3607: Wednesday | D3607: 3 | E3607: 12pm-1pm | F3607: 4 | G3607: 2 | H3607: 4 | I3607: 0 | J3607: =RC[-1]/RC[-2] -> 0
A3608: 233 | B3608: 2 | C3608: Wednesday | D3608: 3 | E3608: 1pm-2pm | F3608: 5 | G3608: 2 | H3608: 4 | I3608: 0 | J3608: =RC[-1]/RC[-2] -> 0
A3609: 233 | B3609: 2 | C3609: Wednesday | D3609: 3 | E3609: 2pm-3pm | F3609: 6 | G3609: 2 | H3609: 4 | I3609: 0 | J3609: =RC[-1]/RC[-2] -> 0
A3610: 233 | B3610: 2 | C3610: Wednesday | D3610: 3 | E3610: 3pm-4pm | F3610: 7 | G3610: 2 | H3610: 4 | I3610: 0 | J3610: =RC[-1]/RC[-2] -> 0
A3611: 233 | B3611: 2 | C3611: Wednesday | D3611: 3 | E3611: 4pm-5pm | F3611: 8 | G3611: 2 | H3611: 4 | I3611: 0 | J3611: =RC[-1]/RC[-2] -> 0
A3612: 233 | B3612: 2 | C3612: Thursday | D3612: 4 | E3612: 9am-10am | F3612: 1 | G3612: 2 | H3612: 4 | I3612: 0 | J3612: =RC[-1]/RC[-2] -> 0
A3613: 233 | B3613: 2 | C3613: Thursday | D3613: 4 | E3613: 10am-11am | F3613: 2 | G3613: 2 | H3613: 4 | I3613: 0 | J3613: =RC[-1]/RC[-2] -> 0
A3614: 233 | B3614: 2 | C3614: Thursday | D3614: 4 | E3614: 11am-12pm | F3614: 3 | G3614: 1 | H3614: 4 | I3614: 9 | J3614: =RC[-1]/RC[-2] -> 2.25
A3615: 233 | B3615: 2 | C3615: Thursday | D3615: 4 | E3615: 12pm-1pm | F3615: 4 | G3615: 1 | H3615: 4 | I3615: 3 | J3615: =RC[-1]/RC[-2] -> 0.75
A3616: 233 | B3616: 2 | C3616: Thursday | D3616: 4 | E3616: 1pm-2pm | F3616: 5 | G3616: 2 | H3616: 4 | I3616: 0 | J3616: =RC[-1]/RC[-2] -> 0
A3617: 233 | B3617: 2 | C3617: Thursday | D3617: 4 | E3617: 2pm-3pm | F3617: 6 | G3617: 2 | H3617: 4 | I3617: 0 | J3617: =RC[-1]/RC[-2] -> 0
A3618: 233 | B3618: 2 | C3618: Thursday | D3618: 4 | E3618: 3pm-4pm | F3618: 7 | G3618: 2 | H3618: 4 | I3618: 0 | J3618: =RC[-1]/RC[-2] -> 0
A3619: 233 | B3619: 2 | C3619: Thursday | D3619: 4 | E3619: 4pm-5pm | F3619: 8 | G3619: 2 | H3619: 4 | I3619: 0 | J3619: =RC[-1]/RC[-2] -> 0
A3620: 233 | B3620: 2 | C3620: Friday | D3620: 5 | E3620: 9am-10am | F3620: 1 | G3620: 2 | H3620: 4 | I3620: 0 | J3620: =RC[-1]/RC[-2] -> 0
A3621: 233 | B3621: 2 | C3621: Friday | D3621: 5 | E3621: 10am-11am | F3621: 2 | G3621: 2 | H3621: 4 | I3621: 0 | J3621: =RC[-1]/RC[-2] -> 0
A3622: 233 | B3622: 2 | C3622: Friday | D3622: 5 | E3622: 11am-12pm | F3622: 3 | G3622: 2 | H3622: 4 | I3622: 0 | J3622: =RC[-1]/RC[-2] -> 0
A3623: 233 | B3623: 2 | C3623: Friday | D3623: 5 | E3623: 12pm-1pm | F3623: 4 | G3623: 2 | H3623: 4 | I3623: 0 | J3623: =RC[-1]/RC[-2] -> 0
A3624: 233 | B3624: 2 | C3624: Friday | D3624: 5 | E3624: 1pm-2pm | F3624: 5 | G3624: 1 | H3624: 4 | I3624: 7 | J3624: =RC[-1]/RC[-2] -> 1.75
A3625: 233 | B3625: 2 | C3625: Friday | D3625: 5 | E3625: 2pm-3pm | F3625: 6 | G3625: 1 | H3625: 4 | I3625: 4 | J3625: =RC[-1]/RC[-2] -> 1
A3626: 233 | B3626: 2 | C3626: Friday | D3626: 5 | E3626: 3pm-4pm | F3626: 7 | G3626: 1 | H3626: 4 | I3626: 11 | J3626: =RC[-1]/RC[-2] -> 2.75
A3627: 233 | B3627: 2 | C3627: Friday | D3627: 5 | E3627: 4pm-5pm | F3627: 8 | G3627: 2 | H3627: 4 | I3627: 0 | J3627: =RC[-1]/RC[-2] -> 0
A3628: 234 | B3628: 2 | C3628: Monday | D3628: 1 | E3628: 9am-10am | F3628: 1 | G3628: 2 | H3628: 4 | I3628: 0 | J3628: =RC[-1]/RC[-2] -> 0
A3629: 234 | B3629: 2 | C3629: Monday | D3629: 1 | E3629: 10am-11am | F3629: 2 | G3629: 3 | H3629: 4 | I3629: 1 | J3629: =RC[-1]/RC[-2] -> 0.25
A3630: 234 | B3630: 2 | C3630: Monday | D3630: 1 | E3630: 11am-12pm | F3630: 3 | G3630: 2 | H3630: 4 | I3630: 0 | J3630: =RC[-1]/RC[-2] -> 0
A3631: 234 | B3631: 2 | C3631: Monday | D3631: 1 | E3631: 12pm-1pm | F3631: 4 | G3631: 2 | H3631: 4 | I3631: 0 | J3631: =RC[-1]/RC[-2] -> 0
A3632: 234 | B3632: 2 | C3632: Monday | D3632: 1 | E3632: 1pm-2pm | F3632: 5 | G3632: 2 | H3632: 4 | I3632: 0 | J3632: =RC[-1]/RC[-2] -> 0
A3633: 234 | B3633: 2 | C3633: Monday | D3633: 1 | E3633: 2pm-3pm | F3633: 6 | G3633: 3 | H3633: 4 | I3633: 1 | J3633: =RC[-1]/RC[-2] -> 0.25
A3634: 234 | B3634: 2 | C3634: Monday | D3634: 1 | E3634: 3pm-4pm | F3634: 7 | G3634: 3 | H3634: 4 | I3634: 1 | J3634: =RC[-1]/RC[-2] -> 0.25
A3635: 234 | B3635: 2 | C3635: Monday | D3635: 1 | E3635: 4pm-5pm | F3635: 8 | G3635: 2 | H3635: 4 | I3635: 0 | J3635: =RC[-1]/RC[-2] -> 0
A3636: 234 | B3636: 2 | C3636: Tuesday | D3636: 2 | E3636: 9am-10am | F3636: 1 | G3636: 1 | H3636: 4 | I3636: 2 | J3636: =RC[-1]/RC[-2] -> 0.5
A3637: 234 | B3637: 2 | C3637: Tuesday | D3637: 2 | E3637: 10am-11am | F3637: 2 | G3637: 2 | H3637: 4 | I3637: 0 | J3637: =RC[-1]/RC[-2] -> 0
A3638: 234 | B3638: 2 | C3638: Tuesday | D3638: 2 | E3638: 11am-12pm | F3638: 3 | G3638: 1 | H3638: 4 | I3638: 3 | J3638: =RC[-1]/RC[-2] -> 0.75
A3639: 234 | B3639: 2 | C3639: Tuesday | D3639: 2 | E3639: 12pm-1pm | F3639: 4 | G3639: 2 | H3639: 4 | I3639: 0 | J3639: =RC[-1]/RC[-2] -> 0
A3640: 234 | B3640: 2 | C3640: Tuesday | D3640: 2 | E3640: 1pm-2pm | F3640: 5 | G3640: 3 | H3640: 4 | I3640: 1 | J3640: =RC[-1]/RC[-2] -> 0.25
A3641: 234 | B3641: 2 | C3641: Tuesday | D3641: 2 | E3641: 2pm-3pm | F3641: 6 | G3641: 3 | H3641: 4 | I3641: 1 | J3641: =RC[-1]/RC[-2] -> 0.25
A3642: 234 | B3642: 2 | C3642: Tuesday | D3642: 2 | E3642: 3pm-4pm | F3642: 7 | G3642: 3 | H3642: 4 | I3642: 1 | J3642: =RC[-1]/RC[-2] -> 0.25
A3643: 234 | B3643: 2 | C3643: Tuesday | D3643: 2 | E3643: 4pm-5pm | F3643: 8 | G3643: 2 | H3643: 4 | I3643: 0 | J3643: =RC[-1]/RC[-2] -> 0
A3644: 234 | B3644: 2 | C3644: Wednesday | D3644: 3 | E3644: 9am-10am | F3644: 1 | G3644: 3 | H3644: 4 | I3644: 1 | J3644: =RC[-1]/RC[-2] -> 0.25
A3645: 234 | B3645: 2 | C3645: Wednesday | D3645: 3 | E3645: 10am-11am | F3645: 2 | G3645: 2 | H3645: 4 | I3645: 0 | J3645: =RC[-1]/RC[-2] -> 0
A3646: 234 | B3646: 2 | C3646: Wednesday | D3646: 3 | E3646: 11am-12pm | F3646: 3 | G3646: 3 | H3646: 4 | I3646: 1 | J3646: =RC[-1]/RC[-2] -> 0.25
A3647: 234 | B3647: 2 | C3647: Wednesday | D3647: 3 | E3647: 12pm-1pm | F3647: 4 | G3647: 2 | H3647: 4 | I3647: 0 | J3647: =RC[-1]/RC[-2] -> 0
A3648: 234 | B3648: 2 | C3648: Wednesday | D3648: 3 | E3648: 1pm-2pm | F3648: 5 | G3648: 2 | H3648: 4 | I3648: 0 | J3648: =RC[-1]/RC[-2] -> 0
A3649: 234 | B3649: 2 | C3649: Wednesday | D3649: 3 | E3649: 2pm-3pm | F3649: 6 | G3649: 2 | H3649: 4 | I3649: 0 | J3649: =RC[-1]/RC[-2] -> 0
A3650: 234 | B3650: 2 | C3650: Wednesday | D3650: 3 | E3650: 3pm-4pm | F3650: 7 | G3650: 2 | H3650: 4 | I3650: 0 | J3650: =RC[-1]/RC[-2] -> 0
A3651: 234 | B3651: 2 | C3651: Wednesday | D3651: 3 | E3651: 4pm-5pm | F3651: 8 | G3651: 2 | H3651: 4 | I3651: 0 | J3651: =RC[-1]/RC[-2] -> 0
A3652: 234 | B3652: 2 | C3652: Thursday | D3652: 4 | E3652: 9am-10am | F3652: 1 | G3652: 2 | H3652: 4 | I3652: 0 | J3652: =RC[-1]/RC[-2] -> 0
A3653: 234 | B3653: 2 | C3653: Thursday | D3653: 4 | E3653: 10am-11am | F3653: 2 | G3653: 1 | H3653: 4 | I3653: 11 | J3653: =RC[-1]/RC[-2] -> 2.75
A3654: 234 | B3654: 2 | C3654: Thursday | D3654: 4 | E3654: 11am-12pm | F3654: 3 | G3654: 1 | H3654: 4 | I3654: 4 | J3654: =RC[-1]/RC[-2] -> 1
A3655: 234 | B3655: 2 | C3655: Thursday | D3655: 4 | E3655: 12pm-1pm | F3655: 4 | G3655: 1 | H3655: 4 | I3655: 10 | J3655: =RC[-1]/RC[-2] -> 2.5
A3656: 234 | B3656: 2 | C3656: Thursday | D3656: 4 | E3656: 1pm-2pm | F3656: 5 | G3656: 1 | H3656: 4 | I3656: 2 | J3656: =RC[-1]/RC[-2] -> 0.5
A3657: 234 | B3657: 2 | C3657: Thursday | D3657: 4 | E3657: 2pm-3pm | F3657: 6 | G3657: 3 | H3657: 4 | I3657: 1 | J3657: =RC[-1]/RC[-2] -> 0.25
A3658: 234 | B3658: 2 | C3658: Thursday | D3658: 4 | E3658: 3pm-4pm | F3658: 7 | G3658: 2 | H3658: 4 | I3658: 0 | J3658: =RC[-1]/RC[-2] -> 0
A3659: 234 | B3659: 2 | C3659: Thursday | D3659: 4 | E3659: 4pm-5pm | F3659: 8 | G3659: 2 | H3659: 4 | I3659: 0 | J3659: =RC[-1]/RC[-2] -> 0
A3660: 234 | B3660: 2 | C3660: Friday | D3660: 5 | E3660: 9am-10am | F3660: 1 | G3660: 3 | H3660: 4 | I3660: 1 | J3660: =RC[-1]/RC[-2] -> 0.25
A3661: 234 | B3661: 2 | C3661: Friday | D3661: 5 | E3661: 10am-11am | F3661: 2 | G3661: 2 | H3661: 4 | I3661: 0 | J3661: =RC[-1]/RC[-2] -> 0
A3662: 234 | B3662: 2 | C3662: Friday | D3662: 5 | E3662: 11am-12pm | F3662: 3 | G3662: 2 | H3662: 4 | I3662: 0 | J3662: =RC[-1]/RC[-2] -> 0
A3663: 234 | B3663: 2 | C3663: Friday | D3663: 5 | E3663: 12pm-1pm | F3663: 4 | G3663: 2 | H3663: 4 | I3663: 0 | J3663: =RC[-1]/RC[-2] -> 0
A3664: 234 | B3664: 2 | C3664: Friday | D3664: 5 | E3664: 1pm-2pm | F3664: 5 | G3664: 1 | H3664: 4 | I3664: 3 | J3664: =RC[-1]/RC[-2] -> 0.75
A3665: 234 | B3665: 2 | C3665: Friday | D3665: 5 | E3665: 2pm-3pm | F3665: 6 | G3665: 1 | H3665: 4 | I3665: 7 | J3665: =RC[-1]/RC[-2] -> 1.75
A3666: 234 | B3666: 2 | C3666: Friday | D3666: 5 | E3666: 3pm-4pm | F3666: 7 | G3666: 2 | H3666: 4 | I3666: 0 | J3666: =RC[-1]/RC[-2] -> 0
A3667: 234 | B3667: 2 | C3667: Friday | D3667: 5 | E3667: 4pm-5pm | F3667: 8 | G3667: 2 | H3667: 4 | I3667: 0 | J3667: =RC[-1]/RC[-2] -> 0
A3668: 237 | B3668: 2 | C3668: Monday | D3668: 1 | E3668: 9am-10am | F3668: 1 | G3668: 2 | H3668: 44 | I3668: 0 | J3668: =RC[-1]/RC[-2] -> 0
A3669: 237 | B3669: 2 | C3669: Monday | D3669: 1 | E3669: 10am-11am | F3669: 2 | G3669: 2 | H3669: 44 | I3669: 0 | J3669: =RC[-1]/RC[-2] -> 0
A3670: 237 | B3670: 2 | C3670: Monday | D3670: 1 | E3670: 11am-12pm | F3670: 3 | G3670: 2 | H3670: 44 | I3670: 0 | J3670: =RC[-1]/RC[-2] -> 0
A3671: 237 | B3671: 2 | C3671: Monday | D3671: 1 | E3671: 12pm-1pm | F3671: 4 | G3671: 2 | H3671: 44 | I3671: 0 | J3671: =RC[-1]/RC[-2] -> 0
A3672: 237 | B3672: 2 | C3672: Monday | D3672: 1 | E3672: 1pm-2pm | F3672: 5 | G3672: 2 | H3672: 44 | I3672: 0 | J3672: =RC[-1]/RC[-2] -> 0
A3673: 237 | B3673: 2 | C3673: Monday | D3673: 1 | E3673: 2pm-3pm | F3673: 6 | G3673: 1 | H3673: 44 | I3673: 13 | J3673: =RC[-1]/RC[-2] -> 0.29545454545454547
A3674: 237 | B3674: 2 | C3674: Monday | D3674: 1 | E3674: 3pm-4pm | F3674: 7 | G3674: 1 | H3674: 44 | I3674: 12 | J3674: =RC[-1]/RC[-2] -> 0.27272727272727271
A3675: 237 | B3675: 2 | C3675: Monday | D3675: 1 | E3675: 4pm-5pm | F3675: 8 | G3675: 1 | H3675: 44 | I3675: 11 | J3675: =RC[-1]/RC[-2] -> 0.25
A3676: 237 | B3676: 2 | C3676: Tuesday | D3676: 2 | E3676: 9am-10am | F3676: 1 | G3676: 1 | H3676: 44 | I3676: 13 | J3676: =RC[-1]/RC[-2] -> 0.29545454545454547
A3677: 237 | B3677: 2 | C3677: Tuesday | D3677: 2 | E3677: 10am-11am | F3677: 2 | G3677: 1 | H3677: 44 | I3677: 13 | J3677: =RC[-1]/RC[-2] -> 0.29545454545454547
A3678: 237 | B3678: 2 | C3678: Tuesday | D3678: 2 | E3678: 11am-12pm | F3678: 3 | G3678: 1 | H3678: 44 | I3678: 15 | J3678: =RC[-1]/RC[-2] -> 0.34090909090909088
A3679: 237 | B3679: 2 | C3679: Tuesday | D3679: 2 | E3679: 12pm-1pm | F3679: 4 | G3679: 2 | H3679: 44 | I3679: 0 | J3679: =RC[-1]/RC[-2] -> 0
A3680: 237 | B3680: 2 | C3680: Tuesday | D3680: 2 | E3680: 1pm-2pm | F3680: 5 | G3680: 2 | H3680: 44 | I3680: 0 | J3680: =RC[-1]/RC[-2] -> 0
A3681: 237 | B3681: 2 | C3681: Tuesday | D3681: 2 | E3681: 2pm-3pm | F3681: 6 | G3681: 2 | H3681: 44 | I3681: 0 | J3681: =RC[-1]/RC[-2] -> 0
A3682: 237 | B3682: 2 | C3682: Tuesday | D3682: 2 | E3682: 3pm-4pm | F3682: 7 | G3682: 2 | H3682: 44 | I3682: 0 | J3682: =RC[-1]/RC[-2] -> 0
A3683: 237 | B3683: 2 | C3683: Tuesday | D3683: 2 | E3683: 4pm-5pm | F3683: 8 | G3683: 2 | H3683: 44 | I3683: 0 | J3683: =RC[-1]/RC[-2] -> 0
A3684: 237 | B3684: 2 | C3684: Wednesday | D3684: 3 | E3684: 9am-10am | F3684: 1 | G3684: 2 | H3684: 44 | I3684: 0 | J3684: =RC[-1]/RC[-2] -> 0
A3685: 237 | B3685: 2 | C3685: Wednesday | D3685: 3 | E3685: 10am-11am | F3685: 2 | G3685: 2 | H3685: 44 | I3685: 0 | J3685: =RC[-1]/RC[-2] -> 0
A3686: 237 | B3686: 2 | C3686: Wednesday | D3686: 3 | E3686: 11am-12pm | F3686: 3 | G3686: 2 | H3686: 44 | I3686: 0 | J3686: =RC[-1]/RC[-2] -> 0
A3687: 237 | B3687: 2 | C3687: Wednesday | D3687: 3 | E3687: 12pm-1pm | F3687: 4 | G3687: 1 | H3687: 44 | I3687: 4 | J3687: =RC[-1]/RC[-2] -> 9.0909090909090912E-2
A3688: 237 | B3688: 2 | C3688: Wednesday | D3688: 3 | E3688: 1pm-2pm | F3688: 5 | G3688: 1 | H3688: 44 | I3688: 5 | J3688: =RC[-1]/RC[-2] -> 0.11363636363636363
A3689: 237 | B3689: 2 | C3689: Wednesday | D3689: 3 | E3689: 2pm-3pm | F3689: 6 | G3689: 1 | H3689: 44 | I3689: 13 | J3689: =RC[-1]/RC[-2] -> 0.29545454545454547
A3690: 237 | B3690: 2 | C3690: Wednesday | D3690: 3 | E3690: 3pm-4pm | F3690: 7 | G3690: 1 | H3690: 44 | I3690: 10 | J3690: =RC[-1]/RC[-2] -> 0.22727272727272727
A3691: 237 | B3691: 2 | C3691: Wednesday | D3691: 3 | E3691: 4pm-5pm | F3691: 8 | G3691: 1 | H3691: 44 | I3691: 10 | J3691: =RC[-1]/RC[-2] -> 0.22727272727272727
A3692: 237 | B3692: 2 | C3692: Thursday | D3692: 4 | E3692: 9am-10am | F3692: 1 | G3692: 2 | H3692: 44 | I3692: 0 | J3692: =RC[-1]/RC[-2] -> 0
A3693: 237 | B3693: 2 | C3693: Thursday | D3693: 4 | E3693: 10am-11am | F3693: 2 | G3693: 1 | H3693: 44 | I3693: 13 | J3693: =RC[-1]/RC[-2] -> 0.29545454545454547
A3694: 237 | B3694: 2 | C3694: Thursday | D3694: 4 | E3694: 11am-12pm | F3694: 3 | G3694: 1 | H3694: 44 | I3694: 12 | J3694: =RC[-1]/RC[-2] -> 0.27272727272727271
A3695: 237 | B3695: 2 | C3695: Thursday | D3695: 4 | E3695: 12pm-1pm | F3695: 4 | G3695: 1 | H3695: 44 | I3695: 10 | J3695: =RC[-1]/RC[-2] -> 0.22727272727272727
A3696: 237 | B3696: 2 | C3696: Thursday | D3696: 4 | E3696: 1pm-2pm | F3696: 5 | G3696: 1 | H3696: 44 | I3696: 5 | J3696: =RC[-1]/RC[-2] -> 0.11363636363636363
A3697: 237 | B3697: 2 | C3697: Thursday | D3697: 4 | E3697: 2pm-3pm | F3697: 6 | G3697: 2 | H3697: 44 | I3697: 0 | J3697: =RC[-1]/RC[-2] -> 0
A3698: 237 | B3698: 2 | C3698: Thursday | D3698: 4 | E3698: 3pm-4pm | F3698: 7 | G3698: 2 | H3698: 44 | I3698: 0 | J3698: =RC[-1]/RC[-2] -> 0
A3699: 237 | B3699: 2 | C3699: Thursday | D3699: 4 | E3699: 4pm-5pm | F3699: 8 | G3699: 2 | H3699: 44 | I3699: 0 | J3699: =RC[-1]/RC[-2] -> 0
A3700: 237 | B3700: 2 | C3700: Friday | D3700: 5 | E3700: 9am-10am | F3700: 1 | G3700: 2 | H3700: 44 | I3700: 0 | J3700: =RC[-1]/RC[-2] -> 0
A3701: 237 | B3701: 2 | C3701: Friday | D3701: 5 | E3701: 10am-11am | F3701: 2 | G3701: 2 | H3701: 44 | I3701: 0 | J3701: =RC[-1]/RC[-2] -> 0
A3702: 237 | B3702: 2 | C3702: Friday | D3702: 5 | E3702: 11am-12pm | F3702: 3 | G3702: 2 | H3702: 44 | I3702: 0 | J3702: =RC[-1]/RC[-2] -> 0
A3703: 237 | B3703: 2 | C3703: Friday | D3703: 5 | E3703: 12pm-1pm | F3703: 4 | G3703: 2 | H3703: 44 | I3703: 0 | J3703: =RC[-1]/RC[-2] -> 0
A3704: 237 | B3704: 2 | C3704: Friday | D3704: 5 | E3704: 1pm-2pm | F3704: 5 | G3704: 2 | H3704: 44 | I3704: 0 | J3704: =RC[-1]/RC[-2] -> 0
A3705: 237 | B3705: 2 | C3705: Friday | D3705: 5 | E3705: 2pm-3pm | F3705: 6 | G3705: 3 | H3705: 44 | I3705: 1 | J3705: =RC[-1]/RC[-2] -> 2.2727272727272728E-2
A3706: 237 | B3706: 2 | C3706: Friday | D3706: 5 | E3706: 3pm-4pm | F3706: 7 | G3706: 2 | H3706: 44 | I3706: 0 | J3706: =RC[-1]/RC[-2] -> 0
A3707: 237 | B3707: 2 | C3707: Friday | D3707: 5 | E3707: 4pm-5pm | F3707: 8 | G3707: 2 | H3707: 44 | I3707: 0 | J3707: =RC[-1]/RC[-2] -> 0
A3708: 237 | B3708: 2 | C3708: Thursday | D3708: 4 | E3708: 4pm-5pm | F3708: 8 | G3708: 2 | H3708: 44 | I3708: 0 | J3708: =RC[-1]/RC[-2] -> 0
A3709: 237 | B3709: 2 | C3709: Friday | D3709: 5 | E3709: 9am-10am | F3709: 1 | G3709: 2 | H3709: 44 | I3709: 0 | J3709: =RC[-1]/RC[-2] -> 0
A3710: 237 | B3710: 2 | C3710: Friday | D3710: 5 | E3710: 10am-11am | F3710: 2 | G3710: 2 | H3710: 44 | I3710: 0 | J3710: =RC[-1]/RC[-2] -> 0
A3711: 237 | B3711: 2 | C3711: Friday | D3711: 5 | E3711: 11am-12pm | F3711: 3 | G3711: 2 | H3711: 44 | I3711: 0 | J3711: =RC[-1]/RC[-2] -> 0
A3712: 237 | B3712: 2 | C3712: Friday | D3712: 5 | E3712: 12pm-1pm | F3712: 4 | G3712: 2 | H3712: 44 | I3712: 0 | J3712: =RC[-1]/RC[-2] -> 0
A3713: 237 | B3713: 2 | C3713: Friday | D3713: 5 | E3713: 1pm-2pm | F3713: 5 | G3713: 2 | H3713: 44 | I3713: 0 | J3713: =RC[-1]/RC[-2] -> 0
A3714: 237 | B3714: 2 | C3714: Friday | D3714: 5 | E3714: 2pm-3pm | F3714: 6 | G3714: 3 | H3714: 44 | I3714: 1 | J3714: =RC[-1]/RC[-2] -> 2.2727272727272728E-2
A3715: 237 | B3715: 2 | C3715: Friday | D3715: 5 | E3715: 3pm-4pm | F3715: 7 | G3715: 2 | H3715: 44 | I3715: 0 | J3715: =RC[-1]/RC[-2] -> 0
A3716: 237 | B3716: 2 | C3716: Friday | D3716: 5 | E3716: 4pm-5pm | F3716: 8 | G3716: 2 | H3716: 44 | I3716: 0 | J3716: =RC[-1]/RC[-2] -> 0
A3717: 237 | B3717: 2 | C3717: Thursday | D3717: 4 | E3717: 4pm-5pm | F3717: 8 | G3717: 2 | H3717: 44 | I3717: 0 | J3717: =RC[-1]/RC[-2] -> 0
A3718: 237 | B3718: 2 | C3718: Friday | D3718: 5 | E3718: 9am-10am | F3718: 1 | G3718: 2 | H3718: 44 | I3718: 0 | J3718: =RC[-1]/RC[-2] -> 0
A3719: 237 | B3719: 2 | C3719: Friday | D3719: 5 | E3719: 10am-11am | F3719: 2 | G3719: 2 | H3719: 44 | I3719: 0 | J3719: =RC[-1]/RC[-2] -> 0
A3720: 237 | B3720: 2 | C3720: Friday | D3720: 5 | E3720: 11am-12pm | F3720: 3 | G3720: 2 | H3720: 44 | I3720: 0 | J3720: =RC[-1]/RC[-2] -> 0
A3721: 237 | B3721: 2 | C3721: Friday | D3721: 5 | E3721: 12pm-1pm | F3721: 4 | G3721: 2 | H3721: 44 | I3721: 0 | J3721: =RC[-1]/RC[-2] -> 0
A3722: 237 | B3722: 2 | C3722: Friday | D3722: 5 | E3722: 1pm-2pm | F3722: 5 | G3722: 2 | H3722: 44 | I3722: 0 | J3722: =RC[-1]/RC[-2] -> 0
A3723: 237 | B3723: 2 | C3723: Friday | D3723: 5 | E3723: 2pm-3pm | F3723: 6 | G3723: 3 | H3723: 44 | I3723: 1 | J3723: =RC[-1]/RC[-2] -> 2.2727272727272728E-2
A3724: 237 | B3724: 2 | C3724: Friday | D3724: 5 | E3724: 3pm-4pm | F3724: 7 | G3724: 2 | H3724: 44 | I3724: 0 | J3724: =RC[-1]/RC[-2] -> 0
A3725: 237 | B3725: 2 | C3725: Friday | D3725: 5 | E3725: 4pm-5pm | F3725: 8 | G3725: 2 | H3725: 44 | I3725: 0 | J3725: =RC[-1]/RC[-2] -> 0
A3726: 237 | B3726: 2 | C3726: Thursday | D3726: 4 | E3726: 4pm-5pm | F3726: 8 | G3726: 2 | H3726: 44 | I3726: 0 | J3726: =RC[-1]/RC[-2] -> 0
A3727: 237 | B3727: 2 | C3727: Friday | D3727: 5 | E3727: 9am-10am | F3727: 1 | G3727: 2 | H3727: 44 | I3727: 0 | J3727: =RC[-1]/RC[-2] -> 0
A3728: 237 | B3728: 2 | C3728: Friday | D3728: 5 | E3728: 10am-11am | F3728: 2 | G3728: 2 | H3728: 44 | I3728: 0 | J3728: =RC[-1]/RC[-2] -> 0
A3729: 237 | B3729: 2 | C3729: Friday | D3729: 5 | E3729: 11am-12pm | F3729: 3 | G3729: 2 | H3729: 44 | I3729: 0 | J3729: =RC[-1]/RC[-2] -> 0
A3730: 237 | B3730: 2 | C3730: Friday | D3730: 5 | E3730: 12pm-1pm | F3730: 4 | G3730: 2 | H3730: 44 | I3730: 0 | J3730: =RC[-1]/RC[-2] -> 0
A3731: 237 | B3731: 2 | C3731: Friday | D3731: 5 | E3731: 1pm-2pm | F3731: 5 | G3731: 2 | H3731: 44 | I3731: 0 | J3731: =RC[-1]/RC[-2] -> 0
A3732: 237 | B3732: 2 | C3732: Friday | D3732: 5 | E3732: 2pm-3pm | F3732: 6 | G3732: 3 | H3732: 44 | I3732: 1 | J3732: =RC[-1]/RC[-2] -> 2.2727272727272728E-2
A3733: 237 | B3733: 2 | C3733: Friday | D3733: 5 | E3733: 3pm-4pm | F3733: 7 | G3733: 2 | H3733: 44 | I3733: 0 | J3733: =RC[-1]/RC[-2] -> 0
A3734: 237 | B3734: 2 | C3734: Friday | D3734: 5 | E3734: 4pm-5pm | F3734: 8 | G3734: 2 | H3734: 44 | I3734: 0 | J3734: =RC[-1]/RC[-2] -> 0
A3735: 237 | B3735: 2 | C3735: Thursday | D3735: 4 | E3735: 4pm-5pm | F3735: 8 | G3735: 2 | H3735: 44 | I3735: 0 | J3735: =RC[-1]/RC[-2] -> 0
A3736: 237 | B3736: 2 | C3736: Friday | D3736: 5 | E3736: 9am-10am | F3736: 1 | G3736: 2 | H3736: 44 | I3736: 0 | J3736: =RC[-1]/RC[-2] -> 0
A3737: 237 | B3737: 2 | C3737: Friday | D3737: 5 | E3737: 10am-11am | F3737: 2 | G3737: 2 | H3737: 44 | I3737: 0 | J3737: =RC[-1]/RC[-2] -> 0
A3738: 237 | B3738: 2 | C3738: Friday | D3738: 5 | E3738: 11am-12pm | F3738: 3 | G3738: 2 | H3738: 44 | I3738: 0 | J3738: =RC[-1]/RC[-2] -> 0
A3739: 237 | B3739: 2 | C3739: Friday | D3739: 5 | E3739: 12pm-1pm | F3739: 4 | G3739: 2 | H3739: 44 | I3739: 0 | J3739: =RC[-1]/RC[-2] -> 0
A3740: 237 | B3740: 2 | C3740: Friday | D3740: 5 | E3740: 1pm-2pm | F3740: 5 | G3740: 2 | H3740: 44 | I3740: 0 | J3740: =RC[-1]/RC[-2] -> 0
A3741: 237 | B3741: 2 | C3741: Friday | D3741: 5 | E3741: 2pm-3pm | F3741: 6 | G3741: 3 | H3741: 44 | I3741: 1 | J3741: =RC[-1]/RC[-2] -> 2.2727272727272728E-2
A3742: 237 | B3742: 2 | C3742: Friday | D3742: 5 | E3742: 3pm-4pm | F3742: 7 | G3742: 2 | H3742: 44 | I3742: 0 | J3742: =RC[-1]/RC[-2] -> 0
A3743: 237 | B3743: 2 | C3743: Friday | D3743: 5 | E3743: 4pm-5pm | F3743: 8 | G3743: 2 | H3743: 44 | I3743: 0 | J3743: =RC[-1]/RC[-2] -> 0
A3744: 237 | B3744: 2 | C3744: Thursday | D3744: 4 | E3744: 4pm-5pm | F3744: 8 | G3744: 2 | H3744: 44 | I3744: 0 | J3744: =RC[-1]/RC[-2] -> 0
A3745: 237 | B3745: 2 | C3745: Friday | D3745: 5 | E3745: 9am-10am | F3745: 1 | G3745: 2 | H3745: 44 | I3745: 0 | J3745: =RC[-1]/RC[-2] -> 0
A3746: 237 | B3746: 2 | C3746: Friday | D3746: 5 | E3746: 10am-11am | F3746: 2 | G3746: 2 | H3746: 44 | I3746: 0 | J3746: =RC[-1]/RC[-2] -> 0
A3747: 237 | B3747: 2 | C3747: Friday | D3747: 5 | E3747: 11am-12pm | F3747: 3 | G3747: 2 | H3747: 44 | I3747: 0 | J3747: =RC[-1]/RC[-2] -> 0
A3748: 237 | B3748: 2 | C3748: Friday | D3748: 5 | E3748: 12pm-1pm | F3748: 4 | G3748: 2 | H3748: 44 | I3748: 0 | J3748: =RC[-1]/RC[-2] -> 0
A3749: 237 | B3749: 2 | C3749: Friday | D3749: 5 | E3749: 1pm-2pm | F3749: 5 | G3749: 2 | H3749: 44 | I3749: 0 | J3749: =RC[-1]/RC[-2] -> 0
A3750: 237 | B3750: 2 | C3750: Friday | D3750: 5 | E3750: 2pm-3pm | F3750: 6 | G3750: 3 | H3750: 44 | I3750: 1 | J3750: =RC[-1]/RC[-2] -> 2.2727272727272728E-2
A3751: 237 | B3751: 2 | C3751: Friday | D3751: 5 | E3751: 3pm-4pm | F3751: 7 | G3751: 2 | H3751: 44 | I3751: 0 | J3751: =RC[-1]/RC[-2] -> 0
A3752: 237 | B3752: 2 | C3752: Friday | D3752: 5 | E3752: 4pm-5pm | F3752: 8 | G3752: 2 | H3752: 44 | I3752: 0 | J3752: =RC[-1]/RC[-2] -> 0
A3753: 237 | B3753: 2 | C3753: Thursday | D3753: 4 | E3753: 4pm-5pm | F3753: 8 | G3753: 2 | H3753: 44 | I3753: 0 | J3753: =RC[-1]/RC[-2] -> 0
A3754: 237 | B3754: 2 | C3754: Friday | D3754: 5 | E3754: 9am-10am | F3754: 1 | G3754: 2 | H3754: 44 | I3754: 0 | J3754: =RC[-1]/RC[-2] -> 0
A3755: 237 | B3755: 2 | C3755: Friday | D3755: 5 | E3755: 10am-11am | F3755: 2 | G3755: 2 | H3755: 44 | I3755: 0 | J3755: =RC[-1]/RC[-2] -> 0
A3756: 237 | B3756: 2 | C3756: Friday | D3756: 5 | E3756: 11am-12pm | F3756: 3 | G3756: 2 | H3756: 44 | I3756: 0 | J3756: =RC[-1]/RC[-2] -> 0
A3757: 237 | B3757: 2 | C3757: Friday | D3757: 5 | E3757: 12pm-1pm | F3757: 4 | G3757: 2 | H3757: 44 | I3757: 0 | J3757: =RC[-1]/RC[-2] -> 0
A3758: 237 | B3758: 2 | C3758: Friday | D3758: 5 | E3758: 1pm-2pm | F3758: 5 | G3758: 2 | H3758: 44 | I3758: 0 | J3758: =RC[-1]/RC[-2] -> 0
A3759: 237 | B3759: 2 | C3759: Friday | D3759: 5 | E3759: 2pm-3pm | F3759: 6 | G3759: 3 | H3759: 44 | I3759: 1 | J3759: =RC[-1]/RC[-2] -> 2.2727272727272728E-2
A3760: 237 | B3760: 2 | C3760: Friday | D3760: 5 | E3760: 3pm-4pm | F3760: 7 | G3760: 2 | H3760: 44 | I3760: 0 | J3760: =RC[-1]/RC[-2] -> 0
A3761: 237 | B3761: 2 | C3761: Friday | D3761: 5 | E3761: 4pm-5pm | F3761: 8 | G3761: 2 | H3761: 44 | I3761: 0 | J3761: =RC[-1]/RC[-2] -> 0
A3762: 237 | B3762: 2 | C3762: Thursday | D3762: 4 | E3762: 4pm-5pm | F3762: 8 | G3762: 2 | H3762: 44 | I3762: 0 | J3762: =RC[-1]/RC[-2] -> 0
A3763: 237 | B3763: 2 | C3763: Friday | D3763: 5 | E3763: 9am-10am | F3763: 1 | G3763: 2 | H3763: 44 | I3763: 0 | J3763: =RC[-1]/RC[-2] -> 0
A3764: 237 | B3764: 2 | C3764: Friday | D3764: 5 | E3764: 10am-11am | F3764: 2 | G3764: 2 | H3764: 44 | I3764: 0 | J3764: =RC[-1]/RC[-2] -> 0
A3765: 237 | B3765: 2 | C3765: Friday | D3765: 5 | E3765: 11am-12pm | F3765: 3 | G3765: 2 | H3765: 44 | I3765: 0 | J3765: =RC[-1]/RC[-2] -> 0
A3766: 237 | B3766: 2 | C3766: Friday | D3766: 5 | E3766: 12pm-1pm | F3766: 4 | G3766: 2 | H3766: 44 | I3766: 0 | J3766: =RC[-1]/RC[-2] -> 0
A3767: 237 | B3767: 2 | C3767: Friday | D3767: 5 | E3767: 1pm-2pm | F3767: 5 | G3767: 2 | H3767: 44 | I3767: 0 | J3767: =RC[-1]/RC[-2] -> 0
A3768: 237 | B3768: 2 | C3768: Friday | D3768: 5 | E3768: 2pm-3pm | F3768: 6 | G3768: 3 | H3768: 44 | I3768: 1 | J3768: =RC[-1]/RC[-2] -> 2.2727272727272728E-2
A3769: 237 | B3769: 2 | C3769: Friday | D3769: 5 | E3769: 3pm-4pm | F3769: 7 | G3769: 2 | H3769: 44 | I3769: 0 | J3769: =RC[-1]/RC[-2] -> 0
A3770: 237 | B3770: 2 | C3770: Friday | D3770: 5 | E3770: 4pm-5pm | F3770: 8 | G3770: 2 | H3770: 44 | I3770: 0 | J3770: =RC[-1]/RC[-2] -> 0
A3771: 237 | B3771: 2 | C3771: Thursday | D3771: 4 | E3771: 4pm-5pm | F3771: 8 | G3771: 2 | H3771: 44 | I3771: 0 | J3771: =RC[-1]/RC[-2] -> 0
A3772: 237 | B3772: 2 | C3772: Friday | D3772: 5 | E3772: 9am-10am | F3772: 1 | G3772: 2 | H3772: 44 | I3772: 0 | J3772: =RC[-1]/RC[-2] -> 0
A3773: 237 | B3773: 2 | C3773: Friday | D3773: 5 | E3773: 10am-11am | F3773: 2 | G3773: 2 | H3773: 44 | I3773: 0 | J3773: =RC[-1]/RC[-2] -> 0
A3774: 237 | B3774: 2 | C3774: Friday | D3774: 5 | E3774: 11am-12pm | F3774: 3 | G3774: 2 | H3774: 44 | I3774: 0 | J3774: =RC[-1]/RC[-2] -> 0
A3775: 237 | B3775: 2 | C3775: Friday | D3775: 5 | E3775: 12pm-1pm | F3775: 4 | G3775: 2 | H3775: 44 | I3775: 0 | J3775: =RC[-1]/RC[-2] -> 0
A3776: 237 | B3776: 2 | C3776: Friday | D3776: 5 | E3776: 1pm-2pm | F3776: 5 | G3776: 2 | H3776: 44 | I3776: 0 | J3776: =RC[-1]/RC[-2] -> 0
A3777: 237 | B3777: 2 | C3777: Friday | D3777: 5 | E3777: 2pm-3pm | F3777: 6 | G3777: 3 | H3777: 44 | I3777: 1 | J3777: =RC[-1]/RC[-2] -> 2.2727272727272728E-2
A3778: 237 | B3778: 2 | C3778: Friday | D3778: 5 | E3778: 3pm-4pm | F3778: 7 | G3778: 2 | H3778: 44 | I3778: 0 | J3778: =RC[-1]/RC[-2] -> 0
A3779: 237 | B3779: 2 | C3779: Friday | D3779: 5 | E3779: 4pm-5pm | F3779: 8 | G3779: 2 | H3779: 44 | I3779: 0 | J3779: =RC[-1]/RC[-2] -> 0
A3780: 237 | B3780: 2 | C3780: Thursday | D3780: 4 | E3780: 4pm-5pm | F3780: 8 | G3780: 2 | H3780: 44 | I3780: 0 | J3780: =RC[-1]/RC[-2] -> 0
A3781: 237 | B3781: 2 | C3781: Friday | D3781: 5 | E3781: 9am-10am | F3781: 1 | G3781: 2 | H3781: 44 | I3781: 0 | J3781: =RC[-1]/RC[-2] -> 0
A3782: 237 | B3782: 2 | C3782: Friday | D3782: 5 | E3782: 10am-11am | F3782: 2 | G3782: 2 | H3782: 44 | I3782: 0 | J3782: =RC[-1]/RC[-2] -> 0
A3783: 237 | B3783: 2 | C3783: Friday | D3783: 5 | E3783: 11am-12pm | F3783: 3 | G3783: 2 | H3783: 44 | I3783: 0 | J3783: =RC[-1]/RC[-2] -> 0
A3784: 237 | B3784: 2 | C3784: Friday | D3784: 5 | E3784: 12pm-1pm | F3784: 4 | G3784: 2 | H3784: 44 | I3784: 0 | J3784: =RC[-1]/RC[-2] -> 0
A3785: 237 | B3785: 2 | C3785: Friday | D3785: 5 | E3785: 1pm-2pm | F3785: 5 | G3785: 2 | H3785: 44 | I3785: 0 | J3785: =RC[-1]/RC[-2] -> 0
A3786: 237 | B3786: 2 | C3786: Friday | D3786: 5 | E3786: 2pm-3pm | F3786: 6 | G3786: 3 | H3786: 44 | I3786: 1 | J3786: =RC[-1]/RC[-2] -> 2.2727272727272728E-2
A3787: 237 | B3787: 2 | C3787: Friday | D3787: 5 | E3787: 3pm-4pm | F3787: 7 | G3787: 2 | H3787: 44 | I3787: 0 | J3787: =RC[-1]/RC[-2] -> 0
A3788: 237 | B3788: 2 | C3788: Friday | D3788: 5 | E3788: 4pm-5pm | F3788: 8 | G3788: 2 | H3788: 44 | I3788: 0 | J3788: =RC[-1]/RC[-2] -> 0
A3789: 237 | B3789: 2 | C3789: Thursday | D3789: 4 | E3789: 4pm-5pm | F3789: 8 | G3789: 2 | H3789: 44 | I3789: 0 | J3789: =RC[-1]/RC[-2] -> 0
A3790: 237 | B3790: 2 | C3790: Friday | D3790: 5 | E3790: 9am-10am | F3790: 1 | G3790: 2 | H3790: 44 | I3790: 0 | J3790: =RC[-1]/RC[-2] -> 0
A3791: 237 | B3791: 2 | C3791: Friday | D3791: 5 | E3791: 10am-11am | F3791: 2 | G3791: 2 | H3791: 44 | I3791: 0 | J3791: =RC[-1]/RC[-2] -> 0
A3792: 237 | B3792: 2 | C3792: Friday | D3792: 5 | E3792: 11am-12pm | F3792: 3 | G3792: 2 | H3792: 44 | I3792: 0 | J3792: =RC[-1]/RC[-2] -> 0
A3793: 237 | B3793: 2 | C3793: Friday | D3793: 5 | E3793: 12pm-1pm | F3793: 4 | G3793: 2 | H3793: 44 | I3793: 0 | J3793: =RC[-1]/RC[-2] -> 0
A3794: 237 | B3794: 2 | C3794: Friday | D3794: 5 | E3794: 1pm-2pm | F3794: 5 | G3794: 2 | H3794: 44 | I3794: 0 | J3794: =RC[-1]/RC[-2] -> 0
A3795: 237 | B3795: 2 | C3795: Friday | D3795: 5 | E3795: 2pm-3pm | F3795: 6 | G3795: 3 | H3795: 44 | I3795: 1 | J3795: =RC[-1]/RC[-2] -> 2.2727272727272728E-2
A3796: 237 | B3796: 2 | C3796: Friday | D3796: 5 | E3796: 3pm-4pm | F3796: 7 | G3796: 2 | H3796: 44 | I3796: 0 | J3796: =RC[-1]/RC[-2] -> 0
A3797: 237 | B3797: 2 | C3797: Friday | D3797: 5 | E3797: 4pm-5pm | F3797: 8 | G3797: 2 | H3797: 44 | I3797: 0 | J3797: =RC[-1]/RC[-2] -> 0
A3798: 237 | B3798: 2 | C3798: Thursday | D3798: 4 | E3798: 4pm-5pm | F3798: 8 | G3798: 2 | H3798: 44 | I3798: 0 | J3798: =RC[-1]/RC[-2] -> 0
A3799: 237 | B3799: 2 | C3799: Friday | D3799: 5 | E3799: 9am-10am | F3799: 1 | G3799: 2 | H3799: 44 | I3799: 0 | J3799: =RC[-1]/RC[-2] -> 0
A3800: 237 | B3800: 2 | C3800: Friday | D3800: 5 | E3800: 10am-11am | F3800: 2 | G3800: 2 | H3800: 44 | I3800: 0 | J3800: =RC[-1]/RC[-2] -> 0
A3801: 237 | B3801: 2 | C3801: Friday | D3801: 5 | E3801: 11am-12pm | F3801: 3 | G3801: 2 | H3801: 44 | I3801: 0 | J3801: =RC[-1]/RC[-2] -> 0
A3802: 237 | B3802: 2 | C3802: Friday | D3802: 5 | E3802: 12pm-1pm | F3802: 4 | G3802: 2 | H3802: 44 | I3802: 0 | J3802: =RC[-1]/RC[-2] -> 0
A3803: 237 | B3803: 2 | C3803: Friday | D3803: 5 | E3803: 1pm-2pm | F3803: 5 | G3803: 2 | H3803: 44 | I3803: 0 | J3803: =RC[-1]/RC[-2] -> 0
A3804: 237 | B3804: 2 | C3804: Friday | D3804: 5 | E3804: 2pm-3pm | F3804: 6 | G3804: 3 | H3804: 44 | I3804: 1 | J3804: =RC[-1]/RC[-2] -> 2.2727272727272728E-2
A3805: 237 | B3805: 2 | C3805: Friday | D3805: 5 | E3805: 3pm-4pm | F3805: 7 | G3805: 2 | H3805: 44 | I3805: 0 | J3805: =RC[-1]/RC[-2] -> 0
A3806: 237 | B3806: 2 | C3806: Friday | D3806: 5 | E3806: 4pm-5pm | F3806: 8 | G3806: 2 | H3806: 44 | I3806: 0 | J3806: =RC[-1]/RC[-2] -> 0
A3807: 237 | B3807: 2 | C3807: Thursday | D3807: 4 | E3807: 4pm-5pm | F3807: 8 | G3807: 2 | H3807: 44 | I3807: 0 | J3807: =RC[-1]/RC[-2] -> 0
A3808: 237 | B3808: 2 | C3808: Friday | D3808: 5 | E3808: 9am-10am | F3808: 1 | G3808: 2 | H3808: 44 | I3808: 0 | J3808: =RC[-1]/RC[-2] -> 0
A3809: 237 | B3809: 2 | C3809: Friday | D3809: 5 | E3809: 10am-11am | F3809: 2 | G3809: 2 | H3809: 44 | I3809: 0 | J3809: =RC[-1]/RC[-2] -> 0
A3810: 237 | B3810: 2 | C3810: Friday | D3810: 5 | E3810: 11am-12pm | F3810: 3 | G3810: 2 | H3810: 44 | I3810: 0 | J3810: =RC[-1]/RC[-2] -> 0
A3811: 237 | B3811: 2 | C3811: Friday | D3811: 5 | E3811: 12pm-1pm | F3811: 4 | G3811: 2 | H3811: 44 | I3811: 0 | J3811: =RC[-1]/RC[-2] -> 0
A3812: 237 | B3812: 2 | C3812: Friday | D3812: 5 | E3812: 1pm-2pm | F3812: 5 | G3812: 2 | H3812: 44 | I3812: 0 | J3812: =RC[-1]/RC[-2] -> 0
A3813: 237 | B3813: 2 | C3813: Friday | D3813: 5 | E3813: 2pm-3pm | F3813: 6 | G3813: 3 | H3813: 44 | I3813: 1 | J3813: =RC[-1]/RC[-2] -> 2.2727272727272728E-2
A3814: 237 | B3814: 2 | C3814: Friday | D3814: 5 | E3814: 3pm-4pm | F3814: 7 | G3814: 2 | H3814: 44 | I3814: 0 | J3814: =RC[-1]/RC[-2] -> 0
A3815: 237 | B3815: 2 | C3815: Friday | D3815: 5 | E3815: 4pm-5pm | F3815: 8 | G3815: 2 | H3815: 44 | I3815: 0 | J3815: =RC[-1]/RC[-2] -> 0
A3816: 237 | B3816: 2 | C3816: Thursday | D3816: 4 | E3816: 4pm-5pm | F3816: 8 | G3816: 2 | H3816: 44 | I3816: 0 | J3816: =RC[-1]/RC[-2] -> 0
A3817: 237 | B3817: 2 | C3817: Friday | D3817: 5 | E3817: 9am-10am | F3817: 1 | G3817: 2 | H3817: 44 | I3817: 0 | J3817: =RC[-1]/RC[-2] -> 0
A3818: 237 | B3818: 2 | C3818: Friday | D3818: 5 | E3818: 10am-11am | F3818: 2 | G3818: 2 | H3818: 44 | I3818: 0 | J3818: =RC[-1]/RC[-2] -> 0
A3819: 237 | B3819: 2 | C3819: Friday | D3819: 5 | E3819: 11am-12pm | F3819: 3 | G3819: 2 | H3819: 44 | I3819: 0 | J3819: =RC[-1]/RC[-2] -> 0
A3820: 237 | B3820: 2 | C3820: Friday | D3820: 5 | E3820: 12pm-1pm | F3820: 4 | G3820: 2 | H3820: 44 | I3820: 0 | J3820: =RC[-1]/RC[-2] -> 0
A3821: 237 | B3821: 2 | C3821: Friday | D3821: 5 | E3821: 1pm-2pm | F3821: 5 | G3821: 2 | H3821: 44 | I3821: 0 | J3821: =RC[-1]/RC[-2] -> 0
A3822: 237 | B3822: 2 | C3822: Friday | D3822: 5 | E3822: 2pm-3pm | F3822: 6 | G3822: 3 | H3822: 44 | I3822: 1 | J3822: =RC[-1]/RC[-2] -> 2.2727272727272728E-2
A3823: 237 | B3823: 2 | C3823: Friday | D3823: 5 | E3823: 3pm-4pm | F3823: 7 | G3823: 2 | H3823: 44 | I3823: 0 | J3823: =RC[-1]/RC[-2] -> 0
A3824: 237 | B3824: 2 | C3824: Friday | D3824: 5 | E3824: 4pm-5pm | F3824: 8 | G3824: 2 | H3824: 44 | I3824: 0 | J3824: =RC[-1]/RC[-2] -> 0
A3825: 237 | B3825: 2 | C3825: Thursday | D3825: 4 | E3825: 4pm-5pm | F3825: 8 | G3825: 2 | H3825: 44 | I3825: 0 | J3825: =RC[-1]/RC[-2] -> 0
A3826: 237 | B3826: 2 | C3826: Friday | D3826: 5 | E3826: 9am-10am | F3826: 1 | G3826: 2 | H3826: 44 | I3826: 0 | J3826: =RC[-1]/RC[-2] -> 0
A3827: 237 | B3827: 2 | C3827: Friday | D3827: 5 | E3827: 10am-11am | F3827: 2 | G3827: 2 | H3827: 44 | I3827: 0 | J3827: =RC[-1]/RC[-2] -> 0
A3828: 237 | B3828: 2 | C3828: Friday | D3828: 5 | E3828: 11am-12pm | F3828: 3 | G3828: 2 | H3828: 44 | I3828: 0 | J3828: =RC[-1]/RC[-2] -> 0
A3829: 237 | B3829: 2 | C3829: Friday | D3829: 5 | E3829: 12pm-1pm | F3829: 4 | G3829: 2 | H3829: 44 | I3829: 0 | J3829: =RC[-1]/RC[-2] -> 0
A3830: 237 | B3830: 2 | C3830: Friday | D3830: 5 | E3830: 1pm-2pm | F3830: 5 | G3830: 2 | H3830: 44 | I3830: 0 | J3830: =RC[-1]/RC[-2] -> 0
A3831: 237 | B3831: 2 | C3831: Friday | D3831: 5 | E3831: 2pm-3pm | F3831: 6 | G3831: 3 | H3831: 44 | I3831: 1 | J3831: =RC[-1]/RC[-2] -> 2.2727272727272728E-2
A3832: 237 | B3832: 2 | C3832: Friday | D3832: 5 | E3832: 3pm-4pm | F3832: 7 | G3832: 2 | H3832: 44 | I3832: 0 | J3832: =RC[-1]/RC[-2] -> 0
A3833: 237 | B3833: 2 | C3833: Friday | D3833: 5 | E3833: 4pm-5pm | F3833: 8 | G3833: 2 | H3833: 44 | I3833: 0 | J3833: =RC[-1]/RC[-2] -> 0
A3834: 237 | B3834: 2 | C3834: Thursday | D3834: 4 | E3834: 4pm-5pm | F3834: 8 | G3834: 2 | H3834: 44 | I3834: 0 | J3834: =RC[-1]/RC[-2] -> 0
A3835: 237 | B3835: 2 | C3835: Friday | D3835: 5 | E3835: 9am-10am | F3835: 1 | G3835: 2 | H3835: 44 | I3835: 0 | J3835: =RC[-1]/RC[-2] -> 0
A3836: 237 | B3836: 2 | C3836: Friday | D3836: 5 | E3836: 10am-11am | F3836: 2 | G3836: 2 | H3836: 44 | I3836: 0 | J3836: =RC[-1]/RC[-2] -> 0
A3837: 237 | B3837: 2 | C3837: Friday | D3837: 5 | E3837: 11am-12pm | F3837: 3 | G3837: 2 | H3837: 44 | I3837: 0 | J3837: =RC[-1]/RC[-2] -> 0
A3838: 237 | B3838: 2 | C3838: Friday | D3838: 5 | E3838: 12pm-1pm | F3838: 4 | G3838: 2 | H3838: 44 | I3838: 0 | J3838: =RC[-1]/RC[-2] -> 0
A3839: 237 | B3839: 2 | C3839: Friday | D3839: 5 | E3839: 1pm-2pm | F3839: 5 | G3839: 2 | H3839: 44 | I3839: 0 | J3839: =RC[-1]/RC[-2] -> 0
A3840: 237 | B3840: 2 | C3840: Friday | D3840: 5 | E3840: 2pm-3pm | F3840: 6 | G3840: 3 | H3840: 44 | I3840: 1 | J3840: =RC[-1]/RC[-2] -> 2.2727272727272728E-2
A3841: 237 | B3841: 2 | C3841: Friday | D3841: 5 | E3841: 3pm-4pm | F3841: 7 | G3841: 2 | H3841: 44 | I3841: 0 | J3841: =RC[-1]/RC[-2] -> 0
A3842: 237 | B3842: 2 | C3842: Friday | D3842: 5 | E3842: 4pm-5pm | F3842: 8 | G3842: 2 | H3842: 44 | I3842: 0 | J3842: =RC[-1]/RC[-2] -> 0
A3843: 237 | B3843: 2 | C3843: Thursday | D3843: 4 | E3843: 4pm-5pm | F3843: 8 | G3843: 2 | H3843: 44 | I3843: 0 | J3843: =RC[-1]/RC[-2] -> 0
A3844: 237 | B3844: 2 | C3844: Friday | D3844: 5 | E3844: 9am-10am | F3844: 1 | G3844: 2 | H3844: 44 | I3844: 0 | J3844: =RC[-1]/RC[-2] -> 0
A3845: 237 | B3845: 2 | C3845: Friday | D3845: 5 | E3845: 10am-11am | F3845: 2 | G3845: 2 | H3845: 44 | I3845: 0 | J3845: =RC[-1]/RC[-2] -> 0
A3846: 237 | B3846: 2 | C3846: Friday | D3846: 5 | E3846: 11am-12pm | F3846: 3 | G3846: 2 | H3846: 44 | I3846: 0 | J3846: =RC[-1]/RC[-2] -> 0
A3847: 237 | B3847: 2 | C3847: Friday | D3847: 5 | E3847: 12pm-1pm | F3847: 4 | G3847: 2 | H3847: 44 | I3847: 0 | J3847: =RC[-1]/RC[-2] -> 0
A3848: 237 | B3848: 2 | C3848: Friday | D3848: 5 | E3848: 1pm-2pm | F3848: 5 | G3848: 2 | H3848: 44 | I3848: 0 | J3848: =RC[-1]/RC[-2] -> 0
A3849: 237 | B3849: 2 | C3849: Friday | D3849: 5 | E3849: 2pm-3pm | F3849: 6 | G3849: 3 | H3849: 44 | I3849: 1 | J3849: =RC[-1]/RC[-2] -> 2.2727272727272728E-2
A3850: 237 | B3850: 2 | C3850: Friday | D3850: 5 | E3850: 3pm-4pm | F3850: 7 | G3850: 2 | H3850: 44 | I3850: 0 | J3850: =RC[-1]/RC[-2] -> 0
A3851: 237 | B3851: 2 | C3851: Friday | D3851: 5 | E3851: 4pm-5pm | F3851: 8 | G3851: 2 | H3851: 44 | I3851: 0 | J3851: =RC[-1]/RC[-2] -> 0
A3852: 237 | B3852: 2 | C3852: Thursday | D3852: 4 | E3852: 4pm-5pm | F3852: 8 | G3852: 2 | H3852: 44 | I3852: 0 | J3852: =RC[-1]/RC[-2] -> 0
A3853: 237 | B3853: 2 | C3853: Friday | D3853: 5 | E3853: 9am-10am | F3853: 1 | G3853: 2 | H3853: 44 | I3853: 0 | J3853: =RC[-1]/RC[-2] -> 0
A3854: 237 | B3854: 2 | C3854: Friday | D3854: 5 | E3854: 10am-11am | F3854: 2 | G3854: 2 | H3854: 44 | I3854: 0 | J3854: =RC[-1]/RC[-2] -> 0
A3855: 237 | B3855: 2 | C3855: Friday | D3855: 5 | E3855: 11am-12pm | F3855: 3 | G3855: 2 | H3855: 44 | I3855: 0 | J3855: =RC[-1]/RC[-2] -> 0
A3856: 237 | B3856: 2 | C3856: Friday | D3856: 5 | E3856: 12pm-1pm | F3856: 4 | G3856: 2 | H3856: 44 | I3856: 0 | J3856: =RC[-1]/RC[-2] -> 0
A3857: 237 | B3857: 2 | C3857: Friday | D3857: 5 | E3857: 1pm-2pm | F3857: 5 | G3857: 2 | H3857: 44 | I3857: 0 | J3857: =RC[-1]/RC[-2] -> 0
A3858: 237 | B3858: 2 | C3858: Friday | D3858: 5 | E3858: 2pm-3pm | F3858: 6 | G3858: 3 | H3858: 44 | I3858: 1 | J3858: =RC[-1]/RC[-2] -> 2.2727272727272728E-2
A3859: 237 | B3859: 2 | C3859: Friday | D3859: 5 | E3859: 3pm-4pm | F3859: 7 | G3859: 2 | H3859: 44 | I3859: 0 | J3859: =RC[-1]/RC[-2] -> 0
A3860: 237 | B3860: 2 | C3860: Friday | D3860: 5 | E3860: 4pm-5pm | F3860: 8 | G3860: 2 | H3860: 44 | I3860: 0 | J3860: =RC[-1]/RC[-2] -> 0
A3861: 237 | B3861: 2 | C3861: Thursday | D3861: 4 | E3861: 4pm-5pm | F3861: 8 | G3861: 2 | H3861: 44 | I3861: 0 | J3861: =RC[-1]/RC[-2] -> 0
A3862: 237 | B3862: 2 | C3862: Friday | D3862: 5 | E3862: 9am-10am | F3862: 1 | G3862: 2 | H3862: 44 | I3862: 0 | J3862: =RC[-1]/RC[-2] -> 0
A3863: 237 | B3863: 2 | C3863: Friday | D3863: 5 | E3863: 10am-11am | F3863: 2 | G3863: 2 | H3863: 44 | I3863: 0 | J3863: =RC[-1]/RC[-2] -> 0
A3864: 237 | B3864: 2 | C3864: Friday | D3864: 5 | E3864: 11am-12pm | F3864: 3 | G3864: 2 | H3864: 44 | I3864: 0 | J3864: =RC[-1]/RC[-2] -> 0
A3865: 237 | B3865: 2 | C3865: Friday | D3865: 5 | E3865: 12pm-1pm | F3865: 4 | G3865: 2 | H3865: 44 | I3865: 0 | J3865: =RC[-1]/RC[-2] -> 0
A3866: 237 | B3866: 2 | C3866: Friday | D3866: 5 | E3866: 1pm-2pm | F3866: 5 | G3866: 2 | H3866: 44 | I3866: 0 | J3866: =RC[-1]/RC[-2] -> 0
A3867: 237 | B3867: 2 | C3867: Friday | D3867: 5 | E3867: 2pm-3pm | F3867: 6 | G3867: 3 | H3867: 44 | I3867: 1 | J3867: =RC[-1]/RC[-2] -> 2.2727272727272728E-2
A3868: 237 | B3868: 2 | C3868: Friday | D3868: 5 | E3868: 3pm-4pm | F3868: 7 | G3868: 2 | H3868: 44 | I3868: 0 | J3868: =RC[-1]/RC[-2] -> 0
A3869: 237 | B3869: 2 | C3869: Friday | D3869: 5 | E3869: 4pm-5pm | F3869: 8 | G3869: 2 | H3869: 44 | I3869: 0 | J3869: =RC[-1]/RC[-2] -> 0
A3870: 237 | B3870: 2 | C3870: Thursday | D3870: 4 | E3870: 4pm-5pm | F3870: 8 | G3870: 2 | H3870: 44 | I3870: 0 | J3870: =RC[-1]/RC[-2] -> 0
A3871: 237 | B3871: 2 | C3871: Friday | D3871: 5 | E3871: 9am-10am | F3871: 1 | G3871: 2 | H3871: 44 | I3871: 0 | J3871: =RC[-1]/RC[-2] -> 0
A3872: 237 | B3872: 2 | C3872: Friday | D3872: 5 | E3872: 10am-11am | F3872: 2 | G3872: 2 | H3872: 44 | I3872: 0 | J3872: =RC[-1]/RC[-2] -> 0
A3873: 237 | B3873: 2 | C3873: Friday | D3873: 5 | E3873: 11am-12pm | F3873: 3 | G3873: 2 | H3873: 44 | I3873: 0 | J3873: =RC[-1]/RC[-2] -> 0
A3874: 237 | B3874: 2 | C3874: Friday | D3874: 5 | E3874: 12pm-1pm | F3874: 4 | G3874: 2 | H3874: 44 | I3874: 0 | J3874: =RC[-1]/RC[-2] -> 0
A3875: 237 | B3875: 2 | C3875: Friday | D3875: 5 | E3875: 1pm-2pm | F3875: 5 | G3875: 2 | H3875: 44 | I3875: 0 | J3875: =RC[-1]/RC[-2] -> 0
A3876: 237 | B3876: 2 | C3876: Friday | D3876: 5 | E3876: 2pm-3pm | F3876: 6 | G3876: 3 | H3876: 44 | I3876: 1 | J3876: =RC[-1]/RC[-2] -> 2.2727272727272728E-2
A3877: 237 | B3877: 2 | C3877: Friday | D3877: 5 | E3877: 3pm-4pm | F3877: 7 | G3877: 2 | H3877: 44 | I3877: 0 | J3877: =RC[-1]/RC[-2] -> 0
A3878: 237 | B3878: 2 | C3878: Friday | D3878: 5 | E3878: 4pm-5pm | F3878: 8 | G3878: 2 | H3878: 44 | I3878: 0 | J3878: =RC[-1]/RC[-2] -> 0
A3879: 237 | B3879: 2 | C3879: Thursday | D3879: 4 | E3879: 4pm-5pm | F3879: 8 | G3879: 2 | H3879: 44 | I3879: 0 | J3879: =RC[-1]/RC[-2] -> 0
A3880: 237 | B3880: 2 | C3880: Friday | D3880: 5 | E3880: 9am-10am | F3880: 1 | G3880: 2 | H3880: 44 | I3880: 0 | J3880: =RC[-1]/RC[-2] -> 0
A3881: 237 | B3881: 2 | C3881: Friday | D3881: 5 | E3881: 10am-11am | F3881: 2 | G3881: 2 | H3881: 44 | I3881: 0 | J3881: =RC[-1]/RC[-2] -> 0
A3882: 237 | B3882: 2 | C3882: Friday | D3882: 5 | E3882: 11am-12pm | F3882: 3 | G3882: 2 | H3882: 44 | I3882: 0 | J3882: =RC[-1]/RC[-2] -> 0
A3883: 237 | B3883: 2 | C3883: Friday | D3883: 5 | E3883: 12pm-1pm | F3883: 4 | G3883: 2 | H3883: 44 | I3883: 0 | J3883: =RC[-1]/RC[-2] -> 0
A3884: 237 | B3884: 2 | C3884: Friday | D3884: 5 | E3884: 1pm-2pm | F3884: 5 | G3884: 2 | H3884: 44 | I3884: 0 | J3884: =RC[-1]/RC[-2] -> 0
A3885: 237 | B3885: 2 | C3885: Friday | D3885: 5 | E3885: 2pm-3pm | F3885: 6 | G3885: 3 | H3885: 44 | I3885: 1 | J3885: =RC[-1]/RC[-2] -> 2.2727272727272728E-2
A3886: 237 | B3886: 2 | C3886: Friday | D3886: 5 | E3886: 3pm-4pm | F3886: 7 | G3886: 2 | H3886: 44 | I3886: 0 | J3886: =RC[-1]/RC[-2] -> 0
A3887: 237 | B3887: 2 | C3887: Friday | D3887: 5 | E3887: 4pm-5pm | F3887: 8 | G3887: 2 | H3887: 44 | I3887: 0 | J3887: =RC[-1]/RC[-2] -> 0
A3888: 237 | B3888: 2 | C3888: Thursday | D3888: 4 | E3888: 4pm-5pm | F3888: 8 | G3888: 2 | H3888: 44 | I3888: 0 | J3888: =RC[-1]/RC[-2] -> 0
A3889: 237 | B3889: 2 | C3889: Friday | D3889: 5 | E3889: 9am-10am | F3889: 1 | G3889: 2 | H3889: 44 | I3889: 0 | J3889: =RC[-1]/RC[-2] -> 0
A3890: 237 | B3890: 2 | C3890: Friday | D3890: 5 | E3890: 10am-11am | F3890: 2 | G3890: 2 | H3890: 44 | I3890: 0 | J3890: =RC[-1]/RC[-2] -> 0
A3891: 237 | B3891: 2 | C3891: Friday | D3891: 5 | E3891: 11am-12pm | F3891: 3 | G3891: 2 | H3891: 44 | I3891: 0 | J3891: =RC[-1]/RC[-2] -> 0
A3892: 237 | B3892: 2 | C3892: Friday | D3892: 5 | E3892: 12pm-1pm | F3892: 4 | G3892: 2 | H3892: 44 | I3892: 0 | J3892: =RC[-1]/RC[-2] -> 0
A3893: 237 | B3893: 2 | C3893: Friday | D3893: 5 | E3893: 1pm-2pm | F3893: 5 | G3893: 2 | H3893: 44 | I3893: 0 | J3893: =RC[-1]/RC[-2] -> 0
A3894: 237 | B3894: 2 | C3894: Friday | D3894: 5 | E3894: 2pm-3pm | F3894: 6 | G3894: 3 | H3894: 44 | I3894: 1 | J3894: =RC[-1]/RC[-2] -> 2.2727272727272728E-2
A3895: 237 | B3895: 2 | C3895: Friday | D3895: 5 | E3895: 3pm-4pm | F3895: 7 | G3895: 2 | H3895: 44 | I3895: 0 | J3895: =RC[-1]/RC[-2] -> 0
A3896: 237 | B3896: 2 | C3896: Friday | D3896: 5 | E3896: 4pm-5pm | F3896: 8 | G3896: 2 | H3896: 44 | I3896: 0 | J3896: =RC[-1]/RC[-2] -> 0
A3897: 237 | B3897: 2 | C3897: Thursday | D3897: 4 | E3897: 4pm-5pm | F3897: 8 | G3897: 2 | H3897: 44 | I3897: 0 | J3897: =RC[-1]/RC[-2] -> 0
A3898: 237 | B3898: 2 | C3898: Friday | D3898: 5 | E3898: 9am-10am | F3898: 1 | G3898: 2 | H3898: 44 | I3898: 0 | J3898: =RC[-1]/RC[-2] -> 0
A3899: 237 | B3899: 2 | C3899: Friday | D3899: 5 | E3899: 10am-11am | F3899: 2 | G3899: 2 | H3899: 44 | I3899: 0 | J3899: =RC[-1]/RC[-2] -> 0
A3900: 237 | B3900: 2 | C3900: Friday | D3900: 5 | E3900: 11am-12pm | F3900: 3 | G3900: 2 | H3900: 44 | I3900: 0 | J3900: =RC[-1]/RC[-2] -> 0
A3901: 237 | B3901: 2 | C3901: Friday | D3901: 5 | E3901: 12pm-1pm | F3901: 4 | G3901: 2 | H3901: 44 | I3901: 0 | J3901: =RC[-1]/RC[-2] -> 0
A3902: 237 | B3902: 2 | C3902: Friday | D3902: 5 | E3902: 1pm-2pm | F3902: 5 | G3902: 2 | H3902: 44 | I3902: 0 | J3902: =RC[-1]/RC[-2] -> 0
A3903: 237 | B3903: 2 | C3903: Friday | D3903: 5 | E3903: 2pm-3pm | F3903: 6 | G3903: 3 | H3903: 44 | I3903: 1 | J3903: =RC[-1]/RC[-2] -> 2.2727272727272728E-2
A3904: 237 | B3904: 2 | C3904: Friday | D3904: 5 | E3904: 3pm-4pm | F3904: 7 | G3904: 2 | H3904: 44 | I3904: 0 | J3904: =RC[-1]/RC[-2] -> 0
A3905: 237 | B3905: 2 | C3905: Friday | D3905: 5 | E3905: 4pm-5pm | F3905: 8 | G3905: 2 | H3905: 44 | I3905: 0 | J3905: =RC[-1]/RC[-2] -> 0
A3906: 237 | B3906: 2 | C3906: Thursday | D3906: 4 | E3906: 4pm-5pm | F3906: 8 | G3906: 2 | H3906: 44 | I3906: 0 | J3906: =RC[-1]/RC[-2] -> 0
A3907: 237 | B3907: 2 | C3907: Friday | D3907: 5 | E3907: 9am-10am | F3907: 1 | G3907: 2 | H3907: 44 | I3907: 0 | J3907: =RC[-1]/RC[-2] -> 0
A3908: 237 | B3908: 2 | C3908: Friday | D3908: 5 | E3908: 10am-11am | F3908: 2 | G3908: 2 | H3908: 44 | I3908: 0 | J3908: =RC[-1]/RC[-2] -> 0
A3909: 237 | B3909: 2 | C3909: Friday | D3909: 5 | E3909: 11am-12pm | F3909: 3 | G3909: 2 | H3909: 44 | I3909: 0 | J3909: =RC[-1]/RC[-2] -> 0
A3910: 237 | B3910: 2 | C3910: Friday | D3910: 5 | E3910: 12pm-1pm | F3910: 4 | G3910: 2 | H3910: 44 | I3910: 0 | J3910: =RC[-1]/RC[-2] -> 0
A3911: 237 | B3911: 2 | C3911: Friday | D3911: 5 | E3911: 1pm-2pm | F3911: 5 | G3911: 2 | H3911: 44 | I3911: 0 | J3911: =RC[-1]/RC[-2] -> 0
A3912: 237 | B3912: 2 | C3912: Friday | D3912: 5 | E3912: 2pm-3pm | F3912: 6 | G3912: 3 | H3912: 44 | I3912: 1 | J3912: =RC[-1]/RC[-2] -> 2.2727272727272728E-2
A3913: 237 | B3913: 2 | C3913: Friday | D3913: 5 | E3913: 3pm-4pm | F3913: 7 | G3913: 2 | H3913: 44 | I3913: 0 | J3913: =RC[-1]/RC[-2] -> 0
A3914: 237 | B3914: 2 | C3914: Friday | D3914: 5 | E3914: 4pm-5pm | F3914: 8 | G3914: 2 | H3914: 44 | I3914: 0 | J3914: =RC[-1]/RC[-2] -> 0
A3915: 237 | B3915: 2 | C3915: Thursday | D3915: 4 | E3915: 4pm-5pm | F3915: 8 | G3915: 2 | H3915: 44 | I3915: 0 | J3915: =RC[-1]/RC[-2] -> 0
A3916: 237 | B3916: 2 | C3916: Friday | D3916: 5 | E3916: 9am-10am | F3916: 1 | G3916: 2 | H3916: 44 | I3916: 0 | J3916: =RC[-1]/RC[-2] -> 0
A3917: 237 | B3917: 2 | C3917: Friday | D3917: 5 | E3917: 10am-11am | F3917: 2 | G3917: 2 | H3917: 44 | I3917: 0 | J3917: =RC[-1]/RC[-2] -> 0
A3918: 237 | B3918: 2 | C3918: Friday | D3918: 5 | E3918: 11am-12pm | F3918: 3 | G3918: 2 | H3918: 44 | I3918: 0 | J3918: =RC[-1]/RC[-2] -> 0
A3919: 237 | B3919: 2 | C3919: Friday | D3919: 5 | E3919: 12pm-1pm | F3919: 4 | G3919: 2 | H3919: 44 | I3919: 0 | J3919: =RC[-1]/RC[-2] -> 0
A3920: 237 | B3920: 2 | C3920: Friday | D3920: 5 | E3920: 1pm-2pm | F3920: 5 | G3920: 2 | H3920: 44 | I3920: 0 | J3920: =RC[-1]/RC[-2] -> 0
A3921: 237 | B3921: 2 | C3921: Friday | D3921: 5 | E3921: 2pm-3pm | F3921: 6 | G3921: 3 | H3921: 44 | I3921: 1 | J3921: =RC[-1]/RC[-2] -> 2.2727272727272728E-2
A3922: 237 | B3922: 2 | C3922: Friday | D3922: 5 | E3922: 3pm-4pm | F3922: 7 | G3922: 2 | H3922: 44 | I3922: 0 | J3922: =RC[-1]/RC[-2] -> 0
A3923: 237 | B3923: 2 | C3923: Friday | D3923: 5 | E3923: 4pm-5pm | F3923: 8 | G3923: 2 | H3923: 44 | I3923: 0 | J3923: =RC[-1]/RC[-2] -> 0
A3924: 237 | B3924: 2 | C3924: Thursday | D3924: 4 | E3924: 4pm-5pm | F3924: 8 | G3924: 2 | H3924: 44 | I3924: 0 | J3924: =RC[-1]/RC[-2] -> 0
A3925: 237 | B3925: 2 | C3925: Friday | D3925: 5 | E3925: 9am-10am | F3925: 1 | G3925: 2 | H3925: 44 | I3925: 0 | J3925: =RC[-1]/RC[-2] -> 0
A3926: 237 | B3926: 2 | C3926: Friday | D3926: 5 | E3926: 10am-11am | F3926: 2 | G3926: 2 | H3926: 44 | I3926: 0 | J3926: =RC[-1]/RC[-2] -> 0
A3927: 237 | B3927: 2 | C3927: Friday | D3927: 5 | E3927: 11am-12pm | F3927: 3 | G3927: 2 | H3927: 44 | I3927: 0 | J3927: =RC[-1]/RC[-2] -> 0
A3928: 237 | B3928: 2 | C3928: Friday | D3928: 5 | E3928: 12pm-1pm | F3928: 4 | G3928: 2 | H3928: 44 | I3928: 0 | J3928: =RC[-1]/RC[-2] -> 0
A3929: 237 | B3929: 2 | C3929: Friday | D3929: 5 | E3929: 1pm-2pm | F3929: 5 | G3929: 2 | H3929: 44 | I3929: 0 | J3929: =RC[-1]/RC[-2] -> 0
A3930: 237 | B3930: 2 | C3930: Friday | D3930: 5 | E3930: 2pm-3pm | F3930: 6 | G3930: 3 | H3930: 44 | I3930: 1 | J3930: =RC[-1]/RC[-2] -> 2.2727272727272728E-2
A3931: 237 | B3931: 2 | C3931: Friday | D3931: 5 | E3931: 3pm-4pm | F3931: 7 | G3931: 2 | H3931: 44 | I3931: 0 | J3931: =RC[-1]/RC[-2] -> 0
A3932: 237 | B3932: 2 | C3932: Friday | D3932: 5 | E3932: 4pm-5pm | F3932: 8 | G3932: 2 | H3932: 44 | I3932: 0 | J3932: =RC[-1]/RC[-2] -> 0
A3933: 237 | B3933: 2 | C3933: Thursday | D3933: 4 | E3933: 4pm-5pm | F3933: 8 | G3933: 2 | H3933: 44 | I3933: 0 | J3933: =RC[-1]/RC[-2] -> 0
A3934: 237 | B3934: 2 | C3934: Friday | D3934: 5 | E3934: 9am-10am | F3934: 1 | G3934: 2 | H3934: 44 | I3934: 0 | J3934: =RC[-1]/RC[-2] -> 0
A3935: 237 | B3935: 2 | C3935: Friday | D3935: 5 | E3935: 10am-11am | F3935: 2 | G3935: 2 | H3935: 44 | I3935: 0 | J3935: =RC[-1]/RC[-2] -> 0
A3936: 237 | B3936: 2 | C3936: Friday | D3936: 5 | E3936: 11am-12pm | F3936: 3 | G3936: 2 | H3936: 44 | I3936: 0 | J3936: =RC[-1]/RC[-2] -> 0
A3937: 237 | B3937: 2 | C3937: Friday | D3937: 5 | E3937: 12pm-1pm | F3937: 4 | G3937: 2 | H3937: 44 | I3937: 0 | J3937: =RC[-1]/RC[-2] -> 0
A3938: 237 | B3938: 2 | C3938: Friday | D3938: 5 | E3938: 1pm-2pm | F3938: 5 | G3938: 2 | H3938: 44 | I3938: 0 | J3938: =RC[-1]/RC[-2] -> 0
A3939: 237 | B3939: 2 | C3939: Friday | D3939: 5 | E3939: 2pm-3pm | F3939: 6 | G3939: 3 | H3939: 44 | I3939: 1 | J3939: =RC[-1]/RC[-2] -> 2.2727272727272728E-2
A3940: 237 | B3940: 2 | C3940: Friday | D3940: 5 | E3940: 3pm-4pm | F3940: 7 | G3940: 2 | H3940: 44 | I3940: 0 | J3940: =RC[-1]/RC[-2] -> 0
A3941: 237 | B3941: 2 | C3941: Friday | D3941: 5 | E3941: 4pm-5pm | F3941: 8 | G3941: 2 | H3941: 44 | I3941: 0 | J3941: =RC[-1]/RC[-2] -> 0
A3942: 237 | B3942: 2 | C3942: Thursday | D3942: 4 | E3942: 4pm-5pm | F3942: 8 | G3942: 2 | H3942: 44 | I3942: 0 | J3942: =RC[-1]/RC[-2] -> 0
A3943: 237 | B3943: 2 | C3943: Friday | D3943: 5 | E3943: 9am-10am | F3943: 1 | G3943: 2 | H3943: 44 | I3943: 0 | J3943: =RC[-1]/RC[-2] -> 0
A3944: 237 | B3944: 2 | C3944: Friday | D3944: 5 | E3944: 10am-11am | F3944: 2 | G3944: 2 | H3944: 44 | I3944: 0 | J3944: =RC[-1]/RC[-2] -> 0
A3945: 237 | B3945: 2 | C3945: Friday | D3945: 5 | E3945: 11am-12pm | F3945: 3 | G3945: 2 | H3945: 44 | I3945: 0 | J3945: =RC[-1]/RC[-2] -> 0
A3946: 237 | B3946: 2 | C3946: Friday | D3946: 5 | E3946: 12pm-1pm | F3946: 4 | G3946: 2 | H3946: 44 | I3946: 0 | J3946: =RC[-1]/RC[-2] -> 0
A3947: 237 | B3947: 2 | C3947: Friday | D3947: 5 | E3947: 1pm-2pm | F3947: 5 | G3947: 2 | H3947: 44 | I3947: 0 | J3947: =RC[-1]/RC[-2] -> 0
A3948: 237 | B3948: 2 | C3948: Friday | D3948: 5 | E3948: 2pm-3pm | F3948: 6 | G3948: 3 | H3948: 44 | I3948: 1 | J3948: =RC[-1]/RC[-2] -> 2.2727272727272728E-2
A3949: 237 | B3949: 2 | C3949: Friday | D3949: 5 | E3949: 3pm-4pm | F3949: 7 | G3949: 2 | H3949: 44 | I3949: 0 | J3949: =RC[-1]/RC[-2] -> 0
A3950: 237 | B3950: 2 | C3950: Friday | D3950: 5 | E3950: 4pm-5pm | F3950: 8 | G3950: 2 | H3950: 44 | I3950: 0 | J3950: =RC[-1]/RC[-2] -> 0
A3951: 237 | B3951: 2 | C3951: Thursday | D3951: 4 | E3951: 4pm-5pm | F3951: 8 | G3951: 2 | H3951: 44 | I3951: 0 | J3951: =RC[-1]/RC[-2] -> 0
A3952: 237 | B3952: 2 | C3952: Friday | D3952: 5 | E3952: 9am-10am | F3952: 1 | G3952: 2 | H3952: 44 | I3952: 0 | J3952: =RC[-1]/RC[-2] -> 0
A3953: 237 | B3953: 2 | C3953: Friday | D3953: 5 | E3953: 10am-11am | F3953: 2 | G3953: 2 | H3953: 44 | I3953: 0 | J3953: =RC[-1]/RC[-2] -> 0
A3954: 237 | B3954: 2 | C3954: Friday | D3954: 5 | E3954: 11am-12pm | F3954: 3 | G3954: 2 | H3954: 44 | I3954: 0 | J3954: =RC[-1]/RC[-2] -> 0
A3955: 237 | B3955: 2 | C3955: Friday | D3955: 5 | E3955: 12pm-1pm | F3955: 4 | G3955: 2 | H3955: 44 | I3955: 0 | J3955: =RC[-1]/RC[-2] -> 0
A3956: 237 | B3956: 2 | C3956: Friday | D3956: 5 | E3956: 1pm-2pm | F3956: 5 | G3956: 2 | H3956: 44 | I3956: 0 | J3956: =RC[-1]/RC[-2] -> 0
A3957: 237 | B3957: 2 | C3957: Friday | D3957: 5 | E3957: 2pm-3pm | F3957: 6 | G3957: 3 | H3957: 44 | I3957: 1 | J3957: =RC[-1]/RC[-2] -> 2.2727272727272728E-2
A3958: 237 | B3958: 2 | C3958: Friday | D3958: 5 | E3958: 3pm-4pm | F3958: 7 | G3958: 2 | H3958: 44 | I3958: 0 | J3958: =RC[-1]/RC[-2] -> 0
A3959: 237 | B3959: 2 | C3959: Friday | D3959: 5 | E3959: 4pm-5pm | F3959: 8 | G3959: 2 | H3959: 44 | I3959: 0 | J3959: =RC[-1]/RC[-2] -> 0
A3960: 237 | B3960: 2 | C3960: Thursday | D3960: 4 | E3960: 4pm-5pm | F3960: 8 | G3960: 2 | H3960: 44 | I3960: 0 | J3960: =RC[-1]/RC[-2] -> 0
A3961: 237 | B3961: 2 | C3961: Friday | D3961: 5 | E3961: 9am-10am | F3961: 1 | G3961: 2 | H3961: 44 | I3961: 0 | J3961: =RC[-1]/RC[-2] -> 0
A3962: 237 | B3962: 2 | C3962: Friday | D3962: 5 | E3962: 10am-11am | F3962: 2 | G3962: 2 | H3962: 44 | I3962: 0 | J3962: =RC[-1]/RC[-2] -> 0
A3963: 237 | B3963: 2 | C3963: Friday | D3963: 5 | E3963: 11am-12pm | F3963: 3 | G3963: 2 | H3963: 44 | I3963: 0 | J3963: =RC[-1]/RC[-2] -> 0
A3964: 237 | B3964: 2 | C3964: Friday | D3964: 5 | E3964: 12pm-1pm | F3964: 4 | G3964: 2 | H3964: 44 | I3964: 0 | J3964: =RC[-1]/RC[-2] -> 0
A3965: 237 | B3965: 2 | C3965: Friday | D3965: 5 | E3965: 1pm-2pm | F3965: 5 | G3965: 2 | H3965: 44 | I3965: 0 | J3965: =RC[-1]/RC[-2] -> 0
A3966: 237 | B3966: 2 | C3966: Friday | D3966: 5 | E3966: 2pm-3pm | F3966: 6 | G3966: 3 | H3966: 44 | I3966: 1 | J3966: =RC[-1]/RC[-2] -> 2.2727272727272728E-2
A3967: 237 | B3967: 2 | C3967: Friday | D3967: 5 | E3967: 3pm-4pm | F3967: 7 | G3967: 2 | H3967: 44 | I3967: 0 | J3967: =RC[-1]/RC[-2] -> 0
A3968: 237 | B3968: 2 | C3968: Friday | D3968: 5 | E3968: 4pm-5pm | F3968: 8 | G3968: 2 | H3968: 44 | I3968: 0 | J3968: =RC[-1]/RC[-2] -> 0
A3969: 237 | B3969: 2 | C3969: Thursday | D3969: 4 | E3969: 4pm-5pm | F3969: 8 | G3969: 2 | H3969: 44 | I3969: 0 | J3969: =RC[-1]/RC[-2] -> 0
A3970: 237 | B3970: 2 | C3970: Friday | D3970: 5 | E3970: 9am-10am | F3970: 1 | G3970: 2 | H3970: 44 | I3970: 0 | J3970: =RC[-1]/RC[-2] -> 0
A3971: 237 | B3971: 2 | C3971: Friday | D3971: 5 | E3971: 10am-11am | F3971: 2 | G3971: 2 | H3971: 44 | I3971: 0 | J3971: =RC[-1]/RC[-2] -> 0
A3972: 237 | B3972: 2 | C3972: Friday | D3972: 5 | E3972: 11am-12pm | F3972: 3 | G3972: 2 | H3972: 44 | I3972: 0 | J3972: =RC[-1]/RC[-2] -> 0
A3973: 237 | B3973: 2 | C3973: Friday | D3973: 5 | E3973: 12pm-1pm | F3973: 4 | G3973: 2 | H3973: 44 | I3973: 0 | J3973: =RC[-1]/RC[-2] -> 0
A3974: 237 | B3974: 2 | C3974: Friday | D3974: 5 | E3974: 1pm-2pm | F3974: 5 | G3974: 2 | H3974: 44 | I3974: 0 | J3974: =RC[-1]/RC[-2] -> 0
A3975: 237 | B3975: 2 | C3975: Friday | D3975: 5 | E3975: 2pm-3pm | F3975: 6 | G3975: 3 | H3975: 44 | I3975: 1 | J3975: =RC[-1]/RC[-2] -> 2.2727272727272728E-2
A3976: 237 | B3976: 2 | C3976: Friday | D3976: 5 | E3976: 3pm-4pm | F3976: 7 | G3976: 2 | H3976: 44 | I3976: 0 | J3976: =RC[-1]/RC[-2] -> 0
A3977: 237 | B3977: 2 | C3977: Friday | D3977: 5 | E3977: 4pm-5pm | F3977: 8 | G3977: 2 | H3977: 44 | I3977: 0 | J3977: =RC[-1]/RC[-2] -> 0
A3978: 237 | B3978: 2 | C3978: Thursday | D3978: 4 | E3978: 4pm-5pm | F3978: 8 | G3978: 2 | H3978: 44 | I3978: 0 | J3978: =RC[-1]/RC[-2] -> 0
A3979: 237 | B3979: 2 | C3979: Friday | D3979: 5 | E3979: 9am-10am | F3979: 1 | G3979: 2 | H3979: 44 | I3979: 0 | J3979: =RC[-1]/RC[-2] -> 0
A3980: 237 | B3980: 2 | C3980: Friday | D3980: 5 | E3980: 10am-11am | F3980: 2 | G3980: 2 | H3980: 44 | I3980: 0 | J3980: =RC[-1]/RC[-2] -> 0
A3981: 237 | B3981: 2 | C3981: Friday | D3981: 5 | E3981: 11am-12pm | F3981: 3 | G3981: 2 | H3981: 44 | I3981: 0 | J3981: =RC[-1]/RC[-2] -> 0
A3982: 237 | B3982: 2 | C3982: Friday | D3982: 5 | E3982: 12pm-1pm | F3982: 4 | G3982: 2 | H3982: 44 | I3982: 0 | J3982: =RC[-1]/RC[-2] -> 0
A3983: 237 | B3983: 2 | C3983: Friday | D3983: 5 | E3983: 1pm-2pm | F3983: 5 | G3983: 2 | H3983: 44 | I3983: 0 | J3983: =RC[-1]/RC[-2] -> 0
A3984: 237 | B3984: 2 | C3984: Friday | D3984: 5 | E3984: 2pm-3pm | F3984: 6 | G3984: 3 | H3984: 44 | I3984: 1 | J3984: =RC[-1]/RC[-2] -> 2.2727272727272728E-2
A3985: 237 | B3985: 2 | C3985: Friday | D3985: 5 | E3985: 3pm-4pm | F3985: 7 | G3985: 2 | H3985: 44 | I3985: 0 | J3985: =RC[-1]/RC[-2] -> 0
A3986: 237 | B3986: 2 | C3986: Friday | D3986: 5 | E3986: 4pm-5pm | F3986: 8 | G3986: 2 | H3986: 44 | I3986: 0 | J3986: =RC[-1]/RC[-2] -> 0
A3987: 237 | B3987: 2 | C3987: Thursday | D3987: 4 | E3987: 4pm-5pm | F3987: 8 | G3987: 2 | H3987: 44 | I3987: 0 | J3987: =RC[-1]/RC[-2] -> 0
A3988: 237 | B3988: 2 | C3988: Friday | D3988: 5 | E3988: 9am-10am | F3988: 1 | G3988: 2 | H3988: 44 | I3988: 0 | J3988: =RC[-1]/RC[-2] -> 0
A3989: 237 | B3989: 2 | C3989: Friday | D3989: 5 | E3989: 10am-11am | F3989: 2 | G3989: 2 | H3989: 44 | I3989: 0 | J3989: =RC[-1]/RC[-2] -> 0
A3990: 237 | B3990: 2 | C3990: Friday | D3990: 5 | E3990: 11am-12pm | F3990: 3 | G3990: 2 | H3990: 44 | I3990: 0 | J3990: =RC[-1]/RC[-2] -> 0
A3991: 237 | B3991: 2 | C3991: Friday | D3991: 5 | E3991: 12pm-1pm | F3991: 4 | G3991: 2 | H3991: 44 | I3991: 0 | J3991: =RC[-1]/RC[-2] -> 0
A3992: 237 | B3992: 2 | C3992: Friday | D3992: 5 | E3992: 1pm-2pm | F3992: 5 | G3992: 2 | H3992: 44 | I3992: 0 | J3992: =RC[-1]/RC[-2] -> 0
A3993: 237 | B3993: 2 | C3993: Friday | D3993: 5 | E3993: 2pm-3pm | F3993: 6 | G3993: 3 | H3993: 44 | I3993: 1 | J3993: =RC[-1]/RC[-2] -> 2.2727272727272728E-2
A3994: 237 | B3994: 2 | C3994: Friday | D3994: 5 | E3994: 3pm-4pm | F3994: 7 | G3994: 2 | H3994: 44 | I3994: 0 | J3994: =RC[-1]/RC[-2] -> 0
A3995: 237 | B3995: 2 | C3995: Friday | D3995: 5 | E3995: 4pm-5pm | F3995: 8 | G3995: 2 | H3995: 44 | I3995: 0 | J3995: =RC[-1]/RC[-2] -> 0
A3996: 237 | B3996: 2 | C3996: Thursday | D3996: 4 | E3996: 4pm-5pm | F3996: 8 | G3996: 2 | H3996: 44 | I3996: 0 | J3996: =RC[-1]/RC[-2] -> 0
A3997: 237 | B3997: 2 | C3997: Friday | D3997: 5 | E3997: 9am-10am | F3997: 1 | G3997: 2 | H3997: 44 | I3997: 0 | J3997: =RC[-1]/RC[-2] -> 0
A3998: 237 | B3998: 2 | C3998: Friday | D3998: 5 | E3998: 10am-11am | F3998: 2 | G3998: 2 | H3998: 44 | I3998: 0 | J3998: =RC[-1]/RC[-2] -> 0
A3999: 237 | B3999: 2 | C3999: Friday | D3999: 5 | E3999: 11am-12pm | F3999: 3 | G3999: 2 | H3999: 44 | I3999: 0 | J3999: =RC[-1]/RC[-2] -> 0
A4000: 237 | B4000: 2 | C4000: Friday | D4000: 5 | E4000: 12pm-1pm | F4000: 4 | G4000: 2 | H4000: 44 | I4000: 0 | J4000: =RC[-1]/RC[-2] -> 0
A4001: 237 | B4001: 2 | C4001: Friday | D4001: 5 | E4001: 1pm-2pm | F4001: 5 | G4001: 2 | H4001: 44 | I4001: 0 | J4001: =RC[-1]/RC[-2] -> 0
A4002: 237 | B4002: 2 | C4002: Friday | D4002: 5 | E4002: 2pm-3pm | F4002: 6 | G4002: 3 | H4002: 44 | I4002: 1 | J4002: =RC[-1]/RC[-2] -> 2.2727272727272728E-2
A4003: 237 | B4003: 2 | C4003: Friday | D4003: 5 | E4003: 3pm-4pm | F4003: 7 | G4003: 2 | H4003: 44 | I4003: 0 | J4003: =RC[-1]/RC[-2] -> 0
A4004: 237 | B4004: 2 | C4004: Friday | D4004: 5 | E4004: 4pm-5pm | F4004: 8 | G4004: 2 | H4004: 44 | I4004: 0 | J4004: =RC[-1]/RC[-2] -> 0
A4005: 237 | B4005: 2 | C4005: Thursday | D4005: 4 | E4005: 4pm-5pm | F4005: 8 | G4005: 2 | H4005: 44 | I4005: 0 | J4005: =RC[-1]/RC[-2] -> 0
A4006: 237 | B4006: 2 | C4006: Friday | D4006: 5 | E4006: 9am-10am | F4006: 1 | G4006: 2 | H4006: 44 | I4006: 0 | J4006: =RC[-1]/RC[-2] -> 0
A4007: 237 | B4007: 2 | C4007: Friday | D4007: 5 | E4007: 10am-11am | F4007: 2 | G4007: 2 | H4007: 44 | I4007: 0 | J4007: =RC[-1]/RC[-2] -> 0
A4008: 237 | B4008: 2 | C4008: Friday | D4008: 5 | E4008: 11am-12pm | F4008: 3 | G4008: 2 | H4008: 44 | I4008: 0 | J4008: =RC[-1]/RC[-2] -> 0
A4009: 237 | B4009: 2 | C4009: Friday | D4009: 5 | E4009: 12pm-1pm | F4009: 4 | G4009: 2 | H4009: 44 | I4009: 0 | J4009: =RC[-1]/RC[-2] -> 0
A4010: 237 | B4010: 2 | C4010: Friday | D4010: 5 | E4010: 1pm-2pm | F4010: 5 | G4010: 2 | H4010: 44 | I4010: 0 | J4010: =RC[-1]/RC[-2] -> 0
A4011: 237 | B4011: 2 | C4011: Friday | D4011: 5 | E4011: 2pm-3pm | F4011: 6 | G4011: 3 | H4011: 44 | I4011: 1 | J4011: =RC[-1]/RC[-2] -> 2.2727272727272728E-2
A4012: 237 | B4012: 2 | C4012: Friday | D4012: 5 | E4012: 3pm-4pm | F4012: 7 | G4012: 2 | H4012: 44 | I4012: 0 | J4012: =RC[-1]/RC[-2] -> 0
A4013: 237 | B4013: 2 | C4013: Friday | D4013: 5 | E4013: 4pm-5pm | F4013: 8 | G4013: 2 | H4013: 44 | I4013: 0 | J4013: =RC[-1]/RC[-2] -> 0
A4014: 237 | B4014: 2 | C4014: Thursday | D4014: 4 | E4014: 4pm-5pm | F4014: 8 | G4014: 2 | H4014: 44 | I4014: 0 | J4014: =RC[-1]/RC[-2] -> 0
A4015: 237 | B4015: 2 | C4015: Friday | D4015: 5 | E4015: 9am-10am | F4015: 1 | G4015: 2 | H4015: 44 | I4015: 0 | J4015: =RC[-1]/RC[-2] -> 0
A4016: 237 | B4016: 2 | C4016: Friday | D4016: 5 | E4016: 10am-11am | F4016: 2 | G4016: 2 | H4016: 44 | I4016: 0 | J4016: =RC[-1]/RC[-2] -> 0
A4017: 237 | B4017: 2 | C4017: Friday | D4017: 5 | E4017: 11am-12pm | F4017: 3 | G4017: 2 | H4017: 44 | I4017: 0 | J4017: =RC[-1]/RC[-2] -> 0
A4018: 237 | B4018: 2 | C4018: Friday | D4018: 5 | E4018: 12pm-1pm | F4018: 4 | G4018: 2 | H4018: 44 | I4018: 0 | J4018: =RC[-1]/RC[-2] -> 0
A4019: 237 | B4019: 2 | C4019: Friday | D4019: 5 | E4019: 1pm-2pm | F4019: 5 | G4019: 2 | H4019: 44 | I4019: 0 | J4019: =RC[-1]/RC[-2] -> 0
A4020: 237 | B4020: 2 | C4020: Friday | D4020: 5 | E4020: 2pm-3pm | F4020: 6 | G4020: 3 | H4020: 44 | I4020: 1 | J4020: =RC[-1]/RC[-2] -> 2.2727272727272728E-2
A4021: 237 | B4021: 2 | C4021: Friday | D4021: 5 | E4021: 3pm-4pm | F4021: 7 | G4021: 2 | H4021: 44 | I4021: 0 | J4021: =RC[-1]/RC[-2] -> 0
A4022: 237 | B4022: 2 | C4022: Friday | D4022: 5 | E4022: 4pm-5pm | F4022: 8 | G4022: 2 | H4022: 44 | I4022: 0 | J4022: =RC[-1]/RC[-2] -> 0
A4023: 237 | B4023: 2 | C4023: Thursday | D4023: 4 | E4023: 4pm-5pm | F4023: 8 | G4023: 2 | H4023: 44 | I4023: 0 | J4023: =RC[-1]/RC[-2] -> 0
A4024: 237 | B4024: 2 | C4024: Friday | D4024: 5 | E4024: 9am-10am | F4024: 1 | G4024: 2 | H4024: 44 | I4024: 0 | J4024: =RC[-1]/RC[-2] -> 0
A4025: 237 | B4025: 2 | C4025: Friday | D4025: 5 | E4025: 10am-11am | F4025: 2 | G4025: 2 | H4025: 44 | I4025: 0 | J4025: =RC[-1]/RC[-2] -> 0
A4026: 237 | B4026: 2 | C4026: Friday | D4026: 5 | E4026: 11am-12pm | F4026: 3 | G4026: 2 | H4026: 44 | I4026: 0 | J4026: =RC[-1]/RC[-2] -> 0
A4027: 237 | B4027: 2 | C4027: Friday | D4027: 5 | E4027: 12pm-1pm | F4027: 4 | G4027: 2 | H4027: 44 | I4027: 0 | J4027: =RC[-1]/RC[-2] -> 0
A4028: 237 | B4028: 2 | C4028: Friday | D4028: 5 | E4028: 1pm-2pm | F4028: 5 | G4028: 2 | H4028: 44 | I4028: 0 | J4028: =RC[-1]/RC[-2] -> 0
A4029: 237 | B4029: 2 | C4029: Friday | D4029: 5 | E4029: 2pm-3pm | F4029: 6 | G4029: 3 | H4029: 44 | I4029: 1 | J4029: =RC[-1]/RC[-2] -> 2.2727272727272728E-2
A4030: 237 | B4030: 2 | C4030: Friday | D4030: 5 | E4030: 3pm-4pm | F4030: 7 | G4030: 2 | H4030: 44 | I4030: 0 | J4030: =RC[-1]/RC[-2] -> 0
A4031: 237 | B4031: 2 | C4031: Friday | D4031: 5 | E4031: 4pm-5pm | F4031: 8 | G4031: 2 | H4031: 44 | I4031: 0 | J4031: =RC[-1]/RC[-2] -> 0
A4032: 237 | B4032: 2 | C4032: Thursday | D4032: 4 | E4032: 4pm-5pm | F4032: 8 | G4032: 2 | H4032: 44 | I4032: 0 | J4032: =RC[-1]/RC[-2] -> 0
A4033: 237 | B4033: 2 | C4033: Friday | D4033: 5 | E4033: 9am-10am | F4033: 1 | G4033: 2 | H4033: 44 | I4033: 0 | J4033: =RC[-1]/RC[-2] -> 0
A4034: 237 | B4034: 2 | C4034: Friday | D4034: 5 | E4034: 10am-11am | F4034: 2 | G4034: 2 | H4034: 44 | I4034: 0 | J4034: =RC[-1]/RC[-2] -> 0
A4035: 237 | B4035: 2 | C4035: Friday | D4035: 5 | E4035: 11am-12pm | F4035: 3 | G4035: 2 | H4035: 44 | I4035: 0 | J4035: =RC[-1]/RC[-2] -> 0
A4036: 237 | B4036: 2 | C4036: Friday | D4036: 5 | E4036: 12pm-1pm | F4036: 4 | G4036: 2 | H4036: 44 | I4036: 0 | J4036: =RC[-1]/RC[-2] -> 0
A4037: 237 | B4037: 2 | C4037: Friday | D4037: 5 | E4037: 1pm-2pm | F4037: 5 | G4037: 2 | H4037: 44 | I4037: 0 | J4037: =RC[-1]/RC[-2] -> 0
A4038: 237 | B4038: 2 | C4038: Friday | D4038: 5 | E4038: 2pm-3pm | F4038: 6 | G4038: 3 | H4038: 44 | I4038: 1 | J4038: =RC[-1]/RC[-2] -> 2.2727272727272728E-2
A4039: 237 | B4039: 2 | C4039: Friday | D4039: 5 | E4039: 3pm-4pm | F4039: 7 | G4039: 2 | H4039: 44 | I4039: 0 | J4039: =RC[-1]/RC[-2] -> 0
A4040: 237 | B4040: 2 | C4040: Friday | D4040: 5 | E4040: 4pm-5pm | F4040: 8 | G4040: 2 | H4040: 44 | I4040: 0 | J4040: =RC[-1]/RC[-2] -> 0
A4041: 237 | B4041: 2 | C4041: Thursday | D4041: 4 | E4041: 4pm-5pm | F4041: 8 | G4041: 2 | H4041: 44 | I4041: 0 | J4041: =RC[-1]/RC[-2] -> 0
A4042: 237 | B4042: 2 | C4042: Friday | D4042: 5 | E4042: 9am-10am | F4042: 1 | G4042: 2 | H4042: 44 | I4042: 0 | J4042: =RC[-1]/RC[-2] -> 0
A4043: 237 | B4043: 2 | C4043: Friday | D4043: 5 | E4043: 10am-11am | F4043: 2 | G4043: 2 | H4043: 44 | I4043: 0 | J4043: =RC[-1]/RC[-2] -> 0
A4044: 237 | B4044: 2 | C4044: Friday | D4044: 5 | E4044: 11am-12pm | F4044: 3 | G4044: 2 | H4044: 44 | I4044: 0 | J4044: =RC[-1]/RC[-2] -> 0
A4045: 237 | B4045: 2 | C4045: Friday | D4045: 5 | E4045: 12pm-1pm | F4045: 4 | G4045: 2 | H4045: 44 | I4045: 0 | J4045: =RC[-1]/RC[-2] -> 0
A4046: 237 | B4046: 2 | C4046: Friday | D4046: 5 | E4046: 1pm-2pm | F4046: 5 | G4046: 2 | H4046: 44 | I4046: 0 | J4046: =RC[-1]/RC[-2] -> 0
A4047: 237 | B4047: 2 | C4047: Friday | D4047: 5 | E4047: 2pm-3pm | F4047: 6 | G4047: 3 | H4047: 44 | I4047: 1 | J4047: =RC[-1]/RC[-2] -> 2.2727272727272728E-2
A4048: 237 | B4048: 2 | C4048: Friday | D4048: 5 | E4048: 3pm-4pm | F4048: 7 | G4048: 2 | H4048: 44 | I4048: 0 | J4048: =RC[-1]/RC[-2] -> 0
A4049: 237 | B4049: 2 | C4049: Friday | D4049: 5 | E4049: 4pm-5pm | F4049: 8 | G4049: 2 | H4049: 44 | I4049: 0 | J4049: =RC[-1]/RC[-2] -> 0
A4050: 237 | B4050: 2 | C4050: Thursday | D4050: 4 | E4050: 4pm-5pm | F4050: 8 | G4050: 2 | H4050: 44 | I4050: 0 | J4050: =RC[-1]/RC[-2] -> 0
A4051: 237 | B4051: 2 | C4051: Friday | D4051: 5 | E4051: 9am-10am | F4051: 1 | G4051: 2 | H4051: 44 | I4051: 0 | J4051: =RC[-1]/RC[-2] -> 0
A4052: 237 | B4052: 2 | C4052: Friday | D4052: 5 | E4052: 10am-11am | F4052: 2 | G4052: 2 | H4052: 44 | I4052: 0 | J4052: =RC[-1]/RC[-2] -> 0
A4053: 237 | B4053: 2 | C4053: Friday | D4053: 5 | E4053: 11am-12pm | F4053: 3 | G4053: 2 | H4053: 44 | I4053: 0 | J4053: =RC[-1]/RC[-2] -> 0
A4054: 237 | B4054: 2 | C4054: Friday | D4054: 5 | E4054: 12pm-1pm | F4054: 4 | G4054: 2 | H4054: 44 | I4054: 0 | J4054: =RC[-1]/RC[-2] -> 0
A4055: 237 | B4055: 2 | C4055: Friday | D4055: 5 | E4055: 1pm-2pm | F4055: 5 | G4055: 2 | H4055: 44 | I4055: 0 | J4055: =RC[-1]/RC[-2] -> 0
A4056: 237 | B4056: 2 | C4056: Friday | D4056: 5 | E4056: 2pm-3pm | F4056: 6 | G4056: 3 | H4056: 44 | I4056: 1 | J4056: =RC[-1]/RC[-2] -> 2.2727272727272728E-2
A4057: 237 | B4057: 2 | C4057: Friday | D4057: 5 | E4057: 3pm-4pm | F4057: 7 | G4057: 2 | H4057: 44 | I4057: 0 | J4057: =RC[-1]/RC[-2] -> 0
A4058: 237 | B4058: 2 | C4058: Friday | D4058: 5 | E4058: 4pm-5pm | F4058: 8 | G4058: 2 | H4058: 44 | I4058: 0 | J4058: =RC[-1]/RC[-2] -> 0
A4059: 237 | B4059: 2 | C4059: Thursday | D4059: 4 | E4059: 4pm-5pm | F4059: 8 | G4059: 2 | H4059: 44 | I4059: 0 | J4059: =RC[-1]/RC[-2] -> 0
A4060: 237 | B4060: 2 | C4060: Friday | D4060: 5 | E4060: 9am-10am | F4060: 1 | G4060: 2 | H4060: 44 | I4060: 0 | J4060: =RC[-1]/RC[-2] -> 0
A4061: 237 | B4061: 2 | C4061: Friday | D4061: 5 | E4061: 10am-11am | F4061: 2 | G4061: 2 | H4061: 44 | I4061: 0 | J4061: =RC[-1]/RC[-2] -> 0
A4062: 237 | B4062: 2 | C4062: Friday | D4062: 5 | E4062: 11am-12pm | F4062: 3 | G4062: 2 | H4062: 44 | I4062: 0 | J4062: =RC[-1]/RC[-2] -> 0
A4063: 237 | B4063: 2 | C4063: Friday | D4063: 5 | E4063: 12pm-1pm | F4063: 4 | G4063: 2 | H4063: 44 | I4063: 0 | J4063: =RC[-1]/RC[-2] -> 0
A4064: 237 | B4064: 2 | C4064: Friday | D4064: 5 | E4064: 1pm-2pm | F4064: 5 | G4064: 2 | H4064: 44 | I4064: 0 | J4064: =RC[-1]/RC[-2] -> 0
A4065: 237 | B4065: 2 | C4065: Friday | D4065: 5 | E4065: 2pm-3pm | F4065: 6 | G4065: 3 | H4065: 44 | I4065: 1 | J4065: =RC[-1]/RC[-2] -> 2.2727272727272728E-2
A4066: 237 | B4066: 2 | C4066: Friday | D4066: 5 | E4066: 3pm-4pm | F4066: 7 | G4066: 2 | H4066: 44 | I4066: 0 | J4066: =RC[-1]/RC[-2] -> 0
A4067: 237 | B4067: 2 | C4067: Friday | D4067: 5 | E4067: 4pm-5pm | F4067: 8 | G4067: 2 | H4067: 44 | I4067: 0 | J4067: =RC[-1]/RC[-2] -> 0
A4068: 237 | B4068: 2 | C4068: Thursday | D4068: 4 | E4068: 4pm-5pm | F4068: 8 | G4068: 2 | H4068: 44 | I4068: 0 | J4068: =RC[-1]/RC[-2] -> 0
A4069: 237 | B4069: 2 | C4069: Friday | D4069: 5 | E4069: 9am-10am | F4069: 1 | G4069: 2 | H4069: 44 | I4069: 0 | J4069: =RC[-1]/RC[-2] -> 0
A4070: 237 | B4070: 2 | C4070: Friday | D4070: 5 | E4070: 10am-11am | F4070: 2 | G4070: 2 | H4070: 44 | I4070: 0 | J4070: =RC[-1]/RC[-2] -> 0
A4071: 237 | B4071: 2 | C4071: Friday | D4071: 5 | E4071: 11am-12pm | F4071: 3 | G4071: 2 | H4071: 44 | I4071: 0 | J4071: =RC[-1]/RC[-2] -> 0
A4072: 237 | B4072: 2 | C4072: Friday | D4072: 5 | E4072: 12pm-1pm | F4072: 4 | G4072: 2 | H4072: 44 | I4072: 0 | J4072: =RC[-1]/RC[-2] -> 0
A4073: 237 | B4073: 2 | C4073: Friday | D4073: 5 | E4073: 1pm-2pm | F4073: 5 | G4073: 2 | H4073: 44 | I4073: 0 | J4073: =RC[-1]/RC[-2] -> 0
A4074: 237 | B4074: 2 | C4074: Friday | D4074: 5 | E4074: 2pm-3pm | F4074: 6 | G4074: 3 | H4074: 44 | I4074: 1 | J4074: =RC[-1]/RC[-2] -> 2.2727272727272728E-2
A4075: 237 | B4075: 2 | C4075: Friday | D4075: 5 | E4075: 3pm-4pm | F4075: 7 | G4075: 2 | H4075: 44 | I4075: 0 | J4075: =RC[-1]/RC[-2] -> 0
A4076: 237 | B4076: 2 | C4076: Friday | D4076: 5 | E4076: 4pm-5pm | F4076: 8 | G4076: 2 | H4076: 44 | I4076: 0 | J4076: =RC[-1]/RC[-2] -> 0
A4077: 237 | B4077: 2 | C4077: Thursday | D4077: 4 | E4077: 4pm-5pm | F4077: 8 | G4077: 2 | H4077: 44 | I4077: 0 | J4077: =RC[-1]/RC[-2] -> 0
A4078: 237 | B4078: 2 | C4078: Friday | D4078: 5 | E4078: 9am-10am | F4078: 1 | G4078: 2 | H4078: 44 | I4078: 0 | J4078: =RC[-1]/RC[-2] -> 0
A4079: 237 | B4079: 2 | C4079: Friday | D4079: 5 | E4079: 10am-11am | F4079: 2 | G4079: 2 | H4079: 44 | I4079: 0 | J4079: =RC[-1]/RC[-2] -> 0
A4080: 237 | B4080: 2 | C4080: Friday | D4080: 5 | E4080: 11am-12pm | F4080: 3 | G4080: 2 | H4080: 44 | I4080: 0 | J4080: =RC[-1]/RC[-2] -> 0
A4081: 237 | B4081: 2 | C4081: Friday | D4081: 5 | E4081: 12pm-1pm | F4081: 4 | G4081: 2 | H4081: 44 | I4081: 0 | J4081: =RC[-1]/RC[-2] -> 0
A4082: 237 | B4082: 2 | C4082: Friday | D4082: 5 | E4082: 1pm-2pm | F4082: 5 | G4082: 2 | H4082: 44 | I4082: 0 | J4082: =RC[-1]/RC[-2] -> 0
A4083: 237 | B4083: 2 | C4083: Friday | D4083: 5 | E4083: 2pm-3pm | F4083: 6 | G4083: 3 | H4083: 44 | I4083: 1 | J4083: =RC[-1]/RC[-2] -> 2.2727272727272728E-2
A4084: 237 | B4084: 2 | C4084: Friday | D4084: 5 | E4084: 3pm-4pm | F4084: 7 | G4084: 2 | H4084: 44 | I4084: 0 | J4084: =RC[-1]/RC[-2] -> 0
A4085: 237 | B4085: 2 | C4085: Friday | D4085: 5 | E4085: 4pm-5pm | F4085: 8 | G4085: 2 | H4085: 44 | I4085: 0 | J4085: =RC[-1]/RC[-2] -> 0
A4086: 237 | B4086: 2 | C4086: Thursday | D4086: 4 | E4086: 4pm-5pm | F4086: 8 | G4086: 2 | H4086: 44 | I4086: 0 | J4086: =RC[-1]/RC[-2] -> 0
A4087: 237 | B4087: 2 | C4087: Friday | D4087: 5 | E4087: 9am-10am | F4087: 1 | G4087: 2 | H4087: 44 | I4087: 0 | J4087: =RC[-1]/RC[-2] -> 0
A4088: 237 | B4088: 2 | C4088: Friday | D4088: 5 | E4088: 10am-11am | F4088: 2 | G4088: 2 | H4088: 44 | I4088: 0 | J4088: =RC[-1]/RC[-2] -> 0
A4089: 237 | B4089: 2 | C4089: Friday | D4089: 5 | E4089: 11am-12pm | F4089: 3 | G4089: 2 | H4089: 44 | I4089: 0 | J4089: =RC[-1]/RC[-2] -> 0
A4090: 237 | B4090: 2 | C4090: Friday | D4090: 5 | E4090: 12pm-1pm | F4090: 4 | G4090: 2 | H4090: 44 | I4090: 0 | J4090: =RC[-1]/RC[-2] -> 0
A4091: 237 | B4091: 2 | C4091: Friday | D4091: 5 | E4091: 1pm-2pm | F4091: 5 | G4091: 2 | H4091: 44 | I4091: 0 | J4091: =RC[-1]/RC[-2] -> 0
A4092: 237 | B4092: 2 | C4092: Friday | D4092: 5 | E4092: 2pm-3pm | F4092: 6 | G4092: 3 | H4092: 44 | I4092: 1 | J4092: =RC[-1]/RC[-2] -> 2.2727272727272728E-2
A4093: 237 | B4093: 2 | C4093: Friday | D4093: 5 | E4093: 3pm-4pm | F4093: 7 | G4093: 2 | H4093: 44 | I4093: 0 | J4093: =RC[-1]/RC[-2] -> 0
A4094: 237 | B4094: 2 | C4094: Friday | D4094: 5 | E4094: 4pm-5pm | F4094: 8 | G4094: 2 | H4094: 44 | I4094: 0 | J4094: =RC[-1]/RC[-2] -> 0
A4095: 237 | B4095: 2 | C4095: Thursday | D4095: 4 | E4095: 4pm-5pm | F4095: 8 | G4095: 2 | H4095: 44 | I4095: 0 | J4095: =RC[-1]/RC[-2] -> 0
A4096: 237 | B4096: 2 | C4096: Friday | D4096: 5 | E4096: 9am-10am | F4096: 1 | G4096: 2 | H4096: 44 | I4096: 0 | J4096: =RC[-1]/RC[-2] -> 0
A4097: 237 | B4097: 2 | C4097: Friday | D4097: 5 | E4097: 10am-11am | F4097: 2 | G4097: 2 | H4097: 44 | I4097: 0 | J4097: =RC[-1]/RC[-2] -> 0
A4098: 237 | B4098: 2 | C4098: Friday | D4098: 5 | E4098: 11am-12pm | F4098: 3 | G4098: 2 | H4098: 44 | I4098: 0 | J4098: =RC[-1]/RC[-2] -> 0
A4099: 237 | B4099: 2 | C4099: Friday | D4099: 5 | E4099: 12pm-1pm | F4099: 4 | G4099: 2 | H4099: 44 | I4099: 0 | J4099: =RC[-1]/RC[-2] -> 0
A4100: 237 | B4100: 2 | C4100: Friday | D4100: 5 | E4100: 1pm-2pm | F4100: 5 | G4100: 2 | H4100: 44 | I4100: 0 | J4100: =RC[-1]/RC[-2] -> 0
A4101: 237 | B4101: 2 | C4101: Friday | D4101: 5 | E4101: 2pm-3pm | F4101: 6 | G4101: 3 | H4101: 44 | I4101: 1 | J4101: =RC[-1]/RC[-2] -> 2.2727272727272728E-2
A4102: 237 | B4102: 2 | C4102: Friday | D4102: 5 | E4102: 3pm-4pm | F4102: 7 | G4102: 2 | H4102: 44 | I4102: 0 | J4102: =RC[-1]/RC[-2] -> 0
A4103: 237 | B4103: 2 | C4103: Friday | D4103: 5 | E4103: 4pm-5pm | F4103: 8 | G4103: 2 | H4103: 44 | I4103: 0 | J4103: =RC[-1]/RC[-2] -> 0
A4104: 237 | B4104: 2 | C4104: Thursday | D4104: 4 | E4104: 4pm-5pm | F4104: 8 | G4104: 2 | H4104: 44 | I4104: 0 | J4104: =RC[-1]/RC[-2] -> 0
A4105: 237 | B4105: 2 | C4105: Friday | D4105: 5 | E4105: 9am-10am | F4105: 1 | G4105: 2 | H4105: 44 | I4105: 0 | J4105: =RC[-1]/RC[-2] -> 0
A4106: 237 | B4106: 2 | C4106: Friday | D4106: 5 | E4106: 10am-11am | F4106: 2 | G4106: 2 | H4106: 44 | I4106: 0 | J4106: =RC[-1]/RC[-2] -> 0
A4107: 237 | B4107: 2 | C4107: Friday | D4107: 5 | E4107: 11am-12pm | F4107: 3 | G4107: 2 | H4107: 44 | I4107: 0 | J4107: =RC[-1]/RC[-2] -> 0
A4108: 237 | B4108: 2 | C4108: Friday | D4108: 5 | E4108: 12pm-1pm | F4108: 4 | G4108: 2 | H4108: 44 | I4108: 0 | J4108: =RC[-1]/RC[-2] -> 0
A4109: 237 | B4109: 2 | C4109: Friday | D4109: 5 | E4109: 1pm-2pm | F4109: 5 | G4109: 2 | H4109: 44 | I4109: 0 | J4109: =RC[-1]/RC[-2] -> 0
A4110: 237 | B4110: 2 | C4110: Friday | D4110: 5 | E4110: 2pm-3pm | F4110: 6 | G4110: 3 | H4110: 44 | I4110: 1 | J4110: =RC[-1]/RC[-2] -> 2.2727272727272728E-2
A4111: 237 | B4111: 2 | C4111: Friday | D4111: 5 | E4111: 3pm-4pm | F4111: 7 | G4111: 2 | H4111: 44 | I4111: 0 | J4111: =RC[-1]/RC[-2] -> 0
A4112: 237 | B4112: 2 | C4112: Friday | D4112: 5 | E4112: 4pm-5pm | F4112: 8 | G4112: 2 | H4112: 44 | I4112: 0 | J4112: =RC[-1]/RC[-2] -> 0
A4113: 237 | B4113: 2 | C4113: Thursday | D4113: 4 | E4113: 4pm-5pm | F4113: 8 | G4113: 2 | H4113: 44 | I4113: 0 | J4113: =RC[-1]/RC[-2] -> 0
A4114: 237 | B4114: 2 | C4114: Friday | D4114: 5 | E4114: 9am-10am | F4114: 1 | G4114: 2 | H4114: 44 | I4114: 0 | J4114: =RC[-1]/RC[-2] -> 0
A4115: 237 | B4115: 2 | C4115: Friday | D4115: 5 | E4115: 10am-11am | F4115: 2 | G4115: 2 | H4115: 44 | I4115: 0 | J4115: =RC[-1]/RC[-2] -> 0
A4116: 237 | B4116: 2 | C4116: Friday | D4116: 5 | E4116: 11am-12pm | F4116: 3 | G4116: 2 | H4116: 44 | I4116: 0 | J4116: =RC[-1]/RC[-2] -> 0
A4117: 237 | B4117: 2 | C4117: Friday | D4117: 5 | E4117: 12pm-1pm | F4117: 4 | G4117: 2 | H4117: 44 | I4117: 0 | J4117: =RC[-1]/RC[-2] -> 0
A4118: 237 | B4118: 2 | C4118: Friday | D4118: 5 | E4118: 1pm-2pm | F4118: 5 | G4118: 2 | H4118: 44 | I4118: 0 | J4118: =RC[-1]/RC[-2] -> 0
A4119: 237 | B4119: 2 | C4119: Friday | D4119: 5 | E4119: 2pm-3pm | F4119: 6 | G4119: 3 | H4119: 44 | I4119: 1 | J4119: =RC[-1]/RC[-2] -> 2.2727272727272728E-2
A4120: 237 | B4120: 2 | C4120: Friday | D4120: 5 | E4120: 3pm-4pm | F4120: 7 | G4120: 2 | H4120: 44 | I4120: 0 | J4120: =RC[-1]/RC[-2] -> 0
A4121: 237 | B4121: 2 | C4121: Friday | D4121: 5 | E4121: 4pm-5pm | F4121: 8 | G4121: 2 | H4121: 44 | I4121: 0 | J4121: =RC[-1]/RC[-2] -> 0
A4122: 237 | B4122: 2 | C4122: Thursday | D4122: 4 | E4122: 4pm-5pm | F4122: 8 | G4122: 2 | H4122: 44 | I4122: 0 | J4122: =RC[-1]/RC[-2] -> 0
A4123: 237 | B4123: 2 | C4123: Friday | D4123: 5 | E4123: 9am-10am | F4123: 1 | G4123: 2 | H4123: 44 | I4123: 0 | J4123: =RC[-1]/RC[-2] -> 0
A4124: 237 | B4124: 2 | C4124: Friday | D4124: 5 | E4124: 10am-11am | F4124: 2 | G4124: 2 | H4124: 44 | I4124: 0 | J4124: =RC[-1]/RC[-2] -> 0
A4125: 237 | B4125: 2 | C4125: Friday | D4125: 5 | E4125: 11am-12pm | F4125: 3 | G4125: 2 | H4125: 44 | I4125: 0 | J4125: =RC[-1]/RC[-2] -> 0
A4126: 237 | B4126: 2 | C4126: Friday | D4126: 5 | E4126: 12pm-1pm | F4126: 4 | G4126: 2 | H4126: 44 | I4126: 0 | J4126: =RC[-1]/RC[-2] -> 0
A4127: 237 | B4127: 2 | C4127: Friday | D4127: 5 | E4127: 1pm-2pm | F4127: 5 | G4127: 2 | H4127: 44 | I4127: 0 | J4127: =RC[-1]/RC[-2] -> 0
A4128: 237 | B4128: 2 | C4128: Friday | D4128: 5 | E4128: 2pm-3pm | F4128: 6 | G4128: 3 | H4128: 44 | I4128: 1 | J4128: =RC[-1]/RC[-2] -> 2.2727272727272728E-2
A4129: 237 | B4129: 2 | C4129: Friday | D4129: 5 | E4129: 3pm-4pm | F4129: 7 | G4129: 2 | H4129: 44 | I4129: 0 | J4129: =RC[-1]/RC[-2] -> 0
A4130: 237 | B4130: 2 | C4130: Friday | D4130: 5 | E4130: 4pm-5pm | F4130: 8 | G4130: 2 | H4130: 44 | I4130: 0 | J4130: =RC[-1]/RC[-2] -> 0
A4131: 237 | B4131: 2 | C4131: Thursday | D4131: 4 | E4131: 4pm-5pm | F4131: 8 | G4131: 2 | H4131: 44 | I4131: 0 | J4131: =RC[-1]/RC[-2] -> 0
A4132: 237 | B4132: 2 | C4132: Friday | D4132: 5 | E4132: 9am-10am | F4132: 1 | G4132: 2 | H4132: 44 | I4132: 0 | J4132: =RC[-1]/RC[-2] -> 0
A4133: 237 | B4133: 2 | C4133: Friday | D4133: 5 | E4133: 10am-11am | F4133: 2 | G4133: 2 | H4133: 44 | I4133: 0 | J4133: =RC[-1]/RC[-2] -> 0
A4134: 237 | B4134: 2 | C4134: Friday | D4134: 5 | E4134: 11am-12pm | F4134: 3 | G4134: 2 | H4134: 44 | I4134: 0 | J4134: =RC[-1]/RC[-2] -> 0
A4135: 237 | B4135: 2 | C4135: Friday | D4135: 5 | E4135: 12pm-1pm | F4135: 4 | G4135: 2 | H4135: 44 | I4135: 0 | J4135: =RC[-1]/RC[-2] -> 0
A4136: 237 | B4136: 2 | C4136: Friday | D4136: 5 | E4136: 1pm-2pm | F4136: 5 | G4136: 2 | H4136: 44 | I4136: 0 | J4136: =RC[-1]/RC[-2] -> 0
A4137: 237 | B4137: 2 | C4137: Friday | D4137: 5 | E4137: 2pm-3pm | F4137: 6 | G4137: 3 | H4137: 44 | I4137: 1 | J4137: =RC[-1]/RC[-2] -> 2.2727272727272728E-2
A4138: 237 | B4138: 2 | C4138: Friday | D4138: 5 | E4138: 3pm-4pm | F4138: 7 | G4138: 2 | H4138: 44 | I4138: 0 | J4138: =RC[-1]/RC[-2] -> 0
A4139: 237 | B4139: 2 | C4139: Friday | D4139: 5 | E4139: 4pm-5pm | F4139: 8 | G4139: 2 | H4139: 44 | I4139: 0 | J4139: =RC[-1]/RC[-2] -> 0
A4140: 237 | B4140: 2 | C4140: Thursday | D4140: 4 | E4140: 4pm-5pm | F4140: 8 | G4140: 2 | H4140: 44 | I4140: 0 | J4140: =RC[-1]/RC[-2] -> 0
A4141: 237 | B4141: 2 | C4141: Friday | D4141: 5 | E4141: 9am-10am | F4141: 1 | G4141: 2 | H4141: 44 | I4141: 0 | J4141: =RC[-1]/RC[-2] -> 0
A4142: 237 | B4142: 2 | C4142: Friday | D4142: 5 | E4142: 10am-11am | F4142: 2 | G4142: 2 | H4142: 44 | I4142: 0 | J4142: =RC[-1]/RC[-2] -> 0
A4143: 237 | B4143: 2 | C4143: Friday | D4143: 5 | E4143: 11am-12pm | F4143: 3 | G4143: 2 | H4143: 44 | I4143: 0 | J4143: =RC[-1]/RC[-2] -> 0
A4144: 237 | B4144: 2 | C4144: Friday | D4144: 5 | E4144: 12pm-1pm | F4144: 4 | G4144: 2 | H4144: 44 | I4144: 0 | J4144: =RC[-1]/RC[-2] -> 0
A4145: 237 | B4145: 2 | C4145: Friday | D4145: 5 | E4145: 1pm-2pm | F4145: 5 | G4145: 2 | H4145: 44 | I4145: 0 | J4145: =RC[-1]/RC[-2] -> 0
A4146: 237 | B4146: 2 | C4146: Friday | D4146: 5 | E4146: 2pm-3pm | F4146: 6 | G4146: 3 | H4146: 44 | I4146: 1 | J4146: =RC[-1]/RC[-2] -> 2.2727272727272728E-2
A4147: 237 | B4147: 2 | C4147: Friday | D4147: 5 | E4147: 3pm-4pm | F4147: 7 | G4147: 2 | H4147: 44 | I4147: 0 | J4147: =RC[-1]/RC[-2] -> 0
A4148: 237 | B4148: 2 | C4148: Friday | D4148: 5 | E4148: 4pm-5pm | F4148: 8 | G4148: 2 | H4148: 44 | I4148: 0 | J4148: =RC[-1]/RC[-2] -> 0
A4149: 237 | B4149: 2 | C4149: Thursday | D4149: 4 | E4149: 4pm-5pm | F4149: 8 | G4149: 2 | H4149: 44 | I4149: 0 | J4149: =RC[-1]/RC[-2] -> 0
A4150: 237 | B4150: 2 | C4150: Friday | D4150: 5 | E4150: 9am-10am | F4150: 1 | G4150: 2 | H4150: 44 | I4150: 0 | J4150: =RC[-1]/RC[-2] -> 0
A4151: 237 | B4151: 2 | C4151: Friday | D4151: 5 | E4151: 10am-11am | F4151: 2 | G4151: 2 | H4151: 44 | I4151: 0 | J4151: =RC[-1]/RC[-2] -> 0
A4152: 237 | B4152: 2 | C4152: Friday | D4152: 5 | E4152: 11am-12pm | F4152: 3 | G4152: 2 | H4152: 44 | I4152: 0 | J4152: =RC[-1]/RC[-2] -> 0
A4153: 237 | B4153: 2 | C4153: Friday | D4153: 5 | E4153: 12pm-1pm | F4153: 4 | G4153: 2 | H4153: 44 | I4153: 0 | J4153: =RC[-1]/RC[-2] -> 0
A4154: 237 | B4154: 2 | C4154: Friday | D4154: 5 | E4154: 1pm-2pm | F4154: 5 | G4154: 2 | H4154: 44 | I4154: 0 | J4154: =RC[-1]/RC[-2] -> 0
A4155: 237 | B4155: 2 | C4155: Friday | D4155: 5 | E4155: 2pm-3pm | F4155: 6 | G4155: 3 | H4155: 44 | I4155: 1 | J4155: =RC[-1]/RC[-2] -> 2.2727272727272728E-2
A4156: 237 | B4156: 2 | C4156: Friday | D4156: 5 | E4156: 3pm-4pm | F4156: 7 | G4156: 2 | H4156: 44 | I4156: 0 | J4156: =RC[-1]/RC[-2] -> 0
A4157: 237 | B4157: 2 | C4157: Friday | D4157: 5 | E4157: 4pm-5pm | F4157: 8 | G4157: 2 | H4157: 44 | I4157: 0 | J4157: =RC[-1]/RC[-2] -> 0
A4158: 237 | B4158: 2 | C4158: Thursday | D4158: 4 | E4158: 4pm-5pm | F4158: 8 | G4158: 2 | H4158: 44 | I4158: 0 | J4158: =RC[-1]/RC[-2] -> 0
A4159: 237 | B4159: 2 | C4159: Friday | D4159: 5 | E4159: 9am-10am | F4159: 1 | G4159: 2 | H4159: 44 | I4159: 0 | J4159: =RC[-1]/RC[-2] -> 0
A4160: 237 | B4160: 2 | C4160: Friday | D4160: 5 | E4160: 10am-11am | F4160: 2 | G4160: 2 | H4160: 44 | I4160: 0 | J4160: =RC[-1]/RC[-2] -> 0
A4161: 237 | B4161: 2 | C4161: Friday | D4161: 5 | E4161: 11am-12pm | F4161: 3 | G4161: 2 | H4161: 44 | I4161: 0 | J4161: =RC[-1]/RC[-2] -> 0
A4162: 237 | B4162: 2 | C4162: Friday | D4162: 5 | E4162: 12pm-1pm | F4162: 4 | G4162: 2 | H4162: 44 | I4162: 0 | J4162: =RC[-1]/RC[-2] -> 0
A4163: 237 | B4163: 2 | C4163: Friday | D4163: 5 | E4163: 1pm-2pm | F4163: 5 | G4163: 2 | H4163: 44 | I4163: 0 | J4163: =RC[-1]/RC[-2] -> 0
A4164: 237 | B4164: 2 | C4164: Friday | D4164: 5 | E4164: 2pm-3pm | F4164: 6 | G4164: 3 | H4164: 44 | I4164: 1 | J4164: =RC[-1]/RC[-2] -> 2.2727272727272728E-2
A4165: 237 | B4165: 2 | C4165: Friday | D4165: 5 | E4165: 3pm-4pm | F4165: 7 | G4165: 2 | H4165: 44 | I4165: 0 | J4165: =RC[-1]/RC[-2] -> 0
A4166: 237 | B4166: 2 | C4166: Friday | D4166: 5 | E4166: 4pm-5pm | F4166: 8 | G4166: 2 | H4166: 44 | I4166: 0 | J4166: =RC[-1]/RC[-2] -> 0
A4167: 237 | B4167: 2 | C4167: Thursday | D4167: 4 | E4167: 4pm-5pm | F4167: 8 | G4167: 2 | H4167: 44 | I4167: 0 | J4167: =RC[-1]/RC[-2] -> 0
A4168: 237 | B4168: 2 | C4168: Friday | D4168: 5 | E4168: 9am-10am | F4168: 1 | G4168: 2 | H4168: 44 | I4168: 0 | J4168: =RC[-1]/RC[-2] -> 0
A4169: 237 | B4169: 2 | C4169: Friday | D4169: 5 | E4169: 10am-11am | F4169: 2 | G4169: 2 | H4169: 44 | I4169: 0 | J4169: =RC[-1]/RC[-2] -> 0
A4170: 237 | B4170: 2 | C4170: Friday | D4170: 5 | E4170: 11am-12pm | F4170: 3 | G4170: 2 | H4170: 44 | I4170: 0 | J4170: =RC[-1]/RC[-2] -> 0
A4171: 237 | B4171: 2 | C4171: Friday | D4171: 5 | E4171: 12pm-1pm | F4171: 4 | G4171: 2 | H4171: 44 | I4171: 0 | J4171: =RC[-1]/RC[-2] -> 0
A4172: 237 | B4172: 2 | C4172: Friday | D4172: 5 | E4172: 1pm-2pm | F4172: 5 | G4172: 2 | H4172: 44 | I4172: 0 | J4172: =RC[-1]/RC[-2] -> 0
A4173: 237 | B4173: 2 | C4173: Friday | D4173: 5 | E4173: 2pm-3pm | F4173: 6 | G4173: 3 | H4173: 44 | I4173: 1 | J4173: =RC[-1]/RC[-2] -> 2.2727272727272728E-2
A4174: 237 | B4174: 2 | C4174: Friday | D4174: 5 | E4174: 3pm-4pm | F4174: 7 | G4174: 2 | H4174: 44 | I4174: 0 | J4174: =RC[-1]/RC[-2] -> 0
A4175: 237 | B4175: 2 | C4175: Friday | D4175: 5 | E4175: 4pm-5pm | F4175: 8 | G4175: 2 | H4175: 44 | I4175: 0 | J4175: =RC[-1]/RC[-2] -> 0
A4176: 237 | B4176: 2 | C4176: Thursday | D4176: 4 | E4176: 4pm-5pm | F4176: 8 | G4176: 2 | H4176: 44 | I4176: 0 | J4176: =RC[-1]/RC[-2] -> 0
A4177: 237 | B4177: 2 | C4177: Friday | D4177: 5 | E4177: 9am-10am | F4177: 1 | G4177: 2 | H4177: 44 | I4177: 0 | J4177: =RC[-1]/RC[-2] -> 0
A4178: 237 | B4178: 2 | C4178: Friday | D4178: 5 | E4178: 10am-11am | F4178: 2 | G4178: 2 | H4178: 44 | I4178: 0 | J4178: =RC[-1]/RC[-2] -> 0
A4179: 237 | B4179: 2 | C4179: Friday | D4179: 5 | E4179: 11am-12pm | F4179: 3 | G4179: 2 | H4179: 44 | I4179: 0 | J4179: =RC[-1]/RC[-2] -> 0
A4180: 237 | B4180: 2 | C4180: Friday | D4180: 5 | E4180: 12pm-1pm | F4180: 4 | G4180: 2 | H4180: 44 | I4180: 0 | J4180: =RC[-1]/RC[-2] -> 0
A4181: 237 | B4181: 2 | C4181: Friday | D4181: 5 | E4181: 1pm-2pm | F4181: 5 | G4181: 2 | H4181: 44 | I4181: 0 | J4181: =RC[-1]/RC[-2] -> 0
A4182: 237 | B4182: 2 | C4182: Friday | D4182: 5 | E4182: 2pm-3pm | F4182: 6 | G4182: 3 | H4182: 44 | I4182: 1 | J4182: =RC[-1]/RC[-2] -> 2.2727272727272728E-2
A4183: 237 | B4183: 2 | C4183: Friday | D4183: 5 | E4183: 3pm-4pm | F4183: 7 | G4183: 2 | H4183: 44 | I4183: 0 | J4183: =RC[-1]/RC[-2] -> 0
A4184: 237 | B4184: 2 | C4184: Friday | D4184: 5 | E4184: 4pm-5pm | F4184: 8 | G4184: 2 | H4184: 44 | I4184: 0 | J4184: =RC[-1]/RC[-2] -> 0
A4185: 237 | B4185: 2 | C4185: Thursday | D4185: 4 | E4185: 4pm-5pm | F4185: 8 | G4185: 2 | H4185: 44 | I4185: 0 | J4185: =RC[-1]/RC[-2] -> 0
A4186: 237 | B4186: 2 | C4186: Friday | D4186: 5 | E4186: 9am-10am | F4186: 1 | G4186: 2 | H4186: 44 | I4186: 0 | J4186: =RC[-1]/RC[-2] -> 0
A4187: 237 | B4187: 2 | C4187: Friday | D4187: 5 | E4187: 10am-11am | F4187: 2 | G4187: 2 | H4187: 44 | I4187: 0 | J4187: =RC[-1]/RC[-2] -> 0
A4188: 237 | B4188: 2 | C4188: Friday | D4188: 5 | E4188: 11am-12pm | F4188: 3 | G4188: 2 | H4188: 44 | I4188: 0 | J4188: =RC[-1]/RC[-2] -> 0
A4189: 237 | B4189: 2 | C4189: Friday | D4189: 5 | E4189: 12pm-1pm | F4189: 4 | G4189: 2 | H4189: 44 | I4189: 0 | J4189: =RC[-1]/RC[-2] -> 0
A4190: 237 | B4190: 2 | C4190: Friday | D4190: 5 | E4190: 1pm-2pm | F4190: 5 | G4190: 2 | H4190: 44 | I4190: 0 | J4190: =RC[-1]/RC[-2] -> 0
A4191: 237 | B4191: 2 | C4191: Friday | D4191: 5 | E4191: 2pm-3pm | F4191: 6 | G4191: 3 | H4191: 44 | I4191: 1 | J4191: =RC[-1]/RC[-2] -> 2.2727272727272728E-2
A4192: 237 | B4192: 2 | C4192: Friday | D4192: 5 | E4192: 3pm-4pm | F4192: 7 | G4192: 2 | H4192: 44 | I4192: 0 | J4192: =RC[-1]/RC[-2] -> 0
A4193: 237 | B4193: 2 | C4193: Friday | D4193: 5 | E4193: 4pm-5pm | F4193: 8 | G4193: 2 | H4193: 44 | I4193: 0 | J4193: =RC[-1]/RC[-2] -> 0
A4194: 237 | B4194: 2 | C4194: Thursday | D4194: 4 | E4194: 4pm-5pm | F4194: 8 | G4194: 2 | H4194: 44 | I4194: 0 | J4194: =RC[-1]/RC[-2] -> 0
A4195: 237 | B4195: 2 | C4195: Friday | D4195: 5 | E4195: 9am-10am | F4195: 1 | G4195: 2 | H4195: 44 | I4195: 0 | J4195: =RC[-1]/RC[-2] -> 0
A4196: 237 | B4196: 2 | C4196: Friday | D4196: 5 | E4196: 10am-11am | F4196: 2 | G4196: 2 | H4196: 44 | I4196: 0 | J4196: =RC[-1]/RC[-2] -> 0
A4197: 237 | B4197: 2 | C4197: Friday | D4197: 5 | E4197: 11am-12pm | F4197: 3 | G4197: 2 | H4197: 44 | I4197: 0 | J4197: =RC[-1]/RC[-2] -> 0
A4198: 237 | B4198: 2 | C4198: Friday | D4198: 5 | E4198: 12pm-1pm | F4198: 4 | G4198: 2 | H4198: 44 | I4198: 0 | J4198: =RC[-1]/RC[-2] -> 0
A4199: 237 | B4199: 2 | C4199: Friday | D4199: 5 | E4199: 1pm-2pm | F4199: 5 | G4199: 2 | H4199: 44 | I4199: 0 | J4199: =RC[-1]/RC[-2] -> 0
A4200: 237 | B4200: 2 | C4200: Friday | D4200: 5 | E4200: 2pm-3pm | F4200: 6 | G4200: 3 | H4200: 44 | I4200: 1 | J4200: =RC[-1]/RC[-2] -> 2.2727272727272728E-2
A4201: 237 | B4201: 2 | C4201: Friday | D4201: 5 | E4201: 3pm-4pm | F4201: 7 | G4201: 2 | H4201: 44 | I4201: 0 | J4201: =RC[-1]/RC[-2] -> 0
A4202: 237 | B4202: 2 | C4202: Friday | D4202: 5 | E4202: 4pm-5pm | F4202: 8 | G4202: 2 | H4202: 44 | I4202: 0 | J4202: =RC[-1]/RC[-2] -> 0
A4203: 237 | B4203: 2 | C4203: Thursday | D4203: 4 | E4203: 4pm-5pm | F4203: 8 | G4203: 2 | H4203: 44 | I4203: 0 | J4203: =RC[-1]/RC[-2] -> 0
A4204: 237 | B4204: 2 | C4204: Friday | D4204: 5 | E4204: 9am-10am | F4204: 1 | G4204: 2 | H4204: 44 | I4204: 0 | J4204: =RC[-1]/RC[-2] -> 0
A4205: 237 | B4205: 2 | C4205: Friday | D4205: 5 | E4205: 10am-11am | F4205: 2 | G4205: 2 | H4205: 44 | I4205: 0 | J4205: =RC[-1]/RC[-2] -> 0
A4206: 237 | B4206: 2 | C4206: Friday | D4206: 5 | E4206: 11am-12pm | F4206: 3 | G4206: 2 | H4206: 44 | I4206: 0 | J4206: =RC[-1]/RC[-2] -> 0
A4207: 237 | B4207: 2 | C4207: Friday | D4207: 5 | E4207: 12pm-1pm | F4207: 4 | G4207: 2 | H4207: 44 | I4207: 0 | J4207: =RC[-1]/RC[-2] -> 0
A4208: 237 | B4208: 2 | C4208: Friday | D4208: 5 | E4208: 1pm-2pm | F4208: 5 | G4208: 2 | H4208: 44 | I4208: 0 | J4208: =RC[-1]/RC[-2] -> 0
A4209: 237 | B4209: 2 | C4209: Friday | D4209: 5 | E4209: 2pm-3pm | F4209: 6 | G4209: 3 | H4209: 44 | I4209: 1 | J4209: =RC[-1]/RC[-2] -> 2.2727272727272728E-2
A4210: 237 | B4210: 2 | C4210: Friday | D4210: 5 | E4210: 3pm-4pm | F4210: 7 | G4210: 2 | H4210: 44 | I4210: 0 | J4210: =RC[-1]/RC[-2] -> 0
A4211: 237 | B4211: 2 | C4211: Friday | D4211: 5 | E4211: 4pm-5pm | F4211: 8 | G4211: 2 | H4211: 44 | I4211: 0 | J4211: =RC[-1]/RC[-2] -> 0
A4212: 237 | B4212: 2 | C4212: Thursday | D4212: 4 | E4212: 4pm-5pm | F4212: 8 | G4212: 2 | H4212: 44 | I4212: 0 | J4212: =RC[-1]/RC[-2] -> 0
A4213: 237 | B4213: 2 | C4213: Friday | D4213: 5 | E4213: 9am-10am | F4213: 1 | G4213: 2 | H4213: 44 | I4213: 0 | J4213: =RC[-1]/RC[-2] -> 0
A4214: 237 | B4214: 2 | C4214: Friday | D4214: 5 | E4214: 10am-11am | F4214: 2 | G4214: 2 | H4214: 44 | I4214: 0 | J4214: =RC[-1]/RC[-2] -> 0
A4215: 237 | B4215: 2 | C4215: Friday | D4215: 5 | E4215: 11am-12pm | F4215: 3 | G4215: 2 | H4215: 44 | I4215: 0 | J4215: =RC[-1]/RC[-2] -> 0
A4216: 237 | B4216: 2 | C4216: Friday | D4216: 5 | E4216: 12pm-1pm | F4216: 4 | G4216: 2 | H4216: 44 | I4216: 0 | J4216: =RC[-1]/RC[-2] -> 0
A4217: 237 | B4217: 2 | C4217: Friday | D4217: 5 | E4217: 1pm-2pm | F4217: 5 | G4217: 2 | H4217: 44 | I4217: 0 | J4217: =RC[-1]/RC[-2] -> 0
A4218: 237 | B4218: 2 | C4218: Friday | D4218: 5 | E4218: 2pm-3pm | F4218: 6 | G4218: 3 | H4218: 44 | I4218: 1 | J4218: =RC[-1]/RC[-2] -> 2.2727272727272728E-2
A4219: 237 | B4219: 2 | C4219: Friday | D4219: 5 | E4219: 3pm-4pm | F4219: 7 | G4219: 2 | H4219: 44 | I4219: 0 | J4219: =RC[-1]/RC[-2] -> 0
A4220: 237 | B4220: 2 | C4220: Friday | D4220: 5 | E4220: 4pm-5pm | F4220: 8 | G4220: 2 | H4220: 44 | I4220: 0 | J4220: =RC[-1]/RC[-2] -> 0
A4221: 237 | B4221: 2 | C4221: Thursday | D4221: 4 | E4221: 4pm-5pm | F4221: 8 | G4221: 2 | H4221: 44 | I4221: 0 | J4221: =RC[-1]/RC[-2] -> 0
A4222: 237 | B4222: 2 | C4222: Friday | D4222: 5 | E4222: 9am-10am | F4222: 1 | G4222: 2 | H4222: 44 | I4222: 0 | J4222: =RC[-1]/RC[-2] -> 0
A4223: 237 | B4223: 2 | C4223: Friday | D4223: 5 | E4223: 10am-11am | F4223: 2 | G4223: 2 | H4223: 44 | I4223: 0 | J4223: =RC[-1]/RC[-2] -> 0
A4224: 237 | B4224: 2 | C4224: Friday | D4224: 5 | E4224: 11am-12pm | F4224: 3 | G4224: 2 | H4224: 44 | I4224: 0 | J4224: =RC[-1]/RC[-2] -> 0
A4225: 237 | B4225: 2 | C4225: Friday | D4225: 5 | E4225: 12pm-1pm | F4225: 4 | G4225: 2 | H4225: 44 | I4225: 0 | J4225: =RC[-1]/RC[-2] -> 0
A4226: 237 | B4226: 2 | C4226: Friday | D4226: 5 | E4226: 1pm-2pm | F4226: 5 | G4226: 2 | H4226: 44 | I4226: 0 | J4226: =RC[-1]/RC[-2] -> 0
A4227: 237 | B4227: 2 | C4227: Friday | D4227: 5 | E4227: 2pm-3pm | F4227: 6 | G4227: 3 | H4227: 44 | I4227: 1 | J4227: =RC[-1]/RC[-2] -> 2.2727272727272728E-2
A4228: 237 | B4228: 2 | C4228: Friday | D4228: 5 | E4228: 3pm-4pm | F4228: 7 | G4228: 2 | H4228: 44 | I4228: 0 | J4228: =RC[-1]/RC[-2] -> 0
A4229: 237 | B4229: 2 | C4229: Friday | D4229: 5 | E4229: 4pm-5pm | F4229: 8 | G4229: 2 | H4229: 44 | I4229: 0 | J4229: =RC[-1]/RC[-2] -> 0
A4230: 237 | B4230: 2 | C4230: Thursday | D4230: 4 | E4230: 4pm-5pm | F4230: 8 | G4230: 2 | H4230: 44 | I4230: 0 | J4230: =RC[-1]/RC[-2] -> 0
A4231: 237 | B4231: 2 | C4231: Friday | D4231: 5 | E4231: 9am-10am | F4231: 1 | G4231: 2 | H4231: 44 | I4231: 0 | J4231: =RC[-1]/RC[-2] -> 0
A4232: 237 | B4232: 2 | C4232: Friday | D4232: 5 | E4232: 10am-11am | F4232: 2 | G4232: 2 | H4232: 44 | I4232: 0 | J4232: =RC[-1]/RC[-2] -> 0
A4233: 237 | B4233: 2 | C4233: Friday | D4233: 5 | E4233: 11am-12pm | F4233: 3 | G4233: 2 | H4233: 44 | I4233: 0 | J4233: =RC[-1]/RC[-2] -> 0
A4234: 237 | B4234: 2 | C4234: Friday | D4234: 5 | E4234: 12pm-1pm | F4234: 4 | G4234: 2 | H4234: 44 | I4234: 0 | J4234: =RC[-1]/RC[-2] -> 0
A4235: 237 | B4235: 2 | C4235: Friday | D4235: 5 | E4235: 1pm-2pm | F4235: 5 | G4235: 2 | H4235: 44 | I4235: 0 | J4235: =RC[-1]/RC[-2] -> 0
A4236: 237 | B4236: 2 | C4236: Friday | D4236: 5 | E4236: 2pm-3pm | F4236: 6 | G4236: 3 | H4236: 44 | I4236: 1 | J4236: =RC[-1]/RC[-2] -> 2.2727272727272728E-2
A4237: 237 | B4237: 2 | C4237: Friday | D4237: 5 | E4237: 3pm-4pm | F4237: 7 | G4237: 2 | H4237: 44 | I4237: 0 | J4237: =RC[-1]/RC[-2] -> 0
A4238: 237 | B4238: 2 | C4238: Friday | D4238: 5 | E4238: 4pm-5pm | F4238: 8 | G4238: 2 | H4238: 44 | I4238: 0 | J4238: =RC[-1]/RC[-2] -> 0
A4239: 237 | B4239: 2 | C4239: Thursday | D4239: 4 | E4239: 4pm-5pm | F4239: 8 | G4239: 2 | H4239: 44 | I4239: 0 | J4239: =RC[-1]/RC[-2] -> 0
A4240: 237 | B4240: 2 | C4240: Friday | D4240: 5 | E4240: 9am-10am | F4240: 1 | G4240: 2 | H4240: 44 | I4240: 0 | J4240: =RC[-1]/RC[-2] -> 0
A4241: 237 | B4241: 2 | C4241: Friday | D4241: 5 | E4241: 10am-11am | F4241: 2 | G4241: 2 | H4241: 44 | I4241: 0 | J4241: =RC[-1]/RC[-2] -> 0
A4242: 237 | B4242: 2 | C4242: Friday | D4242: 5 | E4242: 11am-12pm | F4242: 3 | G4242: 2 | H4242: 44 | I4242: 0 | J4242: =RC[-1]/RC[-2] -> 0
A4243: 237 | B4243: 2 | C4243: Friday | D4243: 5 | E4243: 12pm-1pm | F4243: 4 | G4243: 2 | H4243: 44 | I4243: 0 | J4243: =RC[-1]/RC[-2] -> 0
A4244: 237 | B4244: 2 | C4244: Friday | D4244: 5 | E4244: 1pm-2pm | F4244: 5 | G4244: 2 | H4244: 44 | I4244: 0 | J4244: =RC[-1]/RC[-2] -> 0
A4245: 237 | B4245: 2 | C4245: Friday | D4245: 5 | E4245: 2pm-3pm | F4245: 6 | G4245: 3 | H4245: 44 | I4245: 1 | J4245: =RC[-1]/RC[-2] -> 2.2727272727272728E-2
A4246: 237 | B4246: 2 | C4246: Friday | D4246: 5 | E4246: 3pm-4pm | F4246: 7 | G4246: 2 | H4246: 44 | I4246: 0 | J4246: =RC[-1]/RC[-2] -> 0
A4247: 237 | B4247: 2 | C4247: Friday | D4247: 5 | E4247: 4pm-5pm | F4247: 8 | G4247: 2 | H4247: 44 | I4247: 0 | J4247: =RC[-1]/RC[-2] -> 0
A4248: 237 | B4248: 2 | C4248: Thursday | D4248: 4 | E4248: 4pm-5pm | F4248: 8 | G4248: 2 | H4248: 44 | I4248: 0 | J4248: =RC[-1]/RC[-2] -> 0
A4249: 237 | B4249: 2 | C4249: Friday | D4249: 5 | E4249: 9am-10am | F4249: 1 | G4249: 2 | H4249: 44 | I4249: 0 | J4249: =RC[-1]/RC[-2] -> 0
A4250: 237 | B4250: 2 | C4250: Friday | D4250: 5 | E4250: 10am-11am | F4250: 2 | G4250: 2 | H4250: 44 | I4250: 0 | J4250: =RC[-1]/RC[-2] -> 0
A4251: 237 | B4251: 2 | C4251: Friday | D4251: 5 | E4251: 11am-12pm | F4251: 3 | G4251: 2 | H4251: 44 | I4251: 0 | J4251: =RC[-1]/RC[-2] -> 0
A4252: 237 | B4252: 2 | C4252: Friday | D4252: 5 | E4252: 12pm-1pm | F4252: 4 | G4252: 2 | H4252: 44 | I4252: 0 | J4252: =RC[-1]/RC[-2] -> 0
A4253: 237 | B4253: 2 | C4253: Friday | D4253: 5 | E4253: 1pm-2pm | F4253: 5 | G4253: 2 | H4253: 44 | I4253: 0 | J4253: =RC[-1]/RC[-2] -> 0
A4254: 237 | B4254: 2 | C4254: Friday | D4254: 5 | E4254: 2pm-3pm | F4254: 6 | G4254: 3 | H4254: 44 | I4254: 1 | J4254: =RC[-1]/RC[-2] -> 2.2727272727272728E-2
A4255: 237 | B4255: 2 | C4255: Friday | D4255: 5 | E4255: 3pm-4pm | F4255: 7 | G4255: 2 | H4255: 44 | I4255: 0 | J4255: =RC[-1]/RC[-2] -> 0
A4256: 237 | B4256: 2 | C4256: Friday | D4256: 5 | E4256: 4pm-5pm | F4256: 8 | G4256: 2 | H4256: 44 | I4256: 0 | J4256: =RC[-1]/RC[-2] -> 0
A4257: 237 | B4257: 2 | C4257: Thursday | D4257: 4 | E4257: 4pm-5pm | F4257: 8 | G4257: 2 | H4257: 44 | I4257: 0 | J4257: =RC[-1]/RC[-2] -> 0
A4258: 237 | B4258: 2 | C4258: Friday | D4258: 5 | E4258: 9am-10am | F4258: 1 | G4258: 2 | H4258: 44 | I4258: 0 | J4258: =RC[-1]/RC[-2] -> 0
A4259: 237 | B4259: 2 | C4259: Friday | D4259: 5 | E4259: 10am-11am | F4259: 2 | G4259: 2 | H4259: 44 | I4259: 0 | J4259: =RC[-1]/RC[-2] -> 0
A4260: 237 | B4260: 2 | C4260: Friday | D4260: 5 | E4260: 11am-12pm | F4260: 3 | G4260: 2 | H4260: 44 | I4260: 0 | J4260: =RC[-1]/RC[-2] -> 0
A4261: 237 | B4261: 2 | C4261: Friday | D4261: 5 | E4261: 12pm-1pm | F4261: 4 | G4261: 2 | H4261: 44 | I4261: 0 | J4261: =RC[-1]/RC[-2] -> 0
A4262: 237 | B4262: 2 | C4262: Friday | D4262: 5 | E4262: 1pm-2pm | F4262: 5 | G4262: 2 | H4262: 44 | I4262: 0 | J4262: =RC[-1]/RC[-2] -> 0
A4263: 237 | B4263: 2 | C4263: Friday | D4263: 5 | E4263: 2pm-3pm | F4263: 6 | G4263: 3 | H4263: 44 | I4263: 1 | J4263: =RC[-1]/RC[-2] -> 2.2727272727272728E-2
A4264: 237 | B4264: 2 | C4264: Friday | D4264: 5 | E4264: 3pm-4pm | F4264: 7 | G4264: 2 | H4264: 44 | I4264: 0 | J4264: =RC[-1]/RC[-2] -> 0
A4265: 237 | B4265: 2 | C4265: Friday | D4265: 5 | E4265: 4pm-5pm | F4265: 8 | G4265: 2 | H4265: 44 | I4265: 0 | J4265: =RC[-1]/RC[-2] -> 0
A4266: 237 | B4266: 2 | C4266: Thursday | D4266: 4 | E4266: 4pm-5pm | F4266: 8 | G4266: 2 | H4266: 44 | I4266: 0 | J4266: =RC[-1]/RC[-2] -> 0
A4267: 237 | B4267: 2 | C4267: Friday | D4267: 5 | E4267: 9am-10am | F4267: 1 | G4267: 2 | H4267: 44 | I4267: 0 | J4267: =RC[-1]/RC[-2] -> 0
A4268: 237 | B4268: 2 | C4268: Friday | D4268: 5 | E4268: 10am-11am | F4268: 2 | G4268: 2 | H4268: 44 | I4268: 0 | J4268: =RC[-1]/RC[-2] -> 0
A4269: 237 | B4269: 2 | C4269: Friday | D4269: 5 | E4269: 11am-12pm | F4269: 3 | G4269: 2 | H4269: 44 | I4269: 0 | J4269: =RC[-1]/RC[-2] -> 0
A4270: 237 | B4270: 2 | C4270: Friday | D4270: 5 | E4270: 12pm-1pm | F4270: 4 | G4270: 2 | H4270: 44 | I4270: 0 | J4270: =RC[-1]/RC[-2] -> 0
A4271: 237 | B4271: 2 | C4271: Friday | D4271: 5 | E4271: 1pm-2pm | F4271: 5 | G4271: 2 | H4271: 44 | I4271: 0 | J4271: =RC[-1]/RC[-2] -> 0
A4272: 237 | B4272: 2 | C4272: Friday | D4272: 5 | E4272: 2pm-3pm | F4272: 6 | G4272: 3 | H4272: 44 | I4272: 1 | J4272: =RC[-1]/RC[-2] -> 2.2727272727272728E-2
A4273: 237 | B4273: 2 | C4273: Friday | D4273: 5 | E4273: 3pm-4pm | F4273: 7 | G4273: 2 | H4273: 44 | I4273: 0 | J4273: =RC[-1]/RC[-2] -> 0
A4274: 237 | B4274: 2 | C4274: Friday | D4274: 5 | E4274: 4pm-5pm | F4274: 8 | G4274: 2 | H4274: 44 | I4274: 0 | J4274: =RC[-1]/RC[-2] -> 0
A4275: 237 | B4275: 2 | C4275: Thursday | D4275: 4 | E4275: 4pm-5pm | F4275: 8 | G4275: 2 | H4275: 44 | I4275: 0 | J4275: =RC[-1]/RC[-2] -> 0
A4276: 237 | B4276: 2 | C4276: Friday | D4276: 5 | E4276: 9am-10am | F4276: 1 | G4276: 2 | H4276: 44 | I4276: 0 | J4276: =RC[-1]/RC[-2] -> 0
A4277: 237 | B4277: 2 | C4277: Friday | D4277: 5 | E4277: 10am-11am | F4277: 2 | G4277: 2 | H4277: 44 | I4277: 0 | J4277: =RC[-1]/RC[-2] -> 0
A4278: 237 | B4278: 2 | C4278: Friday | D4278: 5 | E4278: 11am-12pm | F4278: 3 | G4278: 2 | H4278: 44 | I4278: 0 | J4278: =RC[-1]/RC[-2] -> 0
A4279: 237 | B4279: 2 | C4279: Friday | D4279: 5 | E4279: 12pm-1pm | F4279: 4 | G4279: 2 | H4279: 44 | I4279: 0 | J4279: =RC[-1]/RC[-2] -> 0
A4280: 237 | B4280: 2 | C4280: Friday | D4280: 5 | E4280: 1pm-2pm | F4280: 5 | G4280: 2 | H4280: 44 | I4280: 0 | J4280: =RC[-1]/RC[-2] -> 0
A4281: 237 | B4281: 2 | C4281: Friday | D4281: 5 | E4281: 2pm-3pm | F4281: 6 | G4281: 3 | H4281: 44 | I4281: 1 | J4281: =RC[-1]/RC[-2] -> 2.2727272727272728E-2
A4282: 237 | B4282: 2 | C4282: Friday | D4282: 5 | E4282: 3pm-4pm | F4282: 7 | G4282: 2 | H4282: 44 | I4282: 0 | J4282: =RC[-1]/RC[-2] -> 0
A4283: 237 | B4283: 2 | C4283: Friday | D4283: 5 | E4283: 4pm-5pm | F4283: 8 | G4283: 2 | H4283: 44 | I4283: 0 | J4283: =RC[-1]/RC[-2] -> 0